Agency,10-Competitive Service - Career,15-Competitive Service - Career-Conditional,30-Excepted Service - Schedule A,32-Excepted Service - Schedule B,35-Excepted Service - Schedule D,36-Excepted Service - Executive,38-Excepted Service - Other,50-Senior Executive Service - Career,55-Senior Executive Service - Non-Career,**-Unspecified,Permanent,20-Competitive Service,40-Excepted Service - Schedule A,42-Excepted Service - Schedule B,44-Excepted Service - Schedule C,45-Excepted Service - Schedule D,46-Excepted Service - Executive,48-Excepted Service - Other,60-Senior Executive Service - Limited Term,65-Senior Executive Service - Limited Emergency,Non-permanent,Unspecified,Type of Appointment - All,10-Competitive Service - Career,15-Competitive Service - Career-Conditional,30-Excepted Service - Schedule A,32-Excepted Service - Schedule B,35-Excepted Service - Schedule D,36-Excepted Service - Executive,38-Excepted Service - Other,50-Senior Executive Service - Career,55-Senior Executive Service - Non-Career,**-Unspecified,Permanent,20-Competitive Service,40-Excepted Service - Schedule A,42-Excepted Service - Schedule B,44-Excepted Service - Schedule C,45-Excepted Service - Schedule D,46-Excepted Service - Executive,48-Excepted Service - Other,60-Senior Executive Service - Limited Term,65-Senior Executive Service - Limited Emergency,Non-permanent,Unspecified,Type of Appointment - All,Type of Appointment - All
AA00-ADMINISTRATIVE CONFERENCE OF THE UNITED STATES,0,0,0,0,0,0,0,0,0,0,0,0,0,0,0,0,0,0,0,0,0,0,0,0,0,0,0,0,0,0,0,0,0,0,0,0,0,0,0,0,0,0,0,0,0,0,0
AB**-UNSPECIFIED,0,0,0,0,0,0,0,0,0,0,0,0,0,0,0,0,0,0,0,0,0,0,0,0,0,0,0,0,0,0,0,0,0,0,0,0,0,0,0,0,0,0,0,0,0,0,0
AB00-AMERICAN BATTLE MONUMENTS COMMISSION,0,0,0,0,0,0,0,0,0,0,0,0,0,0,0,0,0,0,0,0,0,0,0,0,0,0,0,0,0,0,0,0,0,0,0,0,0,0,0,0,0,0,0,0,0,0,0
AF**-UNSPECIFIED,0,0,0,0,0,0,0,0,0,0,0,0,0,0,0,0,0,0,0,0,0,0,0,0,0,0,0,0,0,0,0,0,0,0,0,0,0,0,0,0,0,0,0,0,0,0,0
AF02-AIR FORCE INSPECTION AGENCY (FO),0,0,0,0,0,0,0,0,0,0,0,0,0,0,0,0,0,0,0,0,0,0,0,0,0,0,0,0,0,0,0,0,0,0,0,0,0,0,0,0,0,0,0,0,0,0,0
AF03-AIR FORCE OPERATIONAL TEST AND EVALUATION CENTER,0,0,0,0,0,0,0,0,0,0,0,0,0,0,0,0,0,0,0,0,0,0,0,0,2,0,0,0,0,0,0,0,0,2,0,0,0,0,0,0,0,0,0,0,0,2,2
AF04-AIR FORCE COMMUNICATIONS AGENCY,0,0,0,0,0,0,0,0,0,0,0,0,0,0,0,0,0,0,0,0,0,0,0,0,0,0,0,0,0,0,0,0,0,0,0,0,0,0,0,0,0,0,0,0,0,0,0
AF05-AIR FORCE INTELLIGENCE ANALYSIS AGENCY,0,0,0,0,0,0,0,0,0,0,0,0,0,0,0,0,0,0,0,0,0,0,0,0,0,0,0,0,0,0,0,0,0,0,0,0,0,0,0,0,0,0,0,0,0,0,0
AF06-AIR FORCE AUDIT AGENCY,0,0,0,0,0,0,0,0,0,0,0,0,0,0,0,0,0,0,0,0,0,0,0,1,0,0,0,0,0,0,0,0,0,1,0,0,0,0,0,0,0,0,0,0,0,1,1
AF07-AIR FORCE OFFICE OF SPECIAL INVESTIGATIONS,0,0,0,0,0,0,0,0,0,0,0,0,0,0,0,0,0,0,0,0,0,0,0,0,0,0,0,0,0,1,0,0,0,1,0,0,0,0,0,0,0,0,0,0,0,1,1
AF08-AIR FORCE OFFICE OF SECURITY POLICE,0,0,0,0,0,0,0,0,0,0,0,0,0,0,0,0,0,0,0,0,0,0,0,0,0,0,0,0,0,0,0,0,0,0,0,0,0,0,0,0,0,0,0,0,0,0,0
AF09-AIR FORCE PERSONNEL CENTER,0,0,0,0,0,0,0,0,0,0,0,0,0,0,0,0,0,0,0,0,0,0,0,1,0,0,0,0,0,0,0,0,0,1,0,0,0,0,0,0,0,0,0,0,0,1,1
AF0B-U.S. AIR FORCE ACADEMY,1,0,0,0,0,0,0,0,0,0,1,0,0,0,0,0,0,0,0,0,0,0,1,1,2,0,0,0,0,0,0,0,0,3,0,0,0,0,0,0,0,0,0,0,0,3,4
"AF0D-U.S. AIR FORCES, EUROPE",1,1,0,0,0,0,0,0,0,0,2,0,0,0,0,0,0,0,0,0,0,0,2,2,7,0,0,0,0,0,0,0,0,9,0,20,0,0,0,0,0,0,0,20,0,29,31
AF0J-AIR EDUCATION AND TRAINING COMMAND,1,1,0,0,0,0,0,0,0,0,2,0,0,0,0,0,0,0,0,0,0,0,2,2,47,1,0,0,0,1,0,0,0,51,14,0,0,0,1,0,0,0,0,15,0,66,68
"AF0M-HEADQUARTERS, AIR FORCE RESERVE",4,1,0,0,0,0,0,0,0,0,5,0,0,0,0,0,0,0,0,0,0,0,5,7,51,1,0,0,0,3,0,0,0,62,6,0,0,0,0,0,0,0,0,6,0,68,73
"AF0N-HEADQUARTERS, U.S. AIR FORCE",0,0,0,0,0,0,0,0,0,0,0,0,0,0,0,0,0,0,0,0,0,0,0,0,0,0,0,0,0,0,0,0,0,0,0,0,0,0,0,0,0,0,0,0,0,0,0
AF0R-PACIFIC AIR FORCES,2,0,0,0,0,0,0,0,0,0,2,0,0,0,0,0,0,0,0,0,0,0,2,0,13,5,0,0,0,0,0,0,0,18,1,4,0,0,0,0,0,0,0,5,0,23,25
"AF0U-AIR FORCE INTELLIGENCE, SURVEILLANCE, & RECONNAISSANCE AGENCY",0,0,0,0,0,0,0,0,0,0,0,0,0,0,0,0,0,0,0,0,0,0,0,0,0,0,0,0,0,11,0,0,0,11,0,0,0,0,0,0,0,0,0,0,0,11,11
AF0V-AIR FORCE SPECIAL OPERATIONS COMMAND,2,0,0,0,0,0,0,0,0,0,2,0,0,0,0,0,0,0,0,0,0,0,2,3,9,0,0,0,0,1,0,0,0,13,0,1,0,0,0,0,0,0,0,1,0,14,16
AF11-AIR FORCE MANPOWER AGENCY,0,0,0,0,0,0,0,0,0,0,0,0,0,0,0,0,0,0,0,0,0,0,0,0,0,0,0,0,0,0,0,0,0,0,0,0,0,0,0,0,0,0,0,0,0,0,0
AF12-AIR FORCE PUBLIC AFFAIRS AGENCY,0,0,0,0,0,0,0,0,0,0,0,0,0,0,0,0,0,0,0,0,0,0,0,0,0,0,0,0,0,0,0,0,0,0,0,0,0,0,0,0,0,0,0,0,0,0,0
AF13-HQ USAF AND SUPPORT ELEMENTS,0,0,0,0,0,0,0,0,0,0,0,0,0,0,0,0,0,0,0,0,0,0,0,1,0,2,0,0,0,0,0,0,0,3,0,0,0,0,0,0,1,0,0,1,0,4,4
AF14-AIR FORCE INSTALLATION CONTRACTING AGENCY,0,0,0,0,0,0,0,0,0,0,0,0,0,0,0,0,0,0,0,0,0,0,0,0,1,0,0,0,0,0,0,0,0,1,0,0,0,0,0,0,0,0,0,0,0,1,1
AF15-AIR FORCE CIVIL ENGINEER CENTER,0,0,0,0,0,0,0,0,0,0,0,0,0,0,0,0,0,0,0,0,0,0,0,2,4,1,0,0,0,0,0,0,0,7,0,0,0,0,0,0,0,0,0,0,0,7,7
"AF1A-AIR FORCE C2 & INTELLIGENCE, SURVEILLANCE & RECONNAISSANCE",0,0,0,0,0,0,0,0,0,0,0,0,0,0,0,0,0,0,0,0,0,0,0,0,0,0,0,0,0,0,0,0,0,0,0,0,0,0,0,0,0,0,0,0,0,0,0
AF1C-AIR COMBAT COMMAND,0,0,0,0,0,0,0,0,0,0,0,0,0,0,0,0,0,0,0,0,0,0,0,5,19,0,0,0,0,0,0,0,0,24,3,0,0,0,0,0,0,0,0,3,0,27,27
AF1G-AIR FORCE LOGISTICS MANAGEMENT AGENCY,0,0,0,0,0,0,0,0,0,0,0,0,0,0,0,0,0,0,0,0,0,0,0,0,0,0,0,0,0,0,0,0,0,0,0,0,0,0,0,0,0,0,0,0,0,0,0
AF1L-AIR MOBILITY COMMAND,1,1,0,0,0,0,0,0,0,0,2,0,0,0,0,0,0,0,0,0,0,0,2,3,24,0,0,0,0,2,0,0,0,29,3,1,0,0,0,0,0,0,0,4,0,33,35
AF1M-AIR FORCE MATERIEL COMMAND,5,2,0,0,0,0,0,1,0,0,8,0,0,0,0,0,0,0,0,0,0,0,8,8,100,0,0,10,0,5,0,0,0,123,31,0,0,0,0,0,0,0,0,31,0,154,162
AF1P-AIR FORCE REAL PROPERTY AGENCY,0,0,0,0,0,0,0,0,0,0,0,0,0,0,0,0,0,0,0,0,0,0,0,0,0,0,0,0,0,0,0,0,0,0,0,0,0,0,0,0,0,0,0,0,0,0,0
AF1Q-HQ AF FLIGHT STANDARDS AGENCY,0,0,0,0,0,0,0,0,0,0,0,0,0,0,0,0,0,0,0,0,0,0,0,0,0,0,0,0,0,0,0,0,0,0,0,0,0,0,0,0,0,0,0,0,0,0,0
"AF1S-HEADQUARTERS, AIR FORCE SPACE COMMAND",1,0,0,0,0,0,0,0,0,0,1,0,0,0,0,0,0,0,0,0,0,0,1,0,9,1,0,0,0,15,0,0,0,25,4,0,0,0,0,0,0,0,0,4,0,29,30
AF1W-AIR FORCE ENGINEERING AND SERVICES CENTER,0,0,0,0,0,0,0,0,0,0,0,0,0,0,0,0,0,0,0,0,0,0,0,0,0,0,0,0,0,0,0,0,0,0,0,0,0,0,0,0,0,0,0,0,0,0,0
AF1Y-AIR FORCE CIVILIAN CAREER TRAINING,0,0,0,0,0,0,0,0,0,0,0,0,0,0,0,0,0,0,0,0,0,0,0,0,6,3,0,15,0,0,0,0,0,24,0,0,0,0,0,0,0,0,0,0,0,24,24
AF20-AIR FORCE AGENCY FOR MODELING/SIMULATION,0,0,0,0,0,0,0,0,0,0,0,0,0,0,0,0,0,0,0,0,0,0,0,0,0,0,0,0,0,0,0,0,0,0,0,0,0,0,0,0,0,0,0,0,0,0,0
AF21-AIR FORCE NUCLEAR WEAPONS AGENCY,0,0,0,0,0,0,0,0,0,0,0,0,0,0,0,0,0,0,0,0,0,0,0,0,0,0,0,0,0,0,0,0,0,0,0,0,0,0,0,0,0,0,0,0,0,0,0
AF24-HQ USAF DIRECT SUPPORT ELEMENT,0,0,0,0,0,0,0,0,0,0,0,0,0,0,0,0,0,0,0,0,0,0,0,0,0,0,0,0,0,0,0,0,0,0,0,0,0,0,0,0,0,0,0,0,0,0,0
AF25-AF-WIDE SUPPORT ELEMENT,0,0,0,0,0,0,0,0,0,0,0,0,0,0,0,0,0,0,0,0,0,0,0,0,0,0,0,0,0,0,0,0,0,0,0,0,0,0,0,0,0,0,0,0,0,0,0
AF27-AIR FORCE AGENCY FOR MODELING AND SIMULATION,0,0,0,0,0,0,0,0,0,0,0,0,0,0,0,0,0,0,0,0,0,0,0,0,0,0,0,0,0,0,0,0,0,0,0,0,0,0,0,0,0,0,0,0,0,0,0
AF2A-AIR FORCE COST ANALYSIS AGENCY,0,0,0,0,0,0,0,0,0,0,0,0,0,0,0,0,0,0,0,0,0,0,0,0,0,0,0,0,0,0,0,0,0,0,0,0,0,0,0,0,0,0,0,0,0,0,0
AF2D-AIR FORCE PERSONNEL OPERATIONS AGENCY,0,0,0,0,0,0,0,0,0,0,0,0,0,0,0,0,0,0,0,0,0,0,0,0,0,0,0,0,0,0,0,0,0,0,0,0,0,0,0,0,0,0,0,0,0,0,0
AF2E-AIR FORCE LEGAL OPERATIONS AGENCY,0,0,0,0,0,0,0,0,0,0,0,0,0,0,0,0,0,0,0,0,0,0,0,0,0,1,0,0,0,0,0,0,0,1,0,0,0,0,0,0,0,0,0,0,0,1,1
AF2F-AIR FORCE MEDICAL SERVICES CENTER,0,0,0,0,0,0,0,0,0,0,0,0,0,0,0,0,0,0,0,0,0,0,0,0,0,0,0,0,0,0,0,0,0,0,0,0,0,0,0,0,0,0,0,0,0,0,0
AF2G-AIR FORCE SERVICE INFORMATION AND NEWS CENTER,0,0,0,0,0,0,0,0,0,0,0,0,0,0,0,0,0,0,0,0,0,0,0,0,0,0,0,0,0,0,0,0,0,0,0,0,0,0,0,0,0,0,0,0,0,0,0
AF2H-AIR FORCE COMBAT OPERATIONS STAFF,0,0,0,0,0,0,0,0,0,0,0,0,0,0,0,0,0,0,0,0,0,0,0,0,0,0,0,0,0,0,0,0,0,0,0,0,0,0,0,0,0,0,0,0,0,0,0
AF2I-AIR NATIONAL GUARD SUPPORT CENTER,0,0,0,0,0,0,0,0,0,0,0,0,0,0,0,0,0,0,0,0,0,0,0,0,1,0,0,0,0,0,0,0,0,1,0,1,0,0,0,0,0,0,0,1,0,2,2
AF2K-AIR FORCE HISTORICAL RESEARCH AGENCY,0,0,0,0,0,0,0,0,0,0,0,0,0,0,0,0,0,0,0,0,0,0,0,0,0,0,0,0,0,0,0,0,0,0,0,0,0,0,0,0,0,0,0,0,0,0,0
AF2L-AIR FORCE TECHNICAL APPLICATIONS CENTER,0,0,0,0,0,0,0,0,0,0,0,0,0,0,0,0,0,0,0,0,0,0,0,0,0,0,0,0,0,0,0,0,0,0,0,0,0,0,0,0,0,0,0,0,0,0,0
AF2M-AIR FORCE REVIEW BOARDS AGENCY,0,0,0,0,0,0,0,0,0,0,0,0,0,0,0,0,0,0,0,0,0,0,0,0,0,0,0,0,0,0,0,0,0,0,2,0,0,0,0,0,0,0,0,2,0,2,2
AF2N-AIR FORCE CENTER FOR STUDIES AND ANALYSES,0,0,0,0,0,0,0,0,0,0,0,0,0,0,0,0,0,0,0,0,0,0,0,0,0,0,0,0,0,0,0,0,0,0,0,0,0,0,0,0,0,0,0,0,0,0,0
AF2Q-AIR WEATHER SERVICE,0,0,0,0,0,0,0,0,0,0,0,0,0,0,0,0,0,0,0,0,0,0,0,0,0,0,0,0,0,0,0,0,0,0,0,0,0,0,0,0,0,0,0,0,0,0,0
AF2R-AIR FORCE PROGRAM EXECUTIVE OFFICE,0,0,0,0,0,0,0,0,0,0,0,0,0,0,0,0,0,0,0,0,0,0,0,0,0,0,0,0,0,0,0,0,0,0,0,0,0,0,0,0,0,0,0,0,0,0,0
AF2S-AIR FORCE ELEMENTS NORAD,0,0,0,0,0,0,0,0,0,0,0,0,0,0,0,0,0,0,0,0,0,0,0,0,1,0,0,0,0,0,0,0,0,1,0,0,0,0,0,0,0,0,0,0,0,1,1
AF2T-AIR FORCE SAFETY CENTER,0,0,0,0,0,0,0,0,0,0,0,0,0,0,0,0,0,0,0,0,0,0,0,0,1,1,0,0,0,0,0,0,0,2,0,0,0,0,0,0,0,0,0,0,0,2,2
"AF2U-AIR FORCE MORALE, WELFARE AND RECREATION CENTER",0,0,0,0,0,0,0,0,0,0,0,0,0,0,0,0,0,0,0,0,0,0,0,0,0,0,0,0,0,0,0,0,0,0,0,0,0,0,0,0,0,0,0,0,0,0,0
AF2Z-AIR FORCE MEDICAL OPERATIONS AGENCY,0,0,0,0,0,0,0,0,0,0,0,0,0,0,0,0,0,0,0,0,0,0,0,0,0,0,0,0,0,0,0,0,0,0,0,0,0,0,0,0,0,0,0,0,0,0,0
AF34-AIR NATIONAL GUARD,0,0,0,0,0,0,0,0,0,0,0,0,0,0,0,0,0,0,0,0,0,0,0,0,2,0,0,0,0,0,0,0,0,2,0,0,0,0,0,0,0,0,0,0,0,2,2
"AF3C-AIR FORCE ELEMENTS, U.S. CENTRAL COMMAND",1,0,0,0,0,0,0,0,0,0,1,0,0,0,0,0,0,0,0,0,0,0,1,0,0,0,0,0,0,0,0,0,0,0,0,0,0,0,0,0,0,0,0,0,0,0,1
"AF3D-AIR FORCE ELEMENTS, U.S. SPECIAL OPERATIONS COMMAND",0,1,0,0,0,0,0,0,0,0,1,0,0,0,0,0,0,0,0,0,0,0,1,1,0,0,0,0,0,0,0,0,0,1,0,0,0,0,0,0,0,0,0,0,0,1,2
"AF3N-AIR FORCE ELEMENTS, U.S. ATLANTIC COMMAND",0,0,0,0,0,0,0,0,0,0,0,0,0,0,0,0,0,0,0,0,0,0,0,0,0,0,0,0,0,0,0,0,0,0,0,0,0,0,0,0,0,0,0,0,0,0,0
"AF3Q-AIR FORCE ELEMENTS, U.S. STRATEGIC COMMAND",0,0,0,0,0,0,0,0,0,0,0,0,0,0,0,0,0,0,0,0,0,0,0,1,0,0,0,0,0,0,0,0,0,1,0,0,0,0,0,0,0,0,0,0,0,1,1
"AF3T-AIR FORCE ELEMENTS, U.S. TRANSPORTATION COMMAND",1,1,0,0,0,0,0,0,0,0,2,0,0,0,0,0,0,0,0,0,0,0,2,2,1,0,0,0,0,0,0,0,0,3,0,0,0,0,0,0,0,0,0,0,0,3,5
AF3V-AIR FORCE ELEMENTS,1,0,0,0,0,0,0,0,0,0,1,0,0,0,0,0,0,0,0,0,0,0,1,0,0,0,0,0,0,0,0,0,0,0,0,1,0,0,0,0,0,0,0,1,0,1,2
AF3W-AIR FORCE CENTER FOR ENGINEER & ENVIRONMENT,0,0,0,0,0,0,0,0,0,0,0,0,0,0,0,0,0,0,0,0,0,0,0,0,0,0,0,0,0,0,0,0,0,0,0,0,0,0,0,0,0,0,0,0,0,0,0
AF3Y-AIR FORCE FREQUENCY MANAGEMENT AGENCY,0,0,0,0,0,0,0,0,0,0,0,0,0,0,0,0,0,0,0,0,0,0,0,0,0,0,0,0,0,0,0,0,0,0,0,0,0,0,0,0,0,0,0,0,0,0,0
"AF4D-AIR FORCE ELEMENTS, U.S. NORTHERN COMMAND",0,0,0,0,0,0,0,0,0,0,0,0,0,0,0,0,0,0,0,0,0,0,0,0,0,0,0,0,0,0,0,0,0,0,0,0,0,0,0,0,0,0,0,0,0,0,0
AF4W-AIR FORCE DISTRICT OF WASHINGTON,2,1,0,0,0,0,0,0,0,0,3,0,0,0,0,0,0,0,0,0,0,0,3,0,3,0,0,0,0,0,0,0,0,3,0,0,0,0,0,0,0,0,0,0,0,3,6
AF5J-AIR FORCE FINANCIAL SERVICES,0,0,0,0,0,0,0,0,0,0,0,0,0,0,0,0,0,0,0,0,0,0,0,1,0,0,0,0,0,0,0,0,0,1,0,0,0,0,0,0,0,0,0,0,0,1,1
AF5K-AIR FORCE PETROLEUM AGENCY,0,0,0,0,0,0,0,0,0,0,0,0,0,0,0,0,0,0,0,0,0,0,0,0,0,0,0,0,0,0,0,0,0,0,0,0,0,0,0,0,0,0,0,0,0,0,0
AFGS-AIR FORCE GLOBAL STRIKE COMMAND,0,0,0,0,0,0,0,0,0,0,0,0,0,0,0,0,0,0,0,0,0,0,0,0,5,0,0,0,0,0,0,0,0,5,1,0,0,0,0,0,0,0,0,1,0,6,6
AFNG-AIR NATIONAL GUARD UNITS (TITLE 32),0,0,0,0,0,0,0,0,0,0,0,0,0,0,0,0,0,0,0,0,0,0,0,0,2,0,0,0,0,72,0,0,0,74,0,0,1,0,0,0,370,0,0,371,0,445,445
"AFZG-U.S. SPECIAL OPERATIONS COMMAND (ANG, TITLE 32)",0,0,0,0,0,0,0,0,0,0,0,0,0,0,0,0,0,0,0,0,0,0,0,0,0,0,0,0,0,2,0,0,0,2,0,0,0,0,0,0,6,0,0,6,0,8,8
AG01-OFFICE OF THE SECRETARY OF AGRICULTURE,1,0,0,0,0,0,0,0,0,0,1,0,0,0,0,0,0,0,0,0,0,0,1,0,0,0,0,0,0,0,0,1,0,1,0,1,0,0,0,0,0,0,0,1,0,2,3
AG02-AGRICULTURAL MARKETING SERVICE,1,0,0,0,0,0,0,0,0,0,1,0,0,0,0,0,0,0,0,0,0,0,1,1,1,0,0,0,0,0,0,0,0,2,0,0,0,0,0,0,0,0,0,0,0,2,3
AG03-AGRICULTURAL RESEARCH SERVICE,0,0,0,0,0,0,0,0,0,0,0,0,0,0,0,0,0,0,0,0,0,0,0,0,10,0,1,4,0,0,0,0,0,15,8,50,7,0,1,0,0,0,0,66,0,81,81
AG07-RURAL HOUSING SERVICE,1,0,0,0,0,0,0,0,0,0,1,0,0,0,0,0,0,0,0,0,0,0,1,1,7,1,0,0,0,0,0,0,0,9,1,0,0,0,0,0,0,0,0,1,0,10,11
AG08-RISK MANAGEMENT AGENCY,0,0,0,0,0,0,0,0,0,0,0,0,0,0,0,0,0,0,0,0,0,0,0,0,0,0,0,1,0,0,0,0,0,1,0,0,0,0,0,0,0,0,0,0,0,1,1
AG10-FOREIGN AGRICULTURAL SERVICE,1,0,0,0,0,0,0,0,0,0,1,0,0,0,0,0,0,0,0,0,0,0,1,1,0,0,0,0,0,0,0,0,0,1,0,0,5,0,0,0,0,0,0,5,0,6,7
AG11-FOREST SERVICE,22,6,0,0,0,0,0,1,0,0,29,0,0,0,0,0,0,0,0,0,0,0,29,10,57,1,0,0,0,4,0,0,0,72,495,9,0,0,4,0,0,0,0,508,0,580,609
AG13-OFFICE OF COMMUNICATIONS,0,0,0,0,0,0,0,0,0,0,0,0,0,0,0,0,0,0,0,0,0,0,0,0,0,0,0,0,0,0,0,0,0,0,0,0,0,1,0,0,0,0,0,1,0,1,1
AG14-OFFICE OF THE GENERAL COUNSEL,0,0,0,0,0,0,0,0,0,0,0,0,0,0,0,0,0,0,0,0,0,0,0,1,0,0,0,0,0,0,0,0,0,1,0,0,0,0,0,0,0,0,0,0,0,1,1
AG15-RURAL UTILITIES SERVICE,0,0,0,0,0,0,0,0,0,0,0,0,0,0,0,0,0,0,0,0,0,0,0,0,0,0,0,0,0,0,0,0,0,0,0,0,0,0,0,0,0,0,0,0,0,0,0
AG16-NATURAL RESOURCES CONSERVATION SERVICE,1,0,0,0,0,0,0,0,0,0,1,0,0,0,0,0,0,0,0,0,0,0,1,6,15,0,0,1,0,0,0,0,0,22,2,1,0,0,0,0,0,0,0,3,0,25,26
AG18-ECONOMIC RESEARCH SERVICE,0,0,0,0,0,0,0,0,0,0,0,0,0,0,0,0,0,0,0,0,0,0,0,0,0,0,0,0,0,0,0,0,0,0,0,0,0,0,0,0,0,0,0,0,0,0,0
AG20-NATIONAL AGRICULTURAL STATISTICS SERVICE,0,0,0,0,0,0,0,0,0,0,0,0,0,0,0,0,0,0,0,0,0,0,0,0,1,0,0,0,0,0,0,0,0,1,0,0,0,0,0,0,0,0,0,0,0,1,1
"AG22-COOPERATIVE STATE RESEARCH, EDUCATION, AND EXTENSION SERVICE",0,0,0,0,0,0,0,0,0,0,0,0,0,0,0,0,0,0,0,0,0,0,0,0,0,0,0,0,0,0,0,0,0,0,0,9,0,0,0,0,0,0,0,9,0,9,9
AG23-OFFICE OF THE INSPECTOR GENERAL,0,0,0,0,0,0,0,0,0,0,0,0,0,0,0,0,0,0,0,0,0,0,0,0,0,0,0,0,0,0,0,0,0,0,0,0,0,0,0,0,0,0,0,0,0,0,0
AG30-FOOD AND NUTRITION SERVICE,1,0,0,0,0,0,0,0,0,0,1,0,0,0,0,0,0,0,0,0,0,0,1,0,0,0,0,0,0,0,0,0,0,0,0,0,0,0,0,0,0,0,0,0,0,0,1
AG32-RURAL BUSINESS-COOPERATIVE SERVICE,0,0,0,0,0,0,0,0,0,0,0,0,0,0,0,0,0,0,0,0,0,0,0,0,0,0,0,0,0,0,0,0,0,0,0,0,0,0,0,0,0,0,0,0,0,0,0
AG34-ANIMAL AND PLANT HEALTH INSPECTION SERVICE,8,0,0,0,0,0,0,0,0,0,8,0,0,0,0,0,0,0,0,0,0,0,8,3,4,0,0,0,0,1,0,0,0,8,2,47,0,0,1,0,0,0,0,50,0,58,66
"AG36-GRAIN INSPECTION, PACKERS AND STOCKYARDS ADMINISTRATION",0,1,0,0,0,0,0,0,0,0,1,0,0,0,0,0,0,0,0,0,0,0,1,1,3,0,0,0,0,1,0,0,0,5,0,0,0,0,0,0,0,0,0,0,0,5,6
AG37-FOOD SAFETY AND INSPECTION SERVICE,3,0,0,0,0,0,0,0,0,0,3,0,0,0,0,0,0,0,0,0,0,0,3,2,4,0,0,0,0,0,0,0,0,6,27,5,0,0,0,0,0,0,0,32,0,38,41
AG38-OFFICE OF THE CHIEF ECONOMIST,0,0,0,0,0,0,0,0,0,0,0,0,0,0,0,0,0,0,0,0,0,0,0,0,0,0,0,0,0,0,0,0,0,0,0,0,0,0,0,0,0,0,0,0,0,0,0
AG42-OFFICE OF BUDGET AND PROGRAM ANALYSIS,0,0,0,0,0,0,0,0,0,0,0,0,0,0,0,0,0,0,0,0,0,0,0,0,0,0,0,0,0,0,0,0,0,0,0,0,0,0,0,0,0,0,0,0,0,0,0
AG90-OFFICE OF THE CHIEF FINANCIAL OFFICER,1,0,0,0,0,0,0,0,0,0,1,0,0,0,0,0,0,0,0,0,0,0,1,1,5,1,0,0,0,0,0,0,0,7,0,0,0,0,0,0,0,0,0,0,0,7,8
AGAO-OFFICE OF ADVOCACY AND OUTREACH,0,0,0,0,0,0,0,0,0,0,0,0,0,0,0,0,0,0,0,0,0,0,0,0,0,0,0,0,0,0,0,0,0,0,0,0,0,0,0,0,0,0,0,0,0,0,0
AGCR-CIVIL RIGHTS,0,0,0,0,0,0,0,0,0,0,0,0,0,0,0,0,0,0,0,0,0,0,0,0,0,0,0,0,0,0,0,0,0,0,0,0,0,0,0,0,0,0,0,0,0,0,0
AGDA-DEPARTMENTAL ADMINISTRATION,0,0,0,0,0,0,0,0,0,0,0,0,0,0,0,0,0,0,0,0,0,0,0,0,0,0,0,0,0,2,0,0,0,2,0,0,0,0,0,0,0,0,0,0,0,2,2
AGES-OFFICE OF THE EXECUTIVE SECRETARIAT,0,0,0,0,0,0,0,0,0,0,0,0,0,0,0,0,0,0,0,0,0,0,0,0,0,0,0,0,0,0,0,0,0,0,0,0,0,0,0,0,0,0,0,0,0,0,0
AGFA-FARM SERVICE AGENCY,0,0,0,0,0,0,0,0,0,0,0,0,0,0,0,0,0,0,0,0,0,0,0,2,5,0,0,0,0,0,0,0,0,7,0,0,0,1,0,0,0,0,0,1,0,8,8
AGHL-HOMELAND SECURITY STAFF,0,0,0,0,0,0,0,0,0,0,0,0,0,0,0,0,0,0,0,0,0,0,0,0,0,0,0,0,0,0,0,0,0,0,0,0,0,0,0,0,0,0,0,0,0,0,0
AGIT-OFFICE OF THE CHIEF INFORMATION OFFICER,1,2,0,0,0,0,0,0,0,0,3,0,0,0,0,0,0,0,0,0,0,0,3,0,1,1,0,0,0,0,0,0,0,2,0,0,0,0,0,0,0,0,0,0,0,2,5
AGNA-NATIONAL APPEALS DIVISION,0,0,0,0,0,0,0,0,0,0,0,0,0,0,0,0,0,0,0,0,0,0,0,0,2,0,0,0,0,0,0,0,0,2,0,0,0,0,0,0,0,0,0,0,0,2,2
AH01-NATIONAL ENDOWMENT FOR THE ARTS,0,0,0,0,0,0,0,0,0,0,0,0,0,0,0,0,0,0,0,0,0,0,0,1,0,0,0,0,0,0,0,0,0,1,0,0,0,1,0,0,0,0,0,1,0,2,2
AH02-NATIONAL ENDOWMENT FOR THE HUMANITIES,0,0,0,0,0,0,0,0,0,0,0,0,0,0,0,0,0,0,0,0,0,0,0,0,0,0,0,0,0,0,0,0,0,0,0,0,0,0,0,0,0,0,0,0,0,0,0
AH03-INSTITUTE OF MUSEUM AND LIBRARY SERVICES,1,0,0,0,0,0,0,0,0,0,1,0,0,0,0,0,0,0,0,0,0,0,1,0,0,0,0,0,0,1,0,0,0,1,0,0,0,0,0,0,1,0,0,1,0,2,3
AM00-AGENCY FOR INTERNATIONAL DEVELOPMENT,2,0,0,0,0,0,0,1,0,0,3,0,0,0,0,0,0,0,0,0,0,0,3,2,1,1,0,1,0,0,0,0,0,5,2,0,0,0,0,0,24,0,0,26,0,31,34
AN00-AFRICAN DEVELOPMENT FOUNDATION,0,0,0,0,0,0,0,0,0,0,0,0,0,0,0,0,0,0,0,0,0,0,0,0,0,0,0,0,0,0,0,0,0,0,0,0,0,0,0,0,0,0,0,0,0,0,0
AP00-APPALACHIAN REGIONAL COMMISSION,0,0,0,0,0,0,0,0,0,0,0,0,0,0,0,0,0,0,0,0,0,0,0,0,0,0,0,0,0,0,0,0,0,0,0,0,0,0,0,0,0,0,0,0,0,0,0
AR**-UNSPECIFIED,0,0,0,0,0,0,0,0,0,0,0,0,0,0,0,0,0,0,0,0,0,0,0,0,0,0,0,0,0,0,0,0,0,0,0,0,0,0,0,0,0,0,0,0,0,0,0
AR2A-UNITED STATES ARMY CYBER COMMAND,0,0,0,0,0,0,0,0,0,0,0,0,0,0,0,0,0,0,0,0,0,0,0,0,0,0,0,0,0,0,0,0,0,0,0,0,0,0,0,0,0,0,0,0,0,0,0
AR3A-U.S. ARMY CENTRAL,0,0,0,0,0,0,0,0,0,0,0,0,0,0,0,0,0,0,0,0,0,0,0,1,2,0,0,0,0,0,0,0,0,3,1,0,0,0,0,0,0,0,0,1,0,4,4
AR5A-U.S. ARMY NORTH,0,0,0,0,0,0,0,0,0,0,0,0,0,0,0,0,0,0,0,0,0,0,0,0,0,0,0,0,0,0,0,0,0,0,0,0,0,0,0,0,0,0,0,0,0,0,0
ARA1-US ARMY AFRICA/SOUTHERN EUROPEAN TASK FORCE (USAFRAF/SETAF),0,0,0,0,0,0,0,0,0,0,0,0,0,0,0,0,0,0,0,0,0,0,0,0,0,0,0,0,0,0,0,0,0,0,0,0,0,0,0,0,0,0,0,0,0,0,0
ARAA-U. S. ARMY ACCESSION COMMAND,2,0,0,0,0,0,0,0,0,0,2,0,0,0,0,0,0,0,0,0,0,0,2,1,4,0,0,0,0,5,0,0,0,10,4,0,0,0,0,0,0,0,0,4,0,14,16
ARAC-U.S. ARMY CONTRACTING AGENCY,0,0,0,0,0,0,0,0,0,0,0,0,0,0,0,0,0,0,0,0,0,0,0,0,0,0,0,0,0,0,0,0,0,0,0,0,0,0,0,0,0,0,0,0,0,0,0
ARAE-U.S. ARMY ACQUISITION SUPPORT CENTER,1,0,0,0,0,0,0,0,0,0,1,0,0,0,0,0,0,0,0,0,0,0,1,0,2,0,0,1,0,0,0,0,0,3,0,0,0,0,0,0,0,0,0,0,0,3,4
ARAP-U. S. MILITARY ENTRANCE PROCESSING COMMAND,0,0,0,0,0,0,0,0,0,0,0,0,0,0,0,0,0,0,0,0,0,0,0,3,26,0,0,0,0,2,0,0,0,31,2,0,0,0,0,0,0,0,0,2,0,33,33
ARAS-U.S. ARMY INTELLIGENCE AND SECURITY COMMAND,0,0,0,0,0,0,0,0,0,0,0,0,0,0,0,0,0,0,0,0,0,0,0,0,0,0,0,0,0,28,0,0,0,28,0,0,0,0,0,0,0,0,0,0,0,28,28
ARAT-U.S. ARMY TEST AND EVALUATION COMMAND,0,0,0,0,0,0,0,0,0,0,0,0,0,0,0,0,0,0,0,0,0,0,0,0,3,0,0,0,0,0,0,0,0,3,0,0,0,0,0,0,0,0,0,0,0,3,3
ARBA-U.S. ARMY INSTALLATION MANAGEMENT COMMAND,18,2,0,0,0,0,0,0,0,0,20,0,0,0,0,0,0,0,0,0,0,0,20,9,76,3,0,0,0,15,0,0,0,103,26,10,0,0,0,0,1,0,0,37,0,140,160
ARCB-U.S. ARMY CRIMINAL INVESTIGATION COMMAND,1,0,0,0,0,0,0,0,0,0,1,0,0,0,0,0,0,0,0,0,0,0,1,0,2,0,0,0,0,0,0,0,0,2,1,0,0,0,0,0,0,0,0,1,0,3,4
ARCE-U.S. ARMY CORPS OF ENGINEERS,10,2,0,0,0,0,0,0,0,0,12,0,0,0,0,0,0,0,0,0,0,0,12,8,41,3,0,4,0,13,0,0,0,69,53,0,0,0,13,0,3,0,0,69,0,138,150
ARCS-IMMEDIATE OFFICE OF THE CHIEF OF STAFF OF THE ARMY,0,1,0,0,0,0,0,0,0,0,1,0,0,0,0,0,0,0,0,0,0,0,1,0,1,0,0,0,0,0,0,0,0,1,1,0,0,0,0,0,3,0,0,4,0,5,6
ARE1-IMMEDIATE OFFICE OF THE COMMANDER-IN-CHIEF OF THE U.S. ARMY EUROPE AND SEVENTH ARMY,0,2,0,0,0,0,0,0,0,0,2,0,0,0,0,0,0,0,0,0,0,0,2,0,2,0,0,0,0,0,0,0,0,2,3,5,0,0,0,0,0,0,0,8,0,10,12
ARE2-21ST THEATER ARMY AREA COMMAND,0,0,0,0,0,0,0,0,0,0,0,0,0,0,0,0,0,0,0,0,0,0,0,0,2,0,0,0,0,0,0,0,0,2,0,0,0,0,0,0,0,0,0,0,0,2,2
ARE3-U.S. ARMY SOUTHERN EURPOEAN TASK FORCE,0,0,0,0,0,0,0,0,0,0,0,0,0,0,0,0,0,0,0,0,0,0,0,0,0,0,0,0,0,0,0,0,0,0,0,0,0,0,0,0,0,0,0,0,0,0,0
ARE5-U.S. ARMY V CORPS,0,0,0,0,0,0,0,0,0,0,0,0,0,0,0,0,0,0,0,0,0,0,0,0,0,0,0,0,0,0,0,0,0,0,0,0,0,0,0,0,0,0,0,0,0,0,0
AREN-SEVENTH ARMY TRAINING COMMAND,0,0,0,0,0,0,0,0,0,0,0,0,0,0,0,0,0,0,0,0,0,0,0,0,1,0,0,0,0,0,0,0,0,1,0,0,0,0,0,0,0,0,0,0,0,1,1
ARFC-U.S. ARMY FORCES COMMAND,0,0,0,0,0,0,0,0,0,0,0,0,0,0,0,0,0,0,0,0,0,0,0,1,8,0,0,0,0,0,1,0,0,10,4,0,0,0,0,0,0,0,0,4,0,14,14
ARG6-U.S. ARMY NETWORK ENTERPRISE TECHNOLOGY COMMAND/9TH ARMY SIGNAL COMMAND,4,0,0,0,0,0,0,0,0,0,4,0,0,0,0,0,0,0,0,0,0,0,4,0,2,0,0,0,0,1,0,0,0,3,1,0,0,0,0,0,0,0,0,1,0,4,8
ARGB-OFFICE OF THE CHIEF OF THE NATIONAL GUARD BUREAU,2,0,0,0,0,0,0,0,0,0,2,0,0,0,0,0,0,0,0,0,0,0,2,0,0,0,0,0,0,0,0,0,0,0,1,0,0,0,0,0,0,0,0,1,0,1,3
ARHR-U.S. ARMY RESERVE COMMAND,4,1,0,0,0,0,0,0,0,0,5,0,0,0,0,0,0,0,0,0,0,0,5,5,46,0,0,0,0,14,0,0,0,65,15,0,0,0,0,0,0,0,0,15,0,80,85
ARJ1-U.S. ARMY ELEMENT SHAPE,0,0,0,0,0,0,0,0,0,0,0,0,0,0,0,0,0,0,0,0,0,0,0,0,0,0,0,0,0,1,0,0,0,1,0,0,0,0,0,0,0,0,0,0,0,1,1
ARJA-JOINT ACTIVITIES,3,0,0,0,0,0,0,0,0,0,3,0,0,0,0,0,0,0,0,0,0,0,3,0,3,0,0,0,0,4,0,0,0,7,0,2,0,0,1,0,0,0,0,3,0,10,13
ARMA-U.S. MILITARY ACADEMY,0,0,0,0,0,0,0,0,0,0,0,0,0,0,0,0,0,0,0,0,0,0,0,1,1,0,0,0,0,0,0,0,0,2,0,1,0,0,0,0,0,0,0,1,0,3,3
ARMC-U.S. ARMY MEDICAL COMMAND,12,7,0,0,0,0,0,0,0,0,19,0,0,0,0,0,0,0,0,0,0,1,20,27,208,2,0,0,0,17,0,0,0,254,23,7,0,0,0,0,0,0,0,30,0,284,304
ARMW-U.S. ARMY MILITARY DISTRICT OF WASHINGTON,0,0,0,0,0,0,0,0,0,0,0,0,0,0,0,0,0,0,0,0,0,0,0,0,1,0,0,0,0,0,0,0,0,1,2,0,0,0,0,0,0,0,0,2,0,3,3
ARNG-ARMY NATIONAL GUARD UNITS (TITLE 32),1,0,0,0,0,0,0,0,0,0,1,0,0,0,0,0,0,0,0,0,0,0,1,1,7,0,0,0,0,182,0,0,0,190,0,0,0,0,0,0,198,0,0,198,0,388,389
"ARP1-U.S. ARMY, PACIFIC",0,0,0,0,0,0,0,0,0,0,0,0,0,0,0,0,0,0,0,0,0,0,0,0,1,0,0,0,0,3,0,0,0,4,0,0,0,0,0,0,0,0,0,0,0,4,4
ARP8-EIGHTH U.S. ARMY,0,0,0,0,0,0,0,0,0,0,0,0,0,0,0,0,0,0,0,0,0,0,0,0,0,0,0,0,0,0,0,0,0,0,0,0,0,0,0,0,0,0,0,0,0,0,0
ARSA-OFFICE OF THE SECRETARY OF THE ARMY,1,0,0,0,0,0,0,0,0,0,1,0,0,0,0,0,0,0,0,0,0,0,1,1,0,0,0,0,0,0,0,0,0,1,0,0,0,0,0,1,2,0,0,3,0,4,5
ARSB-FIELD OPERATING OFFICES OF THE OFFICE OF THE SECRETARY OF THE ARMY,0,0,0,0,0,0,0,0,0,0,0,0,0,0,0,0,0,0,0,0,0,0,0,0,2,0,0,5,0,1,0,0,0,8,0,2,0,0,2,0,0,0,0,4,0,12,12
ARSC-U. S. ARMY SPACE AND MISSILE DEFENSE COMMAND/U. S. ARMY FORCES STRATEGIC COMMAND,0,0,0,0,0,0,0,0,0,0,0,0,0,0,0,0,0,0,0,0,0,0,0,0,7,0,0,0,0,0,0,0,0,7,0,0,0,0,0,0,0,0,0,0,0,7,7
ARSE-FIELD OPERATING AGENCIES OF THE ARMY STAFF RESOURCED THROUGH OA-22,0,0,0,0,0,0,0,0,0,0,0,0,0,0,0,0,0,0,0,0,0,0,0,2,15,0,0,2,0,1,0,0,0,20,2,0,0,0,0,0,0,0,0,2,0,22,22
ARSF-FIELD OPERATING AGENCIES OF THE ARMY STAFF,0,0,0,0,0,0,0,0,0,0,0,0,0,0,0,0,0,0,0,0,0,0,0,0,0,0,0,0,0,0,0,0,0,0,0,0,0,0,0,0,0,0,0,0,0,0,0
"ARSJ-JOINT SERVICES AND ACTIVITIES SUPPORTED BY THE OFFICE, SECRETARY OF THE ARMY",0,0,0,0,0,0,0,0,0,0,0,0,0,0,0,0,0,0,0,0,0,0,0,2,0,0,0,0,0,0,0,0,0,2,0,5,0,0,0,0,0,0,0,5,0,7,7
ARSO-U.S. ARMY SOUTH,0,0,0,0,0,0,0,0,0,0,0,0,0,0,0,0,0,0,0,0,0,0,0,0,0,0,0,0,0,0,0,0,0,0,1,0,0,0,0,0,0,0,0,1,0,1,1
ARSP-U.S. SPECIAL OPERATIONS COMMAND (ARMY),1,0,0,0,0,0,0,0,0,0,1,0,0,0,0,0,0,0,0,0,0,0,1,0,4,0,0,0,0,1,0,0,0,5,0,0,0,0,0,0,0,0,0,0,0,5,6
ARTA-U.S. ARMY ACCESSIONS COMMAND,0,0,0,0,0,0,0,0,0,0,0,0,0,0,0,0,0,0,0,0,0,0,0,0,0,0,0,0,0,0,0,0,0,0,0,0,0,0,0,0,0,0,0,0,0,0,0
ARTC-U.S. ARMY TRAINING AND DOCTRINE COMMAND,1,0,0,0,0,0,0,0,0,0,1,0,0,0,0,0,0,0,0,0,0,0,1,3,12,0,0,0,0,3,0,0,0,18,3,6,0,0,0,0,1,0,0,10,0,28,29
ARTM-U.S. MILITARY ENTRANCE PROCESSING COMMAND,0,0,0,0,0,0,0,0,0,0,0,0,0,0,0,0,0,0,0,0,0,0,0,0,0,0,0,0,0,0,0,0,0,0,0,0,0,0,0,0,0,0,0,0,0,0,0
ARTW-U.S. ARMY WAR COLLEGE,0,0,0,0,0,0,0,0,0,0,0,0,0,0,0,0,0,0,0,0,0,0,0,0,1,0,0,0,0,0,0,0,0,1,0,0,0,0,0,0,0,0,0,0,0,1,1
ARX1-414TH SUPPORT BRIGADE,0,0,0,0,0,0,0,0,0,0,0,0,0,0,0,0,0,0,0,0,0,0,0,0,1,0,0,0,0,0,0,0,0,1,1,0,0,0,0,0,0,0,0,1,0,2,2
"ARX2-HEADQUARTERS, AMC",0,0,0,0,0,0,0,0,0,0,0,0,0,0,0,0,0,0,0,0,0,0,0,0,0,0,0,0,0,0,0,0,0,0,0,0,0,0,0,0,0,0,0,0,0,0,0
"ARX3-HEADQUARTERS, STAFF SUPPORT ACTIVITIES, AMC",0,0,0,0,0,0,0,0,0,0,0,0,0,0,0,0,0,0,0,0,0,0,0,0,0,0,0,0,0,0,0,0,0,0,0,0,0,0,0,0,0,0,0,0,0,0,0
ARX6-U.S. ARMY AVIATION AND MISSILE COMMAND,0,0,0,0,0,0,0,0,0,0,0,0,0,0,0,0,0,0,0,0,0,0,0,0,9,0,0,0,0,0,0,0,0,9,3,0,0,0,0,0,0,0,0,3,0,12,12
ARX7-U.S. ARMY TANK-AUTOMOTIVE AND ARMAMENT COMMAND (TACOM),2,0,0,0,0,0,0,0,0,0,2,0,0,0,0,0,0,0,0,0,0,0,2,0,1,0,0,0,0,0,0,0,0,1,123,0,0,0,0,0,0,0,0,123,0,124,126
ARX8-U.S. ARMY COMMUNICATIONS ELECTRONICS COMMAND,0,0,0,0,0,0,0,0,0,0,0,0,0,0,0,0,0,0,0,0,0,0,0,0,0,0,0,0,0,0,0,0,0,0,0,0,0,0,0,0,0,0,0,0,0,0,0
ARXB-U.S. ARMY CHEMICAL MATERIALS ACTIVITY,0,0,0,0,0,0,0,0,0,0,0,0,0,0,0,0,0,0,0,0,0,0,0,0,0,0,0,0,0,0,0,0,0,0,0,0,0,0,0,0,0,0,0,0,0,0,0
ARXC-U.S. ARMY SUSTAINMENT COMMAND,1,0,0,0,0,0,0,0,0,0,1,0,0,0,0,0,0,0,0,0,0,0,1,0,2,0,0,0,0,0,0,0,0,2,10,0,0,0,0,0,5,0,0,15,0,17,18
ARXD-U. S. ARMY CONTRACTING COMMAND,1,0,0,0,0,0,0,0,0,0,1,0,0,0,0,0,0,0,0,0,0,0,1,0,0,0,0,0,0,0,0,0,0,0,2,0,0,0,0,0,0,0,0,2,0,2,3
ARXK-MATERIEL ACQUISITION ACTIVITIES,0,0,0,0,0,0,0,0,0,0,0,0,0,0,0,0,0,0,0,0,0,0,0,0,1,0,0,0,0,0,0,0,0,1,0,0,0,0,0,0,0,0,0,0,0,1,1
ARXP-U.S. ARMY SECURITY ASSISTANCE COMMAND,0,0,0,0,0,0,0,0,0,0,0,0,0,0,0,0,0,0,0,0,0,0,0,0,2,0,0,0,0,0,0,0,0,2,1,0,0,0,0,0,0,0,0,1,0,3,3
ARXQ-U.S. ARMY JOINT MUNITIONS COMMAND,1,0,0,0,0,0,0,0,0,0,1,0,0,0,0,0,0,0,0,0,0,0,1,0,0,1,0,0,0,1,0,0,0,2,12,0,0,0,0,0,0,0,0,12,0,14,15
"ARXR-U.S. ARMY RESEARCH, DEVELOPMENT AND ENGINEERING COMMAND",0,0,0,0,0,0,0,0,0,0,0,0,0,0,0,0,0,0,0,0,0,0,0,0,0,0,0,0,0,3,0,0,0,3,2,0,0,0,0,0,0,0,0,2,0,5,5
ARXT-U.S. ARMY MILITARY SURFACE DEPLOYMENT AND DISTRIBUTION COMMAND,0,0,0,0,0,0,0,0,0,0,0,0,0,0,0,0,0,0,0,0,0,0,0,0,2,0,0,0,0,0,0,0,0,2,0,0,0,0,0,0,0,0,0,0,0,2,2
ARXX-MATERIEL READINESS ACTIVITIES,0,0,0,0,0,0,0,0,0,0,0,0,0,0,0,0,0,0,0,0,0,0,0,0,0,0,0,0,0,0,0,0,0,0,0,0,0,0,0,0,0,0,0,0,0,0,0
AU00-FEDERAL LABOR RELATIONS AUTHORITY,2,0,0,0,0,0,0,0,0,0,2,0,0,0,0,0,0,0,0,0,0,0,2,0,0,1,0,0,0,0,0,0,0,1,0,0,0,0,0,0,0,0,0,0,0,1,3
AW00-ARCTIC RESEARCH COMMISSION,0,0,0,0,0,0,0,0,0,0,0,0,0,0,0,0,0,0,0,0,0,0,0,0,0,0,0,0,0,0,0,0,0,0,0,0,0,0,0,0,0,0,0,0,0,0,0
BD00-MERIT SYSTEMS PROTECTION BOARD,0,0,0,0,0,0,0,0,0,0,0,0,0,0,0,0,0,0,0,0,0,0,0,0,0,0,0,0,0,0,0,0,0,0,0,0,0,0,0,0,0,0,0,0,0,0,0
BF00-DEFENSE NUCLEAR FACILITIES SAFETY BOARD,0,0,0,0,0,0,0,0,0,0,0,0,0,0,0,0,0,0,0,0,0,0,0,0,0,0,0,0,0,0,0,0,0,0,0,0,0,0,0,0,0,0,0,0,0,0,0
BG00-PENSION BENEFIT GUARANTY CORPORATION,0,0,0,0,0,0,0,0,0,0,0,0,0,0,0,0,0,0,0,0,0,0,0,0,4,1,0,0,0,0,0,0,0,5,0,0,0,0,0,0,0,0,0,0,0,5,5
BK00-JAMES MADISON MEMORIAL FELLOWSHIP FOUNDATION,0,0,0,0,0,0,0,0,0,0,0,0,0,0,0,0,0,0,0,0,0,0,0,0,0,0,0,0,0,0,0,0,0,0,0,0,0,0,0,0,0,0,0,0,0,0,0
BO00-OFFICE OF MANAGEMENT AND BUDGET,1,0,0,0,0,0,0,0,0,0,1,0,0,0,0,0,0,0,0,0,0,0,1,0,0,0,0,0,0,0,1,0,0,1,0,0,0,0,0,0,2,0,0,2,0,3,4
BT00-ARCHITECTURAL AND TRANSPORTATION BARRIERS COMPLIANCE BOARD,0,0,0,0,0,0,0,0,0,0,0,0,0,0,0,0,0,0,0,0,0,0,0,0,0,0,0,0,0,0,0,0,0,0,0,0,0,0,0,1,0,0,0,1,0,1,1
BW00-NUCLEAR WASTE TECHNICAL REVIEW BOARD,0,0,0,0,0,0,0,0,0,0,0,0,0,0,0,0,0,0,0,0,0,0,0,0,0,0,0,0,0,0,0,0,0,0,0,0,0,0,0,0,0,0,0,0,0,0,0
BZ00-CHRISTOPHER COLUMBUS FELLOWSHIP FOUNDATION,0,0,0,0,0,0,0,0,0,0,0,0,0,0,0,0,0,0,0,0,0,0,0,0,0,0,0,0,0,1,0,0,0,1,0,0,0,0,0,0,0,0,0,0,0,1,1
CC00-COMMISSION ON CIVIL RIGHTS,0,0,0,0,0,0,0,0,0,0,0,0,0,0,0,0,0,0,0,0,0,0,0,0,0,0,0,0,0,0,0,0,0,0,0,0,0,0,0,0,0,0,0,0,0,0,0
CE00-COUNCIL OF ECONOMIC ADVISERS,0,0,0,0,0,0,0,0,0,0,0,0,0,0,0,0,0,0,0,0,0,0,0,0,0,0,0,0,0,0,0,0,0,0,0,0,0,0,0,0,0,0,0,0,0,0,0
