Agency,10-Competitive Service - Career,15-Competitive Service - Career-Conditional,30-Excepted Service - Schedule A,32-Excepted Service - Schedule B,36-Excepted Service - Executive,38-Excepted Service - Other,50-Senior Executive Service - Career,55-Senior Executive Service - Non-Career,**-Unspecified,Permanent,20-Competitive Service,40-Excepted Service - Schedule A,42-Excepted Service - Schedule B,44-Excepted Service - Schedule C,46-Excepted Service - Executive,48-Excepted Service - Other,60-Senior Executive Service - Limited Term,65-Senior Executive Service - Limited Emergency,Non-permanent,Unspecified,Type of Appointment - All,10-Competitive Service - Career,15-Competitive Service - Career-Conditional,30-Excepted Service - Schedule A,32-Excepted Service - Schedule B,36-Excepted Service - Executive,38-Excepted Service - Other,50-Senior Executive Service - Career,55-Senior Executive Service - Non-Career,**-Unspecified,Permanent,20-Competitive Service,40-Excepted Service - Schedule A,42-Excepted Service - Schedule B,44-Excepted Service - Schedule C,46-Excepted Service - Executive,48-Excepted Service - Other,60-Senior Executive Service - Limited Term,65-Senior Executive Service - Limited Emergency,Non-permanent,Unspecified,Type of Appointment - All,Type of Appointment - All
AB**-UNSPECIFIED,0,0,0,0,0,0,0,0,0,0,0,0,0,0,0,0,0,0,0,0,0,0,0,0,0,0,0,0,0,0,0,0,0,0,0,0,0,0,0,0,0,0,0
AB00-AMERICAN BATTLE MONUMENTS COMMISSION,1,0,0,0,0,0,0,0,0,1,0,0,0,0,0,0,0,0,0,0,1,0,0,0,0,0,0,0,0,0,0,0,0,0,0,0,0,0,0,0,0,0,1
AF**-UNSPECIFIED,0,0,0,0,0,0,0,0,0,0,0,0,0,0,0,0,0,0,0,0,0,0,0,0,0,0,0,0,0,0,0,0,0,0,0,0,0,0,0,0,0,0,0
AF02-AIR FORCE INSPECTION AND SAFETY CENTER,0,0,0,0,0,0,0,0,0,0,0,0,0,0,0,0,0,0,0,0,0,0,1,0,0,0,0,0,0,0,1,0,0,0,0,0,0,0,0,0,0,1,1
AF03-AIR FORCE OPERATIONAL TEST AND EVALUATION CENTER,1,0,0,0,0,0,0,0,0,1,0,0,0,0,0,0,0,0,0,0,1,0,0,0,0,0,0,0,0,0,0,0,0,0,0,0,0,0,0,0,0,0,1
AF04-AIR FORCE COMMUNICATIONS AGENCY,0,0,0,0,0,0,0,0,0,0,0,0,0,0,0,0,0,0,0,0,0,0,1,0,0,0,0,0,0,0,1,0,0,0,0,0,0,0,0,0,0,1,1
AF05-AIR FORCE INTELLIGENCE SERVICE,0,0,0,0,0,0,0,0,0,0,0,0,0,0,0,0,0,0,0,0,0,0,0,0,0,0,0,0,0,0,0,0,0,0,0,0,0,0,0,0,0,0,0
AF06-AIR FORCE AUDIT AGENCY,0,0,0,0,0,0,0,0,0,0,0,0,0,0,0,0,0,0,0,0,0,0,0,0,1,0,0,0,0,0,1,0,0,0,0,0,0,0,0,0,0,1,1
AF07-AIR FORCE OFFICE OF SPECIAL INVESTIGATIONS,0,0,0,0,0,0,0,0,0,0,0,0,0,0,0,0,0,0,0,0,0,0,0,1,0,0,0,0,0,0,1,0,0,0,0,0,0,0,0,0,0,1,1
AF08-AIR FORCE OFFICE OF SECURITY POLICE,0,0,0,0,0,0,0,0,0,0,0,0,0,0,0,0,0,0,0,0,0,0,1,0,0,0,0,0,0,0,1,0,0,0,0,0,0,0,0,0,0,1,1
AF09-AIR FORCE PERSONNEL CENTER,1,0,0,0,0,0,0,0,0,1,0,0,0,0,0,0,0,0,0,0,1,0,0,0,0,0,0,0,0,0,0,1,0,1,0,0,0,0,0,2,0,2,3
AF0B-U.S. AIR FORCE ACADEMY,0,1,0,0,0,0,0,0,0,1,0,0,0,0,0,0,0,0,0,0,1,0,2,0,0,0,0,0,0,0,2,0,1,1,0,0,0,0,0,2,0,4,5
"AF0D-U.S. AIR FORCES, EUROPE",0,0,0,0,0,0,0,0,0,0,0,0,0,0,0,0,0,0,0,0,0,1,7,0,0,0,0,0,0,0,8,1,26,0,0,0,0,0,0,27,0,35,35
AF0J-AIR EDUCATION AND TRAINING COMMAND,3,3,0,0,0,0,0,0,0,6,0,0,0,0,0,0,0,0,0,0,6,3,39,0,3,0,18,0,0,0,63,42,2,2,0,0,0,0,0,46,0,109,115
"AF0M-HEADQUARTERS, AIR FORCE RESERVE",1,1,0,0,0,0,0,0,0,2,0,0,0,0,0,0,0,0,0,0,2,8,48,0,0,0,16,0,0,0,72,4,0,2,0,0,0,0,0,6,0,78,80
"AF0N-IMMEDIATE OFFICE, HEADQUARTERS, USAF",1,0,0,0,0,0,0,0,0,1,0,0,0,0,0,0,0,0,0,0,1,0,3,1,0,0,0,0,0,0,4,0,0,0,0,0,0,0,0,0,0,4,5
AF0R-PACIFIC AIR FORCES,5,1,0,0,0,0,0,0,0,6,0,0,0,0,0,0,0,0,0,0,6,3,8,0,0,0,5,0,0,0,16,2,17,0,0,0,0,0,0,19,0,35,41
"AF0U-AIR FORCE INTELLIGENCE, SURVEILLANCE, & RECONNAISSANCE AGENCY",0,0,0,0,0,0,0,0,0,0,0,0,0,0,0,0,0,0,0,0,0,0,0,0,0,0,9,0,0,0,9,0,1,0,0,0,1,0,0,2,0,11,11
AF0V-AIR FORCE SPECIAL OPERATIONS COMMAND,0,0,0,0,0,0,0,0,0,0,0,0,0,0,0,0,0,0,0,0,0,0,3,0,1,0,1,0,0,0,5,2,2,0,0,0,0,0,0,4,0,9,9
AF10-AIR FORCE CENTER FOR QUALITY AND MANAGEMENT INNOVATION,0,0,0,0,0,0,0,0,0,0,0,0,0,0,0,0,0,0,0,0,0,0,0,0,0,0,0,0,0,0,0,0,0,0,0,0,0,0,0,0,0,0,0
AF11-AIR FORCE MANPOWER AGENCY,0,0,0,0,0,0,0,0,0,0,0,0,0,0,0,0,0,0,0,0,0,0,1,0,0,0,0,0,0,0,1,3,0,0,0,0,0,0,0,3,0,4,4
"AF1A-AIR FORCE C2 & INTELLIGENCE, SURVEILLANCE & RECONNAISSANCE",0,0,0,0,0,0,0,0,0,0,0,0,0,0,0,0,0,0,0,0,0,0,0,0,0,0,0,0,0,0,0,0,0,0,0,0,0,0,0,0,0,0,0
AF1C-AIR COMBAT COMMAND,8,2,0,0,0,1,0,0,0,11,0,0,0,0,0,0,0,0,0,0,11,3,26,0,0,0,12,0,0,0,41,9,29,1,0,0,0,0,0,39,0,80,91
AF1G-AIR FORCE LOGISTICS MANAGEMENT AGENCY,0,0,0,0,0,0,0,0,0,0,0,0,0,0,0,0,0,0,0,0,0,0,0,0,0,0,0,0,0,0,0,0,0,0,0,0,0,0,0,0,0,0,0
AF1L-AIR MOBILITY COMMAND,4,3,0,0,0,0,0,0,0,7,0,0,0,0,0,0,0,0,0,0,7,3,46,1,0,0,6,0,0,0,56,18,21,2,0,0,0,0,0,41,0,97,104
AF1M-AIR FORCE MATERIEL COMMAND,15,3,0,0,0,0,0,0,0,18,0,0,0,0,0,0,0,0,0,0,18,10,182,1,111,0,47,0,0,0,351,42,31,4,0,0,0,0,0,77,0,428,446
AF1P-AIR FORCE REAL PROPERTY AGENCY,0,0,0,0,0,0,0,0,0,0,0,0,0,0,0,0,0,0,0,0,0,0,0,0,0,0,0,0,0,0,0,0,0,0,0,0,0,0,0,0,0,0,0
AF1Q-HQ AF FLIGHT STANDARDS AGENCY,0,0,0,0,0,0,0,0,0,0,0,0,0,0,0,0,0,0,0,0,0,0,0,0,0,0,0,0,0,0,0,0,0,0,0,0,0,0,0,0,0,0,0
AF1S-SPACE COMMAND,4,1,0,0,0,1,0,0,0,6,0,0,0,0,0,0,0,0,0,0,6,3,20,0,0,0,3,0,0,0,26,7,1,0,0,0,0,0,0,8,0,34,40
AF1W-AIR FORCE ENGINEERING AND SERVICES CENTER,0,1,0,0,0,0,0,0,0,1,0,0,0,0,0,0,0,0,0,0,1,0,0,0,0,0,0,0,0,0,0,1,0,0,0,0,0,0,0,1,0,1,2
AF1Y-AIR FORCE CIVILIAN CAREER TRAINING,0,0,0,0,0,0,0,0,0,0,0,0,0,0,0,0,0,0,0,0,0,0,5,0,18,0,0,0,0,0,23,0,0,0,0,0,0,0,0,0,0,23,23
AF21-AIR FORCE NUCLEAR WEAPONS AGENCY,0,0,0,0,0,0,0,0,0,0,0,0,0,0,0,0,0,0,0,0,0,0,0,0,0,0,0,0,0,0,0,0,0,0,0,0,0,0,0,0,0,0,0
AF24-HQ USAF DIRECT SUPPORT ELEMENT,0,0,0,0,0,0,0,0,0,0,0,0,0,0,0,0,0,0,0,0,0,0,0,0,0,0,0,0,0,0,0,0,0,0,0,0,0,0,0,0,0,0,0
AF25-AF-WIDE SUPPORT ELEMENT,0,0,0,0,0,0,0,0,0,0,0,0,0,0,0,0,0,0,0,0,0,0,0,0,0,0,0,0,0,0,0,1,0,0,0,0,0,0,0,1,0,1,1
AF27-AIR FORCE AGENCY FOR MODELING AND SIMULATION,0,0,0,0,0,0,0,0,0,0,0,0,0,0,0,0,0,0,0,0,0,0,0,0,0,0,0,0,0,0,0,0,0,0,0,0,0,0,0,0,0,0,0
AF2A-AIR FORCE COST CENTER,0,0,0,0,0,0,0,0,0,0,0,0,0,0,0,0,0,0,0,0,0,0,0,0,0,0,0,0,0,0,0,0,0,0,0,0,0,0,0,0,0,0,0
AF2B-AIR FORCE DOCTRINE CENTER,0,0,0,0,0,0,0,0,0,0,0,0,0,0,0,0,0,0,0,0,0,0,1,0,0,0,0,0,0,0,1,0,0,0,0,0,0,0,0,0,0,1,1
AF2D-AIR FORCE PERSONNEL OPERATIONS AGENCY,0,0,0,0,0,0,0,0,0,0,0,0,0,0,0,0,0,0,0,0,0,0,0,0,0,0,0,0,0,0,0,0,0,0,0,0,0,0,0,0,0,0,0
AF2E-AIR FORCE LEGAL SERVICES CENTER,0,0,0,0,0,0,0,0,0,0,0,0,0,0,0,0,0,0,0,0,0,0,0,0,0,0,0,0,0,0,0,0,0,0,0,0,0,0,0,0,0,0,0
AF2F-AIR FORCE MEDICAL SERVICES CENTER,0,0,0,0,0,0,0,0,0,0,0,0,0,0,0,0,0,0,0,0,0,0,0,0,0,0,0,0,0,0,0,0,0,0,0,0,0,0,0,0,0,0,0
AF2G-AIR FORCE SERVICE INFORMATION AND NEWS CENTER,0,0,0,0,0,0,0,0,0,0,0,0,0,0,0,0,0,0,0,0,0,0,0,0,0,0,0,0,0,0,0,0,0,0,0,0,0,0,0,0,0,0,0
AF2I-AIR NATIONAL GUARD SUPPORT CENTER,1,0,0,0,0,0,0,0,0,1,0,0,0,0,0,0,0,0,0,0,1,0,2,0,0,0,0,0,0,0,2,1,0,0,0,0,0,0,0,1,0,3,4
AF2K-U.S. AIR FORCE HISTORICAL RESEARCH CENTER,0,0,0,0,0,0,0,0,0,0,0,0,0,0,0,0,0,0,0,0,0,0,0,0,0,0,0,0,0,0,0,0,0,0,0,0,0,0,0,0,0,0,0
AF2L-AIR FORCE TECHNICAL APPLICATIONS CENTER,0,0,0,0,0,0,0,0,0,0,0,0,0,0,0,0,0,0,0,0,0,0,0,0,0,0,0,0,0,0,0,0,0,0,0,0,0,0,0,0,0,0,0
AF2M-AIR FORCE REVIEW BOARDS OFFICE,0,0,0,0,0,0,0,0,0,0,0,0,0,0,0,0,0,0,0,0,0,0,0,0,0,0,0,0,0,0,0,0,0,0,0,0,0,0,0,0,0,0,0
AF2N-AIR FORCE CENTER FOR STUDIES AND ANALYSES,0,0,0,0,0,0,0,0,0,0,0,0,0,0,0,0,0,0,0,0,0,0,2,0,0,0,0,0,0,0,2,0,0,0,0,0,0,0,0,0,0,2,2
AF2Q-AIR WEATHER SERVICE,0,0,0,0,0,0,0,0,0,0,0,0,0,0,0,0,0,0,0,0,0,0,0,0,0,0,0,0,0,0,0,0,0,0,0,0,0,0,0,0,0,0,0
AF2R-AIR FORCE PROGRAM EXECUTIVE OFFICE,0,0,0,0,0,0,0,0,0,0,0,0,0,0,0,0,0,0,0,0,0,0,0,0,0,0,0,0,0,0,0,0,0,0,0,0,0,0,0,0,0,0,0
AF2S-HQ NORAD,0,0,0,0,0,0,0,0,0,0,0,0,0,0,0,0,0,0,0,0,0,1,0,0,0,0,1,0,0,0,2,0,0,0,0,0,0,0,0,0,0,2,2
AF2T-AIR FORCE SUPPLY CENTER,0,0,0,0,0,0,0,0,0,0,0,0,0,0,0,0,0,0,0,0,0,0,0,0,0,0,0,0,0,0,0,0,0,0,0,0,0,0,0,0,0,0,0
"AF2U-AIR FORCE MORALE, WELFARE AND RECREATION CENTER",0,0,0,0,0,0,0,0,0,0,0,0,0,0,0,0,0,0,0,0,0,1,1,0,0,0,0,0,0,0,2,0,0,0,0,0,0,0,0,0,0,2,2
AF2W-11TH WING,4,0,0,0,0,0,0,0,0,4,0,0,0,0,0,0,0,0,0,0,4,1,4,0,0,0,0,0,0,0,5,1,0,0,0,0,0,0,0,1,0,6,10
AF2Y-AIR FORCE PENTAGON COMMUNICATIONS AGENCY,0,0,0,0,0,0,0,0,0,0,0,0,0,0,0,0,0,0,0,0,0,0,0,0,0,0,0,0,0,0,0,0,0,0,0,0,0,0,0,0,0,0,0
AF2Z-HQ AIR FORCE MEDICAL OPERATIONS AGENCY,0,0,0,0,0,0,0,0,0,0,0,0,0,0,0,0,0,0,0,0,0,0,0,0,0,0,0,0,0,0,0,0,0,0,0,0,0,0,0,0,0,0,0
AF34-AIR NATIONAL GUARD UNITS (MOBILIZATION) (TITLE 5),1,0,0,0,0,0,0,0,0,1,0,0,0,0,0,0,0,0,0,0,1,0,5,0,0,0,1,0,0,0,6,0,0,0,0,0,0,0,0,0,0,6,7
"AF3C-AIR FORCE ELEMENTS, U.S. CENTRAL COMMAND",0,0,0,0,0,0,0,0,0,0,0,0,0,0,0,0,0,0,0,0,0,0,0,0,0,0,1,0,0,0,1,0,0,0,0,0,1,0,0,1,0,2,2
"AF3D-AIR FORCE ELEMENTS, U.S. SPECIAL OPERATIONS COMMAND",1,1,0,0,0,0,0,0,0,2,0,0,0,0,0,0,0,0,0,0,2,0,2,0,0,0,2,0,0,0,4,0,0,0,0,0,0,0,0,0,0,4,6
"AF3N-AIR FORCE ELEMENTS, U.S. ATLANTIC COMMAND",0,0,0,0,0,0,0,0,0,0,0,0,0,0,0,0,0,0,0,0,0,0,1,0,0,0,0,0,0,0,1,0,0,0,0,0,1,0,0,1,0,2,2
"AF3Q-AIR FORCE ELEMENTS, U.S. STRATEGIC COMMAND",0,1,0,0,0,0,0,0,0,1,0,0,0,0,0,0,0,0,0,0,1,0,2,0,0,0,0,0,0,0,2,1,0,0,0,0,0,0,0,1,0,3,4
"AF3S-HEADQUARTERS, U.S. SPACE COMMAND AND NORAD",0,0,0,0,0,0,0,0,0,0,0,0,0,0,0,0,0,0,0,0,0,0,0,0,0,0,0,0,0,0,0,0,0,0,0,0,0,0,0,0,0,0,0
"AF3T-AIR FORCE ELEMENTS, U.S. TRANSPORTATION COMMAND",0,0,0,0,0,0,0,0,0,0,0,0,0,0,0,0,0,0,0,0,0,0,0,0,0,0,0,0,0,0,0,0,0,0,0,0,0,0,0,0,0,0,0
"AF3V-AIR FORCE ELEMENTS, OTHER THAN EUROPE",0,0,0,0,0,0,0,0,0,0,0,0,0,0,0,0,0,0,0,0,0,0,1,0,0,0,5,0,0,0,6,0,0,0,0,0,0,0,0,0,0,6,6
AF3W-AIR FORCE CENTER FOR ENVIRONMENTAL EXCELLENCE,1,0,0,0,0,0,0,0,0,1,0,0,0,0,0,0,0,0,0,0,1,0,0,0,0,0,0,0,0,0,0,1,0,0,0,0,0,0,0,1,0,1,2
AF3Y-AIR FORCE FREQUENCY MANAGEMENT AGENCY,0,0,0,0,0,0,0,0,0,0,0,0,0,0,0,0,0,0,0,0,0,0,0,0,0,0,0,0,0,0,0,0,0,0,0,0,0,0,0,0,0,0,0
"AF4D-AIR FORCE ELEMENTS, U.S. NORTHERN COMMAND",0,0,0,0,0,0,0,0,0,0,0,0,0,0,0,0,0,0,0,0,0,0,1,0,0,0,1,0,0,0,2,0,0,0,0,0,0,0,0,0,0,2,2
AF4W-AIR FORCE DISTRICT OF WASHINGTON,0,0,0,0,0,0,0,0,0,0,0,0,0,0,0,0,0,0,0,0,0,0,0,0,0,0,0,0,0,0,0,0,0,0,0,0,0,0,0,0,0,0,0
AF5J-AIR FORCE FINANCIAL SERVICES,0,0,0,0,0,0,0,0,0,0,0,0,0,0,0,0,0,0,0,0,0,0,0,0,0,0,0,0,0,0,0,0,0,0,0,0,0,0,0,0,0,0,0
AF5K-AIR FORCE PETROLEUM AGENCY,0,0,0,0,0,0,0,0,0,0,0,0,0,0,0,0,0,0,0,0,0,0,0,0,0,0,0,0,0,0,0,0,0,0,0,0,0,0,0,0,0,0,0
AFNG-AIR NATIONAL GUARD UNITS (TITLE 32),0,0,0,0,0,0,0,0,0,0,0,0,0,0,0,0,0,0,0,0,0,0,0,0,0,0,116,0,0,0,116,1,4,0,0,0,281,0,0,286,0,402,402
"AFZG-U.S. SPECIAL OPERATIONS COMMAND (ANG, TITLE 32)",0,0,0,0,0,0,0,0,0,0,0,0,0,0,0,0,0,0,0,0,0,0,0,0,0,0,1,0,0,0,1,0,0,0,0,0,9,0,0,9,0,10,10
AFZS-U.S. SPECIAL OPERATIONS COMMAND (AIR FORCE),0,0,0,0,0,0,0,0,0,0,0,0,0,0,0,0,0,0,0,0,0,0,0,0,0,0,0,0,0,0,0,0,0,0,0,0,0,0,0,0,0,0,0
AG01-OFFICE OF THE SECRETARY OF AGRICULTURE,0,0,0,0,0,0,0,0,0,0,0,0,0,0,0,0,0,0,0,0,0,0,0,0,0,0,0,0,0,0,0,0,0,0,1,0,0,0,0,1,0,1,1
AG02-AGRICULTURAL MARKETING SERVICE,0,0,0,0,0,0,0,0,0,0,0,0,0,0,0,0,0,0,0,0,0,0,7,1,1,0,0,0,0,0,9,0,16,1,0,0,0,0,0,17,0,26,26
AG03-AGRICULTURAL RESEARCH SERVICE,1,1,0,0,0,0,0,0,0,2,0,0,0,0,0,0,0,0,0,0,2,2,30,0,0,0,0,0,0,0,32,7,24,32,0,0,0,0,0,63,0,95,97
AG07-RURAL HOUSING SERVICE,2,0,0,0,0,0,0,0,0,2,0,0,0,0,0,0,0,0,0,0,2,2,15,0,4,0,0,0,0,0,21,2,1,2,1,0,1,0,0,7,0,28,30
AG08-RISK MANAGEMENT AGENCY,0,0,0,0,0,0,0,0,0,0,0,0,0,0,0,0,0,0,0,0,0,0,0,0,0,0,0,0,0,0,0,0,0,0,0,0,0,0,0,0,0,0,0
AG10-FOREIGN AGRICULTURAL SERVICE,0,0,0,0,0,0,0,0,0,0,0,0,0,0,0,0,0,0,0,0,0,0,0,0,0,0,0,0,0,0,0,0,0,0,0,0,1,0,0,1,0,1,1
AG11-FOREST SERVICE,10,3,0,0,0,0,0,0,0,13,0,0,0,0,0,0,0,0,0,0,13,5,41,0,22,0,19,0,0,0,87,417,28,67,0,0,4,0,0,516,0,603,616
AG13-OFFICE OF COMMUNICATIONS,0,0,0,0,0,0,0,0,0,0,0,0,0,0,0,0,0,0,0,0,0,0,1,0,0,0,0,0,0,0,1,0,0,0,1,0,0,0,0,1,0,2,2
AG14-OFFICE OF THE GENERAL COUNSEL,0,0,0,0,0,0,0,0,0,0,0,0,0,0,0,0,0,0,0,0,0,0,1,0,0,0,0,1,0,0,2,0,0,0,0,0,0,0,0,0,0,2,2
AG15-RURAL UTILITIES SERVICE,0,0,0,0,0,0,0,0,0,0,0,0,0,0,0,0,0,0,0,0,0,1,0,0,0,0,0,0,0,0,1,0,0,0,0,0,0,0,0,0,0,1,1
AG16-NATURAL RESOURCES CONSERVATION SERVICE,4,0,0,0,0,0,0,0,0,4,0,0,0,0,0,0,0,0,0,0,4,2,10,0,1,0,0,0,0,0,13,7,11,4,0,0,1,0,0,23,0,36,40
AG18-ECONOMIC RESEARCH SERVICE,0,0,0,0,0,0,0,0,0,0,0,0,0,0,0,0,0,0,0,0,0,0,0,0,0,0,0,0,0,0,0,0,0,0,0,0,0,0,0,0,0,0,0
AG20-NATIONAL AGRICULTURAL STATISTICS SERVICE,0,0,0,0,0,0,0,0,0,0,0,0,0,0,0,0,0,0,0,0,0,0,5,0,0,0,0,0,0,0,5,0,0,0,0,0,0,0,0,0,0,5,5
"AG22-COOPERATIVE STATE RESEARCH, EDUCATION, AND EXTENSION SERVICE",1,0,0,0,0,0,0,0,0,1,0,0,0,0,0,0,0,0,0,0,1,0,1,0,0,0,0,0,0,0,1,0,0,0,0,0,1,0,0,1,0,2,3
AG23-OFFICE OF THE INSPECTOR GENERAL,1,0,0,0,0,0,0,0,0,1,0,0,0,0,0,0,0,0,0,0,1,0,0,0,0,0,0,0,0,0,0,0,0,0,0,0,0,0,0,0,0,0,1
AG30-FOOD AND NUTRITION SERVICE,0,0,0,0,0,0,0,0,0,0,0,0,0,0,0,0,0,0,0,0,0,1,2,0,0,0,0,0,0,0,3,0,0,0,0,0,0,0,0,0,0,3,3
AG32-RURAL BUSINESS-COOPERATIVE SERVICE,0,0,0,0,0,0,0,0,0,0,0,0,0,0,0,0,0,0,0,0,0,0,0,0,0,0,0,0,0,0,0,0,0,0,0,0,0,0,0,0,0,0,0
AG34-ANIMAL AND PLANT HEALTH INSPECTION SERVICE,7,0,0,0,0,0,0,0,0,7,0,0,0,0,0,0,0,0,0,0,7,3,18,0,1,0,0,0,0,0,22,17,42,7,0,0,1,0,0,67,0,89,96
"AG36-GRAIN INSPECTION, PACKERS AND STOCKYARDS ADMINISTRATION",0,0,0,0,0,0,0,0,0,0,0,0,0,0,0,0,0,0,0,0,0,0,1,0,0,0,0,0,0,0,1,0,2,0,0,0,0,0,0,2,0,3,3
AG37-FOOD SAFETY AND INSPECTION SERVICE,0,0,0,0,0,0,0,0,0,0,0,0,0,0,0,0,0,0,0,0,0,1,37,0,0,0,0,0,0,0,38,1,15,0,0,0,0,0,0,16,0,54,54
AG38-OFFICE OF THE CHIEF ECONOMIST,0,0,0,0,0,0,0,0,0,0,0,0,0,0,0,0,0,0,0,0,0,0,0,0,0,0,0,0,0,0,0,0,0,0,0,0,0,0,0,0,0,0,0
AG42-OFFICE OF BUDGET AND PROGRAM ANALYSIS,0,0,0,0,0,0,0,0,0,0,0,0,0,0,0,0,0,0,0,0,0,0,0,0,0,0,0,0,0,0,0,0,0,0,0,0,0,0,0,0,0,0,0
AG90-OFFICE OF THE CHIEF FINANCIAL OFFICER,1,0,0,0,0,0,0,0,0,1,0,0,0,0,0,0,0,0,0,0,1,7,0,0,0,0,0,0,0,0,7,0,0,0,1,0,0,0,0,1,0,8,9
AGCR-OFFICE OF CIVIL RIGHTS,0,0,0,0,0,0,0,0,0,0,0,0,0,0,0,0,0,0,0,0,0,0,0,0,0,0,0,0,0,0,0,0,0,0,0,0,0,0,0,0,0,0,0
AGDA-DEPARTMENTAL ADMINISTRATION,1,0,0,0,0,0,0,0,0,1,0,0,0,0,0,0,0,0,0,0,1,0,1,0,0,0,0,0,0,0,1,0,0,0,0,0,0,0,0,0,0,1,2
AGES-OFFICE OF THE EXECUTIVE SECRETARIAT,0,0,0,0,0,0,0,0,0,0,0,0,0,0,0,0,0,0,0,0,0,0,0,0,0,0,0,0,0,0,0,0,0,0,0,0,0,0,0,0,0,0,0
AGFA-FARM SERVICE AGENCY,1,0,0,0,0,0,0,0,0,1,0,0,0,0,0,0,0,0,0,0,1,0,7,0,0,0,1,0,0,0,8,0,0,0,0,0,0,0,0,0,0,8,9
AGHL-HOMELAND SECURITY STAFF,0,0,0,0,0,0,0,0,0,0,0,0,0,0,0,0,0,0,0,0,0,0,0,0,0,0,0,0,0,0,0,0,0,0,0,0,0,0,0,0,0,0,0
AGHS-HOMELAND SECURITY STAFF,0,0,0,0,0,0,0,0,0,0,0,0,0,0,0,0,0,0,0,0,0,0,0,0,0,0,0,0,0,0,0,0,0,0,0,0,0,0,0,0,0,0,0
AGIT-OFFICE OF THE CHIEF INFORMATION OFFICER,0,2,0,0,0,0,1,0,0,3,0,0,0,0,0,0,0,0,0,0,3,2,2,0,0,0,0,0,0,0,4,1,0,0,0,0,0,0,0,1,0,5,8
AGNA-NATIONAL APPEALS DIVISION,0,0,0,0,0,0,0,0,0,0,0,0,0,0,0,0,0,0,0,0,0,0,0,0,0,0,0,0,0,0,0,0,0,0,0,0,0,0,0,0,0,0,0
AH01-NATIONAL ENDOWMENT FOR THE ARTS,0,0,0,0,0,0,0,0,0,0,0,0,0,0,0,0,0,0,0,0,0,0,2,0,0,0,1,0,0,0,3,0,0,0,0,0,0,0,0,0,0,3,3
AH02-NATIONAL ENDOWMENT FOR THE HUMANITIES,1,0,0,0,0,0,0,0,0,1,0,0,0,0,0,0,0,0,0,0,1,0,0,0,0,0,0,0,0,0,0,0,0,0,0,2,0,0,0,2,0,2,3
AH03-INSTITUTE OF MUSEUM AND LIBRARY SERVICES,0,0,0,0,0,0,0,0,0,0,0,0,0,0,0,0,0,0,0,0,0,0,0,0,0,0,1,0,0,0,1,0,0,0,0,1,1,0,0,2,0,3,3
AI00-U.S. INSTITUTE OF PEACE,0,0,0,0,0,0,0,0,0,0,0,0,0,0,0,0,0,0,0,0,0,0,0,0,0,0,0,0,0,0,0,0,0,0,0,0,3,0,0,3,0,3,3
AM00-AGENCY FOR INTERNATIONAL DEVELOPMENT,0,0,0,0,0,0,0,0,0,0,0,0,0,0,0,0,0,0,0,0,0,0,1,2,0,0,0,0,0,0,3,2,0,0,0,0,8,0,0,10,0,13,13
AN00-AFRICAN DEVELOPMENT FOUNDATION,0,0,0,0,0,0,0,0,0,0,0,0,0,0,0,0,0,0,0,0,0,0,0,0,0,0,0,0,0,0,0,0,0,0,0,0,0,0,0,0,0,0,0
AP00-APPALACHIAN REGIONAL COMMISSION,0,0,0,0,0,0,0,0,0,0,0,0,0,0,0,0,0,0,0,0,0,0,0,0,0,0,0,0,0,0,0,0,0,0,0,0,0,0,0,0,0,0,0
AR**-UNSPECIFIED,0,0,0,0,0,0,0,0,0,0,0,0,0,0,0,0,0,0,0,0,0,0,0,0,0,0,1,0,0,0,1,0,0,0,0,0,0,0,0,0,0,1,1
AR3A-U.S. ARMY CENTRAL,0,0,0,0,0,0,0,0,0,0,0,0,0,0,0,0,0,0,0,0,0,0,0,0,0,0,0,0,0,0,0,0,0,0,0,0,0,0,0,0,0,0,0
AR5A-U.S. ARMY NORTH,0,0,0,0,0,0,0,0,0,0,0,0,0,0,0,0,0,0,0,0,0,0,0,0,0,0,0,0,0,0,0,0,0,0,0,0,0,0,0,0,0,0,0
ARAC-U.S. ARMY CONTRACTING AGENCY,4,2,0,0,0,0,0,0,0,6,0,0,0,0,0,0,0,0,0,0,6,1,6,0,1,0,0,0,0,0,8,0,1,1,0,0,0,0,0,2,0,10,16
ARAE-U.S. ARMY ACQUISITION SUPPORT CENTER,2,0,0,0,0,0,0,0,0,2,0,0,0,0,0,0,0,0,0,1,3,1,9,0,1,0,0,0,0,0,11,3,1,1,0,0,1,0,0,6,0,17,20
ARAS-U.S. ARMY INTELLIGENCE AND SECURITY COMMAND,0,0,0,0,0,0,0,0,0,0,0,0,0,0,0,0,0,0,0,0,0,0,0,0,0,0,16,0,0,0,16,0,0,0,0,0,1,0,0,1,0,17,17
ARAT-U.S. ARMY TEST AND EVALUATION COMMAND,1,0,0,0,0,0,0,0,0,1,0,0,0,0,0,0,0,0,0,0,1,0,9,1,8,0,3,0,0,0,21,3,0,0,0,0,0,0,0,3,0,24,25
ARAU-U.S. ARMY AUDIT AGENCY,0,0,0,0,0,0,0,0,0,0,0,0,0,0,0,0,0,0,0,0,0,0,0,0,0,0,0,0,0,0,0,0,0,0,0,0,0,0,0,0,0,0,0
ARBA-U.S. ARMY INSTALLATION MANAGEMENT COMMAND,30,2,0,0,0,0,0,0,0,32,0,0,0,0,0,0,0,0,0,0,32,19,153,6,0,0,40,0,0,0,218,90,53,2,0,0,9,0,0,154,0,372,404
ARCB-U.S. ARMY CRIMINAL INVESTIGATION COMMAND,0,0,0,0,0,0,0,0,0,0,0,0,0,0,0,0,0,0,0,0,0,0,3,0,0,0,0,0,0,0,3,0,0,0,0,0,0,0,0,0,0,3,3
ARCE-U.S. ARMY CORPS OF ENGINEERS,9,3,0,0,0,1,0,0,0,13,0,0,0,0,0,0,0,0,0,0,13,8,22,2,10,0,4,1,0,0,47,75,83,23,0,0,2,0,0,183,0,230,243
ARCS-IMMEDIATE OFFICE OF THE CHIEF OF STAFF OF THE ARMY,1,1,0,0,0,0,1,0,0,3,0,0,0,0,0,0,0,0,0,0,3,2,6,0,0,0,1,0,0,0,9,0,0,0,0,0,0,0,0,0,0,9,12
ARE1-IMMEDIATE OFFICE OF THE COMMANDER-IN-CHIEF OF THE U.S. ARMY EUROPE AND SEVENTH ARMY,1,0,0,0,0,0,0,0,0,1,0,0,0,0,0,0,0,0,0,0,1,1,2,0,0,0,0,0,0,0,3,6,9,0,0,0,0,0,0,15,0,18,19
ARE2-21ST THEATER SUSTAINMENT COMMAND (TSC),0,0,0,0,0,0,0,0,0,0,0,0,0,0,0,0,0,0,0,0,0,0,3,0,0,0,0,0,0,0,3,0,6,0,0,0,0,0,0,6,0,9,9
ARE3-U.S. ARMY SOUTHERN EURPOEAN TASK FORCE,0,0,0,0,0,0,0,0,0,0,0,0,0,0,0,0,0,0,0,0,0,0,0,0,0,0,0,0,0,0,0,0,0,0,0,0,0,0,0,0,0,0,0
ARE5-U.S. ARMY V CORPS,1,0,0,0,0,0,0,0,0,1,0,0,0,0,0,0,0,0,0,0,1,0,0,0,0,0,0,0,0,0,0,2,8,0,0,0,0,0,0,10,0,10,11
AREB-1ST PERSONNEL COMMAND,0,0,0,0,0,0,0,0,0,0,0,0,0,0,0,0,0,0,0,0,0,0,0,0,0,0,0,0,0,0,0,2,5,0,0,0,1,0,0,8,0,8,8
AREN-SEVENTH ARMY TRAINING COMMAND,0,0,0,0,0,0,0,0,0,0,0,0,0,0,0,0,0,0,0,0,0,0,3,0,0,0,2,0,0,0,5,0,1,0,0,0,0,0,0,1,0,6,6
ARFC-U.S. ARMY FORCES COMMAND,4,1,0,0,0,0,0,0,0,5,0,0,0,0,0,0,0,0,0,0,5,0,15,0,0,0,4,0,0,0,19,7,1,0,0,0,2,0,0,10,1,30,35
ARFL-U.S. ARMY SOUTH COMMAND,0,0,0,0,0,0,0,0,0,0,0,0,0,0,0,0,0,0,0,0,0,0,0,0,0,0,0,0,0,0,0,0,2,0,0,0,0,0,0,2,0,2,2
ARG6-U.S. ARMY NETWORK ENTERPRISE TECHNOLOGY COMMAND/9TH ARMY SIGNAL COMMAND,2,0,0,0,0,0,0,0,0,2,0,0,0,0,0,0,0,0,0,0,2,0,5,0,0,0,1,0,0,0,6,1,1,0,0,0,0,0,0,2,0,8,10
ARGB-OFFICE OF THE CHIEF OF THE NATIONAL GUARD BUREAU,0,0,0,0,0,0,0,0,0,0,0,0,0,0,0,0,0,0,0,0,0,0,3,0,0,0,1,0,0,0,4,0,0,0,0,0,0,0,0,0,0,4,4
ARHR-U.S. ARMY RESERVE COMMAND,2,0,0,0,0,0,0,0,0,2,0,0,0,0,0,0,0,0,0,0,2,0,47,0,0,0,21,0,0,0,68,4,0,0,0,0,0,0,0,4,0,72,74
ARJ1-U.S. ARMY ELEMENT SHAPE,0,0,0,0,0,0,0,0,0,0,0,0,0,0,0,0,0,0,0,0,0,0,1,0,0,0,0,0,0,0,1,0,0,0,0,0,0,0,0,0,0,1,1
ARJA-JOINT ACTIVITIES,0,2,0,0,0,0,0,0,0,2,0,0,0,0,0,0,0,0,0,0,2,0,5,0,0,0,7,0,0,0,12,1,1,0,0,0,0,0,0,2,0,14,16
ARMA-U.S. MILITARY ACADEMY,1,0,0,0,0,0,0,0,0,1,0,0,0,0,0,0,0,0,0,0,1,0,1,0,0,0,1,0,0,0,2,1,0,0,0,0,0,0,0,1,0,3,4
ARMC-U.S. ARMY MEDICAL COMMAND,18,9,0,0,0,0,0,0,0,27,0,0,0,0,0,0,0,0,0,0,27,26,230,0,0,0,31,0,0,0,287,70,25,2,0,0,3,0,0,100,0,387,414
ARMP-U.S. ARMY HUMAN RESOURCES COMMAND,1,2,0,0,0,0,0,0,0,3,0,0,0,0,0,0,0,0,0,0,3,4,8,0,0,0,4,0,0,0,16,0,1,0,0,0,0,0,0,1,0,17,20
ARMT-MILITARY SURFACE DEPLOYMENT AND DISTRIBUTION COMMAND,0,0,0,0,0,0,0,0,0,0,0,0,0,0,0,0,0,0,0,0,0,0,2,0,0,0,3,0,0,0,5,1,0,0,0,0,1,0,0,2,0,7,7
ARMW-U.S. ARMY MILITARY DISTRICT OF WASHINGTON,0,1,0,0,0,0,0,0,0,1,0,0,0,0,0,0,0,0,0,0,1,0,4,0,0,0,1,0,0,0,5,1,0,0,0,0,0,0,0,1,0,6,7
ARNG-ARMY NATIONAL GUARD UNITS (TITLE 32),0,0,0,0,0,0,0,0,0,0,0,0,0,0,0,0,0,0,0,0,0,0,2,0,0,0,127,0,0,0,129,1,28,0,0,0,150,0,0,179,0,308,308
"ARP1-U.S. ARMY, PACIFIC",2,1,0,0,0,0,0,0,0,3,0,0,0,0,0,0,0,0,0,0,3,0,5,0,0,0,1,0,0,0,6,2,1,0,0,0,0,0,0,3,0,9,12
ARP8-EIGHTH U.S. ARMY,0,0,0,0,0,0,0,0,0,0,0,0,0,0,0,0,0,0,0,0,0,0,0,0,0,0,1,0,0,0,1,0,3,0,0,0,0,0,0,3,0,4,4
ARPC-MILITARY ENTRANCE PROCESSING COMMAND,0,0,0,0,0,0,0,0,0,0,0,0,0,0,0,0,0,0,0,0,0,0,0,0,0,0,0,0,0,0,0,0,0,0,0,0,0,0,0,0,0,0,0
ARRC-U.S. ARMY RECRUITING COMMAND,0,0,0,0,0,0,0,0,0,0,0,0,0,0,0,0,0,0,0,0,0,0,0,0,0,0,0,0,0,0,0,0,0,0,0,0,0,0,0,0,0,0,0
ARSA-OFFICE OF THE SECRETARY OF THE ARMY,0,0,0,0,0,0,0,0,0,0,0,0,0,0,0,0,0,0,0,0,0,0,1,0,0,0,0,0,0,0,1,0,0,0,0,0,1,0,0,1,1,3,3
ARSB-FIELD OPERATING OFFICES OF THE OFFICE OF THE SECRETARY OF THE ARMY,8,0,0,0,0,0,0,0,0,8,0,0,0,0,0,0,0,0,0,0,8,1,6,0,1,0,3,0,0,0,11,0,0,0,0,0,0,0,0,0,0,11,19
ARSC-U. S. ARMY SPACE AND MISSILE DEFENSE COMMAND/U. S. ARMY FORCES STRATEGIC COMMAND,0,0,0,0,0,0,0,0,0,0,0,0,0,0,0,0,0,0,0,0,0,0,1,0,1,0,2,0,0,0,4,0,0,0,0,0,0,0,0,0,0,4,4
ARSE-FIELD OPERATING AGENCIES OF THE ARMY STAFF RESOURCED THROUGH OA-22,5,0,0,0,0,0,0,0,0,5,0,0,0,0,0,0,0,0,0,0,5,2,9,0,1,0,0,0,0,0,12,2,0,0,0,0,0,0,0,2,0,14,19
ARSF-FIELD OPERATING AGENCIES OF THE ARMY STAFF,0,0,0,0,0,0,0,0,0,0,0,0,0,0,0,0,0,0,0,0,0,0,1,0,0,0,0,0,0,0,1,0,0,0,0,0,1,0,0,1,0,2,2
"ARSJ-JOINT SERVICES AND ACTIVITIES SUPPORTED BY THE OFFICE, SECRETARY OF THE ARMY",0,0,0,0,0,0,0,0,0,0,0,0,0,0,0,0,0,0,0,0,0,0,3,0,0,0,0,0,0,0,3,0,1,0,0,0,3,0,0,4,0,7,7
ARSO-U.S. ARMY SOUTH,0,0,0,0,0,0,0,0,0,0,0,0,0,0,0,0,0,0,0,0,0,0,0,0,0,0,0,0,0,0,0,0,0,0,0,0,0,0,0,0,0,0,0
ARSP-U.S. SPECIAL OPERATIONS COMMAND (ARMY),1,1,0,0,0,0,0,0,0,2,0,0,0,0,0,0,0,0,0,0,2,0,3,0,0,0,1,0,0,0,4,8,1,2,0,0,1,0,0,12,0,16,18
"ARSS-STAFF SUPPORT AGENCIES OF THE CHIEF OF STAFF, ARMY",0,0,0,0,0,0,0,0,0,0,0,0,0,0,0,0,0,0,0,0,0,0,1,0,0,0,0,0,0,0,1,0,0,0,0,0,0,0,0,0,0,1,1
ARTA-U.S. ARMY ACCESSIONS COMMAND,3,0,0,0,0,0,0,0,0,3,0,0,0,0,0,0,0,0,0,0,3,2,7,0,0,0,3,0,0,0,12,7,0,0,0,0,1,0,0,8,0,20,23
ARTC-U.S. ARMY TRAINING AND DOCTRINE COMMAND,6,2,0,0,0,0,0,0,0,8,0,0,0,0,0,0,0,0,0,0,8,2,38,0,0,0,18,0,0,0,58,29,30,4,0,0,11,0,0,74,1,133,141
ARTM-U.S. MILITARY ENTRANCE PROCESSING COMMAND,3,1,0,0,0,0,0,0,0,4,0,0,0,0,0,0,0,0,0,0,4,2,23,0,0,0,6,0,0,0,31,0,0,0,0,0,0,0,0,0,0,31,35
ARTW-U.S. ARMY WAR COLLEGE,1,0,0,0,0,0,0,0,0,1,0,0,0,0,0,0,0,0,0,0,1,0,2,0,0,0,0,0,0,0,2,0,0,0,0,0,4,0,0,4,0,6,7
"ARX2-HEADQUARTERS, AMC",0,0,0,0,0,0,0,0,0,0,0,0,0,0,0,0,0,0,0,0,0,0,0,0,0,0,0,0,0,0,0,0,0,0,0,0,0,0,0,0,0,0,0
"ARX3-HEADQUARTERS, STAFF SUPPORT ACTIVITIES, AMC",0,0,0,0,0,0,0,0,0,0,0,0,0,0,0,0,0,0,0,0,0,0,0,0,0,0,0,0,0,0,0,0,0,0,0,0,0,0,0,0,0,0,0
"ARX4-TRAINING ACTIVITIES, AMC",0,0,0,0,0,0,0,0,0,0,0,0,0,0,0,0,0,0,0,0,0,0,0,0,0,0,0,0,0,0,0,0,0,0,0,0,0,0,0,0,0,0,0
ARX6-U.S. ARMY AVIATION AND MISSILE COMMAND,1,2,0,0,0,0,0,0,0,3,0,0,0,0,0,0,0,0,0,0,3,2,19,0,2,0,4,0,0,0,27,2,0,1,0,0,0,0,0,3,0,30,33
ARX7-U.S. ARMY TANK-AUTOMOTIVE AND ARMAMENT COMMAND (TACOM),5,0,0,0,0,0,0,0,0,5,0,0,0,0,0,0,0,0,0,0,5,5,15,1,27,0,2,0,0,0,50,12,8,0,0,0,4,0,0,24,0,74,79
ARX8-U.S. ARMY COMMUNICATIONS ELECTRONICS COMMAND,1,0,0,0,0,0,0,0,0,1,0,0,0,0,0,0,0,0,0,0,1,2,20,0,25,0,7,0,0,0,54,2,0,2,0,0,0,0,0,4,0,58,59
"ARX9-U.S. ARMY SIMULATION, TRAINING AND INSTRUMENTATION COMMAND",0,0,0,0,0,0,0,0,0,0,0,0,0,0,0,0,0,0,0,0,0,0,0,0,0,0,0,0,0,0,0,0,0,0,0,0,0,0,0,0,0,0,0
ARXA-U.S. ARMY CHEMICAL AND BIOLOGICAL DEFENSE COMMAND,0,0,0,0,0,0,0,0,0,0,0,0,0,0,0,0,0,0,0,0,0,0,0,0,0,0,0,0,0,0,0,0,0,0,0,0,0,0,0,0,0,0,0
ARXB-U.S. ARMY CHEMICAL MATERIALS AGENCY,2,0,0,0,0,0,0,0,0,2,0,0,0,0,0,0,0,0,0,0,2,2,11,0,0,0,1,0,0,0,14,0,0,0,0,0,0,0,0,0,0,14,16
ARXC-U.S. ARMY SUSTAINMENT COMMAND,0,0,0,0,0,0,0,0,0,0,0,0,0,0,0,0,0,0,0,0,0,0,0,0,0,0,0,0,0,0,0,0,0,0,0,0,0,0,0,0,0,0,0
ARXD-U.S. ARMY RESEARCH LABORATORY COMMAND,0,0,0,0,0,0,0,0,0,0,0,0,0,0,0,0,0,0,0,0,0,0,0,0,0,0,0,0,0,0,0,0,0,0,0,0,0,0,0,0,0,0,0
ARXK-MATERIEL ACQUISITION ACTIVITIES,0,0,0,0,0,0,0,0,0,0,0,0,0,0,0,0,0,0,0,0,0,0,0,0,0,0,0,0,0,0,0,0,0,0,0,0,0,0,0,0,0,0,0
ARXL-MATERIEL ACQUISITION PROJECT MANAGERS,0,0,0,0,0,0,0,0,0,0,0,0,0,0,0,0,0,0,0,0,0,0,0,0,0,0,0,0,0,0,0,0,0,0,0,0,0,0,0,0,0,0,0
ARXP-U.S. ARMY SECURITY ASSISTANCE COMMAND,0,0,0,0,0,0,0,0,0,0,0,0,0,0,0,0,0,0,0,0,0,0,0,0,0,0,0,0,0,0,0,1,0,0,0,0,0,0,0,1,0,1,1
ARXQ-U.S. ARMY JOINT MUNITIONS COMMAND,3,0,0,0,0,0,0,0,0,3,0,0,0,0,0,0,0,0,0,0,3,0,2,0,0,0,9,0,0,0,11,16,4,0,0,0,1,0,0,21,0,32,35
"ARXR-U.S. ARMY RESEARCH, DEVELOPMENT AND ENGINEERING COMMAND",3,2,0,0,0,0,0,0,0,5,0,0,0,0,0,0,0,0,0,0,5,1,23,0,18,0,9,0,0,0,51,7,0,2,0,0,0,0,0,9,0,60,65
ARXT-U.S. ARMY MILITARY SURFACE DEPLOYMENT AND DISTRIBUTION COMMAND,0,0,0,0,0,0,0,0,0,0,0,0,0,0,0,0,0,0,0,0,0,0,0,0,0,0,0,0,0,0,0,0,0,0,0,0,0,0,0,0,0,0,0
ARXX-MATERIEL READINESS ACTIVITIES,0,0,0,0,0,0,0,0,0,0,0,0,0,0,0,0,0,0,0,0,0,0,0,0,0,0,1,0,0,0,1,0,0,0,0,0,0,0,0,0,0,1,1
AU00-FEDERAL LABOR RELATIONS AUTHORITY,0,0,0,0,0,0,0,0,0,0,0,0,0,0,0,0,0,0,0,0,0,1,0,0,0,0,0,0,0,0,1,0,0,0,0,0,0,0,0,0,0,1,1
AW00-ARCTIC RESEARCH COMMISSION,0,0,0,0,0,0,0,0,0,0,0,0,0,0,0,0,0,0,0,0,0,0,0,0,0,0,0,0,0,0,0,0,0,0,0,0,0,0,0,0,0,0,0
BD00-MERIT SYSTEMS PROTECTION BOARD,0,0,0,0,0,0,0,0,0,0,0,0,0,0,0,0,0,0,0,0,0,0,0,3,0,0,0,0,0,0,3,0,0,0,0,0,0,0,0,0,0,3,3
BF00-DEFENSE NUCLEAR FACILITIES SAFETY BOARD,0,0,0,0,0,0,0,0,0,0,0,0,0,0,0,0,0,0,0,0,0,0,0,0,0,0,0,0,0,0,0,0,0,0,0,0,0,0,0,0,0,0,0
BG00-PENSION BENEFIT GUARANTY CORPORATION,3,1,0,0,0,0,0,0,0,4,0,0,0,0,0,0,0,0,0,0,4,0,9,0,0,0,0,0,0,0,9,0,0,0,0,0,0,0,0,0,0,9,13
BO00-OFFICE OF MANAGEMENT AND BUDGET,0,0,0,0,0,0,0,0,0,0,0,0,0,0,0,0,0,0,0,0,0,0,1,0,0,0,0,0,0,0,1,0,0,0,1,0,0,0,0,1,0,2,2
BT00-ARCHITECTURAL AND TRANSPORTATION BARRIERS COMPLIANCE BOARD,0,0,0,0,0,0,0,0,0,0,0,0,0,0,0,0,0,0,0,0,0,0,0,0,0,0,0,0,0,0,0,0,0,0,0,0,0,0,0,0,0,0,0
BW00-NUCLEAR WASTE TECHNICAL REVIEW BOARD,0,0,0,0,0,0,0,0,0,0,0,0,0,0,0,0,0,0,0,0,0,0,0,0,0,0,0,0,0,0,0,0,0,0,0,1,0,0,0,1,0,1,1
BZ00-CHRISTOPHER COLUMBUS FELLOWSHIP FOUNDATION,0,0,0,0,0,0,0,0,0,0,0,0,0,0,0,0,0,0,0,0,0,0,0,0,0,0,0,0,0,0,0,0,0,0,0,0,0,0,0,0,0,0,0
CC00-COMMISSION ON CIVIL RIGHTS,0,0,0,0,0,0,0,0,0,0,0,0,0,0,0,0,0,0,0,0,0,0,0,0,0,0,0,0,0,0,0,0,0,0,0,0,0,0,0,0,0,0,0
CE00-COUNCIL OF ECONOMIC ADVISERS,0,1,0,0,0,0,0,0,0,1,0,0,0,0,0,0,0,0,0,0,1,0,0,0,0,0,0,0,0,0,0,0,0,0,0,0,0,0,0,0,0,0,1
CF00-COMMISSION OF FINE ARTS,0,0,0,0,0,0,0,0,0,0,0,0,0,0,0,0,0,0,0,0,0,0,0,0,0,0,0,0,0,0,0,0,0,0,0,0,0,0,0,0,0,0,0
CM33-TECHNOLOGY ADMINISTRATION,0,0,0,0,0,0,0,0,0,0,0,0,0,0,0,0,0,0,0,0,0,0,0,0,0,0,0,0,0,0,0,0,0,0,0,0,0,0,0,0,0,0,0
CM51-OFFICE OF THE SECRETARY,2,0,0,0,0,0,0,0,0,2,0,0,0,0,0,0,0,0,0,0,2,0,4,0,0,0,0,0,0,0,4,0,0,0,0,0,0,0,0,0,0,4,6
CM52-ECONOMIC DEVELOPMENT ADMINISTRATION,0,0,0,0,0,0,0,0,0,0,0,0,0,0,0,0,0,0,0,0,0,0,1,0,0,0,0,0,0,0,1,0,0,0,0,0,0,0,0,0,0,1,1
CM53-BUREAU OF ECONOMIC ANALYSIS,2,1,0,0,0,0,0,0,0,3,0,0,0,0,0,0,0,0,0,0,3,0,9,0,0,0,0,0,0,0,9,0,0,0,0,0,0,0,0,0,0,9,12
CM54-NATIONAL OCEANIC AND ATMOSPHERIC ADMINISTRATION,4,3,0,0,0,0,0,0,0,7,0,0,0,0,0,0,0,0,0,0,7,1,38,9,2,0,0,0,0,0,50,3,8,4,0,0,2,0,0,17,0,67,74
