VAGB-DEPUTY ASSISTANT SECRETARY FOR SECURITY AND LAW ENFORCEMENT,0,0,0,0,0,0,0,0,0,0,0,0,0,0,0,0,0,0,0,0,0,0,0,0,0,0,0,0,0,0,0,0,0,0,0,0,0,0,0,0,0,0,0,0,0,0,0
VAGC-DEPUTY ASSISTANT SECRETARY FOR EMERGENCY MANAGEMENT,1,0,0,0,0,0,0,0,0,0,1,0,0,0,0,0,0,0,0,0,0,0,1,0,0,0,0,0,0,0,0,0,0,0,0,0,0,0,0,0,0,0,0,0,0,0,1
VAHA-IMMEDIATE OFFICE OF THE ASSISTANT SECRETARY FOR POLICY AND PLANNING,0,0,0,0,0,0,0,0,0,0,0,0,0,0,0,0,0,0,0,0,0,0,0,0,0,0,0,0,0,0,0,0,0,0,1,0,0,0,0,0,0,0,0,1,0,1,1
VAHB-DEPUTY ASSISTANT SECRETARY FOR PROGRAM AND DATA ANALYSIS,0,0,0,0,0,0,0,0,0,0,0,0,0,0,0,0,0,0,0,0,0,0,0,0,0,0,0,0,0,0,0,0,0,0,0,0,0,0,0,0,0,0,0,0,0,0,0
VAHC-DEPUTY ASSISTANT SECRETARY FOR PLANNING AND EVALUATION,0,0,0,0,0,0,0,0,0,0,0,0,0,0,0,0,0,0,0,0,0,0,0,0,0,0,0,0,0,0,0,0,0,0,0,0,0,0,0,0,0,0,0,0,0,0,0
VAHD-NATIONAL CENTER FOR VETERAN ANALYSIS AND STATISTICS,0,0,0,0,0,0,0,0,0,0,0,0,0,0,0,0,0,0,0,0,0,0,0,0,0,0,0,0,0,0,0,0,0,0,0,0,0,0,0,0,0,0,0,0,0,0,0
VAJA-OFFICE OF THE ASSISTANT SECRETARY FOR PUBLIC AND INTERGOVERNMENTAL AFFAIRS,0,0,0,0,0,0,0,0,0,0,0,0,0,0,0,0,0,0,0,0,0,0,0,0,0,0,0,0,0,0,0,0,0,0,0,0,0,0,0,0,0,0,0,0,0,0,0
VAJB-DEPUTY ASSISTANCE SECRETARY FOR INTERGOVERNMENTAL AFFAIRS,0,0,0,0,0,0,0,0,0,0,0,0,0,0,0,0,0,0,0,0,0,0,0,0,0,0,0,0,0,0,0,0,0,0,0,0,0,0,0,0,0,0,0,0,0,0,0
VAJC-DEPUTY ASSISTANT SECRETARY FOR PUBLIC AFFAIRS,0,0,0,0,0,0,0,0,0,0,0,0,0,0,0,0,0,0,0,0,0,0,0,0,0,0,0,0,0,0,0,0,0,0,0,0,1,0,0,0,0,0,0,1,0,1,1
VAKA-IMMEDIATE OFFICE OF THE ASSISTANT SECRETARY FOR CONGRESSIONAL AND LEGISLATIVE AFFAIRS,0,0,0,0,0,0,0,0,0,0,0,0,0,0,0,0,0,0,0,0,0,0,0,0,0,0,0,0,0,0,0,0,0,0,0,0,0,0,0,0,0,0,0,0,0,0,0
VAKB-DEPUTY ASSISTANT SECRETARY FOR CONGRESSIONAL AFFAIRS,0,0,0,0,0,0,0,0,0,0,0,0,0,0,0,0,0,0,0,0,0,0,0,1,0,0,0,0,0,0,0,0,0,1,1,0,0,0,0,0,0,0,0,1,0,2,2
VALA-VETERANS BENEFITS ADMINISTRATION,2,4,0,0,0,0,0,0,0,0,6,0,0,0,0,0,0,0,0,0,0,0,6,10,68,7,3,0,0,33,0,0,0,121,93,0,2,0,0,0,0,0,0,95,0,216,222
VAPA-NATIONAL CEMETERY ADMINISTRATION,1,1,0,0,0,0,0,0,0,0,2,0,0,0,0,0,0,0,0,0,0,0,2,1,7,0,0,0,0,0,0,0,0,8,14,1,2,0,0,0,3,0,0,20,0,28,30
VATA-VETERANS HEALTH ADMINISTRATION,43,37,0,0,0,0,1,0,0,0,81,0,0,0,0,0,0,0,0,0,0,0,81,38,466,48,49,0,0,1126,0,0,0,1727,120,57,155,0,0,0,818,0,0,1150,1,2878,2959
VB00-COMMISSION TO ELIMINATE CHILD ABUSE AND NEGLECT FATALITIES,0,0,0,0,0,0,0,0,0,0,0,0,0,0,0,0,0,0,0,0,0,0,0,0,0,0,0,0,0,0,0,0,0,0,0,0,0,0,0,0,0,0,0,0,0,0,0
VD00-PRIVACY AND CIVIL LIBERTIES OVERSIGHT BOARD,0,0,0,0,0,0,0,0,0,0,0,0,0,0,0,0,0,0,0,0,0,0,0,0,0,0,0,0,0,0,0,0,0,0,0,0,0,0,0,0,0,0,0,0,0,0,0
YE00-COMMISSION ON THE PREVENTION OF WEAPONS OF MASS DESTRUCTION PROLIFERATION AND TERRORISM,0,0,0,0,0,0,0,0,0,0,0,0,0,0,0,0,0,0,0,0,0,0,0,0,0,0,0,0,0,0,0,0,0,0,0,0,0,0,0,0,0,0,0,0,0,0,0
YF00-FINANCIAL CRISIS INQUIRY COMMISSION,0,0,0,0,0,0,0,0,0,0,0,0,0,0,0,0,0,0,0,0,0,0,0,0,0,0,0,0,0,0,0,0,0,0,0,0,0,0,0,0,0,0,0,0,0,0,0
YG00-RONALD REAGAN CENTENNIAL COMMISSION,0,0,0,0,0,0,0,0,0,0,0,0,0,0,0,0,0,0,0,0,0,0,0,0,0,0,0,0,0,0,0,0,0,0,0,0,0,0,0,0,0,0,0,0,0,0,0
ZL00-MEDICARE PAYMENT ADVISORY COMMISSION,0,0,0,0,0,0,0,0,0,0,0,0,0,0,0,0,0,0,0,0,0,0,0,0,0,0,0,0,0,0,0,0,0,0,0,0,0,0,0,0,5,0,0,5,0,5,5
ZP00-U.S. COMMISSION ON INTERNATIONAL RELIGIOUS FREEDOM,0,0,0,0,0,0,0,0,0,0,0,0,0,0,0,0,0,0,0,0,0,0,0,0,0,0,0,0,0,0,0,0,0,0,0,0,0,0,0,0,2,0,0,2,0,2,2
ZS00-UNITED STATES-CHINA ECONOMIC AND SECURITY REVIEW COMMISSION,0,0,0,0,0,0,0,0,0,0,0,0,0,0,0,0,0,0,0,0,0,0,0,0,0,0,0,0,0,0,0,0,0,0,0,0,0,0,0,0,1,0,0,1,0,1,1
ZU00-DWIGHT D. EISENHOWER MEMORIAL COMMISSION,0,0,0,0,0,0,0,0,0,0,0,0,0,0,0,0,0,0,0,0,0,0,0,0,0,0,0,0,0,0,0,0,0,0,0,0,0,0,0,0,1,0,0,1,0,1,1
All Agencies,636,247,0,0,0,0,7,6,1,0,897,0,0,0,0,0,0,0,0,0,0,0,897,367,4220,527,784,0,0,2677,9,9,0,8593,8303,2329,5560,25,0,5,2224,0,0,18446,5,27044,27941
