HUDD-ASSISTANT SECRETARY FOR COMMUNITY PLANNING AND DEVELOPMENT,0,0,0,0,0,0,0,0,0,0,0,0,0,0,0,0,0,0,0,0,0,0,0,0,0,0,0,0,0,0,0,0,0,0,0,0,0,0,0,0,0,0,0
HUEE-ASSISTANT SECRETARY FOR FAIR HOUSING AND EQUAL OPPORTUNITY,0,0,0,0,0,0,0,0,0,0,0,0,0,0,0,0,0,0,0,0,0,0,1,0,0,0,0,0,0,0,1,0,0,0,0,0,0,0,0,0,0,1,1
HUFF-OFFICE OF THE CHIEF FINANCIAL OFFICER,0,0,0,0,0,0,0,0,0,0,0,0,0,0,0,0,0,0,0,0,0,2,1,0,0,0,0,0,0,0,3,0,0,0,0,0,0,0,0,0,0,3,3
HUFH-OFFICE OF FEDERAL HOUSING ENTERPRISE OVERSIGHT,0,0,0,0,0,0,0,0,0,0,0,0,0,0,0,0,0,0,0,0,0,0,0,0,0,0,0,0,0,0,0,0,0,0,0,0,0,0,0,0,0,0,0
HUGG-OFFICE OF INSPECTOR GENERAL,7,0,0,0,0,0,0,0,0,7,0,0,0,0,0,0,0,0,0,0,7,1,1,0,0,0,0,0,0,0,2,0,0,0,0,0,0,0,0,0,0,2,9
HUII-OFFICE OF DEPARTMENTAL OPERATIONS AND COORDINATION,0,0,0,0,0,0,0,0,0,0,0,0,0,0,0,0,0,0,0,0,0,0,0,0,0,0,0,0,0,0,0,0,0,0,0,0,0,0,0,0,0,0,0
HUJJ-ASSISTANT SECRETARY FOR CONGRESSIONAL AND INTERGOVERNMENTAL RELATIONS,0,0,0,0,0,0,0,0,0,0,0,0,0,0,0,0,0,0,0,0,0,0,0,0,0,0,0,0,0,0,0,0,0,0,0,0,0,0,0,0,0,0,0
HUKA-CENTER FOR FAITH-BASED AND COMMUNITY INITIATIVES,0,0,0,0,0,0,0,0,0,0,0,0,0,0,0,0,0,0,0,0,0,0,0,0,0,0,0,0,0,0,0,0,0,0,0,0,0,0,0,0,0,0,0
HUKK-OFFICE OF FIELD POLICY AND MANAGEMENT,0,0,0,0,0,0,0,0,0,0,0,0,0,0,0,0,0,0,0,0,0,0,0,0,0,0,0,0,0,0,0,0,0,0,0,0,0,0,0,0,0,0,0
HULL-OFFICE OF HEALTHY HOMES AND LEAD HAZARD CONTROL,0,0,0,0,0,0,0,0,0,0,0,0,0,0,0,0,0,0,0,0,0,0,0,0,0,0,0,0,0,0,0,0,0,0,0,0,0,0,0,0,0,0,0
HUMM-ASSISTANT SECRETARY FOR HOUSING--FEDERAL HOUSING COMMISSIONER,0,0,0,0,0,0,0,0,0,0,0,0,0,0,0,0,0,0,0,0,0,0,1,0,0,0,0,0,0,0,1,0,0,0,0,0,0,0,0,0,0,1,1
HUNN-OFFICE OF THE CHIEF PROCUREMENT OFFICER,0,0,0,0,0,0,0,0,0,0,0,0,0,0,0,0,0,0,0,0,0,0,0,0,0,0,0,0,0,0,0,0,0,0,0,0,0,0,0,0,0,0,0
HUPP-ASSISTANT SECRETARY FOR PUBLIC AND INDIAN HOUSING,0,0,0,0,0,0,0,0,0,0,0,0,0,0,0,0,0,0,0,0,0,0,1,0,0,0,0,0,0,0,1,0,0,0,0,0,0,0,0,0,0,1,1
HUQQ-OFFICE OF THE CHIEF INFORMATION OFFICER,1,0,0,0,0,0,0,0,0,1,0,0,0,0,0,0,0,0,0,0,1,0,0,0,0,0,0,0,0,0,0,0,0,0,0,0,0,0,0,0,0,0,1
HURR-ASSISTANT SECRETARY FOR POLICY DEVELOPMENT AND RESEARCH,0,0,0,0,0,0,0,0,0,0,0,0,0,0,0,0,0,0,0,0,0,0,0,0,0,0,0,0,0,0,0,0,0,0,0,0,0,0,0,0,0,0,0
HUTT-GOVERNMENT NATIONAL MORTGAGE ASSOCIATION (GINNIE MAE),0,0,0,0,0,0,0,0,0,0,0,0,0,0,0,0,0,0,0,0,0,0,0,0,0,0,0,0,0,0,0,0,0,0,0,0,0,0,0,0,0,0,0
HUUU-OFFICE OF DEPARTMENTAL EQUAL EMPLOYMENT OPPORTUNITY,0,0,0,0,0,0,0,0,0,0,0,0,0,0,0,0,0,0,0,0,0,1,0,0,0,0,0,0,0,0,1,0,0,0,0,0,0,0,0,0,0,1,1
HUWW-ASSISTANT SECRETARY FOR PUBLIC AFFAIRS,0,0,0,0,0,0,0,0,0,0,0,0,0,0,0,0,0,0,0,0,0,0,0,0,0,0,0,0,0,0,0,0,0,0,0,0,0,0,0,0,0,0,0
HW00-U.S. INTERAGENCY COUNCIL ON HOMELESSNESS,0,0,0,0,0,0,0,0,0,0,0,0,0,0,0,0,0,0,0,0,0,0,0,0,0,0,0,0,0,0,0,0,0,0,0,0,0,0,0,0,0,0,0
IB00-BROADCASTING BOARD OF GOVERNORS,1,0,0,0,0,0,0,0,0,1,0,0,0,0,0,0,0,0,0,0,1,0,15,0,1,0,0,0,0,0,16,0,0,0,0,0,3,0,0,3,0,19,20
IF00-INTER-AMERICAN FOUNDATION,0,0,0,0,0,0,0,0,0,0,0,0,0,0,0,0,0,0,0,0,0,0,0,0,0,0,0,0,0,0,0,0,0,1,0,0,0,0,0,1,0,1,1
IN01-OFFICE OF THE SECRETARY OF THE INTERIOR,4,1,0,0,0,0,0,0,0,5,0,0,0,0,0,0,0,0,0,0,5,2,5,6,0,0,1,0,1,0,15,0,0,0,2,0,0,0,0,2,0,17,22
IN05-BUREAU OF LAND MANAGEMENT,19,6,0,0,0,0,0,0,0,25,0,0,0,0,0,0,0,0,0,0,25,10,60,0,7,0,1,0,0,0,78,39,474,14,0,0,22,0,0,549,0,627,652
IN06-INDIAN AFFAIRS,3,1,0,0,0,0,0,0,0,4,0,0,0,0,0,0,0,0,0,0,4,1,1,9,0,0,0,0,0,0,11,0,14,0,0,0,14,0,0,28,0,39,43
IN07-BUREAU OF RECLAMATION,8,0,0,0,0,0,0,0,0,8,0,0,0,0,0,0,0,0,0,0,8,2,16,1,5,0,2,0,0,0,26,9,4,9,0,0,0,0,0,22,0,48,56
IN08-GEOLOGICAL SURVEY,3,0,0,0,0,0,0,0,0,3,0,0,0,0,0,0,0,0,0,0,3,3,23,0,3,0,1,0,0,0,30,29,91,27,0,0,0,0,0,147,0,177,180
IN10-NATIONAL PARK SERVICE,9,7,0,0,0,0,0,0,0,16,0,0,0,0,0,0,0,0,0,0,16,6,42,5,2,0,0,0,0,0,55,1434,87,77,0,0,111,0,0,1709,0,1764,1780
IN15-U.S. FISH AND WILDLIFE SERVICE,5,1,0,0,0,0,0,0,0,6,0,0,0,0,0,0,0,0,0,0,6,3,17,2,2,0,0,0,0,0,24,100,28,8,0,0,6,0,0,142,0,166,172
IN21-OFFICE OF THE SOLICITOR,0,0,0,0,0,0,0,0,0,0,0,0,0,0,0,0,0,0,0,0,0,0,1,3,0,0,0,0,0,0,4,0,4,0,0,0,0,0,0,4,0,8,8
"IN22-OFFICE OF SURFACE MINING, RECLAMATION AND ENFORCEMENT",1,0,0,0,0,0,0,0,0,1,0,0,0,0,0,0,0,0,0,0,1,0,0,1,1,0,0,0,0,0,2,0,0,0,0,0,0,0,0,0,0,2,3
IN23-MINERAL MANAGEMENT SERVICE,4,0,0,0,0,0,0,0,0,4,0,0,0,0,0,0,0,0,0,0,4,1,3,0,4,0,0,0,0,0,8,1,0,0,0,0,0,0,0,1,0,9,13
IN24-OFFICE OF THE INSPECTOR GENERAL,1,0,0,0,0,0,0,0,0,1,0,0,0,0,0,0,0,0,0,0,1,0,0,0,0,0,0,0,0,0,0,0,0,0,0,0,0,0,0,0,0,0,1
IW00-COMMISSION ON THE INTELLIGENCE CAPABILITIES OF THE UNITED STATES REGARDING WEAPONS OF MASS DESTRUCTION,0,0,0,0,0,0,0,0,0,0,0,0,0,0,0,0,0,0,0,0,0,0,0,0,0,0,0,0,0,0,0,0,0,0,0,0,0,0,0,0,0,0,0
KS00-CORPORATION FOR NATIONAL AND COMMUNITY SERVICE,0,0,0,0,0,0,0,0,0,0,0,0,0,0,0,0,0,0,0,0,0,0,0,0,0,0,6,0,0,0,6,0,0,0,0,0,5,0,0,5,0,11,11
LF00-FEDERAL ELECTION COMMISSION,0,0,0,0,0,0,0,0,0,0,0,0,0,0,0,0,0,0,0,0,0,0,0,0,0,0,0,0,0,0,0,0,0,0,0,0,0,0,0,0,0,0,0
LP00-GOVERNMENT PRINTING OFFICE,6,0,0,0,0,0,0,0,0,6,0,0,0,0,0,0,0,0,0,0,6,1,18,0,0,0,0,0,0,0,19,1,0,0,0,0,0,0,0,1,0,20,26
LT00-U.S. TAX COURT,1,0,0,0,0,0,0,0,0,1,0,0,0,0,0,0,0,0,0,0,1,0,2,0,0,0,0,0,0,0,2,0,0,0,0,0,0,0,0,0,0,2,3
MA00-MARINE MAMMAL COMMISSION,0,0,0,0,0,0,0,0,0,0,0,0,0,0,0,0,0,0,0,0,0,0,0,0,0,0,0,0,0,0,0,0,0,0,0,0,0,0,0,0,0,0,0
MC00-FEDERAL MARITIME COMMISSION,0,0,0,0,0,0,0,0,0,0,0,0,0,0,0,0,0,0,0,0,0,0,0,0,0,0,0,0,0,0,0,0,0,0,0,0,0,0,0,0,0,0,0
MI00-MILLENNIUM CHALLENGE CORPORATION,0,0,0,0,0,0,0,0,0,0,0,0,0,0,0,0,0,0,0,0,0,0,0,0,0,0,0,0,0,0,0,0,0,0,0,0,2,0,0,2,0,2,2
NF00-NATIONAL SCIENCE FOUNDATION,4,0,0,0,0,0,0,0,0,4,0,0,0,0,0,0,0,0,0,0,4,0,3,0,1,0,0,0,0,0,4,0,0,1,0,0,3,0,0,4,0,8,12
NK00-NATIONAL COUNCIL ON DISABILITY,0,0,0,0,0,0,0,0,0,0,0,0,0,0,0,0,0,0,0,0,0,0,0,0,0,0,0,0,0,0,0,0,0,0,0,0,0,0,0,0,0,0,0
NL00-NATIONAL LABOR RELATIONS BOARD,0,0,0,0,0,0,0,0,0,0,0,0,0,0,0,0,0,0,0,0,0,0,1,0,0,0,0,0,0,0,1,0,0,0,0,0,0,0,0,0,0,1,1
NM00-NATIONAL MEDIATION BOARD,1,0,0,0,0,0,0,0,0,1,0,0,0,0,0,0,0,0,0,0,1,0,0,0,0,0,0,0,0,0,0,0,0,0,0,0,0,0,0,0,0,0,1
"NN10-HEADQUARTERS, NASA",7,0,0,0,0,0,0,0,0,7,0,0,0,0,0,0,0,0,0,0,7,2,2,0,0,0,0,1,0,0,5,0,0,0,0,0,3,0,0,3,0,8,15
NN21-AMES RESEARCH CENTER,1,0,0,0,0,0,0,0,0,1,0,0,0,0,0,0,0,0,0,0,1,0,0,0,2,0,0,0,0,0,2,11,0,0,0,0,0,0,0,11,0,13,14
NN22-JOHN GLENN RESEARCH CENTER AT LEWIS FIELD,0,0,0,0,0,0,0,0,0,0,0,0,0,0,0,0,0,0,0,0,0,0,1,0,0,0,0,0,0,0,1,0,0,0,0,0,0,0,0,0,0,1,1
NN23-LANGLEY RESEARCH CENTER,2,1,0,0,0,0,0,0,0,3,0,0,0,0,0,0,0,0,0,0,3,0,1,0,0,0,0,0,0,0,1,1,0,0,0,0,0,0,0,1,0,2,5
NN24-DRYDEN FLIGHT RESEARCH CENTER,0,0,0,0,0,0,0,0,0,0,0,0,0,0,0,0,0,0,0,0,0,0,1,0,0,0,0,0,0,0,1,7,0,0,0,0,0,0,0,7,0,8,8
NN51-GODDARD SPACE FLIGHT CENTER,2,0,0,0,0,0,0,0,0,2,0,0,0,0,0,0,0,0,0,0,2,0,0,0,2,0,0,0,0,0,2,0,0,1,0,0,0,0,0,1,0,3,5
NN62-GEORGE C. MARSHALL SPACE FLIGHT CENTER,1,0,0,0,0,0,0,0,0,1,0,0,0,0,0,0,0,0,0,0,1,1,0,0,1,0,0,0,0,0,2,3,0,0,0,0,0,0,0,3,0,5,6
NN64-JOHN C. STENNIS SPACE CENTER,0,0,0,0,0,0,0,0,0,0,0,0,0,0,0,0,0,0,0,0,0,0,0,0,0,0,0,0,0,0,0,0,0,0,0,0,0,0,0,0,0,0,0
NN72-LYNDON B. JOHNSON SPACE CENTER,0,0,0,0,0,0,0,0,0,0,0,0,0,0,0,0,0,0,0,0,0,0,0,1,1,0,0,0,0,0,2,4,0,0,0,0,1,0,0,5,0,7,7
NN76-JOHN F. KENNEDY SPACE CENTER,1,0,0,0,0,0,0,0,0,1,0,0,0,0,0,0,0,0,0,0,1,0,0,0,0,0,0,1,0,0,1,20,0,0,0,0,0,0,0,20,0,21,22
NP00-NATIONAL CAPITAL PLANNING COMMISSION,0,0,0,0,0,0,0,0,0,0,0,0,0,0,0,0,0,0,0,0,0,0,0,0,0,0,0,0,0,0,0,0,0,0,0,0,0,0,0,0,0,0,0
NQ00-NATIONAL ARCHIVES AND RECORDS ADMINISTRATION,0,1,0,0,0,0,0,0,0,1,0,0,0,0,0,0,0,0,0,0,1,0,11,0,0,0,0,0,0,0,11,0,0,33,0,0,0,0,0,33,0,44,45
NS00-NATIONAL SECURITY COUNCIL,0,0,0,0,0,0,0,0,0,0,0,0,0,0,0,0,0,0,0,0,0,0,0,2,0,0,0,0,0,0,2,0,0,0,0,0,0,0,0,0,0,2,2
NU00-NUCLEAR REGULATORY COMMISSION,0,0,0,0,0,0,2,0,0,2,0,0,0,0,0,0,0,0,0,0,2,0,0,0,0,0,41,0,0,0,41,0,0,0,0,0,11,0,0,11,0,52,54
NV11-IMMEDIATE OFFICE OF THE CHIEF OF NAVAL OPERATIONS,3,0,0,0,0,0,0,0,0,3,0,0,0,0,0,0,0,0,0,0,3,5,3,0,1,0,8,0,0,0,17,2,31,5,0,0,4,0,0,42,0,59,62
"NV12-ASSISTANT FOR ADMINISTRATION, UNDER SECRETARY OF THE NAVY",8,0,0,0,0,0,0,0,0,8,0,0,0,0,0,0,0,0,0,0,8,8,0,11,4,0,7,0,0,0,30,1,2,6,2,0,1,0,0,12,0,42,50
NV14-OFFICE OF NAVAL RESEARCH,2,0,0,0,0,0,0,0,0,2,0,0,0,0,0,0,0,0,0,0,2,3,8,0,2,0,0,0,0,0,13,0,0,1,0,0,1,0,0,2,0,15,17
NV15-NAVAL INTELLIGENCE COMMAND,0,0,0,0,0,0,0,0,0,0,0,0,0,0,0,0,0,0,0,0,0,0,0,0,0,0,25,0,0,0,25,0,0,0,0,0,1,0,0,1,0,26,26
NV18-NAVAL MEDICAL COMMAND,18,4,0,0,0,0,0,0,0,22,0,0,0,0,0,0,0,0,0,0,22,8,127,0,3,0,13,0,0,0,151,4,13,5,0,0,1,0,0,23,0,174,196
NV19-NAVAL AIR SYSTEMS COMMAND,8,1,0,0,0,0,0,0,0,9,0,0,0,0,0,0,0,0,0,0,9,6,65,2,26,0,7,0,0,0,106,2,0,3,0,0,0,0,0,5,0,111,120
NV22-BUREAU OF NAVAL PERSONNEL,2,0,0,0,0,0,0,0,0,2,0,0,0,0,0,0,0,0,0,0,2,1,6,0,0,0,10,0,0,0,17,3,0,0,0,0,0,0,0,3,0,20,22
NV23-NAVAL SUPPLY SYSTEMS COMMAND,3,1,0,0,0,0,0,0,0,4,0,0,0,0,0,0,0,0,0,0,4,4,32,0,40,0,9,0,0,0,85,5,1,9,0,0,0,0,0,15,0,100,104
NV24-NAVAL SEA SYSTEMS COMMAND,10,1,0,0,0,0,0,0,0,11,0,0,0,0,0,0,0,0,0,0,11,17,42,2,14,0,7,0,0,0,82,5,0,8,0,0,0,0,0,13,0,95,106
NV25-NAVAL FACILITIES ENGINEERING COMMAND,20,2,0,0,0,0,0,0,0,22,0,0,0,0,0,0,0,0,0,0,22,6,58,0,21,0,6,0,0,0,91,12,0,1,0,0,0,0,0,13,0,104,126
NV27-U.S. MARINE CORPS,21,2,0,0,0,1,0,0,0,24,0,0,0,0,0,0,0,0,0,0,24,25,113,0,4,0,33,0,0,0,175,42,22,3,0,0,0,0,0,67,1,243,267
NV30-STRATEGIC SYSTEMS PROGRAMS OFFICE,0,0,0,0,0,0,0,0,0,0,0,0,0,0,0,0,0,0,0,0,0,1,4,0,1,0,1,0,0,0,7,0,0,0,0,0,0,0,0,0,0,7,7
NV33-MILITARY SEALIFT COMMAND,2,0,0,0,0,0,0,0,0,2,0,0,0,0,0,0,0,0,0,0,2,0,6,73,1,0,0,0,0,0,80,2,12,0,0,0,1,0,0,15,0,95,97
NV39-SPACE AND NAVAL WARFARE SYSTEMS COMMAND,5,0,0,0,0,0,0,0,0,5,0,0,0,0,0,0,0,0,0,0,5,19,9,0,4,0,2,0,0,0,34,1,0,2,0,0,0,0,0,3,0,37,42
NV41-NAVY SYSTEMS MANAGEMENT ACTIVITY,0,0,0,0,0,0,0,0,0,0,0,0,0,0,0,0,0,0,0,0,0,0,0,0,0,0,0,0,0,0,0,0,0,0,0,0,0,0,0,0,0,0,0
"NV52-COMMANDER, NAVY INSTALLATIONS",14,2,0,0,0,1,0,0,0,17,0,0,0,0,0,0,0,0,0,0,17,6,47,0,9,0,19,0,0,0,81,24,23,0,0,0,1,0,0,48,0,129,146
"NV60-U.S. ATLANTIC FLEET, COMMANDER IN CHIEF",8,1,0,0,0,0,0,0,0,9,0,0,0,0,0,0,0,0,0,0,9,17,18,0,3,0,23,0,0,0,61,5,1,3,0,0,2,0,0,11,0,72,81
"NV61-U.S. NAVAL FORCES, EUROPE",0,0,0,0,0,0,0,0,0,0,0,0,0,0,0,0,0,0,0,0,0,0,0,0,0,0,0,0,0,0,0,0,0,0,0,0,0,0,0,0,0,0,0
NV62-CHIEF OF NAVAL EDUCATION AND TRAINING,0,0,0,0,0,0,0,0,0,0,0,0,0,0,0,0,0,0,0,0,0,0,0,0,0,0,0,0,0,0,0,0,0,0,0,0,0,0,0,0,0,0,0
NV69-NAVAL SECURITY GROUP COMMAND,0,0,0,0,0,0,0,0,0,0,0,0,0,0,0,0,0,0,0,0,0,0,0,0,0,0,0,0,0,0,0,0,0,0,0,0,0,0,0,0,0,0,0
"NV70-U.S. PACIFIC FLEET, COMMANDER IN CHIEF",4,0,0,0,0,0,0,0,0,4,0,0,0,0,0,0,0,0,0,0,4,6,37,0,31,0,5,0,0,0,79,4,0,0,0,0,0,0,0,4,0,83,87
NV72-NAVAL RESERVE FORCE,2,0,0,0,0,0,0,0,0,2,0,0,0,0,0,0,0,0,0,0,2,3,0,0,0,0,4,0,0,0,7,0,0,0,0,0,0,0,0,0,0,7,9
NV74-NAVAL SPECIAL WARFARE COMMAND,0,0,0,0,0,0,0,0,0,0,0,0,0,0,0,0,0,0,0,0,0,10,0,0,0,0,1,0,0,0,11,1,0,0,0,0,0,0,0,1,0,12,12
NV76-NAVAL EDUCATION AND TRAINING COMMAND,7,0,0,0,0,0,0,0,0,7,0,0,0,0,0,0,0,0,0,0,7,4,23,0,28,0,11,0,0,0,66,9,0,3,0,0,0,0,0,12,0,78,85
OM00-OFFICE OF PERSONNEL MANAGEMENT,16,4,0,0,0,0,0,0,0,20,0,0,0,0,0,0,0,0,0,0,20,9,19,15,19,0,0,0,0,0,62,3,0,0,1,0,0,0,0,4,0,66,86
OS00-OCCUPATIONAL SAFETY AND HEALTH REVIEW COMMISSION,0,0,0,0,0,0,0,0,0,0,0,0,0,0,0,0,0,0,0,0,0,0,0,0,0,0,0,0,0,0,0,0,0,0,0,0,0,0,0,0,0,0,0
PU00-PEACE CORPS,0,0,0,0,0,0,0,0,0,0,0,0,0,0,0,0,0,0,0,0,0,0,0,0,0,0,0,0,0,0,0,0,0,0,0,0,15,0,0,15,0,15,15
QQ00-OFFICE OF NATIONAL DRUG CONTROL POLICY,0,0,0,0,0,0,0,0,0,0,0,0,0,0,0,0,0,0,0,0,0,0,0,0,0,0,0,0,0,0,0,0,0,0,2,0,0,0,0,2,0,2,2
RE00-OFFICE OF NAVAJO AND HOPI INDIAN RELOCATION,0,0,0,0,0,0,0,0,0,0,0,0,0,0,0,0,0,0,0,0,0,0,0,0,0,0,0,0,0,0,0,0,0,0,0,0,0,0,0,0,0,0,0
RF00-FEDERAL RETIREMENT THRIFT INVESTMENT BOARD,1,0,0,0,0,0,0,0,0,1,0,0,0,0,0,0,0,0,0,0,1,0,0,0,0,0,0,0,0,0,0,0,0,0,0,0,0,0,0,0,0,0,1
RH00-ARMED FORCES RETIREMENT HOME,0,0,0,0,0,0,0,0,0,0,0,0,0,0,0,0,0,0,0,0,0,0,3,0,0,0,1,0,0,0,4,0,0,0,0,0,0,0,0,0,0,4,4
RR00-RAILROAD RETIREMENT BOARD,1,0,0,0,0,0,0,0,0,1,0,0,0,0,0,0,0,0,0,0,1,0,6,0,0,0,0,0,0,0,6,0,0,0,0,0,0,0,0,0,0,6,7
RS00-FEDERAL MINE SAFETY AND HEALTH REVIEW COMMISSION,0,0,0,0,0,0,0,0,0,0,0,0,0,0,0,0,0,0,0,0,0,0,0,0,0,0,0,0,0,0,0,0,0,0,0,0,0,0,0,0,0,0,0
SB00-SMALL BUSINESS ADMINISTRATION,9,0,0,0,0,0,0,0,0,9,0,0,0,0,0,0,0,0,0,0,9,3,7,0,1,0,0,0,0,0,11,24,36,0,1,0,2,0,0,63,0,74,83
SE00-SECURITIES AND EXCHANGE COMMISSION,2,0,0,0,0,0,0,0,0,2,0,0,0,0,0,0,0,0,0,0,2,1,5,6,0,0,0,0,0,0,12,1,0,3,1,0,0,0,0,5,0,17,19
SK00-CONSUMER PRODUCT SAFETY COMMISSION,0,0,0,0,0,0,0,0,0,0,0,0,0,0,0,0,0,0,0,0,0,0,0,0,0,0,0,0,0,0,0,0,0,0,0,0,0,0,0,0,0,0,0
SM01-NATIONAL GALLERY OF ART,0,0,0,0,0,0,0,0,0,0,0,0,0,0,0,0,0,0,0,0,0,1,12,0,0,0,0,0,0,0,13,0,0,0,0,0,0,0,0,0,0,13,13
SM02-WOODROW WILSON INTERNATIONAL CENTER FOR SCHOLARS,0,0,0,0,0,0,0,0,0,0,0,0,0,0,0,0,0,0,0,0,0,0,0,0,0,0,0,0,0,0,0,0,0,0,0,0,0,0,0,0,0,0,0
SM03-SMITHSONIAN INSTITUTION (EXCEPT UNITS ADMINISTERED UNDER SEPARATE BOARDS OF TRUSTEES),5,0,0,0,0,0,0,0,0,5,0,0,0,0,0,0,0,0,0,0,5,0,11,1,0,0,0,0,0,0,12,7,16,2,0,0,0,0,0,25,0,37,42
SM04-JOHN F. KENNEDY CENTER FOR THE PERFORMING ARTS,1,0,0,0,0,0,0,0,0,1,0,0,0,0,0,0,0,0,0,0,1,0,0,0,0,0,0,0,0,0,0,0,0,0,0,0,0,0,0,0,0,0,1
SS00-SELECTIVE SERVICE SYSTEM,1,0,0,0,0,0,0,0,0,1,0,0,0,0,0,0,0,0,0,0,1,0,1,0,0,0,0,0,0,0,1,0,0,0,0,0,0,0,0,0,0,1,2
ST00-DEPARTMENT OF STATE,12,3,0,0,0,0,0,0,0,15,0,0,0,0,0,0,0,0,0,0,15,3,28,4,8,0,8,0,0,0,51,25,6,19,7,0,13,1,0,71,0,122,137
SZ00-SOCIAL SECURITY ADMINISTRATION,2,0,0,0,0,0,0,0,0,2,0,0,0,0,0,0,0,0,0,0,2,1,11,2,1,0,0,0,0,0,15,2,5,1,0,0,0,0,0,8,0,23,25
TB00-NATIONAL TRANSPORTATION SAFETY BOARD,1,0,0,0,0,0,0,0,0,1,0,0,0,0,0,0,0,0,0,0,1,0,4,0,0,0,0,0,0,0,4,0,0,0,0,0,0,0,0,0,0,4,5
TC00-U.S. INTERNATIONAL TRADE COMMISSION,1,0,0,0,0,0,0,0,0,1,0,0,0,0,0,0,0,0,0,0,1,0,0,1,0,0,0,0,0,0,1,0,1,0,2,0,0,0,0,3,0,4,5
TD01-OFFICE OF THE SECRETARY OF TRANSPORTATION,3,1,0,0,0,0,0,0,0,4,0,0,0,0,0,0,0,0,0,0,4,0,0,0,0,0,0,0,0,0,0,0,0,0,0,0,1,0,0,1,0,1,5
TD03-FEDERAL AVIATION ADMINISTRATION,0,0,0,0,0,0,0,0,0,0,0,0,0,0,0,0,0,0,0,0,0,0,0,0,0,0,183,0,0,0,183,0,0,0,0,0,103,0,0,103,0,286,286
TD04-FEDERAL HIGHWAY ADMINISTRATION,6,2,0,0,0,0,0,0,0,8,0,0,0,0,0,0,0,0,0,0,8,3,8,1,5,0,0,0,0,0,17,0,0,5,0,0,0,0,0,5,0,22,30
TD05-FEDERAL RAILROAD ADMINISTRATION,1,0,0,0,0,0,0,0,0,1,0,0,0,0,0,0,0,0,0,0,1,0,3,0,0,0,0,0,0,0,3,0,0,2,0,0,0,0,0,2,0,5,6
TD06-SAINT LAWRENCE SEAWAY DEVELOPMENT CORPORATION,0,0,0,0,0,0,0,0,0,0,0,0,0,0,0,0,0,0,0,0,0,0,1,0,0,0,0,0,0,0,1,1,0,0,0,0,0,0,0,1,0,2,2
TD09-FEDERAL TRANSIT ADMINISTRATION,0,1,0,0,0,0,0,0,0,1,0,0,0,0,0,0,0,0,0,0,1,0,1,0,1,0,0,0,0,0,2,0,0,0,0,0,0,0,0,0,0,2,3
TD10-NATIONAL HIGHWAY TRAFFIC SAFETY ADMINISTRATION,1,0,0,0,0,0,0,0,0,1,0,0,0,0,0,0,0,0,0,0,1,0,2,0,0,0,0,0,0,0,2,1,0,0,0,0,0,0,0,1,0,3,4
TD11-RESEARCH AND INNOVATIVE TECHNONOGY ADMINSTRATION,1,0,0,0,0,0,0,0,0,1,0,0,0,0,0,0,0,0,0,0,1,0,0,0,2,0,0,0,0,0,2,0,0,2,0,0,0,0,0,2,0,4,5
TD12-OFFICE OF INSPECTOR GENERAL,1,1,0,0,0,0,0,0,0,2,0,0,0,0,0,0,0,0,0,0,2,0,0,0,2,0,0,0,0,0,2,0,0,0,0,0,0,0,0,0,0,2,4
TD13-MARITIME ADMINISTRATION,0,0,0,0,0,0,0,0,0,0,0,0,0,0,0,0,0,0,0,0,0,0,7,0,0,0,0,0,0,0,7,1,0,0,0,0,0,0,0,1,0,8,8
TD15-SURFACE TRANSPORTATION BOARD,1,0,0,0,0,0,0,0,0,1,0,0,0,0,0,0,0,0,0,0,1,2,2,0,0,0,0,0,0,0,4,0,0,0,0,0,0,0,0,0,0,4,5
TD16-PIPELINE AND HAZARDOUS MATERIALS SAFETY ADMINISTRATION,0,1,0,0,0,0,0,0,0,1,0,0,0,0,0,0,0,0,0,0,1,0,1,0,1,0,0,0,0,0,2,0,0,0,0,0,0,0,0,0,0,2,3
TD17-FEDERAL MOTOR CARRIER SAFETY ADMINISTRATION,0,0,0,0,0,0,0,0,0,0,0,0,0,0,0,0,0,0,0,0,0,1,1,0,0,0,0,0,0,0,2,0,0,0,1,0,0,0,0,1,0,3,3
TN00-OFFICE OF THE U.S. TRADE REPRESENTATIVE,0,0,0,0,0,0,0,0,0,0,0,0,0,0,0,0,0,0,0,0,0,0,0,1,0,0,0,0,0,0,1,0,0,0,0,0,1,0,0,1,0,2,2
TR35-OFFICE OF THRIFT SUPERVISION,4,0,0,0,0,0,0,0,0,4,0,0,0,0,0,0,0,0,0,0,4,1,4,0,0,0,0,0,0,0,5,0,0,0,0,0,0,0,0,0,0,5,9
TR40-ALCOHOL AND TOBACCO TAX AND TRADE BUREAU,0,0,0,0,0,0,0,0,0,0,0,0,0,0,0,0,0,0,0,0,0,0,0,0,0,0,0,0,0,0,0,0,0,0,0,0,0,0,0,0,0,0,0
TR91-DEPARTMENTAL OFFICES,1,1,0,0,0,0,0,0,0,2,0,0,0,0,0,0,0,0,0,0,2,0,9,3,1,0,0,0,0,0,13,0,1,0,3,0,0,0,0,4,0,17,19
TR93-INTERNAL REVENUE SERVICE,9,3,0,0,0,0,0,0,0,12,0,0,0,0,0,0,0,0,0,0,12,10,115,6,11,0,1,0,0,0,143,951,350,93,0,0,0,0,0,1394,0,1537,1549
TR95-OFFICE OF INSPECTOR GENERAL,0,0,0,0,0,0,0,0,0,0,0,0,0,0,0,0,0,0,0,0,0,0,0,0,0,0,0,0,0,0,0,0,0,0,0,0,0,0,0,0,0,0,0
TRAA-FINANCIAL MANAGEMENT SERVICE,3,0,0,0,0,0,0,0,0,3,0,0,0,0,0,0,0,0,0,0,3,0,2,0,0,0,0,0,0,0,2,4,0,2,0,0,0,0,0,6,0,8,11
TRAB-BUREAU OF THE PUBLIC DEBT,0,0,0,0,0,0,0,0,0,0,0,0,0,0,0,0,0,0,0,0,0,0,1,0,3,0,2,0,0,0,6,1,0,2,0,0,0,0,0,3,0,9,9
TRAD-U.S. MINT,5,0,0,0,0,0,0,0,0,5,0,0,0,0,0,0,0,0,0,0,5,0,7,0,0,0,0,0,0,0,7,24,0,0,0,0,0,0,0,24,0,31,36
TRAF-FINANCIAL CRIMES ENFORCEMENT NETWORK,1,0,0,0,0,0,0,0,0,1,0,0,0,0,0,0,0,0,0,0,1,1,3,0,0,0,0,0,0,0,4,0,1,0,0,0,0,0,0,1,0,5,6
TRAI-BUREAU OF ENGRAVING AND PRINTING,1,1,0,0,0,0,0,0,0,2,0,0,0,0,0,0,0,0,0,0,2,1,0,0,0,0,0,0,0,0,1,0,0,1,0,0,0,0,0,1,0,2,4
TRAJ-OFFICE OF THE COMPTROLLER OF THE CURRENCY,3,2,0,0,0,0,0,0,0,5,0,0,0,0,0,0,0,0,0,0,5,1,8,0,7,0,0,0,0,0,16,1,0,2,0,0,0,0,0,3,0,19,24
TRTG-OFFICE OF THE INSPECTOR GENERAL FOR TAX ADMINISTRATION,2,0,0,0,0,0,0,0,0,2,0,0,0,0,0,0,0,0,0,0,2,0,0,0,0,0,0,0,0,0,0,0,0,0,0,0,0,0,0,0,0,0,2
TS00-OFFICE OF SCIENCE AND TECHNOLOGY POLICY,0,0,0,0,0,0,0,0,0,0,0,0,0,0,0,0,0,0,0,0,0,0,0,0,0,0,0,0,0,0,0,0,0,0,0,0,0,0,0,0,0,0,0
UJ00-JAPAN-UNITED STATES FRIENDSHIP COMMISSION,0,0,0,0,0,0,0,0,0,0,0,0,0,0,0,0,0,0,0,0,0,0,0,0,0,0,0,0,0,0,0,0,0,0,0,0,0,0,0,0,0,0,0
UT00-UTAH RECLAMATION MITIGATION AND CONSERVATION COMMISSION,0,0,0,0,0,0,0,0,0,0,0,0,0,0,0,0,0,0,0,0,0,0,0,0,0,0,0,0,0,0,0,0,0,0,0,0,0,0,0,0,0,0,0
VA**-UNSPECIFIED,0,0,0,0,0,0,0,0,0,0,0,0,0,0,0,0,0,0,0,0,0,0,0,0,0,0,0,0,0,0,0,1,0,0,0,0,0,0,0,1,0,1,1
VAAA-OFFICE OF THE SECRETARY,0,0,0,0,0,0,0,0,0,0,0,0,0,0,0,0,0,0,0,0,0,0,1,0,0,0,0,0,0,0,1,0,0,0,0,0,0,0,0,0,0,1,1
VAAC-BOARD OF CONTRACT APPEALS,0,0,0,0,0,0,0,0,0,0,0,0,0,0,0,0,0,0,0,0,0,0,0,0,0,0,0,0,0,0,0,0,0,0,0,0,0,0,0,0,0,0,0
VAAD-BOARD OF VETERANS APPEALS,0,1,0,0,0,0,0,0,0,1,0,0,0,0,0,0,0,0,0,0,1,0,1,3,0,0,3,0,0,0,7,0,2,0,0,0,1,0,0,3,0,10,11
VAAE-GENERAL COUNSEL,2,0,0,0,0,0,0,0,0,2,0,0,0,0,0,0,0,0,0,0,2,0,1,2,2,0,1,0,0,0,6,0,0,0,0,0,0,0,0,0,0,6,8
VAAF-INSPECTOR GENERAL,0,0,0,0,0,0,0,0,0,0,0,0,0,0,0,0,0,0,0,0,0,0,0,0,0,0,0,0,0,0,0,0,0,0,0,0,0,0,0,0,0,0,0
VAAH-OFFICE OF SMALL AND DISADVANTAGED BUSINESS UTILIZATION,0,0,0,0,0,0,0,0,0,0,0,0,0,0,0,0,0,0,0,0,0,0,0,0,0,0,0,0,0,0,0,0,0,0,0,0,0,0,0,0,0,0,0
VABA-IMMEDIATE OFFICE OF THE ASSISTANT SECRETARY FOR HUMAN RESOURCES AND ADMINISTRATION,0,0,0,0,0,0,0,0,0,0,0,0,0,0,0,0,0,0,0,0,0,0,0,0,0,0,0,0,0,0,0,0,0,0,0,0,0,0,0,0,0,0,0
VABC-ASSISTANT SECRETARY FOR HUMAN RESOURCES MANAGEMENT,1,0,0,0,0,0,0,0,0,1,0,0,0,0,0,0,0,0,0,0,1,2,0,0,1,0,1,0,0,0,4,0,0,0,0,0,0,0,0,0,0,4,5
VABD-DEPUTY ASSISTANT SECRETARY FOR EQUAL OPPORTUNITY,0,0,0,0,0,0,0,0,0,0,0,0,0,0,0,0,0,0,0,0,0,0,0,0,0,0,0,0,0,0,0,0,0,0,0,0,0,0,0,0,0,0,0
VABE-DEPUTY ASSISTANT SECRETARY FOR ADMINISTRATION,0,0,0,0,0,0,0,0,0,0,0,0,0,0,0,0,0,0,0,0,0,0,0,0,0,0,0,0,0,0,0,0,0,0,0,0,0,0,0,0,0,0,0
VABF-DEPUTY ASSISTANT SECRETARY FOR OFFICE OF RESOLUTION MANAGEMENT,1,0,0,0,0,0,0,0,0,1,0,0,0,0,0,0,0,0,0,0,1,1,0,0,0,0,0,0,0,0,1,0,0,0,0,0,0,0,0,0,0,1,2
VADA-IMMEDIATE OFFICE OF THE ASSISTANT SECRETARY FOR MANAGEMENT,0,0,0,0,0,0,0,0,0,0,0,0,0,0,0,0,0,0,0,0,0,0,0,0,0,0,0,0,0,0,0,0,0,0,0,0,0,0,0,0,0,0,0
VADC-DEPUTY ASSISTANT SECRETARY FOR BUDGET,0,0,0,0,0,0,0,0,0,0,0,0,0,0,0,0,0,0,0,0,0,0,0,0,0,0,0,0,0,0,0,0,0,0,0,0,0,0,0,0,0,0,0
VADD-DEPUTY ASSISTANT SECRETARY FOR FINANCE,2,0,0,0,0,0,0,0,0,2,0,0,0,0,0,0,0,0,0,0,2,1,2,0,0,0,0,0,0,0,3,0,0,0,0,0,0,0,0,0,0,3,5
VADG-DEPUTY ASSISTANT SECRETARY FOR ACQUISITION AND MATERIEL MANAGEMENT,4,0,0,0,0,0,0,0,0,4,0,0,0,0,0,0,0,0,0,0,4,0,3,0,0,0,0,0,0,0,3,0,0,0,0,0,0,0,0,0,0,3,7
VAEA-IMMEDIATE OFFICE OF THE ASSISTANT SECRETARY FOR INFORMATION AND TECHNOLOGY,0,0,0,0,0,0,1,0,0,1,0,0,0,0,0,0,0,0,0,0,1,0,0,0,0,0,0,0,0,0,0,0,0,0,0,0,0,0,0,0,0,0,1
VAEB-DEPUTY ASSISTANT SECRETARY FOR INFORMATION AND TECHNOLOGY,11,1,0,0,0,0,0,0,0,12,0,0,0,0,0,0,0,0,0,0,12,7,54,1,3,0,4,0,0,0,69,3,0,0,0,0,0,0,0,3,0,72,84
VAHA-IMMEDIATE OFFICE OF THE ASSISTANT SECRETARY FOR POLICY AND PLANNING,0,0,0,0,0,0,0,0,0,0,0,0,0,0,0,0,0,0,0,0,0,0,0,0,0,0,0,0,0,0,0,0,0,0,0,0,0,0,0,0,0,0,0
VAHB-DEPUTY ASSISTANT SECRETARY FOR PROGRAM AND DATA ANALYSIS,0,0,0,0,0,0,0,0,0,0,0,0,0,0,0,0,0,0,0,0,0,0,0,0,0,0,0,0,0,0,0,0,0,0,0,0,0,0,0,0,0,0,0
VAHC-DEPUTY ASSISTANT SECRETARY FOR PLANNING AND EVALUATION,0,0,0,0,0,0,0,0,0,0,0,0,0,0,0,0,0,0,0,0,0,0,0,0,0,0,0,0,0,0,0,0,0,0,0,0,0,0,0,0,0,0,0
VAHD-NATIONAL CENTER FOR VETERAN ANALYSIS AND STATISTICS,0,0,0,0,0,0,0,0,0,0,0,0,0,0,0,0,0,0,0,0,0,0,0,0,0,0,0,0,0,0,0,0,0,0,0,0,0,0,0,0,0,0,0
VAJA-OFFICE OF THE ASSISTANT SECRETARY FOR PUBLIC AND INTERGOVERNMENTAL AFFAIRS,1,0,0,0,0,0,0,0,0,1,0,0,0,0,0,0,0,0,0,0,1,0,0,0,0,0,0,0,0,0,0,0,0,0,0,0,0,0,0,0,0,0,1
VAJB-DEPUTY ASSISTANCE SECRETARY FOR INTERGOVERNMENTAL AFFAIRS,0,0,0,0,0,0,0,0,0,0,0,0,0,0,0,0,0,0,0,0,0,0,0,0,0,0,0,0,0,0,0,0,0,0,0,0,0,0,0,0,0,0,0
VAJC-DEPUTY ASSISTANT SECRETARY FOR PUBLIC AFFAIRS,0,0,0,0,0,0,0,0,0,0,0,0,0,0,0,0,0,0,0,0,0,0,0,0,0,0,0,0,0,0,0,0,0,0,0,0,0,0,0,0,0,0,0
VAKA-IMMEDIATE OFFICE OF THE ASSISTANT SECRETARY FOR CONGRESSIONAL AND LEGISLATIVE AFFAIRS,0,0,0,0,0,0,0,0,0,0,0,0,0,0,0,0,0,0,0,0,0,0,0,0,0,0,0,0,0,0,0,0,0,0,0,0,0,0,0,0,0,0,0
VAKB-DEPUTY ASSISTANT SECRETARY FOR CONGRESSIONAL AFFAIRS,0,0,0,0,0,0,0,0,0,0,0,0,0,0,0,0,0,0,0,0,0,0,0,0,0,0,0,0,0,0,0,0,0,0,0,0,0,0,0,0,0,0,0
VALA-VETERANS BENEFITS ADMINISTRATION,13,5,0,0,0,0,0,0,0,18,0,0,0,0,0,0,0,0,0,0,18,10,61,2,37,0,21,0,0,0,131,16,0,0,0,0,0,0,0,16,0,147,165
VAPA-NATIONAL CEMETERY ADMINISTRATION,1,0,0,0,0,0,0,0,0,1,0,0,0,0,0,0,0,0,0,0,1,4,9,0,0,0,2,0,0,0,15,45,8,1,0,0,7,0,0,61,0,76,77
VATA-VETERANS HEALTH ADMINISTRATION,79,21,0,0,0,5,0,0,0,105,0,0,0,0,0,0,0,0,0,1,106,109,972,5,8,0,936,0,0,0,2030,136,51,78,0,0,1003,0,0,1268,8,3306,3412
YA00-COMMISSION ON THE REVIEW OF THE OVERSEAS MILITARY FACILITY STRUCTURE OF THE UNITED STATES,0,0,0,0,0,0,0,0,0,0,0,0,0,0,0,0,0,0,0,0,0,0,0,0,0,0,0,0,0,0,0,0,0,0,0,0,0,0,0,0,0,0,0
YB00-ANTITRUST MODERNIZATION COMMISSION,0,0,0,0,0,0,0,0,0,0,0,0,0,0,0,0,0,0,0,0,0,0,0,0,0,0,0,0,0,0,0,0,0,0,0,0,0,0,0,0,0,0,0
YD00-HELPING TO ENHANCE THE LIVELIHOOD OF PEOPLE (HELP) AROUND THE GLOBE COMMISSION,0,0,0,0,0,0,0,0,0,0,0,0,0,0,0,0,0,0,0,0,0,0,0,0,0,0,0,0,0,0,0,0,0,0,0,0,0,0,0,0,0,0,0
YE00-COMMISSION ON THE PREVENTION OF WEAPONS OF MASS DESTRUCTION PROLIFERATION AND TERRORISM,0,0,0,0,0,0,0,0,0,0,0,0,0,0,0,0,0,0,0,0,0,0,0,0,0,0,0,0,0,0,0,0,0,0,0,0,0,0,0,0,0,0,0
ZL00-MEDICARE PAYMENT ADVISORY COMMISSION,0,0,0,0,0,0,0,0,0,0,0,0,0,0,0,0,0,0,0,0,0,0,0,0,0,0,0,0,0,0,0,0,0,0,0,0,1,0,0,1,0,1,1
ZP00-U.S. COMMISSION ON INTERNATIONAL RELIGIOUS FREEDOM,0,0,0,0,0,0,0,0,0,0,0,0,0,0,0,0,0,0,0,0,0,0,0,0,0,0,0,0,0,0,0,0,0,0,0,0,1,0,0,1,0,1,1
ZS00-UNITED STATES-CHINA ECONOMIC AND SECURITY REVIEW COMMISSION,0,0,0,0,0,0,0,0,0,0,0,0,0,0,0,0,0,0,0,0,0,0,0,0,0,0,0,0,0,0,0,0,0,0,0,0,0,0,0,0,0,0,0
ZU00-DWIGHT D. EISENHOWER MEMORIAL COMMISSION,0,0,0,0,0,0,0,0,0,0,0,0,0,0,0,0,0,0,0,0,0,0,0,0,0,0,0,0,0,0,0,0,0,0,0,0,0,0,0,0,0,0,0
All Agencies,1293,235,0,0,0,14,8,0,0,1550,0,0,0,0,0,9247,0,0,9247,2,10799,936,5217,474,1740,0,3722,24,12,0,12125,7005,2581,1743,65,4,2875,4,0,14277,18,26420,37219
