CE00-COUNCIL OF ECONOMIC ADVISERS,0,0,0,0,0,0,0,0,0,0,0,0,0,0,0,0,0,0,0,0,0,0,0,0,0,0,0,0,0,0,0,0,0,0,0,0,0,0,0,0,2,0,0,2,0,2,2
CF00-COMMISSION OF FINE ARTS,0,0,0,0,0,0,0,0,0,0,0,0,0,0,0,0,0,0,0,0,0,0,0,0,0,0,0,0,0,0,0,0,0,0,0,0,0,0,0,0,0,0,0,0,0,0,0
CM51-OFFICE OF THE SECRETARY,1,0,0,0,0,0,0,0,0,0,1,0,0,0,0,0,0,0,0,0,0,0,1,0,0,3,0,2,0,0,0,0,0,5,0,1,0,0,0,0,0,0,0,1,0,6,7
CM52-ECONOMIC DEVELOPMENT ADMINISTRATION,0,0,0,0,0,0,0,0,0,0,0,0,0,0,0,0,0,0,0,0,0,0,0,0,1,0,0,0,0,0,0,0,0,1,0,0,0,0,0,0,0,0,0,0,0,1,1
CM53-BUREAU OF ECONOMIC ANALYSIS,0,0,0,0,0,0,0,0,0,0,0,0,0,0,0,0,0,0,0,0,0,0,0,0,1,0,0,0,0,0,0,0,0,1,0,0,0,0,0,0,0,0,0,0,0,1,1
CM54-NATIONAL OCEANIC AND ATMOSPHERIC ADMINISTRATION,3,0,0,0,0,0,0,0,0,0,3,0,0,0,0,0,0,0,0,0,0,0,3,4,16,0,0,0,0,0,0,0,0,20,1,1,0,0,1,0,0,0,0,3,0,23,26
CM55-INTERNATIONAL TRADE ADMINISTRATION,0,1,0,0,0,0,0,0,0,0,1,0,0,0,0,0,0,0,0,0,0,0,1,0,0,0,0,0,0,2,0,0,0,2,0,0,0,1,0,0,0,0,0,1,0,3,4
CM56-PATENT AND TRADEMARK OFFICE,2,1,0,0,0,0,0,0,0,0,3,0,0,0,0,0,0,0,0,0,0,0,3,0,234,9,0,0,0,9,0,0,0,252,0,0,0,0,0,0,1,0,0,1,0,253,256
CM57-NATIONAL INSTITUTE OF STANDARDS AND TECHNOLOGY,4,0,0,0,0,0,0,0,0,0,4,0,0,0,0,0,0,0,0,0,0,0,4,0,18,0,0,2,0,0,0,0,0,20,5,6,0,0,0,0,0,0,0,11,0,31,35
CM59-MINORITY BUSINESS DEVELOPMENT AGENCY,0,0,0,0,0,0,0,0,0,0,0,0,0,0,0,0,0,0,0,0,0,0,0,0,0,0,0,0,0,0,0,0,0,0,0,0,0,0,0,0,0,0,0,0,0,0,0
CM61-NATIONAL TELECOMMUNICATIONS AND INFORMATION ADMINISTRATION,0,1,0,0,0,0,0,0,0,0,1,0,0,0,0,0,0,0,0,0,0,0,1,0,1,2,0,0,0,0,0,0,0,3,0,0,0,0,0,0,15,0,0,15,0,18,19
CM62-NATIONAL TECHNICAL INFORMATION SERVICE,0,0,0,0,0,0,0,0,0,0,0,0,0,0,0,0,0,0,0,0,0,0,0,0,1,0,0,0,0,0,0,0,0,1,0,0,0,0,0,0,0,0,0,0,0,1,1
CM63-BUREAU OF THE CENSUS,2,0,0,0,0,0,0,0,0,0,2,0,0,0,0,0,0,0,0,0,0,0,2,0,32,115,0,0,0,0,0,0,0,147,80,0,0,0,3,0,0,0,0,83,0,230,232
CM64-OFFICE OF THE INSPECTOR GENERAL,1,0,0,0,0,0,0,0,0,0,1,0,0,0,0,0,0,0,0,0,0,0,1,1,0,0,0,0,0,0,0,0,0,1,0,0,0,0,0,0,0,0,0,0,0,1,2
CM65-ECONOMICS AND STATISTICS ADMINISTRATION,0,0,0,0,0,0,0,0,0,0,0,0,0,0,0,0,0,0,0,0,0,0,0,0,0,0,0,0,0,0,0,0,0,0,0,0,0,0,0,0,0,0,0,0,0,0,0
CM67-BUREAU OF INDUSTRY AND SECURITY,1,0,0,0,0,0,0,0,0,0,1,0,0,0,0,0,0,0,0,0,0,0,1,1,4,0,0,0,0,0,0,0,0,5,0,0,0,0,0,0,0,0,0,0,0,5,6
CT00-COMMODITY FUTURES TRADING COMMISSION,0,0,0,0,0,0,0,0,0,0,0,0,0,0,0,0,0,0,0,0,0,0,0,0,0,2,0,0,0,0,0,0,0,2,0,1,0,0,0,0,0,0,0,1,0,3,3
CU00-NATIONAL CREDIT UNION ADMINISTRATION,4,3,0,0,0,0,0,0,0,0,7,0,0,0,0,0,0,0,0,0,0,0,7,3,7,1,0,0,0,0,0,0,0,11,2,0,0,0,0,0,0,0,0,2,0,13,20
DB00-PUBLIC INTEREST DECLASSIFICATION BOARD,0,0,0,0,0,0,0,0,0,0,0,0,0,0,0,0,0,0,0,0,0,0,0,0,0,0,0,0,0,0,0,0,0,0,0,0,0,0,0,0,0,0,0,0,0,0,0
DD**-UNSPECIFIED,0,0,0,0,0,0,0,0,0,0,0,0,0,0,0,0,0,0,0,0,0,0,0,0,0,0,0,0,0,0,0,0,0,0,0,0,0,0,0,0,0,0,0,0,0,0,0
DD01-OFFICE OF THE SECRETARY OF DEFENSE,2,0,0,0,0,0,0,0,0,0,2,0,0,0,0,0,0,0,0,0,0,0,2,1,2,1,1,0,0,1,0,0,0,6,0,0,0,0,0,0,2,0,0,2,0,8,10
DD02-ORGANIZATION OF THE JOINT CHIEFS OF STAFF,3,1,0,0,0,0,0,0,0,0,4,0,0,0,0,0,0,0,0,0,0,0,4,0,3,0,0,0,0,0,0,0,0,3,2,0,0,0,0,0,0,0,0,2,0,5,9
DD04-DEFENSE INFORMATION SYSTEMS AGENCY,9,4,0,0,0,0,0,0,0,0,13,0,0,0,0,0,0,0,0,0,0,0,13,3,20,0,0,0,0,0,0,0,0,23,1,0,0,0,0,0,0,0,0,1,0,24,37
DD06-DEFENSE SECURITY COOPERATION AGENCY,2,0,0,0,0,0,0,0,0,0,2,0,0,0,0,0,0,0,0,0,0,0,2,0,0,0,0,0,0,0,0,0,0,0,0,0,0,0,0,0,1,0,0,1,0,1,3
DD07-DEFENSE LOGISTICS AGENCY,15,11,0,0,0,0,0,0,0,0,26,0,0,0,0,0,0,0,0,0,0,0,26,5,68,3,0,1,0,10,0,0,0,87,13,0,0,0,0,0,1,0,0,14,0,101,127
DD08-U.S. COURT OF APPEALS FOR THE ARMED FORCES,0,0,0,0,0,0,0,0,0,0,0,0,0,0,0,0,0,0,0,0,0,0,0,0,0,0,0,0,0,0,0,0,0,0,0,0,0,0,0,0,1,0,0,1,0,1,1
DD10-DEFENSE CONTRACT AUDIT AGENCY,5,0,0,0,0,0,0,0,0,0,5,0,0,0,0,0,0,0,0,0,0,0,5,2,48,2,0,0,0,1,0,0,0,53,2,2,0,0,0,0,0,0,0,4,0,57,62
DD12-DEFENSE SECURITY SERVICE,0,0,0,0,0,0,0,0,0,0,0,0,0,0,0,0,0,0,0,0,0,0,0,0,0,0,0,0,0,10,0,0,0,10,0,0,0,0,0,0,0,0,0,0,0,10,10
DD13-DEFENSE ADVANCED RESEARCH PROJECTS AGENCY,0,0,0,0,0,0,0,0,0,0,0,0,0,0,0,0,0,0,0,0,0,0,0,0,0,0,0,0,0,0,0,0,0,0,0,0,0,0,0,0,3,0,0,3,0,3,3
DD16-DEPARTMENT OF DEFENSE EDUCATION ACTIVITY,2,0,0,0,0,0,1,0,0,0,3,0,0,0,0,0,0,0,0,0,0,0,3,2,2,20,0,0,0,33,1,0,0,58,1,325,0,0,0,0,86,0,0,412,0,470,473
DD21-WASHINGTON HEADQUARTERS SERVICES,4,1,0,0,0,0,0,0,0,0,5,0,0,0,0,0,0,0,0,0,0,0,5,2,7,1,0,2,0,0,0,0,0,12,0,1,0,0,0,0,3,0,0,4,0,16,21
DD23-OFFICE OF ECONOMIC ADJUSTMENT,0,0,0,0,0,0,0,0,0,0,0,0,0,0,0,0,0,0,0,0,0,0,0,0,0,0,0,0,0,0,0,0,0,0,0,0,0,0,0,0,0,0,0,0,0,0,0
DD25-DEFENSE LEGAL SERVICES AGENCY,0,0,0,0,0,0,0,0,0,0,0,0,0,0,0,0,0,0,0,0,0,0,0,0,0,1,0,0,0,0,0,0,0,1,0,0,0,0,0,0,0,0,0,0,0,1,1
DD26-OFFICE OF THE INSPECTOR GENERAL,6,0,0,0,0,0,0,0,0,0,6,0,0,0,0,0,0,0,0,0,0,0,6,2,2,0,8,0,0,0,0,0,0,12,1,1,0,0,0,0,0,0,0,2,0,14,20
DD27-MISSILE DEFENSE AGENCY,2,0,0,0,0,0,0,0,0,0,2,0,0,0,0,0,0,0,0,0,0,0,2,0,36,0,0,0,0,0,0,0,0,36,0,0,0,0,0,0,0,0,0,0,0,36,38
DD29-DEFENSE TECHNOLOGY SECURITY ADMINISTRATION,0,0,0,0,0,0,0,0,0,0,0,0,0,0,0,0,0,0,0,0,0,0,0,0,1,0,0,0,0,0,0,0,0,1,0,0,0,0,0,0,0,0,0,0,0,1,1
DD34-DEFENSE COMMISSARY AGENCY,1,2,0,0,0,0,0,0,0,0,3,0,0,0,0,0,0,0,0,0,0,0,3,3,195,2,0,0,0,1,0,0,0,201,12,22,0,0,0,0,0,0,0,34,0,235,238
DD35-DEFENSE FINANCE AND ACCOUNTING SERVICE,3,0,0,0,0,0,0,0,0,0,3,0,0,0,0,0,0,0,0,0,0,0,3,0,28,2,0,0,0,2,0,0,0,32,3,0,0,0,0,0,0,0,0,3,0,35,38
DD48-DEFENSE HUMAN RESOURCES ACTIVITY,5,0,0,0,0,0,0,0,0,0,5,0,0,0,0,0,0,0,0,0,0,0,5,1,1,0,0,0,0,24,0,0,0,26,0,0,0,0,0,0,0,0,0,0,0,26,31
DD58-DEFENSE PRISONER OF WAR/MISSING PERSONNEL OFFICE,0,0,0,0,0,0,0,0,0,0,0,0,0,0,0,0,0,0,0,0,0,0,0,0,0,0,0,0,0,0,0,0,0,0,0,0,0,0,0,0,0,0,0,0,0,0,0
DD60-DEFENSE HEALTH AGENCY,5,5,0,0,0,0,0,0,0,0,10,0,0,0,0,0,0,0,0,0,0,0,10,0,26,1,0,0,0,0,1,0,0,28,1,3,0,0,0,0,0,0,0,4,0,32,42
DD61-DEFENSE THREAT REDUCTION AGENCY,1,1,0,0,0,0,0,0,0,0,2,0,0,0,0,0,0,0,0,0,0,0,2,0,7,0,0,0,0,1,0,0,0,8,0,0,0,0,0,0,0,0,0,0,0,8,10
DD63-DEFENSE CONTRACT MANAGEMENT AGENCY,27,12,0,0,0,0,0,0,0,0,39,0,0,0,0,0,0,0,0,0,0,0,39,11,70,1,0,1,0,2,0,0,0,85,7,0,0,0,0,0,0,0,0,7,0,92,131
DD65-PENTAGON FORCE PROTECTION AGENCY,4,0,0,0,0,0,0,0,0,0,4,0,0,0,0,0,0,0,0,0,0,0,4,2,4,0,0,0,0,0,0,0,0,6,0,0,0,0,0,0,0,0,0,0,0,6,10
DD68-DEPARTMENT OF DEFENSE TEST RESOURCE MANAGEMENT CENTER,0,0,0,0,0,0,0,0,0,0,0,0,0,0,0,0,0,0,0,0,0,0,0,0,0,0,0,0,0,0,0,0,0,0,0,0,0,0,0,0,0,0,0,0,0,0,0
DD69-NATIONAL DEFENSE UNIVERSITY,0,0,0,0,0,0,0,0,0,0,0,0,0,0,0,0,0,0,0,0,0,0,0,0,0,0,0,0,0,0,0,0,0,0,0,0,0,0,0,0,1,0,0,1,0,1,1
DD71-DEFENSE MICROELECTRONICS ACTIVITY,0,0,0,0,0,0,0,0,0,0,0,0,0,0,0,0,0,0,0,0,0,0,0,0,0,0,0,0,0,0,0,0,0,0,0,0,0,0,0,0,0,0,0,0,0,0,0
DD74-DEFENSE TECHNICAL INFORMATION CENTER,1,0,0,0,0,0,0,0,0,0,1,0,0,0,0,0,0,0,0,0,0,0,1,0,1,0,0,0,0,0,0,0,0,1,0,0,0,0,0,0,0,0,0,0,0,1,2
DD77-BUSINESS TRANSFORMATION AGENCY,0,0,0,0,0,0,0,0,0,0,0,0,0,0,0,0,0,0,0,0,0,0,0,0,0,0,0,0,0,0,0,0,0,0,0,0,0,0,0,0,0,0,0,0,0,0,0
DD80-DEFENSE MEDIA ACTIVITY,0,0,0,0,0,0,0,0,0,0,0,0,0,0,0,0,0,0,0,0,0,0,0,0,4,1,0,0,0,0,0,0,0,5,1,0,0,0,0,0,0,0,0,1,0,6,6
DD81-DEFENSE ACQUISITION UNIVERSITY,0,0,0,0,0,0,0,0,0,0,0,0,0,0,0,0,0,0,0,0,0,0,0,0,1,0,0,0,0,0,0,0,0,1,0,0,0,0,0,0,3,0,0,3,0,4,4
DF00-OFFICE OF THE FEDERAL COORDINATOR FOR ALASKA NATURAL GAS TRANSPORTATION PROJECTS,0,0,0,0,0,0,0,0,0,0,0,0,0,0,0,0,0,0,0,0,0,0,0,0,0,0,0,0,0,0,0,0,0,0,0,0,0,0,0,0,0,0,0,0,0,0,0
DG00-NORTHERN BORDER REGIONAL COMMISSION,0,0,0,0,0,0,0,0,0,0,0,0,0,0,0,0,0,0,0,0,0,0,0,0,0,0,0,0,0,0,0,0,0,0,0,0,0,0,0,0,0,0,0,0,0,0,0
"DJ01-OFFICES, BOARDS AND DIVISIONS",5,0,0,0,0,0,0,0,1,0,6,0,0,0,0,0,0,0,0,0,0,0,6,1,8,7,0,2,0,0,0,0,0,18,21,19,0,2,2,0,0,0,0,44,0,62,68
DJ02-FEDERAL BUREAU OF INVESTIGATION,0,0,0,0,0,0,0,0,0,0,0,0,0,0,0,0,0,0,0,0,0,0,0,0,0,1,0,0,0,323,1,0,0,325,0,0,0,0,0,0,6,0,0,6,0,331,331
DJ03-BUREAU OF PRISONS/FEDERAL PRISON SYSTEM,0,1,0,0,0,0,0,0,0,0,1,0,0,0,0,0,0,0,0,0,0,0,1,2,323,7,0,0,0,8,0,0,0,340,3,3,0,0,3,0,0,0,0,9,0,349,350
DJ06-DRUG ENFORCEMENT ADMINISTRATION,1,1,0,0,0,0,0,0,0,0,2,0,0,0,0,0,0,0,0,0,0,0,2,0,3,2,44,0,0,0,0,0,0,49,0,1,0,0,0,0,0,0,0,1,0,50,52
DJ07-OFFICE OF JUSTICE PROGRAMS,0,1,0,0,0,0,0,0,0,0,1,0,0,0,0,0,0,0,0,0,0,0,1,0,0,0,0,0,0,0,0,0,0,0,0,0,0,0,0,0,0,0,0,0,0,0,1
DJ08-U.S. MARSHALS SERVICE,2,0,0,0,0,0,0,0,0,0,2,0,0,0,0,0,0,0,0,0,0,0,2,0,3,0,0,0,0,1,0,0,0,4,0,0,0,0,0,0,0,0,0,0,0,4,6
DJ09-EXECUTIVE OFFICE FOR U.S. ATTORNEYS AND THE OFFICES OF THE U.S. ATTORNEYS,0,3,0,0,0,0,0,0,0,0,3,0,0,0,0,0,0,0,0,0,0,0,3,0,16,0,0,1,0,1,0,0,0,18,0,1,0,0,53,0,41,0,0,95,1,114,117
DJ10-OFFICE OF THE INSPECTOR GENERAL,0,0,0,0,0,0,0,0,0,0,0,0,0,0,0,0,0,0,0,0,0,0,0,0,0,0,0,0,0,0,0,0,0,0,0,0,0,0,1,0,0,0,0,1,0,1,1
DJ11-U.S. TRUSTEE PROGRAM,0,0,0,0,0,0,0,0,0,0,0,0,0,0,0,0,0,0,0,0,0,0,0,0,0,0,0,0,0,0,0,0,0,0,0,0,0,0,0,0,0,0,0,0,0,0,0
DJ12-EXECUTIVE OFFICE FOR IMMIGRATION REVIEW,0,0,0,0,0,0,0,0,0,0,0,0,0,0,0,0,0,0,0,0,0,0,0,0,1,0,0,0,0,0,0,0,0,1,0,27,0,0,0,0,0,0,0,27,0,28,28
DJ14-COMMUNITY RELATIONS SERVICE,0,0,0,0,0,0,0,0,0,0,0,0,0,0,0,0,0,0,0,0,0,0,0,0,0,0,0,0,0,0,0,0,0,0,0,0,0,0,0,0,0,0,0,0,0,0,0
"DJ15-BUREAU OF ALCOHOL, TOBACCO, FIREARMS, AND EXPLOSIVES",1,0,0,0,0,0,0,0,0,0,1,0,0,0,0,0,0,0,0,0,0,0,1,0,30,0,0,0,0,0,0,0,0,30,0,0,0,0,0,0,0,0,0,0,0,30,31
DLAA-OFFICE OF THE SECRETARY OF LABOR,2,0,0,0,0,0,0,0,0,0,2,0,0,0,0,0,0,0,0,0,0,0,2,0,0,0,0,0,0,0,0,0,0,0,0,10,0,0,0,0,0,0,0,10,0,10,12
DLAM-OFFICE OF THE ASSISTANT SECRETARY FOR ADMINISTRATION AND MANAGEMENT,1,1,0,0,0,0,0,0,0,0,2,0,0,0,0,0,0,0,0,0,0,0,2,0,5,1,0,0,0,2,0,0,0,8,0,0,0,0,0,0,0,0,0,0,0,8,10
DLBL-BUREAU OF INTERNATIONAL LABOR AFFAIRS,0,0,0,0,0,0,0,0,0,0,0,0,0,0,0,0,0,0,0,0,0,0,0,0,0,0,0,0,0,0,0,0,0,0,0,0,0,0,0,0,0,0,0,0,0,0,0
DLCA-OFFICE OF CONGRESSIONAL AND INTERGOVERNMENTAL AFFAIRS,0,0,0,0,0,0,0,0,0,0,0,0,0,0,0,0,0,0,0,0,0,0,0,0,0,0,0,0,0,0,0,0,0,0,0,0,0,0,0,0,0,0,0,0,0,0,0
DLCF-OFFICE OF THE CHIEF FINANCIAL OFFICER,0,0,0,0,0,0,0,0,0,0,0,0,0,0,0,0,0,0,0,0,0,0,0,0,0,0,0,0,0,0,0,0,0,0,0,0,0,0,0,0,0,0,0,0,0,0,0
DLEB-EMPLOYEE BENEFITS SECURITY ADMINISTRATION,0,0,0,0,0,0,0,0,0,0,0,0,0,0,0,0,0,0,0,0,0,0,0,0,0,0,0,0,0,0,0,0,0,0,0,0,0,0,0,0,0,0,0,0,0,0,0
DLEH-OFFICE OF DISABILITY EMPLOYMENT POLICY,0,0,0,0,0,0,0,0,0,0,0,0,0,0,0,0,0,0,0,0,0,0,0,0,0,0,0,0,0,0,0,0,0,0,0,0,0,0,0,0,0,0,0,0,0,0,0
DLES-EMPLOYMENT STANDARDS ADMINISTRATION,0,0,0,0,0,0,0,0,0,0,0,0,0,0,0,0,0,0,0,0,0,0,0,0,0,0,0,0,0,0,0,0,0,0,0,0,0,0,0,0,0,0,0,0,0,0,0
DLET-EMPLOYMENT AND TRAINING ADMINISTRATION,15,1,0,0,0,0,0,0,0,0,16,0,0,0,0,0,0,0,0,0,0,0,16,1,5,0,0,0,0,1,0,0,0,7,0,0,0,0,0,0,0,0,0,0,0,7,23
DLIG-OFFICE OF THE INSPECTOR GENERAL,1,0,0,0,0,0,0,0,0,0,1,0,0,0,0,0,0,0,0,0,0,0,1,0,0,0,0,0,0,0,0,0,0,0,0,0,0,0,0,0,0,0,0,0,0,0,1
DLLS-BUREAU OF LABOR STATISTICS,1,0,0,0,0,0,0,0,0,0,1,0,0,0,0,0,0,0,0,0,0,0,1,0,14,0,0,0,0,1,0,0,0,15,0,0,0,0,0,0,0,0,0,0,0,15,16
DLMS-MINE SAFETY AND HEALTH ADMINISTRATION,2,0,0,0,0,0,0,0,0,0,2,0,0,0,0,0,0,0,0,0,0,0,2,0,24,2,0,0,0,1,0,0,0,27,0,0,0,0,0,0,0,0,0,0,0,27,29
DLOF-OFFICE OF FEDERAL CONTRACT COMPLIANCE PROGRAMS,3,0,0,0,0,0,0,0,0,0,3,0,0,0,0,0,0,0,0,0,0,0,3,0,2,1,0,0,0,1,0,0,0,4,0,0,0,0,0,0,0,0,0,0,0,4,7
DLOL-OFFICE OF LABOR-MANAGEMENT STANDARDS,0,0,0,0,0,0,0,0,0,0,0,0,0,0,0,0,0,0,0,0,0,0,0,0,2,0,0,0,0,0,0,0,0,2,0,0,0,0,0,0,0,0,0,0,0,2,2
DLOW-OFFICE OF WORKERS' COMPENSATION PROGRAMS,5,3,0,0,0,0,0,0,0,0,8,0,0,0,0,0,0,0,0,0,0,0,8,3,18,8,0,0,0,8,0,0,0,37,1,0,0,0,0,0,0,0,0,1,0,38,46
DLPA-OFFICE OF PUBLIC AFFAIRS,0,0,0,0,0,0,0,0,0,0,0,0,0,0,0,0,0,0,0,0,0,0,0,0,0,0,0,0,0,0,0,0,0,0,0,0,0,0,0,0,0,0,0,0,0,0,0
DLPE-OFFICE OF THE ASSISTANT SECRETARY FOR POLICY,0,0,0,0,0,0,0,0,0,0,0,0,0,0,0,0,0,0,0,0,0,0,0,0,0,0,0,0,0,0,0,0,0,0,0,0,0,0,0,0,0,0,0,0,0,0,0
DLPW-EMPLOYEE BENEFITS SECURITY ADMINISTRATION,1,2,0,0,0,0,0,0,0,0,3,0,0,0,0,0,0,0,0,0,0,0,3,1,6,1,0,0,0,0,0,0,0,8,0,0,0,0,0,0,0,0,0,0,0,8,11
DLSH-OCCUPATIONAL SAFETY AND HEALTH ADMINISTRATION,2,1,0,0,0,0,0,0,0,0,3,0,0,0,0,0,0,0,0,0,0,0,3,0,12,0,0,3,0,0,0,0,0,15,0,0,0,0,0,0,0,0,0,0,0,15,18
DLSL-OFFICE OF THE SOLICITOR,1,0,0,0,0,0,0,0,0,0,1,0,0,0,0,0,0,0,0,0,0,0,1,0,0,3,0,0,0,0,0,0,0,3,2,5,0,0,0,0,2,0,0,9,0,12,13
DLVE-VETERANS EMPLOYMENT AND TRAINING SERVICES,0,0,0,0,0,0,0,0,0,0,0,0,0,0,0,0,0,0,0,0,0,0,0,0,6,0,0,0,0,1,0,0,0,7,3,0,0,0,0,0,0,0,0,3,0,10,10
DLWB-WOMEN'S BUREAU,0,0,0,0,0,0,0,0,0,0,0,0,0,0,0,0,0,0,0,0,0,0,0,0,0,0,0,1,0,0,0,0,0,1,0,0,0,0,0,0,0,0,0,0,0,1,1
DLWH-WAGE AND HOUR DIVISION,1,0,0,0,0,0,0,0,0,0,1,0,0,0,0,0,0,0,0,0,0,0,1,0,1,0,0,2,0,0,0,0,0,3,0,0,0,0,0,0,0,0,0,0,0,3,4
DN**-UNSPECIFIED,0,0,0,0,0,0,0,0,0,0,0,0,0,0,0,0,0,0,0,0,0,0,0,0,0,0,0,0,0,0,0,0,0,0,0,0,0,0,0,0,0,0,0,0,0,0,0
DN00-DEPARTMENT OF ENERGY,15,3,0,0,0,0,0,0,0,0,18,0,0,0,0,0,0,0,0,0,0,0,18,4,17,1,0,2,0,0,0,0,0,24,5,1,0,1,0,0,2,0,0,9,0,33,51
DNFE-FEDERAL ENERGY REGULATORY COMMISSION,1,0,0,0,0,0,0,0,0,0,1,0,0,0,0,0,0,0,0,0,0,0,1,1,4,6,0,0,0,0,0,0,0,11,0,4,0,0,0,0,0,0,0,4,0,15,16
DQ00-DENALI COMMISSION,0,0,0,0,0,0,0,0,0,0,0,0,0,0,0,0,0,0,0,0,0,0,0,0,0,0,0,0,0,0,0,0,0,0,0,0,0,0,0,0,0,0,0,0,0,0,0
EB00-EXPORT-IMPORT BANK OF THE UNITED STATES,0,0,0,0,0,0,0,0,0,0,0,0,0,0,0,0,0,0,0,0,0,0,0,0,1,0,0,0,0,0,0,0,0,1,0,1,0,0,0,0,0,0,0,1,0,2,2
EC00-OFFICE OF ADMINISTRATION,1,0,0,0,0,0,0,0,0,0,1,0,0,0,0,0,0,0,0,0,0,0,1,0,1,0,0,0,0,0,0,0,0,1,0,0,0,0,0,0,0,0,0,0,0,1,2
EDEA-IMMEDIATE OFFICE OF THE SECRETARY OF EDUCATION,0,0,0,0,0,0,0,0,0,0,0,0,0,0,0,0,0,0,0,0,0,0,0,0,0,0,0,0,0,0,0,0,0,0,0,0,0,0,0,0,0,0,0,0,0,0,0
EDEB-OFFICE OF THE DUTY SECRETARY OF EDUCATION,0,0,0,0,0,0,0,0,0,0,0,0,0,0,0,0,0,0,0,0,0,0,0,0,0,0,0,0,0,0,0,0,0,0,0,0,0,0,0,0,0,0,0,0,0,0,0
EDEC-OFFICE FOR CIVIL RIGHTS,0,0,0,0,0,0,0,0,0,0,0,0,0,0,0,0,0,0,0,0,0,0,0,0,2,15,0,0,0,0,0,0,0,17,0,0,0,0,0,0,0,0,0,0,0,17,17
"EDED-OFFICE OF PLANNING, EVALUATION AND POLICY DEVELOPMENT",0,0,0,0,0,0,0,0,0,0,0,0,0,0,0,0,0,0,0,0,0,0,0,0,0,0,0,0,0,0,0,0,0,0,0,0,0,0,0,0,0,0,0,0,0,0,0
EDEE-OFFICE OF THE UNDER SECRETARY,0,0,0,0,0,0,0,0,0,0,0,0,0,0,0,0,0,0,0,0,0,0,0,0,0,0,0,0,0,0,0,0,0,0,0,0,0,1,0,0,1,0,0,2,0,2,2
EDEF-OFFICE OF INSPECTOR GENERAL,0,0,0,0,0,0,0,0,0,0,0,0,0,0,0,0,0,0,0,0,0,0,0,0,0,0,0,0,0,0,0,0,0,0,0,0,0,0,0,0,0,0,0,0,0,0,0
EDEG-OFFICE OF THE GENERAL COUNSEL,0,0,0,0,0,0,0,0,0,0,0,0,0,0,0,0,0,0,0,0,0,0,0,0,0,0,0,0,0,0,0,0,0,0,0,0,0,0,0,0,0,0,0,0,0,0,0
EDEH-OFFICE OF SPECIAL EDUCATION AND REHABILITATIVE SERVICES,0,0,0,0,0,0,0,0,0,0,0,0,0,0,0,0,0,0,0,0,0,0,0,0,0,0,0,0,0,0,0,0,0,0,0,0,0,0,0,0,0,0,0,0,0,0,0
EDEI-OFFICE OF THE CHIEF INFORMATION OFFICER,0,0,0,0,0,0,0,0,0,0,0,0,0,0,0,0,0,0,0,0,0,0,0,0,0,0,0,0,0,0,0,0,0,0,0,0,0,0,0,0,0,0,0,0,0,0,0
EDEJ-OFFICE OF LEGISLATION AND CONGRESSIONAL AFFAIRS,0,0,0,0,0,0,0,0,0,0,0,0,0,0,0,0,0,0,0,0,0,0,0,0,0,0,0,1,0,0,0,0,0,1,0,0,0,0,0,0,0,0,0,0,0,1,1
EDEL-OFFICE OF THE CHIEF FINANCIAL OFFICER,0,0,0,0,0,0,0,0,0,0,0,0,0,0,0,0,0,0,0,0,0,0,0,0,3,0,0,0,0,0,0,0,0,3,0,0,0,0,0,0,0,0,0,0,0,3,3
EDEM-OFFICE OF MANAGEMENT,0,0,0,0,0,0,0,0,0,0,0,0,0,0,0,0,0,0,0,0,0,0,0,0,0,0,0,0,0,0,0,0,0,0,0,0,0,0,0,0,0,0,0,0,0,0,0
EDEN-FEDERAL STUDENT AID,1,0,0,0,0,0,0,1,0,0,2,0,0,0,0,0,0,0,0,0,0,0,2,0,4,0,0,0,0,2,0,0,0,6,0,0,0,0,0,0,0,0,0,0,0,6,8
EDEO-OFFICE OF COMMUNICATIONS AND OUTREACH,0,0,0,0,0,0,0,0,0,0,0,0,0,0,0,0,0,0,0,0,0,0,0,0,0,0,0,0,0,0,0,0,0,0,0,0,0,2,0,0,0,0,0,2,0,2,2
EDEP-OFFICE OF POSTSECONDARY EDUCATION,0,0,0,0,0,0,0,0,0,0,0,0,0,0,0,0,0,0,0,0,0,0,0,0,0,0,0,0,0,0,0,0,0,0,0,0,0,0,0,0,0,0,0,0,0,0,0
EDEQ-OFFICE OF SAFE AND DRUG-FREE SCHOOLS,0,0,0,0,0,0,0,0,0,0,0,0,0,0,0,0,0,0,0,0,0,0,0,0,0,0,0,0,0,0,0,0,0,0,0,0,0,0,0,0,0,0,0,0,0,0,0
EDER-INSTITUTE OF EDUCATION SCIENCES,0,0,0,0,0,0,0,0,0,0,0,0,0,0,0,0,0,0,0,0,0,0,0,0,0,0,0,0,0,0,0,0,0,0,0,0,0,0,0,0,1,0,0,1,0,1,1
EDES-OFFICE OF ELEMENTARY AND SECONDARY EDUCATION,0,0,0,0,0,0,0,0,0,0,0,0,0,0,0,0,0,0,0,0,0,0,0,0,2,0,0,0,0,0,0,0,0,2,0,0,0,0,0,0,0,0,0,0,0,2,2
EDET-OFFICE OF ENGLISH LANGUAGE ACQUISITION,0,0,0,0,0,0,0,0,0,0,0,0,0,0,0,0,0,0,0,0,0,0,0,0,0,0,0,0,0,0,0,0,0,0,0,0,0,0,0,0,0,0,0,0,0,0,0
EDEU-OFFICE OF INNOVATION AND IMPROVEMENT,0,0,0,0,0,0,0,0,0,0,0,0,0,0,0,0,0,0,0,0,0,0,0,0,0,0,0,0,0,0,0,0,0,0,0,0,0,1,0,0,0,0,0,1,0,1,1
EDEV-OFFICE OF VOCATIONAL AND ADULT EDUCATION,0,0,0,0,0,0,0,0,0,0,0,0,0,0,0,0,0,0,0,0,0,0,0,0,0,0,0,0,0,0,0,0,0,0,0,0,0,0,0,0,0,0,0,0,0,0,0
EDEX-NATIONAL INSTITUTE FOR LITERACY,0,0,0,0,0,0,0,0,0,0,0,0,0,0,0,0,0,0,0,0,0,0,0,0,0,0,0,0,0,0,0,0,0,0,0,0,0,0,0,0,0,0,0,0,0,0,0
EDEY-ADVISORY COUNCILS AND COMMITTEES,0,0,0,0,0,0,0,0,0,0,0,0,0,0,0,0,0,0,0,0,0,0,0,0,0,0,0,0,0,0,0,0,0,0,0,0,0,0,0,0,0,0,0,0,0,0,0
EDEZ-NATIONAL ASSESSMENT GOVERNING BOARD,0,0,0,0,0,0,0,0,0,0,0,0,0,0,0,0,0,0,0,0,0,0,0,0,0,0,0,0,0,0,0,0,0,0,0,0,0,0,0,0,0,0,0,0,0,0,0
EE00-EQUAL EMPLOYMENT OPPORTUNITY COMMISSION,0,0,0,0,0,0,0,0,0,0,0,0,0,0,0,0,0,0,0,0,0,0,0,0,0,1,0,0,0,0,0,0,0,1,0,0,0,0,0,0,0,0,0,0,0,1,1
EO00-MORRIS K. UDALL AND STEWART L. UDALL FOUNDATION,0,0,0,0,0,0,0,0,0,0,0,0,0,0,0,0,0,0,0,0,0,0,0,0,0,0,0,0,0,0,0,0,0,0,0,0,0,0,0,0,0,0,0,0,0,0,0
EP00-ENVIRONMENTAL PROTECTION AGENCY,0,0,0,0,0,0,0,0,0,0,0,0,0,0,0,0,0,0,0,0,0,0,0,0,2,0,0,1,0,0,0,1,0,4,0,6,0,0,0,0,5,0,0,11,0,15,15
EQ00-COUNCIL ON ENVIRONMENTAL QUALITY/OFFICE OF ENVIRONMENTAL QUALITY,0,0,0,0,0,0,0,0,0,0,0,0,0,0,0,0,0,0,0,0,0,0,0,0,0,0,0,0,0,0,0,0,0,0,0,1,0,0,0,0,0,0,0,1,0,1,1
EW00-TRADE AND DEVELOPMENT AGENCY,0,0,0,0,0,0,0,0,0,0,0,0,0,0,0,0,0,0,0,0,0,0,0,0,0,0,0,0,0,0,0,0,0,0,0,0,0,0,0,0,0,0,0,0,0,0,0
FC00-FEDERAL COMMUNICATIONS COMMISSION,2,2,0,0,0,0,0,0,0,0,4,0,0,0,0,0,0,0,0,0,0,0,4,0,1,7,0,0,0,0,0,0,0,8,1,5,0,1,1,0,2,0,0,10,0,18,22
FD00-FEDERAL DEPOSIT INSURANCE CORPORATION,2,0,0,0,0,0,0,0,0,0,2,0,0,0,0,0,0,0,0,0,0,0,2,4,4,0,0,1,0,0,0,0,0,9,8,6,0,0,0,0,0,0,0,14,0,23,25
FI00-FEDERAL FINANCIAL INSTITUTIONS EXAMINATION COUNCIL,0,0,0,0,0,0,0,0,0,0,0,0,0,0,0,0,0,0,0,0,0,0,0,0,0,0,0,0,0,0,0,0,0,0,0,0,0,0,0,0,0,0,0,0,0,0,0
FJ00-CHEMICAL SAFETY AND HAZARD INVESTIGATION BOARD,0,0,0,0,0,0,0,0,0,0,0,0,0,0,0,0,0,0,0,0,0,0,0,0,0,0,0,0,0,0,0,0,0,0,0,0,0,0,0,0,0,0,0,0,0,0,0
FK00-FARM CREDIT SYSTEM INSURANCE CORPORATION,0,0,0,0,0,0,0,0,0,0,0,0,0,0,0,0,0,0,0,0,0,0,0,0,0,0,0,0,0,0,0,0,0,0,0,0,0,0,0,0,0,0,0,0,0,0,0
FL00-FARM CREDIT ADMINISTRATION,0,0,0,0,0,0,0,0,0,0,0,0,0,0,0,0,0,0,0,0,0,0,0,0,0,0,0,0,0,0,0,0,0,0,0,0,0,0,0,0,0,0,0,0,0,0,0
FM00-FEDERAL MEDIATION AND CONCILIATION SERVICE,0,0,0,0,0,0,0,0,0,0,0,0,0,0,0,0,0,0,0,0,0,0,0,0,0,0,0,0,0,2,0,0,0,2,0,0,0,0,0,0,0,0,0,0,0,2,2
FQ01-OFFICE OF THE DIRECTOR,0,0,0,0,0,0,0,0,0,0,0,0,0,0,0,0,0,0,0,0,0,0,0,1,1,0,0,0,0,0,0,0,0,2,0,0,0,0,0,0,0,0,0,0,0,2,2
FQ02-PRETRIAL SERVICES AGENCY,0,0,0,0,0,0,0,0,0,0,0,0,0,0,0,0,0,0,0,0,0,0,0,0,0,0,0,0,0,0,0,0,0,0,0,0,0,0,0,0,0,0,0,0,0,0,0
FRFT-BUREAU OF CONSUMER FINANCIAL PROTECTION,5,0,0,0,0,0,0,0,0,0,5,0,0,0,0,0,0,0,0,0,0,0,5,1,0,2,0,0,0,7,0,0,0,10,0,5,0,0,0,0,16,0,0,21,0,31,36
FT00-FEDERAL TRADE COMMISSION,4,0,0,0,0,0,0,0,0,0,4,0,0,0,0,0,0,0,0,0,0,0,4,0,1,6,0,0,0,0,0,0,0,7,8,6,0,0,0,0,0,0,0,14,0,21,25
FW00-OFFICE OF SPECIAL COUNSEL,0,0,0,0,0,0,0,0,0,0,0,0,0,0,0,0,0,0,0,0,0,0,0,0,0,0,0,0,0,0,0,0,0,0,0,1,0,0,0,0,4,0,0,5,0,5,5
FY00-FEDERAL HOUSING FINANCE BOARD,0,0,0,0,0,0,0,0,0,0,0,0,0,0,0,0,0,0,0,0,0,0,0,0,0,0,0,0,0,0,0,0,0,0,0,0,0,0,0,0,0,0,0,0,0,0,0
GB00-OVERSEAS PRIVATE INVESTMENT CORPORATION,2,0,0,0,0,0,0,0,0,0,2,0,0,0,0,0,0,0,0,0,0,0,2,0,0,0,0,0,0,0,0,0,0,0,0,0,0,0,0,0,0,0,0,0,0,0,2
GE00-BARRY GOLDWATER SCHOLARSHIP AND EXCELLENCE IN EDUCATION FOUNDATION,0,0,0,0,0,0,0,0,0,0,0,0,0,0,0,0,0,0,0,0,0,0,0,0,0,0,0,0,0,0,0,0,0,0,0,0,0,0,0,0,0,0,0,0,0,0,0
GG00-OFFICE OF GOVERNMENT ETHICS,2,0,0,0,0,0,0,0,0,0,2,0,0,0,0,0,0,0,0,0,0,0,2,0,0,0,0,0,0,0,0,0,0,0,0,1,0,0,0,0,0,0,0,1,0,1,3
GJ00-PRESIDIO TRUST,0,0,0,0,0,0,0,0,0,0,0,0,0,0,0,0,0,0,0,0,0,0,0,0,0,0,0,0,0,0,0,0,0,0,0,0,0,0,0,0,0,0,0,0,0,0,0
GM00-VALLES CALDERA TRUST,0,0,0,0,0,0,0,0,0,0,0,0,0,0,0,0,0,0,0,0,0,0,0,0,0,0,0,0,0,0,0,0,0,0,0,0,0,0,0,0,1,0,0,1,0,1,1
GO00-VIETNAM EDUCATION FOUNDATION,0,0,0,0,0,0,0,0,0,0,0,0,0,0,0,0,0,0,0,0,0,0,0,0,0,0,0,0,0,0,0,0,0,0,0,0,0,0,0,0,0,0,0,0,0,0,0
GQ00-ELECTION ASSISTANCE COMMISSION,0,0,0,0,0,0,0,0,0,0,0,0,0,0,0,0,0,0,0,0,0,0,0,0,0,0,0,0,0,0,0,0,0,0,0,0,0,0,0,0,0,0,0,0,0,0,0
GS01-IMMEDIATE OFFICE OF THE ADMINISTRATOR,0,0,0,0,0,0,0,0,0,0,0,0,0,0,0,0,0,0,0,0,0,0,0,0,0,0,0,0,0,0,0,0,0,0,0,0,0,0,0,0,0,0,0,0,0,0,0
GS02-OFFICE OF ADMINISTRATIVE SERVICES,0,0,0,0,0,0,0,0,0,0,0,0,0,0,0,0,0,0,0,0,0,0,0,0,0,0,0,0,0,0,0,0,0,0,0,0,0,0,0,0,0,0,0,0,0,0,0
GS03-PUBLIC BUILDINGS SERVICE,0,0,0,0,0,0,0,0,1,0,1,0,0,0,0,0,0,0,0,0,0,0,1,2,4,1,0,0,0,0,0,0,0,7,0,0,0,0,0,0,0,0,0,0,0,7,8
GS04-OFFICE OF CIVIL RIGHTS,0,0,0,0,0,0,0,0,0,0,0,0,0,0,0,0,0,0,0,0,0,0,0,0,0,0,0,0,0,0,0,0,0,0,0,0,0,0,0,0,0,0,0,0,0,0,0
GS10-OFFICE OF SMALL BUSINESS UTILIZATION,0,0,0,0,0,0,0,0,0,0,0,0,0,0,0,0,0,0,0,0,0,0,0,0,0,0,0,0,0,0,0,0,0,0,0,0,0,0,0,0,0,0,0,0,0,0,0
GS11-OFFICE OF THE CHIEF FINANCIAL OFFICER,1,0,0,0,0,0,0,0,0,0,1,0,0,0,0,0,0,0,0,0,0,0,1,0,0,0,0,0,0,0,0,0,0,0,0,0,0,0,0,0,0,0,0,0,0,0,1
GS12-OFFICE OF GENERAL COUNSEL,0,0,0,0,0,0,0,0,0,0,0,0,0,0,0,0,0,0,0,0,0,0,0,0,0,0,0,0,0,0,0,0,0,0,0,0,0,0,0,0,0,0,0,0,0,0,0
GS13-CIVILIAN BOARD OF CONTRACT APPEALS,0,0,0,0,0,0,0,0,0,0,0,0,0,0,0,0,0,0,0,0,0,0,0,0,0,0,0,0,0,0,0,0,0,0,0,0,0,0,0,0,0,0,0,0,0,0,0
GS14-OFFICE OF THE CHIEF HUMAN CAPITAL OFFICER,0,0,0,0,0,0,0,0,0,0,0,0,0,0,0,0,0,0,0,0,0,0,0,0,0,0,0,0,0,0,0,0,0,0,0,0,0,0,0,0,0,0,0,0,0,0,0
GS15-OFFICE OF INSPECTOR GENERAL,1,1,0,0,0,0,0,0,0,0,2,0,0,0,0,0,0,0,0,0,0,0,2,0,0,0,0,0,0,0,0,0,0,0,0,0,0,0,0,0,0,0,0,0,0,0,2
GS16-OFFICE OF THE CHIEF ACQUISITION OFFICER,0,0,0,0,0,0,0,0,0,0,0,0,0,0,0,0,0,0,0,0,0,0,0,0,0,0,0,0,0,0,0,0,0,0,0,0,0,0,0,0,0,0,0,0,0,0,0
GS19-OFFICE OF CITIZEN SERVICES AND COMMUNICATIONS,0,0,0,0,0,0,0,0,0,0,0,0,0,0,0,0,0,0,0,0,0,0,0,0,0,0,0,0,0,0,0,0,0,0,0,0,0,0,0,0,0,0,0,0,0,0,0
GS20-OFFICE OF CONGRESSIONAL AND INTERGOVERNMENTAL AFFAIRS,0,0,0,0,0,0,0,0,0,0,0,0,0,0,0,0,0,0,0,0,0,0,0,0,0,0,0,0,0,0,0,0,0,0,0,0,0,0,0,0,0,0,0,0,0,0,0
GS22-OFFICES OF THE REGIONAL ADMINISTRATORS,0,0,0,0,0,0,0,0,0,0,0,0,0,0,0,0,0,0,0,0,0,0,0,0,0,0,0,0,0,0,0,0,0,0,0,0,0,0,0,0,0,0,0,0,0,0,0
GS26-OFFICE OF GOVERNMENTWIDE POLICY,0,0,0,0,0,0,0,0,0,0,0,0,0,0,0,0,0,0,0,0,0,0,0,0,0,0,0,0,0,0,0,0,0,0,0,0,0,0,0,0,0,0,0,0,0,0,0
GS28-OFFICE OF THE CHIEF INFORMATION OFFICER,0,0,0,0,0,0,0,0,0,0,0,0,0,0,0,0,0,0,0,0,0,0,0,0,0,0,0,0,0,0,0,0,0,0,0,0,0,0,0,0,0,0,0,0,0,0,0
GS30-FEDERAL ACQUISITION SERVICE,0,1,0,0,0,0,0,0,0,0,1,0,0,0,0,0,0,0,0,0,0,0,1,0,1,0,0,0,0,0,0,0,0,1,0,0,0,0,0,0,0,0,0,0,0,1,2
GS31-OFFICE OF EMERGENCY RESPONSE AND RECOVERY,0,0,0,0,0,0,0,0,0,0,0,0,0,0,0,0,0,0,0,0,0,0,0,0,0,0,0,0,0,0,0,0,0,0,0,0,0,0,0,0,0,0,0,0,0,0,0
GS32-OFFICE OF COMMUNICATIONS AND MARKETING,0,0,0,0,0,0,0,0,0,0,0,0,0,0,0,0,0,0,0,0,0,0,0,0,0,0,0,0,0,0,0,0,0,0,0,0,0,0,0,0,0,0,0,0,0,0,0
GW00-INTERNATIONAL BOUNDARY AND WATER COMMISSION:  UNITED STATES AND MEXICO,0,0,0,0,0,0,0,0,0,0,0,0,0,0,0,0,0,0,0,0,0,0,0,0,0,0,0,0,0,0,0,0,0,0,0,0,0,0,0,0,0,0,0,0,0,0,0
GX00-INTERNATIONAL BOUNDARY COMMISSION:  UNITED STATES AND CANADA,0,0,0,0,0,0,0,0,0,0,0,0,0,0,0,0,0,0,0,0,0,0,0,0,0,0,0,0,0,0,0,0,0,0,0,0,0,0,0,0,0,0,0,0,0,0,0
GY00-INTERNATIONAL JOINT COMMISSION:  UNITED STATES AND CANADA,0,0,0,0,0,0,0,0,0,0,0,0,0,0,0,0,0,0,0,0,0,0,0,0,1,0,0,0,0,0,0,0,0,1,0,0,0,0,0,0,0,0,0,0,0,1,1
HB00-COMMITTEE FOR PURCHASE FROM PEOPLE WHO ARE BLIND OR SEVERELY DISABLED,0,0,0,0,0,0,0,0,0,0,0,0,0,0,0,0,0,0,0,0,0,0,0,0,0,0,0,0,0,0,0,0,0,0,0,0,0,0,0,0,0,0,0,0,0,0,0
HD00-U.S. HOLOCAUST MEMORIAL MUSEUM,0,0,0,0,0,0,0,0,0,0,0,0,0,0,0,0,0,0,0,0,0,0,0,0,0,0,0,0,0,0,0,0,0,0,0,0,0,0,0,0,0,0,0,0,0,0,0
HE10-OFFICE OF THE SECRETARY OF HEALTH AND HUMAN SERVICES,2,1,0,0,0,0,0,0,0,0,3,0,0,0,0,0,0,0,0,0,0,0,3,5,15,5,0,4,0,1,1,0,0,31,5,2,1,0,2,0,21,0,0,31,0,62,65
HE11-PROGRAM SUPPORT CENTER,0,0,0,0,0,0,0,0,0,0,0,0,0,0,0,0,0,0,0,0,0,0,0,0,3,0,0,0,0,0,0,0,0,3,0,0,0,0,0,0,0,0,0,0,0,3,3
HE12-ADMINISTRATION FOR COMMUNITY LIVING,0,0,0,0,0,0,0,0,0,0,0,0,0,0,0,0,0,0,0,0,0,0,0,0,0,1,0,0,0,0,0,0,0,1,0,0,0,0,0,0,0,0,0,0,0,1,1
HE31-OFFICE OF THE ASSISTANT SECRETARY FOR HEALTH,0,0,0,0,0,0,0,0,0,0,0,0,0,0,0,0,0,0,0,0,0,0,0,0,0,0,0,0,0,0,0,0,0,0,0,0,0,0,0,0,0,0,0,0,0,0,0
HE32-SUBSTANCE ABUSE AND MENTAL HEALTH SERVICES ADMINISTRATION,0,0,0,0,0,0,0,0,0,0,0,0,0,0,0,0,0,0,0,0,0,0,0,0,4,0,0,0,0,0,0,0,0,4,0,0,0,0,0,0,0,0,0,0,0,4,4
HE33-AGENCY FOR HEALTHCARE RESEARCH AND QUALITY,1,0,0,0,0,0,0,0,0,0,1,0,0,0,0,0,0,0,0,0,0,0,1,0,1,0,0,0,0,0,0,0,0,1,0,0,0,0,0,0,0,0,0,0,0,1,2
HE34-HEALTH RESOURCES AND SERVICES ADMINISTRATION,4,0,0,0,0,0,0,0,0,0,4,0,0,0,0,0,0,0,0,0,0,0,4,2,5,0,0,0,0,0,0,0,0,7,0,1,0,0,0,0,3,0,0,4,0,11,15
HE35-AGENCY FOR TOXIC SUBSTANCES AND DISEASE REGISTRY,0,0,0,0,0,0,0,0,0,0,0,0,0,0,0,0,0,0,0,0,0,0,0,0,0,0,0,0,0,0,0,0,0,0,0,0,0,0,0,0,0,0,0,0,0,0,0
HE36-FOOD AND DRUG ADMINISTRATION,8,1,0,0,0,0,0,0,0,0,9,0,0,0,0,0,0,0,0,0,0,0,9,3,54,9,0,5,0,0,0,0,0,71,11,4,0,0,0,0,62,0,0,77,0,148,157
HE37-INDIAN HEALTH SERVICE,4,0,0,0,0,0,0,0,0,0,4,0,0,0,0,0,0,0,0,0,0,0,4,13,75,74,0,0,0,0,0,0,0,162,3,55,0,0,0,0,0,0,0,58,0,220,224
HE38-NATIONAL INSTITUTES OF HEALTH,12,2,0,0,0,0,0,0,0,0,14,0,0,0,0,0,0,0,0,0,0,0,14,4,28,2,0,1,0,1,0,0,0,36,5,0,0,0,0,0,52,0,0,57,0,93,107
HE39-CENTERS FOR DISEASE CONTROL AND PREVENTION,2,5,0,0,0,0,0,0,0,0,7,0,0,0,0,0,0,0,0,0,0,0,7,2,19,15,0,2,0,0,0,0,0,38,3,0,0,0,0,0,25,0,0,28,0,66,73
HE70-CENTERS FOR MEDICARE & MEDICAID SERVICES,12,1,0,0,0,0,0,0,0,0,13,0,0,0,0,0,0,0,0,0,0,0,13,2,59,2,0,0,0,1,0,0,0,64,3,0,0,0,0,0,0,0,0,3,0,67,80
HE90-ADMINISTRATION FOR CHILDREN AND FAMILIES,3,1,0,0,0,0,0,0,0,0,4,0,0,0,0,0,0,0,0,0,0,0,4,1,8,1,0,3,0,0,0,0,0,13,0,2,0,0,0,0,0,0,0,2,0,15,19
HF**-UNSPECIFIED,0,0,0,0,0,0,0,0,0,0,0,0,0,0,0,0,0,0,0,0,0,0,0,0,0,0,0,0,0,0,0,0,0,0,0,0,0,0,0,0,0,0,0,0,0,0,0
HF00-FEDERAL HOUSING FINANCE AGENCY,3,0,0,0,0,0,0,0,0,0,3,0,0,0,0,0,0,0,0,0,0,0,3,0,2,0,0,0,0,0,0,0,0,2,0,0,0,0,0,0,1,0,0,1,0,3,6
HFHA-FEDERAL HOUSING FINANCE AGENCY,0,0,0,0,0,0,0,0,0,0,0,0,0,0,0,0,0,0,0,0,0,0,0,1,0,0,0,0,0,0,0,0,0,1,0,0,0,0,0,0,0,0,0,0,0,1,1
HFHI-OFFICE OF INSPECTOR GENERAL,0,1,0,0,0,0,0,0,0,0,1,0,0,0,0,0,0,0,0,0,0,0,1,0,0,0,0,0,0,0,0,0,0,0,0,0,0,0,0,0,0,0,0,0,0,0,1
HP00-ADVISORY COUNCIL ON HISTORIC PRESERVATION,0,0,0,0,0,0,0,0,0,0,0,0,0,0,0,0,0,0,0,0,0,0,0,0,0,0,0,0,0,0,0,0,0,0,0,0,0,0,0,0,0,0,0,0,0,0,0
HSAA-DHS HEADQUARTERS,4,0,0,0,0,0,0,0,0,0,4,0,0,0,0,0,0,0,0,0,0,0,4,1,15,1,0,4,0,0,0,1,0,22,0,3,0,0,0,0,0,0,0,3,0,25,29
HSAB-BUREAU OF CITIZENSHIP AND IMMIGRATION SERVICES,15,3,0,0,0,0,0,0,0,0,18,0,0,0,0,0,0,0,0,0,0,0,18,2,98,3,0,2,0,10,0,0,0,115,1,1,0,0,1,0,4,0,0,7,0,122,140
HSAC-U.S. COAST GUARD,7,1,0,0,0,0,0,0,0,0,8,0,0,0,0,0,0,0,0,0,0,0,8,2,35,0,0,0,0,4,0,0,0,41,3,1,0,0,0,0,1,0,0,5,0,46,54
HSAD-U.S. SECRET SERVICE,0,0,0,0,0,0,0,0,0,0,0,0,0,0,0,0,0,0,0,0,0,0,0,0,1,0,0,0,0,0,0,0,0,1,0,0,0,0,0,0,3,0,0,3,0,4,4
