HUDD-ASSISTANT SECRETARY FOR COMMUNITY PLANNING AND DEVELOPMENT,0,0,0,0,0,0,0,0,0,0,0,0,0,0,0,0,0,0,0,0,0,0,0,0,0,0,0,0,0,0,0,0,0,0,0,0,0,0,0,0,0,0,0
HUEE-ASSISTANT SECRETARY FOR FAIR HOUSING AND EQUAL OPPORTUNITY,1,0,0,0,0,0,0,0,0,1,0,0,0,0,0,0,0,0,0,0,1,0,0,0,0,0,0,0,0,0,0,0,0,0,0,0,0,0,0,0,0,0,1
HUFF-OFFICE OF THE CHIEF FINANCIAL OFFICER,0,0,0,0,0,0,0,0,0,0,0,0,0,0,0,0,0,0,0,0,0,0,0,0,0,0,0,0,0,0,0,0,0,0,0,0,0,0,0,0,0,0,0
HUFH-OFFICE OF FEDERAL HOUSING ENTERPRISE OVERSIGHT,0,0,0,0,0,0,0,0,0,0,0,0,0,0,0,0,0,0,0,0,0,1,0,0,0,0,0,0,0,0,1,0,0,0,0,0,0,0,0,0,0,1,1
HUGG-OFFICE OF INSPECTOR GENERAL,1,1,0,0,0,0,0,0,0,2,0,0,0,0,0,0,0,0,0,0,2,0,2,0,2,0,0,0,0,0,4,0,0,0,0,0,0,0,0,0,0,4,6
HUII-OFFICE OF DEPARTMENTAL OPERATIONS AND COORDINATION,0,0,0,0,0,0,0,0,0,0,0,0,0,0,0,0,0,0,0,0,0,0,0,0,0,0,0,0,0,0,0,0,0,0,0,0,0,0,0,0,0,0,0
HUJJ-ASSISTANT SECRETARY FOR CONGRESSIONAL AND INTERGOVERNMENTAL RELATIONS,0,0,0,0,0,0,0,0,0,0,0,0,0,0,0,0,0,0,0,0,0,0,0,0,0,0,0,0,0,0,0,0,0,0,0,0,0,0,0,0,0,0,0
HUKA-CENTER FOR FAITH-BASED AND COMMUNITY INITIATIVES,0,0,0,0,0,0,0,0,0,0,0,0,0,0,0,0,0,0,0,0,0,0,0,0,0,0,0,0,0,0,0,0,0,0,0,0,0,0,0,0,0,0,0
HUKK-OFFICE OF FIELD POLICY AND MANAGEMENT,0,0,0,0,0,0,0,0,0,0,0,0,0,0,0,0,0,0,0,0,0,0,0,0,0,0,0,0,0,0,0,0,0,0,0,0,0,0,0,0,0,0,0
HULL-OFFICE OF HEALTHY HOMES AND LEAD HAZARD CONTROL,0,0,0,0,0,0,0,0,0,0,0,0,0,0,0,0,0,0,0,0,0,0,0,0,0,0,0,0,0,0,0,0,0,0,0,0,0,0,0,0,0,0,0
HUMM-ASSISTANT SECRETARY FOR HOUSING--FEDERAL HOUSING COMMISSIONER,0,0,0,0,0,0,0,0,0,0,0,0,0,0,0,0,0,0,0,0,0,0,1,0,0,0,4,0,0,0,5,0,0,0,0,0,0,0,0,0,0,5,5
HUNN-OFFICE OF THE CHIEF PROCUREMENT OFFICER,1,0,0,0,0,0,0,0,0,1,0,0,0,0,0,0,0,0,0,0,1,0,0,0,0,0,0,0,0,0,0,0,0,0,0,0,0,0,0,0,0,0,1
HUPP-ASSISTANT SECRETARY FOR PUBLIC AND INDIAN HOUSING,0,0,0,0,0,0,0,0,0,0,0,0,0,0,0,0,0,0,0,0,0,0,2,0,0,0,0,0,0,0,2,0,0,0,0,0,0,0,0,0,0,2,2
HUQQ-OFFICE OF THE CHIEF INFORMATION OFFICER,0,1,0,0,0,0,0,0,0,1,0,0,0,0,0,0,0,0,0,0,1,0,0,0,0,0,0,0,0,0,0,0,0,0,0,0,0,0,0,0,0,0,1
HURR-ASSISTANT SECRETARY FOR POLICY DEVELOPMENT AND RESEARCH,0,0,0,0,0,0,0,0,0,0,0,0,0,0,0,0,0,0,0,0,0,0,0,0,0,0,0,0,0,0,0,0,0,0,0,0,0,0,0,0,0,0,0
HUTT-GOVERNMENT NATIONAL MORTGAGE ASSOCIATION (GINNIE MAE),0,0,0,0,0,0,0,0,0,0,0,0,0,0,0,0,0,0,0,0,0,0,1,0,0,0,0,0,0,0,1,0,0,0,0,0,0,0,0,0,0,1,1
HUUU-OFFICE OF DEPARTMENTAL EQUAL EMPLOYMENT OPPORTUNITY,0,0,0,0,0,0,0,0,0,0,0,0,0,0,0,0,0,0,0,0,0,0,0,0,0,0,0,0,0,0,0,0,0,0,0,0,0,0,0,0,0,0,0
HUWW-ASSISTANT SECRETARY FOR PUBLIC AFFAIRS,0,0,0,0,0,0,0,0,0,0,0,0,0,0,0,0,0,0,0,0,0,0,0,0,0,0,0,0,0,0,0,0,0,0,0,0,0,0,0,0,0,0,0
HW00-U.S. INTERAGENCY COUNCIL ON HOMELESSNESS,0,0,0,0,0,0,0,0,0,0,0,0,0,0,0,0,0,0,0,0,0,0,0,0,0,0,0,0,0,0,0,0,0,0,0,0,0,0,0,0,0,0,0
IB00-BROADCASTING BOARD OF GOVERNORS,2,1,0,0,0,0,0,0,0,3,0,0,0,0,0,0,0,0,0,0,3,0,1,0,0,0,0,0,0,0,1,1,1,0,0,0,0,0,0,2,0,3,6
IF00-INTER-AMERICAN FOUNDATION,0,0,0,0,0,0,0,0,0,0,0,0,0,0,0,0,0,0,0,0,0,0,0,0,0,0,0,0,0,0,0,0,0,0,0,0,0,0,0,0,0,0,0
IN01-OFFICE OF THE SECRETARY OF THE INTERIOR,4,1,0,0,0,0,0,0,0,5,0,0,0,0,0,0,0,0,0,0,5,3,14,3,4,0,3,0,0,0,27,0,0,0,0,0,0,0,0,0,0,27,32
IN05-BUREAU OF LAND MANAGEMENT,9,1,0,0,0,0,0,0,0,10,0,0,0,0,0,0,0,0,0,0,10,4,15,0,2,0,0,0,0,0,21,10,25,10,0,0,0,0,0,45,0,66,76
IN06-INDIAN AFFAIRS,2,2,0,0,0,0,0,0,0,4,0,0,0,0,0,0,0,0,0,0,4,2,0,23,0,0,0,0,0,0,25,0,3,0,0,0,27,0,0,30,0,55,59
IN07-BUREAU OF RECLAMATION,4,3,0,0,0,0,0,0,0,7,0,0,0,0,0,0,0,0,0,0,7,5,17,0,9,0,0,0,0,0,31,5,0,6,0,0,0,0,0,11,0,42,49
IN08-GEOLOGICAL SURVEY,5,2,0,0,0,0,0,0,0,7,0,0,0,0,0,0,0,0,0,0,7,4,10,0,2,0,0,0,0,0,16,12,7,23,0,0,0,0,0,42,0,58,65
IN10-NATIONAL PARK SERVICE,6,1,0,0,0,0,0,0,0,7,0,0,0,0,0,0,0,0,0,0,7,2,33,0,4,0,0,0,0,0,39,126,23,12,0,0,4,0,0,165,0,204,211
IN15-U.S. FISH AND WILDLIFE SERVICE,5,1,0,0,0,0,0,0,0,6,0,0,0,0,0,0,0,0,0,0,6,1,2,0,3,0,1,0,0,0,7,14,4,9,0,0,0,0,0,27,0,34,40
IN21-OFFICE OF THE SOLICITOR,0,0,0,0,0,0,0,0,0,0,0,0,0,0,0,0,0,0,0,0,0,0,0,0,0,0,0,0,0,0,0,0,0,0,0,0,0,0,0,0,0,0,0
"IN22-OFFICE OF SURFACE MINING, RECLAMATION AND ENFORCEMENT",0,0,0,0,0,0,0,0,0,0,0,0,0,0,0,0,0,0,0,0,0,1,0,0,0,0,0,0,0,0,1,0,1,0,0,0,0,0,0,1,0,2,2
IN23-MINERAL MANAGEMENT SERVICE,2,1,0,0,0,0,0,0,0,3,0,0,0,0,0,0,0,0,0,0,3,0,7,0,1,0,0,0,0,0,8,0,0,0,0,0,0,0,0,0,0,8,11
IN24-OFFICE OF THE INSPECTOR GENERAL,0,0,0,0,0,0,0,0,0,0,0,0,0,0,0,0,0,0,0,0,0,0,0,0,0,0,0,0,0,0,0,0,0,0,0,0,0,0,0,0,0,0,0
IW00-COMMISSION ON THE INTELLIGENCE CAPABILITIES OF THE UNITED STATES REGARDING WEAPONS OF MASS DESTRUCTION,0,0,0,0,0,0,0,0,0,0,0,0,0,0,0,0,0,0,0,0,0,0,0,0,0,0,0,0,0,0,0,0,0,0,0,0,0,0,0,0,0,0,0
KS00-CORPORATION FOR NATIONAL AND COMMUNITY SERVICE,0,0,0,0,0,0,0,0,0,0,0,0,0,0,0,0,0,0,0,0,0,0,0,0,0,0,6,0,0,0,6,0,0,0,0,0,3,0,0,3,0,9,9
LF00-FEDERAL ELECTION COMMISSION,0,0,0,0,0,0,0,0,0,0,0,0,0,0,0,0,0,0,0,0,0,0,0,0,0,0,0,0,0,0,0,0,0,0,0,0,0,0,0,0,0,0,0
LP00-GOVERNMENT PRINTING OFFICE,3,2,0,0,0,0,0,0,0,5,0,0,0,0,0,0,0,0,0,0,5,2,21,1,0,0,0,0,0,0,24,1,0,0,0,0,0,0,0,1,0,25,30
LT00-U.S. TAX COURT,0,0,0,0,0,0,0,0,0,0,0,0,0,0,0,0,0,0,0,0,0,0,0,0,0,0,0,0,0,0,0,0,0,0,0,0,0,0,0,0,0,0,0
MA00-MARINE MAMMAL COMMISSION,0,0,0,0,0,0,0,0,0,0,0,0,0,0,0,0,0,0,0,0,0,0,1,0,0,0,0,0,0,0,1,0,0,0,0,0,0,0,0,0,0,1,1
MC00-FEDERAL MARITIME COMMISSION,1,0,0,0,0,0,0,0,0,1,0,0,0,0,0,0,0,0,0,0,1,0,1,0,0,0,0,0,0,0,1,0,0,0,0,0,0,0,0,0,0,1,2
MI00-MILLENNIUM CHALLENGE CORPORATION,1,1,0,0,0,0,0,0,0,2,0,0,0,0,0,0,0,0,0,0,2,0,0,0,0,0,1,0,0,0,1,0,0,0,0,0,0,0,0,0,0,1,3
NF00-NATIONAL SCIENCE FOUNDATION,6,0,0,0,0,0,0,0,0,6,0,0,0,0,0,0,0,0,0,0,6,0,3,0,0,0,0,0,0,0,3,0,0,1,0,0,5,0,0,6,0,9,15
NK00-NATIONAL COUNCIL ON DISABILITY,0,0,0,0,0,0,0,0,0,0,0,0,0,0,0,0,0,0,0,0,0,0,0,0,0,0,0,0,0,0,0,0,0,0,0,0,0,0,0,0,0,0,0
NL00-NATIONAL LABOR RELATIONS BOARD,1,0,0,0,0,0,0,0,0,1,0,0,0,0,0,0,0,0,0,0,1,0,1,2,0,0,0,0,0,0,3,0,0,1,0,0,0,0,0,1,0,4,5
NM00-NATIONAL MEDIATION BOARD,0,0,0,0,0,0,0,0,0,0,0,0,0,0,0,0,0,0,0,0,0,0,0,0,0,0,0,0,0,0,0,0,0,0,0,0,0,0,0,0,0,0,0
"NN10-HEADQUARTERS, NASA",3,2,0,0,0,0,0,0,0,5,0,0,0,0,0,0,0,0,0,0,5,1,1,0,0,0,0,0,0,0,2,0,0,0,0,0,0,0,0,0,0,2,7
NN21-AMES RESEARCH CENTER,0,0,0,0,0,0,0,0,0,0,0,0,0,0,0,0,0,0,0,0,0,0,0,0,2,0,0,0,0,0,2,11,0,0,0,0,0,0,0,11,0,13,13
NN22-JOHN GLENN RESEARCH CENTER AT LEWIS FIELD,0,0,0,0,0,0,0,0,0,0,0,0,0,0,0,0,0,0,0,0,0,0,1,0,0,0,0,0,0,0,1,2,0,0,0,0,0,0,0,2,0,3,3
NN23-LANGLEY RESEARCH CENTER,2,0,0,0,0,0,0,0,0,2,0,0,0,0,0,0,0,0,0,0,2,0,0,0,0,0,0,0,0,0,0,2,0,0,0,0,1,0,0,3,0,3,5
NN24-DRYDEN FLIGHT RESEARCH CENTER,0,0,0,0,0,0,0,0,0,0,0,0,0,0,0,0,0,0,0,0,0,0,1,0,0,0,0,0,0,0,1,3,0,0,0,0,0,0,0,3,0,4,4
NN51-GODDARD SPACE FLIGHT CENTER,0,0,0,0,0,0,0,0,0,0,0,0,0,0,0,0,0,0,0,0,0,0,1,0,0,0,0,0,0,0,1,3,0,1,0,0,0,0,0,4,0,5,5
NN62-GEORGE C. MARSHALL SPACE FLIGHT CENTER,0,0,0,0,0,0,0,0,0,0,0,0,0,0,0,0,0,0,0,0,0,0,0,0,1,0,0,0,0,0,1,3,0,0,0,0,0,0,0,3,0,4,4
NN64-JOHN C. STENNIS SPACE CENTER,1,0,0,0,0,0,0,0,0,1,0,0,0,0,0,0,0,0,0,0,1,0,0,0,0,0,0,0,0,0,0,1,0,0,0,0,0,0,0,1,0,1,2
NN72-LYNDON B. JOHNSON SPACE CENTER,1,0,0,0,0,0,0,0,0,1,0,0,0,0,0,0,0,0,0,0,1,0,0,0,1,0,0,0,0,0,1,4,0,0,0,0,0,0,0,4,0,5,6
NN76-JOHN F. KENNEDY SPACE CENTER,1,0,0,0,0,0,0,0,0,1,0,0,0,0,0,0,0,0,0,0,1,0,0,0,2,0,0,0,0,0,2,14,0,0,0,0,0,0,0,14,0,16,17
NP00-NATIONAL CAPITAL PLANNING COMMISSION,0,0,0,0,0,0,0,0,0,0,0,0,0,0,0,0,0,0,0,0,0,0,1,0,0,0,0,0,0,0,1,0,0,0,0,0,0,0,0,0,0,1,1
NQ00-NATIONAL ARCHIVES AND RECORDS ADMINISTRATION,0,1,0,0,0,0,0,0,0,1,0,0,0,0,0,0,0,0,0,0,1,1,7,0,0,0,0,0,0,0,8,0,0,15,0,0,1,0,0,16,0,24,25
NS00-NATIONAL SECURITY COUNCIL,0,0,0,0,0,0,0,0,0,0,0,0,0,0,0,0,0,0,0,0,0,0,0,0,0,0,0,0,0,0,0,0,3,0,0,0,0,0,0,3,0,3,3
NU00-NUCLEAR REGULATORY COMMISSION,0,0,0,0,0,0,0,0,0,0,0,0,0,0,0,0,0,0,0,0,0,0,0,0,0,0,29,0,0,0,29,0,0,0,0,0,6,0,0,6,0,35,35
NV11-IMMEDIATE OFFICE OF THE CHIEF OF NAVAL OPERATIONS,5,0,0,0,0,0,0,0,0,5,0,0,0,0,0,0,0,0,0,0,5,8,9,0,1,0,4,0,0,0,22,1,4,3,0,0,4,0,0,12,0,34,39
"NV12-ASSISTANT FOR ADMINISTRATION, UNDER SECRETARY OF THE NAVY",5,0,0,0,0,0,0,0,0,5,0,0,0,0,0,0,0,0,0,0,5,11,0,35,6,0,0,0,0,0,52,1,0,2,0,0,0,0,0,3,0,55,60
NV14-OFFICE OF NAVAL RESEARCH,4,0,0,0,0,0,0,0,0,4,0,0,0,0,0,0,0,0,0,0,4,1,5,0,0,0,0,0,0,0,6,0,0,2,0,0,0,0,0,2,0,8,12
NV15-NAVAL INTELLIGENCE COMMAND,0,0,0,0,0,0,0,0,0,0,0,0,0,0,0,0,0,0,0,0,0,0,0,0,0,0,15,0,0,0,15,0,0,0,0,0,0,0,0,0,0,15,15
NV18-NAVAL MEDICAL COMMAND,7,2,0,0,0,0,0,0,0,9,0,0,0,0,0,0,0,0,0,0,9,5,77,1,1,0,9,0,0,0,93,4,3,2,0,0,0,0,0,9,0,102,111
NV19-NAVAL AIR SYSTEMS COMMAND,13,0,0,0,0,0,0,0,0,13,0,0,0,0,0,0,0,0,0,0,13,5,38,2,8,0,4,0,0,0,57,3,0,2,0,0,0,0,0,5,0,62,75
NV22-BUREAU OF NAVAL PERSONNEL,0,0,0,0,0,0,0,0,0,0,0,0,0,0,0,0,0,0,0,0,0,4,4,0,0,0,2,0,0,0,10,5,0,0,0,0,0,0,0,5,0,15,15
NV23-NAVAL SUPPLY SYSTEMS COMMAND,0,0,0,0,0,0,0,0,0,0,0,0,0,0,0,0,0,0,0,0,0,2,7,0,3,0,2,0,0,0,14,4,1,4,0,0,0,0,0,9,0,23,23
NV24-NAVAL SEA SYSTEMS COMMAND,9,0,0,0,0,0,0,0,0,9,0,0,0,0,0,0,0,0,0,0,9,7,24,0,7,0,8,0,0,0,46,5,0,2,0,0,0,0,0,7,0,53,62
NV25-NAVAL FACILITIES ENGINEERING COMMAND,12,2,0,0,0,0,1,0,0,15,0,0,0,0,0,0,0,0,0,0,15,6,43,2,7,0,5,0,0,0,63,4,1,0,0,0,0,0,0,5,0,68,83
NV27-U.S. MARINE CORPS,21,3,0,0,0,0,0,0,0,24,0,0,0,0,0,0,0,0,0,0,24,17,76,1,3,0,13,0,0,0,110,18,13,4,0,0,0,0,0,35,0,145,169
NV30-STRATEGIC SYSTEMS PROGRAMS OFFICE,1,0,0,0,0,0,0,0,0,1,0,0,0,0,0,0,0,0,0,0,1,1,0,1,0,0,0,0,0,0,2,0,0,0,0,0,0,0,0,0,0,2,3
NV33-MILITARY SEALIFT COMMAND,1,1,0,0,0,0,0,0,0,2,0,0,0,0,0,0,0,0,0,0,2,0,3,34,2,0,0,0,0,0,39,0,29,0,0,0,7,0,0,36,0,75,77
NV39-SPACE AND NAVAL WARFARE SYSTEMS COMMAND,9,0,0,0,0,0,0,0,0,9,0,0,0,0,0,0,0,0,0,0,9,25,2,0,13,0,2,0,0,0,42,1,1,3,0,0,0,0,0,5,0,47,56
NV41-NAVY SYSTEMS MANAGEMENT ACTIVITY,0,0,0,0,0,0,0,0,0,0,0,0,0,0,0,0,0,0,0,0,0,0,0,0,0,0,0,0,0,0,0,0,0,0,0,0,0,0,0,0,0,0,0
"NV52-COMMANDER, NAVY INSTALLATIONS",17,5,0,0,0,0,0,0,0,22,0,0,0,0,0,0,0,0,0,0,22,15,51,2,13,0,11,0,0,0,92,14,9,1,0,0,0,0,0,24,0,116,138
"NV60-U.S. ATLANTIC FLEET, COMMANDER IN CHIEF",4,0,0,0,0,0,0,0,0,4,0,0,0,0,0,0,0,0,0,0,4,8,13,0,8,0,21,0,0,0,50,2,1,2,0,0,1,0,0,6,0,56,60
"NV61-U.S. NAVAL FORCES, EUROPE",0,0,0,0,0,0,0,0,0,0,0,0,0,0,0,0,0,0,0,0,0,0,0,0,0,0,0,0,0,0,0,0,0,0,0,0,0,0,0,0,0,0,0
NV62-CHIEF OF NAVAL EDUCATION AND TRAINING,0,0,0,0,0,0,0,0,0,0,0,0,0,0,0,0,0,0,0,0,0,0,0,0,0,0,0,0,0,0,0,0,0,0,0,0,0,0,0,0,0,0,0
NV69-NAVAL SECURITY GROUP COMMAND,0,0,0,0,0,0,0,0,0,0,0,0,0,0,0,0,0,0,0,0,0,0,0,0,0,0,0,0,0,0,0,0,0,0,0,0,0,0,0,0,0,0,0
"NV70-U.S. PACIFIC FLEET, COMMANDER IN CHIEF",1,0,0,0,0,0,0,0,0,1,0,0,0,0,0,0,0,0,0,0,1,3,10,0,8,0,5,0,0,0,26,1,1,0,0,0,0,0,0,2,0,28,29
NV72-NAVAL RESERVE FORCE,0,0,0,0,0,0,0,0,0,0,0,0,0,0,0,0,0,0,0,0,0,0,0,0,0,0,1,0,0,0,1,0,0,0,0,0,0,0,0,0,0,1,1
NV74-NAVAL SPECIAL WARFARE COMMAND,1,0,0,0,0,0,0,0,0,1,0,0,0,0,0,0,0,0,0,0,1,4,0,0,0,0,4,0,0,0,8,5,0,0,0,0,0,0,0,5,0,13,14
NV76-NAVAL EDUCATION AND TRAINING COMMAND,1,0,0,0,0,0,0,0,0,1,0,0,0,0,0,0,0,0,0,0,1,2,15,0,0,0,4,0,0,0,21,8,0,0,0,0,0,0,0,8,0,29,30
OM00-OFFICE OF PERSONNEL MANAGEMENT,10,0,0,0,0,0,0,0,0,10,0,0,0,0,0,0,0,0,0,0,10,5,10,17,12,0,0,1,0,0,45,1,0,0,2,0,1,0,0,4,0,49,59
OS00-OCCUPATIONAL SAFETY AND HEALTH REVIEW COMMISSION,0,0,0,0,0,0,0,0,0,0,0,0,0,0,0,0,0,0,0,0,0,0,0,0,0,0,0,0,0,0,0,0,0,0,0,0,0,0,0,0,0,0,0
PU00-PEACE CORPS,0,0,0,0,0,0,0,0,0,0,0,0,0,0,0,0,0,0,0,0,0,0,0,0,0,0,0,0,0,0,0,0,0,0,0,0,17,0,0,17,0,17,17
QQ00-OFFICE OF NATIONAL DRUG CONTROL POLICY,0,0,0,0,0,0,0,0,0,0,0,0,0,0,0,0,0,0,0,0,0,0,0,1,0,0,0,0,0,0,1,0,0,0,0,0,0,0,0,0,0,1,1
RE00-OFFICE OF NAVAJO AND HOPI INDIAN RELOCATION,0,0,0,0,0,0,0,0,0,0,0,0,0,0,0,0,0,0,0,0,0,0,0,0,0,0,0,0,0,0,0,0,0,0,0,0,0,0,0,0,0,0,0
RF00-FEDERAL RETIREMENT THRIFT INVESTMENT BOARD,1,1,0,0,0,0,0,0,0,2,0,0,0,0,0,0,0,0,0,0,2,1,1,0,0,0,0,0,0,0,2,0,0,0,0,0,0,0,0,0,0,2,4
RH00-ARMED FORCES RETIREMENT HOME,0,0,0,0,0,0,0,0,0,0,0,0,0,0,0,0,0,0,0,0,0,0,1,0,0,0,0,0,0,0,1,0,0,0,0,0,0,0,0,0,0,1,1
RR00-RAILROAD RETIREMENT BOARD,1,2,0,0,0,0,0,0,0,3,0,0,0,0,0,0,0,0,0,0,3,1,0,0,0,0,0,0,0,0,1,0,0,0,0,0,0,0,0,0,0,1,4
RS00-FEDERAL MINE SAFETY AND HEALTH REVIEW COMMISSION,0,0,0,0,0,0,0,0,0,0,0,0,0,0,0,0,0,0,0,0,0,0,0,0,0,0,0,0,0,0,0,0,0,0,0,0,0,0,0,0,0,0,0
SB00-SMALL BUSINESS ADMINISTRATION,5,0,0,0,0,0,0,0,0,5,0,0,0,0,0,0,0,0,0,0,5,1,16,1,0,0,0,0,0,0,18,14,6,0,0,0,1,0,0,21,0,39,44
SE00-SECURITIES AND EXCHANGE COMMISSION,3,0,0,0,0,0,0,0,0,3,0,0,0,0,0,0,0,0,0,0,3,1,4,12,0,0,0,0,0,0,17,1,0,2,0,0,0,0,0,3,0,20,23
SK00-CONSUMER PRODUCT SAFETY COMMISSION,0,0,0,0,0,0,0,0,0,0,0,0,0,0,0,0,0,0,0,0,0,0,1,0,0,0,0,0,0,0,1,0,0,0,0,0,0,0,0,0,0,1,1
SM01-NATIONAL GALLERY OF ART,0,0,0,0,0,0,0,0,0,0,0,0,0,0,0,0,0,0,0,0,0,0,1,0,0,0,0,0,0,0,1,6,0,0,0,0,0,0,0,6,0,7,7
SM02-WOODROW WILSON INTERNATIONAL CENTER FOR SCHOLARS,0,0,0,0,0,0,0,0,0,0,0,0,0,0,0,0,0,0,0,0,0,0,0,0,0,0,0,0,0,0,0,0,0,0,0,0,0,0,0,0,0,0,0
SM03-SMITHSONIAN INSTITUTION (EXCEPT UNITS ADMINISTERED UNDER SEPARATE BOARDS OF TRUSTEES),2,1,0,0,0,0,0,0,0,3,0,0,0,0,0,0,0,0,0,0,3,3,20,1,0,0,0,0,0,0,24,2,0,0,0,0,0,0,0,2,0,26,29
SM04-JOHN F. KENNEDY CENTER FOR THE PERFORMING ARTS,0,0,0,0,0,0,0,0,0,0,0,0,0,0,0,0,0,0,0,0,0,0,0,0,0,0,0,0,0,0,0,0,0,0,0,0,0,0,0,0,0,0,0
SS00-SELECTIVE SERVICE SYSTEM,0,0,0,0,0,0,0,0,0,0,0,0,0,0,0,0,0,0,0,0,0,0,0,0,0,0,0,0,0,0,0,0,1,0,0,0,0,0,0,1,0,1,1
ST00-DEPARTMENT OF STATE,12,3,0,0,0,0,1,0,0,16,0,0,0,0,0,0,0,0,0,0,16,3,28,6,30,0,1,0,0,0,68,46,13,10,2,0,7,1,0,79,0,147,163
SZ00-SOCIAL SECURITY ADMINISTRATION,1,0,0,0,0,0,0,0,0,1,0,0,0,0,0,0,0,0,0,0,1,1,4,1,6,0,0,0,0,0,12,0,5,0,0,0,0,0,0,5,0,17,18
TB00-NATIONAL TRANSPORTATION SAFETY BOARD,1,1,0,0,0,0,0,0,0,2,0,0,0,0,0,0,0,0,0,0,2,0,1,0,0,0,0,0,0,0,1,0,0,0,0,0,0,0,0,0,0,1,3
TC00-U.S. INTERNATIONAL TRADE COMMISSION,0,0,0,0,0,0,0,0,0,0,0,0,0,0,0,0,0,0,0,0,0,0,1,0,1,0,0,0,0,0,2,0,0,0,0,0,0,0,0,0,0,2,2
TD01-OFFICE OF THE SECRETARY OF TRANSPORTATION,2,0,0,0,0,0,0,0,0,2,0,0,0,0,0,0,0,0,0,0,2,0,2,0,0,0,0,0,0,0,2,0,0,0,1,0,1,0,0,2,0,4,6
TD03-FEDERAL AVIATION ADMINISTRATION,0,0,0,0,0,0,0,0,0,0,0,0,0,0,0,0,0,0,0,0,0,0,0,0,0,0,154,0,0,0,154,0,0,0,0,0,13,0,0,13,0,167,167
TD04-FEDERAL HIGHWAY ADMINISTRATION,1,1,0,0,0,0,0,0,0,2,0,0,0,0,0,0,0,0,0,0,2,1,5,0,4,0,1,0,0,0,11,0,0,1,0,0,0,0,0,1,0,12,14
TD05-FEDERAL RAILROAD ADMINISTRATION,2,0,0,0,0,0,0,0,0,2,0,0,0,0,0,0,0,0,0,0,2,0,9,0,0,0,0,0,0,0,9,0,0,1,0,0,0,0,0,1,0,10,12
TD06-SAINT LAWRENCE SEAWAY DEVELOPMENT CORPORATION,0,0,0,0,0,0,0,0,0,0,0,0,0,0,0,0,0,0,0,0,0,0,0,0,0,0,0,0,0,0,0,0,0,0,0,0,0,0,0,0,0,0,0
TD09-FEDERAL TRANSIT ADMINISTRATION,0,1,0,0,0,0,0,0,0,1,0,0,0,0,0,0,0,0,0,0,1,0,0,0,0,0,0,0,0,0,0,0,0,0,0,0,0,0,0,0,0,0,1
TD10-NATIONAL HIGHWAY TRAFFIC SAFETY ADMINISTRATION,1,0,0,0,0,0,0,0,0,1,0,0,0,0,0,0,0,0,0,0,1,0,0,1,0,0,0,1,0,0,2,0,0,0,0,0,0,0,0,0,0,2,3
TD11-RESEARCH AND INNOVATIVE TECHNONOGY ADMINSTRATION,0,0,0,0,0,0,0,0,0,0,0,0,0,0,0,0,0,0,0,0,0,0,1,0,0,0,1,0,0,0,2,0,0,0,0,0,0,0,0,0,0,2,2
TD12-OFFICE OF INSPECTOR GENERAL,4,0,0,0,0,0,0,0,0,4,0,0,0,0,0,0,0,0,0,0,4,0,1,0,1,0,0,0,0,0,2,0,0,0,0,0,1,0,0,1,0,3,7
TD13-MARITIME ADMINISTRATION,1,0,0,0,0,0,0,0,0,1,0,0,0,0,0,0,0,0,0,0,1,0,2,0,0,0,0,0,0,0,2,0,0,0,0,0,0,0,0,0,0,2,3
TD15-SURFACE TRANSPORTATION BOARD,0,0,0,0,0,0,0,0,0,0,0,0,0,0,0,0,0,0,0,0,0,0,0,0,0,0,0,0,0,0,0,0,0,0,0,0,0,0,0,0,0,0,0
TD16-PIPELINE AND HAZARDOUS MATERIALS SAFETY ADMINISTRATION,1,0,0,0,0,0,0,0,0,1,0,0,0,0,0,0,0,0,0,0,1,0,3,1,0,0,0,0,0,0,4,0,0,2,0,0,0,0,0,2,0,6,7
TD17-FEDERAL MOTOR CARRIER SAFETY ADMINISTRATION,2,0,0,0,0,0,0,0,0,2,0,0,0,0,0,0,0,0,0,0,2,1,1,2,0,0,0,0,0,0,4,0,0,0,0,0,0,0,0,0,0,4,6
TN00-OFFICE OF THE U.S. TRADE REPRESENTATIVE,2,0,0,0,0,0,0,0,0,2,0,0,0,0,0,0,0,0,0,0,2,0,3,0,0,0,2,0,0,0,5,0,0,0,0,0,0,0,0,0,1,6,8
TR35-OFFICE OF THRIFT SUPERVISION,2,0,0,0,0,0,0,0,0,2,0,0,0,0,0,0,0,0,0,0,2,0,2,0,0,0,0,0,0,0,2,2,0,0,0,0,0,0,0,2,0,4,6
TR40-ALCOHOL AND TOBACCO TAX AND TRADE BUREAU,2,0,0,0,0,0,0,0,0,2,0,0,0,0,0,0,0,0,0,0,2,0,1,0,0,0,0,0,0,0,1,0,0,0,0,0,0,0,0,0,0,1,3
TR91-DEPARTMENTAL OFFICES,3,1,0,0,0,0,0,0,0,4,0,0,0,0,0,0,0,0,0,0,4,0,5,0,0,0,0,0,0,0,5,0,1,1,0,0,0,1,0,3,0,8,12
TR93-INTERNAL REVENUE SERVICE,8,5,0,0,0,0,0,0,0,13,0,0,0,0,0,0,0,0,0,0,13,2,140,1,25,0,2,0,0,0,170,66,0,7,0,0,0,0,0,73,0,243,256
TR95-OFFICE OF INSPECTOR GENERAL,0,0,0,0,0,0,0,0,0,0,0,0,0,0,0,0,0,0,0,0,0,0,0,0,0,0,0,0,0,0,0,0,0,0,0,0,0,0,0,0,0,0,0
TRAA-FINANCIAL MANAGEMENT SERVICE,4,0,0,0,0,0,0,0,0,4,0,0,0,0,0,0,0,0,0,0,4,0,5,0,0,0,0,0,0,0,5,0,0,0,0,0,0,0,0,0,0,5,9
TRAB-BUREAU OF THE PUBLIC DEBT,0,0,0,0,0,0,0,0,0,0,0,0,0,0,0,0,0,0,0,0,0,1,1,0,3,0,0,0,0,0,5,0,0,0,0,0,0,0,0,0,0,5,5
TRAD-U.S. MINT,1,0,0,0,0,0,0,0,0,1,0,0,0,0,0,0,0,0,0,0,1,0,3,0,0,0,0,0,0,0,3,1,0,0,0,0,0,0,0,1,0,4,5
TRAF-FINANCIAL CRIMES ENFORCEMENT NETWORK,0,0,0,0,0,0,0,0,0,0,0,0,0,0,0,0,0,0,0,0,0,0,1,0,0,0,0,0,0,0,1,0,0,0,0,0,0,0,0,0,0,1,1
TRAI-BUREAU OF ENGRAVING AND PRINTING,2,0,0,0,0,0,0,0,0,2,0,0,0,0,0,0,0,0,0,0,2,0,4,0,0,0,0,0,0,0,4,0,0,0,0,0,0,0,0,0,0,4,6
TRAJ-OFFICE OF THE COMPTROLLER OF THE CURRENCY,1,0,0,0,0,0,0,0,0,1,0,0,0,0,0,0,0,0,0,0,1,0,4,0,1,0,0,0,0,0,5,0,0,0,0,0,0,0,0,0,0,5,6
TRTG-OFFICE OF THE INSPECTOR GENERAL FOR TAX ADMINISTRATION,2,0,0,0,0,0,0,0,0,2,0,0,0,0,0,0,0,0,0,0,2,1,1,1,0,0,0,0,0,0,3,0,0,0,0,0,0,0,0,0,0,3,5
TS00-OFFICE OF SCIENCE AND TECHNOLOGY POLICY,0,0,0,0,0,0,0,0,0,0,0,0,0,0,0,0,0,0,0,0,0,0,0,0,0,0,0,0,0,0,0,0,0,0,0,0,0,0,0,0,0,0,0
UJ00-JAPAN-UNITED STATES FRIENDSHIP COMMISSION,0,0,0,0,0,0,0,0,0,0,0,0,0,0,0,0,0,0,0,0,0,0,0,0,0,0,0,0,0,0,0,0,0,0,0,0,0,0,0,0,0,0,0
UT00-UTAH RECLAMATION MITIGATION AND CONSERVATION COMMISSION,0,0,0,0,0,0,0,0,0,0,0,0,0,0,0,0,0,0,0,0,0,0,0,0,0,0,0,0,0,0,0,0,0,0,0,0,0,0,0,0,0,0,0
VA**-UNSPECIFIED,0,0,0,0,0,0,0,0,0,0,0,0,0,0,0,0,0,0,0,0,0,0,0,0,0,0,0,1,0,0,1,0,0,0,0,0,0,0,0,0,0,1,1
VAAA-OFFICE OF THE SECRETARY,0,0,0,0,0,0,0,0,0,0,0,0,0,0,0,0,0,0,0,0,0,0,1,0,0,0,0,0,0,0,1,0,0,0,0,0,0,0,0,0,0,1,1
VAAC-BOARD OF CONTRACT APPEALS,0,0,0,0,0,0,0,0,0,0,0,0,0,0,0,0,0,0,0,0,0,0,0,0,0,0,0,0,0,0,0,0,0,0,0,0,0,0,0,0,0,0,0
VAAD-BOARD OF VETERANS APPEALS,0,0,0,0,0,0,0,0,0,0,0,0,0,0,0,0,0,0,0,0,0,0,0,2,0,0,0,0,0,0,2,0,0,0,0,0,0,0,0,0,0,2,2
VAAE-GENERAL COUNSEL,0,0,0,0,0,0,0,0,0,0,0,0,0,0,0,0,0,0,0,0,0,0,0,2,0,0,0,0,0,0,2,0,0,0,0,0,0,0,0,0,0,2,2
VAAF-INSPECTOR GENERAL,0,0,0,0,0,0,0,0,0,0,0,0,0,0,0,0,0,0,0,0,0,0,0,0,0,0,0,0,0,0,0,0,0,0,0,0,0,0,0,0,0,0,0
VAAH-OFFICE OF SMALL AND DISADVANTAGED BUSINESS UTILIZATION,0,0,0,0,0,0,0,0,0,0,0,0,0,0,0,0,0,0,0,0,0,0,0,0,0,0,0,0,0,0,0,0,0,0,0,0,0,0,0,0,0,0,0
VABA-IMMEDIATE OFFICE OF THE ASSISTANT SECRETARY FOR HUMAN RESOURCES AND ADMINISTRATION,0,0,0,0,0,0,0,0,0,0,0,0,0,0,0,0,0,0,0,0,0,0,0,0,0,0,0,0,0,0,0,0,0,0,0,1,0,0,0,1,0,1,1
VABC-ASSISTANT SECRETARY FOR HUMAN RESOURCES MANAGEMENT,0,0,0,0,0,0,0,0,0,0,0,0,0,0,0,0,0,0,0,0,0,1,0,0,0,0,0,0,0,0,1,0,0,0,0,0,0,0,0,0,0,1,1
VABD-DEPUTY ASSISTANT SECRETARY FOR EQUAL OPPORTUNITY,0,0,0,0,0,0,0,0,0,0,0,0,0,0,0,0,0,0,0,0,0,0,0,0,0,0,0,0,0,0,0,0,0,0,0,0,0,0,0,0,0,0,0
VABE-DEPUTY ASSISTANT SECRETARY FOR ADMINISTRATION,0,0,0,0,0,0,0,0,0,0,0,0,0,0,0,0,0,0,0,0,0,0,0,0,0,0,0,0,0,0,0,0,0,0,0,0,0,0,0,0,0,0,0
VABF-DEPUTY ASSISTANT SECRETARY FOR OFFICE OF RESOLUTION MANAGEMENT,1,0,0,0,0,0,0,0,0,1,0,0,0,0,0,0,0,0,0,0,1,0,0,0,0,0,0,0,0,0,0,0,0,0,0,0,0,0,0,0,0,0,1
VADA-IMMEDIATE OFFICE OF THE ASSISTANT SECRETARY FOR MANAGEMENT,0,0,0,0,0,0,0,0,0,0,0,0,0,0,0,0,0,0,0,0,0,0,0,0,0,0,0,0,0,0,0,0,0,0,0,0,0,0,0,0,0,0,0
VADC-DEPUTY ASSISTANT SECRETARY FOR BUDGET,0,0,0,0,0,0,0,0,0,0,0,0,0,0,0,0,0,0,0,0,0,0,0,0,0,0,0,0,0,0,0,0,0,0,0,0,0,0,0,0,0,0,0
VADD-DEPUTY ASSISTANT SECRETARY FOR FINANCE,0,1,0,0,0,0,0,0,0,1,0,0,0,0,0,0,0,0,0,0,1,1,7,0,0,0,1,0,0,0,9,0,0,0,0,0,0,0,0,0,0,9,10
VADG-DEPUTY ASSISTANT SECRETARY FOR ACQUISITION AND MATERIEL MANAGEMENT,1,0,0,0,0,0,0,0,0,1,0,0,0,0,0,0,0,0,0,0,1,1,0,0,0,0,0,0,0,0,1,0,0,0,0,0,0,0,0,0,0,1,2
VAEA-IMMEDIATE OFFICE OF THE ASSISTANT SECRETARY FOR INFORMATION AND TECHNOLOGY,0,0,0,0,0,0,0,0,0,0,0,0,0,0,0,0,0,0,0,0,0,0,0,0,0,0,0,0,0,0,0,0,0,0,0,0,0,0,0,0,0,0,0
VAEB-DEPUTY ASSISTANT SECRETARY FOR INFORMATION AND TECHNOLOGY,7,2,0,0,0,1,0,0,0,10,0,0,0,0,0,0,0,0,0,0,10,2,28,0,11,0,2,0,0,0,43,0,0,0,0,0,0,0,0,0,0,43,53
VAHA-IMMEDIATE OFFICE OF THE ASSISTANT SECRETARY FOR POLICY AND PLANNING,0,0,0,0,0,0,0,0,0,0,0,0,0,0,0,0,0,0,0,0,0,0,0,0,0,0,0,0,0,0,0,0,0,0,0,0,0,0,0,0,1,1,1
VAHB-DEPUTY ASSISTANT SECRETARY FOR PROGRAM AND DATA ANALYSIS,0,0,0,0,0,0,0,0,0,0,0,0,0,0,0,0,0,0,0,0,0,0,0,0,0,0,0,0,0,0,0,0,0,0,0,0,0,0,0,0,0,0,0
VAHC-DEPUTY ASSISTANT SECRETARY FOR PLANNING AND EVALUATION,0,0,0,0,0,0,0,0,0,0,0,0,0,0,0,0,0,0,0,0,0,0,0,0,0,0,0,0,0,0,0,0,0,0,0,0,0,0,0,0,0,0,0
VAHD-NATIONAL CENTER FOR VETERAN ANALYSIS AND STATISTICS,0,0,0,0,0,0,0,0,0,0,0,0,0,0,0,0,0,0,0,0,0,0,0,0,0,0,0,0,0,0,0,0,0,0,0,0,0,0,0,0,0,0,0
VAJA-OFFICE OF THE ASSISTANT SECRETARY FOR PUBLIC AND INTERGOVERNMENTAL AFFAIRS,0,0,0,0,0,0,0,0,0,0,0,0,0,0,0,0,0,0,0,0,0,0,0,0,0,0,0,0,0,0,0,0,0,0,0,0,0,0,0,0,0,0,0
VAJB-DEPUTY ASSISTANCE SECRETARY FOR INTERGOVERNMENTAL AFFAIRS,0,0,0,0,0,0,0,0,0,0,0,0,0,0,0,0,0,0,0,0,0,0,0,0,0,0,0,0,0,0,0,0,0,0,0,0,0,0,0,0,0,0,0
VAJC-DEPUTY ASSISTANT SECRETARY FOR PUBLIC AFFAIRS,1,0,0,0,0,0,0,0,0,1,0,0,0,0,0,0,0,0,0,0,1,0,0,0,0,0,0,0,0,0,0,0,0,0,0,0,0,0,0,0,0,0,1
VAKA-IMMEDIATE OFFICE OF THE ASSISTANT SECRETARY FOR CONGRESSIONAL AND LEGISLATIVE AFFAIRS,0,0,0,0,0,0,0,0,0,0,0,0,0,0,0,0,0,0,0,0,0,0,0,0,0,0,0,0,0,0,0,0,0,0,0,0,0,0,0,0,0,0,0
VAKB-DEPUTY ASSISTANT SECRETARY FOR CONGRESSIONAL AFFAIRS,2,0,0,0,0,0,0,0,0,2,0,0,0,0,0,0,0,0,0,0,2,0,0,0,0,0,0,0,0,0,0,0,0,0,0,0,0,0,0,0,0,0,2
VALA-VETERANS BENEFITS ADMINISTRATION,18,7,0,0,0,0,0,0,0,25,0,0,0,0,0,0,0,0,0,0,25,8,47,1,70,0,21,0,0,0,147,8,0,0,0,0,1,0,0,9,0,156,181
VAPA-NATIONAL CEMETERY ADMINISTRATION,1,0,0,0,0,0,0,0,0,1,0,0,0,0,0,0,0,0,0,0,1,2,5,0,0,0,2,0,0,0,9,1,0,0,0,0,9,0,0,10,0,19,20
VATA-VETERANS HEALTH ADMINISTRATION,58,18,0,0,0,1,0,0,0,77,0,0,0,0,0,0,0,0,0,1,78,79,748,9,11,0,842,0,0,0,1689,98,35,65,0,0,909,0,0,1107,5,2801,2879
YA00-COMMISSION ON THE REVIEW OF THE OVERSEAS MILITARY FACILITY STRUCTURE OF THE UNITED STATES,0,0,0,0,0,0,0,0,0,0,0,0,0,0,0,0,0,0,0,0,0,0,0,0,0,0,0,0,0,0,0,0,0,0,0,0,0,0,0,0,0,0,0
YB00-ANTITRUST MODERNIZATION COMMISSION,0,0,0,0,0,0,0,0,0,0,0,0,0,0,0,0,0,0,0,0,0,0,0,0,0,0,0,0,0,0,0,0,0,0,0,0,0,0,0,0,0,0,0
YD00-HELPING TO ENHANCE THE LIVELIHOOD OF PEOPLE (HELP) AROUND THE GLOBE COMMISSION,0,0,0,0,0,0,0,0,0,0,0,0,0,0,0,0,0,0,0,0,0,0,0,0,0,0,0,0,0,0,0,0,0,0,0,0,0,0,0,0,0,0,0
YE00-COMMISSION ON THE PREVENTION OF WEAPONS OF MASS DESTRUCTION PROLIFERATION AND TERRORISM,0,0,0,0,0,0,0,0,0,0,0,0,0,0,0,0,0,0,0,0,0,0,0,0,0,0,0,0,0,0,0,0,0,0,0,0,0,0,0,0,0,0,0
ZL00-MEDICARE PAYMENT ADVISORY COMMISSION,0,0,0,0,0,0,0,0,0,0,0,0,0,0,0,0,0,0,0,0,0,0,0,0,0,0,0,0,0,0,0,0,0,0,0,0,0,0,0,0,0,0,0
ZP00-U.S. COMMISSION ON INTERNATIONAL RELIGIOUS FREEDOM,0,0,0,0,0,0,0,0,0,0,0,0,0,0,0,0,0,0,0,0,0,0,0,0,0,0,0,0,0,0,0,0,0,0,0,0,1,0,0,1,0,1,1
ZS00-UNITED STATES-CHINA ECONOMIC AND SECURITY REVIEW COMMISSION,0,0,0,0,0,0,0,0,0,0,0,0,0,0,0,0,0,0,0,0,0,0,0,0,0,0,0,0,0,0,0,0,0,0,0,0,0,0,0,0,0,0,0
ZU00-DWIGHT D. EISENHOWER MEMORIAL COMMISSION,0,0,0,0,0,0,0,0,0,0,0,0,0,0,0,0,0,0,0,0,0,0,0,0,0,0,0,0,0,0,0,0,0,0,0,0,0,0,0,0,0,0,0
All Agencies,867,168,0,0,0,4,3,0,0,1042,0,0,0,0,0,0,0,0,0,3,1045,787,4082,355,1065,0,3011,11,1,0,9312,1376,1313,571,28,5,2178,3,0,5474,11,14797,15842
