Agency,10-Competitive Service - Career,15-Competitive Service - Career-Conditional,30-Excepted Service - Schedule A,32-Excepted Service - Schedule B,35-Excepted Service - Schedule D,36-Excepted Service - Executive,38-Excepted Service - Other,50-Senior Executive Service - Career,55-Senior Executive Service - Non-Career,**-Unspecified,Permanent,20-Competitive Service,40-Excepted Service - Schedule A,42-Excepted Service - Schedule B,44-Excepted Service - Schedule C,45-Excepted Service - Schedule D,46-Excepted Service - Executive,48-Excepted Service - Other,60-Senior Executive Service - Limited Term,65-Senior Executive Service - Limited Emergency,Non-permanent,Unspecified,Type of Appointment - All,10-Competitive Service - Career,15-Competitive Service - Career-Conditional,30-Excepted Service - Schedule A,32-Excepted Service - Schedule B,35-Excepted Service - Schedule D,36-Excepted Service - Executive,38-Excepted Service - Other,50-Senior Executive Service - Career,55-Senior Executive Service - Non-Career,**-Unspecified,Permanent,20-Competitive Service,40-Excepted Service - Schedule A,42-Excepted Service - Schedule B,44-Excepted Service - Schedule C,45-Excepted Service - Schedule D,46-Excepted Service - Executive,48-Excepted Service - Other,60-Senior Executive Service - Limited Term,65-Senior Executive Service - Limited Emergency,Non-permanent,Unspecified,Type of Appointment - All,Type of Appointment - All
AA00-ADMINISTRATIVE CONFERENCE OF THE UNITED STATES,0,0,0,0,0,0,0,0,0,0,0,0,0,0,0,0,0,0,0,0,0,0,0,0,0,0,0,0,0,0,0,0,0,0,0,0,0,0,0,0,0,0,0,0,0,0,0
AB**-UNSPECIFIED,0,0,0,0,0,0,0,0,0,0,0,0,0,0,0,0,0,0,0,0,0,0,0,0,0,0,0,0,0,0,0,0,0,0,0,0,0,0,0,0,0,0,0,0,0,0,0
AB00-AMERICAN BATTLE MONUMENTS COMMISSION,0,0,0,0,0,0,0,0,0,0,0,0,0,0,0,0,0,0,0,0,0,0,0,0,0,0,0,0,0,0,0,0,0,0,0,0,0,0,0,0,1,0,0,1,0,1,1
AF**-UNSPECIFIED,0,0,0,0,0,0,0,0,0,0,0,0,0,0,0,0,0,0,0,0,0,0,0,0,0,0,0,0,0,0,0,0,0,0,0,0,0,0,0,0,0,0,0,0,0,0,0
AF02-AIR FORCE INSPECTION AGENCY (FO),0,0,0,0,0,0,0,0,0,0,0,0,0,0,0,0,0,0,0,0,0,0,0,0,0,0,0,0,0,0,0,0,0,0,0,0,0,0,0,0,0,0,0,0,0,0,0
AF03-AIR FORCE OPERATIONAL TEST AND EVALUATION CENTER,0,0,0,0,0,0,0,0,0,0,0,0,0,0,0,0,0,0,0,0,0,0,0,0,2,0,0,0,0,0,0,0,0,2,0,0,0,0,0,0,0,0,0,0,0,2,2
AF04-AIR FORCE COMMUNICATIONS AGENCY,0,0,0,0,0,0,0,0,0,0,0,0,0,0,0,0,0,0,0,0,0,0,0,0,0,0,0,0,0,0,0,0,0,0,0,0,0,0,0,0,0,0,0,0,0,0,0
AF05-AIR FORCE INTELLIGENCE ANALYSIS AGENCY,0,0,0,0,0,0,0,0,0,0,0,0,0,0,0,0,0,0,0,0,0,0,0,0,0,0,0,0,0,1,0,0,0,1,0,0,0,0,0,0,0,0,0,0,0,1,1
AF06-AIR FORCE AUDIT AGENCY,0,0,0,0,0,0,0,0,0,0,0,0,0,0,0,0,0,0,0,0,0,0,0,0,0,0,0,0,0,0,0,0,0,0,0,1,0,0,0,0,0,0,0,1,0,1,1
AF07-AIR FORCE OFFICE OF SPECIAL INVESTIGATIONS,0,1,0,0,0,0,0,0,0,0,1,0,0,0,0,0,0,0,0,0,0,0,1,0,2,3,0,0,0,2,0,0,0,7,2,0,0,0,0,0,0,0,0,2,0,9,10
AF08-AIR FORCE OFFICE OF SECURITY POLICE,0,0,0,0,0,0,0,0,0,0,0,0,0,0,0,0,0,0,0,0,0,0,0,0,0,0,0,0,0,1,0,0,0,1,0,0,0,0,0,0,0,0,0,0,0,1,1
AF09-AIR FORCE PERSONNEL CENTER,1,0,0,0,0,0,0,0,0,0,1,0,0,0,0,0,0,0,0,0,0,0,1,0,0,0,0,0,0,0,0,0,0,0,0,0,0,0,0,0,0,0,0,0,0,0,1
AF0B-U.S. AIR FORCE ACADEMY,1,2,0,0,0,0,0,0,0,0,3,0,0,0,0,0,0,0,0,0,0,0,3,1,10,0,0,0,0,0,0,0,0,11,10,3,0,0,0,0,0,0,0,13,0,24,27
"AF0D-U.S. AIR FORCES, EUROPE",2,2,0,0,0,0,0,0,0,0,4,0,0,0,0,0,0,0,0,0,0,0,4,0,9,0,0,0,0,1,0,0,0,10,0,29,0,0,0,0,0,0,0,29,0,39,43
AF0J-AIR EDUCATION AND TRAINING COMMAND,7,3,0,0,0,0,0,0,0,0,10,0,0,0,0,0,0,0,0,0,0,0,10,5,83,0,0,0,0,1,0,0,0,89,19,7,0,0,0,0,0,0,0,26,0,115,125
"AF0M-HEADQUARTERS, AIR FORCE RESERVE",4,3,0,0,0,0,0,0,0,0,7,0,0,0,0,0,0,0,0,0,0,0,7,6,108,0,0,0,0,6,0,0,0,120,10,0,0,0,0,0,0,0,0,10,0,130,137
"AF0N-HEADQUARTERS, U.S. AIR FORCE",0,0,0,0,0,0,0,0,0,0,0,0,0,0,0,0,0,0,0,0,0,0,0,0,0,0,0,0,0,0,0,0,0,0,0,0,0,0,0,0,0,0,0,0,0,0,0
AF0R-PACIFIC AIR FORCES,4,0,0,0,0,0,0,0,0,0,4,0,0,0,0,0,0,0,0,0,0,0,4,5,29,0,0,0,0,0,0,0,0,34,7,8,0,0,0,0,0,0,0,15,0,49,53
"AF0U-AIR FORCE INTELLIGENCE, SURVEILLANCE, & RECONNAISSANCE AGENCY",0,0,0,0,0,0,0,0,0,0,0,0,0,0,0,0,0,0,0,0,0,0,0,0,0,0,0,0,0,15,0,0,0,15,0,0,0,0,0,0,0,0,0,0,0,15,15
AF0V-AIR FORCE SPECIAL OPERATIONS COMMAND,0,0,0,0,0,0,0,0,0,0,0,0,0,0,0,0,0,0,0,0,0,0,0,1,6,0,0,0,0,2,0,0,0,9,1,2,0,0,0,0,0,0,0,3,0,12,12
AF11-AIR FORCE MANPOWER AGENCY,0,0,0,0,0,0,0,0,0,0,0,0,0,0,0,0,0,0,0,0,0,0,0,0,0,0,0,0,0,0,0,0,0,0,0,0,0,0,0,0,0,0,0,0,0,0,0
AF12-AIR FORCE PUBLIC AFFAIRS AGENCY,0,0,0,0,0,0,0,0,0,0,0,0,0,0,0,0,0,0,0,0,0,0,0,0,0,0,0,0,0,0,0,0,0,0,0,0,0,0,0,0,0,0,0,0,0,0,0
AF13-HQ USAF AND SUPPORT ELEMENTS,0,0,0,0,0,0,0,0,0,0,0,0,0,0,0,0,0,0,0,0,0,0,0,0,1,0,0,0,0,0,0,0,0,1,0,0,0,0,0,0,0,0,0,0,0,1,1
AF14-AIR FORCE INSTALLATION CONTRACTING AGENCY,0,0,0,0,0,0,0,0,0,0,0,0,0,0,0,0,0,0,0,0,0,0,0,0,0,0,0,0,0,0,0,0,0,0,0,0,0,0,0,0,0,0,0,0,0,0,0
AF15-AIR FORCE CIVIL ENGINEER CENTER,0,0,0,0,0,0,0,0,0,0,0,0,0,0,0,0,0,0,0,0,0,0,0,0,0,0,0,0,0,0,0,0,0,0,0,0,0,0,0,0,0,0,0,0,0,0,0
"AF1A-AIR FORCE C2 & INTELLIGENCE, SURVEILLANCE & RECONNAISSANCE",0,0,0,0,0,0,0,0,0,0,0,0,0,0,0,0,0,0,0,0,0,0,0,0,0,0,0,0,0,0,0,0,0,0,0,0,0,0,0,0,0,0,0,0,0,0,0
AF1C-AIR COMBAT COMMAND,2,0,0,0,0,0,0,0,0,0,2,0,0,0,0,0,0,0,0,0,0,0,2,4,79,1,0,0,0,2,0,0,0,86,24,2,0,0,1,0,1,0,0,28,0,114,116
AF1G-AIR FORCE LOGISTICS MANAGEMENT AGENCY,0,0,0,0,0,0,0,0,0,0,0,0,0,0,0,0,0,0,0,0,0,0,0,0,0,0,0,0,0,0,0,0,0,0,0,0,0,0,0,0,0,0,0,0,0,0,0
AF1L-AIR MOBILITY COMMAND,0,1,0,0,0,0,0,0,0,0,1,0,0,0,0,0,0,0,0,0,0,0,1,3,27,1,0,0,0,0,0,0,0,31,20,3,0,0,0,0,0,0,0,23,0,54,55
AF1M-AIR FORCE MATERIEL COMMAND,13,7,0,0,0,0,0,0,0,0,20,0,0,0,0,0,0,0,0,0,0,0,20,2,82,7,0,42,0,7,0,0,0,140,20,3,0,0,0,0,0,0,0,23,0,163,183
AF1P-AIR FORCE REAL PROPERTY AGENCY,0,0,0,0,0,0,0,0,0,0,0,0,0,0,0,0,0,0,0,0,0,0,0,0,0,0,0,0,0,0,0,0,0,0,0,0,0,0,0,0,0,0,0,0,0,0,0
AF1Q-HQ AF FLIGHT STANDARDS AGENCY,0,0,0,0,0,0,0,0,0,0,0,0,0,0,0,0,0,0,0,0,0,0,0,0,0,0,0,0,0,0,0,0,0,0,0,0,0,0,0,0,0,0,0,0,0,0,0
"AF1S-HEADQUARTERS, AIR FORCE SPACE COMMAND",5,4,0,0,0,0,0,0,0,0,9,0,0,0,0,0,0,0,0,0,0,0,9,0,34,0,0,0,0,4,0,0,0,38,10,1,0,0,0,0,1,0,0,12,0,50,59
AF1W-AIR FORCE ENGINEERING AND SERVICES CENTER,0,0,0,0,0,0,0,0,0,0,0,0,0,0,0,0,0,0,0,0,0,0,0,0,0,0,0,0,0,0,0,0,0,0,1,0,0,0,0,0,0,0,0,1,0,1,1
AF1Y-AIR FORCE CIVILIAN CAREER TRAINING,0,0,0,0,0,0,0,0,0,0,0,0,0,0,0,0,0,0,0,0,0,0,0,2,39,16,0,1,0,19,0,0,0,77,0,0,0,0,0,0,1,0,0,1,0,78,78
AF20-AIR FORCE AGENCY FOR MODELING/SIMULATION,0,0,0,0,0,0,0,0,0,0,0,0,0,0,0,0,0,0,0,0,0,0,0,0,0,0,0,0,0,0,0,0,0,0,0,0,0,0,0,0,0,0,0,0,0,0,0
AF21-AIR FORCE NUCLEAR WEAPONS AGENCY,0,0,0,0,0,0,0,0,0,0,0,0,0,0,0,0,0,0,0,0,0,0,0,0,0,0,0,0,0,0,0,0,0,0,0,0,0,0,0,0,0,0,0,0,0,0,0
AF24-HQ USAF DIRECT SUPPORT ELEMENT,0,0,0,0,0,0,0,0,0,0,0,0,0,0,0,0,0,0,0,0,0,0,0,0,0,0,0,0,0,0,0,0,0,0,0,0,0,0,0,0,0,0,0,0,0,0,0
AF25-AF-WIDE SUPPORT ELEMENT,0,0,0,0,0,0,0,0,0,0,0,0,0,0,0,0,0,0,0,0,0,0,0,0,0,0,0,0,0,0,0,0,0,0,0,0,0,0,0,0,0,0,0,0,0,0,0
AF27-AIR FORCE AGENCY FOR MODELING AND SIMULATION,0,0,0,0,0,0,0,0,0,0,0,0,0,0,0,0,0,0,0,0,0,0,0,0,0,0,0,0,0,0,0,0,0,0,0,0,0,0,0,0,0,0,0,0,0,0,0
AF2A-AIR FORCE COST ANALYSIS AGENCY,0,0,0,0,0,0,0,0,0,0,0,0,0,0,0,0,0,0,0,0,0,0,0,0,0,0,0,0,0,0,0,0,0,0,0,0,0,0,0,0,0,0,0,0,0,0,0
AF2D-AIR FORCE PERSONNEL OPERATIONS AGENCY,0,0,0,0,0,0,0,0,0,0,0,0,0,0,0,0,0,0,0,0,0,0,0,0,0,0,0,0,0,0,0,0,0,0,0,0,0,0,0,0,0,0,0,0,0,0,0
AF2E-AIR FORCE LEGAL OPERATIONS AGENCY,0,0,0,0,0,0,0,0,0,0,0,0,0,0,0,0,0,0,0,0,0,0,0,0,0,1,0,0,0,0,0,0,0,1,0,0,0,0,0,0,0,0,0,0,0,1,1
AF2F-AIR FORCE MEDICAL SERVICES CENTER,0,0,0,0,0,0,0,0,0,0,0,0,0,0,0,0,0,0,0,0,0,0,0,0,0,0,0,0,0,0,0,0,0,0,0,0,0,0,0,0,0,0,0,0,0,0,0
AF2G-AIR FORCE SERVICE INFORMATION AND NEWS CENTER,0,0,0,0,0,0,0,0,0,0,0,0,0,0,0,0,0,0,0,0,0,0,0,0,0,0,0,0,0,0,0,0,0,0,0,0,0,0,0,0,0,0,0,0,0,0,0
AF2H-AIR FORCE COMBAT OPERATIONS STAFF,0,0,0,0,0,0,0,0,0,0,0,0,0,0,0,0,0,0,0,0,0,0,0,0,0,0,0,0,0,0,0,0,0,0,0,0,0,0,0,0,0,0,0,0,0,0,0
AF2I-AIR NATIONAL GUARD SUPPORT CENTER,2,0,0,0,0,0,0,0,0,0,2,0,0,0,0,0,0,0,0,0,0,0,2,0,5,1,0,0,0,0,0,0,0,6,0,0,0,0,0,0,0,0,0,0,0,6,8
AF2K-AIR FORCE HISTORICAL RESEARCH AGENCY,0,0,0,0,0,0,0,0,0,0,0,0,0,0,0,0,0,0,0,0,0,0,0,0,0,0,0,0,0,0,0,0,0,0,0,0,0,0,0,0,0,0,0,0,0,0,0
AF2L-AIR FORCE TECHNICAL APPLICATIONS CENTER,0,0,0,0,0,0,0,0,0,0,0,0,0,0,0,0,0,0,0,0,0,0,0,0,0,0,0,0,0,0,0,0,0,0,0,0,0,0,0,0,0,0,0,0,0,0,0
AF2M-AIR FORCE REVIEW BOARDS AGENCY,0,0,0,0,0,0,0,0,0,0,0,0,0,0,0,0,0,0,0,0,0,0,0,0,0,0,0,0,0,0,0,0,0,0,1,0,0,0,0,0,0,0,0,1,0,1,1
AF2N-AIR FORCE CENTER FOR STUDIES AND ANALYSES,0,0,0,0,0,0,0,0,0,0,0,0,0,0,0,0,0,0,0,0,0,0,0,0,0,0,0,0,0,0,0,0,0,0,0,0,0,0,0,0,0,0,0,0,0,0,0
AF2Q-AIR WEATHER SERVICE,0,0,0,0,0,0,0,0,0,0,0,0,0,0,0,0,0,0,0,0,0,0,0,0,0,0,0,0,0,0,0,0,0,0,1,0,0,0,0,0,0,0,0,1,0,1,1
AF2R-AIR FORCE PROGRAM EXECUTIVE OFFICE,0,0,0,0,0,0,0,0,0,0,0,0,0,0,0,0,0,0,0,0,0,0,0,0,0,0,0,0,0,0,0,0,0,0,0,0,0,0,0,0,0,0,0,0,0,0,0
AF2S-AIR FORCE ELEMENTS NORAD,0,0,0,0,0,0,0,0,0,0,0,0,0,0,0,0,0,0,0,0,0,0,0,0,1,0,0,0,0,0,0,0,0,1,0,0,0,0,0,0,0,0,0,0,0,1,1
AF2T-AIR FORCE SAFETY CENTER,0,0,0,0,0,0,0,0,0,0,0,0,0,0,0,0,0,0,0,0,0,0,0,0,0,0,0,0,0,0,0,0,0,0,0,0,0,0,0,0,0,0,0,0,0,0,0
"AF2U-AIR FORCE MORALE, WELFARE AND RECREATION CENTER",0,0,0,0,0,0,0,0,0,0,0,0,0,0,0,0,0,0,0,0,0,0,0,0,0,0,0,0,0,0,0,0,0,0,0,0,0,0,0,0,0,0,0,0,0,0,0
AF2Z-AIR FORCE MEDICAL OPERATIONS AGENCY,0,0,0,0,0,0,0,0,0,0,0,0,0,0,0,0,0,0,0,0,0,0,0,0,1,0,0,0,0,0,0,0,0,1,0,0,0,0,0,0,0,0,0,0,0,1,1
AF34-AIR NATIONAL GUARD,1,0,0,0,0,0,0,0,0,0,1,0,0,0,0,0,0,0,0,0,0,0,1,0,3,0,0,0,0,0,0,0,0,3,1,0,0,0,0,0,0,0,0,1,0,4,5
"AF3C-AIR FORCE ELEMENTS, U.S. CENTRAL COMMAND",0,0,0,0,0,0,0,0,0,0,0,0,0,0,0,0,0,0,0,0,0,0,0,0,2,0,0,0,0,0,0,0,0,2,0,1,0,0,0,0,0,0,0,1,0,3,3
"AF3D-AIR FORCE ELEMENTS, U.S. SPECIAL OPERATIONS COMMAND",1,0,0,0,0,0,0,0,0,0,1,0,0,0,0,0,0,0,0,0,0,0,1,0,1,0,0,0,0,0,0,0,0,1,0,0,0,0,0,0,0,0,0,0,0,1,2
"AF3N-AIR FORCE ELEMENTS, U.S. ATLANTIC COMMAND",0,0,0,0,0,0,0,0,0,0,0,0,0,0,0,0,0,0,0,0,0,0,0,0,0,0,0,0,0,0,0,0,0,0,0,0,0,0,0,0,0,0,0,0,0,0,0
"AF3Q-AIR FORCE ELEMENTS, U.S. STRATEGIC COMMAND",346,15,0,0,0,0,17,0,0,0,378,0,0,0,0,0,0,0,0,0,0,0,378,2,6,2,0,0,0,2,0,0,0,12,1,1,0,0,0,0,1,0,0,3,0,15,393
"AF3T-AIR FORCE ELEMENTS, U.S. TRANSPORTATION COMMAND",0,1,0,0,0,0,0,0,0,0,1,0,0,0,0,0,0,0,0,0,0,0,1,1,0,0,0,0,0,0,0,0,0,1,0,0,0,0,0,0,0,0,0,0,0,1,2
AF3V-AIR FORCE ELEMENTS,0,0,0,0,0,0,0,0,0,0,0,0,0,0,0,0,0,0,0,0,0,0,0,0,0,0,0,0,0,0,0,0,0,0,0,1,0,0,0,0,0,0,0,1,0,1,1
AF3W-AIR FORCE CENTER FOR ENGINEER & ENVIRONMENT,0,0,0,0,0,0,0,0,0,0,0,0,0,0,0,0,0,0,0,0,0,0,0,0,1,0,0,0,0,0,0,0,0,1,0,0,0,0,0,0,0,0,0,0,0,1,1
AF3Y-AIR FORCE FREQUENCY MANAGEMENT AGENCY,0,0,0,0,0,0,0,0,0,0,0,0,0,0,0,0,0,0,0,0,0,0,0,0,0,0,0,0,0,0,0,0,0,0,0,0,0,0,0,0,0,0,0,0,0,0,0
"AF4D-AIR FORCE ELEMENTS, U.S. NORTHERN COMMAND",0,0,0,0,0,0,0,0,0,0,0,0,0,0,0,0,0,0,0,0,0,0,0,1,7,0,0,0,0,2,0,0,0,10,0,0,0,0,0,0,0,0,0,0,0,10,10
AF4W-AIR FORCE DISTRICT OF WASHINGTON,1,0,0,0,0,0,0,0,0,0,1,0,0,0,0,0,0,0,0,0,0,0,1,3,3,0,0,0,0,0,0,0,0,6,0,0,0,0,0,0,0,0,0,0,0,6,7
AF5J-AIR FORCE FINANCIAL SERVICES,0,0,0,0,0,0,0,0,0,0,0,0,0,0,0,0,0,0,0,0,0,0,0,0,0,0,0,0,0,0,0,0,0,0,0,0,0,0,0,0,0,0,0,0,0,0,0
AF5K-AIR FORCE PETROLEUM AGENCY,0,0,0,0,0,0,0,0,0,0,0,0,0,0,0,0,0,0,0,0,0,0,0,0,0,0,0,0,0,0,0,0,0,0,0,0,0,0,0,0,0,0,0,0,0,0,0
AFGS-AIR FORCE GLOBAL STRIKE COMMAND,1,0,0,0,0,0,0,0,0,0,1,0,0,0,0,0,0,0,0,0,0,0,1,1,20,0,0,0,0,0,0,0,0,21,0,0,0,0,0,0,0,0,0,0,0,21,22
AFNG-AIR NATIONAL GUARD UNITS (TITLE 32),0,0,0,0,0,0,0,0,0,0,0,0,0,0,0,0,0,0,0,0,0,0,0,0,1,0,0,0,0,73,0,0,0,74,0,5,0,0,0,0,214,0,0,219,0,293,293
"AFZG-U.S. SPECIAL OPERATIONS COMMAND (ANG, TITLE 32)",0,0,0,0,0,0,0,0,0,0,0,0,0,0,0,0,0,0,0,0,0,0,0,0,0,0,0,0,0,1,0,0,0,1,0,0,0,0,0,0,3,0,0,3,0,4,4
AG01-OFFICE OF THE SECRETARY OF AGRICULTURE,0,0,0,0,0,0,0,0,0,0,0,0,0,0,0,0,0,0,0,0,0,0,0,0,0,0,0,0,0,0,0,0,0,0,0,0,0,0,0,0,0,0,0,0,0,0,0
AG02-AGRICULTURAL MARKETING SERVICE,0,0,0,0,0,0,0,0,0,0,0,0,0,0,0,0,0,0,0,0,0,0,0,1,6,0,0,0,0,0,0,0,0,7,0,28,0,0,0,0,0,0,0,28,0,35,35
AG03-AGRICULTURAL RESEARCH SERVICE,1,0,0,0,0,0,0,0,0,0,1,0,0,0,0,0,0,0,0,0,0,0,1,0,4,1,0,0,0,0,0,0,0,5,3,63,8,0,0,0,0,0,0,74,0,79,80
AG07-RURAL HOUSING SERVICE,0,0,0,0,0,0,0,0,0,0,0,0,0,0,0,0,0,0,0,0,0,0,0,0,0,0,0,0,0,0,0,0,0,0,0,0,0,0,0,0,0,0,0,0,0,0,0
AG08-RISK MANAGEMENT AGENCY,0,0,0,0,0,0,0,0,0,0,0,0,0,0,0,0,0,0,0,0,0,0,0,0,0,0,0,0,0,0,0,0,0,0,0,0,0,0,0,0,0,0,0,0,0,0,0
AG10-FOREIGN AGRICULTURAL SERVICE,0,0,0,0,0,0,0,0,0,0,0,0,0,0,0,0,0,0,0,0,0,0,0,0,1,0,0,0,0,0,0,0,0,1,0,0,6,0,0,0,3,0,0,9,0,10,10
AG11-FOREST SERVICE,18,4,0,0,0,0,0,0,0,0,22,0,0,0,0,0,0,0,0,0,0,0,22,6,44,2,0,1,0,8,1,0,0,62,56,3,0,0,0,0,1,0,0,60,0,122,144
AG13-OFFICE OF COMMUNICATIONS,0,0,0,0,0,0,0,0,0,0,0,0,0,0,0,0,0,0,0,0,0,0,0,0,0,0,0,0,0,0,0,0,0,0,0,0,0,0,0,0,0,0,0,0,0,0,0
AG14-OFFICE OF THE GENERAL COUNSEL,0,0,0,0,0,0,0,0,0,0,0,0,0,0,0,0,0,0,0,0,0,0,0,0,0,0,0,0,0,0,0,0,0,0,0,0,0,0,0,0,0,0,0,0,0,0,0
AG15-RURAL UTILITIES SERVICE,0,0,0,0,0,0,0,0,0,0,0,0,0,0,0,0,0,0,0,0,0,0,0,0,0,0,0,0,0,0,0,0,0,0,0,0,0,0,0,0,0,0,0,0,0,0,0
AG16-NATURAL RESOURCES CONSERVATION SERVICE,4,3,0,0,0,0,0,0,0,0,7,0,0,0,0,0,0,0,0,0,0,0,7,1,9,0,0,0,0,0,0,0,0,10,2,3,0,0,0,0,1,0,0,6,0,16,23
AG18-ECONOMIC RESEARCH SERVICE,0,0,0,0,0,0,0,0,0,0,0,0,0,0,0,0,0,0,0,0,0,0,0,0,1,0,0,0,0,0,0,0,0,1,0,0,0,0,0,0,0,0,0,0,0,1,1
AG20-NATIONAL AGRICULTURAL STATISTICS SERVICE,0,0,0,0,0,0,0,0,0,0,0,0,0,0,0,0,0,0,0,0,0,0,0,0,0,0,0,0,0,0,0,0,0,0,22,0,0,0,0,0,0,0,0,22,0,22,22
"AG22-COOPERATIVE STATE RESEARCH, EDUCATION, AND EXTENSION SERVICE",2,0,0,0,0,0,0,0,0,0,2,0,0,0,0,0,0,0,0,0,0,0,2,0,0,0,0,0,0,1,0,0,0,1,0,1,0,0,0,0,0,0,0,1,0,2,4
AG23-OFFICE OF THE INSPECTOR GENERAL,1,0,0,0,0,0,0,0,0,0,1,0,0,0,0,0,0,0,0,0,0,0,1,0,0,0,0,0,0,0,0,0,0,0,0,0,0,0,0,0,0,0,0,0,0,0,1
AG30-FOOD AND NUTRITION SERVICE,1,1,0,0,0,0,0,0,0,0,2,0,0,0,0,0,0,0,0,0,0,0,2,3,7,0,0,0,0,0,0,0,0,10,2,0,0,0,0,0,0,0,0,2,0,12,14
AG32-RURAL BUSINESS-COOPERATIVE SERVICE,0,0,0,0,0,0,0,0,0,0,0,0,0,0,0,0,0,0,0,0,0,0,0,0,0,0,0,0,0,0,0,0,0,0,0,0,0,0,0,0,0,0,0,0,0,0,0
AG34-ANIMAL AND PLANT HEALTH INSPECTION SERVICE,3,0,0,0,0,0,0,0,0,0,3,0,0,0,0,0,0,0,0,0,0,0,3,1,11,0,0,0,0,1,0,0,0,13,15,26,0,0,2,0,0,0,0,43,0,56,59
"AG36-GRAIN INSPECTION, PACKERS AND STOCKYARDS ADMINISTRATION",0,0,0,0,0,0,0,0,0,0,0,0,0,0,0,0,0,0,0,0,0,0,0,0,0,0,0,0,0,0,0,0,0,0,0,3,0,0,0,0,0,0,0,3,0,3,3
AG37-FOOD SAFETY AND INSPECTION SERVICE,1,0,0,0,0,0,0,0,0,0,1,0,0,0,0,0,0,0,0,0,0,0,1,2,15,0,0,0,0,0,0,0,0,17,2,7,0,0,0,0,0,0,0,9,0,26,27
AG38-OFFICE OF THE CHIEF ECONOMIST,0,0,0,0,0,0,0,0,0,0,0,0,0,0,0,0,0,0,0,0,0,0,0,0,0,0,0,0,0,0,0,0,0,0,0,0,0,0,0,0,0,0,0,0,0,0,0
AG42-OFFICE OF BUDGET AND PROGRAM ANALYSIS,1,0,0,0,0,0,0,0,0,0,1,0,0,0,0,0,0,0,0,0,0,0,1,0,0,0,0,0,0,0,0,0,0,0,0,0,0,0,0,0,0,0,0,0,0,0,1
AG90-OFFICE OF THE CHIEF FINANCIAL OFFICER,0,1,0,0,0,0,0,0,0,0,1,0,0,0,0,0,0,0,0,0,0,0,1,0,8,0,0,0,0,1,0,0,0,9,1,0,0,0,0,0,0,0,0,1,0,10,11
AGAO-OFFICE OF ADVOCACY AND OUTREACH,0,0,0,0,0,0,0,0,0,0,0,0,0,0,0,0,0,0,0,0,0,0,0,0,0,0,0,0,0,0,0,0,0,0,0,0,0,0,0,0,0,0,0,0,0,0,0
AGCR-CIVIL RIGHTS,0,0,0,0,0,0,0,0,0,0,0,0,0,0,0,0,0,0,0,0,0,0,0,0,0,0,0,0,0,0,0,0,0,0,0,0,0,0,0,0,0,0,0,0,0,0,0
AGDA-DEPARTMENTAL ADMINISTRATION,0,0,0,0,0,0,0,0,0,0,0,0,0,0,0,0,0,0,0,0,0,0,0,0,0,0,0,0,0,0,0,0,0,0,0,1,0,0,0,0,0,0,0,1,0,1,1
AGES-OFFICE OF THE EXECUTIVE SECRETARIAT,0,0,0,0,0,0,0,0,0,0,0,0,0,0,0,0,0,0,0,0,0,0,0,0,0,0,0,0,0,0,0,0,0,0,0,0,0,0,0,0,0,0,0,0,0,0,0
AGFA-FARM SERVICE AGENCY,4,3,0,0,0,0,0,0,0,0,7,0,0,0,0,0,0,0,0,0,0,0,7,2,6,1,0,0,0,0,0,0,0,9,0,0,0,1,0,0,0,0,0,1,0,10,17
AGHL-HOMELAND SECURITY STAFF,0,0,0,0,0,0,0,0,0,0,0,0,0,0,0,0,0,0,0,0,0,0,0,0,0,0,0,0,0,0,0,0,0,0,0,0,0,0,0,0,0,0,0,0,0,0,0
AGIT-OFFICE OF THE CHIEF INFORMATION OFFICER,2,0,0,0,0,0,0,0,0,0,2,0,0,0,0,0,0,0,0,0,0,0,2,0,5,0,0,1,0,0,0,0,0,6,0,0,0,0,0,0,0,0,0,0,0,6,8
AGNA-NATIONAL APPEALS DIVISION,0,0,0,0,0,0,0,0,0,0,0,0,0,0,0,0,0,0,0,0,0,0,0,0,0,0,0,0,0,0,0,0,0,0,0,0,0,0,0,0,0,0,0,0,0,0,0
AH01-NATIONAL ENDOWMENT FOR THE ARTS,1,0,0,0,0,0,0,0,0,0,1,0,0,0,0,0,0,0,0,0,0,0,1,0,0,0,0,0,0,0,0,0,0,0,0,0,0,0,0,0,0,0,0,0,0,0,1
AH02-NATIONAL ENDOWMENT FOR THE HUMANITIES,0,0,0,0,0,0,0,0,0,0,0,0,0,0,0,0,0,0,0,0,0,0,0,0,0,0,0,0,0,0,0,0,0,0,0,0,2,0,0,0,0,0,0,2,0,2,2
AH03-INSTITUTE OF MUSEUM AND LIBRARY SERVICES,0,0,0,0,0,0,0,0,0,0,0,0,0,0,0,0,0,0,0,0,0,0,0,1,0,0,0,0,0,0,0,0,0,1,0,0,0,0,0,0,0,0,0,0,0,1,1
AM00-AGENCY FOR INTERNATIONAL DEVELOPMENT,4,1,0,0,0,0,0,0,0,0,5,0,0,0,0,0,0,0,0,0,0,0,5,0,5,0,0,3,0,2,0,0,0,10,1,0,0,0,3,0,53,0,0,57,0,67,72
AN00-AFRICAN DEVELOPMENT FOUNDATION,0,0,0,0,0,0,0,0,0,0,0,0,0,0,0,0,0,0,0,0,0,0,0,0,0,0,0,0,0,0,0,0,0,0,0,0,0,0,0,0,0,0,0,0,0,0,0
AP00-APPALACHIAN REGIONAL COMMISSION,0,0,0,0,0,0,0,0,0,0,0,0,0,0,0,0,0,0,0,0,0,0,0,0,0,0,0,0,0,0,0,0,0,0,0,0,0,0,0,0,0,0,0,0,0,0,0
AR**-UNSPECIFIED,0,0,0,0,0,0,0,0,0,0,0,0,0,0,0,0,0,0,0,0,0,0,0,0,0,0,0,0,0,0,0,0,0,0,0,0,0,0,0,0,0,0,0,0,0,0,0
AR2A-UNITED STATES ARMY CYBER COMMAND,0,0,0,0,0,0,0,0,0,0,0,0,0,0,0,0,0,0,0,0,0,0,0,0,2,0,0,0,0,1,0,0,0,3,0,0,0,0,0,0,0,0,0,0,0,3,3
AR3A-U.S. ARMY CENTRAL,0,0,0,0,0,0,0,0,0,0,0,0,0,0,0,0,0,0,0,0,0,0,0,0,0,0,0,0,0,0,0,0,0,0,0,0,0,0,0,0,22,0,0,22,0,22,22
AR5A-U.S. ARMY NORTH,0,0,0,0,0,0,0,0,0,0,0,0,0,0,0,0,0,0,0,0,0,0,0,0,2,0,0,0,0,0,0,0,0,2,1,0,0,0,0,0,0,0,0,1,0,3,3
ARA1-US ARMY AFRICA/SOUTHERN EUROPEAN TASK FORCE (USAFRAF/SETAF),1,0,0,0,0,0,0,0,0,0,1,0,0,0,0,0,0,0,0,0,0,0,1,0,2,0,0,0,0,0,0,0,0,2,0,0,0,0,0,0,0,0,0,0,0,2,3
ARAA-U. S. ARMY ACCESSION COMMAND,1,0,0,0,0,0,0,0,0,0,1,0,0,0,0,0,0,0,0,0,0,0,1,1,7,0,0,0,0,3,0,0,0,11,3,0,0,0,0,0,0,0,0,3,0,14,15
ARAC-U.S. ARMY CONTRACTING AGENCY,0,0,0,0,0,0,0,0,0,0,0,0,0,0,0,0,0,0,0,0,0,0,0,0,0,0,0,0,0,0,0,0,0,0,0,0,0,0,0,0,0,0,0,0,0,0,0
ARAE-U.S. ARMY ACQUISITION SUPPORT CENTER,4,0,0,0,0,0,0,0,0,0,4,0,0,0,0,0,0,0,0,0,0,0,4,2,6,0,0,0,0,0,0,0,0,8,2,8,0,0,0,0,0,0,0,10,0,18,22
ARAP-U. S. MILITARY ENTRANCE PROCESSING COMMAND,0,1,0,0,0,0,0,0,0,0,1,0,0,0,0,0,0,0,0,0,0,0,1,3,8,0,0,0,0,7,0,0,0,18,3,0,0,0,0,0,0,0,0,3,0,21,22
ARAS-U.S. ARMY INTELLIGENCE AND SECURITY COMMAND,0,0,0,0,0,0,0,0,0,0,0,0,0,0,0,0,0,0,0,0,0,0,0,0,0,0,0,0,0,17,0,0,0,17,0,0,0,0,0,0,15,0,0,15,0,32,32
ARAT-U.S. ARMY TEST AND EVALUATION COMMAND,0,0,0,0,0,0,0,0,0,0,0,0,0,0,0,0,0,0,0,0,0,0,0,0,9,1,0,0,0,0,0,0,0,10,1,0,0,0,0,0,0,0,0,1,0,11,11
ARBA-U.S. ARMY INSTALLATION MANAGEMENT COMMAND,5,5,0,0,0,0,0,0,0,0,10,0,0,0,0,0,0,0,0,0,0,0,10,5,65,0,0,0,0,21,0,0,0,91,19,9,0,0,0,0,13,0,0,41,0,132,142
ARCB-U.S. ARMY CRIMINAL INVESTIGATION COMMAND,0,0,0,0,0,0,0,0,0,0,0,0,0,0,0,0,0,0,0,0,0,0,0,0,1,0,0,0,0,0,0,0,0,1,1,0,0,0,0,0,0,0,0,1,0,2,2
ARCE-U.S. ARMY CORPS OF ENGINEERS,15,4,0,0,0,0,0,0,0,0,19,0,0,0,0,0,0,0,0,0,0,0,19,7,47,3,0,0,0,1,0,0,0,58,26,14,0,0,1,0,2,0,0,43,0,101,120
ARCS-IMMEDIATE OFFICE OF THE CHIEF OF STAFF OF THE ARMY,0,0,0,0,0,0,0,0,0,0,0,0,0,0,0,0,0,0,0,0,0,0,0,0,1,0,0,0,0,0,0,0,0,1,0,0,0,0,0,0,5,0,0,5,0,6,6
ARE1-IMMEDIATE OFFICE OF THE COMMANDER-IN-CHIEF OF THE U.S. ARMY EUROPE AND SEVENTH ARMY,1,0,0,0,0,0,0,0,0,0,1,0,0,0,0,0,0,0,0,0,0,0,1,0,1,0,0,0,0,2,0,0,0,3,0,2,0,0,0,0,0,0,0,2,0,5,6
ARE2-21ST THEATER ARMY AREA COMMAND,0,0,0,0,0,0,0,0,0,0,0,0,0,0,0,0,0,0,0,0,0,0,0,0,0,0,0,0,0,0,0,0,0,0,0,0,0,0,0,0,0,0,0,0,0,0,0
ARE3-U.S. ARMY SOUTHERN EURPOEAN TASK FORCE,0,0,0,0,0,0,0,0,0,0,0,0,0,0,0,0,0,0,0,0,0,0,0,0,0,0,0,0,0,0,0,0,0,0,0,0,0,0,0,0,0,0,0,0,0,0,0
ARE5-U.S. ARMY V CORPS,0,0,0,0,0,0,0,0,0,0,0,0,0,0,0,0,0,0,0,0,0,0,0,0,0,0,0,0,0,0,0,0,0,0,0,0,0,0,0,0,0,0,0,0,0,0,0
AREN-SEVENTH ARMY TRAINING COMMAND,0,0,0,0,0,0,0,0,0,0,0,0,0,0,0,0,0,0,0,0,0,0,0,0,0,0,0,0,0,0,0,0,0,0,0,2,0,0,0,0,0,0,0,2,0,2,2
ARFC-U.S. ARMY FORCES COMMAND,0,0,0,0,0,0,0,0,0,0,0,0,0,0,0,0,0,0,0,0,0,0,0,0,4,0,0,0,0,0,0,0,0,4,11,0,0,0,0,0,6,0,0,17,0,21,21
ARG6-U.S. ARMY NETWORK ENTERPRISE TECHNOLOGY COMMAND/9TH ARMY SIGNAL COMMAND,8,1,0,0,0,0,0,0,0,0,9,0,0,0,0,0,0,0,0,0,0,0,9,3,16,0,0,0,0,2,0,0,0,21,4,1,0,0,0,0,0,0,0,5,0,26,35
ARGB-OFFICE OF THE CHIEF OF THE NATIONAL GUARD BUREAU,3,0,0,0,0,0,0,0,0,0,3,0,0,0,0,0,0,0,0,0,0,0,3,0,3,0,0,0,0,1,0,0,0,4,0,0,0,0,0,0,0,0,0,0,0,4,7
ARHR-U.S. ARMY RESERVE COMMAND,2,3,0,0,0,0,0,0,0,0,5,0,0,0,0,0,0,0,0,0,0,0,5,5,55,1,0,0,0,47,0,0,0,108,2,0,0,0,0,0,0,0,0,2,0,110,115
ARJ1-U.S. ARMY ELEMENT SHAPE,0,0,0,0,0,0,0,0,0,0,0,0,0,0,0,0,0,0,0,0,0,0,0,0,0,0,0,0,0,0,0,0,0,0,0,0,0,0,0,0,0,0,0,0,0,0,0
ARJA-JOINT ACTIVITIES,5,0,0,0,0,0,0,0,0,0,5,0,0,0,0,0,0,0,0,0,0,0,5,0,15,0,0,0,0,4,0,0,0,19,0,1,0,0,0,0,5,0,0,6,0,25,30
ARMA-U.S. MILITARY ACADEMY,0,0,0,0,0,0,0,0,0,0,0,0,0,0,0,0,0,0,0,0,0,0,0,0,0,0,0,0,0,0,0,0,0,0,3,4,0,0,0,0,0,0,0,7,0,7,7
ARMC-U.S. ARMY MEDICAL COMMAND,11,11,0,0,0,0,0,0,0,0,22,0,0,0,0,0,0,0,0,0,0,0,22,20,388,3,0,0,0,30,0,0,0,441,67,21,0,0,1,0,1,0,0,90,0,531,553
ARMW-U.S. ARMY MILITARY DISTRICT OF WASHINGTON,0,0,0,0,0,0,0,0,0,0,0,0,0,0,0,0,0,0,0,0,0,0,0,0,3,0,0,0,0,0,0,0,0,3,0,0,0,0,0,0,0,0,0,0,0,3,3
ARNG-ARMY NATIONAL GUARD UNITS (TITLE 32),0,0,0,0,0,0,0,0,0,0,0,0,0,0,0,0,0,0,0,0,0,0,0,1,3,0,0,0,0,162,0,0,0,166,1,16,0,0,0,0,192,0,0,209,0,375,375
"ARP1-U.S. ARMY, PACIFIC",0,0,0,0,0,0,0,0,0,0,0,0,0,0,0,0,0,0,0,0,0,0,0,0,3,0,0,0,0,1,0,0,0,4,1,0,0,0,0,0,0,0,0,1,0,5,5
ARP8-EIGHTH U.S. ARMY,0,0,0,0,0,0,0,0,0,0,0,0,0,0,0,0,0,0,0,0,0,0,0,0,0,0,0,0,0,0,0,0,0,0,0,0,0,0,0,0,0,0,0,0,0,0,0
ARSA-OFFICE OF THE SECRETARY OF THE ARMY,1,0,0,0,0,0,0,0,0,0,1,0,0,0,0,0,0,0,0,0,0,0,1,0,1,2,0,0,0,0,0,0,0,3,0,0,0,1,0,0,0,0,0,1,0,4,5
ARSB-FIELD OPERATING OFFICES OF THE OFFICE OF THE SECRETARY OF THE ARMY,1,2,0,0,0,0,0,0,0,0,3,0,0,0,0,0,0,0,0,0,0,0,3,2,32,1,0,1,0,12,0,0,0,48,0,0,0,0,0,0,0,0,0,0,0,48,51
ARSC-U. S. ARMY SPACE AND MISSILE DEFENSE COMMAND/U. S. ARMY FORCES STRATEGIC COMMAND,1,0,0,0,0,0,0,0,0,0,1,0,0,0,0,0,0,0,0,0,0,0,1,0,1,0,0,0,0,0,0,0,0,1,1,0,0,0,0,0,0,0,0,1,0,2,3
ARSE-FIELD OPERATING AGENCIES OF THE ARMY STAFF RESOURCED THROUGH OA-22,9,2,0,0,0,0,0,0,0,0,11,0,0,0,0,0,0,0,0,0,0,0,11,6,18,0,0,0,0,5,0,0,0,29,7,1,0,0,0,0,0,0,0,8,0,37,48
ARSF-FIELD OPERATING AGENCIES OF THE ARMY STAFF,0,0,0,0,0,0,0,0,0,0,0,0,0,0,0,0,0,0,0,0,0,0,0,0,0,0,0,0,0,0,0,0,0,0,0,0,0,0,0,0,0,0,0,0,0,0,0
"ARSJ-JOINT SERVICES AND ACTIVITIES SUPPORTED BY THE OFFICE, SECRETARY OF THE ARMY",3,1,0,0,0,0,0,0,0,0,4,0,0,0,0,0,0,0,0,0,0,0,4,0,4,0,0,0,0,2,0,0,0,6,0,9,0,0,0,0,0,0,0,9,0,15,19
ARSO-U.S. ARMY SOUTH,1,0,0,0,0,0,0,0,0,0,1,0,0,0,0,0,0,0,0,0,0,0,1,1,0,0,0,0,0,0,0,0,0,1,0,0,0,0,0,0,0,0,0,0,0,1,2
ARSP-U.S. SPECIAL OPERATIONS COMMAND (ARMY),1,0,0,0,0,0,0,0,0,0,1,0,0,0,0,0,0,0,0,0,0,0,1,0,6,0,0,0,0,0,0,0,0,6,1,0,0,0,0,0,1,0,0,2,0,8,9
ARTA-U.S. ARMY ACCESSIONS COMMAND,0,0,0,0,0,0,0,0,0,0,0,0,0,0,0,0,0,0,0,0,0,0,0,0,0,0,0,0,0,0,0,0,0,0,0,0,0,0,0,0,0,0,0,0,0,0,0
ARTC-U.S. ARMY TRAINING AND DOCTRINE COMMAND,1,0,0,0,0,0,0,0,0,0,1,0,0,0,0,0,0,0,0,0,0,0,1,1,6,0,0,0,0,7,0,0,0,14,4,16,0,0,0,0,0,0,0,20,0,34,35
ARTM-U.S. MILITARY ENTRANCE PROCESSING COMMAND,0,0,0,0,0,0,0,0,0,0,0,0,0,0,0,0,0,0,0,0,0,0,0,0,0,0,0,0,0,0,0,0,0,0,0,0,0,0,0,0,0,0,0,0,0,0,0
ARTW-U.S. ARMY WAR COLLEGE,0,0,0,0,0,0,0,0,0,0,0,0,0,0,0,0,0,0,0,0,0,0,0,0,0,0,0,0,0,0,0,0,0,0,0,0,0,0,0,0,0,0,0,0,0,0,0
ARX1-414TH SUPPORT BRIGADE,0,0,0,0,0,0,0,0,0,0,0,0,0,0,0,0,0,0,0,0,0,0,0,0,0,0,0,0,0,0,0,0,0,0,0,0,0,0,0,0,0,0,0,0,0,0,0
"ARX2-HEADQUARTERS, AMC",0,0,0,0,0,0,0,0,0,0,0,0,0,0,0,0,0,0,0,0,0,0,0,0,1,0,0,0,0,0,0,0,0,1,0,0,0,0,0,0,0,0,0,0,0,1,1
"ARX3-HEADQUARTERS, STAFF SUPPORT ACTIVITIES, AMC",0,0,0,0,0,0,0,0,0,0,0,0,0,0,0,0,0,0,0,0,0,0,0,0,0,0,0,0,0,0,0,0,0,0,0,0,0,0,0,0,0,0,0,0,0,0,0
ARX6-U.S. ARMY AVIATION AND MISSILE COMMAND,6,0,0,0,0,0,0,0,0,0,6,0,0,0,0,0,0,0,0,0,0,0,6,0,10,0,0,0,0,2,0,0,0,12,1,0,0,0,0,0,0,0,0,1,1,14,20
ARX7-U.S. ARMY TANK-AUTOMOTIVE AND ARMAMENT COMMAND (TACOM),0,0,0,0,0,0,0,0,0,0,0,0,0,0,0,0,0,0,0,0,0,0,0,2,33,1,0,0,0,7,0,0,0,43,27,4,0,0,0,0,108,0,0,139,0,182,182
ARX8-U.S. ARMY COMMUNICATIONS ELECTRONICS COMMAND,0,0,0,0,0,0,0,0,0,0,0,0,0,0,0,0,0,0,0,0,0,0,0,1,0,2,0,0,0,1,0,0,0,4,3,0,0,0,0,0,0,0,0,3,0,7,7
ARXB-U.S. ARMY CHEMICAL MATERIALS ACTIVITY,0,0,0,0,0,0,0,0,0,0,0,0,0,0,0,0,0,0,0,0,0,0,0,0,2,0,0,0,0,0,0,0,0,2,1,0,0,0,0,0,0,0,0,1,0,3,3
ARXC-U.S. ARMY SUSTAINMENT COMMAND,1,0,0,0,0,0,0,0,0,0,1,0,0,0,0,0,0,0,0,0,0,0,1,0,0,0,0,0,0,0,0,0,0,0,0,7,0,0,0,0,0,0,0,7,0,7,8
ARXD-U. S. ARMY CONTRACTING COMMAND,2,0,0,0,0,0,0,0,0,0,2,0,0,0,0,0,0,0,0,0,0,0,2,2,1,0,0,1,0,0,0,0,0,4,2,0,0,0,0,0,0,0,0,2,0,6,8
ARXK-MATERIEL ACQUISITION ACTIVITIES,0,0,0,0,0,0,0,0,0,0,0,0,0,0,0,0,0,0,0,0,0,0,0,0,0,0,0,0,0,0,0,0,0,0,0,0,0,0,0,0,0,0,0,0,0,0,0
ARXP-U.S. ARMY SECURITY ASSISTANCE COMMAND,0,0,0,0,0,0,0,0,0,0,0,0,0,0,0,0,0,0,0,0,0,0,0,0,0,0,0,0,0,0,0,0,0,0,2,0,0,0,0,0,0,0,0,2,0,2,2
ARXQ-U.S. ARMY JOINT MUNITIONS COMMAND,1,0,0,0,0,0,0,0,0,0,1,0,0,0,0,0,0,0,0,0,0,0,1,0,7,0,0,0,0,1,0,0,0,8,1,1,0,0,0,0,0,0,0,2,0,10,11
"ARXR-U.S. ARMY RESEARCH, DEVELOPMENT AND ENGINEERING COMMAND",3,0,0,0,0,0,0,0,0,0,3,0,0,0,0,0,0,0,0,0,0,0,3,1,4,0,0,0,0,1,0,0,0,6,1,0,0,0,3,0,0,0,0,4,0,10,13
ARXT-U.S. ARMY MILITARY SURFACE DEPLOYMENT AND DISTRIBUTION COMMAND,1,0,0,0,0,0,0,0,0,0,1,0,0,0,0,0,0,0,0,0,0,0,1,0,1,0,0,0,0,0,0,0,0,1,1,0,0,0,0,0,0,0,0,1,0,2,3
ARXX-MATERIEL READINESS ACTIVITIES,0,0,0,0,0,0,0,0,0,0,0,0,0,0,0,0,0,0,0,0,0,0,0,0,1,0,0,0,0,0,0,0,0,1,0,0,0,0,0,0,0,0,0,0,0,1,1
AU00-FEDERAL LABOR RELATIONS AUTHORITY,0,0,0,0,0,0,0,0,0,0,0,0,0,0,0,0,0,0,0,0,0,0,0,0,1,0,0,0,0,0,0,0,0,1,0,0,0,0,0,0,0,0,0,0,0,1,1
AW00-ARCTIC RESEARCH COMMISSION,0,0,0,0,0,0,0,0,0,0,0,0,0,0,0,0,0,0,0,0,0,0,0,0,0,0,0,0,0,0,0,0,0,0,0,0,0,0,0,0,0,0,0,0,0,0,0
BD00-MERIT SYSTEMS PROTECTION BOARD,0,0,0,0,0,0,0,0,0,0,0,0,0,0,0,0,0,0,0,0,0,0,0,0,0,0,0,0,0,0,0,0,0,0,0,0,0,0,0,0,0,0,0,0,0,0,0
BF00-DEFENSE NUCLEAR FACILITIES SAFETY BOARD,0,0,0,0,0,0,0,0,0,0,0,0,0,0,0,0,0,0,0,0,0,0,0,0,0,0,0,0,0,2,0,0,0,2,0,0,0,0,0,1,0,0,0,1,0,3,3
BG00-PENSION BENEFIT GUARANTY CORPORATION,4,0,0,0,0,0,0,0,0,0,4,0,0,0,0,0,0,0,0,0,0,0,4,0,4,1,0,0,0,0,0,0,0,5,1,1,0,0,0,0,0,0,0,2,0,7,11
BK00-JAMES MADISON MEMORIAL FELLOWSHIP FOUNDATION,0,0,0,0,0,0,0,0,0,0,0,0,0,0,0,0,0,0,0,0,0,0,0,0,0,0,0,0,0,0,0,0,0,0,0,0,0,0,0,0,0,0,0,0,0,0,0
BO00-OFFICE OF MANAGEMENT AND BUDGET,0,1,0,0,0,0,0,0,0,0,1,0,0,0,0,0,0,0,0,0,0,0,1,2,1,0,0,1,0,0,0,0,0,4,0,0,0,0,4,0,0,0,0,4,0,8,9
BT00-ARCHITECTURAL AND TRANSPORTATION BARRIERS COMPLIANCE BOARD,0,0,0,0,0,0,0,0,0,0,0,0,0,0,0,0,0,0,0,0,0,0,0,0,0,0,0,0,0,0,0,0,0,0,0,0,0,0,0,0,0,0,0,0,0,0,0
BW00-NUCLEAR WASTE TECHNICAL REVIEW BOARD,0,0,0,0,0,0,0,0,0,0,0,0,0,0,0,0,0,0,0,0,0,0,0,0,0,0,0,0,0,0,0,0,0,0,0,0,0,0,0,8,0,0,0,8,0,8,8
BZ00-CHRISTOPHER COLUMBUS FELLOWSHIP FOUNDATION,0,0,0,0,0,0,0,0,0,0,0,0,0,0,0,0,0,0,0,0,0,0,0,0,0,0,0,0,0,0,0,0,0,0,0,0,0,0,0,0,0,0,0,0,0,0,0
CC00-COMMISSION ON CIVIL RIGHTS,0,0,0,0,0,0,0,0,0,0,0,0,0,0,0,0,0,0,0,0,0,0,0,0,0,0,0,0,0,0,0,0,0,0,0,0,0,0,0,0,0,0,0,0,0,0,0
