Agency,10-Competitive Service - Career,15-Competitive Service - Career-Conditional,30-Excepted Service - Schedule A,32-Excepted Service - Schedule B,35-Excepted Service - Schedule D,36-Excepted Service - Executive,38-Excepted Service - Other,50-Senior Executive Service - Career,55-Senior Executive Service - Non-Career,**-Unspecified,Permanent,20-Competitive Service,40-Excepted Service - Schedule A,42-Excepted Service - Schedule B,44-Excepted Service - Schedule C,45-Excepted Service - Schedule D,46-Excepted Service - Executive,48-Excepted Service - Other,60-Senior Executive Service - Limited Term,65-Senior Executive Service - Limited Emergency,Non-permanent,Unspecified,Type of Appointment - All,10-Competitive Service - Career,15-Competitive Service - Career-Conditional,30-Excepted Service - Schedule A,32-Excepted Service - Schedule B,35-Excepted Service - Schedule D,36-Excepted Service - Executive,38-Excepted Service - Other,50-Senior Executive Service - Career,55-Senior Executive Service - Non-Career,**-Unspecified,Permanent,20-Competitive Service,40-Excepted Service - Schedule A,42-Excepted Service - Schedule B,44-Excepted Service - Schedule C,45-Excepted Service - Schedule D,46-Excepted Service - Executive,48-Excepted Service - Other,60-Senior Executive Service - Limited Term,65-Senior Executive Service - Limited Emergency,Non-permanent,Unspecified,Type of Appointment - All,Type of Appointment - All
AA00-ADMINISTRATIVE CONFERENCE OF THE UNITED STATES,0,0,0,0,0,0,0,0,0,0,0,0,0,0,0,0,0,0,0,0,0,0,0,1,0,0,0,0,0,0,0,0,0,1,0,1,0,0,0,0,0,0,0,1,0,2,2
AB**-UNSPECIFIED,0,0,0,0,0,0,0,0,0,0,0,0,0,0,0,0,0,0,0,0,0,0,0,0,0,0,0,0,0,0,0,0,0,0,0,0,0,0,0,0,0,0,0,0,0,0,0
AB00-AMERICAN BATTLE MONUMENTS COMMISSION,0,0,0,0,0,0,0,0,0,0,0,0,0,0,0,0,0,0,0,0,0,0,0,0,0,0,0,0,0,0,0,0,0,0,0,0,6,0,0,0,1,0,0,7,0,7,7
AF**-UNSPECIFIED,0,0,0,0,0,0,0,0,0,0,0,0,0,0,0,0,0,0,0,0,0,0,0,0,0,0,0,0,0,0,0,0,0,0,0,0,0,0,0,0,0,0,0,0,0,0,0
AF02-AIR FORCE INSPECTION AGENCY (FO),0,0,0,0,0,0,0,0,0,0,0,0,0,0,0,0,0,0,0,0,0,0,0,0,0,0,0,0,0,0,0,0,0,0,0,0,0,0,0,0,0,0,0,0,0,0,0
AF03-AIR FORCE OPERATIONAL TEST AND EVALUATION CENTER,0,0,0,0,0,0,0,0,0,0,0,0,0,0,0,0,0,0,0,0,0,0,0,0,1,0,0,0,0,0,0,0,0,1,0,0,0,0,0,0,0,0,0,0,0,1,1
AF04-AIR FORCE COMMUNICATIONS AGENCY,0,0,0,0,0,0,0,0,0,0,0,0,0,0,0,0,0,0,0,0,0,0,0,0,0,0,0,0,0,0,0,0,0,0,0,0,0,0,0,0,0,0,0,0,0,0,0
AF05-AIR FORCE INTELLIGENCE ANALYSIS AGENCY,0,0,0,0,0,0,0,0,0,0,0,0,0,0,0,0,0,0,0,0,0,0,0,0,0,0,0,0,0,0,0,0,0,0,0,0,0,0,0,0,0,0,0,0,0,0,0
AF06-AIR FORCE AUDIT AGENCY,0,0,0,0,0,0,0,0,0,0,0,0,0,0,0,0,0,0,0,0,0,0,0,0,0,0,0,0,0,0,0,0,0,0,0,0,0,0,0,0,0,0,0,0,0,0,0
AF07-AIR FORCE OFFICE OF SPECIAL INVESTIGATIONS,0,2,0,0,0,0,0,0,0,0,2,0,0,0,0,0,0,0,0,0,0,0,2,0,3,1,0,0,0,2,0,0,0,6,0,0,0,0,0,0,0,0,0,0,0,6,8
AF08-AIR FORCE OFFICE OF SECURITY POLICE,0,0,0,0,0,0,0,0,0,0,0,0,0,0,0,0,0,0,0,0,0,0,0,0,0,0,0,0,0,0,0,0,0,0,0,0,0,0,0,0,0,0,0,0,0,0,0
AF09-AIR FORCE PERSONNEL CENTER,0,0,0,0,0,0,0,0,0,0,0,0,0,0,0,0,0,0,0,0,0,0,0,0,0,0,0,0,0,0,0,0,0,0,0,0,0,0,0,0,0,0,0,0,0,0,0
AF0B-U.S. AIR FORCE ACADEMY,1,1,0,0,0,0,0,0,0,0,2,0,0,0,0,0,0,0,0,0,0,0,2,1,4,0,0,0,0,0,0,0,0,5,1,0,0,0,0,0,0,0,0,1,0,6,8
"AF0D-U.S. AIR FORCES, EUROPE",2,0,0,0,0,0,0,0,0,0,2,0,0,0,0,0,0,0,0,0,0,0,2,0,8,0,0,0,0,0,0,0,0,8,1,20,0,0,0,0,0,0,0,21,0,29,31
AF0J-AIR EDUCATION AND TRAINING COMMAND,7,2,0,0,0,0,0,0,0,0,9,0,0,0,0,0,0,0,0,0,0,0,9,4,54,0,0,0,0,2,0,0,0,60,25,1,98,0,0,0,0,0,0,124,0,184,193
"AF0M-HEADQUARTERS, AIR FORCE RESERVE",5,3,0,0,0,0,0,0,0,0,8,0,0,0,0,0,0,0,0,0,0,0,8,7,95,0,0,0,0,5,0,0,0,107,7,0,0,0,0,0,0,0,0,7,0,114,122
"AF0N-HEADQUARTERS, U.S. AIR FORCE",0,0,0,0,0,0,0,0,0,0,0,0,0,0,0,0,0,0,0,0,0,0,0,0,0,0,0,0,0,0,0,0,0,0,0,0,0,0,0,0,0,0,0,0,0,0,0
AF0R-PACIFIC AIR FORCES,1,1,0,0,0,0,0,0,0,0,2,0,0,0,0,0,0,0,0,0,0,0,2,3,7,0,0,0,0,0,0,0,0,10,1,11,15,0,0,0,0,0,0,27,0,37,39
"AF0U-AIR FORCE INTELLIGENCE, SURVEILLANCE, & RECONNAISSANCE AGENCY",0,0,0,0,0,0,0,0,0,0,0,0,0,0,0,0,0,0,0,0,0,0,0,0,0,0,0,0,0,16,0,0,0,16,0,0,0,0,0,0,0,0,0,0,0,16,16
AF0V-AIR FORCE SPECIAL OPERATIONS COMMAND,0,0,0,0,0,0,0,0,0,0,0,0,0,0,0,0,0,0,0,0,0,0,0,0,4,0,0,0,0,0,0,0,0,4,2,1,0,0,0,0,0,0,0,3,0,7,7
AF11-AIR FORCE MANPOWER AGENCY,0,0,0,0,0,0,0,0,0,0,0,0,0,0,0,0,0,0,0,0,0,0,0,0,0,0,0,0,0,0,0,0,0,0,0,0,0,0,0,0,0,0,0,0,0,0,0
AF12-AIR FORCE PUBLIC AFFAIRS AGENCY,0,0,0,0,0,0,0,0,0,0,0,0,0,0,0,0,0,0,0,0,0,0,0,0,0,0,0,0,0,0,0,0,0,0,0,0,0,0,0,0,0,0,0,0,0,0,0
AF13-HQ USAF AND SUPPORT ELEMENTS,0,0,0,0,0,0,0,1,0,0,1,0,0,0,0,0,0,0,0,0,0,0,1,0,0,0,0,0,0,0,0,0,0,0,0,15,0,0,0,0,3,0,0,18,0,18,19
AF14-AIR FORCE INSTALLATION CONTRACTING AGENCY,0,0,0,0,0,0,0,0,0,0,0,0,0,0,0,0,0,0,0,0,0,0,0,0,0,0,0,0,0,0,0,0,0,0,0,0,0,0,0,0,0,0,0,0,0,0,0
AF15-AIR FORCE CIVIL ENGINEER CENTER,0,0,0,0,0,0,0,0,0,0,0,0,0,0,0,0,0,0,0,0,0,0,0,0,0,0,0,0,0,0,0,0,0,0,0,0,0,0,0,0,0,0,0,0,0,0,0
"AF1A-AIR FORCE C2 & INTELLIGENCE, SURVEILLANCE & RECONNAISSANCE",0,0,0,0,0,0,0,0,0,0,0,0,0,0,0,0,0,0,0,0,0,0,0,0,0,0,0,0,0,0,0,0,0,0,0,0,0,0,0,0,0,0,0,0,0,0,0
AF1C-AIR COMBAT COMMAND,3,0,0,0,0,0,0,0,0,0,3,0,0,0,0,0,0,0,0,0,0,0,3,3,66,0,0,0,0,2,0,0,0,71,8,2,47,0,0,0,0,0,0,57,0,128,131
AF1G-AIR FORCE LOGISTICS MANAGEMENT AGENCY,0,0,0,0,0,0,0,0,0,0,0,0,0,0,0,0,0,0,0,0,0,0,0,0,0,0,0,0,0,0,0,0,0,0,0,0,0,0,0,0,0,0,0,0,0,0,0
AF1L-AIR MOBILITY COMMAND,3,1,0,0,0,0,0,0,0,0,4,0,0,0,0,0,0,0,0,0,0,0,4,4,19,0,0,0,0,1,0,0,0,24,5,4,90,0,0,0,0,0,0,99,0,123,127
AF1M-AIR FORCE MATERIEL COMMAND,3,6,0,0,0,0,0,0,0,0,9,0,0,0,0,0,0,0,0,0,0,0,9,2,87,3,10,0,0,4,0,0,0,106,54,0,90,0,0,0,0,0,0,144,0,250,259
AF1P-AIR FORCE REAL PROPERTY AGENCY,0,0,0,0,0,0,0,0,0,0,0,0,0,0,0,0,0,0,0,0,0,0,0,0,0,0,0,0,0,0,0,0,0,0,0,0,0,0,0,0,0,0,0,0,0,0,0
AF1Q-HQ AF FLIGHT STANDARDS AGENCY,0,0,0,0,0,0,0,0,0,0,0,0,0,0,0,0,0,0,0,0,0,0,0,0,0,0,0,0,0,0,0,0,0,0,0,0,0,0,0,0,0,0,0,0,0,0,0
"AF1S-HEADQUARTERS, AIR FORCE SPACE COMMAND",3,2,0,0,0,0,0,0,0,0,5,0,0,0,0,0,0,0,0,0,0,0,5,1,26,0,0,0,0,12,0,0,0,39,10,1,13,0,0,0,0,0,0,24,0,63,68
AF1W-AIR FORCE ENGINEERING AND SERVICES CENTER,0,0,0,0,0,0,0,0,0,0,0,0,0,0,0,0,0,0,0,0,0,0,0,0,0,0,0,0,0,0,0,0,0,0,0,0,0,0,0,0,0,0,0,0,0,0,0
AF1Y-AIR FORCE CIVILIAN CAREER TRAINING,0,0,0,0,0,0,0,0,0,0,0,0,0,0,0,0,0,0,0,0,0,0,0,0,12,6,28,0,0,1,0,0,0,47,1,0,0,0,0,0,0,0,0,1,0,48,48
AF20-AIR FORCE AGENCY FOR MODELING/SIMULATION,0,0,0,0,0,0,0,0,0,0,0,0,0,0,0,0,0,0,0,0,0,0,0,0,0,0,0,0,0,0,0,0,0,0,0,0,0,0,0,0,0,0,0,0,0,0,0
AF21-AIR FORCE NUCLEAR WEAPONS AGENCY,0,0,0,0,0,0,0,0,0,0,0,0,0,0,0,0,0,0,0,0,0,0,0,0,0,0,0,0,0,0,0,0,0,0,0,0,0,0,0,0,0,0,0,0,0,0,0
AF24-HQ USAF DIRECT SUPPORT ELEMENT,0,0,0,0,0,0,0,0,0,0,0,0,0,0,0,0,0,0,0,0,0,0,0,0,0,0,0,0,0,0,0,0,0,0,0,0,0,0,0,0,0,0,0,0,0,0,0
AF25-AF-WIDE SUPPORT ELEMENT,0,0,0,0,0,0,0,0,0,0,0,0,0,0,0,0,0,0,0,0,0,0,0,0,0,0,0,0,0,0,0,0,0,0,0,0,0,0,0,0,0,0,0,0,0,0,0
AF27-AIR FORCE AGENCY FOR MODELING AND SIMULATION,0,0,0,0,0,0,0,0,0,0,0,0,0,0,0,0,0,0,0,0,0,0,0,0,0,0,0,0,0,0,0,0,0,0,0,0,0,0,0,0,0,0,0,0,0,0,0
AF2A-AIR FORCE COST ANALYSIS AGENCY,0,0,0,0,0,0,0,0,0,0,0,0,0,0,0,0,0,0,0,0,0,0,0,0,0,0,0,0,0,0,0,0,0,0,0,0,0,0,0,0,0,0,0,0,0,0,0
AF2D-AIR FORCE PERSONNEL OPERATIONS AGENCY,0,0,0,0,0,0,0,0,0,0,0,0,0,0,0,0,0,0,0,0,0,0,0,0,0,0,0,0,0,0,0,0,0,0,0,0,0,0,0,0,0,0,0,0,0,0,0
AF2E-AIR FORCE LEGAL OPERATIONS AGENCY,0,0,0,0,0,0,0,0,0,0,0,0,0,0,0,0,0,0,0,0,0,0,0,0,1,0,0,0,0,0,0,0,0,1,0,0,0,0,0,0,0,0,0,0,0,1,1
AF2F-AIR FORCE MEDICAL SERVICES CENTER,0,0,0,0,0,0,0,0,0,0,0,0,0,0,0,0,0,0,0,0,0,0,0,0,1,0,0,0,0,0,0,0,0,1,0,0,0,0,0,0,0,0,0,0,0,1,1
AF2G-AIR FORCE SERVICE INFORMATION AND NEWS CENTER,0,0,0,0,0,0,0,0,0,0,0,0,0,0,0,0,0,0,0,0,0,0,0,0,0,0,0,0,0,0,0,0,0,0,0,0,0,0,0,0,0,0,0,0,0,0,0
AF2H-AIR FORCE COMBAT OPERATIONS STAFF,0,0,0,0,0,0,0,0,0,0,0,0,0,0,0,0,0,0,0,0,0,0,0,0,0,0,0,0,0,0,0,0,0,0,0,0,0,0,0,0,0,0,0,0,0,0,0
AF2I-AIR NATIONAL GUARD SUPPORT CENTER,2,1,0,0,0,0,0,0,0,0,3,0,0,0,0,0,0,0,0,0,0,0,3,0,6,0,0,0,0,0,0,0,0,6,1,0,2,0,0,0,0,0,0,3,0,9,12
AF2K-AIR FORCE HISTORICAL RESEARCH AGENCY,0,0,0,0,0,0,0,0,0,0,0,0,0,0,0,0,0,0,0,0,0,0,0,0,0,0,0,0,0,0,0,0,0,0,0,0,0,0,0,0,0,0,0,0,0,0,0
AF2L-AIR FORCE TECHNICAL APPLICATIONS CENTER,0,0,0,0,0,0,0,0,0,0,0,0,0,0,0,0,0,0,0,0,0,0,0,0,0,0,0,0,0,8,0,0,0,8,0,0,0,0,0,0,1,0,0,1,0,9,9
AF2M-AIR FORCE REVIEW BOARDS AGENCY,0,0,0,0,0,0,0,0,0,0,0,0,0,0,0,0,0,0,0,0,0,0,0,0,0,0,0,0,0,0,0,0,0,0,1,0,0,0,0,0,0,0,0,1,0,1,1
AF2N-AIR FORCE CENTER FOR STUDIES AND ANALYSES,0,0,0,0,0,0,0,0,0,0,0,0,0,0,0,0,0,0,0,0,0,0,0,0,0,0,0,0,0,0,0,0,0,0,0,0,0,0,0,0,0,0,0,0,0,0,0
AF2Q-AIR WEATHER SERVICE,0,0,0,0,0,0,0,0,0,0,0,0,0,0,0,0,0,0,0,0,0,0,0,0,0,0,0,0,0,0,0,0,0,0,0,0,0,0,0,0,0,0,0,0,0,0,0
AF2R-AIR FORCE PROGRAM EXECUTIVE OFFICE,0,0,0,0,0,0,0,0,0,0,0,0,0,0,0,0,0,0,0,0,0,0,0,0,0,0,0,0,0,0,0,0,0,0,0,0,0,0,0,0,0,0,0,0,0,0,0
AF2S-AIR FORCE ELEMENTS NORAD,0,0,0,0,0,0,0,0,0,0,0,0,0,0,0,0,0,0,0,0,0,0,0,0,0,0,0,0,0,0,0,0,0,0,0,0,0,0,0,0,0,0,0,0,0,0,0
AF2T-AIR FORCE SAFETY CENTER,0,0,0,0,0,0,0,0,0,0,0,0,0,0,0,0,0,0,0,0,0,0,0,0,0,0,0,0,0,0,0,0,0,0,0,0,0,0,0,0,0,0,0,0,0,0,0
"AF2U-AIR FORCE MORALE, WELFARE AND RECREATION CENTER",0,0,0,0,0,0,0,0,0,0,0,0,0,0,0,0,0,0,0,0,0,0,0,0,0,0,0,0,0,0,0,0,0,0,0,0,0,0,0,0,0,0,0,0,0,0,0
AF2Z-AIR FORCE MEDICAL OPERATIONS AGENCY,0,0,0,0,0,0,0,0,0,0,0,0,0,0,0,0,0,0,0,0,0,0,0,0,0,0,0,0,0,0,0,0,0,0,0,0,0,0,0,0,0,0,0,0,0,0,0
AF34-AIR NATIONAL GUARD,0,0,0,0,0,0,0,0,0,0,0,0,0,0,0,0,0,0,0,0,0,0,0,0,5,0,0,0,0,0,0,0,0,5,4,1,12,0,0,0,0,0,0,17,0,22,22
"AF3C-AIR FORCE ELEMENTS, U.S. CENTRAL COMMAND",0,0,0,0,0,0,0,0,0,0,0,0,0,0,0,0,0,0,0,0,0,0,0,0,11,0,0,0,0,0,0,0,0,11,0,0,0,0,0,0,0,0,0,0,0,11,11
"AF3D-AIR FORCE ELEMENTS, U.S. SPECIAL OPERATIONS COMMAND",3,0,0,0,0,0,0,0,0,0,3,0,0,0,0,0,0,0,0,0,0,0,3,1,5,0,0,0,0,0,0,0,0,6,0,0,0,0,0,0,0,0,0,0,0,6,9
"AF3N-AIR FORCE ELEMENTS, U.S. ATLANTIC COMMAND",0,0,0,0,0,0,0,0,0,0,0,0,0,0,0,0,0,0,0,0,0,0,0,0,0,0,0,0,0,0,0,0,0,0,0,0,0,0,0,0,0,0,0,0,0,0,0
"AF3Q-AIR FORCE ELEMENTS, U.S. STRATEGIC COMMAND",0,0,0,0,0,0,0,0,0,0,0,0,0,0,0,0,0,0,0,0,0,0,0,0,6,2,0,0,0,1,1,0,0,10,2,0,16,0,0,0,0,0,0,18,0,28,28
"AF3T-AIR FORCE ELEMENTS, U.S. TRANSPORTATION COMMAND",1,1,0,0,0,0,0,0,0,0,2,0,0,0,0,0,0,0,0,0,0,0,2,2,0,0,0,0,0,0,0,0,0,2,0,0,0,0,0,0,0,0,0,0,0,2,4
AF3V-AIR FORCE ELEMENTS,0,0,0,0,0,0,0,0,0,0,0,0,0,0,0,0,0,0,0,0,0,0,0,0,2,0,0,0,0,0,0,0,0,2,0,42,0,0,0,0,0,0,0,42,0,44,44
AF3W-AIR FORCE CENTER FOR ENGINEER & ENVIRONMENT,0,0,0,0,0,0,0,0,0,0,0,0,0,0,0,0,0,0,0,0,0,0,0,0,1,0,0,0,0,0,0,0,0,1,0,0,0,0,0,0,0,0,0,0,0,1,1
AF3Y-AIR FORCE FREQUENCY MANAGEMENT AGENCY,0,0,0,0,0,0,0,0,0,0,0,0,0,0,0,0,0,0,0,0,0,0,0,0,0,0,0,0,0,0,0,0,0,0,0,0,0,0,0,0,0,0,0,0,0,0,0
"AF4D-AIR FORCE ELEMENTS, U.S. NORTHERN COMMAND",1,0,0,0,0,0,0,0,0,0,1,0,0,0,0,0,0,0,0,0,0,0,1,0,5,0,0,0,0,0,0,0,0,5,1,0,0,0,0,0,1,0,0,2,0,7,8
AF4W-AIR FORCE DISTRICT OF WASHINGTON,0,0,0,0,0,0,0,0,0,0,0,0,0,0,0,0,0,0,0,0,0,0,0,0,0,0,0,0,0,0,0,0,0,0,2,0,0,0,0,0,0,0,0,2,0,2,2
AF5J-AIR FORCE FINANCIAL SERVICES,0,0,0,0,0,0,0,0,0,0,0,0,0,0,0,0,0,0,0,0,0,0,0,0,0,0,0,0,0,0,0,0,0,0,6,0,0,0,0,0,0,0,0,6,0,6,6
AF5K-AIR FORCE PETROLEUM AGENCY,0,0,0,0,0,0,0,0,0,0,0,0,0,0,0,0,0,0,0,0,0,0,0,0,0,0,0,0,0,0,0,0,0,0,0,0,0,0,0,0,0,0,0,0,0,0,0
AFGS-AIR FORCE GLOBAL STRIKE COMMAND,1,1,0,0,0,0,0,0,0,0,2,0,0,0,0,0,0,0,0,0,0,0,2,1,6,0,0,0,0,0,0,0,0,7,1,0,2,0,0,0,0,0,0,3,0,10,12
AFNG-AIR NATIONAL GUARD UNITS (TITLE 32),0,0,0,0,0,0,0,0,0,0,0,0,0,0,0,0,0,0,0,0,0,0,0,0,1,0,0,0,0,58,0,0,0,59,1,3,3,0,0,0,288,0,0,295,0,354,354
"AFZG-U.S. SPECIAL OPERATIONS COMMAND (ANG, TITLE 32)",0,0,0,0,0,0,0,0,0,0,0,0,0,0,0,0,0,0,0,0,0,0,0,0,0,0,0,0,0,0,0,0,0,0,0,0,0,0,0,0,14,0,0,14,0,14,14
AG01-OFFICE OF THE SECRETARY OF AGRICULTURE,1,0,0,0,0,0,0,0,0,0,1,0,0,0,0,0,0,0,0,0,0,0,1,0,0,0,0,0,0,0,0,0,0,0,0,0,2,1,0,0,0,0,0,3,0,3,4
AG02-AGRICULTURAL MARKETING SERVICE,0,0,0,0,0,0,0,0,0,0,0,0,0,0,0,0,0,0,0,0,0,0,0,1,6,0,0,0,0,0,0,0,0,7,0,1,7,0,0,0,1,0,0,9,0,16,16
AG03-AGRICULTURAL RESEARCH SERVICE,1,0,0,0,0,0,0,0,0,0,1,0,0,0,0,0,0,0,0,0,0,0,1,0,0,0,1,0,0,3,0,0,0,4,8,119,265,0,0,0,0,0,0,392,0,396,397
AG07-RURAL HOUSING SERVICE,0,0,0,0,0,0,0,0,0,0,0,0,0,0,0,0,0,0,0,0,0,0,0,0,1,0,0,0,0,0,0,0,0,1,1,0,6,0,0,0,0,0,0,7,0,8,8
AG08-RISK MANAGEMENT AGENCY,0,0,0,0,0,0,0,0,0,0,0,0,0,0,0,0,0,0,0,0,0,0,0,0,0,0,0,0,0,0,0,0,0,0,0,0,4,0,0,0,0,0,0,4,0,4,4
AG10-FOREIGN AGRICULTURAL SERVICE,0,0,0,0,0,0,0,0,0,0,0,0,0,0,0,0,0,0,0,0,0,0,0,0,1,0,0,0,0,0,0,0,0,1,0,0,3,1,0,0,2,0,0,6,0,7,7
AG11-FOREST SERVICE,15,4,0,0,0,0,0,0,0,0,19,0,0,0,0,0,0,0,0,0,0,0,19,6,43,4,26,0,0,16,0,0,0,95,4549,8,1432,0,0,0,1,0,0,5990,0,6085,6104
AG13-OFFICE OF COMMUNICATIONS,0,0,0,0,0,0,0,0,0,0,0,0,0,0,0,0,0,0,0,0,0,0,0,0,0,0,0,0,0,0,0,0,0,0,0,0,0,0,0,0,0,0,0,0,0,0,0
AG14-OFFICE OF THE GENERAL COUNSEL,0,0,0,0,0,0,0,0,0,0,0,0,0,0,0,0,0,0,0,0,0,0,0,0,0,0,0,0,0,0,0,0,0,0,0,0,1,0,0,0,0,0,0,1,0,1,1
AG15-RURAL UTILITIES SERVICE,0,0,0,0,0,0,0,0,0,0,0,0,0,0,0,0,0,0,0,0,0,0,0,1,4,0,0,0,0,0,0,0,0,5,0,0,0,0,0,0,0,0,0,0,0,5,5
AG16-NATURAL RESOURCES CONSERVATION SERVICE,1,2,0,0,0,0,0,0,0,0,3,0,0,0,0,0,0,0,0,0,0,0,3,2,16,1,57,0,0,0,0,0,0,76,11,21,123,0,0,0,3,0,0,158,0,234,237
AG18-ECONOMIC RESEARCH SERVICE,0,0,0,0,0,0,0,0,0,0,0,0,0,0,0,0,0,0,0,0,0,0,0,0,0,0,0,0,0,0,0,0,0,0,0,0,11,0,0,0,0,0,0,11,0,11,11
AG20-NATIONAL AGRICULTURAL STATISTICS SERVICE,2,0,0,0,0,0,0,0,0,0,2,0,0,0,0,0,0,0,0,0,0,0,2,0,0,0,9,0,0,0,0,0,0,9,0,0,10,0,0,0,0,0,0,10,0,19,21
"AG22-COOPERATIVE STATE RESEARCH, EDUCATION, AND EXTENSION SERVICE",0,0,0,0,0,0,0,0,0,0,0,0,0,0,0,0,0,0,0,0,0,0,0,1,2,0,0,0,0,0,0,0,0,3,0,2,2,0,0,1,1,0,0,6,0,9,9
AG23-OFFICE OF THE INSPECTOR GENERAL,0,0,0,0,0,0,0,0,0,0,0,0,0,0,0,0,0,0,0,0,0,0,0,0,0,0,0,0,0,0,0,0,0,0,0,0,0,0,0,0,0,0,0,0,0,0,0
AG30-FOOD AND NUTRITION SERVICE,2,0,0,0,0,0,0,0,0,0,2,0,0,0,0,0,0,0,0,0,0,0,2,1,2,0,2,0,0,0,0,0,0,5,0,0,7,0,0,0,0,0,0,7,0,12,14
AG32-RURAL BUSINESS-COOPERATIVE SERVICE,0,0,0,0,0,0,0,0,0,0,0,0,0,0,0,0,0,0,0,0,0,0,0,0,0,0,0,0,0,0,0,0,0,0,0,0,0,0,0,0,0,0,0,0,0,0,0
AG34-ANIMAL AND PLANT HEALTH INSPECTION SERVICE,1,0,0,0,0,0,0,0,0,0,1,0,0,0,0,0,0,0,0,0,0,0,1,1,0,0,0,0,0,0,0,0,0,1,9,88,17,0,0,0,0,0,0,114,0,115,116
"AG36-GRAIN INSPECTION, PACKERS AND STOCKYARDS ADMINISTRATION",0,0,0,0,0,0,0,0,0,0,0,0,0,0,0,0,0,0,0,0,0,0,0,0,1,0,0,0,0,0,0,0,0,1,0,4,0,0,0,0,0,0,0,4,0,5,5
AG37-FOOD SAFETY AND INSPECTION SERVICE,0,0,0,0,0,0,0,0,0,0,0,0,0,0,0,0,0,0,0,0,0,0,0,2,20,0,2,0,0,0,0,0,0,24,2,9,5,0,0,0,0,0,0,16,0,40,40
AG38-OFFICE OF THE CHIEF ECONOMIST,0,0,0,0,0,0,0,0,0,0,0,0,0,0,0,0,0,0,0,0,0,0,0,0,0,0,0,0,0,0,0,0,0,0,0,0,0,0,0,0,0,0,0,0,0,0,0
AG42-OFFICE OF BUDGET AND PROGRAM ANALYSIS,0,0,0,0,0,0,0,0,0,0,0,0,0,0,0,0,0,0,0,0,0,0,0,0,0,0,0,0,0,0,0,0,0,0,0,0,0,0,0,0,0,0,0,0,0,0,0
AG90-OFFICE OF THE CHIEF FINANCIAL OFFICER,0,1,0,0,0,0,0,0,0,0,1,0,0,0,0,0,0,0,0,0,0,0,1,0,6,0,0,0,0,0,0,0,0,6,0,0,0,0,0,0,0,0,0,0,0,6,7
AGAO-OFFICE OF ADVOCACY AND OUTREACH,0,0,0,0,0,0,0,0,0,0,0,0,0,0,0,0,0,0,0,0,0,0,0,0,0,0,0,0,0,0,0,0,0,0,0,0,0,0,0,0,0,0,0,0,0,0,0
AGCR-CIVIL RIGHTS,1,0,0,0,0,0,0,0,0,0,1,0,0,0,0,0,0,0,0,0,0,0,1,0,0,0,0,0,0,0,0,0,0,0,0,0,3,0,0,0,0,0,0,3,0,3,4
AGDA-DEPARTMENTAL ADMINISTRATION,1,0,0,0,0,0,0,0,0,0,1,0,0,0,0,0,0,0,0,0,0,0,1,0,0,0,0,0,0,0,0,0,0,0,1,0,1,0,0,0,0,0,0,2,0,2,3
AGES-OFFICE OF THE EXECUTIVE SECRETARIAT,0,0,0,0,0,0,0,0,0,0,0,0,0,0,0,0,0,0,0,0,0,0,0,0,0,0,0,0,0,0,0,0,0,0,0,0,0,0,0,0,0,0,0,0,0,0,0
AGFA-FARM SERVICE AGENCY,3,0,0,0,0,0,0,0,0,0,3,0,0,0,0,0,0,0,0,0,0,0,3,4,4,0,0,0,0,0,0,0,0,8,0,0,0,1,0,0,0,0,0,1,0,9,12
AGHL-HOMELAND SECURITY STAFF,0,0,0,0,0,0,0,0,0,0,0,0,0,0,0,0,0,0,0,0,0,0,0,0,1,0,0,0,0,0,0,0,0,1,0,0,0,0,0,0,0,0,0,0,0,1,1
AGIT-OFFICE OF THE CHIEF INFORMATION OFFICER,4,1,0,0,0,0,0,0,0,0,5,0,0,0,0,0,0,0,0,0,0,0,5,0,3,0,0,0,0,1,0,0,0,4,0,0,0,0,0,0,0,0,0,0,0,4,9
AGNA-NATIONAL APPEALS DIVISION,0,0,0,0,0,0,0,0,0,0,0,0,0,0,0,0,0,0,0,0,0,0,0,0,1,0,0,0,0,0,0,0,0,1,0,1,0,0,0,0,0,0,0,1,0,2,2
AH01-NATIONAL ENDOWMENT FOR THE ARTS,0,0,0,0,0,0,0,0,0,0,0,0,0,0,0,0,0,0,0,0,0,0,0,0,2,0,0,0,0,0,0,0,0,2,0,1,0,0,0,1,0,0,0,2,0,4,4
AH02-NATIONAL ENDOWMENT FOR THE HUMANITIES,0,0,0,0,0,0,0,0,0,0,0,0,0,0,0,0,0,0,0,0,0,0,0,0,0,0,0,0,0,0,0,0,0,0,0,0,0,0,0,0,0,0,0,0,0,0,0
AH03-INSTITUTE OF MUSEUM AND LIBRARY SERVICES,0,0,0,0,0,0,0,0,0,0,0,0,0,0,0,0,0,0,0,0,0,0,0,0,2,0,0,0,0,0,0,0,0,2,0,0,0,0,0,0,0,0,0,0,0,2,2
AM00-AGENCY FOR INTERNATIONAL DEVELOPMENT,3,1,0,0,0,0,0,0,0,0,4,0,0,0,0,0,0,0,0,0,0,0,4,0,1,5,3,0,0,0,0,0,0,9,2,0,2,0,0,0,45,0,0,49,0,58,62
AN00-AFRICAN DEVELOPMENT FOUNDATION,0,0,0,0,0,0,0,0,0,0,0,0,0,0,0,0,0,0,0,0,0,0,0,0,0,0,0,0,0,0,0,0,0,0,0,0,0,0,0,0,0,0,0,0,0,0,0
AP00-APPALACHIAN REGIONAL COMMISSION,0,0,0,0,0,0,0,0,0,0,0,0,0,0,0,0,0,0,0,0,0,0,0,0,0,0,0,0,0,0,0,0,0,0,0,0,0,0,0,0,0,0,0,0,0,0,0
AR**-UNSPECIFIED,0,0,0,0,0,0,0,0,0,0,0,0,0,0,0,0,0,0,0,0,0,0,0,0,0,0,0,0,0,0,0,0,0,0,0,0,0,0,0,0,0,0,0,0,0,0,0
AR2A-UNITED STATES ARMY CYBER COMMAND,0,0,0,0,0,0,0,0,0,0,0,0,0,0,0,0,0,0,0,0,0,0,0,0,1,2,0,0,0,1,0,0,0,4,0,0,0,0,0,0,0,0,0,0,0,4,4
AR3A-U.S. ARMY CENTRAL,0,0,0,0,0,0,0,0,0,0,0,0,0,0,0,0,0,0,0,0,0,0,0,0,1,0,0,0,0,0,0,0,0,1,0,38,0,0,0,0,0,0,0,38,0,39,39
AR5A-U.S. ARMY NORTH,0,0,0,0,0,0,0,0,0,0,0,0,0,0,0,0,0,0,0,0,0,0,0,0,1,0,0,0,0,0,0,0,0,1,3,0,0,0,0,0,0,0,0,3,0,4,4
ARA1-US ARMY AFRICA/SOUTHERN EUROPEAN TASK FORCE (USAFRAF/SETAF),0,0,0,0,0,0,0,0,0,0,0,0,0,0,0,0,0,0,0,0,0,0,0,0,0,0,0,0,0,0,0,0,0,0,0,0,0,0,0,0,0,0,0,0,0,0,0
ARAA-U. S. ARMY ACCESSION COMMAND,0,1,0,0,0,0,0,0,0,0,1,0,0,0,0,0,0,0,0,0,0,0,1,0,5,0,0,0,0,2,0,0,0,7,7,0,20,0,0,0,1,0,0,28,0,35,36
ARAC-U.S. ARMY CONTRACTING AGENCY,0,0,0,0,0,0,0,0,0,0,0,0,0,0,0,0,0,0,0,0,0,0,0,0,0,0,0,0,0,0,0,0,0,0,0,0,0,0,0,0,0,0,0,0,0,0,0
ARAE-U.S. ARMY ACQUISITION SUPPORT CENTER,1,1,0,0,0,0,0,0,0,0,2,0,0,0,0,0,0,0,0,0,0,0,2,0,3,0,8,0,0,1,0,0,0,12,6,4,7,0,0,0,0,0,0,17,0,29,31
ARAP-U. S. MILITARY ENTRANCE PROCESSING COMMAND,0,1,0,0,0,0,0,0,0,0,1,0,0,0,0,0,0,0,0,0,0,0,1,1,27,0,0,0,0,2,0,0,0,30,2,0,0,0,0,0,0,0,0,2,0,32,33
ARAS-U.S. ARMY INTELLIGENCE AND SECURITY COMMAND,0,0,0,0,0,0,0,0,0,0,0,0,0,0,0,0,0,0,0,0,0,0,0,0,0,0,0,0,0,19,0,0,0,19,0,0,0,0,0,0,1,0,0,1,0,20,20
ARAT-U.S. ARMY TEST AND EVALUATION COMMAND,0,0,0,0,0,0,0,0,0,0,0,0,0,0,0,0,0,0,0,0,0,0,0,0,2,0,0,0,0,2,0,0,0,4,1,0,17,0,0,0,0,0,0,18,0,22,22
ARBA-U.S. ARMY INSTALLATION MANAGEMENT COMMAND,1,0,0,0,0,0,0,0,0,0,1,0,0,0,0,0,0,0,0,0,0,0,1,4,13,1,0,0,0,3,0,0,0,21,26,3,38,0,0,0,12,0,0,79,0,100,101
ARCB-U.S. ARMY CRIMINAL INVESTIGATION COMMAND,1,0,0,0,0,0,0,0,0,0,1,0,0,0,0,0,0,0,0,0,0,0,1,0,2,0,0,0,0,3,0,0,0,5,2,0,0,0,0,0,3,0,0,5,0,10,11
ARCE-U.S. ARMY CORPS OF ENGINEERS,17,6,0,0,0,0,0,0,0,0,23,0,0,0,0,0,0,0,0,0,0,0,23,6,30,1,53,0,0,6,0,0,0,96,119,13,378,0,0,0,2,0,0,512,0,608,631
ARCS-IMMEDIATE OFFICE OF THE CHIEF OF STAFF OF THE ARMY,1,0,0,0,0,0,0,0,0,0,1,0,0,0,0,0,0,0,0,0,0,0,1,0,0,0,0,0,0,0,0,0,0,0,0,0,0,0,0,0,5,0,0,5,0,5,6
ARE1-IMMEDIATE OFFICE OF THE COMMANDER-IN-CHIEF OF THE U.S. ARMY EUROPE AND SEVENTH ARMY,2,0,0,0,0,0,0,0,0,0,2,0,0,0,0,0,0,0,0,0,0,0,2,0,1,0,0,0,0,1,0,0,0,2,0,2,0,0,0,0,1,0,0,3,0,5,7
ARE2-21ST THEATER ARMY AREA COMMAND,0,0,0,0,0,0,0,0,0,0,0,0,0,0,0,0,0,0,0,0,0,0,0,0,2,0,0,0,0,0,0,0,0,2,0,0,0,0,0,0,0,0,0,0,0,2,2
ARE3-U.S. ARMY SOUTHERN EURPOEAN TASK FORCE,0,0,0,0,0,0,0,0,0,0,0,0,0,0,0,0,0,0,0,0,0,0,0,0,0,0,0,0,0,0,0,0,0,0,0,0,0,0,0,0,0,0,0,0,0,0,0
ARE5-U.S. ARMY V CORPS,0,0,0,0,0,0,0,0,0,0,0,0,0,0,0,0,0,0,0,0,0,0,0,0,0,0,0,0,0,0,0,0,0,0,0,0,0,0,0,0,0,0,0,0,0,0,0
AREN-SEVENTH ARMY TRAINING COMMAND,0,0,0,0,0,0,0,0,0,0,0,0,0,0,0,0,0,0,0,0,0,0,0,0,2,0,0,0,0,0,0,0,0,2,0,0,0,0,0,0,0,0,0,0,0,2,2
ARFC-U.S. ARMY FORCES COMMAND,2,0,0,0,0,0,0,0,0,0,2,0,0,0,0,0,0,0,0,0,0,0,2,1,5,0,0,0,0,4,0,0,0,10,15,0,1,0,0,0,0,0,0,16,0,26,28
ARG6-U.S. ARMY NETWORK ENTERPRISE TECHNOLOGY COMMAND/9TH ARMY SIGNAL COMMAND,3,1,0,0,0,0,0,0,0,0,4,0,0,0,0,0,0,0,0,0,0,0,4,2,13,0,0,0,0,1,0,0,0,16,1,1,1,0,0,0,4,0,0,7,0,23,27
ARGB-OFFICE OF THE CHIEF OF THE NATIONAL GUARD BUREAU,0,0,0,0,0,0,0,0,0,0,0,0,0,0,0,0,0,0,0,0,0,0,0,3,2,0,0,0,0,1,0,0,0,6,0,0,0,0,0,0,0,0,0,0,0,6,6
ARHR-U.S. ARMY RESERVE COMMAND,1,0,0,0,0,0,0,0,0,0,1,0,0,0,0,0,0,0,0,0,0,0,1,3,10,0,0,0,0,26,0,0,0,39,0,0,0,0,0,0,0,0,0,0,0,39,40
ARJ1-U.S. ARMY ELEMENT SHAPE,0,0,0,0,0,0,0,0,0,0,0,0,0,0,0,0,0,0,0,0,0,0,0,0,0,0,0,0,0,1,0,0,0,1,0,0,0,0,0,0,0,0,0,0,0,1,1
ARJA-JOINT ACTIVITIES,2,0,0,0,0,0,0,0,0,0,2,0,0,0,0,0,0,0,0,0,0,0,2,0,9,0,0,0,0,3,0,0,0,12,1,0,1,0,0,0,2,0,0,4,0,16,18
ARMA-U.S. MILITARY ACADEMY,0,0,0,0,0,0,0,0,0,0,0,0,0,0,0,0,0,0,0,0,0,0,0,1,0,0,0,0,0,0,0,0,0,1,0,1,6,0,0,0,0,0,0,7,0,8,8
ARMC-U.S. ARMY MEDICAL COMMAND,13,20,0,0,0,0,1,0,0,0,34,0,0,0,0,0,0,0,0,0,0,0,34,19,341,11,4,0,0,25,0,0,0,400,83,20,8,0,0,0,0,0,0,111,0,511,545
ARMW-U.S. ARMY MILITARY DISTRICT OF WASHINGTON,1,0,0,0,0,0,0,0,0,0,1,0,0,0,0,0,0,0,0,0,0,0,1,0,0,0,0,0,0,0,0,0,0,0,0,0,4,0,0,0,0,0,0,4,0,4,5
ARNG-ARMY NATIONAL GUARD UNITS (TITLE 32),0,0,0,0,0,0,0,0,0,0,0,0,0,0,0,0,0,0,0,0,0,0,0,0,7,0,0,0,0,115,0,0,0,122,0,15,1,0,0,0,237,0,0,253,1,376,376
"ARP1-U.S. ARMY, PACIFIC",2,1,0,0,0,0,0,0,0,0,3,0,0,0,0,0,0,0,0,0,0,0,3,0,7,0,0,0,0,0,0,0,0,7,0,0,0,0,0,0,3,0,0,3,0,10,13
ARP8-EIGHTH U.S. ARMY,0,0,0,0,0,0,0,0,0,0,0,0,0,0,0,0,0,0,0,0,0,0,0,0,0,0,0,0,0,0,0,0,0,0,0,0,0,0,0,0,0,0,0,0,0,0,0
ARSA-OFFICE OF THE SECRETARY OF THE ARMY,2,0,0,0,0,0,0,0,0,0,2,0,0,0,0,0,0,0,0,0,0,0,2,0,0,0,0,0,0,0,0,0,0,0,0,0,5,1,0,0,1,0,0,7,0,7,9
ARSB-FIELD OPERATING OFFICES OF THE OFFICE OF THE SECRETARY OF THE ARMY,0,0,0,0,0,0,0,0,0,0,0,0,0,0,0,0,0,0,0,0,0,0,0,0,4,1,0,0,0,0,0,0,0,5,2,17,9,0,0,0,19,0,0,47,0,52,52
ARSC-U. S. ARMY SPACE AND MISSILE DEFENSE COMMAND/U. S. ARMY FORCES STRATEGIC COMMAND,0,0,0,0,0,0,0,0,0,0,0,0,0,0,0,0,0,0,0,0,0,0,0,0,0,0,0,0,0,0,0,0,0,0,0,0,0,0,0,0,0,0,0,0,0,0,0
ARSE-FIELD OPERATING AGENCIES OF THE ARMY STAFF RESOURCED THROUGH OA-22,6,0,0,0,0,0,0,0,0,0,6,0,0,0,0,0,0,0,0,0,0,0,6,0,2,0,0,0,0,2,0,0,0,4,0,0,8,0,0,0,0,0,0,8,0,12,18
ARSF-FIELD OPERATING AGENCIES OF THE ARMY STAFF,0,0,0,0,0,0,0,0,0,0,0,0,0,0,0,0,0,0,0,0,0,0,0,0,0,0,0,0,0,0,0,0,0,0,0,0,0,0,0,0,0,0,0,0,0,0,0
"ARSJ-JOINT SERVICES AND ACTIVITIES SUPPORTED BY THE OFFICE, SECRETARY OF THE ARMY",0,0,0,0,0,0,0,0,0,0,0,0,0,0,0,0,0,0,0,0,0,0,0,1,5,0,0,0,0,1,0,0,0,7,0,20,4,0,0,0,1,0,0,25,0,32,32
ARSO-U.S. ARMY SOUTH,0,0,0,0,0,0,0,0,0,0,0,0,0,0,0,0,0,0,0,0,0,0,0,0,0,0,0,0,0,0,0,0,0,0,0,0,0,0,0,0,0,0,0,0,0,0,0
ARSP-U.S. SPECIAL OPERATIONS COMMAND (ARMY),0,0,0,0,0,0,0,0,0,0,0,0,0,0,0,0,0,0,0,0,0,0,0,0,1,0,0,0,0,0,0,0,0,1,3,0,0,0,0,0,0,0,0,3,0,4,4
ARTA-U.S. ARMY ACCESSIONS COMMAND,0,0,0,0,0,0,0,0,0,0,0,0,0,0,0,0,0,0,0,0,0,0,0,0,0,0,0,0,0,0,0,0,0,0,0,0,0,0,0,0,0,0,0,0,0,0,0
ARTC-U.S. ARMY TRAINING AND DOCTRINE COMMAND,0,0,0,0,0,0,0,0,0,0,0,0,0,0,0,0,0,0,0,0,0,0,0,1,12,0,0,0,0,7,0,0,0,20,5,7,5,0,0,0,31,0,0,48,0,68,68
ARTM-U.S. MILITARY ENTRANCE PROCESSING COMMAND,0,0,0,0,0,0,0,0,0,0,0,0,0,0,0,0,0,0,0,0,0,0,0,0,0,0,0,0,0,0,0,0,0,0,0,0,0,0,0,0,0,0,0,0,0,0,0
ARTW-U.S. ARMY WAR COLLEGE,1,0,0,0,0,0,0,0,0,0,1,0,0,0,0,0,0,0,0,0,0,0,1,0,0,0,0,0,0,0,0,0,0,0,0,0,22,0,0,0,0,0,0,22,0,22,23
ARX1-414TH SUPPORT BRIGADE,0,0,0,0,0,0,0,0,0,0,0,0,0,0,0,0,0,0,0,0,0,0,0,0,0,0,0,0,0,0,0,0,0,0,0,0,0,0,0,0,0,0,0,0,0,0,0
"ARX2-HEADQUARTERS, AMC",0,0,0,0,0,0,0,0,0,0,0,0,0,0,0,0,0,0,0,0,0,0,0,0,2,0,0,0,0,0,0,0,0,2,0,0,0,0,0,0,0,0,0,0,0,2,2
"ARX3-HEADQUARTERS, STAFF SUPPORT ACTIVITIES, AMC",0,0,0,0,0,0,0,0,0,0,0,0,0,0,0,0,0,0,0,0,0,0,0,0,0,0,0,0,0,0,0,0,0,0,0,0,0,0,0,0,0,0,0,0,0,0,0
ARX6-U.S. ARMY AVIATION AND MISSILE COMMAND,0,1,0,0,0,0,0,0,0,0,1,0,0,0,0,0,0,0,0,0,0,0,1,0,35,0,0,0,0,4,0,0,0,39,2,0,3,0,0,0,0,0,0,5,0,44,45
ARX7-U.S. ARMY TANK-AUTOMOTIVE AND ARMAMENT COMMAND (TACOM),0,1,0,0,0,0,0,0,0,0,1,0,0,0,0,0,0,0,0,0,0,0,1,1,12,0,0,0,0,3,0,0,0,16,6,102,5,0,0,0,0,0,0,113,0,129,130
ARX8-U.S. ARMY COMMUNICATIONS ELECTRONICS COMMAND,1,0,0,0,0,0,0,0,0,0,1,0,0,0,0,0,0,0,0,0,0,0,1,1,2,0,0,0,0,3,0,0,0,6,3,0,16,0,0,0,0,0,0,19,0,25,26
ARXB-U.S. ARMY CHEMICAL MATERIALS ACTIVITY,0,0,0,0,0,0,0,0,0,0,0,0,0,0,0,0,0,0,0,0,0,0,0,0,0,0,0,0,0,0,0,0,0,0,1,0,0,0,0,0,0,0,0,1,0,1,1
ARXC-U.S. ARMY SUSTAINMENT COMMAND,0,0,0,0,0,0,0,0,0,0,0,0,0,0,0,0,0,0,0,0,0,0,0,0,1,0,0,0,0,0,0,0,0,1,1,6,0,0,0,0,0,0,0,7,0,8,8
ARXD-U. S. ARMY CONTRACTING COMMAND,7,1,0,0,0,0,0,0,0,0,8,0,0,0,0,0,0,0,0,0,0,0,8,0,2,1,0,0,0,0,0,0,0,3,1,0,2,0,0,0,1,0,0,4,0,7,15
ARXK-MATERIEL ACQUISITION ACTIVITIES,0,0,0,0,0,0,0,0,0,0,0,0,0,0,0,0,0,0,0,0,0,0,0,0,0,0,0,0,0,0,0,0,0,0,0,0,0,0,0,0,0,0,0,0,0,0,0
ARXP-U.S. ARMY SECURITY ASSISTANCE COMMAND,2,0,0,0,0,0,0,0,0,0,2,0,0,0,0,0,0,0,0,0,0,0,2,1,0,0,0,0,0,0,0,0,0,1,0,1,0,0,0,0,0,0,0,1,0,2,4
ARXQ-U.S. ARMY JOINT MUNITIONS COMMAND,0,3,0,0,0,0,0,0,0,0,3,0,0,0,0,0,0,0,0,0,0,0,3,0,4,0,0,0,0,1,0,0,0,5,0,5,4,0,0,0,0,0,0,9,0,14,17
"ARXR-U.S. ARMY RESEARCH, DEVELOPMENT AND ENGINEERING COMMAND",1,0,0,0,0,0,0,0,0,0,1,0,0,0,0,0,0,0,0,0,0,0,1,1,4,0,6,0,0,0,0,0,0,11,1,0,21,0,0,0,1,0,0,23,0,34,35
ARXT-U.S. ARMY MILITARY SURFACE DEPLOYMENT AND DISTRIBUTION COMMAND,1,2,0,0,0,0,0,0,0,0,3,0,0,0,0,0,0,0,0,0,0,0,3,0,4,1,0,0,0,0,0,0,0,5,0,0,0,0,0,0,0,0,0,0,0,5,8
ARXX-MATERIEL READINESS ACTIVITIES,0,0,0,0,0,0,0,0,0,0,0,0,0,0,0,0,0,0,0,0,0,0,0,0,1,0,0,0,0,0,0,0,0,1,0,0,0,0,0,0,0,0,0,0,0,1,1
AU00-FEDERAL LABOR RELATIONS AUTHORITY,0,0,0,0,0,0,0,0,0,0,0,0,0,0,0,0,0,0,0,0,0,0,0,0,0,0,0,0,0,0,0,0,0,0,0,0,0,0,0,0,0,0,0,0,0,0,0
AW00-ARCTIC RESEARCH COMMISSION,0,0,0,0,0,0,0,0,0,0,0,0,0,0,0,0,0,0,0,0,0,0,0,0,0,0,0,0,0,0,0,0,0,0,0,0,0,0,0,0,0,0,0,0,0,0,0
BD00-MERIT SYSTEMS PROTECTION BOARD,0,0,0,0,0,0,0,0,0,0,0,0,0,0,0,0,0,0,0,0,0,0,0,0,0,0,0,0,0,0,0,0,0,0,0,0,0,1,0,1,0,0,0,2,0,2,2
BF00-DEFENSE NUCLEAR FACILITIES SAFETY BOARD,0,1,0,0,0,0,0,0,0,0,1,0,0,0,0,0,0,0,0,0,0,0,1,0,1,0,0,0,0,0,0,0,0,1,0,0,2,0,0,0,0,0,0,2,0,3,4
BG00-PENSION BENEFIT GUARANTY CORPORATION,0,2,0,0,0,0,0,0,0,0,2,0,0,0,0,0,0,0,0,0,0,0,2,1,1,1,0,0,0,0,0,0,0,3,0,0,9,0,0,0,0,0,0,9,0,12,14
BK00-JAMES MADISON MEMORIAL FELLOWSHIP FOUNDATION,0,0,0,0,0,0,0,0,0,0,0,0,0,0,0,0,0,0,0,0,0,0,0,0,0,0,0,0,0,1,0,0,0,1,0,0,0,0,0,0,0,0,0,0,0,1,1
BO00-OFFICE OF MANAGEMENT AND BUDGET,0,0,0,0,0,0,0,0,0,0,0,0,0,0,0,0,0,0,0,0,0,0,0,0,0,0,0,0,0,0,0,0,0,0,0,1,0,0,0,0,1,0,0,2,0,2,2
BT00-ARCHITECTURAL AND TRANSPORTATION BARRIERS COMPLIANCE BOARD,0,0,0,0,0,0,0,0,0,0,0,0,0,0,0,0,0,0,0,0,0,0,0,0,0,0,0,0,0,0,0,0,0,0,0,0,0,0,0,0,0,0,0,0,0,0,0
BW00-NUCLEAR WASTE TECHNICAL REVIEW BOARD,0,0,0,0,0,0,0,0,0,0,0,0,0,0,0,0,0,0,0,0,0,0,0,0,0,0,0,0,0,0,0,0,0,0,0,0,0,0,0,0,0,0,0,0,0,0,0
BZ00-CHRISTOPHER COLUMBUS FELLOWSHIP FOUNDATION,0,0,0,0,0,0,0,0,0,0,0,0,0,0,0,0,0,0,0,0,0,0,0,0,0,0,0,0,0,0,0,0,0,0,0,0,0,0,0,0,0,0,0,0,0,0,0
CC00-COMMISSION ON CIVIL RIGHTS,0,0,0,0,0,0,0,0,0,0,0,0,0,0,0,0,0,0,0,0,0,0,0,0,0,1,0,0,0,0,0,0,0,1,0,0,1,0,0,0,0,0,0,1,0,2,2
