CM54-NATIONAL OCEANIC AND ATMOSPHERIC ADMINISTRATION,13,4,0,0,0,0,0,0,0,17,0,0,0,0,0,0,0,0,0,0,17,5,31,16,4,0,2,0,1,0,59,5,1,39,0,0,0,0,0,45,0,104,121
CM55-INTERNATIONAL TRADE ADMINISTRATION,0,0,0,0,0,0,0,0,0,0,0,0,0,0,0,0,0,0,0,0,0,1,3,0,0,0,0,0,0,0,4,0,0,1,1,0,0,0,0,2,0,6,6
CM56-PATENT AND TRADEMARK OFFICE,5,0,0,0,0,0,0,0,0,5,0,0,0,0,0,0,0,0,0,0,5,1,19,3,133,0,0,1,0,0,157,0,0,0,0,0,0,0,0,0,0,157,162
CM57-NATIONAL INSTITUTE OF STANDARDS AND TECHNOLOGY,4,2,0,0,0,0,0,0,0,6,0,0,0,0,0,0,0,0,0,0,6,4,14,0,0,0,0,0,0,0,18,5,2,13,0,0,1,0,0,21,0,39,45
CM59-MINORITY BUSINESS DEVELOPMENT AGENCY,0,0,0,0,0,0,0,0,0,0,0,0,0,0,0,0,0,0,0,0,0,0,0,0,0,0,0,0,0,0,0,0,0,0,0,0,0,0,0,0,0,0,0
CM61-NATIONAL TELECOMMUNICATIONS AND INFORMATION ADMINISTRATION,1,0,0,0,0,0,0,0,0,1,0,0,0,0,0,0,0,0,0,0,1,0,2,1,0,0,0,0,0,0,3,0,1,10,0,0,0,0,0,11,0,14,15
CM62-NATIONAL TECHNICAL INFORMATION SERVICE,0,0,0,0,0,0,0,0,0,0,0,0,0,0,0,0,0,0,0,0,0,0,0,0,0,0,0,0,0,0,0,0,0,0,0,0,0,0,0,0,0,0,0
CM63-BUREAU OF THE CENSUS,0,1,0,0,0,0,0,0,0,1,0,0,0,0,0,0,0,0,0,0,1,1,59,60,0,0,0,0,0,0,120,28,72,46,0,0,0,0,0,146,0,266,267
CM64-OFFICE OF THE INSPECTOR GENERAL,0,0,0,0,0,0,0,0,0,0,0,0,0,0,0,0,0,0,0,0,0,0,0,0,0,0,0,0,0,0,0,0,0,0,0,0,0,0,0,0,0,0,0
CM65-ECONOMICS AND STATISTICS ADMINISTRATION,0,0,0,0,0,0,0,0,0,0,0,0,0,0,0,0,0,0,0,0,0,0,0,0,0,0,0,0,0,0,0,0,0,1,0,0,0,0,0,1,0,1,1
CM67-BUREAU OF INDUSTRY AND SECURITY,0,0,0,0,0,0,0,0,0,0,0,0,0,0,0,0,0,0,0,0,0,1,2,0,1,0,0,0,0,0,4,0,0,2,0,1,0,0,0,3,0,7,7
CT00-COMMODITY FUTURES TRADING COMMISSION,1,0,0,0,0,0,0,0,0,1,0,0,0,0,0,0,0,0,0,0,1,0,0,3,0,0,0,0,0,0,3,0,0,0,0,0,0,0,0,0,0,3,4
CU00-NATIONAL CREDIT UNION ADMINISTRATION,0,0,0,0,0,0,0,0,0,0,0,0,0,0,0,0,0,0,0,0,0,1,1,0,5,0,0,0,0,0,7,0,0,1,0,0,0,0,0,1,0,8,8
CX00-NATIONAL COMMISSION ON LIBRARIES AND INFORMATION SCIENCE,0,0,0,0,0,0,0,0,0,0,0,0,0,0,0,0,0,0,0,0,0,0,0,0,0,0,0,0,0,0,0,0,0,0,0,0,0,0,0,0,0,0,0
DB00-PUBLIC INTEREST DECLASSIFICATION BOARD,0,0,0,0,0,0,0,0,0,0,0,0,0,0,0,0,0,0,0,0,0,0,0,0,0,0,0,0,0,0,0,0,0,0,0,0,0,0,0,0,0,0,0
DD01-OFFICE OF THE SECRETARY OF DEFENSE,2,0,0,0,0,0,0,0,0,2,0,0,0,0,0,0,0,0,0,0,2,0,0,0,2,0,2,0,3,0,7,0,2,0,3,0,4,0,0,9,0,16,18
DD02-ORGANIZATION OF THE JOINT CHIEFS OF STAFF,1,0,0,0,0,0,0,0,0,1,0,0,0,0,0,0,0,0,0,0,1,1,0,0,0,0,0,0,0,0,1,0,1,0,0,0,0,0,0,1,0,2,3
DD04-DEFENSE INFORMATION SYSTEMS AGENCY,11,1,0,0,0,0,0,0,0,12,0,0,0,0,0,0,0,0,0,0,12,1,12,1,26,0,0,0,0,0,40,3,0,55,0,0,1,0,0,59,0,99,111
DD06-DEFENSE SECURITY COOPERATION AGENCY,2,0,0,0,0,1,0,0,0,3,0,0,0,0,0,0,0,0,0,0,3,0,0,0,0,0,0,1,0,0,1,0,3,4,0,0,0,0,0,7,0,8,11
DD07-DEFENSE LOGISTICS AGENCY,13,0,0,0,0,0,1,0,0,14,0,0,0,0,0,0,0,0,0,0,14,5,51,0,3,0,12,0,0,0,71,6,31,33,0,0,5,0,0,75,0,146,160
DD08-U.S. COURT OF APPEALS FOR THE ARMED FORCES,0,0,0,0,0,0,0,0,0,0,0,0,0,0,0,0,0,0,0,0,0,0,0,0,0,0,0,0,0,0,0,0,0,6,0,0,0,0,0,6,0,6,6
DD09-AMERICAN FORCES INFORMATION SERVICE,0,0,0,0,0,0,0,0,0,0,0,0,0,0,0,0,0,0,0,0,0,0,0,0,0,0,0,0,0,0,0,0,0,0,0,0,0,0,0,0,0,0,0
DD10-DEFENSE CONTRACT AUDIT AGENCY,2,1,0,0,0,0,0,0,0,3,0,0,0,0,0,0,0,0,0,0,3,1,5,0,36,0,0,0,0,0,42,1,0,14,0,0,0,0,0,15,0,57,60
DD12-DEFENSE SECURITY SERVICE,1,0,0,0,0,0,0,0,0,1,0,0,0,0,0,0,0,0,0,0,1,0,0,0,0,0,0,0,0,0,0,0,1,0,0,0,0,0,0,1,0,1,2
DD13-DEFENSE ADVANCED RESEARCH PROJECTS AGENCY,1,0,0,0,0,0,0,0,0,1,0,0,0,0,0,0,0,0,0,0,1,0,0,0,0,0,0,0,0,0,0,0,0,0,0,0,2,0,0,2,0,2,3
DD16-DEPARTMENT OF DEFENSE EDUCATION ACTIVITY,5,0,0,0,0,0,0,0,0,5,0,0,0,0,0,0,0,0,0,0,5,1,2,0,0,0,2,0,0,0,5,3,115,4,0,0,29,0,0,151,0,156,161
DD21-WASHINGTON HEADQUARTERS SERVICES,6,0,0,0,0,0,0,0,0,6,0,0,0,0,0,0,0,0,0,0,6,5,1,0,0,0,0,0,0,0,6,0,1,11,0,0,1,0,0,13,0,19,25
DD23-OFFICE OF ECONOMIC ADJUSTMENT,0,0,0,0,0,0,0,0,0,0,0,0,0,0,0,0,0,0,0,0,0,0,0,0,0,0,0,0,0,0,0,0,0,0,0,0,0,0,0,0,0,0,0
DD25-DEFENSE LEGAL SERVICES AGENCY,0,0,0,0,0,0,0,0,0,0,0,0,0,0,0,0,0,0,0,0,0,0,0,1,0,0,0,0,0,0,1,0,0,12,0,0,0,0,0,12,0,13,13
DD26-OFFICE OF THE INSPECTOR GENERAL,0,0,0,0,0,0,0,0,0,0,0,0,0,0,0,0,0,0,0,0,0,2,0,0,6,0,0,0,0,0,8,1,0,21,0,0,1,0,0,23,0,31,31
DD27-MISSILE DEFENSE AGENCY,9,0,0,0,0,0,0,0,0,9,0,0,0,0,0,0,0,0,0,0,9,4,0,0,0,0,0,0,0,0,4,0,0,2,0,0,0,0,0,2,0,6,15
DD29-DEFENSE TECHNOLOGY SECURITY ADMINISTRATION,0,0,0,0,0,0,0,0,0,0,0,0,0,0,0,0,0,0,0,0,0,0,0,0,0,0,0,0,0,0,0,0,0,0,0,0,0,0,0,0,0,0,0
DD34-DEFENSE COMMISSARY AGENCY,6,1,0,0,0,0,0,0,0,7,0,0,0,0,0,0,0,0,0,0,7,5,92,1,1,0,2,0,0,0,101,34,76,165,0,0,3,0,0,278,0,379,386
DD35-DEFENSE FINANCE AND ACCOUNTING SERVICE,1,0,0,0,0,0,0,0,0,1,0,0,0,0,0,0,0,0,0,0,1,6,74,0,19,0,5,0,0,0,104,17,0,72,0,0,0,0,0,89,0,193,194
DD48-DEFENSE HUMAN RESOURCES ACTIVITY,3,0,0,0,0,0,0,0,0,3,0,0,0,0,0,0,0,0,0,0,3,1,0,0,2,0,0,0,0,0,3,0,0,0,0,0,0,0,0,0,0,3,6
DD58-DEFENSE PRISONER OF WAR/MISSING PERSONNEL OFFICE,0,0,0,0,0,0,0,0,0,0,0,0,0,0,0,0,0,0,0,0,0,0,0,0,0,0,0,0,0,0,0,0,0,0,0,0,0,0,0,0,0,0,0
DD60-TRICARE MANAGEMENT ACTIVITY,0,0,0,0,0,0,0,0,0,0,0,0,0,0,0,0,0,0,0,0,0,1,0,0,0,0,0,0,0,0,1,0,0,0,0,0,5,0,0,5,0,6,6
DD61-DEFENSE THREAT REDUCTION AGENCY,6,1,0,0,0,0,0,0,0,7,0,0,0,0,0,0,0,0,0,0,7,4,0,3,1,0,0,0,0,0,8,0,4,2,0,0,0,0,0,6,0,14,21
DD63-DEFENSE CONTRACT MANAGEMENT AGENCY,24,1,0,0,0,0,1,0,0,26,0,0,0,0,0,0,0,0,0,0,26,5,8,0,3,0,5,0,0,0,21,3,17,0,0,0,2,0,0,22,0,43,69
DD65-PENTAGON FORCE PROTECTION AGENCY,0,0,0,0,0,0,0,0,0,0,0,0,0,0,0,0,0,0,0,0,0,2,0,0,0,0,0,0,0,0,2,0,1,0,0,0,0,0,0,1,0,3,3
DD68-DEPARTMENT OF DEFENSE TEST RESOURCE MANAGEMENT CENTER,0,0,0,0,0,0,0,0,0,0,0,0,0,0,0,0,0,0,0,0,0,0,0,0,0,0,0,0,0,0,0,0,0,0,0,0,0,0,0,0,0,0,0
DD69-NATIONAL DEFENSE UNIVERSITY,2,0,0,0,0,0,0,0,0,2,0,0,0,0,0,0,0,0,0,0,2,0,1,0,0,0,0,0,0,0,1,0,0,14,0,0,3,0,0,17,0,18,20
DD74-DEFENSE TECHNICAL INFORMATION CENTER,2,0,0,0,0,0,0,0,0,2,0,0,0,0,0,0,0,0,0,0,2,0,0,0,0,0,0,0,0,0,0,0,0,0,0,0,0,0,0,0,0,0,2
DD77-BUSINESS TRANSFORMATION AGENCY,3,0,0,0,0,0,0,0,0,3,0,0,0,0,0,0,0,0,0,0,3,0,0,0,0,0,0,0,0,0,0,0,3,0,0,0,1,0,0,4,0,4,7
DF00-OFFICE OF THE FEDERAL COORDINATOR FOR ALASKA NATURAL GAS TRANSPORTATION PROJECTS,0,0,0,0,0,0,0,0,0,0,0,0,0,0,0,0,0,0,0,0,0,0,0,0,0,0,0,0,0,0,0,0,0,0,0,0,0,0,0,0,0,0,0
"DJ01-OFFICES, BOARDS AND DIVISIONS",6,0,0,0,0,0,0,0,0,6,0,0,0,0,0,0,0,0,0,0,6,0,7,0,7,0,0,0,1,0,15,10,14,80,0,0,4,0,0,108,0,123,129
DJ02-FEDERAL BUREAU OF INVESTIGATION,0,0,0,0,0,0,0,0,0,0,0,0,0,0,0,0,0,0,0,0,0,0,0,0,1,0,39,0,0,0,40,0,0,0,0,0,1,0,0,1,0,41,41
DJ03-BUREAU OF PRISONS/FEDERAL PRISON SYSTEM,2,1,0,0,0,0,0,0,0,3,0,0,0,0,0,0,0,0,0,0,3,9,165,0,2,0,4,0,0,0,180,0,0,14,0,0,0,0,0,14,0,194,197
DJ06-DRUG ENFORCEMENT ADMINISTRATION,1,1,0,0,0,0,0,0,0,2,0,0,0,0,0,0,0,0,0,0,2,2,1,7,1,0,1,0,0,0,12,0,1,0,0,0,0,0,0,1,0,13,15
DJ07-OFFICE OF JUSTICE PROGRAMS,0,2,0,0,0,0,0,0,0,2,0,0,0,0,0,0,0,0,0,0,2,0,4,0,0,0,0,0,0,0,4,0,0,10,0,0,0,0,0,10,0,14,16
DJ08-U.S. MARSHALS SERVICE,5,0,0,0,0,0,0,0,0,5,0,0,0,0,0,0,0,0,0,0,5,0,6,0,4,0,0,0,0,0,10,0,0,0,0,1,0,0,0,1,0,11,16
DJ09-EXECUTIVE OFFICE FOR U.S. ATTORNEYS AND THE OFFICES OF THE U.S. ATTORNEYS,4,0,0,0,0,0,0,0,0,4,0,0,0,0,0,0,0,0,0,0,4,3,24,0,3,0,1,0,0,0,31,0,0,36,0,0,28,0,0,64,0,95,99
DJ10-OFFICE OF THE INSPECTOR GENERAL,1,0,0,0,0,0,0,0,0,1,0,0,0,0,0,0,0,0,0,0,1,0,0,0,1,0,0,0,0,0,1,0,0,4,0,0,0,0,0,4,0,5,6
DJ11-U.S. TRUSTEE PROGRAM,2,0,0,0,0,0,0,0,0,2,0,0,0,0,0,0,0,0,0,0,2,0,1,0,2,0,0,0,0,0,3,0,4,0,0,0,0,0,0,4,0,7,9
DJ12-EXECUTIVE OFFICE FOR IMMIGRATION REVIEW,1,0,0,0,0,0,0,0,0,1,0,0,0,0,0,0,0,0,0,0,1,0,3,0,0,0,0,0,0,0,3,0,1,11,0,0,0,0,0,12,0,15,16
DJ14-COMMUNITY RELATIONS SERVICE,0,0,0,0,0,0,0,0,0,0,0,0,0,0,0,0,0,0,0,0,0,0,0,0,0,0,0,0,0,0,0,0,0,0,0,0,0,0,0,0,0,0,0
"DJ15-BUREAU OF ALCOHOL, TOBACCO, FIREARMS, AND EXPLOSIVES",3,1,0,0,0,0,0,0,0,4,0,0,0,0,0,0,0,0,0,0,4,3,9,0,0,0,0,0,0,0,12,0,0,0,0,0,0,0,0,0,0,12,16
DL**-UNSPECIFIED,0,0,0,0,0,0,0,0,0,0,0,0,0,0,0,0,0,0,0,0,0,0,0,0,0,0,0,0,0,0,0,0,0,0,0,0,0,0,0,0,0,0,0
DLAA-OFFICE OF THE SECRETARY OF LABOR,0,0,0,0,0,0,0,0,0,0,0,0,0,0,0,0,0,0,0,0,0,0,1,0,0,0,0,0,0,0,1,1,0,16,1,0,0,0,0,18,0,19,19
DLAM-OFFICE OF THE ASSISTANT SECRETARY FOR ADMINISTRATION AND MANAGEMENT,5,0,0,0,0,0,0,0,0,5,0,0,0,0,0,0,0,0,0,0,5,0,2,0,0,0,0,0,0,0,2,0,2,11,0,0,0,0,0,13,0,15,20
DLBL-BUREAU OF INTERNATIONAL LABOR AFFAIRS,0,0,0,0,0,0,0,0,0,0,0,0,0,0,0,0,0,0,0,0,0,0,0,0,0,0,0,0,1,0,1,0,0,3,0,0,0,0,0,3,0,4,4
DLCA-OFFICE OF CONGRESSIONAL AND INTERGOVERNMENTAL AFFAIRS,0,0,0,0,0,0,0,0,0,0,0,0,0,0,0,0,0,0,0,0,0,0,0,0,0,0,0,0,0,0,0,0,0,1,1,0,0,0,0,2,0,2,2
DLCF-OFFICE OF THE CHIEF FINANCIAL OFFICER,0,0,0,0,0,0,0,0,0,0,0,0,0,0,0,0,0,0,0,0,0,0,0,0,0,0,0,0,0,0,0,0,0,4,0,0,0,0,0,4,0,4,4
DLEB-EMPLOYEE BENEFITS SECURITY ADMINISTRATION,0,0,0,0,0,0,0,0,0,0,0,0,0,0,0,0,0,0,0,0,0,0,0,0,0,0,0,0,0,0,0,0,0,0,0,0,0,0,0,0,0,0,0
DLEH-OFFICE OF DISABILITY EMPLOYMENT POLICY,0,0,0,0,0,0,0,0,0,0,0,0,0,0,0,0,0,0,0,0,0,0,0,0,0,0,0,0,0,0,0,0,1,2,0,0,0,0,0,3,0,3,3
DLES-EMPLOYMENT STANDARDS ADMINISTRATION,3,1,0,0,0,0,0,0,0,4,0,0,0,0,0,0,0,0,0,0,4,4,2,0,4,0,0,0,0,0,10,8,0,7,0,0,0,0,0,15,0,25,29
DLET-EMPLOYMENT AND TRAINING ADMINISTRATION,0,0,0,0,0,0,0,0,0,0,0,0,0,0,0,0,0,0,0,0,0,1,2,1,1,0,0,0,0,0,5,0,1,7,0,0,0,0,0,8,0,13,13
DLIG-OFFICE OF THE INSPECTOR GENERAL,1,0,0,0,0,0,0,0,0,1,0,0,0,0,0,0,0,0,0,0,1,0,0,0,0,0,0,0,0,0,0,0,0,1,0,0,0,0,0,1,0,1,2
DLLS-BUREAU OF LABOR STATISTICS,0,0,0,0,0,0,0,0,0,0,0,0,0,0,0,0,0,0,0,0,0,0,6,0,0,0,0,0,0,0,6,0,0,1,0,0,0,0,0,1,0,7,7
DLMS-MINE SAFETY AND HEALTH ADMINISTRATION,0,0,0,0,0,0,0,0,0,0,0,0,0,0,0,0,0,0,0,0,0,1,2,0,25,0,0,0,0,0,28,0,0,25,0,0,0,0,0,25,0,53,53
DLPA-OFFICE OF PUBLIC AFFAIRS,0,0,0,0,0,0,0,0,0,0,0,0,0,0,0,0,0,0,0,0,0,0,0,0,0,0,0,0,0,0,0,0,0,3,0,0,0,0,0,3,0,3,3
DLPE-OFFICE OF THE ASSISTANT SECRETARY FOR POLICY,0,0,0,0,0,0,0,0,0,0,0,0,0,0,0,0,0,0,0,0,0,0,0,0,0,0,0,0,0,0,0,0,0,1,0,0,0,0,0,1,0,1,1
DLPW-EMPLOYEE BENEFITS SECURITY ADMINISTRATION,0,0,0,0,0,0,0,0,0,0,0,0,0,0,0,0,0,0,0,0,0,0,0,0,11,0,0,0,0,0,11,0,0,6,0,0,5,0,0,11,0,22,22
DLSH-OCCUPATIONAL SAFETY AND HEALTH ADMINISTRATION,1,0,0,0,0,0,0,0,0,1,0,0,0,0,0,0,0,0,0,0,1,0,10,0,0,0,1,0,0,0,11,0,0,15,0,0,0,0,0,15,0,26,27
DLSL-OFFICE OF THE SOLICITOR,0,0,0,0,0,0,0,0,0,0,0,0,0,0,0,0,0,0,0,0,0,0,0,1,0,0,0,0,0,0,1,0,0,0,0,0,0,0,0,0,0,1,1
DLVE-VETERANS EMPLOYMENT AND TRAINING SERVICES,0,0,0,0,0,0,0,0,0,0,0,0,0,0,0,0,0,0,0,0,0,0,1,0,0,0,0,0,0,0,1,0,0,3,0,0,0,0,0,3,0,4,4
DLWB-WOMEN'S BUREAU,0,0,0,0,0,0,0,0,0,0,0,0,0,0,0,0,0,0,0,0,0,0,0,0,0,0,0,0,0,0,0,0,0,1,0,0,0,0,0,1,0,1,1
DN00-DEPARTMENT OF ENERGY,16,0,0,0,0,0,0,0,0,16,0,0,0,0,0,0,0,0,0,0,16,9,26,3,6,0,1,0,0,0,45,1,0,42,3,0,15,0,0,61,0,106,122
DQ00-DENALI COMMISSION,0,0,0,0,0,0,0,0,0,0,0,0,0,0,0,0,0,0,0,0,0,0,0,0,0,0,0,0,0,0,0,0,0,0,0,0,6,0,0,6,0,6,6
EB00-EXPORT-IMPORT BANK OF THE UNITED STATES,0,1,0,0,0,0,0,0,0,1,0,0,0,0,0,0,0,0,0,0,1,0,0,0,0,0,0,0,0,0,0,0,0,0,0,0,0,0,0,0,0,0,1
EC00-OFFICE OF ADMINISTRATION,0,0,0,0,0,0,0,0,0,0,0,0,0,0,0,0,0,0,0,0,0,0,0,2,0,0,0,0,0,0,2,0,0,4,0,0,1,0,0,5,0,7,7
EDEA-IMMEDIATE OFFICE OF THE SECRETARY OF EDUCATION,0,0,0,0,0,0,0,0,0,0,0,0,0,0,0,0,0,0,0,0,0,0,0,0,0,0,0,0,0,0,0,0,0,3,0,0,0,0,0,3,0,3,3
EDEB-OFFICE OF THE DUTY SECRETARY OF EDUCATION,0,0,0,0,0,0,0,0,0,0,0,0,0,0,0,0,0,0,0,0,0,0,0,0,0,0,0,0,0,0,0,0,0,1,0,0,0,0,0,1,0,1,1
EDEC-OFFICE FOR CIVIL RIGHTS,0,0,0,0,0,0,0,0,0,0,0,0,0,0,0,0,0,0,0,0,0,0,0,1,0,0,0,0,0,0,1,0,0,3,0,0,0,0,0,3,0,4,4
"EDED-OFFICE OF PLANNING, EVALUATION AND POLICY DEVELOPMENT",0,0,0,0,0,0,0,0,0,0,0,0,0,0,0,0,0,0,0,0,0,0,0,0,1,0,0,0,0,0,1,0,0,1,1,0,0,0,0,2,0,3,3
EDEE-OFFICE OF THE UNDER SECRETARY,0,0,0,0,0,0,0,0,0,0,0,0,0,0,0,0,0,0,0,0,0,0,0,0,0,0,0,0,0,0,0,0,0,2,0,0,0,0,0,2,0,2,2
EDEF-OFFICE OF INSPECTOR GENERAL,0,0,0,0,0,0,0,0,0,0,0,0,0,0,0,0,0,0,0,0,0,0,0,0,0,0,0,0,0,0,0,0,0,0,0,0,0,0,0,0,0,0,0
EDEG-OFFICE OF THE GENERAL COUNSEL,0,0,0,0,0,0,0,0,0,0,0,0,0,0,0,0,0,0,0,0,0,0,0,0,0,0,0,0,0,0,0,0,0,1,0,0,0,0,0,1,0,1,1
EDEH-OFFICE OF SPECIAL EDUCATION AND REHABILITATIVE SERVICES,0,0,0,0,0,0,0,0,0,0,0,0,0,0,0,0,0,0,0,0,0,0,0,0,0,0,0,0,0,0,0,0,0,7,0,0,0,0,0,7,0,7,7
EDEI-OFFICE OF THE CHIEF INFORMATION OFFICER,1,0,0,0,0,0,0,0,0,1,0,0,0,0,0,0,0,0,0,0,1,0,0,0,0,0,0,0,0,0,0,0,0,0,0,0,0,0,0,0,0,0,1
EDEJ-OFFICE OF LEGISLATION AND CONGRESSIONAL AFFAIRS,0,0,0,0,0,0,0,0,0,0,0,0,0,0,0,0,0,0,0,0,0,0,0,0,0,0,0,0,0,0,0,0,0,0,0,0,0,0,0,0,0,0,0
EDEK-OFFICE OF INTERGOVERNMENTAL AND INTERAGENCY AFFAIRS,0,0,0,0,0,0,0,0,0,0,0,0,0,0,0,0,0,0,0,0,0,0,0,0,0,0,0,0,0,0,0,0,0,0,0,0,0,0,0,0,0,0,0
EDEL-OFFICE OF THE CHIEF FINANCIAL OFFICER,0,0,0,0,0,0,0,0,0,0,0,0,0,0,0,0,0,0,0,0,0,0,0,0,0,0,0,0,0,0,0,0,0,6,0,0,0,0,0,6,0,6,6
EDEM-OFFICE OF MANAGEMENT,1,0,0,0,0,0,0,0,0,1,0,0,0,0,0,0,0,0,0,0,1,0,0,0,0,0,0,0,0,0,0,0,0,0,0,0,0,0,0,0,0,0,1
EDEN-FEDERAL STUDENT AID,0,1,0,0,0,0,0,0,0,1,0,0,0,0,0,0,0,0,0,0,1,0,1,0,0,0,1,0,0,0,2,1,0,0,0,0,0,0,0,1,0,3,4
EDEO-OFFICE OF COMMUNICATIONS AND OUTREACH,0,0,0,0,0,0,0,0,0,0,0,0,0,0,0,0,0,0,0,0,0,0,1,0,0,0,0,0,0,0,1,0,0,0,1,0,0,0,0,1,0,2,2
EDEP-OFFICE OF POSTSECONDARY EDUCATION,0,0,0,0,0,0,0,1,0,1,0,0,0,0,0,0,0,0,0,0,1,0,0,0,0,0,0,0,0,0,0,0,0,0,0,0,0,0,0,0,0,0,1
EDEQ-OFFICE OF SAFE AND DRUG-FREE SCHOOLS,0,0,0,0,0,0,0,0,0,0,0,0,0,0,0,0,0,0,0,0,0,0,1,0,0,0,0,0,0,0,1,0,0,1,0,0,0,0,0,1,0,2,2
EDER-INSTITUTE OF EDUCATION SCIENCES,0,0,0,0,0,0,0,0,0,0,0,0,0,0,0,0,0,0,0,0,0,0,0,0,0,0,0,0,0,0,0,0,0,1,0,0,2,0,0,3,0,3,3
EDES-OFFICE OF ELEMENTARY AND SECONDARY EDUCATION,0,0,0,0,0,0,0,0,0,0,0,0,0,0,0,0,0,0,0,0,0,0,0,0,0,0,0,0,0,0,0,0,0,0,0,0,0,0,0,0,0,0,0
EDET-OFFICE OF ENGLISH LANGUAGE ACQUISITION,0,0,0,0,0,0,0,0,0,0,0,0,0,0,0,0,0,0,0,0,0,0,0,0,0,0,0,0,0,0,0,0,0,0,0,0,0,0,0,0,0,0,0
EDEU-OFFICE OF INNOVATION AND IMPROVEMENT,0,0,0,0,0,0,0,0,0,0,0,0,0,0,0,0,0,0,0,0,0,0,0,0,0,0,0,0,0,0,0,0,0,1,0,0,0,0,0,1,0,1,1
EDEV-OFFICE OF VOCATIONAL AND ADULT EDUCATION,0,0,0,0,0,0,0,0,0,0,0,0,0,0,0,0,0,0,0,0,0,0,0,0,0,0,0,0,0,0,0,0,0,0,0,0,0,0,0,0,0,0,0
EDEX-NATIONAL INSTITUTE FOR LITERACY,0,0,0,0,0,0,0,0,0,0,0,0,0,0,0,0,0,0,0,0,0,0,0,0,0,0,0,0,0,0,0,0,0,0,0,0,0,0,0,0,0,0,0
EDEY-ADVISORY COUNCILS AND COMMITTEES,0,0,0,0,0,0,0,0,0,0,0,0,0,0,0,0,0,0,0,0,0,0,0,0,0,0,0,0,0,0,0,0,0,0,0,0,1,0,0,1,0,1,1
EDEZ-NATIONAL ASSESSMENT GOVERNING BOARD,0,0,0,0,0,0,0,0,0,0,0,0,0,0,0,0,0,0,0,0,0,0,0,0,0,0,0,0,0,0,0,0,0,0,0,0,0,0,0,0,0,0,0
EE00-EQUAL EMPLOYMENT OPPORTUNITY COMMISSION,2,1,0,0,0,0,0,0,0,3,0,0,0,0,0,0,0,0,0,0,3,2,8,3,0,0,2,0,0,0,15,0,0,0,0,0,0,0,0,0,0,15,18
EO00-MORRIS K. UDALL SCHOLARSHIP AND EXCELLENCE IN NATIONAL ENVIRONMENTAL POLICY FOUNDATION,0,0,0,0,0,0,0,0,0,0,0,0,0,0,0,0,0,0,0,0,0,0,0,0,0,0,0,0,0,0,0,0,0,0,0,0,2,0,0,2,0,2,2
EP00-ENVIRONMENTAL PROTECTION AGENCY,10,1,0,0,0,0,0,0,0,11,0,0,0,0,0,0,0,0,0,0,11,0,11,0,8,0,1,0,0,0,20,0,0,207,0,0,10,0,0,217,4,241,252
EQ00-COUNCIL ON ENVIRONMENTAL QUALITY/OFFICE OF ENVIRONMENTAL QUALITY,0,1,0,0,0,0,0,0,0,1,0,0,0,0,0,0,0,0,0,0,1,0,0,0,0,0,0,0,0,0,0,0,0,1,0,0,0,0,0,1,0,1,2
EW00-TRADE AND DEVELOPMENT AGENCY,0,0,0,0,0,0,0,0,0,0,0,0,0,0,0,0,0,0,0,0,0,0,0,0,0,0,0,0,0,0,0,0,0,0,0,0,0,0,0,0,0,0,0
FC00-FEDERAL COMMUNICATIONS COMMISSION,1,0,0,0,0,0,0,0,0,1,0,0,0,0,0,0,0,0,0,0,1,0,1,2,0,0,0,0,0,0,3,0,0,10,0,0,2,0,0,12,0,15,16
FD00-FEDERAL DEPOSIT INSURANCE CORPORATION,6,1,0,0,0,0,0,0,0,7,0,0,0,0,0,0,0,0,0,0,7,0,4,0,34,0,0,0,0,0,38,0,2,48,0,0,0,0,0,50,0,88,95
FI00-FEDERAL FINANCIAL INSTITUTIONS EXAMINATION COUNCIL,0,0,0,0,0,0,0,0,0,0,0,0,0,0,0,0,0,0,0,0,0,0,0,0,0,0,0,0,0,0,0,0,0,0,0,0,0,0,0,0,0,0,0
FJ00-CHEMICAL SAFETY AND HAZARD INVESTIGATION BOARD,0,0,0,0,0,0,0,0,0,0,0,0,0,0,0,0,0,0,0,0,0,0,0,0,0,0,0,0,0,0,0,0,0,0,0,0,0,0,0,0,0,0,0
FK00-FARM CREDIT SYSTEM INSURANCE CORPORATION,0,0,0,0,0,0,0,0,0,0,0,0,0,0,0,0,0,0,0,0,0,0,0,0,0,0,0,0,0,0,0,0,0,0,0,0,0,0,0,0,0,0,0
FL00-FARM CREDIT ADMINISTRATION,1,0,0,0,0,0,0,0,0,1,0,0,0,0,0,0,0,0,0,0,1,0,0,0,0,0,0,0,0,0,0,0,0,0,0,0,0,0,0,0,0,0,1
FM00-FEDERAL MEDIATION AND CONCILIATION SERVICE,0,0,0,0,0,0,0,0,0,0,0,0,0,0,0,0,0,0,0,0,0,0,0,0,0,0,0,0,0,0,0,0,0,0,0,0,0,0,0,0,0,0,0
FQ01-OFFICE OF THE DIRECTOR,0,0,0,0,0,0,0,0,0,0,0,0,0,0,0,0,0,0,0,0,0,0,4,0,0,0,0,0,0,0,4,0,0,1,0,0,0,0,0,1,0,5,5
FQ02-PRETRIAL SERVICES AGENCY,1,0,0,0,0,0,0,0,0,1,0,0,0,0,0,0,0,0,0,0,1,0,0,0,0,0,0,0,0,0,0,0,0,0,0,0,0,0,0,0,0,0,1
FT00-FEDERAL TRADE COMMISSION,3,1,0,0,0,0,0,0,0,4,0,0,0,0,0,0,0,0,0,0,4,0,1,1,0,0,0,0,0,0,2,4,1,33,0,0,1,0,0,39,0,41,45
FW00-OFFICE OF SPECIAL COUNSEL,0,0,0,0,0,0,0,0,0,0,0,0,0,0,0,0,0,0,0,0,0,0,0,0,0,0,0,0,0,0,0,0,0,0,0,0,1,0,0,1,0,1,1
FY00-FEDERAL HOUSING FINANCE BOARD,0,0,0,0,0,0,0,0,0,0,0,0,0,0,0,0,0,0,0,0,0,0,0,0,0,0,0,0,0,0,0,0,0,1,0,0,0,0,0,1,0,1,1
GB00-OVERSEAS PRIVATE INVESTMENT CORPORATION,0,1,0,0,0,0,0,0,0,1,0,0,0,0,0,0,0,0,0,0,1,0,0,0,0,0,0,0,0,0,0,0,0,12,0,0,0,0,0,12,0,12,13
GE00-BARRY GOLDWATER SCHOLARSHIP AND EXCELLENCE IN EDUCATION FOUNDATION,0,0,0,0,0,0,0,0,0,0,0,0,0,0,0,0,0,0,0,0,0,0,0,0,0,0,0,0,0,0,0,0,0,0,0,0,0,0,0,0,0,0,0
GG00-OFFICE OF GOVERNMENT ETHICS,0,0,0,0,0,0,0,0,0,0,0,0,0,0,0,0,0,0,0,0,0,0,0,0,0,0,0,0,0,0,0,0,0,0,0,0,0,0,0,0,0,0,0
GJ00-PRESIDIO TRUST,0,0,0,0,0,0,0,0,0,0,0,0,0,0,0,0,0,0,0,0,0,0,0,0,0,0,3,0,0,0,3,0,0,0,0,0,3,0,0,3,0,6,6
GM00-VALLES CALDERA TRUST,0,0,0,0,0,0,0,0,0,0,0,0,0,0,0,0,0,0,0,0,0,0,0,0,0,0,0,0,0,0,0,0,0,0,0,0,12,0,0,12,0,12,12
GO00-VIETNAM EDUCATION FOUNDATION,0,0,0,0,0,0,0,0,0,0,0,0,0,0,0,0,0,0,0,0,0,0,0,0,0,0,1,0,0,0,1,0,0,0,0,0,0,0,0,0,0,1,1
GQ00-ELECTION ASSISTANCE COMMISSION,0,0,0,0,0,0,0,0,0,0,0,0,0,0,0,0,0,0,0,0,0,0,0,0,0,0,0,0,0,0,0,0,0,0,0,0,2,0,0,2,1,3,3
GS01-IMMEDIATE OFFICE OF THE ADMINISTRATOR,0,0,0,0,0,0,0,0,0,0,0,0,0,0,0,0,0,0,0,0,0,0,0,0,0,0,0,0,1,0,1,0,0,0,0,0,0,0,0,0,0,1,1
GS03-PUBLIC BUILDINGS SERVICE,15,1,0,0,0,0,0,0,0,16,0,0,0,0,0,0,0,0,0,0,16,5,13,0,22,0,0,0,0,0,40,0,0,17,0,0,0,0,0,17,0,57,73
GS04-OFFICE OF CIVIL RIGHTS,0,0,0,0,0,0,0,0,0,0,0,0,0,0,0,0,0,0,0,0,0,0,0,0,0,0,0,0,0,0,0,0,0,0,0,0,0,0,0,0,0,0,0
GS10-OFFICE OF SMALL BUSINESS UTILIZATION,0,0,0,0,0,0,0,0,0,0,0,0,0,0,0,0,0,0,0,0,0,0,0,0,0,0,0,0,0,0,0,0,0,0,0,0,0,0,0,0,0,0,0
GS11-OFFICE OF THE CHIEF FINANCIAL OFFICER,1,0,0,0,0,0,0,0,0,1,0,0,0,0,0,0,0,0,0,0,1,0,0,0,2,0,0,1,0,0,3,0,0,0,0,0,0,0,0,0,0,3,4
GS12-OFFICE OF GENERAL COUNSEL,0,0,0,0,0,0,0,0,0,0,0,0,0,0,0,0,0,0,0,0,0,0,0,0,0,0,0,0,0,0,0,0,0,1,0,0,0,0,0,1,0,1,1
GS13-GSA BOARD OF CONTRACT APPEALS,0,0,0,0,0,0,0,0,0,0,0,0,0,0,0,0,0,0,0,0,0,0,0,0,0,0,0,0,0,0,0,0,0,0,0,0,0,0,0,0,0,0,0
GS14-OFFICE OF THE CHIEF HUMAN CAPITAL OFFICER,1,0,0,0,0,0,0,0,0,1,0,0,0,0,0,0,0,0,0,0,1,0,0,1,1,0,0,0,0,0,2,0,0,0,0,0,0,0,0,0,0,2,3
GS15-OFFICE OF INSPECTOR GENERAL,0,0,0,0,0,0,0,0,0,0,0,0,0,0,0,0,0,0,0,0,0,0,0,0,0,0,0,0,0,0,0,0,0,2,0,0,0,0,0,2,0,2,2
GS16-OFFICE OF THE CHIEF ACQUISITION OFFICER,0,0,0,0,0,0,0,0,0,0,0,0,0,0,0,0,0,0,0,0,0,0,0,0,0,0,0,0,0,0,0,0,0,0,0,0,0,0,0,0,0,0,0
GS19-OFFICE OF CITIZEN SERVICES AND COMMUNICATIONS,0,1,0,0,0,0,0,0,0,1,0,0,0,0,0,0,0,0,0,0,1,0,1,0,1,0,0,0,0,0,2,0,0,0,0,0,0,0,0,0,0,2,3
GS20-OFFICE OF CONGRESSIONAL AND INTERGOVERNMENTAL AFFAIRS,0,0,0,0,0,0,0,0,0,0,0,0,0,0,0,0,0,0,0,0,0,0,0,0,0,0,0,0,0,0,0,0,0,0,0,0,0,0,0,0,0,0,0
GS22-OFFICES OF THE REGIONAL ADMINISTRATORS,1,0,0,0,0,0,0,0,0,1,0,0,0,0,0,0,0,0,0,0,1,0,0,0,0,0,0,0,0,0,0,0,0,0,0,0,0,0,0,0,0,0,1
GS24-FEDERAL SUPPLY SERVICE,0,0,0,0,0,0,0,0,0,0,0,0,0,0,0,0,0,0,0,0,0,0,0,0,0,0,0,0,0,0,0,0,0,1,0,0,0,0,0,1,0,1,1
GS26-OFFICE OF GOVERNMENTWIDE POLICY,0,0,0,0,0,0,0,0,0,0,0,0,0,0,0,0,0,0,0,0,0,0,0,0,0,0,0,0,0,0,0,0,0,1,0,0,0,0,0,1,0,1,1
GS27-FEDERAL TECHNOLOGY SERVICE,0,0,0,0,0,0,0,0,0,0,0,0,0,0,0,0,0,0,0,0,0,0,0,0,0,0,0,0,0,0,0,0,0,0,0,0,0,0,0,0,0,0,0
GS28-OFFICE OF THE CHIEF INFORMATION OFFICER,0,0,0,0,0,0,0,0,0,0,0,0,0,0,0,0,0,0,0,0,0,0,0,0,0,0,0,0,0,0,0,0,0,0,0,0,0,0,0,0,0,0,0
GS30-FEDERAL ACQUISITION SERVICE,3,1,0,0,0,0,0,0,0,4,0,0,0,0,0,0,0,0,0,0,4,0,1,0,0,0,0,0,0,0,1,0,0,1,0,0,0,0,0,1,0,2,6
GS31-OFFICE OF EMERGENCY RESPONSE AND RECOVERY,0,0,0,0,0,0,0,0,0,0,0,0,0,0,0,0,0,0,0,0,0,0,0,0,0,0,0,0,0,0,0,0,0,0,0,0,0,0,0,0,0,0,0
GW00-INTERNATIONAL BOUNDARY AND WATER COMMISSION:  UNITED STATES AND MEXICO,0,0,0,0,0,0,0,0,0,0,0,0,0,0,0,0,0,0,0,0,0,0,0,0,0,0,2,0,0,0,2,0,0,0,0,0,0,0,0,0,0,2,2
GX00-INTERNATIONAL BOUNDARY COMMISSION:  UNITED STATES AND CANADA,0,0,0,0,0,0,0,0,0,0,0,0,0,0,0,0,0,0,0,0,0,0,0,0,0,0,0,0,0,0,0,0,0,0,0,0,3,0,0,3,0,3,3
GY00-INTERNATIONAL JOINT COMMISSION:  UNITED STATES AND CANADA,0,0,0,0,0,0,0,0,0,0,0,0,0,0,0,0,0,0,0,0,0,0,0,0,0,0,0,0,0,0,0,0,0,0,0,0,0,0,0,0,0,0,0
HB00-COMMITTEE FOR PURCHASE FROM PEOPLE WHO ARE BLIND OR SEVERELY DISABLED,0,0,0,0,0,0,0,0,0,0,0,0,0,0,0,0,0,0,0,0,0,0,0,0,0,0,0,0,0,0,0,0,0,0,0,0,0,0,0,0,0,0,0
HD00-U.S. HOLOCAUST MEMORIAL MUSEUM,0,0,0,0,0,0,0,0,0,0,0,0,0,0,0,0,0,0,0,0,0,0,1,0,0,0,0,0,0,0,1,0,0,0,0,0,0,0,0,0,0,1,1
HE10-OFFICE OF THE SECRETARY OF HEALTH AND HUMAN SERVICES,8,0,0,0,0,0,1,0,0,9,0,0,0,0,0,0,0,0,0,0,9,1,5,8,0,0,1,0,0,0,15,0,1,17,0,0,2,0,0,20,1,36,45
HE11-PROGRAM SUPPORT CENTER,2,0,0,0,0,0,0,0,0,2,0,0,0,0,0,0,0,0,0,0,2,0,1,0,0,0,0,0,0,0,1,0,0,4,0,0,1,0,0,5,2,8,10
HE12-ADMINISTRATION ON AGING,0,0,0,0,0,0,0,0,0,0,0,0,0,0,0,0,0,0,0,0,0,0,0,0,0,0,0,0,0,0,0,0,0,0,0,0,0,0,0,0,0,0,0
HE31-OFFICE OF THE ASSISTANT SECRETARY FOR HEALTH,0,0,0,0,0,0,0,0,0,0,0,0,0,0,0,0,0,0,0,0,0,0,0,0,0,0,0,0,0,0,0,0,0,0,0,0,0,0,0,0,0,0,0
HE32-SUBSTANCE ABUSE AND MENTAL HEALTH SERVICES ADMINISTRATION,1,0,0,0,0,0,0,0,0,1,0,0,0,0,0,0,0,0,0,0,1,0,1,0,0,0,0,0,0,0,1,0,0,3,0,0,0,0,0,3,0,4,5
HE33-AGENCY FOR HEALTHCARE RESEARCH AND QUALITY,0,0,0,0,0,0,0,0,0,0,0,0,0,0,0,0,0,0,0,0,0,0,0,0,0,0,0,0,0,0,0,0,0,9,0,0,0,0,0,9,0,9,9
HE34-HEALTH RESOURCES AND SERVICES ADMINISTRATION,1,0,0,0,0,0,0,0,0,1,0,0,0,0,0,0,0,0,0,0,1,0,2,0,0,0,0,0,0,0,2,0,0,4,0,0,0,0,0,4,0,6,7
HE35-AGENCY FOR TOXIC SUBSTANCES AND DISEASE REGISTRY,0,0,0,0,0,0,0,0,0,0,0,0,0,0,0,0,0,0,0,0,0,0,0,0,0,0,0,0,0,0,0,0,0,0,0,0,0,0,0,0,0,0,0
HE36-FOOD AND DRUG ADMINISTRATION,1,0,0,0,0,0,0,0,0,1,0,0,0,0,0,0,0,0,0,0,1,2,8,0,0,0,0,0,0,0,10,9,5,54,0,0,11,0,0,79,8,97,98
HE37-INDIAN HEALTH SERVICE,3,1,0,0,0,0,0,0,0,4,0,0,0,0,0,0,0,0,0,0,4,2,15,48,0,0,0,0,0,0,65,12,61,6,0,0,39,0,0,118,1,184,188
HE38-NATIONAL INSTITUTES OF HEALTH,8,4,0,0,0,0,0,0,0,12,0,0,0,0,0,0,0,0,0,0,12,2,51,0,3,0,7,0,0,0,63,12,8,86,0,0,71,0,0,177,1,241,253
HE39-CENTERS FOR DISEASE CONTROL AND PREVENTION,2,1,0,0,0,0,0,0,0,3,0,0,0,0,0,0,0,0,0,0,3,3,29,0,0,0,2,0,0,0,34,0,0,17,0,0,15,0,0,32,0,66,69
HE70-CENTERS FOR MEDICARE & MEDICAID SERVICES,3,0,0,0,0,0,0,0,0,3,0,0,0,0,0,0,0,0,0,0,3,3,5,0,7,0,4,0,0,0,19,0,0,41,0,0,10,0,0,51,5,75,78
HE90-ADMINISTRATION FOR CHILDREN AND FAMILIES,2,0,0,0,0,0,0,0,0,2,0,0,0,0,0,0,0,0,0,0,2,2,7,0,0,0,0,0,0,0,9,0,0,3,0,0,0,0,0,3,0,12,14
HP00-ADVISORY COUNCIL ON HISTORIC PRESERVATION,0,0,0,0,0,0,0,0,0,0,0,0,0,0,0,0,0,0,0,0,0,0,0,0,0,0,0,0,0,0,0,0,0,0,0,0,0,0,0,0,0,0,0
HS**-UNSPECIFIED,0,0,0,0,0,0,0,0,0,0,0,0,0,0,0,0,0,0,0,0,0,0,0,0,0,0,0,0,0,0,0,0,0,0,0,0,0,0,0,0,0,0,0
HSAA-DHS HEADQUARTERS,5,0,0,0,0,0,0,0,0,5,0,0,0,0,0,0,0,0,0,0,5,3,16,1,0,0,0,2,0,0,22,0,0,28,2,0,1,0,0,31,0,53,58
HSAB-BUREAU OF CITIZENSHIP AND IMMIGRATION SERVICES,6,0,0,0,0,0,0,0,0,6,0,0,0,0,0,0,0,0,0,0,6,3,28,4,2,0,1,0,0,0,38,3,0,5,0,0,0,0,0,8,0,46,52
HSAC-U.S. COAST GUARD,9,1,0,0,0,0,0,0,0,10,0,0,0,0,0,0,0,0,0,0,10,4,33,2,6,0,1,0,0,0,46,39,2,25,0,0,0,0,0,66,0,112,122
HSAD-U.S. SECRET SERVICE,2,1,0,0,0,0,0,0,0,3,0,0,0,0,0,0,0,0,0,0,3,1,7,0,0,0,0,0,0,0,8,0,0,31,0,0,0,0,0,31,0,39,42
HSAE-OFFICE OF THE INSPECTOR GENERAL,5,0,0,0,0,0,0,0,0,5,0,0,0,0,0,0,0,0,0,0,5,1,2,0,0,0,0,0,0,0,3,0,0,9,0,0,3,0,0,12,0,15,20
HSBA-US-VISIT,0,0,0,0,0,0,0,0,0,0,0,0,0,0,0,0,0,0,0,0,0,0,0,0,0,0,0,0,0,0,0,0,0,0,0,0,0,0,0,0,0,0,0
HSBB-BUREAU OF IMMIGRATION AND CUSTOMS ENFORCEMENT,11,0,0,0,0,0,0,0,0,11,0,0,0,0,0,0,0,0,0,0,11,4,12,17,87,0,3,0,0,0,123,0,1,11,0,0,0,0,0,12,0,135,146
HSBC-TRANSPORTATION SECURITY ADMINISTRATION,0,0,0,0,0,0,0,0,0,0,0,0,0,0,0,0,0,0,0,0,0,0,0,0,0,0,807,0,0,0,807,0,0,0,0,0,16,0,0,16,0,823,823
HSBD-BUREAU OF CUSTOMS AND BORDER PROTECTION,15,2,0,0,0,1,0,0,0,18,0,0,0,0,0,0,0,0,0,0,18,12,38,2,575,0,0,0,0,0,627,27,0,9,0,0,0,0,0,36,0,663,681
HSBE-FEDERAL LAW ENFORCEMENT TRAINING CENTERS,1,0,0,0,0,0,0,0,0,1,0,0,0,0,0,0,0,0,0,0,1,0,5,0,1,0,0,0,0,0,6,1,1,5,0,0,2,0,0,9,0,15,16
HSCB-FEDERAL EMERGENCY MANAGEMENT AGENCY,3,1,0,0,0,0,0,0,0,4,0,0,0,0,0,0,0,0,0,0,4,3,9,1,1,0,0,0,0,0,14,0,1,16,1,0,118,0,0,136,0,150,154
HSDA-DOMESTIC NUCLEAR DETECTION OFFICE,2,0,0,0,0,0,0,0,0,2,0,0,0,0,0,0,0,0,0,0,2,0,6,0,0,0,0,0,0,0,6,0,1,5,0,0,0,0,0,6,0,12,14
HSDB-OFFICE FOR INFORMATION ANALYSIS,0,0,0,0,0,0,0,0,0,0,0,0,0,0,0,0,0,0,0,0,0,0,0,0,0,0,0,0,0,0,0,0,0,0,0,0,0,0,0,0,0,0,0
HSEA-OFFICE OF THE UNDER SECRETARY FOR MANAGEMENT,0,0,0,0,0,0,0,0,0,0,0,0,0,0,0,0,0,0,0,0,0,0,0,0,0,0,0,0,0,0,0,0,0,0,0,0,0,0,0,0,0,0,0
HSFA-OFFICE OF THE UNDER SECRETARY FOR SCIENCE AND TECHNOLOGY,3,0,0,0,0,0,0,0,0,3,0,0,0,0,0,0,0,0,0,0,3,0,1,0,0,0,0,0,0,0,1,0,0,0,0,0,1,0,0,1,0,2,5
HT00-HARRY S. TRUMAN SCHOLARSHIP FOUNDATION,0,0,0,0,0,0,0,0,0,0,0,0,0,0,0,0,0,0,0,0,0,0,0,0,0,0,0,0,0,0,0,0,0,0,0,0,0,0,0,0,0,0,0
HU**-UNSPECIFIED,1,0,0,0,0,0,0,0,0,1,0,0,0,0,0,0,0,0,0,0,1,0,0,0,0,0,0,0,0,0,0,0,0,0,0,0,0,0,0,0,0,0,1
HU01-OFFICE OF THE SENIOR COORDINATOR FOR NEW ENGLAND,0,0,0,0,0,0,0,0,0,0,0,0,0,0,0,0,0,0,0,0,0,0,0,0,0,0,0,0,0,0,0,0,1,1,0,0,0,0,0,2,0,2,2
HU02-OFFICE OF THE SENIOR COORDINATOR FOR NEW YORK/NEW JERSEY,0,0,0,0,0,0,0,0,0,0,0,0,0,0,0,0,0,0,0,0,0,0,0,0,0,0,0,0,0,0,0,0,0,0,0,0,0,0,0,0,0,0,0
HU03-OFFICE OF THE SENIOR COORDINATOR FOR MID-ATLANTIC,0,0,0,0,0,0,0,0,0,0,0,0,0,0,0,0,0,0,0,0,0,0,0,0,0,0,0,0,0,0,0,0,0,0,0,0,0,0,0,0,0,0,0
HU04-OFFICE OF THE SENIOR COORDINATOR FOR SOUTHEAST/CARIBBEAN,0,0,0,0,0,0,0,0,0,0,0,0,0,0,0,0,0,0,0,0,0,0,0,0,0,0,0,0,0,0,0,0,0,1,0,0,0,0,0,1,0,1,1
HU05-OFFICE OF THE SENIOR COORDINATOR FOR MIDWEST,0,0,0,0,0,0,0,0,0,0,0,0,0,0,0,0,0,0,0,0,0,0,0,0,0,0,0,0,0,0,0,0,0,2,0,0,0,0,0,2,0,2,2
HU06-OFFICE OF THE SENIOR COORDINATOR FOR SOUTHWEST,0,0,0,0,0,0,0,0,0,0,0,0,0,0,0,0,0,0,0,0,0,0,1,0,0,0,0,0,0,0,1,0,0,0,0,0,0,0,0,0,0,1,1
HU07-OFFICE OF THE SENIOR COORDINATOR FOR GREAT PLAINS,0,0,0,0,0,0,0,0,0,0,0,0,0,0,0,0,0,0,0,0,0,0,0,0,0,0,0,0,0,0,0,0,0,0,0,0,0,0,0,0,0,0,0
HU08-OFFICE OF THE SENIOR COORDINATOR FOR ROCKY MOUNTAINS,0,0,0,0,0,0,0,0,0,0,0,0,0,0,0,0,0,0,0,0,0,0,0,0,0,0,0,0,0,0,0,0,0,1,0,0,0,0,0,1,0,1,1
HU09-OFFICE OF THE SENIOR COORDINATOR FOR PACIFIC/HAWAII,2,0,0,0,0,0,0,0,0,2,0,0,0,0,0,0,0,0,0,0,2,0,1,0,0,0,0,0,0,0,1,0,0,0,0,0,0,0,0,0,0,1,3
HU10-OFFICE OF THE SENIOR COORDINATOR FOR NORTHWEST/ALASKA,0,0,0,0,0,0,0,0,0,0,0,0,0,0,0,0,0,0,0,0,0,1,1,0,0,0,0,0,0,0,2,0,0,0,0,0,0,0,0,0,0,2,2
HUAA-OFFICE OF THE SECRETARY OF HOUSING AND URBAN DEVELOPMENT,0,0,0,0,0,0,0,0,0,0,0,0,0,0,0,0,0,0,0,0,0,0,0,0,0,0,0,0,0,0,0,0,0,4,0,0,0,0,0,4,0,4,4
