HUBB-ASSISTANT SECRETARY FOR ADMINISTRATION,1,0,0,0,0,0,0,0,0,1,0,0,0,0,0,0,0,0,0,0,1,0,1,0,0,0,0,0,0,0,1,0,0,4,1,0,0,0,0,5,0,6,7
HUCC-OFFICE OF GENERAL COUNSEL,0,0,0,0,0,0,0,0,0,0,0,0,0,0,0,0,0,0,0,0,0,0,0,0,0,0,0,0,0,0,0,0,0,0,0,0,0,0,0,0,0,0,0
HUDD-ASSISTANT SECRETARY FOR COMMUNITY PLANNING AND DEVELOPMENT,0,0,0,0,0,0,0,0,0,0,0,0,0,0,0,0,0,0,0,0,0,0,1,0,0,0,0,0,0,0,1,0,0,13,0,0,0,0,0,13,0,14,14
HUEE-ASSISTANT SECRETARY FOR FAIR HOUSING AND EQUAL OPPORTUNITY,0,0,0,0,0,0,0,0,0,0,0,0,0,0,0,0,0,0,0,0,0,0,0,0,0,0,0,0,0,0,0,0,0,1,0,0,1,0,0,2,0,2,2
HUFF-OFFICE OF THE CHIEF FINANCIAL OFFICER,0,0,0,0,0,0,0,0,0,0,0,0,0,0,0,0,0,0,0,0,0,0,0,0,0,0,0,0,0,0,0,0,0,2,0,0,0,0,0,2,0,2,2
HUFH-OFFICE OF FEDERAL HOUSING ENTERPRISE OVERSIGHT,3,0,0,0,0,0,0,0,0,3,0,0,0,0,0,0,0,0,0,0,3,0,0,0,0,0,0,0,0,0,0,0,1,5,0,0,0,0,0,6,0,6,9
HUGG-OFFICE OF INSPECTOR GENERAL,3,0,0,0,0,0,0,0,0,3,0,0,0,0,0,0,0,0,0,0,3,0,0,0,2,0,0,0,0,0,2,0,0,0,0,0,0,0,0,0,0,2,5
HUII-OFFICE OF DEPARTMENTAL OPERATIONS AND COORDINATION,0,0,0,0,0,0,0,0,0,0,0,0,0,0,0,0,0,0,0,0,0,0,0,0,0,0,0,0,0,0,0,0,0,0,0,0,0,0,0,0,0,0,0
HUJJ-ASSISTANT SECRETARY FOR CONGRESSIONAL AND INTERGOVERNMENTAL RELATIONS,0,0,0,0,0,0,0,0,0,0,0,0,0,0,0,0,0,0,0,0,0,0,0,0,0,0,0,0,0,0,0,0,0,0,0,0,0,0,0,0,0,0,0
HUKA-CENTER FOR FAITH-BASED AND COMMUNITY INITIATIVES,0,0,0,0,0,0,0,0,0,0,0,0,0,0,0,0,0,0,0,0,0,0,0,0,0,0,0,0,0,0,0,0,0,0,0,0,0,0,0,0,0,0,0
HUKK-OFFICE OF FIELD POLICY AND MANAGEMENT,0,0,0,0,0,0,0,0,0,0,0,0,0,0,0,0,0,0,0,0,0,0,0,0,0,0,0,0,0,0,0,0,0,0,0,0,0,0,0,0,0,0,0
HULL-OFFICE OF HEALTHY HOMES AND LEAD HAZARD CONTROL,0,0,0,0,0,0,0,0,0,0,0,0,0,0,0,0,0,0,0,0,0,0,0,0,0,0,0,0,0,0,0,0,0,0,0,0,0,0,0,0,0,0,0
HUMM-ASSISTANT SECRETARY FOR HOUSING--FEDERAL HOUSING COMMISSIONER,0,0,0,0,0,0,0,0,0,0,0,0,0,0,0,0,0,0,0,0,0,0,0,0,0,0,0,0,0,0,0,0,0,0,0,0,0,0,0,0,0,0,0
HUNN-OFFICE OF THE CHIEF PROCUREMENT OFFICER,0,0,0,0,0,0,0,0,0,0,0,0,0,0,0,0,0,0,0,0,0,0,0,0,0,0,0,0,0,0,0,0,0,0,0,0,0,0,0,0,0,0,0
HUPP-ASSISTANT SECRETARY FOR PUBLIC AND INDIAN HOUSING,1,0,0,0,0,0,0,0,0,1,0,0,0,0,0,0,0,0,0,0,1,0,4,0,0,0,0,0,0,0,4,0,0,7,0,0,0,0,0,7,0,11,12
HUQQ-OFFICE OF THE CHIEF INFORMATION OFFICER,0,0,0,0,0,0,0,0,0,0,0,0,0,0,0,0,0,0,0,0,0,0,0,0,0,0,0,0,0,0,0,0,0,0,0,0,0,0,0,0,0,0,0
HURR-ASSISTANT SECRETARY FOR POLICY DEVELOPMENT AND RESEARCH,0,0,0,0,0,0,0,0,0,0,0,0,0,0,0,0,0,0,0,0,0,0,1,0,0,0,0,0,0,0,1,0,0,0,0,0,0,0,0,0,0,1,1
HUTT-GOVERNMENT NATIONAL MORTGAGE ASSOCIATION (GINNIE MAE),0,0,0,0,0,0,0,0,0,0,0,0,0,0,0,0,0,0,0,0,0,0,0,0,0,0,0,0,0,0,0,0,0,0,0,0,0,0,0,0,0,0,0
HUUU-OFFICE OF DEPARTMENTAL EQUAL EMPLOYMENT OPPORTUNITY,0,0,0,0,0,0,0,0,0,0,0,0,0,0,0,0,0,0,0,0,0,0,0,0,0,0,0,0,0,0,0,0,0,0,0,0,0,0,0,0,0,0,0
HUWW-ASSISTANT SECRETARY FOR PUBLIC AFFAIRS,0,0,0,0,0,0,0,0,0,0,0,0,0,0,0,0,0,0,0,0,0,0,0,0,0,0,0,0,0,0,0,0,0,0,0,0,0,0,0,0,0,0,0
HW00-U.S. INTERAGENCY COUNCIL ON HOMELESSNESS,0,0,0,0,0,0,0,0,0,0,0,0,0,0,0,0,0,0,0,0,0,0,0,0,0,0,0,0,0,0,0,0,0,0,0,0,0,0,0,0,0,0,0
IB00-BROADCASTING BOARD OF GOVERNORS,0,0,0,0,0,0,0,0,0,0,0,0,0,0,0,0,0,0,0,0,0,1,6,0,0,0,0,0,0,0,7,0,0,3,0,0,4,0,0,7,0,14,14
IF00-INTER-AMERICAN FOUNDATION,0,0,0,0,0,0,0,0,0,0,0,0,0,0,0,0,0,0,0,0,0,0,0,0,0,0,0,0,0,0,0,0,0,0,0,0,0,0,0,0,0,0,0
IN01-OFFICE OF THE SECRETARY OF THE INTERIOR,11,0,0,0,0,0,0,0,0,11,0,0,0,0,0,0,0,0,0,0,11,1,6,1,0,0,0,0,0,0,8,1,5,15,0,0,0,0,0,21,0,29,40
IN05-BUREAU OF LAND MANAGEMENT,16,3,0,0,0,0,0,0,0,19,0,0,0,0,0,0,0,0,0,0,19,5,36,0,9,0,1,0,0,0,51,22,869,137,0,0,9,0,0,1037,0,1088,1107
IN06-INDIAN AFFAIRS,1,0,0,0,0,0,0,0,0,1,0,0,0,0,0,0,0,0,0,0,1,3,0,10,0,0,1,0,0,0,14,1,26,0,0,0,9,0,0,36,0,50,51
IN07-BUREAU OF RECLAMATION,5,0,0,0,0,0,0,0,0,5,0,0,0,0,0,0,0,0,0,0,5,4,6,0,14,0,1,0,0,0,25,27,8,22,0,0,0,0,0,57,0,82,87
IN08-GEOLOGICAL SURVEY,7,2,0,0,0,0,0,0,0,9,0,0,0,0,0,0,0,0,0,0,9,2,5,0,28,0,0,0,0,0,35,33,53,108,0,0,1,0,0,195,0,230,239
IN10-NATIONAL PARK SERVICE,1,1,0,0,0,0,0,0,0,2,0,0,0,0,0,0,0,0,0,0,2,3,37,1,6,0,2,0,0,0,49,1923,132,757,0,0,86,0,0,2898,0,2947,2949
IN15-U.S. FISH AND WILDLIFE SERVICE,6,1,0,0,0,0,0,0,0,7,0,0,0,0,0,0,0,0,0,0,7,2,6,0,9,0,0,0,0,0,17,127,49,119,0,0,3,0,0,298,0,315,322
IN21-OFFICE OF THE SOLICITOR,0,0,0,0,0,0,0,0,0,0,0,0,0,0,0,0,0,0,0,0,0,0,0,0,0,0,0,0,1,0,1,0,2,1,0,0,0,0,0,3,0,4,4
"IN22-OFFICE OF SURFACE MINING, RECLAMATION AND ENFORCEMENT",1,0,0,0,0,0,0,0,0,1,0,0,0,0,0,0,0,0,0,0,1,1,2,0,1,0,0,0,0,0,4,0,0,6,0,0,0,0,0,6,0,10,11
IN23-MINERAL MANAGEMENT SERVICE,2,0,0,0,0,0,0,0,0,2,0,0,0,0,0,0,0,0,0,0,2,1,3,0,1,0,0,0,0,0,5,1,0,12,0,0,0,0,0,13,0,18,20
IN24-OFFICE OF THE INSPECTOR GENERAL,0,0,0,0,0,0,0,0,0,0,0,0,0,0,0,0,0,0,0,0,0,0,0,0,0,0,0,0,0,0,0,0,0,0,0,0,0,0,0,0,0,0,0
IW00-COMMISSION ON THE INTELLIGENCE CAPABILITIES OF THE UNITED STATES REGARDING WEAPONS OF MASS DESTRUCTION,0,0,0,0,0,0,0,0,0,0,0,0,0,0,0,0,0,0,0,0,0,0,0,0,0,0,0,0,0,0,0,0,0,0,0,0,0,0,0,0,0,0,0
KS00-CORPORATION FOR NATIONAL AND COMMUNITY SERVICE,0,0,0,0,0,0,0,0,0,0,0,0,0,0,0,0,0,0,0,0,0,0,0,0,0,0,6,0,0,0,6,0,0,0,0,0,9,0,0,9,0,15,15
LF00-FEDERAL ELECTION COMMISSION,0,0,0,0,0,0,0,0,0,0,0,0,0,0,0,0,0,0,0,0,0,0,0,0,0,0,1,0,0,0,1,0,0,0,0,0,6,0,0,6,0,7,7
LP00-GOVERNMENT PRINTING OFFICE,3,0,0,0,0,0,0,0,0,3,0,0,0,0,0,0,0,0,0,0,3,1,12,0,0,0,0,0,0,0,13,0,0,1,0,0,0,0,0,1,0,14,17
LT00-U.S. TAX COURT,0,0,0,0,0,0,0,0,0,0,0,0,0,0,0,0,0,0,0,0,0,0,2,0,0,0,0,0,0,0,2,0,1,4,0,0,0,0,0,5,0,7,7
MA00-MARINE MAMMAL COMMISSION,0,0,0,0,0,0,0,0,0,0,0,0,0,0,0,0,0,0,0,0,0,0,0,0,0,0,0,0,0,0,0,0,0,0,0,0,0,0,0,0,0,0,0
MC00-FEDERAL MARITIME COMMISSION,0,0,0,0,0,0,0,0,0,0,0,0,0,0,0,0,0,0,0,0,0,0,0,0,0,0,0,0,0,0,0,0,0,0,0,0,0,0,0,0,0,0,0
MI00-MILLENNIUM CHALLENGE CORPORATION,0,0,0,0,0,0,0,0,0,0,0,0,0,0,0,0,0,0,0,0,0,0,0,0,0,0,1,0,0,0,1,0,0,5,0,0,4,0,0,9,0,10,10
NF00-NATIONAL SCIENCE FOUNDATION,1,0,0,0,0,0,0,0,0,1,0,0,0,0,0,0,0,0,0,0,1,0,1,0,0,0,1,0,0,0,2,0,0,19,0,0,6,0,0,25,0,27,28
NK00-NATIONAL COUNCIL ON DISABILITY,0,0,0,0,0,0,0,0,0,0,0,0,0,0,0,0,0,0,0,0,0,0,0,0,0,0,0,0,0,0,0,0,0,0,0,0,1,0,0,1,0,1,1
NL00-NATIONAL LABOR RELATIONS BOARD,0,0,0,0,0,0,0,0,0,0,0,0,0,0,0,0,0,0,0,0,0,0,0,0,5,0,0,0,0,0,5,0,1,2,0,0,0,0,0,3,0,8,8
NM00-NATIONAL MEDIATION BOARD,0,0,0,0,0,0,0,0,0,0,0,0,0,0,0,0,0,0,0,0,0,0,0,0,0,0,0,0,0,0,0,0,0,0,0,0,0,0,0,0,0,0,0
"NN10-HEADQUARTERS, NASA",2,1,0,0,0,0,0,0,0,3,0,0,0,0,0,0,0,0,0,0,3,1,4,0,0,0,0,0,0,0,5,0,0,0,0,0,1,0,0,1,1,7,10
NN21-AMES RESEARCH CENTER,0,0,0,0,0,0,0,0,0,0,0,0,0,0,0,0,0,0,0,0,0,0,0,0,6,0,0,0,0,0,6,14,0,0,0,0,0,0,0,14,0,20,20
NN22-JOHN GLENN RESEARCH CENTER AT LEWIS FIELD,0,0,0,0,0,0,0,0,0,0,0,0,0,0,0,0,0,0,0,0,0,0,0,0,0,0,0,0,0,0,0,1,0,0,0,0,0,0,0,1,0,1,1
NN23-LANGLEY RESEARCH CENTER,0,0,0,0,0,0,0,0,0,0,0,0,0,0,0,0,0,0,0,0,0,0,0,0,0,0,0,0,0,0,0,2,0,0,0,0,0,0,0,2,0,2,2
NN24-DRYDEN FLIGHT RESEARCH CENTER,1,0,0,0,0,0,0,0,0,1,0,0,0,0,0,0,0,0,0,0,1,0,0,0,0,0,0,0,0,0,0,7,0,1,0,0,0,0,0,8,0,8,9
NN51-GODDARD SPACE FLIGHT CENTER,1,0,0,0,0,0,0,0,0,1,0,0,0,0,0,0,0,0,0,0,1,0,1,0,4,0,0,0,0,0,5,1,0,1,0,0,1,0,0,3,0,8,9
NN62-GEORGE C. MARSHALL SPACE FLIGHT CENTER,2,1,0,0,0,0,0,0,0,3,0,0,0,0,0,0,0,0,0,0,3,0,1,0,11,0,0,0,0,0,12,3,0,0,0,0,0,0,0,3,0,15,18
NN64-JOHN C. STENNIS SPACE CENTER,0,0,0,0,0,0,0,0,0,0,0,0,0,0,0,0,0,0,0,0,0,0,0,0,2,0,0,0,0,0,2,0,0,1,0,0,0,0,0,1,0,3,3
NN72-LYNDON B. JOHNSON SPACE CENTER,0,0,0,0,0,0,0,0,0,0,0,0,0,0,0,0,0,0,0,0,0,0,0,1,0,0,0,0,0,0,1,4,0,0,0,0,1,0,0,5,0,6,6
NN76-JOHN F. KENNEDY SPACE CENTER,0,0,0,0,0,0,0,0,0,0,0,0,0,0,0,0,0,0,0,0,0,0,0,0,2,0,0,0,0,0,2,11,0,15,0,0,0,0,0,26,0,28,28
NP00-NATIONAL CAPITAL PLANNING COMMISSION,0,0,0,0,0,0,0,0,0,0,0,0,0,0,0,0,0,0,0,0,0,0,0,0,0,0,0,0,0,0,0,0,0,0,0,0,0,0,0,0,0,0,0
NQ00-NATIONAL ARCHIVES AND RECORDS ADMINISTRATION,2,2,0,0,0,0,0,0,0,4,0,0,0,0,0,0,0,0,0,0,4,0,2,0,1,0,0,0,0,0,3,7,0,43,0,0,0,0,0,50,0,53,57
NS00-NATIONAL SECURITY COUNCIL,0,0,0,0,0,0,0,0,0,0,0,0,0,0,0,0,0,0,0,0,0,0,0,0,0,0,0,0,0,0,0,0,1,0,0,0,0,0,0,1,0,1,1
NU00-NUCLEAR REGULATORY COMMISSION,0,0,0,0,0,0,0,0,0,0,0,0,0,0,0,0,0,0,0,0,0,0,0,0,0,0,32,0,0,0,32,0,0,0,0,0,24,0,0,24,0,56,56
NV11-IMMEDIATE OFFICE OF THE CHIEF OF NAVAL OPERATIONS,3,0,0,0,0,0,0,0,0,3,0,0,0,0,0,0,0,0,0,0,3,6,3,0,1,0,6,0,0,0,16,2,3,20,0,0,10,0,0,35,0,51,54
"NV12-ASSISTANT FOR ADMINISTRATION, UNDER SECRETARY OF THE NAVY",7,0,0,0,0,1,0,0,0,8,0,0,0,0,0,0,0,0,0,1,9,8,0,10,2,0,0,0,0,0,20,7,3,26,1,0,0,0,0,37,0,57,66
NV14-OFFICE OF NAVAL RESEARCH,1,0,0,0,0,0,0,0,0,1,0,0,0,0,0,0,0,0,0,0,1,3,4,0,6,0,1,0,0,0,14,0,0,27,0,0,0,0,0,27,0,41,42
NV15-NAVAL INTELLIGENCE COMMAND,0,0,0,0,0,0,0,0,0,0,0,0,0,0,0,0,0,0,0,0,0,0,0,0,0,0,12,0,0,0,12,0,0,0,0,0,21,0,0,21,0,33,33
NV18-NAVAL MEDICAL COMMAND,5,3,0,0,0,0,0,0,0,8,0,0,0,0,0,0,0,0,0,0,8,4,91,1,1,0,7,0,0,0,104,10,15,16,0,0,1,0,0,42,0,146,154
NV19-NAVAL AIR SYSTEMS COMMAND,3,1,0,0,0,0,0,0,0,4,0,0,0,0,0,0,0,0,0,0,4,5,66,4,42,0,1,0,0,0,118,2,5,71,0,0,1,0,0,79,0,197,201
NV22-BUREAU OF NAVAL PERSONNEL,2,1,0,0,0,1,0,0,0,4,0,0,0,0,0,0,0,0,0,0,4,2,9,0,0,0,6,0,0,0,17,2,0,72,0,0,0,0,0,74,0,91,95
NV23-NAVAL SUPPLY SYSTEMS COMMAND,3,1,0,0,0,0,0,0,0,4,0,0,0,0,0,0,0,0,0,0,4,1,10,0,31,0,5,0,0,0,47,2,1,7,0,0,0,0,0,10,0,57,61
NV24-NAVAL SEA SYSTEMS COMMAND,5,1,0,0,0,0,0,0,0,6,0,0,0,0,0,0,0,0,0,0,6,13,45,0,29,0,1,0,0,0,88,4,1,110,0,0,0,0,0,115,0,203,209
NV25-NAVAL FACILITIES ENGINEERING COMMAND,11,1,0,0,0,0,0,0,0,12,0,0,0,0,0,0,0,0,0,0,12,9,45,0,17,0,8,0,0,0,79,5,1,36,0,0,0,0,0,42,0,121,133
NV27-U.S. MARINE CORPS,17,1,0,0,0,0,0,0,0,18,0,0,0,0,0,0,0,0,0,0,18,8,68,0,14,0,17,0,0,0,107,16,21,86,0,0,0,0,0,123,0,230,248
NV30-STRATEGIC SYSTEMS PROGRAMS OFFICE,2,0,0,0,0,0,0,0,0,2,0,0,0,0,0,0,0,0,0,0,2,3,2,1,1,0,0,0,0,0,7,2,0,15,0,0,0,0,0,17,0,24,26
NV33-MILITARY SEALIFT COMMAND,3,0,0,0,0,0,0,0,0,3,0,0,0,0,0,0,0,0,0,0,3,0,5,141,0,0,0,0,0,0,146,1,23,18,0,0,0,0,0,42,0,188,191
NV39-SPACE AND NAVAL WARFARE SYSTEMS COMMAND,2,0,0,0,0,0,0,0,0,2,0,0,0,0,0,0,0,0,0,0,2,17,0,0,10,0,1,0,0,0,28,2,0,10,0,0,1,0,0,13,0,41,43
NV41-NAVY SYSTEMS MANAGEMENT ACTIVITY,0,0,0,0,0,0,0,0,0,0,0,0,0,0,0,0,0,0,0,0,0,1,0,0,1,0,0,0,0,0,2,0,0,0,0,0,0,0,0,0,0,2,2
"NV52-COMMANDER, NAVY INSTALLATIONS",13,2,0,0,0,0,0,0,0,15,0,0,0,0,0,0,0,0,0,1,16,9,60,1,13,0,8,0,0,0,91,13,38,2,0,0,0,0,0,53,0,144,160
"NV60-U.S. ATLANTIC FLEET, COMMANDER IN CHIEF",6,1,0,0,0,0,0,0,0,7,0,0,0,0,0,0,0,0,0,0,7,10,20,0,3,0,8,0,0,0,41,2,2,61,0,0,1,0,0,66,0,107,114
"NV61-U.S. NAVAL FORCES, EUROPE",0,0,0,0,0,0,0,0,0,0,0,0,0,0,0,0,0,0,0,0,0,0,0,0,0,0,0,0,0,0,0,0,0,0,0,0,0,0,0,0,0,0,0
NV62-CHIEF OF NAVAL EDUCATION AND TRAINING,0,0,0,0,0,0,0,0,0,0,0,0,0,0,0,0,0,0,0,0,0,0,0,0,0,0,0,0,0,0,0,0,0,0,0,0,0,0,0,0,0,0,0
NV69-NAVAL SECURITY GROUP COMMAND,0,0,0,0,0,0,0,0,0,0,0,0,0,0,0,0,0,0,0,0,0,0,0,0,0,0,0,0,0,0,0,0,0,0,0,0,0,0,0,0,0,0,0
"NV70-U.S. PACIFIC FLEET, COMMANDER IN CHIEF",3,0,0,0,0,0,0,0,0,3,0,0,0,0,0,0,0,0,0,0,3,4,13,0,16,0,4,0,0,0,37,3,1,8,0,0,0,0,0,12,0,49,52
NV72-NAVAL RESERVE FORCE,2,0,0,0,0,0,0,0,0,2,0,0,0,0,0,0,0,0,0,0,2,0,1,0,0,0,1,0,0,0,2,0,0,1,0,0,0,0,0,1,0,3,5
NV74-NAVAL SPECIAL WARFARE COMMAND,1,0,0,0,0,0,0,0,0,1,0,0,0,0,0,0,0,0,0,0,1,8,0,0,0,0,7,0,0,0,15,1,0,0,0,0,0,0,0,1,0,16,17
NV76-NAVAL EDUCATION AND TRAINING COMMAND,2,0,0,0,0,0,0,0,0,2,0,0,0,0,0,0,0,0,0,0,2,1,20,0,26,0,5,0,0,0,52,0,1,6,0,0,0,0,0,7,0,59,61
OM00-OFFICE OF PERSONNEL MANAGEMENT,8,2,0,0,0,0,0,0,0,10,0,0,0,0,0,0,0,0,0,0,10,7,13,19,14,0,0,0,0,0,53,2,0,5,0,0,0,0,0,7,0,60,70
OS00-OCCUPATIONAL SAFETY AND HEALTH REVIEW COMMISSION,0,1,0,0,0,0,0,0,0,1,0,0,0,0,0,0,0,0,0,0,1,0,0,0,0,0,0,0,0,0,0,0,0,0,0,0,0,0,0,0,0,0,1
PU00-PEACE CORPS,0,0,0,0,0,0,0,0,0,0,0,0,0,0,0,0,0,0,0,0,0,0,0,0,0,0,0,0,0,0,0,0,0,0,0,0,12,0,0,12,0,12,12
QQ00-OFFICE OF NATIONAL DRUG CONTROL POLICY,0,0,0,0,0,0,0,0,0,0,0,0,0,0,0,0,0,0,0,0,0,0,1,0,0,0,0,1,0,0,2,0,0,0,1,0,0,0,0,1,0,3,3
RE00-OFFICE OF NAVAJO AND HOPI INDIAN RELOCATION,0,0,0,0,0,0,0,0,0,0,0,0,0,0,0,0,0,0,0,0,0,0,0,0,0,0,0,0,0,0,0,0,0,0,0,0,0,0,0,0,0,0,0
RF00-FEDERAL RETIREMENT THRIFT INVESTMENT BOARD,0,0,0,0,0,0,0,0,0,0,0,0,0,0,0,0,0,0,0,0,0,0,0,0,1,0,0,0,0,0,1,0,0,1,0,0,0,0,0,1,0,2,2
RH00-ARMED FORCES RETIREMENT HOME,0,0,0,0,0,0,0,0,0,0,0,0,0,0,0,0,0,0,0,0,0,0,0,0,0,0,0,0,0,0,0,0,0,0,0,0,0,0,0,0,0,0,0
RR00-RAILROAD RETIREMENT BOARD,0,0,0,0,0,0,0,0,0,0,0,0,0,0,0,0,0,0,0,0,0,2,0,0,0,0,0,0,0,0,2,4,0,0,0,0,0,0,0,4,0,6,6
RS00-FEDERAL MINE SAFETY AND HEALTH REVIEW COMMISSION,0,0,0,0,0,0,0,0,0,0,0,0,0,0,0,0,0,0,0,0,0,0,0,0,0,0,0,0,0,0,0,0,0,0,0,0,0,0,0,0,0,0,0
SB00-SMALL BUSINESS ADMINISTRATION,0,0,0,0,0,0,0,0,0,0,0,0,0,0,0,0,0,0,0,0,0,1,3,0,0,0,0,1,1,0,6,35,94,40,0,0,0,0,0,169,0,175,175
SE00-SECURITIES AND EXCHANGE COMMISSION,0,0,0,0,0,0,0,0,0,0,0,0,0,0,0,0,0,0,0,0,0,2,4,6,0,0,0,0,0,0,12,0,0,102,0,0,0,0,0,102,0,114,114
SK00-CONSUMER PRODUCT SAFETY COMMISSION,1,1,0,0,0,0,0,0,0,2,0,0,0,0,0,0,0,0,0,0,2,0,0,0,0,0,0,0,0,0,0,0,0,1,0,0,0,0,0,1,0,1,3
SM01-NATIONAL GALLERY OF ART,1,1,0,0,0,0,0,0,0,2,0,0,0,0,0,0,0,0,0,0,2,1,4,0,0,0,0,0,0,0,5,0,0,0,0,0,0,0,0,0,0,5,7
SM02-WOODROW WILSON INTERNATIONAL CENTER FOR SCHOLARS,0,0,0,0,0,0,0,0,0,0,0,0,0,0,0,0,0,0,0,0,0,0,1,0,0,0,0,0,0,0,1,0,0,0,0,0,0,0,0,0,0,1,1
SM03-SMITHSONIAN INSTITUTION (EXCEPT UNITS ADMINISTERED UNDER SEPARATE BOARDS OF TRUSTEES),6,1,0,0,0,0,0,0,0,7,0,0,0,0,0,0,0,0,0,0,7,2,12,1,0,0,0,0,0,0,15,4,5,33,0,0,0,0,0,42,0,57,64
SM04-JOHN F. KENNEDY CENTER FOR THE PERFORMING ARTS,0,0,0,0,0,0,0,0,0,0,0,0,0,0,0,0,0,0,0,0,0,0,0,0,0,0,0,0,0,0,0,0,0,0,0,0,0,0,0,0,0,0,0
SS00-SELECTIVE SERVICE SYSTEM,0,0,0,0,0,0,0,0,0,0,0,0,0,0,0,0,0,0,0,0,0,1,0,0,0,0,0,0,0,0,1,0,0,1,0,0,0,0,0,1,0,2,2
ST00-DEPARTMENT OF STATE,5,1,0,0,0,0,0,0,0,6,0,0,0,0,0,0,0,0,0,0,6,5,23,4,11,0,8,0,1,0,52,28,11,180,0,0,3,0,0,222,0,274,280
SZ00-SOCIAL SECURITY ADMINISTRATION,3,0,0,0,0,0,0,0,0,3,0,0,0,0,0,0,0,0,0,0,3,2,45,3,52,0,1,0,0,0,103,19,4,174,0,0,2,0,0,199,0,302,305
TB00-NATIONAL TRANSPORTATION SAFETY BOARD,0,0,0,0,0,0,0,0,0,0,0,0,0,0,0,0,0,0,0,0,0,0,0,0,0,0,0,0,0,0,0,0,0,0,0,0,0,0,0,0,0,0,0
TC00-U.S. INTERNATIONAL TRADE COMMISSION,0,0,0,0,0,0,0,0,0,0,0,0,0,0,0,0,0,0,0,0,0,0,0,1,0,0,0,0,0,0,1,0,0,4,0,0,0,0,0,4,0,5,5
TD01-OFFICE OF THE SECRETARY OF TRANSPORTATION,2,0,0,0,0,0,0,0,0,2,0,0,0,0,0,0,0,0,0,0,2,0,2,1,0,0,0,0,0,0,3,0,0,1,2,0,0,0,0,3,0,6,8
TD03-FEDERAL AVIATION ADMINISTRATION,0,0,0,0,0,0,0,0,0,0,0,0,0,0,0,0,0,0,0,0,0,0,0,0,0,0,174,0,0,0,174,0,0,0,0,0,33,0,0,33,0,207,207
TD04-FEDERAL HIGHWAY ADMINISTRATION,4,0,0,0,0,0,0,0,0,4,0,0,0,0,0,0,0,0,0,0,4,1,6,0,8,0,0,0,0,0,15,1,0,15,0,0,0,0,0,16,0,31,35
TD05-FEDERAL RAILROAD ADMINISTRATION,0,0,0,0,0,0,0,0,0,0,0,0,0,0,0,0,0,0,0,0,0,0,2,0,0,0,0,0,0,0,2,0,0,1,0,0,0,0,0,1,0,3,3
TD06-SAINT LAWRENCE SEAWAY DEVELOPMENT CORPORATION,0,0,0,0,0,0,0,0,0,0,0,0,0,0,0,0,0,0,0,0,0,0,0,0,0,0,0,0,0,0,0,2,0,3,0,0,0,0,0,5,0,5,5
TD09-FEDERAL TRANSIT ADMINISTRATION,0,0,0,0,0,0,0,0,0,0,0,0,0,0,0,0,0,0,0,0,0,1,4,0,0,0,0,0,0,0,5,0,0,14,0,0,0,0,0,14,0,19,19
TD10-NATIONAL HIGHWAY TRAFFIC SAFETY ADMINISTRATION,1,1,0,0,0,0,0,0,0,2,0,0,0,0,0,0,0,0,0,0,2,0,4,0,0,0,0,0,0,0,4,2,0,2,0,0,0,0,0,4,0,8,10
TD11-RESEARCH AND INNOVATIVE TECHNONOGY ADMINSTRATION,0,0,0,0,0,0,0,0,0,0,0,0,0,0,0,0,0,0,0,0,0,0,0,0,14,0,0,0,0,0,14,0,0,0,0,0,0,0,0,0,0,14,14
TD12-OFFICE OF INSPECTOR GENERAL,4,0,0,0,0,0,0,0,0,4,0,0,0,0,0,0,0,0,0,0,4,0,0,0,0,0,0,0,0,0,0,0,0,3,0,0,0,0,0,3,0,3,7
TD13-MARITIME ADMINISTRATION,0,1,0,0,0,0,0,0,0,1,0,0,0,0,0,0,0,0,0,0,1,1,3,0,0,0,0,0,0,0,4,0,0,1,0,0,0,0,0,1,0,5,6
TD15-SURFACE TRANSPORTATION BOARD,0,0,0,0,0,0,0,0,0,0,0,0,0,0,0,0,0,0,0,0,0,0,0,2,0,0,0,0,0,0,2,0,0,0,0,0,0,0,0,0,0,2,2
TD16-PIPELINE AND HAZARDOUS MATERIALS SAFETY ADMINISTRATION,0,0,0,0,0,0,0,0,0,0,0,0,0,0,0,0,0,0,0,0,0,0,2,0,0,0,0,0,0,0,2,0,0,1,0,0,0,0,0,1,0,3,3
TD17-FEDERAL MOTOR CARRIER SAFETY ADMINISTRATION,1,0,0,0,0,0,0,0,0,1,0,0,0,0,0,0,0,0,0,0,1,0,2,0,0,0,0,0,0,0,2,0,0,0,0,0,0,0,0,0,0,2,3
TN00-OFFICE OF THE U.S. TRADE REPRESENTATIVE,0,0,0,0,0,0,0,0,0,0,0,0,0,0,0,0,0,0,0,0,0,0,2,2,0,0,0,0,0,0,4,0,0,0,0,0,1,0,0,1,0,5,5
TR35-OFFICE OF THRIFT SUPERVISION,3,0,0,0,0,0,0,0,0,3,0,0,0,0,0,0,0,0,0,0,3,1,5,0,2,0,0,0,0,0,8,0,0,4,0,0,0,0,0,4,0,12,15
TR40-ALCOHOL AND TOBACCO TAX AND TRADE BUREAU,0,0,0,0,0,0,0,0,0,0,0,0,0,0,0,0,0,0,0,0,0,0,0,0,0,0,0,0,0,0,0,0,0,2,0,0,0,0,0,2,0,2,2
TR91-DEPARTMENTAL OFFICES,2,1,0,0,0,0,0,0,0,3,0,0,0,0,0,0,0,0,0,0,3,0,5,2,0,0,0,0,1,0,8,1,2,9,3,0,0,1,0,16,0,24,27
TR93-INTERNAL REVENUE SERVICE,6,0,0,0,0,0,0,0,0,6,0,0,0,0,0,0,0,0,0,0,6,1,93,4,6,0,0,0,0,0,104,26,1,46,0,0,2,0,0,75,0,179,185
TR95-OFFICE OF INSPECTOR GENERAL,0,0,0,0,0,0,0,0,0,0,0,0,0,0,0,0,0,0,0,0,0,0,0,0,0,0,0,0,0,0,0,0,0,0,0,0,0,0,0,0,0,0,0
TRAA-FINANCIAL MANAGEMENT SERVICE,2,0,0,0,0,0,0,0,0,2,0,0,0,0,0,0,0,0,0,0,2,0,0,0,0,0,1,0,0,0,1,0,1,13,0,0,0,0,0,14,0,15,17
TRAB-BUREAU OF THE PUBLIC DEBT,0,0,0,0,0,0,0,0,0,0,0,0,0,0,0,0,0,0,0,0,0,1,0,0,7,0,1,0,0,0,9,5,0,8,0,0,0,0,0,13,0,22,22
TRAD-U.S. MINT,2,0,0,0,0,0,0,0,0,2,0,0,0,0,0,0,0,0,0,0,2,1,0,2,0,0,0,0,0,0,3,7,0,0,1,0,0,0,0,8,0,11,13
TRAF-FINANCIAL CRIMES ENFORCEMENT NETWORK,0,0,0,0,0,0,0,0,0,0,0,0,0,0,0,0,0,0,0,0,0,0,1,0,0,0,0,0,0,0,1,0,0,1,0,0,0,0,0,1,0,2,2
TRAI-BUREAU OF ENGRAVING AND PRINTING,2,0,0,0,0,0,0,0,0,2,0,0,0,0,0,0,0,0,0,0,2,0,3,0,0,0,0,0,0,0,3,0,0,0,0,0,0,0,0,0,0,3,5
TRAJ-OFFICE OF THE COMPTROLLER OF THE CURRENCY,3,0,0,0,0,0,0,0,0,3,0,0,0,0,0,0,0,0,0,0,3,0,2,0,8,0,0,0,0,0,10,2,0,24,0,0,0,0,0,26,0,36,39
TRTG-OFFICE OF THE INSPECTOR GENERAL FOR TAX ADMINISTRATION,0,0,0,0,0,0,0,0,0,0,0,0,0,0,0,0,0,0,0,0,0,0,0,0,0,0,0,0,0,0,0,0,0,0,0,0,0,0,0,0,0,0,0
TS00-OFFICE OF SCIENCE AND TECHNOLOGY POLICY,0,0,0,0,0,0,0,0,0,0,0,0,0,0,0,0,0,0,0,0,0,0,0,0,0,0,0,0,0,0,0,0,0,0,0,0,0,0,0,0,0,0,0
UJ00-JAPAN-UNITED STATES FRIENDSHIP COMMISSION,0,0,0,0,0,0,0,0,0,0,0,0,0,0,0,0,0,0,0,0,0,0,0,0,0,0,0,0,0,0,0,0,0,0,0,0,0,0,0,0,0,0,0
UT00-UTAH RECLAMATION MITIGATION AND CONSERVATION COMMISSION,0,0,0,0,0,0,0,0,0,0,0,0,0,0,0,0,0,0,0,0,0,0,0,0,0,0,0,0,0,0,0,0,0,0,0,0,0,0,0,0,0,0,0
VA**-UNSPECIFIED,0,0,0,0,0,0,0,0,0,0,0,0,0,0,0,0,0,0,0,0,0,0,0,0,0,0,0,0,0,0,0,0,0,2,0,0,0,0,0,2,0,2,2
VAAA-OFFICE OF THE SECRETARY,0,0,0,0,0,0,0,0,0,0,0,0,0,0,0,0,0,0,0,0,0,0,0,0,0,0,0,0,0,0,0,0,0,0,0,0,1,0,0,1,0,1,1
VAAC-BOARD OF CONTRACT APPEALS,0,0,0,0,0,0,0,0,0,0,0,0,0,0,0,0,0,0,0,0,0,0,0,0,0,0,0,0,0,0,0,0,0,0,0,0,0,0,0,0,0,0,0
VAAD-BOARD OF VETERANS APPEALS,1,1,0,0,0,0,0,0,0,2,0,0,0,0,0,0,0,0,0,0,2,1,2,4,0,0,1,0,0,0,8,0,0,15,0,0,1,0,0,16,0,24,26
VAAE-GENERAL COUNSEL,0,0,0,0,0,0,0,0,0,0,0,0,0,0,0,0,0,0,0,0,0,2,0,2,0,0,1,0,0,0,5,0,0,0,0,0,0,0,0,0,0,5,5
VAAF-INSPECTOR GENERAL,0,0,0,0,0,0,0,0,0,0,0,0,0,0,0,0,0,0,0,0,0,0,0,0,0,0,0,0,0,0,0,0,0,0,0,0,0,0,0,0,0,0,0
VAAH-OFFICE OF SMALL AND DISADVANTAGED BUSINESS UTILIZATION,0,0,0,0,0,0,0,0,0,0,0,0,0,0,0,0,0,0,0,0,0,0,0,0,0,0,0,0,0,0,0,0,0,0,0,0,0,0,0,0,0,0,0
VABA-IMMEDIATE OFFICE OF THE ASSISTANT SECRETARY FOR HUMAN RESOURCES AND ADMINISTRATION,0,0,0,0,0,0,0,0,0,0,0,0,0,0,0,0,0,0,0,0,0,0,0,0,0,0,0,0,0,0,0,0,0,0,0,0,0,0,0,0,0,0,0
VABC-ASSISTANT SECRETARY FOR HUMAN RESOURCES MANAGEMENT,2,0,0,0,0,0,0,0,0,2,0,0,0,0,0,0,0,0,0,0,2,0,0,0,0,0,1,0,0,0,1,1,0,1,0,0,0,0,0,2,0,3,5
VABD-DEPUTY ASSISTANT SECRETARY FOR EQUAL OPPORTUNITY,0,0,0,0,0,0,0,0,0,0,0,0,0,0,0,0,0,0,0,0,0,0,0,0,0,0,0,0,0,0,0,0,0,0,0,0,0,0,0,0,0,0,0
VABE-DEPUTY ASSISTANT SECRETARY FOR ADMINISTRATION,0,0,0,0,0,0,0,0,0,0,0,0,0,0,0,0,0,0,0,0,0,0,0,0,0,0,0,0,0,0,0,0,0,1,0,0,0,0,0,1,0,1,1
VABF-DEPUTY ASSISTANT SECRETARY FOR OFFICE OF RESOLUTION MANAGEMENT,0,0,0,0,0,0,0,0,0,0,0,0,0,0,0,0,0,0,0,0,0,0,1,0,0,0,0,0,0,0,1,0,0,0,0,0,0,0,0,0,0,1,1
VADA-IMMEDIATE OFFICE OF THE ASSISTANT SECRETARY FOR MANAGEMENT,0,0,0,0,0,0,0,0,0,0,0,0,0,0,0,0,0,0,0,0,0,0,0,0,0,0,0,0,0,0,0,0,0,0,0,0,0,0,0,0,0,0,0
VADC-DEPUTY ASSISTANT SECRETARY FOR BUDGET,0,0,0,0,0,0,0,0,0,0,0,0,0,0,0,0,0,0,0,0,0,0,0,0,0,0,0,0,0,0,0,0,0,0,0,0,0,0,0,0,0,0,0
VADD-DEPUTY ASSISTANT SECRETARY FOR FINANCE,1,0,0,0,0,0,0,0,0,1,0,0,0,0,0,0,0,0,0,0,1,0,5,0,2,0,0,0,0,0,7,0,0,0,0,0,0,0,0,0,0,7,8
VADG-DEPUTY ASSISTANT SECRETARY FOR ACQUISITION AND MATERIEL MANAGEMENT,2,1,0,0,0,0,0,0,0,3,0,0,0,0,0,0,0,0,0,0,3,0,0,0,0,0,1,0,0,0,1,0,0,0,0,0,0,0,0,0,0,1,4
VAEA-IMMEDIATE OFFICE OF THE ASSISTANT SECRETARY FOR INFORMATION AND TECHNOLOGY,0,0,0,0,0,0,0,0,0,0,0,0,0,0,0,0,0,0,0,0,0,0,0,0,0,0,0,0,0,0,0,0,0,0,0,0,0,0,0,0,0,0,0
VAEB-DEPUTY ASSISTANT SECRETARY FOR INFORMATION AND TECHNOLOGY,9,2,0,0,0,0,0,0,0,11,0,0,0,0,0,0,0,0,0,0,11,5,24,0,10,0,3,0,0,0,42,1,0,7,0,0,2,0,0,10,0,52,63
VAHA-IMMEDIATE OFFICE OF THE ASSISTANT SECRETARY FOR POLICY AND PLANNING,0,0,0,0,0,0,0,0,0,0,0,0,0,0,0,0,0,0,0,0,0,0,0,0,0,0,0,0,0,0,0,0,0,0,0,0,0,0,0,0,0,0,0
VAHB-DEPUTY ASSISTANT SECRETARY FOR PROGRAM AND DATA ANALYSIS,0,0,0,0,0,0,0,0,0,0,0,0,0,0,0,0,0,0,0,0,0,0,0,0,0,0,0,0,0,0,0,0,0,0,0,0,0,0,0,0,0,0,0
VAHC-DEPUTY ASSISTANT SECRETARY FOR PLANNING AND EVALUATION,0,0,0,0,0,0,0,0,0,0,0,0,0,0,0,0,0,0,0,0,0,0,0,0,0,0,0,0,0,0,0,0,0,0,0,0,0,0,0,0,0,0,0
VAHD-NATIONAL CENTER FOR VETERAN ANALYSIS AND STATISTICS,0,0,0,0,0,0,0,0,0,0,0,0,0,0,0,0,0,0,0,0,0,0,0,0,0,0,0,0,0,0,0,0,0,0,0,0,0,0,0,0,0,0,0
VAJA-OFFICE OF THE ASSISTANT SECRETARY FOR PUBLIC AND INTERGOVERNMENTAL AFFAIRS,0,0,0,0,0,0,0,0,0,0,0,0,0,0,0,0,0,0,0,0,0,0,0,0,0,0,0,0,0,0,0,0,0,1,0,0,0,0,0,1,0,1,1
VAJB-DEPUTY ASSISTANCE SECRETARY FOR INTERGOVERNMENTAL AFFAIRS,0,0,0,0,0,0,0,0,0,0,0,0,0,0,0,0,0,0,0,0,0,0,0,0,0,0,0,0,0,0,0,0,0,0,0,0,0,0,0,0,0,0,0
VAJC-DEPUTY ASSISTANT SECRETARY FOR PUBLIC AFFAIRS,0,0,0,0,0,0,0,0,0,0,0,0,0,0,0,0,0,0,0,0,0,0,0,0,0,0,1,0,0,0,1,0,0,0,0,0,0,0,0,0,0,1,1
VAKA-IMMEDIATE OFFICE OF THE ASSISTANT SECRETARY FOR CONGRESSIONAL AND LEGISLATIVE AFFAIRS,0,0,0,0,0,0,0,0,0,0,0,0,0,0,0,0,0,0,0,0,0,0,0,0,0,0,0,0,0,0,0,0,0,0,0,0,0,0,0,0,0,0,0
VAKB-DEPUTY ASSISTANT SECRETARY FOR CONGRESSIONAL AFFAIRS,0,0,0,0,0,0,0,0,0,0,0,0,0,0,0,0,0,0,0,0,0,0,0,0,0,0,0,0,0,0,0,0,0,1,0,0,0,0,0,1,0,1,1
VALA-VETERANS BENEFITS ADMINISTRATION,20,1,0,0,0,0,0,0,0,21,0,0,0,0,0,0,0,0,0,0,21,11,84,0,105,0,38,0,0,0,238,2,0,1,0,0,0,0,0,3,0,241,262
VAPA-NATIONAL CEMETERY ADMINISTRATION,0,0,0,0,0,0,0,0,0,0,0,0,0,0,0,0,0,0,0,0,0,2,6,0,0,0,0,0,0,0,8,19,6,20,0,0,7,0,0,52,0,60,60
VATA-VETERANS HEALTH ADMINISTRATION,61,13,0,0,0,3,0,0,0,77,0,0,0,0,0,0,0,0,0,0,77,73,709,6,19,0,765,0,0,0,1572,123,34,247,0,0,1313,0,0,1717,11,3300,3377
YA00-COMMISSION ON THE REVIEW OF THE OVERSEAS MILITARY FACILITY STRUCTURE OF THE UNITED STATES,0,0,0,0,0,0,0,0,0,0,0,0,0,0,0,0,0,0,0,0,0,0,0,0,0,0,0,0,0,0,0,0,0,0,0,0,0,0,0,0,0,0,0
YB00-ANTITRUST MODERNIZATION COMMISSION,0,0,0,0,0,0,0,0,0,0,0,0,0,0,0,0,0,0,0,0,0,0,0,0,0,0,0,0,0,0,0,0,0,0,0,0,0,0,0,0,0,0,0
YD00-HELPING TO ENHANCE THE LIVELIHOOD OF PEOPLE (HELP) AROUND THE GLOBE COMMISSION,0,0,0,0,0,0,0,0,0,0,0,0,0,0,0,0,0,0,0,0,0,0,0,0,0,0,0,0,0,0,0,0,0,0,0,0,0,0,0,0,0,0,0
YE00-COMMISSION ON THE PREVENTION OF WEAPONS OF MASS DESTRUCTION PROLIFERATION AND TERRORISM,0,0,0,0,0,0,0,0,0,0,0,0,0,0,0,0,0,0,0,0,0,0,0,0,0,0,0,0,0,0,0,0,0,0,0,0,0,0,0,0,0,0,0
ZL00-MEDICARE PAYMENT ADVISORY COMMISSION,0,0,0,0,0,0,0,0,0,0,0,0,0,0,0,0,0,0,0,0,0,0,0,0,0,0,0,0,0,0,0,0,0,0,0,0,3,0,0,3,0,3,3
ZP00-U.S. COMMISSION ON INTERNATIONAL RELIGIOUS FREEDOM,0,0,0,0,0,0,0,0,0,0,0,0,0,0,0,0,0,0,0,0,0,0,0,0,0,0,0,0,0,0,0,0,0,0,0,0,2,0,0,2,0,2,2
ZS00-UNITED STATES-CHINA ECONOMIC AND SECURITY REVIEW COMMISSION,0,0,0,0,0,0,0,0,0,0,0,0,0,0,0,0,0,0,0,0,0,0,0,0,0,0,0,0,0,0,0,0,0,0,0,0,2,0,0,2,0,2,2
ZU00-DWIGHT D. EISENHOWER MEMORIAL COMMISSION,0,0,0,0,0,0,0,0,0,0,0,0,0,0,0,0,0,0,0,0,0,0,0,0,0,0,0,0,0,0,0,0,0,0,0,0,0,0,0,0,0,0,0
All Agencies,851,142,0,0,0,10,5,1,0,1009,0,0,0,0,0,0,0,0,0,2,1011,720,3784,442,2104,1,2629,9,11,0,9700,6172,2501,8559,30,5,2960,1,0,20228,39,29967,30978
