Agency,10-Competitive Service - Career,15-Competitive Service - Career-Conditional,30-Excepted Service - Schedule A,32-Excepted Service - Schedule B,35-Excepted Service - Schedule D,36-Excepted Service - Executive,38-Excepted Service - Other,50-Senior Executive Service - Career,55-Senior Executive Service - Non-Career,**-Unspecified,Permanent,20-Competitive Service,40-Excepted Service - Schedule A,42-Excepted Service - Schedule B,44-Excepted Service - Schedule C,45-Excepted Service - Schedule D,46-Excepted Service - Executive,48-Excepted Service - Other,60-Senior Executive Service - Limited Term,65-Senior Executive Service - Limited Emergency,Non-permanent,Unspecified,Type of Appointment - All,10-Competitive Service - Career,15-Competitive Service - Career-Conditional,30-Excepted Service - Schedule A,32-Excepted Service - Schedule B,35-Excepted Service - Schedule D,36-Excepted Service - Executive,38-Excepted Service - Other,50-Senior Executive Service - Career,55-Senior Executive Service - Non-Career,**-Unspecified,Permanent,20-Competitive Service,40-Excepted Service - Schedule A,42-Excepted Service - Schedule B,44-Excepted Service - Schedule C,45-Excepted Service - Schedule D,46-Excepted Service - Executive,48-Excepted Service - Other,60-Senior Executive Service - Limited Term,65-Senior Executive Service - Limited Emergency,Non-permanent,Unspecified,Type of Appointment - All,Type of Appointment - All
AA00-ADMINISTRATIVE CONFERENCE OF THE UNITED STATES,0,0,0,0,0,0,0,0,0,0,0,0,0,0,0,0,0,0,0,0,0,0,0,0,0,0,0,0,0,0,0,0,0,0,0,0,0,0,0,0,0,0,0,0,0,0,0
AB**-UNSPECIFIED,0,0,0,0,0,0,0,0,0,0,0,0,0,0,0,0,0,0,0,0,0,0,0,0,0,0,0,0,0,0,0,0,0,0,0,0,0,0,0,0,0,0,0,0,0,0,0
AB00-AMERICAN BATTLE MONUMENTS COMMISSION,0,0,0,0,0,0,0,0,0,0,0,0,0,0,0,0,0,0,0,0,0,0,0,0,0,0,0,0,0,0,0,0,0,0,0,0,0,0,0,0,0,0,0,0,0,0,0
AF**-UNSPECIFIED,0,0,0,0,0,0,0,0,0,0,0,0,0,0,0,0,0,0,0,0,0,0,0,0,0,0,0,0,0,0,0,0,0,0,0,0,0,0,0,0,0,0,0,0,0,0,0
AF02-AIR FORCE INSPECTION AGENCY (FO),0,0,0,0,0,0,0,0,0,0,0,0,0,0,0,0,0,0,0,0,0,0,0,0,0,0,0,0,0,0,0,0,0,0,0,0,0,0,0,0,0,0,0,0,0,0,0
AF03-AIR FORCE OPERATIONAL TEST AND EVALUATION CENTER,0,0,0,0,0,0,0,0,0,0,0,0,0,0,0,0,0,0,0,0,0,0,0,0,0,0,0,0,0,0,0,0,0,0,0,0,0,0,0,0,0,0,0,0,0,0,0
AF04-AIR FORCE COMMUNICATIONS AGENCY,0,0,0,0,0,0,0,0,0,0,0,0,0,0,0,0,0,0,0,0,0,0,0,0,0,0,0,0,0,0,0,0,0,0,0,0,0,0,0,0,0,0,0,0,0,0,0
AF05-AIR FORCE INTELLIGENCE ANALYSIS AGENCY,0,0,0,0,0,0,0,0,0,0,0,0,0,0,0,0,0,0,0,0,0,0,0,0,0,0,0,0,0,2,0,0,0,2,0,0,0,0,0,0,0,0,0,0,0,2,2
AF06-AIR FORCE AUDIT AGENCY,0,0,0,0,0,0,0,0,0,0,0,0,0,0,0,0,0,0,0,0,0,0,0,0,0,0,0,0,0,0,0,0,0,0,0,0,0,0,0,0,0,0,0,0,0,0,0
AF07-AIR FORCE OFFICE OF SPECIAL INVESTIGATIONS,0,0,0,0,0,0,0,0,0,0,0,0,0,0,0,0,0,0,0,0,0,0,0,0,1,3,0,0,0,5,0,0,0,9,0,0,0,0,0,0,0,0,0,0,0,9,9
AF08-AIR FORCE OFFICE OF SECURITY POLICE,0,0,0,0,0,0,0,0,0,0,0,0,0,0,0,0,0,0,0,0,0,0,0,0,0,0,0,0,0,0,0,0,0,0,0,0,0,0,0,0,0,0,0,0,0,0,0
AF09-AIR FORCE PERSONNEL CENTER,3,0,0,0,0,0,0,0,0,0,3,0,0,0,0,0,0,0,0,0,0,0,3,0,0,0,0,0,0,0,0,0,0,0,0,0,0,0,0,0,0,0,0,0,0,0,3
AF0B-U.S. AIR FORCE ACADEMY,0,0,0,0,0,0,0,0,0,0,0,0,0,0,0,0,0,0,0,0,0,0,0,3,4,0,0,0,0,0,0,0,0,7,0,1,0,0,0,0,0,0,0,1,0,8,8
"AF0D-U.S. AIR FORCES, EUROPE",3,0,0,0,0,0,0,0,0,0,3,0,0,0,0,0,0,0,0,0,0,0,3,1,2,0,0,0,0,0,0,0,0,3,0,8,0,0,0,0,0,0,0,8,0,11,14
AF0J-AIR EDUCATION AND TRAINING COMMAND,1,1,0,0,0,0,0,0,0,0,2,0,0,0,0,0,0,0,0,0,0,0,2,1,12,0,0,0,0,0,0,0,0,13,26,2,1,0,0,0,0,0,0,29,0,42,44
"AF0M-HEADQUARTERS, AIR FORCE RESERVE",3,0,0,0,0,0,0,0,0,0,3,0,0,0,0,0,0,0,0,0,0,0,3,4,97,1,0,0,0,7,0,0,0,109,2,0,0,0,0,0,0,0,0,2,0,111,114
"AF0N-HEADQUARTERS, U.S. AIR FORCE",0,0,0,0,0,0,0,0,0,0,0,0,0,0,0,0,0,0,0,0,0,0,0,0,0,0,0,0,0,0,0,0,0,0,0,0,0,0,0,0,0,0,0,0,0,0,0
AF0R-PACIFIC AIR FORCES,0,0,0,0,0,0,0,0,0,0,0,0,0,0,0,0,0,0,0,0,0,0,0,0,9,0,0,0,0,0,0,0,0,9,0,13,0,0,0,0,0,0,0,13,0,22,22
"AF0U-AIR FORCE INTELLIGENCE, SURVEILLANCE, & RECONNAISSANCE AGENCY",0,0,0,0,0,0,0,0,0,0,0,0,0,0,0,0,0,0,0,0,0,0,0,0,0,0,0,0,0,23,0,0,0,23,0,0,0,0,0,0,1,0,0,1,1,25,25
AF0V-AIR FORCE SPECIAL OPERATIONS COMMAND,1,0,0,0,0,0,0,0,0,0,1,0,0,0,0,0,0,0,0,0,0,0,1,0,4,0,0,0,0,1,0,0,0,5,2,5,0,0,0,0,0,0,0,7,0,12,13
AF11-AIR FORCE MANPOWER AGENCY,0,0,0,0,0,0,0,0,0,0,0,0,0,0,0,0,0,0,0,0,0,0,0,0,0,0,0,0,0,0,0,0,0,0,0,0,0,0,0,0,0,0,0,0,0,0,0
AF12-AIR FORCE PUBLIC AFFAIRS AGENCY,0,0,0,0,0,0,0,0,0,0,0,0,0,0,0,0,0,0,0,0,0,0,0,0,0,0,0,0,0,0,0,0,0,0,0,0,0,0,0,0,0,0,0,0,0,0,0
AF13-HQ USAF AND SUPPORT ELEMENTS,1,0,0,0,0,0,0,0,0,0,1,0,0,0,0,0,0,0,0,0,0,0,1,0,3,0,0,0,0,2,0,0,0,5,0,0,0,0,0,0,37,0,0,37,0,42,43
AF14-AIR FORCE INSTALLATION CONTRACTING AGENCY,0,0,0,0,0,0,0,0,0,0,0,0,0,0,0,0,0,0,0,0,0,0,0,0,0,0,0,0,0,0,0,0,0,0,0,0,0,0,0,0,0,0,0,0,0,0,0
AF15-AIR FORCE CIVIL ENGINEER CENTER,0,0,0,0,0,0,0,0,0,0,0,0,0,0,0,0,0,0,0,0,0,0,0,0,0,0,0,0,0,0,0,0,0,0,0,0,0,0,0,0,0,0,0,0,0,0,0
"AF1A-AIR FORCE C2 & INTELLIGENCE, SURVEILLANCE & RECONNAISSANCE",0,0,0,0,0,0,0,0,0,0,0,0,0,0,0,0,0,0,0,0,0,0,0,0,0,0,0,0,0,0,0,0,0,0,0,0,0,0,0,0,0,0,0,0,0,0,0
AF1C-AIR COMBAT COMMAND,3,0,0,0,0,0,0,0,0,0,3,0,0,0,0,0,0,0,0,0,0,0,3,0,19,0,0,0,0,0,0,0,0,19,57,2,0,0,0,0,0,0,0,59,0,78,81
AF1G-AIR FORCE LOGISTICS MANAGEMENT AGENCY,0,0,0,0,0,0,0,0,0,0,0,0,0,0,0,0,0,0,0,0,0,0,0,0,0,0,0,0,0,0,0,0,0,0,0,0,0,0,0,0,0,0,0,0,0,0,0
AF1L-AIR MOBILITY COMMAND,5,0,0,0,0,0,1,0,0,0,6,0,0,0,0,0,0,0,0,0,0,0,6,2,17,1,0,0,0,1,0,0,0,21,2,33,2,0,0,0,0,0,0,37,0,58,64
AF1M-AIR FORCE MATERIEL COMMAND,10,1,0,0,0,0,0,0,0,0,11,0,0,0,0,0,0,0,0,0,0,0,11,5,170,2,21,0,0,17,0,0,0,215,10,6,0,0,0,0,0,0,0,16,0,231,242
AF1P-AIR FORCE REAL PROPERTY AGENCY,0,0,0,0,0,0,0,0,0,0,0,0,0,0,0,0,0,0,0,0,0,0,0,0,1,0,0,0,0,0,0,0,0,1,0,0,0,0,0,0,0,0,0,0,0,1,1
AF1Q-HQ AF FLIGHT STANDARDS AGENCY,0,0,0,0,0,0,0,0,0,0,0,0,0,0,0,0,0,0,0,0,0,0,0,0,0,0,0,0,0,0,0,0,0,0,0,0,0,0,0,0,0,0,0,0,0,0,0
"AF1S-HEADQUARTERS, AIR FORCE SPACE COMMAND",0,0,0,0,0,0,0,0,0,0,0,0,0,0,0,0,0,0,0,0,0,0,0,0,34,5,1,0,0,2,0,0,0,42,1,1,0,0,0,0,0,0,0,2,0,44,44
AF1W-AIR FORCE ENGINEERING AND SERVICES CENTER,0,0,0,0,0,0,0,0,0,0,0,0,0,0,0,0,0,0,0,0,0,0,0,0,0,0,0,0,0,0,0,0,0,0,0,0,0,0,0,0,0,0,0,0,0,0,0
AF1Y-AIR FORCE CIVILIAN CAREER TRAINING,0,0,0,0,0,0,0,0,0,0,0,0,0,0,0,0,0,0,0,0,0,0,0,0,22,3,5,0,0,0,0,0,0,30,1,0,0,0,0,0,0,0,0,1,0,31,31
AF20-AIR FORCE AGENCY FOR MODELING/SIMULATION,0,0,0,0,0,0,0,0,0,0,0,0,0,0,0,0,0,0,0,0,0,0,0,0,0,0,0,0,0,0,0,0,0,0,0,0,0,0,0,0,0,0,0,0,0,0,0
AF21-AIR FORCE NUCLEAR WEAPONS AGENCY,0,0,0,0,0,0,0,0,0,0,0,0,0,0,0,0,0,0,0,0,0,0,0,0,0,0,0,0,0,0,0,0,0,0,0,0,0,0,0,0,0,0,0,0,0,0,0
AF24-HQ USAF DIRECT SUPPORT ELEMENT,0,0,0,0,0,0,0,0,0,0,0,0,0,0,0,0,0,0,0,0,0,0,0,0,0,0,0,0,0,0,0,0,0,0,0,0,0,0,0,0,0,0,0,0,0,0,0
AF25-AF-WIDE SUPPORT ELEMENT,0,0,0,0,0,0,0,0,0,0,0,0,0,0,0,0,0,0,0,0,0,0,0,0,0,0,0,0,0,0,0,0,0,0,0,0,0,0,0,0,0,0,0,0,0,0,0
AF27-AIR FORCE AGENCY FOR MODELING AND SIMULATION,0,0,0,0,0,0,0,0,0,0,0,0,0,0,0,0,0,0,0,0,0,0,0,0,0,0,0,0,0,0,0,0,0,0,0,0,0,0,0,0,0,0,0,0,0,0,0
AF2A-AIR FORCE COST ANALYSIS AGENCY,0,0,0,0,0,0,0,0,0,0,0,0,0,0,0,0,0,0,0,0,0,0,0,0,3,0,0,0,0,0,0,0,0,3,0,0,0,0,0,0,0,0,0,0,0,3,3
AF2D-AIR FORCE PERSONNEL OPERATIONS AGENCY,0,0,0,0,0,0,0,0,0,0,0,0,0,0,0,0,0,0,0,0,0,0,0,0,0,0,0,0,0,0,0,0,0,0,0,0,0,0,0,0,0,0,0,0,0,0,0
AF2E-AIR FORCE LEGAL OPERATIONS AGENCY,0,0,0,0,0,0,0,0,0,0,0,0,0,0,0,0,0,0,0,0,0,0,0,0,0,0,0,0,0,0,0,0,0,0,0,0,0,0,0,0,0,0,0,0,0,0,0
AF2F-AIR FORCE MEDICAL SERVICES CENTER,0,0,0,0,0,0,0,0,0,0,0,0,0,0,0,0,0,0,0,0,0,0,0,0,1,0,0,0,0,0,0,0,0,1,2,0,0,0,0,0,0,0,0,2,0,3,3
AF2G-AIR FORCE SERVICE INFORMATION AND NEWS CENTER,0,0,0,0,0,0,0,0,0,0,0,0,0,0,0,0,0,0,0,0,0,0,0,0,0,0,0,0,0,0,0,0,0,0,0,0,0,0,0,0,0,0,0,0,0,0,0
AF2H-AIR FORCE COMBAT OPERATIONS STAFF,0,0,0,0,0,0,0,0,0,0,0,0,0,0,0,0,0,0,0,0,0,0,0,0,0,0,0,0,0,0,0,0,0,0,0,0,0,0,0,0,0,0,0,0,0,0,0
AF2I-AIR NATIONAL GUARD SUPPORT CENTER,2,0,0,0,0,0,0,0,0,0,2,0,0,0,0,0,0,0,0,0,0,0,2,2,7,0,0,0,0,0,0,0,0,9,0,0,0,0,0,0,0,0,0,0,0,9,11
AF2K-AIR FORCE HISTORICAL RESEARCH AGENCY,0,0,0,0,0,0,0,0,0,0,0,0,0,0,0,0,0,0,0,0,0,0,0,0,0,0,0,0,0,0,0,0,0,0,0,0,0,0,0,0,0,0,0,0,0,0,0
AF2L-AIR FORCE TECHNICAL APPLICATIONS CENTER,0,0,0,0,0,0,0,0,0,0,0,0,0,0,0,0,0,0,0,0,0,0,0,0,0,0,0,0,0,2,0,0,0,2,0,0,0,0,0,0,1,0,0,1,0,3,3
AF2M-AIR FORCE REVIEW BOARDS AGENCY,0,0,0,0,0,0,0,0,0,0,0,0,0,0,0,0,0,0,0,0,0,0,0,0,3,0,0,0,0,0,0,0,0,3,0,0,0,0,0,0,0,0,0,0,0,3,3
AF2N-AIR FORCE CENTER FOR STUDIES AND ANALYSES,0,0,0,0,0,0,0,0,0,0,0,0,0,0,0,0,0,0,0,0,0,0,0,0,0,0,0,0,0,0,0,0,0,0,0,0,0,0,0,0,0,0,0,0,0,0,0
AF2Q-AIR WEATHER SERVICE,0,0,0,0,0,0,0,0,0,0,0,0,0,0,0,0,0,0,0,0,0,0,0,0,0,0,0,0,0,0,0,0,0,0,0,0,0,0,0,0,0,0,0,0,0,0,0
AF2R-AIR FORCE PROGRAM EXECUTIVE OFFICE,0,0,0,0,0,0,0,0,0,0,0,0,0,0,0,0,0,0,0,0,0,0,0,0,0,0,0,0,0,0,0,0,0,0,0,0,0,0,0,0,0,0,0,0,0,0,0
AF2S-AIR FORCE ELEMENTS NORAD,0,0,0,0,0,0,0,0,0,0,0,0,0,0,0,0,0,0,0,0,0,0,0,0,2,0,0,0,0,0,0,0,0,2,0,0,0,0,0,0,0,0,0,0,0,2,2
AF2T-AIR FORCE SAFETY CENTER,0,0,0,0,0,0,0,0,0,0,0,0,0,0,0,0,0,0,0,0,0,0,0,0,0,0,0,0,0,0,0,0,0,0,0,0,0,0,0,0,0,0,0,0,0,0,0
"AF2U-AIR FORCE MORALE, WELFARE AND RECREATION CENTER",0,0,0,0,0,0,0,0,0,0,0,0,0,0,0,0,0,0,0,0,0,0,0,0,0,0,0,0,0,0,0,0,0,0,0,0,0,0,0,0,0,0,0,0,0,0,0
AF2Z-AIR FORCE MEDICAL OPERATIONS AGENCY,0,0,0,0,0,0,0,0,0,0,0,0,0,0,0,0,0,0,0,0,0,0,0,0,0,0,0,0,0,0,0,0,0,0,0,0,0,0,0,0,0,0,0,0,0,0,0
AF34-AIR NATIONAL GUARD,0,0,0,0,0,0,0,0,0,0,0,0,0,0,0,0,0,0,0,0,0,0,0,0,5,0,0,0,0,0,0,0,0,5,1,1,0,0,0,0,0,0,0,2,0,7,7
"AF3C-AIR FORCE ELEMENTS, U.S. CENTRAL COMMAND",1,1,0,0,0,0,0,0,0,0,2,0,0,0,0,0,0,0,0,0,0,0,2,0,6,0,0,0,0,0,0,0,0,6,0,0,0,0,0,0,0,0,0,0,0,6,8
"AF3D-AIR FORCE ELEMENTS, U.S. SPECIAL OPERATIONS COMMAND",15,4,0,0,0,0,0,0,0,0,19,0,0,0,0,0,0,0,0,0,0,0,19,0,7,0,0,0,0,0,0,0,0,7,2,0,0,0,0,0,0,0,0,2,0,9,28
"AF3N-AIR FORCE ELEMENTS, U.S. ATLANTIC COMMAND",0,0,0,0,0,0,0,0,0,0,0,0,0,0,0,0,0,0,0,0,0,0,0,0,0,0,0,0,0,8,0,0,0,8,1,0,0,0,0,0,0,0,0,1,0,9,9
"AF3Q-AIR FORCE ELEMENTS, U.S. STRATEGIC COMMAND",4,7,0,0,0,0,0,1,0,0,12,0,0,0,0,0,0,0,0,0,0,0,12,1,17,4,1,0,0,0,0,0,0,23,1,0,0,0,0,0,1,0,0,2,0,25,37
"AF3T-AIR FORCE ELEMENTS, U.S. TRANSPORTATION COMMAND",17,9,0,0,0,0,2,1,0,0,29,0,0,0,0,0,0,0,0,0,0,0,29,1,1,0,0,0,0,1,0,0,0,3,4,0,0,0,0,0,0,0,0,4,0,7,36
AF3V-AIR FORCE ELEMENTS,0,0,0,0,0,0,0,0,0,0,0,0,0,0,0,0,0,0,0,0,0,0,0,0,2,0,0,0,0,1,0,0,0,3,0,0,0,0,0,0,0,0,0,0,0,3,3
AF3W-AIR FORCE CENTER FOR ENGINEER & ENVIRONMENT,0,0,0,0,0,0,0,0,0,0,0,0,0,0,0,0,0,0,0,0,0,0,0,0,2,0,0,0,0,0,0,0,0,2,0,0,0,0,0,0,0,0,0,0,0,2,2
AF3Y-AIR FORCE FREQUENCY MANAGEMENT AGENCY,0,0,0,0,0,0,0,0,0,0,0,0,0,0,0,0,0,0,0,0,0,0,0,0,0,0,0,0,0,0,0,0,0,0,0,0,0,0,0,0,0,0,0,0,0,0,0
"AF4D-AIR FORCE ELEMENTS, U.S. NORTHERN COMMAND",1,0,0,0,0,0,0,0,0,0,1,0,0,0,0,0,0,0,0,0,0,0,1,0,8,0,0,0,0,0,0,0,0,8,4,0,0,0,0,0,3,0,0,7,0,15,16
AF4W-AIR FORCE DISTRICT OF WASHINGTON,0,1,0,0,0,0,0,0,0,0,1,0,0,0,0,0,0,0,0,0,0,0,1,0,4,0,0,0,0,0,0,0,0,4,0,0,0,0,0,0,0,0,0,0,0,4,5
AF5J-AIR FORCE FINANCIAL SERVICES,0,0,0,0,0,0,0,0,0,0,0,0,0,0,0,0,0,0,0,0,0,0,0,0,0,0,0,0,0,0,0,0,0,0,0,0,0,0,0,0,0,0,0,0,0,0,0
AF5K-AIR FORCE PETROLEUM AGENCY,0,0,0,0,0,0,0,0,0,0,0,0,0,0,0,0,0,0,0,0,0,0,0,0,0,0,0,0,0,0,0,0,0,0,0,0,0,0,0,0,0,0,0,0,0,0,0
AFGS-AIR FORCE GLOBAL STRIKE COMMAND,1,0,0,0,0,0,0,0,0,0,1,0,0,0,0,0,0,0,0,0,0,0,1,1,12,0,0,0,0,0,0,0,0,13,2,0,0,0,0,0,0,0,0,2,0,15,16
AFNG-AIR NATIONAL GUARD UNITS (TITLE 32),0,0,0,0,0,0,0,0,0,0,0,0,0,0,0,0,0,0,0,0,0,0,0,0,4,0,0,0,0,75,0,0,0,79,0,14,0,0,0,0,401,0,0,415,0,494,494
"AFZG-U.S. SPECIAL OPERATIONS COMMAND (ANG, TITLE 32)",0,0,0,0,0,0,0,0,0,0,0,0,0,0,0,0,0,0,0,0,0,0,0,0,0,0,0,0,0,0,0,0,0,0,0,0,0,0,0,0,9,0,0,9,0,9,9
AG01-OFFICE OF THE SECRETARY OF AGRICULTURE,0,0,0,0,0,0,0,0,0,0,0,0,0,0,0,0,0,0,0,0,0,0,0,0,0,0,0,0,0,0,0,1,0,1,0,0,0,0,0,0,0,0,0,0,0,1,1
AG02-AGRICULTURAL MARKETING SERVICE,0,1,0,0,0,0,0,0,0,0,1,0,0,0,0,0,0,0,0,0,0,0,1,2,9,0,0,0,0,1,0,0,0,12,0,228,0,0,0,0,0,0,0,228,0,240,241
AG03-AGRICULTURAL RESEARCH SERVICE,0,0,0,0,0,0,0,0,0,0,0,0,0,0,0,0,0,0,0,0,0,0,0,0,3,0,0,0,0,0,0,0,0,3,7,38,55,0,0,0,0,0,0,100,0,103,103
AG07-RURAL HOUSING SERVICE,2,0,0,0,0,0,0,0,0,0,2,0,0,0,0,0,0,0,0,0,0,0,2,2,7,0,5,0,0,1,0,0,0,15,2,0,5,0,0,0,0,0,0,7,0,22,24
AG08-RISK MANAGEMENT AGENCY,0,0,0,0,0,0,0,0,0,0,0,0,0,0,0,0,0,0,0,0,0,0,0,0,0,0,0,0,0,0,0,0,0,0,0,0,0,1,0,0,0,0,0,1,0,1,1
AG10-FOREIGN AGRICULTURAL SERVICE,0,0,0,0,0,0,0,0,0,0,0,0,0,0,0,0,0,0,0,0,0,0,0,0,0,0,0,0,0,0,0,0,0,0,0,0,5,0,0,0,0,0,0,5,0,5,5
AG11-FOREST SERVICE,15,1,0,0,0,0,0,0,0,0,16,0,0,0,0,0,0,0,0,0,0,0,16,4,22,2,2,0,0,3,0,0,0,33,41,0,12,0,0,0,1,0,0,54,0,87,103
AG13-OFFICE OF COMMUNICATIONS,0,0,0,0,0,0,0,0,0,0,0,0,0,0,0,0,0,0,0,0,0,0,0,0,0,0,0,0,0,0,0,0,0,0,0,0,0,0,0,0,0,0,0,0,0,0,0
AG14-OFFICE OF THE GENERAL COUNSEL,0,0,0,0,0,0,0,0,0,0,0,0,0,0,0,0,0,0,0,0,0,0,0,0,0,0,0,0,0,0,0,0,0,0,0,0,0,0,0,0,0,0,0,0,0,0,0
AG15-RURAL UTILITIES SERVICE,0,0,0,0,0,0,0,0,0,0,0,0,0,0,0,0,0,0,0,0,0,0,0,0,1,0,0,0,0,0,0,0,0,1,0,0,0,0,0,0,0,0,0,0,0,1,1
AG16-NATURAL RESOURCES CONSERVATION SERVICE,1,1,0,0,0,0,0,0,0,0,2,0,0,0,0,0,0,0,0,0,0,0,2,1,24,0,2,0,0,0,0,0,0,27,14,4,4,0,0,0,2,0,0,24,0,51,53
AG18-ECONOMIC RESEARCH SERVICE,0,0,0,0,0,0,0,0,0,0,0,0,0,0,0,0,0,0,0,0,0,0,0,0,1,0,0,0,0,0,0,0,0,1,0,0,0,0,0,0,0,0,0,0,0,1,1
AG20-NATIONAL AGRICULTURAL STATISTICS SERVICE,0,2,0,0,0,0,0,0,0,0,2,0,0,0,0,0,0,0,0,0,0,0,2,2,2,0,1,0,0,0,0,0,0,5,43,0,0,0,0,0,0,0,0,43,0,48,50
"AG22-COOPERATIVE STATE RESEARCH, EDUCATION, AND EXTENSION SERVICE",0,0,0,0,0,0,0,0,0,0,0,0,0,0,0,0,0,0,0,0,0,0,0,0,0,0,0,0,0,0,0,0,0,0,0,3,1,0,0,0,0,0,0,4,0,4,4
AG23-OFFICE OF THE INSPECTOR GENERAL,0,0,0,0,0,0,0,0,0,0,0,0,0,0,0,0,0,0,0,0,0,0,0,0,0,0,0,0,0,0,0,0,0,0,0,0,0,0,0,0,0,0,0,0,0,0,0
AG30-FOOD AND NUTRITION SERVICE,0,0,0,0,0,0,0,0,0,0,0,0,0,0,0,0,0,0,0,0,0,0,0,0,0,0,0,0,0,0,0,0,0,0,1,0,0,0,0,0,0,0,0,1,0,1,1
AG32-RURAL BUSINESS-COOPERATIVE SERVICE,0,0,0,0,0,0,0,0,0,0,0,0,0,0,0,0,0,0,0,0,0,0,0,0,0,0,0,0,0,0,0,0,0,0,0,0,0,0,0,0,0,0,0,0,0,0,0
AG34-ANIMAL AND PLANT HEALTH INSPECTION SERVICE,0,0,0,0,0,0,0,0,0,0,0,0,0,0,0,0,0,0,0,0,0,0,0,0,1,0,0,0,0,0,0,0,0,1,4,18,1,0,0,0,0,0,0,23,0,24,24
"AG36-GRAIN INSPECTION, PACKERS AND STOCKYARDS ADMINISTRATION",1,0,0,0,0,0,0,0,0,0,1,0,0,0,0,0,0,0,0,0,0,0,1,0,1,0,0,0,0,0,0,0,0,1,0,4,0,0,0,0,0,0,0,4,0,5,6
AG37-FOOD SAFETY AND INSPECTION SERVICE,1,0,0,0,0,0,0,0,0,0,1,0,0,0,0,0,0,0,0,0,0,0,1,4,18,0,0,0,0,0,0,0,0,22,3,13,0,0,0,0,0,0,0,16,0,38,39
AG38-OFFICE OF THE CHIEF ECONOMIST,0,0,0,0,0,0,0,0,0,0,0,0,0,0,0,0,0,0,0,0,0,0,0,0,0,0,0,0,0,0,0,0,0,0,0,0,0,0,0,0,0,0,0,0,0,0,0
AG42-OFFICE OF BUDGET AND PROGRAM ANALYSIS,0,0,0,0,0,0,0,0,0,0,0,0,0,0,0,0,0,0,0,0,0,0,0,0,0,0,0,0,0,0,0,0,0,0,0,0,0,0,0,0,0,0,0,0,0,0,0
AG90-OFFICE OF THE CHIEF FINANCIAL OFFICER,0,0,0,0,0,0,0,0,0,0,0,0,0,0,0,0,0,0,0,0,0,0,0,1,7,0,0,0,0,0,1,0,0,9,0,0,0,0,0,0,0,0,0,0,0,9,9
AGAO-OFFICE OF ADVOCACY AND OUTREACH,0,0,0,0,0,0,0,0,0,0,0,0,0,0,0,0,0,0,0,0,0,0,0,0,1,0,0,0,0,0,0,0,0,1,0,0,0,0,0,0,0,0,0,0,0,1,1
AGCR-CIVIL RIGHTS,0,0,0,0,0,0,0,0,0,0,0,0,0,0,0,0,0,0,0,0,0,0,0,0,0,0,0,0,0,0,0,0,0,0,0,0,0,0,0,0,0,0,0,0,0,0,0
AGDA-DEPARTMENTAL ADMINISTRATION,6,0,0,0,0,0,0,0,0,0,6,0,0,0,0,0,0,0,0,0,0,0,6,0,0,0,0,0,0,0,0,0,0,0,0,1,0,0,0,0,0,0,0,1,0,1,7
AGES-OFFICE OF THE EXECUTIVE SECRETARIAT,0,0,0,0,0,0,0,0,0,0,0,0,0,0,0,0,0,0,0,0,0,0,0,0,0,0,0,0,0,0,0,0,0,0,0,0,0,0,0,0,0,0,0,0,0,0,0
AGFA-FARM SERVICE AGENCY,1,0,0,0,0,0,0,0,0,0,1,0,0,0,0,0,0,0,0,0,0,0,1,0,6,1,0,0,0,0,0,0,0,7,0,2,0,0,0,0,0,0,0,2,0,9,10
AGHL-HOMELAND SECURITY STAFF,0,0,0,0,0,0,0,0,0,0,0,0,0,0,0,0,0,0,0,0,0,0,0,0,0,0,0,0,0,0,0,0,0,0,0,0,0,0,0,0,0,0,0,0,0,0,0
AGIT-OFFICE OF THE CHIEF INFORMATION OFFICER,1,0,0,0,0,0,0,0,0,0,1,0,0,0,0,0,0,0,0,0,0,0,1,1,2,0,0,0,0,0,0,0,0,3,0,0,0,0,0,0,0,0,0,0,0,3,4
AGNA-NATIONAL APPEALS DIVISION,0,0,0,0,0,0,0,0,0,0,0,0,0,0,0,0,0,0,0,0,0,0,0,0,0,0,0,0,0,0,0,0,0,0,0,0,0,0,0,0,0,0,0,0,0,0,0
AH01-NATIONAL ENDOWMENT FOR THE ARTS,0,0,0,0,0,0,0,0,0,0,0,0,0,0,0,0,0,0,0,0,0,0,0,0,0,0,0,0,0,0,0,0,0,0,0,0,0,0,0,0,0,0,0,0,0,0,0
AH02-NATIONAL ENDOWMENT FOR THE HUMANITIES,0,0,0,0,0,0,0,0,0,0,0,0,0,0,0,0,0,0,0,0,0,0,0,0,0,0,0,0,0,0,0,0,0,0,0,0,0,0,0,0,0,0,0,0,0,0,0
AH03-INSTITUTE OF MUSEUM AND LIBRARY SERVICES,0,0,0,0,0,0,0,0,0,0,0,0,0,0,0,0,0,0,0,0,0,0,0,0,0,0,0,0,0,0,0,0,0,0,0,0,0,0,0,0,0,0,0,0,0,0,0
AM00-AGENCY FOR INTERNATIONAL DEVELOPMENT,4,4,0,0,0,0,0,0,0,0,8,0,0,0,0,0,0,0,0,0,0,0,8,2,3,2,0,0,0,2,0,0,0,9,3,0,1,0,0,0,13,0,0,17,0,26,34
AN00-AFRICAN DEVELOPMENT FOUNDATION,0,0,0,0,0,0,0,0,0,0,0,0,0,0,0,0,0,0,0,0,0,0,0,0,0,0,0,0,0,0,0,0,0,0,0,0,0,0,0,0,0,0,0,0,0,0,0
AP00-APPALACHIAN REGIONAL COMMISSION,0,0,0,0,0,0,0,0,0,0,0,0,0,0,0,0,0,0,0,0,0,0,0,0,0,0,0,0,0,0,0,0,0,0,0,0,0,0,0,0,0,0,0,0,0,0,0
AR**-UNSPECIFIED,0,0,0,0,0,0,0,0,0,0,0,0,0,0,0,0,0,0,0,0,0,0,0,0,0,0,0,0,0,0,0,0,0,0,0,0,0,0,0,0,0,0,0,0,0,0,0
AR2A-UNITED STATES ARMY CYBER COMMAND,0,1,0,0,0,0,0,0,0,0,1,0,0,0,0,0,0,0,0,0,0,0,1,0,1,0,0,0,0,0,0,0,0,1,0,0,0,0,0,0,0,0,0,0,0,1,2
AR3A-U.S. ARMY CENTRAL,1,0,0,0,0,0,0,0,0,0,1,0,0,0,0,0,0,0,0,0,0,0,1,0,0,0,0,0,0,0,0,0,0,0,6,13,0,0,0,0,0,0,0,19,0,19,20
AR5A-U.S. ARMY NORTH,1,0,0,0,0,0,0,0,0,0,1,0,0,0,0,0,0,0,0,0,0,0,1,0,1,0,0,0,0,2,0,0,0,3,0,0,0,0,0,0,0,0,0,0,0,3,4
ARA1-US ARMY AFRICA/SOUTHERN EUROPEAN TASK FORCE (USAFRAF/SETAF),0,0,0,0,0,0,0,0,0,0,0,0,0,0,0,0,0,0,0,0,0,0,0,0,0,0,0,0,0,0,0,0,0,0,0,0,0,0,0,0,0,0,0,0,0,0,0
ARAA-U. S. ARMY ACCESSION COMMAND,0,0,0,0,0,0,0,0,0,0,0,0,0,0,0,0,0,0,0,0,0,0,0,1,8,0,0,0,0,1,0,0,0,10,1,0,0,0,0,0,0,0,0,1,0,11,11
ARAC-U.S. ARMY CONTRACTING AGENCY,0,0,0,0,0,0,0,0,0,0,0,0,0,0,0,0,0,0,0,0,0,0,0,0,0,0,0,0,0,0,0,0,0,0,0,0,0,0,0,0,0,0,0,0,0,0,0
ARAE-U.S. ARMY ACQUISITION SUPPORT CENTER,3,1,0,0,0,0,0,0,0,0,4,0,0,0,0,0,0,0,0,0,0,0,4,1,8,0,0,0,0,0,0,0,0,9,12,5,0,0,0,0,0,0,0,17,0,26,30
ARAP-U. S. MILITARY ENTRANCE PROCESSING COMMAND,2,2,0,0,0,0,0,0,0,0,4,0,0,0,0,0,0,0,0,0,0,0,4,3,180,1,0,0,0,6,0,0,0,190,3,1,0,0,0,0,0,0,0,4,0,194,198
ARAS-U.S. ARMY INTELLIGENCE AND SECURITY COMMAND,0,0,0,0,0,0,0,0,0,0,0,0,0,0,0,0,0,0,0,0,0,0,0,0,0,0,0,0,0,25,0,0,0,25,0,0,0,0,0,0,1,0,0,1,0,26,26
ARAT-U.S. ARMY TEST AND EVALUATION COMMAND,0,0,0,0,0,0,0,0,0,0,0,0,0,0,0,0,0,0,0,0,0,0,0,0,1,0,0,0,0,2,0,0,0,3,0,0,0,0,0,0,0,0,0,0,0,3,3
ARBA-U.S. ARMY INSTALLATION MANAGEMENT COMMAND,10,2,0,0,0,0,0,0,0,0,12,0,0,0,0,0,0,0,0,0,0,0,12,6,58,2,2,0,0,11,0,0,0,79,132,12,0,0,0,0,9,0,0,153,0,232,244
ARCB-U.S. ARMY CRIMINAL INVESTIGATION COMMAND,0,1,0,0,0,0,0,0,0,0,1,0,0,0,0,0,0,0,0,0,0,0,1,0,2,0,0,0,0,0,0,0,0,2,0,1,0,0,0,0,0,0,0,1,0,3,4
ARCE-U.S. ARMY CORPS OF ENGINEERS,9,7,0,0,0,0,0,0,0,0,16,0,0,0,0,0,0,0,0,0,0,0,16,8,36,2,13,0,0,7,0,0,0,66,46,10,18,0,0,0,0,0,0,74,0,140,156
ARCS-IMMEDIATE OFFICE OF THE CHIEF OF STAFF OF THE ARMY,1,0,0,0,0,0,0,0,0,0,1,0,0,0,0,0,0,0,0,0,0,0,1,0,2,0,0,0,0,1,0,0,0,3,0,0,0,0,0,0,0,0,0,0,0,3,4
ARE1-IMMEDIATE OFFICE OF THE COMMANDER-IN-CHIEF OF THE U.S. ARMY EUROPE AND SEVENTH ARMY,0,2,0,0,0,0,0,0,0,0,2,0,0,0,0,0,0,0,0,0,0,0,2,1,7,0,0,0,0,1,0,0,0,9,0,1,0,0,0,0,0,0,0,1,0,10,12
ARE2-21ST THEATER ARMY AREA COMMAND,2,0,0,0,0,0,0,0,0,0,2,0,0,0,0,0,0,0,0,0,0,0,2,1,3,0,0,0,0,0,0,0,0,4,0,0,0,0,0,0,0,0,0,0,0,4,6
ARE3-U.S. ARMY SOUTHERN EURPOEAN TASK FORCE,0,0,0,0,0,0,0,0,0,0,0,0,0,0,0,0,0,0,0,0,0,0,0,0,0,0,0,0,0,0,0,0,0,0,0,0,0,0,0,0,0,0,0,0,0,0,0
ARE5-U.S. ARMY V CORPS,0,0,0,0,0,0,0,0,0,0,0,0,0,0,0,0,0,0,0,0,0,0,0,0,0,0,0,0,0,0,0,0,0,0,0,0,0,0,0,0,0,0,0,0,0,0,0
AREN-SEVENTH ARMY TRAINING COMMAND,0,0,0,0,0,0,0,0,0,0,0,0,0,0,0,0,0,0,0,0,0,0,0,0,1,0,0,0,0,0,0,0,0,1,0,1,0,0,0,0,0,0,0,1,0,2,2
ARFC-U.S. ARMY FORCES COMMAND,1,0,0,0,0,0,0,0,0,0,1,0,0,0,0,0,0,0,0,0,0,0,1,1,4,0,0,0,0,1,0,0,0,6,20,0,0,0,0,0,11,0,0,31,0,37,38
ARG6-U.S. ARMY NETWORK ENTERPRISE TECHNOLOGY COMMAND/9TH ARMY SIGNAL COMMAND,3,0,0,0,0,0,0,0,0,0,3,0,0,0,0,0,0,0,0,0,0,0,3,4,20,0,0,0,0,2,0,0,0,26,3,1,0,0,0,0,0,0,0,4,0,30,33
ARGB-OFFICE OF THE CHIEF OF THE NATIONAL GUARD BUREAU,2,1,0,0,0,0,0,0,0,0,3,0,0,0,0,0,0,0,0,0,0,0,3,2,4,0,0,0,0,0,0,0,0,6,3,0,0,0,0,0,0,0,0,3,0,9,12
ARHR-U.S. ARMY RESERVE COMMAND,0,0,0,0,0,0,0,0,0,0,0,0,0,0,0,0,0,0,0,0,0,0,0,2,12,0,0,0,0,7,0,0,0,21,0,0,0,0,0,0,0,0,0,0,0,21,21
ARJ1-U.S. ARMY ELEMENT SHAPE,1,0,0,0,0,0,0,0,0,0,1,0,0,0,0,0,0,0,0,0,0,0,1,0,0,0,0,0,0,0,0,0,0,0,0,0,0,0,0,0,0,0,0,0,0,0,1
ARJA-JOINT ACTIVITIES,2,3,0,0,0,0,0,1,0,0,6,0,0,0,0,0,0,0,0,0,0,0,6,1,18,0,0,0,0,7,0,0,0,26,5,2,0,0,0,0,0,0,0,7,0,33,39
ARMA-U.S. MILITARY ACADEMY,0,0,0,0,0,0,0,0,0,0,0,0,0,0,0,0,0,0,0,0,0,0,0,0,1,0,0,0,0,0,0,0,0,1,0,2,0,0,0,0,0,0,0,2,0,3,3
ARMC-U.S. ARMY MEDICAL COMMAND,19,8,0,0,0,0,0,0,0,0,27,0,0,0,0,0,0,0,0,0,0,0,27,23,282,0,2,0,0,16,0,0,0,323,84,16,6,0,0,0,5,0,0,111,1,435,462
ARMW-U.S. ARMY MILITARY DISTRICT OF WASHINGTON,0,0,0,0,0,0,0,0,0,0,0,0,0,0,0,0,0,0,0,0,0,0,0,0,1,0,0,0,0,0,0,0,0,1,7,0,0,0,0,0,0,0,0,7,0,8,8
ARNG-ARMY NATIONAL GUARD UNITS (TITLE 32),0,1,0,0,0,0,0,0,0,0,1,0,0,0,0,0,0,0,0,0,0,0,1,1,5,0,0,0,0,120,0,0,0,126,1,86,0,0,0,0,387,0,0,474,0,600,601
"ARP1-U.S. ARMY, PACIFIC",0,0,0,0,0,0,0,0,0,0,0,0,0,0,0,0,0,0,0,0,0,0,0,0,2,0,0,0,0,0,0,0,0,2,1,0,0,0,0,0,0,0,0,1,0,3,3
ARP8-EIGHTH U.S. ARMY,0,0,0,0,0,0,0,0,0,0,0,0,0,0,0,0,0,0,0,0,0,0,0,0,1,0,0,0,0,0,0,0,0,1,0,1,0,0,0,0,0,0,0,1,0,2,2
ARSA-OFFICE OF THE SECRETARY OF THE ARMY,1,0,0,0,0,0,0,1,0,0,2,0,0,0,0,0,0,0,0,0,0,0,2,1,0,0,0,0,0,0,0,0,0,1,1,0,0,0,0,0,2,0,0,3,0,4,6
ARSB-FIELD OPERATING OFFICES OF THE OFFICE OF THE SECRETARY OF THE ARMY,0,3,0,0,0,0,0,0,0,0,3,0,0,0,0,0,0,0,0,0,0,0,3,0,36,3,0,0,0,5,0,0,0,44,0,0,0,0,0,0,0,0,0,0,0,44,47
ARSC-U. S. ARMY SPACE AND MISSILE DEFENSE COMMAND/U. S. ARMY FORCES STRATEGIC COMMAND,1,1,0,0,0,0,0,0,0,0,2,0,0,0,0,0,0,0,0,0,0,0,2,0,2,0,0,0,0,0,0,0,0,2,0,0,0,0,0,0,0,0,0,0,0,2,4
ARSE-FIELD OPERATING AGENCIES OF THE ARMY STAFF RESOURCED THROUGH OA-22,4,1,0,0,0,0,0,0,0,0,5,0,0,0,0,0,0,0,0,0,0,0,5,6,12,0,0,0,0,9,0,0,0,27,5,0,0,0,0,0,0,0,0,5,0,32,37
ARSF-FIELD OPERATING AGENCIES OF THE ARMY STAFF,0,0,0,0,0,0,0,0,0,0,0,0,0,0,0,0,0,0,0,0,0,0,0,0,0,0,0,0,0,0,0,0,0,0,0,0,0,0,0,0,0,0,0,0,0,0,0
"ARSJ-JOINT SERVICES AND ACTIVITIES SUPPORTED BY THE OFFICE, SECRETARY OF THE ARMY",8,1,0,0,0,0,0,0,0,0,9,0,0,0,0,0,0,0,0,0,0,0,9,1,7,0,0,0,0,0,0,0,0,8,0,4,2,0,0,0,2,0,0,8,0,16,25
ARSO-U.S. ARMY SOUTH,0,0,0,0,0,0,0,0,0,0,0,0,0,0,0,0,0,0,0,0,0,0,0,0,0,0,0,0,0,0,0,0,0,0,0,0,0,0,0,0,0,0,0,0,0,0,0
ARSP-U.S. SPECIAL OPERATIONS COMMAND (ARMY),0,0,0,0,0,0,0,0,0,0,0,0,0,0,0,0,0,0,0,0,0,0,0,1,1,0,0,0,0,0,0,0,0,2,0,0,0,0,0,0,0,0,0,0,0,2,2
ARTA-U.S. ARMY ACCESSIONS COMMAND,0,0,0,0,0,0,0,0,0,0,0,0,0,0,0,0,0,0,0,0,0,0,0,0,0,0,0,0,0,0,0,0,0,0,0,0,0,0,0,0,0,0,0,0,0,0,0
ARTC-U.S. ARMY TRAINING AND DOCTRINE COMMAND,0,0,0,0,0,0,0,0,0,0,0,0,0,0,0,0,0,0,0,0,0,0,0,0,6,0,0,0,0,7,0,0,0,13,5,16,0,0,0,0,2,0,0,23,0,36,36
ARTM-U.S. MILITARY ENTRANCE PROCESSING COMMAND,0,0,0,0,0,0,0,0,0,0,0,0,0,0,0,0,0,0,0,0,0,0,0,0,0,0,0,0,0,0,0,0,0,0,0,0,0,0,0,0,0,0,0,0,0,0,0
ARTW-U.S. ARMY WAR COLLEGE,0,0,0,0,0,0,0,0,0,0,0,0,0,0,0,0,0,0,0,0,0,0,0,0,0,0,0,0,0,0,0,0,0,0,0,0,0,0,0,0,0,0,0,0,0,0,0
ARX1-414TH SUPPORT BRIGADE,0,0,0,0,0,0,0,0,0,0,0,0,0,0,0,0,0,0,0,0,0,0,0,0,0,0,0,0,0,0,0,0,0,0,0,0,0,0,0,0,0,0,0,0,0,0,0
"ARX2-HEADQUARTERS, AMC",0,0,0,0,0,0,0,0,0,0,0,0,0,0,0,0,0,0,0,0,0,0,0,0,0,0,0,0,0,0,0,0,0,0,0,0,0,0,0,0,0,0,0,0,0,0,0
"ARX3-HEADQUARTERS, STAFF SUPPORT ACTIVITIES, AMC",0,0,0,0,0,0,0,0,0,0,0,0,0,0,0,0,0,0,0,0,0,0,0,0,0,0,0,0,0,0,0,0,0,0,0,0,0,0,0,0,0,0,0,0,0,0,0
ARX6-U.S. ARMY AVIATION AND MISSILE COMMAND,1,2,0,0,0,0,0,0,0,0,3,0,0,0,0,0,0,0,0,0,0,0,3,0,26,2,0,0,0,8,0,0,0,36,3,0,0,0,0,0,0,0,0,3,0,39,42
ARX7-U.S. ARMY TANK-AUTOMOTIVE AND ARMAMENT COMMAND (TACOM),43,1,0,0,0,0,0,0,0,0,44,0,0,0,0,0,0,0,0,0,0,0,44,0,11,2,0,0,0,3,0,0,0,16,44,32,1,0,0,0,9,0,0,86,0,102,146
ARX8-U.S. ARMY COMMUNICATIONS ELECTRONICS COMMAND,1,1,0,0,0,0,1,0,0,0,3,0,0,0,0,0,0,0,0,0,0,0,3,1,4,1,0,0,0,4,0,0,0,10,5,0,0,0,0,0,0,0,0,5,0,15,18
ARXB-U.S. ARMY CHEMICAL MATERIALS ACTIVITY,0,0,0,0,0,0,0,0,0,0,0,0,0,0,0,0,0,0,0,0,0,0,0,0,2,0,0,0,0,1,0,0,0,3,0,0,0,0,0,0,0,0,0,0,0,3,3
ARXC-U.S. ARMY SUSTAINMENT COMMAND,0,0,0,0,0,0,0,0,0,0,0,0,0,0,0,0,0,0,0,0,0,0,0,0,2,0,0,0,0,0,0,0,0,2,1,10,0,0,0,0,1,0,0,12,0,14,14
ARXD-U. S. ARMY CONTRACTING COMMAND,17,1,0,0,0,0,0,0,0,0,18,0,0,0,0,0,0,0,0,0,0,0,18,2,14,1,1,0,0,2,0,0,0,20,2,1,0,0,0,0,0,0,0,3,0,23,41
ARXK-MATERIEL ACQUISITION ACTIVITIES,1,0,0,0,0,0,0,0,0,0,1,0,0,0,0,0,0,0,0,0,0,0,1,0,0,0,0,0,0,0,0,0,0,0,0,0,0,0,0,0,0,0,0,0,0,0,1
ARXP-U.S. ARMY SECURITY ASSISTANCE COMMAND,0,0,0,0,0,0,0,0,0,0,0,0,0,0,0,0,0,0,0,0,0,0,0,3,1,0,0,0,0,0,0,0,0,4,0,0,0,0,0,0,0,0,0,0,0,4,4
ARXQ-U.S. ARMY JOINT MUNITIONS COMMAND,0,0,0,0,0,0,0,0,0,0,0,0,0,0,0,0,0,0,0,0,0,0,0,0,4,0,0,0,0,1,0,0,0,5,0,17,1,0,0,0,0,0,0,18,0,23,23
"ARXR-U.S. ARMY RESEARCH, DEVELOPMENT AND ENGINEERING COMMAND",2,0,0,0,0,0,0,0,0,0,2,0,0,0,0,0,0,0,0,0,0,0,2,1,4,0,0,0,0,3,0,0,0,8,4,0,0,0,0,0,0,0,0,4,0,12,14
ARXT-U.S. ARMY MILITARY SURFACE DEPLOYMENT AND DISTRIBUTION COMMAND,0,1,0,0,0,0,0,0,0,0,1,0,0,0,0,0,0,0,0,0,0,0,1,0,3,0,0,0,0,0,0,0,0,3,0,0,0,0,0,0,0,0,0,0,0,3,4
ARXX-MATERIEL READINESS ACTIVITIES,0,0,0,0,0,0,0,0,0,0,0,0,0,0,0,0,0,0,0,0,0,0,0,0,2,0,0,0,0,0,0,0,0,2,0,0,0,0,0,0,0,0,0,0,0,2,2
AU00-FEDERAL LABOR RELATIONS AUTHORITY,0,0,0,0,0,0,0,0,0,0,0,0,0,0,0,0,0,0,0,0,0,0,0,0,0,0,0,0,0,0,0,0,0,0,0,0,0,0,0,0,0,0,0,0,0,0,0
AW00-ARCTIC RESEARCH COMMISSION,0,0,0,0,0,0,0,0,0,0,0,0,0,0,0,0,0,0,0,0,0,0,0,0,0,0,0,0,0,0,0,0,0,0,0,0,0,0,0,0,0,0,0,0,0,0,0
BD00-MERIT SYSTEMS PROTECTION BOARD,0,0,0,0,0,0,0,0,0,0,0,0,0,0,0,0,0,0,0,0,0,0,0,0,0,1,0,0,0,0,0,0,0,1,0,0,0,0,0,0,0,0,0,0,0,1,1
BF00-DEFENSE NUCLEAR FACILITIES SAFETY BOARD,0,0,0,0,0,0,0,0,0,0,0,0,0,0,0,0,0,0,0,0,0,0,0,0,0,0,0,0,0,0,0,0,0,0,0,0,0,0,0,0,0,0,0,0,0,0,0
BG00-PENSION BENEFIT GUARANTY CORPORATION,0,1,0,0,0,0,0,0,0,0,1,0,0,0,0,0,0,0,0,0,0,0,1,0,2,0,0,0,0,0,0,0,0,2,0,0,2,0,0,0,0,0,0,2,0,4,5
BK00-JAMES MADISON MEMORIAL FELLOWSHIP FOUNDATION,0,0,0,0,0,0,0,0,0,0,0,0,0,0,0,0,0,0,0,0,0,0,0,0,0,0,0,0,0,0,0,0,0,0,0,0,0,0,0,0,0,0,0,0,0,0,0
BO00-OFFICE OF MANAGEMENT AND BUDGET,1,0,0,0,0,0,0,0,0,0,1,0,0,0,0,0,0,0,0,0,0,0,1,0,0,1,0,0,0,0,1,0,0,2,0,1,4,0,0,0,0,0,0,5,0,7,8
BT00-ARCHITECTURAL AND TRANSPORTATION BARRIERS COMPLIANCE BOARD,0,0,0,0,0,0,0,0,0,0,0,0,0,0,0,0,0,0,0,0,0,0,0,0,0,0,0,0,0,0,0,0,0,0,0,0,0,0,0,0,0,0,0,0,0,0,0
BW00-NUCLEAR WASTE TECHNICAL REVIEW BOARD,0,0,0,0,0,0,0,0,0,0,0,0,0,0,0,0,0,0,0,0,0,0,0,0,0,0,0,0,0,0,0,0,0,0,0,0,0,0,0,0,0,0,0,0,0,0,0
BZ00-CHRISTOPHER COLUMBUS FELLOWSHIP FOUNDATION,0,0,0,0,0,0,0,0,0,0,0,0,0,0,0,0,0,0,0,0,0,0,0,0,0,0,0,0,0,0,0,0,0,0,0,0,0,0,0,1,0,0,0,1,0,1,1
CC00-COMMISSION ON CIVIL RIGHTS,0,0,0,0,0,0,0,0,0,0,0,0,0,0,0,0,0,0,0,0,0,0,0,0,0,0,0,0,0,0,0,0,0,0,0,0,0,1,0,0,0,0,0,1,0,1,1
