HSAB-BUREAU OF CITIZENSHIP AND IMMIGRATION SERVICES,4,0,0,0,0,0,0,0,0,0,4,0,0,0,0,0,0,0,0,0,0,0,4,2,18,0,17,0,0,6,0,0,0,43,2,3,42,3,0,0,0,0,0,50,0,93,97
HSAC-U.S. COAST GUARD,3,0,0,0,0,0,0,0,0,0,3,0,0,0,0,0,0,0,0,0,0,0,3,6,54,0,7,0,0,2,0,0,0,69,58,4,51,0,0,0,2,0,0,115,0,184,187
HSAD-U.S. SECRET SERVICE,1,0,0,0,0,0,0,0,0,0,1,0,0,0,0,0,0,0,0,0,0,0,1,0,6,0,0,0,0,0,0,0,0,6,1,0,8,0,0,0,0,0,0,9,0,15,16
HSAE-OFFICE OF THE INSPECTOR GENERAL,1,1,0,0,0,0,0,0,0,0,2,0,0,0,0,0,0,0,0,0,0,0,2,1,1,0,5,0,0,0,0,0,0,7,0,0,12,0,0,0,0,0,0,12,0,19,21
HSBB-BUREAU OF IMMIGRATION AND CUSTOMS ENFORCEMENT,21,6,0,0,0,0,0,0,0,0,27,0,0,0,0,0,0,0,0,0,0,0,27,14,53,6,74,0,0,1,0,0,0,148,2,1,35,0,0,0,0,0,0,38,0,186,213
HSBC-TRANSPORTATION SECURITY ADMINISTRATION,0,0,0,0,0,0,0,0,0,0,0,0,0,0,0,0,0,0,0,0,0,0,0,0,0,0,0,0,0,181,0,0,0,181,0,0,0,0,0,0,33,0,0,33,0,214,214
HSBD-BUREAU OF CUSTOMS AND BORDER PROTECTION,19,3,0,0,0,0,0,0,0,0,22,0,0,0,0,0,0,0,0,0,0,0,22,10,158,2,634,0,0,9,0,1,0,814,6,0,41,0,0,0,0,0,0,47,0,861,883
HSBE-FEDERAL LAW ENFORCEMENT TRAINING CENTERS,1,0,0,0,0,0,0,0,0,0,1,0,0,0,0,0,0,0,0,0,0,0,1,0,3,1,0,0,0,0,0,0,0,4,0,3,59,0,0,0,4,0,0,66,0,70,71
HSCA-NATIONAL PROTECTION AND PROGRAMS DIRECTORATE,0,0,0,0,0,0,0,0,0,0,0,0,0,0,0,0,0,0,0,0,0,0,0,0,0,0,0,0,0,0,0,0,0,0,0,0,0,0,0,0,0,0,0,0,0,0,0
HSCB-FEDERAL EMERGENCY MANAGEMENT AGENCY,4,2,0,0,0,0,0,0,0,0,6,0,0,0,0,0,0,0,0,0,0,0,6,0,10,2,0,0,0,0,0,1,0,13,2,0,17,4,0,0,156,0,0,179,0,192,198
HSDA-DOMESTIC NUCLEAR DETECTION OFFICE,5,1,0,0,0,0,0,0,0,0,6,0,0,0,0,0,0,0,0,0,0,0,6,2,30,0,0,0,0,0,0,1,0,33,0,0,4,0,0,0,0,0,0,4,0,37,43
HSFA-OFFICE OF THE UNDER SECRETARY FOR SCIENCE AND TECHNOLOGY,3,0,0,0,0,0,0,0,0,0,3,0,0,0,0,0,0,0,0,0,0,0,3,1,3,0,0,0,0,0,0,0,0,4,1,0,4,0,0,0,1,0,0,6,0,10,13
HT00-HARRY S. TRUMAN SCHOLARSHIP FOUNDATION,0,0,0,0,0,0,0,0,0,0,0,0,0,0,0,0,0,0,0,0,0,0,0,0,0,0,0,0,0,0,0,0,0,0,0,0,0,0,0,0,0,0,0,0,0,0,0
HU**-UNSPECIFIED,0,0,0,0,0,0,0,0,0,0,0,0,0,0,0,0,0,0,0,0,0,0,0,0,0,0,0,0,0,0,0,0,0,0,0,0,0,0,0,0,0,0,0,0,0,0,0
HU01-OFFICE OF THE SENIOR COORDINATOR FOR NEW ENGLAND,0,0,0,0,0,0,0,0,0,0,0,0,0,0,0,0,0,0,0,0,0,0,0,0,1,1,0,0,0,0,0,0,0,2,0,1,6,0,0,0,0,0,0,7,0,9,9
HU02-OFFICE OF THE SENIOR COORDINATOR FOR NEW YORK/NEW JERSEY,0,0,0,0,0,0,0,0,0,0,0,0,0,0,0,0,0,0,0,0,0,0,0,0,1,0,0,0,0,0,0,0,0,1,0,0,6,0,0,0,0,0,0,6,0,7,7
HU03-OFFICE OF THE SENIOR COORDINATOR FOR MID-ATLANTIC,0,1,0,0,0,0,0,0,0,0,1,0,0,0,0,0,0,0,0,0,0,0,1,0,0,0,0,0,0,0,0,0,0,0,0,0,14,0,0,0,0,0,0,14,0,14,15
HU04-OFFICE OF THE SENIOR COORDINATOR FOR SOUTHEAST/CARIBBEAN,0,0,0,0,0,0,0,0,0,0,0,0,0,0,0,0,0,0,0,0,0,0,0,0,1,0,1,0,0,0,0,0,0,2,0,0,16,0,0,0,0,0,0,16,0,18,18
HU05-OFFICE OF THE SENIOR COORDINATOR FOR MIDWEST,0,0,0,0,0,0,0,0,0,0,0,0,0,0,0,0,0,0,0,0,0,0,0,0,1,1,0,0,0,0,0,0,0,2,0,0,9,0,0,0,0,0,0,9,0,11,11
HU06-OFFICE OF THE SENIOR COORDINATOR FOR SOUTHWEST,0,0,0,0,0,0,0,0,0,0,0,0,0,0,0,0,0,0,0,0,0,0,0,0,0,0,0,0,0,0,0,0,0,0,0,0,13,0,0,0,0,0,0,13,0,13,13
HU07-OFFICE OF THE SENIOR COORDINATOR FOR GREAT PLAINS,0,0,0,0,0,0,0,0,0,0,0,0,0,0,0,0,0,0,0,0,0,0,0,0,0,0,0,0,0,0,0,0,0,0,0,0,7,0,0,0,0,0,0,7,0,7,7
HU08-OFFICE OF THE SENIOR COORDINATOR FOR ROCKY MOUNTAINS,0,0,0,0,0,0,0,0,0,0,0,0,0,0,0,0,0,0,0,0,0,0,0,0,0,0,0,0,0,0,0,0,0,0,0,0,8,0,0,0,0,0,0,8,0,8,8
HU09-OFFICE OF THE SENIOR COORDINATOR FOR PACIFIC/HAWAII,0,0,0,0,0,0,0,0,0,0,0,0,0,0,0,0,0,0,0,0,0,0,0,0,0,0,0,0,0,0,0,0,0,0,0,0,8,0,0,0,0,0,0,8,0,8,8
HU10-OFFICE OF THE SENIOR COORDINATOR FOR NORTHWEST/ALASKA,0,0,0,0,0,0,0,0,0,0,0,0,0,0,0,0,0,0,0,0,0,0,0,0,1,0,0,0,0,0,0,0,0,1,0,0,5,0,0,0,0,0,0,5,0,6,6
HUAA-OFFICE OF THE SECRETARY OF HOUSING AND URBAN DEVELOPMENT,0,0,0,0,0,0,0,0,0,0,0,0,0,0,0,0,0,0,0,0,0,0,0,0,0,0,0,0,0,0,0,0,0,0,0,1,0,2,0,0,0,0,0,3,0,3,3
HUBB-ASSISTANT SECRETARY FOR ADMINISTRATION,1,0,0,0,0,0,0,0,0,0,1,0,0,0,0,0,0,0,0,0,0,0,1,0,0,1,0,0,0,0,0,0,0,1,0,0,59,1,0,0,0,0,0,60,0,61,62
HUCC-OFFICE OF GENERAL COUNSEL,0,0,0,0,0,0,0,0,0,0,0,0,0,0,0,0,0,0,0,0,0,0,0,0,0,0,0,0,0,0,0,0,0,0,0,0,5,0,0,0,0,0,0,5,0,5,5
HUDD-ASSISTANT SECRETARY FOR COMMUNITY PLANNING AND DEVELOPMENT,0,0,0,0,0,0,0,0,0,0,0,0,0,0,0,0,0,0,0,0,0,0,0,0,5,1,0,0,0,0,0,0,0,6,0,0,14,0,0,1,0,0,0,15,0,21,21
HUEE-ASSISTANT SECRETARY FOR FAIR HOUSING AND EQUAL OPPORTUNITY,0,0,0,0,0,0,0,0,0,0,0,0,0,0,0,0,0,0,0,0,0,0,0,0,0,0,0,0,0,0,0,0,0,0,0,0,6,0,0,0,0,0,0,6,0,6,6
HUFF-OFFICE OF THE CHIEF FINANCIAL OFFICER,0,0,0,0,0,0,0,0,0,0,0,0,0,0,0,0,0,0,0,0,0,0,0,0,0,0,0,0,0,0,0,0,0,0,0,0,5,0,0,0,0,0,0,5,0,5,5
HUFH-OFFICE OF FEDERAL HOUSING ENTERPRISE OVERSIGHT,0,0,0,0,0,0,0,0,0,0,0,0,0,0,0,0,0,0,0,0,0,0,0,0,0,1,0,0,0,0,0,0,0,1,0,0,6,0,0,0,0,0,0,6,0,7,7
HUGG-OFFICE OF INSPECTOR GENERAL,0,0,0,0,0,0,0,0,0,0,0,0,0,0,0,0,0,0,0,0,0,0,0,0,0,0,5,0,0,0,0,0,0,5,0,0,6,0,0,0,0,0,0,6,0,11,11
HUII-OFFICE OF DEPARTMENTAL OPERATIONS AND COORDINATION,0,0,0,0,0,0,0,0,0,0,0,0,0,0,0,0,0,0,0,0,0,0,0,0,0,0,0,0,0,0,0,0,0,0,0,0,0,0,0,0,0,0,0,0,0,0,0
HUJJ-ASSISTANT SECRETARY FOR CONGRESSIONAL AND INTERGOVERNMENTAL RELATIONS,0,0,0,0,0,0,0,0,0,0,0,0,0,0,0,0,0,0,0,0,0,0,0,0,0,0,0,0,0,0,0,0,0,0,0,0,11,0,0,0,0,0,0,11,0,11,11
HUKA-CENTER FOR FAITH-BASED AND COMMUNITY INITIATIVES,0,0,0,0,0,0,0,0,0,0,0,0,0,0,0,0,0,0,0,0,0,0,0,0,0,0,0,0,0,0,0,0,0,0,0,0,1,0,0,0,0,0,0,1,0,1,1
HUKK-OFFICE OF FIELD POLICY AND MANAGEMENT,0,0,0,0,0,0,0,0,0,0,0,0,0,0,0,0,0,0,0,0,0,0,0,0,0,0,0,0,0,0,0,0,0,0,0,0,3,0,0,0,0,0,0,3,0,3,3
HULL-OFFICE OF HEALTHY HOMES AND LEAD HAZARD CONTROL,0,0,0,0,0,0,0,0,0,0,0,0,0,0,0,0,0,0,0,0,0,0,0,0,0,0,0,0,0,0,0,0,0,0,0,0,13,0,0,0,0,0,0,13,0,13,13
HUMM-ASSISTANT SECRETARY FOR HOUSING--FEDERAL HOUSING COMMISSIONER,0,0,0,0,0,0,0,0,0,0,0,0,0,0,0,0,0,0,0,0,0,0,0,0,0,0,0,0,0,0,0,0,0,0,0,0,12,0,0,0,0,0,0,12,0,12,12
HUNN-OFFICE OF THE CHIEF PROCUREMENT OFFICER,0,0,0,0,0,0,0,0,0,0,0,0,0,0,0,0,0,0,0,0,0,0,0,0,1,0,0,0,0,0,0,0,0,1,0,0,3,0,0,0,0,0,0,3,0,4,4
HUPP-ASSISTANT SECRETARY FOR PUBLIC AND INDIAN HOUSING,0,0,0,0,0,0,0,0,0,0,0,0,0,0,0,0,0,0,0,0,0,0,0,0,1,1,0,0,0,0,0,0,0,2,0,0,19,4,0,1,0,0,0,24,0,26,26
HUQQ-OFFICE OF THE CHIEF INFORMATION OFFICER,0,0,0,0,0,0,0,0,0,0,0,0,0,0,0,0,0,0,0,0,0,0,0,0,1,0,0,0,0,0,0,0,0,1,0,0,24,0,0,0,0,0,0,24,0,25,25
HURR-ASSISTANT SECRETARY FOR POLICY DEVELOPMENT AND RESEARCH,1,0,0,0,0,0,0,0,0,0,1,0,0,0,0,0,0,0,0,0,0,0,1,0,0,0,0,0,0,0,0,0,0,0,0,0,7,1,0,0,0,0,0,8,0,8,9
HUTT-GOVERNMENT NATIONAL MORTGAGE ASSOCIATION (GINNIE MAE),0,0,0,0,0,0,0,0,0,0,0,0,0,0,0,0,0,0,0,0,0,0,0,0,0,0,0,0,0,0,0,0,0,0,0,0,0,0,0,0,0,0,0,0,0,0,0
HUUU-OFFICE OF DEPARTMENTAL EQUAL EMPLOYMENT OPPORTUNITY,0,0,0,0,0,0,0,0,0,0,0,0,0,0,0,0,0,0,0,0,0,0,0,0,0,0,0,0,0,0,0,0,0,0,0,0,2,0,0,0,0,0,0,2,0,2,2
HUWW-ASSISTANT SECRETARY FOR PUBLIC AFFAIRS,0,0,0,0,0,0,0,0,0,0,0,0,0,0,0,0,0,0,0,0,0,0,0,0,0,0,0,0,0,0,0,0,0,0,0,0,2,1,0,0,0,0,0,3,0,3,3
HUXX-OFFICE OF STRATEGIC PLANNING AND MANAGEMENT,0,0,0,0,0,0,0,0,0,0,0,0,0,0,0,0,0,0,0,0,0,0,0,0,0,0,0,0,0,0,0,0,0,0,0,0,0,0,0,0,0,0,0,0,0,0,0
HUYY-OFFICE OF SUSTAINABLE HOUSING AND COMMUNTIES,0,0,0,0,0,0,0,0,0,0,0,0,0,0,0,0,0,0,0,0,0,0,0,0,0,0,0,0,0,0,0,0,0,0,0,0,0,0,0,0,0,0,0,0,0,0,0
HW00-U.S. INTERAGENCY COUNCIL ON HOMELESSNESS,0,0,0,0,0,0,0,0,0,0,0,0,0,0,0,0,0,0,0,0,0,0,0,0,0,0,0,0,0,0,0,0,0,0,0,0,0,0,0,0,0,0,0,0,0,0,0
IB00-BROADCASTING BOARD OF GOVERNORS,1,0,0,0,0,0,0,0,0,0,1,0,0,0,0,0,0,0,0,0,0,0,1,2,7,0,0,0,0,0,1,0,0,10,0,0,3,0,0,0,3,0,0,6,0,16,17
IF00-INTER-AMERICAN FOUNDATION,0,0,0,0,0,0,0,0,0,0,0,0,0,0,0,0,0,0,0,0,0,0,0,0,0,0,0,0,0,0,0,0,0,0,0,0,0,0,0,0,0,0,0,0,0,0,0
IG00-COUNCIL OF THE INSPECTORS GENERAL ON INTEGRITY AND EFFICIENCY,0,0,0,0,0,0,0,0,0,0,0,0,0,0,0,0,0,0,0,0,0,0,0,0,0,0,0,0,0,0,0,0,0,0,0,0,0,0,0,0,0,0,0,0,0,0,0
IN01-OFFICE OF THE SECRETARY OF THE INTERIOR,7,1,0,0,0,0,0,0,0,0,8,0,0,0,0,0,0,0,0,0,0,0,8,2,13,1,1,0,0,1,0,4,0,22,0,1,13,1,0,1,0,0,0,16,0,38,46
IN05-BUREAU OF LAND MANAGEMENT,7,2,0,0,0,0,0,0,0,0,9,0,0,0,0,0,0,0,0,0,0,0,9,10,37,2,24,0,0,5,0,0,0,78,17,304,218,0,0,0,1,0,0,540,0,618,627
IN06-INDIAN AFFAIRS,2,1,0,0,0,0,0,0,0,0,3,0,0,0,0,0,0,0,0,0,0,0,3,4,1,39,0,0,0,0,0,0,0,44,1,35,3,0,0,0,17,0,0,56,0,100,103
IN07-BUREAU OF RECLAMATION,3,0,0,0,0,0,0,0,0,0,3,0,0,0,0,0,0,0,0,0,0,0,3,7,18,1,17,0,0,0,0,0,0,43,9,11,46,0,0,1,0,0,0,67,0,110,113
IN08-GEOLOGICAL SURVEY,1,2,0,0,0,0,0,0,0,0,3,0,0,0,0,0,0,0,0,0,0,0,3,1,11,0,13,0,0,0,0,0,0,25,27,46,116,0,0,0,0,0,0,189,0,214,217
IN10-NATIONAL PARK SERVICE,9,4,0,0,0,0,0,0,0,0,13,0,0,0,0,0,0,0,0,0,0,0,13,11,32,0,11,0,0,0,0,0,0,54,1054,139,999,0,0,0,36,0,0,2228,0,2282,2295
IN15-U.S. FISH AND WILDLIFE SERVICE,4,2,0,0,0,0,0,0,0,0,6,0,0,0,0,0,0,0,0,0,0,0,6,4,27,0,20,0,0,0,0,0,0,51,103,63,212,0,0,0,2,0,0,380,0,431,437
IN21-OFFICE OF THE SOLICITOR,1,0,0,0,0,0,0,0,0,0,1,0,0,0,0,0,0,0,0,0,0,0,1,0,0,0,0,0,0,0,0,1,0,1,0,2,1,0,0,1,0,0,0,4,0,5,6
"IN22-OFFICE OF SURFACE MINING, RECLAMATION AND ENFORCEMENT",0,0,0,0,0,0,0,0,0,0,0,0,0,0,0,0,0,0,0,0,0,0,0,0,0,0,1,0,0,0,0,0,0,1,0,0,2,0,0,0,0,0,0,2,0,3,3
"IN23-BUREAU OF OCEAN ENERGY MANAGEMENT, REGULATION, AND ENFORCEMENT",1,0,0,0,0,0,0,0,0,0,1,0,0,0,0,0,0,0,0,0,0,0,1,1,7,0,4,0,0,0,0,0,0,12,0,0,8,0,0,0,0,0,0,8,0,20,21
IN24-OFFICE OF THE INSPECTOR GENERAL,0,0,0,0,0,0,0,0,0,0,0,0,0,0,0,0,0,0,0,0,0,0,0,0,0,0,2,0,0,0,0,0,0,2,1,0,2,0,0,0,0,0,0,3,0,5,5
IN26-BUREAU OF SAFETY AND ENVIRONMENTAL ENFORCEMENT,0,0,0,0,0,0,0,0,0,0,0,0,0,0,0,0,0,0,0,0,0,0,0,0,0,0,0,0,0,0,0,0,0,0,0,0,0,0,0,0,0,0,0,0,0,0,0
IN27-BUREAU OF OCEAN ENERGY MANAGEMENT,0,0,0,0,0,0,0,0,0,0,0,0,0,0,0,0,0,0,0,0,0,0,0,0,0,0,0,0,0,0,0,0,0,0,0,0,0,0,0,0,0,0,0,0,0,0,0
JL03-U.S. TAX COURT,0,0,0,0,0,0,0,0,0,0,0,0,0,0,0,0,0,0,0,0,0,0,0,0,0,0,0,0,0,0,0,0,0,0,0,0,0,0,0,0,0,0,0,0,0,0,0
KS00-CORPORATION FOR NATIONAL AND COMMUNITY SERVICE,0,0,0,0,0,0,0,0,0,0,0,0,0,0,0,0,0,0,0,0,0,0,0,0,0,0,0,0,0,5,0,0,0,5,0,5,0,0,0,0,21,0,0,26,0,31,31
LF00-FEDERAL ELECTION COMMISSION,0,0,0,0,0,0,0,0,0,0,0,0,0,0,0,0,0,0,0,0,0,0,0,0,0,0,0,0,0,3,0,0,0,3,0,0,0,0,0,0,1,0,0,1,0,4,4
LP00-GOVERNMENT PRINTING OFFICE,0,0,0,0,0,0,0,0,0,0,0,0,0,0,0,0,0,0,0,0,0,0,0,0,3,0,0,0,0,0,0,0,0,3,1,0,12,0,0,0,0,0,0,13,0,16,16
LT00-U.S. TAX COURT,0,0,0,0,0,0,0,0,0,0,0,0,0,0,0,0,0,0,0,0,0,0,0,0,5,0,0,0,0,0,0,0,0,5,0,3,2,0,0,0,0,0,0,5,0,10,10
MA00-MARINE MAMMAL COMMISSION,0,0,0,0,0,0,0,0,0,0,0,0,0,0,0,0,0,0,0,0,0,0,0,0,1,0,0,0,0,0,0,0,0,1,0,0,0,0,0,0,0,0,0,0,0,1,1
MC00-FEDERAL MARITIME COMMISSION,0,0,0,0,0,0,0,0,0,0,0,0,0,0,0,0,0,0,0,0,0,0,0,0,2,0,0,0,0,0,0,0,0,2,0,0,6,0,0,0,0,0,0,6,0,8,8
MI00-MILLENNIUM CHALLENGE CORPORATION,2,0,0,0,0,0,0,0,0,0,2,0,0,0,0,0,0,0,0,0,0,0,2,0,2,0,0,0,0,0,0,0,0,2,0,0,0,0,0,0,0,0,0,0,0,2,4
NF00-NATIONAL SCIENCE FOUNDATION,5,1,0,0,0,0,0,0,0,0,6,0,0,0,0,0,0,0,0,0,0,0,6,2,2,0,1,0,0,0,0,0,0,5,0,0,15,0,0,0,11,1,0,27,0,32,38
NK00-NATIONAL COUNCIL ON DISABILITY,0,0,0,0,0,0,0,0,0,0,0,0,0,0,0,0,0,0,0,0,0,0,0,0,0,0,0,0,0,0,0,0,0,0,0,0,0,0,0,0,0,0,0,0,0,0,0
NL00-NATIONAL LABOR RELATIONS BOARD,0,0,0,0,0,0,0,0,0,0,0,0,0,0,0,0,0,0,0,0,0,0,0,1,3,1,8,0,0,0,0,0,0,13,0,0,9,0,0,0,0,0,0,9,0,22,22
NM00-NATIONAL MEDIATION BOARD,0,0,0,0,0,0,0,0,0,0,0,0,0,0,0,0,0,0,0,0,0,0,0,0,0,0,0,0,0,0,0,0,0,0,0,0,0,0,0,0,0,0,0,0,0,0,0
"NN10-HEADQUARTERS, NASA",5,0,0,0,0,0,0,0,0,0,5,0,0,0,0,0,0,0,0,0,0,0,5,2,1,0,1,0,0,0,0,0,0,4,0,0,1,0,0,0,9,0,0,10,0,14,19
NN21-AMES RESEARCH CENTER,0,0,0,0,0,0,0,0,0,0,0,0,0,0,0,0,0,0,0,0,0,0,0,0,0,0,0,0,0,0,0,0,0,0,0,0,0,0,0,0,0,0,0,0,0,0,0
NN22-JOHN GLENN RESEARCH CENTER AT LEWIS FIELD,1,0,0,0,0,0,0,0,0,0,1,0,0,0,0,0,0,0,0,0,0,0,1,0,0,0,10,0,0,0,0,0,0,10,0,0,0,0,0,0,0,0,0,0,0,10,11
NN23-LANGLEY RESEARCH CENTER,1,0,0,0,0,0,0,0,0,0,1,0,0,0,0,0,0,0,0,0,0,0,1,0,0,0,6,0,0,0,0,0,0,6,5,0,0,0,0,0,0,0,0,5,0,11,12
NN24-DRYDEN FLIGHT RESEARCH CENTER,0,0,0,0,0,0,0,0,0,0,0,0,0,0,0,0,0,0,0,0,0,0,0,0,0,0,1,0,0,0,0,0,0,1,1,0,1,0,0,0,0,0,0,2,0,3,3
NN51-GODDARD SPACE FLIGHT CENTER,1,0,0,0,0,0,0,0,0,0,1,0,0,0,0,0,0,0,0,0,0,0,1,0,2,1,2,0,0,0,0,0,0,5,9,0,5,0,0,0,0,0,0,14,0,19,20
NN62-GEORGE C. MARSHALL SPACE FLIGHT CENTER,0,0,0,0,0,0,0,0,0,0,0,0,0,0,0,0,0,0,0,0,0,0,0,0,0,0,0,0,0,0,0,0,0,0,0,0,0,0,0,0,0,0,0,0,0,0,0
NN64-JOHN C. STENNIS SPACE CENTER,0,0,0,0,0,0,0,0,0,0,0,0,0,0,0,0,0,0,0,0,0,0,0,0,0,0,0,0,0,0,0,0,0,0,0,0,2,0,0,0,0,0,0,2,0,2,2
NN72-LYNDON B. JOHNSON SPACE CENTER,0,0,0,0,0,0,0,0,0,0,0,0,0,0,0,0,0,0,0,0,0,0,0,0,1,1,0,0,0,0,0,0,0,2,1,0,0,0,0,0,1,0,0,2,0,4,4
NN76-JOHN F. KENNEDY SPACE CENTER,0,0,0,0,0,0,0,0,0,0,0,0,0,0,0,0,0,0,0,0,0,0,0,0,0,0,9,0,0,0,0,0,0,9,2,0,0,0,0,0,0,0,0,2,0,11,11
NP00-NATIONAL CAPITAL PLANNING COMMISSION,0,0,0,0,0,0,0,0,0,0,0,0,0,0,0,0,0,0,0,0,0,0,0,0,0,0,0,0,0,0,0,0,0,0,0,0,0,0,0,0,0,0,0,0,0,0,0
NQ00-NATIONAL ARCHIVES AND RECORDS ADMINISTRATION,2,1,0,0,0,0,0,0,0,0,3,0,0,0,0,0,0,0,0,0,0,0,3,0,11,0,0,0,0,0,0,0,0,11,1,0,103,0,0,0,0,0,0,104,0,115,118
NS00-NATIONAL SECURITY COUNCIL,0,0,0,0,0,0,0,0,0,0,0,0,0,0,0,0,0,0,0,0,0,0,0,0,0,0,0,0,0,0,0,0,0,0,0,1,0,0,0,0,0,0,0,1,0,1,1
NU00-NUCLEAR REGULATORY COMMISSION,0,0,0,0,0,0,0,0,0,0,0,0,0,0,0,0,0,0,0,0,0,0,0,0,0,0,0,0,0,21,0,0,0,21,0,0,0,0,0,0,37,0,0,37,0,58,58
NV11-IMMEDIATE OFFICE OF THE CHIEF OF NAVAL OPERATIONS,2,1,0,0,0,0,0,0,0,0,3,0,0,0,0,0,0,0,0,0,0,0,3,1,34,2,9,0,0,6,0,0,0,52,1,12,76,0,0,0,2,0,0,91,0,143,146
"NV12-ASSISTANT FOR ADMINISTRATION, UNDER SECRETARY OF THE NAVY",5,0,0,0,0,0,0,0,0,0,5,0,0,0,0,0,0,0,0,0,0,0,5,1,10,7,14,0,0,4,0,0,0,36,0,1,12,0,0,0,0,0,0,13,0,49,54
NV14-OFFICE OF NAVAL RESEARCH,2,0,0,0,0,0,0,0,0,0,2,0,0,0,0,0,0,0,0,0,0,0,2,0,14,0,9,0,0,0,0,0,0,23,1,1,68,0,0,0,1,0,0,71,0,94,96
NV15-NAVAL INTELLIGENCE COMMAND,0,0,0,0,0,0,0,0,0,0,0,0,0,0,0,0,0,0,0,0,0,0,0,0,0,0,0,0,0,24,0,0,0,24,0,0,0,0,0,0,17,0,0,17,1,42,42
NV18-NAVAL MEDICAL COMMAND,9,1,0,0,0,0,0,0,0,0,10,0,0,0,0,0,0,0,0,0,0,0,10,7,94,1,6,0,0,19,0,0,0,127,21,20,79,0,0,0,0,0,0,120,0,247,257
NV19-NAVAL AIR SYSTEMS COMMAND,4,1,0,0,0,0,0,0,0,0,5,0,0,0,0,0,0,0,0,0,0,0,5,9,88,2,70,0,0,0,1,0,0,170,1,12,163,0,0,0,3,0,0,179,0,349,354
NV22-BUREAU OF NAVAL PERSONNEL,2,1,0,0,0,0,1,0,0,0,4,0,0,0,0,0,0,0,0,0,0,0,4,0,4,0,0,0,0,1,0,0,0,5,0,1,9,0,0,0,0,0,0,10,0,15,19
NV23-NAVAL SUPPLY SYSTEMS COMMAND,5,3,0,0,0,0,0,0,0,0,8,0,0,0,0,0,0,0,0,0,0,0,8,4,18,0,32,0,0,6,0,0,0,60,2,26,32,0,0,0,0,0,0,60,0,120,128
NV24-NAVAL SEA SYSTEMS COMMAND,6,1,0,0,0,0,0,0,0,0,7,0,0,0,0,0,0,0,0,0,0,0,7,11,203,0,85,0,0,12,0,0,0,311,2,4,160,0,0,0,0,0,0,166,0,477,484
NV25-NAVAL FACILITIES ENGINEERING COMMAND,16,2,0,0,0,0,0,0,0,0,18,0,0,0,0,0,0,0,0,0,0,0,18,11,108,2,43,0,0,6,0,0,0,170,11,29,86,0,0,0,0,0,0,126,0,296,314
NV27-U.S. MARINE CORPS,7,4,0,0,0,0,0,0,0,0,11,0,0,0,0,0,0,0,0,0,0,0,11,6,127,3,15,0,0,37,0,0,0,188,22,75,128,0,0,0,0,0,0,225,0,413,424
NV30-STRATEGIC SYSTEMS PROGRAMS OFFICE,1,0,0,0,0,0,0,0,0,0,1,0,0,0,0,0,0,0,0,0,0,0,1,1,8,0,2,0,0,0,0,0,0,11,1,0,17,0,0,0,0,0,0,18,0,29,30
NV33-MILITARY SEALIFT COMMAND,1,0,0,0,0,0,0,0,0,0,1,0,0,0,0,0,0,0,0,0,0,0,1,0,3,12,1,0,0,4,0,0,0,20,0,21,11,0,0,0,0,0,0,32,0,52,53
NV39-SPACE AND NAVAL WARFARE SYSTEMS COMMAND,3,0,0,0,0,0,1,0,0,0,4,0,0,0,0,0,0,0,0,0,0,0,4,1,32,0,28,0,0,1,0,0,0,62,2,4,32,0,0,0,0,0,0,38,0,100,104
NV41-NAVY SYSTEMS MANAGEMENT ACTIVITY,0,0,0,0,0,0,0,0,0,0,0,0,0,0,0,0,0,0,0,0,0,0,0,0,0,0,6,0,0,2,0,0,0,8,0,0,0,0,0,0,0,0,0,0,0,8,8
"NV52-COMMANDER, NAVY INSTALLATIONS",13,1,0,0,0,0,0,0,0,0,14,0,0,0,0,0,0,0,0,0,0,0,14,12,81,0,9,0,0,18,0,0,0,120,5,105,5,0,0,0,2,0,0,117,0,237,251
"NV60-U.S. ATLANTIC FLEET, COMMANDER IN CHIEF",5,0,0,0,0,0,0,0,0,0,5,0,0,0,0,0,0,0,0,0,0,0,5,5,50,0,109,0,0,26,0,0,0,190,5,0,44,0,0,0,0,0,0,49,0,239,244
NV69-NAVAL SECURITY GROUP COMMAND,0,0,0,0,0,0,0,0,0,0,0,0,0,0,0,0,0,0,0,0,0,0,0,0,0,0,0,0,0,0,0,0,0,0,0,0,0,0,0,0,0,0,0,0,0,0,0
"NV70-U.S. PACIFIC FLEET, COMMANDER IN CHIEF",1,0,0,0,0,0,0,0,0,0,1,0,0,0,0,0,0,0,0,0,0,0,1,3,19,0,50,0,0,11,0,0,0,83,1,13,21,0,0,0,0,0,0,35,0,118,119
NV72-NAVAL RESERVE FORCE,0,0,0,0,0,0,0,0,0,0,0,0,0,0,0,0,0,0,0,0,0,0,0,1,7,0,0,0,0,4,0,0,0,12,0,0,0,0,0,0,0,0,0,0,0,12,12
NV74-NAVAL SPECIAL WARFARE COMMAND,0,0,0,0,0,0,0,0,0,0,0,0,0,0,0,0,0,0,0,0,0,0,0,0,11,0,0,0,0,2,0,0,0,13,5,0,1,0,0,0,0,0,0,6,0,19,19
NV76-NAVAL EDUCATION AND TRAINING COMMAND,1,1,0,0,0,0,0,0,0,0,2,0,0,0,0,0,0,0,0,0,0,0,2,0,12,0,75,0,0,3,0,0,0,90,1,0,11,0,0,0,0,0,0,12,0,102,104
OM00-OFFICE OF PERSONNEL MANAGEMENT,7,0,0,0,0,0,0,0,0,0,7,0,0,0,0,0,0,0,0,0,0,0,7,5,2,17,8,0,0,0,0,0,0,32,2,1,28,7,0,0,0,0,0,38,0,70,77
OS00-OCCUPATIONAL SAFETY AND HEALTH REVIEW COMMISSION,0,0,0,0,0,0,0,0,0,0,0,0,0,0,0,0,0,0,0,0,0,0,0,0,0,0,0,0,0,0,0,0,0,0,0,0,0,0,0,0,0,0,0,0,0,0,0
PU00-PEACE CORPS,0,0,0,0,0,0,0,0,0,0,0,0,0,0,0,0,0,0,0,0,0,0,0,0,0,0,0,0,0,0,0,0,0,0,0,0,0,0,0,0,25,0,0,25,0,25,25
QQ00-OFFICE OF NATIONAL DRUG CONTROL POLICY,0,0,0,0,0,0,0,0,0,0,0,0,0,0,0,0,0,0,0,0,0,0,0,0,0,0,0,0,0,0,0,1,0,1,0,0,0,1,0,0,0,0,0,1,0,2,2
RE00-OFFICE OF NAVAJO AND HOPI INDIAN RELOCATION,0,0,0,0,0,0,0,0,0,0,0,0,0,0,0,0,0,0,0,0,0,0,0,1,0,0,0,0,0,0,0,0,0,1,0,0,0,0,0,0,0,0,0,0,0,1,1
RF00-FEDERAL RETIREMENT THRIFT INVESTMENT BOARD,0,0,0,0,0,0,0,0,0,0,0,0,0,0,0,0,0,0,0,0,0,0,0,0,0,0,0,0,0,0,0,0,0,0,0,0,10,0,0,0,0,0,0,10,0,10,10
RH00-ARMED FORCES RETIREMENT HOME,0,0,0,0,0,0,0,0,0,0,0,0,0,0,0,0,0,0,0,0,0,0,0,0,1,0,0,0,0,0,0,0,0,1,0,0,0,0,0,0,0,0,0,0,0,1,1
RO**-UNSPECIFIED,0,0,0,0,0,0,0,0,0,0,0,0,0,0,0,0,0,0,0,0,0,0,0,0,0,0,0,0,0,0,0,0,0,0,0,0,0,0,0,0,0,0,0,0,0,0,0
RO00-MEDICAID AND CHIP PAYMENT AND ACCESS COMMISSION,0,0,0,0,0,0,0,0,0,0,0,0,0,0,0,0,0,0,0,0,0,0,0,0,0,0,0,0,0,0,0,0,0,0,0,0,0,0,0,0,0,0,0,0,0,0,0
RR00-RAILROAD RETIREMENT BOARD,0,0,0,0,0,0,0,0,0,0,0,0,0,0,0,0,0,0,0,0,0,0,0,0,0,0,0,0,0,0,0,0,0,0,0,0,0,0,0,0,0,0,0,0,0,0,0
RS00-FEDERAL MINE SAFETY AND HEALTH REVIEW COMMISSION,0,0,0,0,0,0,0,0,0,0,0,0,0,0,0,0,0,0,0,0,0,0,0,0,0,0,0,0,0,0,0,0,0,0,0,0,0,0,0,0,0,0,0,0,0,0,0
RZ00-RECOVERY ACT ACCOUNTABILITY & TRANSPARENCY BOARD,0,0,0,0,0,0,0,0,0,0,0,0,0,0,0,0,0,0,0,0,0,0,0,0,0,0,0,0,0,0,0,0,0,0,0,0,0,0,0,0,3,0,0,3,0,3,3
SB00-SMALL BUSINESS ADMINISTRATION,2,0,0,0,0,0,0,0,0,0,2,0,0,0,0,0,0,0,0,0,0,0,2,2,4,3,0,0,0,0,0,0,0,9,93,46,39,2,0,0,1,0,0,181,0,190,192
SE00-SECURITIES AND EXCHANGE COMMISSION,1,1,0,0,0,0,0,0,0,0,2,0,0,0,0,0,0,0,0,0,0,0,2,0,3,3,0,0,0,0,0,0,0,6,0,2,53,1,0,0,0,0,0,56,0,62,64
SK00-CONSUMER PRODUCT SAFETY COMMISSION,2,1,0,0,0,0,0,0,0,0,3,0,0,0,0,0,0,0,0,0,0,0,3,0,3,1,0,0,0,0,0,0,0,4,0,0,8,1,0,1,0,0,0,10,0,14,17
SM01-NATIONAL GALLERY OF ART,0,0,0,0,0,0,0,0,0,0,0,0,0,0,0,0,0,0,0,0,0,0,0,0,5,1,0,0,0,0,0,0,0,6,0,0,0,0,0,0,0,0,0,0,0,6,6
SM02-WOODROW WILSON INTERNATIONAL CENTER FOR SCHOLARS,0,0,0,0,0,0,0,0,0,0,0,0,0,0,0,0,0,0,0,0,0,0,0,0,0,0,0,0,0,0,0,0,0,0,0,1,0,0,0,0,0,0,0,1,0,1,1
SM03-SMITHSONIAN INSTITUTION (EXCEPT UNITS ADMINISTERED UNDER SEPARATE BOARDS OF TRUSTEES),2,0,0,0,0,0,0,0,0,0,2,0,0,0,0,0,0,0,0,0,0,0,2,0,20,0,0,0,0,0,0,0,0,20,3,1,19,0,0,0,0,0,0,23,0,43,45
SM04-JOHN F. KENNEDY CENTER FOR THE PERFORMING ARTS,0,0,0,0,0,0,0,0,0,0,0,0,0,0,0,0,0,0,0,0,0,0,0,0,0,0,0,0,0,0,0,0,0,0,0,0,0,0,0,0,0,0,0,0,0,0,0
SS00-SELECTIVE SERVICE SYSTEM,0,0,0,0,0,0,0,0,0,0,0,0,0,0,0,0,0,0,0,0,0,0,0,1,1,0,0,0,0,0,0,0,0,2,0,1,0,0,0,0,0,0,0,1,0,3,3
ST00-DEPARTMENT OF STATE,4,1,0,0,0,0,0,0,0,0,5,0,0,0,0,0,0,0,0,0,0,0,5,2,16,1,2,0,0,8,1,0,0,30,16,20,282,5,0,4,8,0,0,335,1,366,371
SZ00-SOCIAL SECURITY ADMINISTRATION,2,0,0,0,0,0,0,0,0,0,2,0,0,0,0,0,0,0,0,0,0,0,2,38,212,121,149,0,0,29,0,0,0,549,329,53,1050,0,0,0,9,0,0,1441,0,1990,1992
TB00-NATIONAL TRANSPORTATION SAFETY BOARD,1,0,0,0,0,0,0,0,0,0,1,0,0,0,0,0,0,0,0,0,0,0,1,0,1,0,0,0,0,0,0,0,0,1,0,0,8,0,0,0,1,0,0,9,0,10,11
TC00-U.S. INTERNATIONAL TRADE COMMISSION,0,0,0,0,0,0,0,0,0,0,0,0,0,0,0,0,0,0,0,0,0,0,0,0,0,1,0,0,0,0,0,0,0,1,0,0,23,0,0,0,0,0,0,23,0,24,24
TD01-OFFICE OF THE SECRETARY OF TRANSPORTATION,1,0,0,0,0,0,0,0,0,0,1,0,0,0,0,0,0,0,0,0,0,0,1,3,6,2,0,0,0,0,0,0,0,11,0,0,16,0,0,1,0,0,0,17,0,28,29
TD03-FEDERAL AVIATION ADMINISTRATION,0,0,0,0,0,0,0,0,0,0,0,0,0,0,0,0,0,0,0,0,0,0,0,0,0,0,0,0,0,218,0,0,0,218,0,0,0,0,0,1,271,0,0,272,0,490,490
TD04-FEDERAL HIGHWAY ADMINISTRATION,1,1,0,0,0,0,0,0,0,0,2,0,0,0,0,0,0,0,0,0,0,0,2,1,10,1,12,0,0,0,0,2,0,26,6,0,19,0,0,0,0,0,0,25,0,51,53
TD05-FEDERAL RAILROAD ADMINISTRATION,0,0,0,0,0,0,0,0,0,0,0,0,0,0,0,0,0,0,0,0,0,0,0,0,5,1,1,0,0,0,0,0,0,7,0,0,0,0,0,0,0,0,0,0,0,7,7
TD06-SAINT LAWRENCE SEAWAY DEVELOPMENT CORPORATION,0,0,0,0,0,0,0,0,0,0,0,0,0,0,0,0,0,0,0,0,0,0,0,0,2,0,0,0,0,0,0,0,0,2,2,0,0,0,0,0,0,0,0,2,0,4,4
TD09-FEDERAL TRANSIT ADMINISTRATION,1,0,0,0,0,0,0,0,0,0,1,0,0,0,0,0,0,0,0,0,0,0,1,0,1,0,0,0,0,0,0,0,0,1,1,1,18,1,0,0,0,0,0,21,0,22,23
TD10-NATIONAL HIGHWAY TRAFFIC SAFETY ADMINISTRATION,0,0,0,0,0,0,0,0,0,0,0,0,0,0,0,0,0,0,0,0,0,0,0,0,5,0,0,0,0,0,0,0,0,5,0,0,5,0,0,0,0,0,0,5,0,10,10
TD11-RESEARCH AND INNOVATIVE TECHNONOGY ADMINSTRATION,0,0,0,0,0,0,0,0,0,0,0,0,0,0,0,0,0,0,0,0,0,0,0,0,0,0,7,0,0,0,0,0,0,7,0,0,1,0,0,0,0,0,0,1,0,8,8
TD12-OFFICE OF INSPECTOR GENERAL,1,0,0,0,0,0,0,0,0,0,1,0,0,0,0,0,0,0,0,0,0,0,1,1,2,1,8,0,0,0,0,0,0,12,0,1,1,0,0,0,0,0,0,2,0,14,15
TD13-MARITIME ADMINISTRATION,0,0,0,0,0,0,0,0,0,0,0,0,0,0,0,0,0,0,0,0,0,0,0,2,1,0,0,0,0,0,0,0,0,3,0,0,0,0,0,0,0,0,0,0,0,3,3
TD15-SURFACE TRANSPORTATION BOARD,0,0,0,0,0,0,0,0,0,0,0,0,0,0,0,0,0,0,0,0,0,0,0,0,1,0,0,0,0,0,0,0,0,1,0,0,0,0,0,0,1,0,0,1,0,2,2
TD16-PIPELINE AND HAZARDOUS MATERIALS SAFETY ADMINISTRATION,0,0,0,0,0,0,0,0,0,0,0,0,0,0,0,0,0,0,0,0,0,0,0,0,1,0,0,0,0,0,0,0,0,1,0,0,1,0,0,0,0,0,0,1,0,2,2
TD17-FEDERAL MOTOR CARRIER SAFETY ADMINISTRATION,4,1,0,0,0,0,0,0,0,0,5,0,0,0,0,0,0,0,0,0,0,0,5,0,8,1,5,0,0,0,0,0,0,14,0,0,1,0,0,0,0,0,0,1,0,15,20
TN00-OFFICE OF THE U.S. TRADE REPRESENTATIVE,0,0,0,0,0,0,0,0,0,0,0,0,0,0,0,0,0,0,0,0,0,0,0,0,0,0,0,0,0,0,0,0,0,0,0,0,0,2,0,0,1,0,0,3,0,3,3
TR**-UNSPECIFIED,1,0,0,0,0,0,0,0,0,0,1,0,0,0,0,0,0,0,0,0,0,0,1,2,3,0,0,0,0,0,0,0,0,5,4,0,0,0,0,0,0,0,0,4,0,9,10
TR35-OFFICE OF THRIFT SUPERVISION,0,0,0,0,0,0,0,0,0,0,0,0,0,0,0,0,0,0,0,0,0,0,0,0,0,0,2,0,0,0,0,0,0,2,1,0,12,0,0,0,0,0,0,13,0,15,15
TR36-SPECIAL INSPECTOR GENERAL FOR THE TROUBLED ASSETS RELIEF PROGRAM (TARP),0,0,0,0,0,0,0,0,0,0,0,0,0,0,0,0,0,0,0,0,0,0,0,0,0,0,0,0,0,0,0,0,0,0,0,0,0,0,0,0,0,0,0,0,0,0,0
TR40-ALCOHOL AND TOBACCO TAX AND TRADE BUREAU,0,0,0,0,0,0,0,0,0,0,0,0,0,0,0,0,0,0,0,0,0,0,0,0,0,0,0,0,0,0,0,0,0,0,0,0,8,0,0,0,0,0,0,8,0,8,8
TR91-DEPARTMENTAL OFFICES,3,0,0,0,0,0,0,0,0,0,3,0,0,0,0,0,0,0,0,0,0,0,3,3,7,5,7,0,0,0,1,4,0,27,14,1,15,6,0,0,0,0,0,36,0,63,66
TR93-INTERNAL REVENUE SERVICE,4,0,0,0,0,0,0,0,0,0,4,0,0,0,0,0,0,0,0,0,0,0,4,7,1227,77,323,0,0,0,1,0,0,1635,10,13,194,0,0,0,1,0,0,218,0,1853,1857
TR95-OFFICE OF INSPECTOR GENERAL,0,0,0,0,0,0,0,0,0,0,0,0,0,0,0,0,0,0,0,0,0,0,0,0,1,0,0,0,0,0,0,0,0,1,0,0,2,0,0,0,0,0,0,2,0,3,3
TRAA-FINANCIAL MANAGEMENT SERVICE,0,0,0,0,0,0,0,0,0,0,0,0,0,0,0,0,0,0,0,0,0,0,0,0,2,0,9,0,0,0,0,0,0,11,1,1,9,0,0,0,1,0,0,12,0,23,23
TRAB-BUREAU OF THE PUBLIC DEBT,1,0,0,0,0,0,0,0,0,0,1,0,0,0,0,0,0,0,0,0,0,0,1,0,1,0,4,0,0,2,0,0,0,7,0,0,5,0,0,0,0,0,0,5,0,12,13
TRAD-U.S. MINT,0,0,0,0,0,0,0,0,0,0,0,0,0,0,0,0,0,0,0,0,0,0,0,0,1,0,0,0,0,0,0,0,0,1,1,0,0,0,0,0,0,0,0,1,0,2,2
TRAF-FINANCIAL CRIMES ENFORCEMENT NETWORK,0,0,0,0,0,0,0,0,0,0,0,0,0,0,0,0,0,0,0,0,0,0,0,0,0,0,0,0,0,0,0,0,0,0,0,0,8,0,0,0,0,0,0,8,0,8,8
TRAI-BUREAU OF ENGRAVING AND PRINTING,0,0,0,0,0,0,0,0,0,0,0,0,0,0,0,0,0,0,0,0,0,0,0,0,1,0,0,0,0,0,0,0,0,1,0,0,8,0,0,0,0,0,0,8,0,9,9
TRAJ-OFFICE OF THE COMPTROLLER OF THE CURRENCY,0,0,0,0,0,0,0,0,0,0,0,0,0,0,0,0,0,0,0,0,0,0,0,0,1,0,60,0,0,0,0,0,0,61,0,1,28,0,0,0,0,0,0,29,0,90,90
TRFD-BUREAU OF THE FISCAL SERVICE,0,0,0,0,0,0,0,0,0,0,0,0,0,0,0,0,0,0,0,0,0,0,0,0,0,0,0,0,0,0,0,0,0,0,0,0,0,0,0,0,0,0,0,0,0,0,0
TRTG-OFFICE OF THE INSPECTOR GENERAL FOR TAX ADMINISTRATION,1,0,0,0,0,0,0,0,0,0,1,0,0,0,0,0,0,0,0,0,0,0,1,0,0,1,5,0,0,0,0,0,0,6,1,2,1,0,0,0,0,0,0,4,0,10,11
TS00-OFFICE OF SCIENCE AND TECHNOLOGY POLICY,0,0,0,0,0,0,0,0,0,0,0,0,0,0,0,0,0,0,0,0,0,0,0,0,0,0,0,0,0,0,0,0,0,0,0,0,0,0,0,0,0,0,0,0,0,0,0
UJ00-JAPAN-UNITED STATES FRIENDSHIP COMMISSION,0,0,0,0,0,0,0,0,0,0,0,0,0,0,0,0,0,0,0,0,0,0,0,0,0,0,0,0,0,0,0,0,0,0,0,0,0,0,0,0,0,0,0,0,0,0,0
UT00-UTAH RECLAMATION MITIGATION AND CONSERVATION COMMISSION,0,0,0,0,0,0,0,0,0,0,0,0,0,0,0,0,0,0,0,0,0,0,0,0,0,0,0,0,0,0,0,0,0,0,0,0,0,0,0,0,0,0,0,0,0,0,0
VA**-UNSPECIFIED,0,0,0,0,0,0,0,0,0,0,0,0,0,0,0,0,0,0,0,0,0,0,0,0,0,0,0,0,0,0,0,0,0,0,0,0,0,0,0,0,0,0,0,0,0,0,0
VAAA-OFFICE OF THE SECRETARY,0,0,0,0,0,0,0,0,0,0,0,0,0,0,0,0,0,0,0,0,0,0,0,0,0,0,0,0,0,1,0,0,0,1,0,0,1,0,0,0,0,0,0,1,0,2,2
VAAD-BOARD OF VETERANS APPEALS,1,0,0,0,0,0,0,0,0,0,1,0,0,0,0,0,0,0,0,0,0,0,1,0,0,3,0,0,0,0,0,0,0,3,0,1,3,0,0,0,0,0,0,4,0,7,8
VAAE-GENERAL COUNSEL,0,0,0,0,0,0,0,0,0,0,0,0,0,0,0,0,0,0,0,0,0,0,0,0,0,1,0,0,0,0,0,0,0,1,0,0,0,0,0,0,0,0,0,0,0,1,1
VAAF-INSPECTOR GENERAL,1,0,0,0,0,0,0,0,0,0,1,0,0,0,0,0,0,0,0,0,0,0,1,0,2,0,2,0,0,0,0,0,0,4,0,0,0,0,0,0,0,0,0,0,0,4,5
VABA-IMMEDIATE OFFICE OF THE ASSISTANT SECRETARY FOR HUMAN RESOURCES AND ADMINISTRATION,0,0,0,0,0,0,0,0,0,0,0,0,0,0,0,0,0,0,0,0,0,0,0,0,0,0,0,0,0,0,0,0,0,0,0,0,0,0,0,0,0,0,0,0,0,0,0
VABC-ASSISTANT SECRETARY FOR HUMAN RESOURCES MANAGEMENT,0,0,0,0,0,0,0,0,0,0,0,0,0,0,0,0,0,0,0,0,0,0,0,0,0,0,0,0,0,0,0,0,0,0,0,0,0,0,0,0,0,0,0,0,0,0,0
VABD-ASSISTANT SECRETARY FOR DIVERSITY & INCLUSION,0,0,0,0,0,0,0,0,0,0,0,0,0,0,0,0,0,0,0,0,0,0,0,0,0,0,0,0,0,0,0,0,0,0,0,0,0,0,0,0,0,0,0,0,0,0,0
VABE-DEPUTY ASSISTANT SECRETARY FOR ADMINISTRATION,0,0,0,0,0,0,0,0,0,0,0,0,0,0,0,0,0,0,0,0,0,0,0,0,0,0,0,0,0,0,0,0,0,0,0,0,0,0,0,0,0,0,0,0,0,0,0
VABF-DEPUTY ASSISTANT SECRETARY FOR OFFICE OF RESOLUTION MANAGEMENT,0,0,0,0,0,0,0,0,0,0,0,0,0,0,0,0,0,0,0,0,0,0,0,0,0,0,0,0,0,0,0,0,0,0,0,0,7,0,0,0,1,0,0,8,0,8,8
VABG-DEPUTY ASSISTANT SECRETARY FOR CORPORATE SENIOR EXECUTIVE MANAGEMENT,0,0,0,0,0,0,0,0,0,0,0,0,0,0,0,0,0,0,0,0,0,0,0,0,0,0,0,0,0,0,0,0,0,0,0,0,0,0,0,0,0,0,0,0,0,0,0
VABH-DEPUTY ASSISTANT SECRETARY FOR LABOR MANAGEMENT RELATIONS,0,0,0,0,0,0,0,0,0,0,0,0,0,0,0,0,0,0,0,0,0,0,0,0,0,0,0,0,0,0,0,0,0,0,0,0,0,0,0,0,0,0,0,0,0,0,0
VABI-DEAN FOR VA LEARNING UNIVERSITY,0,0,0,0,0,0,0,0,0,0,0,0,0,0,0,0,0,0,0,0,0,0,0,0,0,0,0,0,0,0,0,0,0,0,0,0,0,0,0,0,0,0,0,0,0,0,0
VABJ-VETERAN EMPLOYMENT SERVICES OFFICE,0,0,0,0,0,0,0,0,0,0,0,0,0,0,0,0,0,0,0,0,0,0,0,0,0,0,0,0,0,0,0,0,0,0,0,0,0,0,0,0,0,0,0,0,0,0,0
VADA-IMMEDIATE OFFICE OF THE ASSISTANT SECRETARY FOR MANAGEMENT,0,0,0,0,0,0,0,0,0,0,0,0,0,0,0,0,0,0,0,0,0,0,0,0,0,0,0,0,0,0,0,0,0,0,0,0,0,0,0,0,0,0,0,0,0,0,0
VADC-DEPUTY ASSISTANT SECRETARY FOR BUDGET,0,0,0,0,0,0,0,0,0,0,0,0,0,0,0,0,0,0,0,0,0,0,0,0,0,0,0,0,0,0,0,0,0,0,0,0,1,0,0,0,0,0,0,1,0,1,1
VADD-DEPUTY ASSISTANT SECRETARY FOR FINANCE,1,0,0,0,0,0,0,0,0,0,1,0,0,0,0,0,0,0,0,0,0,0,1,0,2,0,0,0,0,0,0,0,0,2,3,0,1,0,0,0,0,0,0,4,0,6,7
