CM55-INTERNATIONAL TRADE ADMINISTRATION,1,0,0,0,0,0,0,0,0,1,0,0,0,0,0,0,0,0,0,0,1,0,6,0,1,0,0,0,0,0,7,1,0,0,2,0,0,0,0,3,0,10,11
CM56-PATENT AND TRADEMARK OFFICE,11,0,0,0,0,0,0,0,0,11,0,0,0,0,0,0,0,0,0,0,11,3,13,2,42,0,0,0,0,0,60,0,0,0,0,0,0,0,0,0,0,60,71
CM57-NATIONAL INSTITUTE OF STANDARDS AND TECHNOLOGY,0,0,0,0,0,0,1,0,0,1,0,0,0,0,0,0,0,0,0,0,1,1,18,0,0,0,0,0,0,0,19,5,7,0,0,0,5,0,0,17,0,36,37
CM59-MINORITY BUSINESS DEVELOPMENT AGENCY,0,0,0,0,0,0,0,0,0,0,0,0,0,0,0,0,0,0,0,0,0,0,0,0,0,0,0,0,0,0,0,0,0,0,0,0,0,0,0,0,0,0,0
CM61-NATIONAL TELECOMMUNICATIONS AND INFORMATION ADMINISTRATION,0,0,0,0,0,0,0,0,0,0,0,0,0,0,0,0,0,0,0,0,0,0,0,0,0,0,0,0,0,0,0,0,0,0,0,0,0,0,0,0,0,0,0
CM62-NATIONAL TECHNICAL INFORMATION SERVICE,2,0,0,0,0,0,0,0,0,2,0,0,0,0,0,0,0,0,0,0,2,0,0,0,0,0,0,0,0,0,0,0,0,0,0,0,0,0,0,0,0,0,2
CM63-BUREAU OF THE CENSUS,5,4,0,0,0,0,1,0,0,10,0,0,0,0,0,0,0,0,0,0,10,2,22,129,0,0,0,0,0,0,153,7,407,3,0,0,0,0,0,417,0,570,580
CM64-OFFICE OF THE INSPECTOR GENERAL,0,0,0,0,0,0,0,0,0,0,0,0,0,0,0,0,0,0,0,0,0,0,0,0,0,0,0,0,0,0,0,0,0,0,0,0,0,0,0,0,0,0,0
CM65-ECONOMICS AND STATISTICS ADMINISTRATION,0,0,0,0,0,0,0,0,0,0,0,0,0,0,0,0,0,0,0,0,0,0,0,0,0,0,0,0,0,0,0,0,0,0,0,0,0,0,0,0,0,0,0
CM67-BUREAU OF INDUSTRY AND SECURITY,2,0,0,0,0,0,0,0,0,2,0,0,0,0,0,0,0,0,0,0,2,0,1,0,0,0,0,0,0,0,1,0,0,0,0,0,0,0,0,0,0,1,3
CT00-COMMODITY FUTURES TRADING COMMISSION,1,0,0,0,0,0,0,0,0,1,0,0,0,0,0,0,0,0,0,0,1,0,0,0,0,0,0,0,0,0,0,0,0,0,0,0,0,0,0,0,0,0,1
CU00-NATIONAL CREDIT UNION ADMINISTRATION,1,0,0,0,0,0,0,0,0,1,0,0,0,0,0,0,0,0,0,0,1,0,1,0,9,0,0,0,0,0,10,0,0,0,0,0,0,0,0,0,0,10,11
CX00-NATIONAL COMMISSION ON LIBRARIES AND INFORMATION SCIENCE,0,0,0,0,0,0,0,0,0,0,0,0,0,0,0,0,0,0,0,0,0,0,0,0,0,0,0,0,0,0,0,0,0,0,0,0,0,0,0,0,0,0,0
DB00-PUBLIC INTEREST DECLASSIFICATION BOARD,0,0,0,0,0,0,0,0,0,0,0,0,0,0,0,0,0,0,0,0,0,0,0,0,0,0,0,0,0,0,0,0,0,0,0,1,0,0,0,1,0,1,1
DD01-OFFICE OF THE SECRETARY OF DEFENSE,3,0,0,0,0,0,0,0,0,3,0,0,0,0,0,0,0,0,0,0,3,2,0,1,0,0,1,1,4,0,9,0,0,0,3,1,7,0,0,11,0,20,23
DD02-ORGANIZATION OF THE JOINT CHIEFS OF STAFF,0,0,0,0,0,0,0,0,0,0,0,0,0,0,0,0,0,0,0,0,0,0,0,0,0,0,0,0,0,0,0,0,0,0,0,0,0,0,0,0,0,0,0
DD04-DEFENSE INFORMATION SYSTEMS AGENCY,13,1,0,0,0,0,0,0,0,14,0,0,0,0,0,0,0,0,0,0,14,4,19,0,10,0,1,0,0,0,34,7,0,5,0,0,2,0,0,14,0,48,62
DD06-DEFENSE SECURITY COOPERATION AGENCY,2,0,0,0,0,0,0,0,0,2,0,0,0,0,0,0,0,0,0,0,2,2,0,1,0,0,0,0,0,0,3,0,1,0,0,0,1,0,0,2,0,5,7
DD07-DEFENSE LOGISTICS AGENCY,36,8,0,0,0,0,0,0,0,44,0,0,0,0,0,0,0,0,0,0,44,9,69,0,3,0,16,1,0,0,98,10,0,0,0,0,1,0,0,11,0,109,153
DD08-U.S. COURT OF APPEALS FOR THE ARMED FORCES,0,0,0,0,0,0,0,0,0,0,0,0,0,0,0,0,0,0,0,0,0,0,0,0,0,0,0,0,0,0,0,0,1,0,0,0,0,0,0,1,0,1,1
DD09-AMERICAN FORCES INFORMATION SERVICE,1,0,0,0,0,0,0,0,0,1,0,0,0,0,0,0,0,0,0,0,1,0,0,0,0,0,1,0,0,0,1,0,0,0,0,0,0,0,0,0,0,1,2
DD10-DEFENSE CONTRACT AUDIT AGENCY,4,1,0,0,0,0,0,0,0,5,0,0,0,0,0,0,0,0,0,0,5,3,10,0,25,0,0,0,0,0,38,0,0,0,0,0,0,0,0,0,0,38,43
DD12-DEFENSE SECURITY SERVICE,5,0,0,0,0,0,0,0,0,5,0,0,0,0,0,0,0,0,0,0,5,0,1,1,0,0,0,0,0,0,2,0,0,0,0,0,0,0,0,0,0,2,7
DD13-DEFENSE ADVANCED RESEARCH PROJECTS AGENCY,2,0,0,0,0,0,0,0,0,2,0,0,0,0,0,0,0,0,0,0,2,0,0,0,0,0,0,0,0,0,0,1,0,0,0,0,2,0,0,3,0,3,5
DD16-DEPARTMENT OF DEFENSE EDUCATION ACTIVITY,3,0,0,0,0,0,0,0,0,3,0,0,0,0,0,0,0,0,0,0,3,0,2,1,0,0,5,0,0,0,8,0,148,0,0,0,30,0,0,178,0,186,189
DD21-WASHINGTON HEADQUARTERS SERVICES,5,1,0,0,0,0,0,0,0,6,0,0,0,0,0,0,0,0,0,0,6,4,1,0,0,0,0,0,0,0,5,0,7,0,2,0,1,0,0,10,0,15,21
DD23-OFFICE OF ECONOMIC ADJUSTMENT,0,0,0,0,0,0,0,0,0,0,0,0,0,0,0,0,0,0,0,0,0,0,0,0,0,0,0,0,0,0,0,0,0,0,0,0,0,0,0,0,0,0,0
DD25-DEFENSE LEGAL SERVICES AGENCY,1,0,0,0,0,0,0,0,0,1,0,0,0,0,0,0,0,0,0,0,1,0,0,0,0,0,0,0,0,0,0,0,0,0,0,0,0,0,0,0,0,0,1
DD26-OFFICE OF THE INSPECTOR GENERAL,5,0,0,0,0,0,0,0,0,5,0,0,0,0,0,0,0,0,0,0,5,2,0,1,8,0,0,0,0,0,11,1,1,1,0,0,2,0,0,5,0,16,21
DD27-MISSILE DEFENSE AGENCY,31,1,0,0,0,1,0,0,0,33,0,0,0,0,0,0,0,0,0,0,33,6,0,0,2,0,0,0,0,0,8,1,0,0,0,0,0,0,0,1,0,9,42
DD29-DEFENSE TECHNOLOGY SECURITY ADMINISTRATION,0,0,0,0,0,0,0,0,0,0,0,0,0,0,0,0,0,0,0,0,0,0,0,0,0,0,0,0,0,0,0,0,0,0,0,0,0,0,0,0,0,0,0
DD34-DEFENSE COMMISSARY AGENCY,3,1,0,0,0,0,0,0,0,4,0,0,0,0,0,0,0,0,0,0,4,4,117,0,0,0,1,0,0,0,122,56,56,156,0,0,3,0,0,271,0,393,397
DD35-DEFENSE FINANCE AND ACCOUNTING SERVICE,4,2,0,0,0,0,0,0,0,6,0,0,0,0,0,0,0,0,0,0,6,6,143,1,21,0,6,0,0,0,177,29,2,14,0,0,0,0,0,45,0,222,228
DD48-DEFENSE HUMAN RESOURCES ACTIVITY,4,1,0,0,0,0,0,0,0,5,0,0,0,0,0,0,0,0,0,0,5,1,5,0,1,0,0,0,1,0,8,0,0,0,0,0,0,0,0,0,0,8,13
DD58-DEFENSE PRISONER OF WAR/MISSING PERSONNEL OFFICE,0,0,0,0,0,0,0,0,0,0,0,0,0,0,0,0,0,0,0,0,0,0,0,0,0,0,0,0,0,0,0,0,0,0,0,0,0,0,0,0,0,0,0
DD60-TRICARE MANAGEMENT ACTIVITY,2,0,0,0,0,0,0,0,0,2,0,0,0,0,0,0,0,0,0,0,2,4,0,0,0,0,0,0,0,0,4,0,0,0,0,0,0,0,0,0,0,4,6
DD61-DEFENSE THREAT REDUCTION AGENCY,4,0,0,0,0,0,0,0,0,4,0,0,0,0,0,0,0,0,0,0,4,1,0,1,1,0,0,0,0,0,3,0,0,2,0,0,0,0,0,2,0,5,9
DD63-DEFENSE CONTRACT MANAGEMENT AGENCY,44,2,0,0,0,2,0,0,0,48,0,0,0,0,0,0,0,0,0,0,48,7,19,0,2,0,3,0,0,0,31,3,0,0,0,0,1,0,0,4,0,35,83
DD65-PENTAGON FORCE PROTECTION AGENCY,4,3,0,0,0,0,0,0,0,7,0,0,0,0,0,0,0,0,0,0,7,3,3,0,0,0,0,0,0,0,6,0,0,0,0,0,0,0,0,0,0,6,13
DD68-DEPARTMENT OF DEFENSE TEST RESOURCE MANAGEMENT CENTER,0,0,0,0,0,0,0,0,0,0,0,0,0,0,0,0,0,0,0,0,0,0,0,0,0,0,0,0,0,0,0,0,0,0,0,0,0,0,0,0,0,0,0
DD69-NATIONAL DEFENSE UNIVERSITY,0,0,0,0,0,0,0,0,0,0,0,0,0,0,0,0,0,0,0,0,0,0,1,0,0,0,0,0,0,0,1,2,0,0,0,0,0,0,0,2,0,3,3
DD74-DEFENSE TECHNICAL INFORMATION CENTER,1,0,0,0,0,0,0,0,0,1,0,0,0,0,0,0,0,0,0,0,1,0,3,0,0,0,1,0,0,0,4,0,0,0,0,0,0,0,0,0,0,4,5
DD77-BUSINESS TRANSFORMATION AGENCY,1,0,0,0,0,1,0,0,0,2,0,0,0,0,0,0,0,0,0,0,2,0,0,1,0,0,0,0,0,0,1,0,5,0,0,0,1,0,0,6,0,7,9
DF00-OFFICE OF THE FEDERAL COORDINATOR FOR ALASKA NATURAL GAS TRANSPORTATION PROJECTS,0,0,0,0,0,0,0,0,0,0,0,0,0,0,0,0,0,0,0,0,0,0,0,0,0,0,0,0,0,0,0,0,0,0,0,0,0,0,0,0,0,0,0
"DJ01-OFFICES, BOARDS AND DIVISIONS",5,0,0,0,0,0,0,0,0,5,0,0,0,0,0,0,0,0,0,0,5,3,7,2,1,0,0,0,0,0,13,8,14,6,1,0,0,0,0,29,0,42,47
DJ02-FEDERAL BUREAU OF INVESTIGATION,0,0,0,0,0,0,0,0,0,0,0,0,0,0,0,0,0,0,0,0,0,0,0,0,4,0,92,1,0,0,97,0,0,0,0,0,5,0,0,5,0,102,102
DJ03-BUREAU OF PRISONS/FEDERAL PRISON SYSTEM,1,3,0,0,0,0,0,0,0,4,0,0,0,0,0,0,0,0,0,0,4,7,288,0,1,0,6,0,0,0,302,0,0,1,0,0,0,0,0,1,0,303,307
DJ06-DRUG ENFORCEMENT ADMINISTRATION,1,0,0,0,0,0,0,0,0,1,0,0,0,0,0,0,0,0,0,0,1,0,0,1,0,0,0,0,0,0,1,0,0,0,0,0,0,0,0,0,0,1,2
DJ07-OFFICE OF JUSTICE PROGRAMS,4,0,0,0,0,0,0,0,0,4,0,0,0,0,0,0,0,0,0,0,4,1,1,0,0,0,0,0,0,0,2,0,0,0,0,0,0,0,0,0,0,2,6
DJ08-U.S. MARSHALS SERVICE,6,0,0,0,0,0,0,0,0,6,0,0,0,0,0,0,0,0,0,0,6,3,7,1,3,0,0,0,0,0,14,0,0,0,0,0,0,0,0,0,0,14,20
DJ09-EXECUTIVE OFFICE FOR U.S. ATTORNEYS AND THE OFFICES OF THE U.S. ATTORNEYS,7,0,0,0,0,0,0,0,0,7,0,0,0,0,0,0,0,0,0,0,7,5,36,0,1,0,1,0,0,0,43,0,0,25,0,0,27,0,0,52,0,95,102
DJ10-OFFICE OF THE INSPECTOR GENERAL,0,0,0,0,0,0,0,0,0,0,0,0,0,0,0,0,0,0,0,0,0,0,0,0,0,0,0,0,0,0,0,0,0,5,0,0,0,0,0,5,0,5,5
DJ11-U.S. TRUSTEE PROGRAM,3,1,0,0,0,0,0,0,0,4,0,0,0,0,0,0,0,0,0,0,4,0,1,0,5,0,0,0,0,0,6,0,3,0,0,0,0,0,0,3,0,9,13
DJ12-EXECUTIVE OFFICE FOR IMMIGRATION REVIEW,4,1,0,0,0,0,0,0,0,5,0,0,0,0,0,0,0,0,0,0,5,1,6,0,0,0,0,0,0,0,7,0,1,3,0,0,0,0,0,4,0,11,16
DJ14-COMMUNITY RELATIONS SERVICE,0,0,0,0,0,0,0,0,0,0,0,0,0,0,0,0,0,0,0,0,0,0,0,0,0,0,0,0,0,0,0,0,0,0,1,0,0,0,0,1,0,1,1
"DJ15-BUREAU OF ALCOHOL, TOBACCO, FIREARMS, AND EXPLOSIVES",3,0,0,0,0,0,0,0,0,3,0,0,0,0,0,0,0,0,0,0,3,0,3,0,0,0,0,0,0,0,3,0,0,21,0,0,0,0,0,21,0,24,27
DL**-UNSPECIFIED,0,0,0,0,0,0,0,0,0,0,0,0,0,0,0,0,0,0,0,0,0,0,0,0,0,0,0,0,0,0,0,0,0,0,0,0,0,0,0,0,0,0,0
DLAA-OFFICE OF THE SECRETARY OF LABOR,1,0,0,0,0,0,0,0,0,1,0,0,0,0,0,0,0,0,0,0,1,0,0,0,0,0,0,0,0,0,0,0,0,0,1,0,0,0,0,1,0,1,2
DLAM-OFFICE OF THE ASSISTANT SECRETARY FOR ADMINISTRATION AND MANAGEMENT,7,0,0,0,0,0,0,0,0,7,0,0,0,0,0,0,0,0,0,0,7,0,4,0,1,0,0,0,0,0,5,1,0,0,0,0,0,0,0,1,0,6,13
DLBL-BUREAU OF INTERNATIONAL LABOR AFFAIRS,0,0,0,0,0,0,0,0,0,0,0,0,0,0,0,0,0,0,0,0,0,0,3,0,0,0,0,0,0,0,3,0,0,0,0,0,0,0,0,0,0,3,3
DLCA-OFFICE OF CONGRESSIONAL AND INTERGOVERNMENTAL AFFAIRS,0,0,0,0,0,0,0,0,0,0,0,0,0,0,0,0,0,0,0,0,0,0,0,0,0,0,0,0,0,0,0,0,0,0,1,0,0,0,0,1,0,1,1
DLCF-OFFICE OF THE CHIEF FINANCIAL OFFICER,0,0,0,0,0,0,0,0,0,0,0,0,0,0,0,0,0,0,0,0,0,0,0,0,0,0,0,0,0,0,0,0,0,0,0,0,0,0,0,0,0,0,0
DLEB-EMPLOYEE BENEFITS SECURITY ADMINISTRATION,0,0,0,0,0,0,0,0,0,0,0,0,0,0,0,0,0,0,0,0,0,0,0,0,0,0,0,0,0,0,0,0,0,0,0,0,0,0,0,0,0,0,0
DLEH-OFFICE OF DISABILITY EMPLOYMENT POLICY,0,0,0,0,0,0,0,0,0,0,0,0,0,0,0,0,0,0,0,0,0,0,0,0,0,0,0,0,0,0,0,0,0,0,0,0,0,0,0,0,0,0,0
DLES-EMPLOYMENT STANDARDS ADMINISTRATION,5,0,0,0,0,0,0,0,0,5,0,0,0,0,0,0,0,0,0,0,5,0,8,0,12,0,2,0,0,0,22,2,0,0,1,0,0,0,0,3,0,25,30
DLET-EMPLOYMENT AND TRAINING ADMINISTRATION,2,0,0,0,0,0,0,0,0,2,0,0,0,0,0,0,0,0,0,0,2,1,5,0,0,0,0,0,0,0,6,0,0,0,0,0,0,1,0,1,0,7,9
DLIG-OFFICE OF THE INSPECTOR GENERAL,2,0,0,0,0,0,0,0,0,2,0,0,0,0,0,0,0,0,0,0,2,0,0,0,0,0,0,0,0,0,0,0,0,0,0,0,0,0,0,0,0,0,2
DLLS-BUREAU OF LABOR STATISTICS,0,0,0,0,0,0,0,0,0,0,0,0,0,0,0,0,0,0,0,0,0,1,4,0,0,0,0,0,0,0,5,0,0,0,0,0,0,0,0,0,0,5,5
DLMS-MINE SAFETY AND HEALTH ADMINISTRATION,4,1,0,0,0,0,0,0,0,5,0,0,0,0,0,0,0,0,0,0,5,0,4,0,66,0,1,0,0,0,71,0,0,0,0,0,0,0,0,0,0,71,76
DLPA-OFFICE OF PUBLIC AFFAIRS,0,0,0,0,0,0,0,0,0,0,0,0,0,0,0,0,0,0,0,0,0,0,1,0,0,0,0,0,0,0,1,0,0,0,0,0,0,0,0,0,0,1,1
DLPE-OFFICE OF THE ASSISTANT SECRETARY FOR POLICY,0,0,0,0,0,0,0,0,0,0,0,0,0,0,0,0,0,0,0,0,0,0,0,0,0,0,0,0,0,0,0,0,0,0,0,0,0,0,0,0,0,0,0
DLPW-EMPLOYEE BENEFITS SECURITY ADMINISTRATION,0,0,0,0,0,0,0,0,0,0,0,0,0,0,0,0,0,0,0,0,0,0,1,0,3,0,0,0,0,0,4,1,0,0,0,0,0,0,0,1,0,5,5
DLSH-OCCUPATIONAL SAFETY AND HEALTH ADMINISTRATION,5,1,0,0,0,0,0,0,0,6,0,0,0,0,0,0,0,0,0,0,6,2,9,0,1,0,1,0,0,0,13,0,0,0,0,0,0,0,0,0,0,13,19
DLSL-OFFICE OF THE SOLICITOR,0,0,0,0,0,0,0,0,0,0,0,0,0,0,0,0,0,0,0,0,0,1,0,2,0,0,0,0,0,0,3,0,0,0,0,0,0,0,0,0,0,3,3
DLVE-VETERANS EMPLOYMENT AND TRAINING SERVICES,0,0,0,0,0,0,0,0,0,0,0,0,0,0,0,0,0,0,0,0,0,0,0,0,0,0,0,0,0,0,0,1,0,0,0,0,0,0,0,1,0,1,1
DLWB-WOMEN'S BUREAU,0,0,0,0,0,0,0,0,0,0,0,0,0,0,0,0,0,0,0,0,0,0,0,0,0,0,0,0,0,0,0,0,0,0,0,0,0,0,0,0,0,0,0
DN00-DEPARTMENT OF ENERGY,15,1,0,0,0,0,1,0,0,17,0,0,0,0,0,0,0,0,0,0,17,7,43,4,8,0,4,3,0,0,69,0,1,3,4,1,1,0,0,10,0,79,96
DQ00-DENALI COMMISSION,0,0,0,0,0,0,0,0,0,0,0,0,0,0,0,0,0,0,0,0,0,0,0,0,0,0,0,0,0,0,0,0,0,0,0,0,0,0,0,0,0,0,0
EB00-EXPORT-IMPORT BANK OF THE UNITED STATES,0,0,0,0,0,0,0,0,0,0,0,0,0,0,0,0,0,0,0,0,0,0,0,0,0,0,0,0,0,0,0,0,0,0,1,0,0,0,0,1,0,1,1
EC00-OFFICE OF ADMINISTRATION,0,1,0,0,0,0,0,0,0,1,0,0,0,0,0,0,0,0,0,0,1,0,1,3,0,0,0,0,0,0,4,0,1,0,0,0,0,0,0,1,0,5,6
EDEA-IMMEDIATE OFFICE OF THE SECRETARY OF EDUCATION,0,1,0,0,0,0,0,0,0,1,0,0,0,0,0,0,0,0,0,0,1,0,0,0,0,0,0,0,0,0,0,0,0,0,0,0,0,0,0,0,0,0,1
EDEB-OFFICE OF THE DUTY SECRETARY OF EDUCATION,0,0,0,0,0,0,0,0,0,0,0,0,0,0,0,0,0,0,0,0,0,0,0,0,0,0,0,0,0,0,0,0,0,0,0,0,0,0,0,0,0,0,0
EDEC-OFFICE FOR CIVIL RIGHTS,0,0,0,0,0,0,0,0,0,0,0,0,0,0,0,0,0,0,0,0,0,0,0,5,0,0,0,0,0,0,5,0,0,0,0,0,0,0,0,0,0,5,5
"EDED-OFFICE OF PLANNING, EVALUATION AND POLICY DEVELOPMENT",0,0,0,0,0,0,0,0,0,0,0,0,0,0,0,0,0,0,0,0,0,0,0,0,0,0,0,0,0,0,0,0,0,0,0,0,1,0,0,1,0,1,1
EDEE-OFFICE OF THE UNDER SECRETARY,0,0,0,0,0,0,0,0,0,0,0,0,0,0,0,0,0,0,0,0,0,0,0,0,0,0,0,0,0,0,0,0,0,0,1,0,0,0,0,1,0,1,1
EDEF-OFFICE OF INSPECTOR GENERAL,1,0,0,0,0,0,0,0,0,1,0,0,0,0,0,0,0,0,0,0,1,0,0,0,0,0,0,0,0,0,0,0,0,0,0,0,0,0,0,0,0,0,1
EDEG-OFFICE OF THE GENERAL COUNSEL,1,1,0,0,0,0,0,0,0,2,0,0,0,0,0,0,0,0,0,0,2,0,0,3,0,0,0,0,0,0,3,0,0,0,1,0,0,0,0,1,0,4,6
EDEH-OFFICE OF SPECIAL EDUCATION AND REHABILITATIVE SERVICES,0,0,0,0,0,0,0,0,0,0,0,0,0,0,0,0,0,0,0,0,0,0,0,1,0,0,0,0,0,0,1,0,0,0,1,0,0,0,0,1,0,2,2
EDEI-OFFICE OF THE CHIEF INFORMATION OFFICER,0,0,0,0,0,0,0,0,0,0,0,0,0,0,0,0,0,0,0,0,0,0,0,0,0,0,0,0,0,0,0,0,0,0,0,0,0,1,0,1,0,1,1
EDEJ-OFFICE OF LEGISLATION AND CONGRESSIONAL AFFAIRS,0,0,0,0,0,0,0,0,0,0,0,0,0,0,0,0,0,0,0,0,0,0,0,0,0,0,0,0,0,0,0,0,0,0,0,0,0,0,0,0,0,0,0
EDEK-OFFICE OF INTERGOVERNMENTAL AND INTERAGENCY AFFAIRS,0,0,0,0,0,0,0,0,0,0,0,0,0,0,0,0,0,0,0,0,0,0,0,0,0,0,0,0,0,0,0,0,0,0,0,0,0,0,0,0,0,0,0
EDEL-OFFICE OF THE CHIEF FINANCIAL OFFICER,0,0,0,0,0,0,0,0,0,0,0,0,0,0,0,0,0,0,0,0,0,0,0,0,0,0,0,0,0,0,0,0,0,0,0,0,0,0,0,0,0,0,0
EDEM-OFFICE OF MANAGEMENT,3,0,0,0,0,0,0,0,0,3,0,0,0,0,0,0,0,0,0,0,3,1,0,0,0,0,0,0,0,0,1,0,0,0,0,0,0,0,0,0,0,1,4
EDEN-FEDERAL STUDENT AID,2,0,0,0,0,0,0,0,0,2,0,0,0,0,0,0,0,0,0,0,2,1,3,0,0,0,1,0,0,0,5,0,0,0,0,0,0,0,0,0,0,5,7
EDEO-OFFICE OF COMMUNICATIONS AND OUTREACH,0,0,0,0,0,0,0,0,0,0,0,0,0,0,0,0,0,0,0,0,0,0,0,0,0,0,0,0,0,0,0,0,0,0,1,0,0,0,0,1,0,1,1
EDEP-OFFICE OF POSTSECONDARY EDUCATION,0,0,0,0,0,0,0,0,0,0,0,0,0,0,0,0,0,0,0,0,0,0,0,0,0,0,0,0,0,0,0,0,0,0,0,0,2,0,0,2,0,2,2
EDEQ-OFFICE OF SAFE AND DRUG-FREE SCHOOLS,0,0,0,0,0,0,0,0,0,0,0,0,0,0,0,0,0,0,0,0,0,0,1,0,0,0,0,0,0,0,1,0,0,0,0,0,0,0,0,0,0,1,1
EDER-INSTITUTE OF EDUCATION SCIENCES,1,0,0,0,0,0,0,0,0,1,0,0,0,0,0,0,0,0,0,0,1,0,0,0,0,0,0,0,0,0,0,0,0,0,0,0,0,0,0,0,0,0,1
EDES-OFFICE OF ELEMENTARY AND SECONDARY EDUCATION,0,0,0,0,0,0,0,0,0,0,0,0,0,0,0,0,0,0,0,0,0,0,0,0,0,0,0,0,0,0,0,0,0,0,1,0,0,0,0,1,0,1,1
EDET-OFFICE OF ENGLISH LANGUAGE ACQUISITION,0,0,0,0,0,0,0,0,0,0,0,0,0,0,0,0,0,0,0,0,0,0,0,0,0,0,0,0,0,0,0,0,0,0,0,0,0,0,0,0,0,0,0
EDEU-OFFICE OF INNOVATION AND IMPROVEMENT,0,0,0,0,0,0,0,0,0,0,0,0,0,0,0,0,0,0,0,0,0,0,0,0,1,0,0,0,0,0,1,0,0,0,0,0,0,0,0,0,0,1,1
EDEV-OFFICE OF VOCATIONAL AND ADULT EDUCATION,0,0,0,0,0,0,0,0,0,0,0,0,0,0,0,0,0,0,0,0,0,0,0,0,0,0,0,0,0,0,0,0,0,0,0,0,0,0,0,0,0,0,0
EDEX-NATIONAL INSTITUTE FOR LITERACY,0,0,0,0,0,0,0,0,0,0,0,0,0,0,0,0,0,0,0,0,0,0,0,0,0,0,0,0,0,0,0,0,0,0,0,0,0,0,0,0,0,0,0
EDEY-ADVISORY COUNCILS AND COMMITTEES,0,0,0,0,0,0,0,0,0,0,0,0,0,0,0,0,0,0,0,0,0,0,0,0,0,0,0,0,0,0,0,0,0,0,0,0,0,0,0,0,0,0,0
EDEZ-NATIONAL ASSESSMENT GOVERNING BOARD,0,0,0,0,0,0,0,0,0,0,0,0,0,0,0,0,0,0,0,0,0,0,0,0,0,0,0,0,0,0,0,0,0,0,0,0,0,0,0,0,0,0,0
EE00-EQUAL EMPLOYMENT OPPORTUNITY COMMISSION,1,0,0,0,0,0,0,0,0,1,0,0,0,0,0,0,0,0,0,0,1,2,10,0,0,0,0,0,1,0,13,0,1,0,0,0,1,0,0,2,0,15,16
EO00-MORRIS K. UDALL SCHOLARSHIP AND EXCELLENCE IN NATIONAL ENVIRONMENTAL POLICY FOUNDATION,0,0,0,0,0,0,0,0,0,0,0,0,0,0,0,0,0,0,0,0,0,0,0,0,0,0,0,0,0,0,0,0,0,0,0,0,0,0,0,0,0,0,0
EP00-ENVIRONMENTAL PROTECTION AGENCY,10,2,0,0,0,0,0,0,0,12,0,0,0,0,0,0,0,0,0,0,12,1,25,0,14,0,1,1,0,0,42,5,5,5,2,0,10,0,0,27,0,69,81
EQ00-COUNCIL ON ENVIRONMENTAL QUALITY/OFFICE OF ENVIRONMENTAL QUALITY,0,0,0,0,0,0,0,0,0,0,0,0,0,0,0,0,0,0,0,0,0,0,0,0,0,0,0,0,0,0,0,0,0,0,0,0,0,0,0,0,0,0,0
EW00-TRADE AND DEVELOPMENT AGENCY,0,0,0,0,0,0,0,0,0,0,0,0,0,0,0,0,0,0,0,0,0,0,0,0,0,0,0,0,0,0,0,0,0,0,0,0,0,0,0,0,0,0,0
FC00-FEDERAL COMMUNICATIONS COMMISSION,2,0,0,0,0,0,0,0,0,2,0,0,0,0,0,0,0,0,0,0,2,0,1,1,0,0,0,0,1,0,3,1,0,0,2,0,0,0,0,3,0,6,8
FD00-FEDERAL DEPOSIT INSURANCE CORPORATION,6,1,0,0,0,0,0,0,0,7,0,0,0,0,0,0,0,0,0,0,7,0,2,0,0,0,0,0,0,0,2,0,0,0,1,0,0,0,0,1,0,3,10
FI00-FEDERAL FINANCIAL INSTITUTIONS EXAMINATION COUNCIL,0,0,0,0,0,0,0,0,0,0,0,0,0,0,0,0,0,0,0,0,0,0,0,0,0,0,0,0,0,0,0,0,0,0,0,0,0,0,0,0,0,0,0
FJ00-CHEMICAL SAFETY AND HAZARD INVESTIGATION BOARD,0,0,0,0,0,0,0,0,0,0,0,0,0,0,0,0,0,0,0,0,0,0,0,0,0,0,0,0,0,0,0,0,0,0,0,0,0,0,0,0,0,0,0
FK00-FARM CREDIT SYSTEM INSURANCE CORPORATION,0,0,0,0,0,0,0,0,0,0,0,0,0,0,0,0,0,0,0,0,0,0,0,0,0,0,0,0,0,0,0,0,0,0,0,0,0,0,0,0,0,0,0
FL00-FARM CREDIT ADMINISTRATION,0,0,0,0,0,0,0,0,0,0,0,0,0,0,0,0,0,0,0,0,0,0,0,0,1,0,0,0,0,0,1,0,0,0,0,0,0,0,0,0,0,1,1
FM00-FEDERAL MEDIATION AND CONCILIATION SERVICE,0,0,0,0,0,0,0,0,0,0,0,0,0,0,0,0,0,0,0,0,0,0,0,0,0,0,0,0,0,0,0,0,0,0,0,0,0,0,0,0,0,0,0
FQ01-OFFICE OF THE DIRECTOR,1,0,0,0,0,0,0,0,0,1,0,0,0,0,0,0,0,0,0,0,1,0,6,0,0,0,0,0,0,0,6,0,0,2,0,0,0,0,0,2,0,8,9
FQ02-PRETRIAL SERVICES AGENCY,0,0,0,0,0,0,0,0,0,0,0,0,0,0,0,0,0,0,0,0,0,0,0,0,0,0,0,0,0,0,0,0,0,0,0,0,0,0,0,0,0,0,0
FT00-FEDERAL TRADE COMMISSION,1,0,0,0,0,0,0,0,0,1,0,0,0,0,0,0,0,0,0,0,1,1,4,4,0,0,0,0,0,0,9,1,0,2,0,0,0,0,0,3,0,12,13
FW00-OFFICE OF SPECIAL COUNSEL,0,0,0,0,0,0,0,0,0,0,0,0,0,0,0,0,0,0,0,0,0,1,0,0,0,0,0,0,0,0,1,0,0,0,0,0,1,0,0,1,0,2,2
FY00-FEDERAL HOUSING FINANCE BOARD,2,0,0,0,0,0,0,0,0,2,0,0,0,0,0,0,0,0,0,0,2,0,1,0,0,0,0,0,0,0,1,0,0,0,0,0,0,0,0,0,0,1,3
GB00-OVERSEAS PRIVATE INVESTMENT CORPORATION,0,0,0,0,0,0,0,0,0,0,0,0,0,0,0,0,0,0,0,0,0,0,1,1,0,0,0,0,0,0,2,0,0,1,0,0,1,0,0,2,0,4,4
GE00-BARRY GOLDWATER SCHOLARSHIP AND EXCELLENCE IN EDUCATION FOUNDATION,0,0,0,0,0,0,0,0,0,0,0,0,0,0,0,0,0,0,0,0,0,0,0,0,0,0,0,0,0,0,0,0,0,0,0,0,0,0,0,0,0,0,0
GG00-OFFICE OF GOVERNMENT ETHICS,0,0,0,0,0,0,0,0,0,0,0,0,0,0,0,0,0,0,0,0,0,0,0,1,0,0,0,0,0,0,1,0,0,0,0,0,0,0,0,0,0,1,1
GJ00-PRESIDIO TRUST,0,0,0,0,0,0,0,0,0,0,0,0,0,0,0,0,0,0,0,0,0,0,0,0,0,0,7,0,0,0,7,0,0,0,0,0,7,0,0,7,0,14,14
GM00-VALLES CALDERA TRUST,0,0,0,0,0,0,0,0,0,0,0,0,0,0,0,0,0,0,0,0,0,0,0,0,0,0,0,0,0,0,0,0,0,0,0,0,1,0,0,1,0,1,1
GO00-VIETNAM EDUCATION FOUNDATION,0,0,0,0,0,0,0,0,0,0,0,0,0,0,0,0,0,0,0,0,0,0,0,0,0,0,0,0,0,0,0,0,0,0,0,0,0,0,0,0,0,0,0
GQ00-ELECTION ASSISTANCE COMMISSION,0,0,0,0,0,0,0,0,0,0,0,0,0,0,0,0,0,0,0,0,0,0,0,0,0,0,0,0,0,0,0,0,0,0,0,0,5,0,0,5,0,5,5
GS01-IMMEDIATE OFFICE OF THE ADMINISTRATOR,1,0,0,0,0,0,0,0,0,1,0,0,0,0,0,0,0,0,0,0,1,0,0,0,0,0,0,0,0,0,0,0,0,0,0,0,0,0,0,0,0,0,1
GS03-PUBLIC BUILDINGS SERVICE,18,1,0,0,0,0,0,0,0,19,0,0,0,0,0,0,0,0,0,0,19,2,22,0,18,0,0,0,0,0,42,0,1,1,0,0,0,0,0,2,0,44,63
GS04-OFFICE OF CIVIL RIGHTS,0,0,0,0,0,0,0,0,0,0,0,0,0,0,0,0,0,0,0,0,0,0,0,0,0,0,0,0,0,0,0,0,0,0,0,0,0,0,0,0,0,0,0
GS10-OFFICE OF SMALL BUSINESS UTILIZATION,0,0,0,0,0,0,0,0,0,0,0,0,0,0,0,0,0,0,0,0,0,0,0,0,0,0,0,0,0,0,0,0,0,0,0,0,0,0,0,0,0,0,0
GS11-OFFICE OF THE CHIEF FINANCIAL OFFICER,0,0,0,0,0,0,0,0,0,0,0,0,0,0,0,0,0,0,0,0,0,0,0,0,4,0,0,0,0,0,4,0,0,0,0,0,0,0,0,0,0,4,4
GS12-OFFICE OF GENERAL COUNSEL,0,0,0,0,0,0,0,0,0,0,0,0,0,0,0,0,0,0,0,0,0,0,0,2,0,0,0,0,0,0,2,0,0,0,0,0,0,0,0,0,0,2,2
GS13-GSA BOARD OF CONTRACT APPEALS,0,0,0,0,0,0,0,0,0,0,0,0,0,0,0,0,0,0,0,0,0,0,0,0,0,0,0,0,0,0,0,0,0,0,0,0,0,0,0,0,0,0,0
GS14-OFFICE OF THE CHIEF HUMAN CAPITAL OFFICER,5,1,0,0,0,0,0,0,0,6,0,0,0,0,0,0,0,0,0,0,6,0,0,0,0,0,1,0,0,0,1,0,0,0,0,0,0,0,0,0,0,1,7
GS15-OFFICE OF INSPECTOR GENERAL,2,0,0,0,0,0,0,0,0,2,0,0,0,0,0,0,0,0,0,0,2,0,0,0,0,0,0,0,0,0,0,0,1,0,0,0,0,0,0,1,0,1,3
GS16-OFFICE OF THE CHIEF ACQUISITION OFFICER,0,0,0,0,0,0,0,0,0,0,0,0,0,0,0,0,0,0,0,0,0,0,0,0,0,0,0,0,0,0,0,0,0,0,0,0,0,0,0,0,0,0,0
GS19-OFFICE OF CITIZEN SERVICES AND COMMUNICATIONS,0,0,0,0,0,0,0,0,0,0,0,0,0,0,0,0,0,0,0,0,0,0,1,0,1,0,0,0,0,0,2,0,0,0,0,0,0,0,0,0,0,2,2
GS20-OFFICE OF CONGRESSIONAL AND INTERGOVERNMENTAL AFFAIRS,0,0,0,0,0,0,0,0,0,0,0,0,0,0,0,0,0,0,0,0,0,0,0,0,0,0,0,0,0,0,0,0,0,0,1,0,0,0,0,1,0,1,1
GS22-OFFICES OF THE REGIONAL ADMINISTRATORS,1,1,0,0,0,0,0,0,0,2,0,0,0,0,0,0,0,0,0,0,2,0,0,0,0,0,0,0,0,0,0,0,0,0,0,0,0,0,0,0,0,0,2
GS24-FEDERAL SUPPLY SERVICE,4,0,0,0,0,0,0,0,0,4,0,0,0,0,0,0,0,0,0,0,4,3,3,0,0,0,0,0,0,0,6,0,0,0,0,0,0,0,0,0,0,6,10
GS26-OFFICE OF GOVERNMENTWIDE POLICY,0,0,0,0,0,0,0,0,0,0,0,0,0,0,0,0,0,0,0,0,0,0,0,0,0,0,0,0,0,0,0,0,0,0,0,0,0,0,0,0,0,0,0
GS27-FEDERAL TECHNOLOGY SERVICE,4,0,0,0,0,0,0,0,0,4,0,0,0,0,0,0,0,0,0,0,4,0,0,0,0,0,0,0,0,0,0,0,0,0,0,0,0,0,0,0,0,0,4
GS28-OFFICE OF THE CHIEF INFORMATION OFFICER,0,0,0,0,0,0,0,0,0,0,0,0,0,0,0,0,0,0,0,0,0,0,0,0,0,0,0,0,0,0,0,0,0,0,0,0,0,0,0,0,0,0,0
GS30-FEDERAL ACQUISITION SERVICE,0,0,0,0,0,0,0,0,0,0,0,0,0,0,0,0,0,0,0,0,0,1,0,0,0,0,0,0,0,0,1,0,0,0,0,0,0,0,0,0,0,1,1
GS31-OFFICE OF EMERGENCY RESPONSE AND RECOVERY,0,0,0,0,0,0,0,0,0,0,0,0,0,0,0,0,0,0,0,0,0,0,0,0,0,0,0,1,0,0,1,0,0,0,0,0,0,0,0,0,0,1,1
GW00-INTERNATIONAL BOUNDARY AND WATER COMMISSION:  UNITED STATES AND MEXICO,0,0,0,0,0,0,0,0,0,0,0,0,0,0,0,0,0,0,0,0,0,0,0,0,0,0,0,0,0,0,0,0,0,0,0,0,1,0,0,1,0,1,1
GX00-INTERNATIONAL BOUNDARY COMMISSION:  UNITED STATES AND CANADA,0,0,0,0,0,0,0,0,0,0,0,0,0,0,0,0,0,0,0,0,0,0,0,0,0,0,0,0,0,0,0,0,0,0,0,0,0,0,0,0,0,0,0
GY00-INTERNATIONAL JOINT COMMISSION:  UNITED STATES AND CANADA,0,0,0,0,0,0,0,0,0,0,0,0,0,0,0,0,0,0,0,0,0,0,0,0,0,0,0,0,0,0,0,0,0,0,0,0,0,0,0,0,0,0,0
HB00-COMMITTEE FOR PURCHASE FROM PEOPLE WHO ARE BLIND OR SEVERELY DISABLED,1,0,0,0,0,0,0,0,0,1,0,0,0,0,0,0,0,0,0,0,1,0,0,0,0,0,0,0,0,0,0,0,0,0,0,0,0,0,0,0,0,0,1
HD00-U.S. HOLOCAUST MEMORIAL MUSEUM,0,0,0,0,0,0,0,0,0,0,0,0,0,0,0,0,0,0,0,0,0,0,0,0,0,0,0,0,0,0,0,0,0,0,0,0,0,0,0,0,0,0,0
HE10-OFFICE OF THE SECRETARY OF HEALTH AND HUMAN SERVICES,15,1,0,0,0,0,1,0,0,17,0,0,0,0,0,9247,0,0,9247,0,9264,3,16,14,2,0,0,4,0,0,39,0,2,3,2,0,7,0,0,14,2,55,9319
HE11-PROGRAM SUPPORT CENTER,4,0,0,0,0,0,0,0,0,4,0,0,0,0,0,0,0,0,0,0,4,0,3,0,0,0,0,2,0,0,5,0,0,0,0,0,0,0,0,0,0,5,9
HE12-ADMINISTRATION ON AGING,0,0,0,0,0,0,0,0,0,0,0,0,0,0,0,0,0,0,0,0,0,0,2,0,0,0,0,0,0,0,2,0,0,0,0,0,0,0,0,0,0,2,2
HE31-OFFICE OF THE ASSISTANT SECRETARY FOR HEALTH,0,0,0,0,0,0,0,0,0,0,0,0,0,0,0,0,0,0,0,0,0,0,0,0,0,0,0,0,0,0,0,0,0,0,0,0,1,0,0,1,0,1,1
HE32-SUBSTANCE ABUSE AND MENTAL HEALTH SERVICES ADMINISTRATION,1,1,0,0,0,0,0,0,0,2,0,0,0,0,0,0,0,0,0,0,2,0,2,0,0,0,0,0,0,0,2,0,0,1,0,0,3,0,0,4,0,6,8
HE33-AGENCY FOR HEALTHCARE RESEARCH AND QUALITY,0,0,0,0,0,0,0,0,0,0,0,0,0,0,0,0,0,0,0,0,0,0,0,0,0,0,0,0,0,0,0,0,0,0,0,0,6,0,0,6,0,6,6
HE34-HEALTH RESOURCES AND SERVICES ADMINISTRATION,0,0,0,0,0,0,0,0,0,0,0,0,0,0,0,0,0,0,0,0,0,1,1,0,0,0,0,0,0,0,2,0,0,0,0,0,6,0,0,6,0,8,8
HE35-AGENCY FOR TOXIC SUBSTANCES AND DISEASE REGISTRY,0,0,0,0,0,0,0,0,0,0,0,0,0,0,0,0,0,0,0,0,0,0,0,0,0,0,0,0,0,0,0,0,0,0,0,0,0,0,0,0,0,0,0
HE36-FOOD AND DRUG ADMINISTRATION,5,2,0,0,0,0,0,0,0,7,0,0,0,0,0,0,0,0,0,0,7,2,9,0,0,0,0,0,0,0,11,4,0,0,0,0,14,0,0,18,2,31,38
HE37-INDIAN HEALTH SERVICE,2,0,0,0,0,0,0,0,0,2,0,0,0,0,0,0,0,0,0,0,2,8,31,57,0,0,0,0,0,0,96,15,51,0,0,0,1,0,0,67,1,164,166
HE38-NATIONAL INSTITUTES OF HEALTH,10,2,0,0,0,0,0,0,0,12,0,0,0,0,0,0,0,0,0,0,12,8,86,0,0,0,2,0,0,0,96,3,0,6,0,0,59,0,0,68,0,164,176
HE39-CENTERS FOR DISEASE CONTROL AND PREVENTION,8,0,0,0,0,0,0,0,0,8,0,0,0,0,0,0,0,0,0,0,8,4,38,0,0,0,3,0,0,0,45,1,0,1,0,0,13,0,0,15,0,60,68
HE70-CENTERS FOR MEDICARE & MEDICAID SERVICES,4,0,0,0,0,0,0,0,0,4,0,0,0,0,0,0,0,0,0,0,4,3,15,1,13,0,5,0,0,0,37,0,0,0,0,0,2,0,0,2,0,39,43
HE90-ADMINISTRATION FOR CHILDREN AND FAMILIES,3,0,0,0,0,0,0,0,0,3,0,0,0,0,0,0,0,0,0,0,3,2,9,0,0,0,0,0,0,0,11,0,0,0,0,0,0,0,0,0,0,11,14
HP00-ADVISORY COUNCIL ON HISTORIC PRESERVATION,0,0,0,0,0,0,0,0,0,0,0,0,0,0,0,0,0,0,0,0,0,0,0,0,0,0,0,0,0,0,0,0,0,0,0,0,0,0,0,0,0,0,0
HS**-UNSPECIFIED,0,0,0,0,0,0,0,0,0,0,0,0,0,0,0,0,0,0,0,0,0,0,1,0,0,0,0,0,0,0,1,0,0,0,0,0,0,0,0,0,0,1,1
HSAA-DHS HEADQUARTERS,5,2,0,0,0,0,0,0,0,7,0,0,0,0,0,0,0,0,0,0,7,4,19,2,0,0,1,1,2,0,29,0,0,2,2,0,1,1,0,6,0,35,42
HSAB-BUREAU OF CITIZENSHIP AND IMMIGRATION SERVICES,5,1,0,0,0,0,0,0,0,6,0,0,0,0,0,0,0,0,0,0,6,5,24,5,3,0,0,0,0,0,37,0,0,3,0,0,0,0,0,3,0,40,46
HSAC-U.S. COAST GUARD,18,4,0,0,0,0,1,0,0,23,0,0,0,0,0,0,0,0,0,0,23,3,46,0,0,0,6,1,0,0,56,20,1,0,0,0,0,0,0,21,0,77,100
HSAD-U.S. SECRET SERVICE,0,0,0,0,0,0,0,0,0,0,0,0,0,0,0,0,0,0,0,0,0,2,14,0,0,0,0,0,0,0,16,0,0,63,0,0,0,0,0,63,0,79,79
HSAE-OFFICE OF THE INSPECTOR GENERAL,2,1,0,0,0,0,0,0,0,3,0,0,0,0,0,0,0,0,0,0,3,0,2,0,2,0,2,0,0,0,6,0,0,1,0,0,0,0,0,1,0,7,10
HSBA-US-VISIT,0,0,0,0,0,0,0,0,0,0,0,0,0,0,0,0,0,0,0,0,0,0,0,0,0,0,0,0,0,0,0,0,0,0,0,0,0,0,0,0,0,0,0
HSBB-BUREAU OF IMMIGRATION AND CUSTOMS ENFORCEMENT,28,2,0,0,0,0,0,0,0,30,0,0,0,0,0,0,0,0,0,0,30,10,44,13,159,0,3,0,0,0,229,1,0,12,1,0,0,0,0,14,0,243,273
HSBC-TRANSPORTATION SECURITY ADMINISTRATION,0,0,0,0,0,0,0,0,0,0,0,0,0,0,0,0,0,0,0,0,0,0,0,0,0,0,1389,0,0,0,1389,0,0,0,0,0,17,0,0,17,0,1406,1406
HSBD-BUREAU OF CUSTOMS AND BORDER PROTECTION,29,8,0,0,0,0,0,0,0,37,0,0,0,0,0,0,0,0,0,0,37,13,31,7,775,0,1,0,0,0,827,45,0,5,0,0,0,0,0,50,0,877,914
HSBE-FEDERAL LAW ENFORCEMENT TRAINING CENTERS,7,1,0,0,0,0,0,0,0,8,0,0,0,0,0,0,0,0,0,0,8,1,4,0,0,0,0,0,0,0,5,2,1,0,0,0,3,0,0,6,0,11,19
HSCB-FEDERAL EMERGENCY MANAGEMENT AGENCY,6,0,0,0,0,0,0,0,0,6,0,0,0,0,0,0,0,0,0,0,6,4,12,2,5,0,0,1,1,0,25,4,3,0,0,0,172,0,0,179,0,204,210
HSDA-DOMESTIC NUCLEAR DETECTION OFFICE,0,0,0,0,0,0,0,0,0,0,0,0,0,0,0,0,0,0,0,0,0,0,6,0,0,0,0,0,1,0,7,0,0,0,0,0,1,0,0,1,0,8,8
HSDB-OFFICE FOR INFORMATION ANALYSIS,0,0,0,0,0,0,0,0,0,0,0,0,0,0,0,0,0,0,0,0,0,0,0,0,0,0,0,0,0,0,0,0,0,0,0,0,0,0,0,0,0,0,0
HSEA-OFFICE OF THE UNDER SECRETARY FOR MANAGEMENT,0,0,0,0,0,0,0,0,0,0,0,0,0,0,0,0,0,0,0,0,0,0,0,0,0,0,0,0,0,0,0,0,0,0,0,0,0,0,0,0,0,0,0
HSFA-OFFICE OF THE UNDER SECRETARY FOR SCIENCE AND TECHNOLOGY,0,0,0,0,0,0,0,0,0,0,0,0,0,0,0,0,0,0,0,0,0,0,5,0,0,0,0,0,0,0,5,1,0,0,0,0,1,0,0,2,0,7,7
HT00-HARRY S. TRUMAN SCHOLARSHIP FOUNDATION,0,0,0,0,0,0,0,0,0,0,0,0,0,0,0,0,0,0,0,0,0,0,0,0,0,0,0,0,0,0,0,0,0,0,0,0,0,0,0,0,0,0,0
HU**-UNSPECIFIED,4,0,0,0,0,0,0,0,0,4,0,0,0,0,0,0,0,0,0,0,4,0,0,0,0,0,0,0,0,0,0,0,0,0,0,0,0,0,0,0,0,0,4
HU01-OFFICE OF THE SENIOR COORDINATOR FOR NEW ENGLAND,0,0,0,0,0,0,0,0,0,0,0,0,0,0,0,0,0,0,0,0,0,0,0,0,0,0,0,0,0,0,0,0,0,0,0,0,0,0,0,0,0,0,0
HU02-OFFICE OF THE SENIOR COORDINATOR FOR NEW YORK/NEW JERSEY,0,0,0,0,0,0,0,0,0,0,0,0,0,0,0,0,0,0,0,0,0,0,0,0,0,0,0,0,0,0,0,0,0,0,0,0,0,0,0,0,0,0,0
HU03-OFFICE OF THE SENIOR COORDINATOR FOR MID-ATLANTIC,0,0,0,0,0,0,0,0,0,0,0,0,0,0,0,0,0,0,0,0,0,0,0,0,0,0,0,0,0,0,0,0,0,0,0,0,0,0,0,0,0,0,0
HU04-OFFICE OF THE SENIOR COORDINATOR FOR SOUTHEAST/CARIBBEAN,0,0,0,0,0,0,0,0,0,0,0,0,0,0,0,0,0,0,0,0,0,0,0,0,0,0,0,0,0,0,0,0,0,0,0,0,0,0,0,0,0,0,0
HU05-OFFICE OF THE SENIOR COORDINATOR FOR MIDWEST,0,0,0,0,0,0,0,0,0,0,0,0,0,0,0,0,0,0,0,0,0,0,0,0,0,0,0,0,0,0,0,0,0,0,0,0,0,0,0,0,0,0,0
HU06-OFFICE OF THE SENIOR COORDINATOR FOR SOUTHWEST,0,0,0,0,0,0,0,0,0,0,0,0,0,0,0,0,0,0,0,0,0,0,0,0,0,0,0,0,0,0,0,0,0,0,0,0,0,0,0,0,0,0,0
HU07-OFFICE OF THE SENIOR COORDINATOR FOR GREAT PLAINS,1,0,0,0,0,0,0,0,0,1,0,0,0,0,0,0,0,0,0,0,1,0,0,0,0,0,0,0,0,0,0,0,0,0,0,0,0,0,0,0,0,0,1
HU08-OFFICE OF THE SENIOR COORDINATOR FOR ROCKY MOUNTAINS,0,0,0,0,0,0,0,0,0,0,0,0,0,0,0,0,0,0,0,0,0,0,0,0,0,0,0,0,0,0,0,0,0,0,0,0,0,0,0,0,0,0,0
HU09-OFFICE OF THE SENIOR COORDINATOR FOR PACIFIC/HAWAII,1,0,0,0,0,0,0,0,0,1,0,0,0,0,0,0,0,0,0,0,1,0,3,0,0,0,0,0,0,0,3,0,0,0,0,0,0,0,0,0,0,3,4
HU10-OFFICE OF THE SENIOR COORDINATOR FOR NORTHWEST/ALASKA,0,0,0,0,0,0,0,0,0,0,0,0,0,0,0,0,0,0,0,0,0,1,0,0,0,0,0,0,0,0,1,0,0,0,0,0,0,0,0,0,0,1,1
HUAA-OFFICE OF THE SECRETARY OF HOUSING AND URBAN DEVELOPMENT,0,0,0,0,0,0,0,0,0,0,0,0,0,0,0,0,0,0,0,0,0,0,0,0,0,0,0,0,0,0,0,0,0,0,0,0,0,0,0,0,0,0,0
HUBB-ASSISTANT SECRETARY FOR ADMINISTRATION,1,0,0,0,0,0,0,0,0,1,0,0,0,0,0,0,0,0,0,0,1,0,0,0,0,0,0,1,0,0,1,0,0,0,0,0,0,0,0,0,0,1,2
HUCC-OFFICE OF GENERAL COUNSEL,0,0,0,0,0,0,0,0,0,0,0,0,0,0,0,0,0,0,0,0,0,0,0,0,0,0,0,0,0,0,0,0,0,0,0,0,0,0,0,0,0,0,0
