Agency,10-Competitive Service - Career,15-Competitive Service - Career-Conditional,30-Excepted Service - Schedule A,32-Excepted Service - Schedule B,36-Excepted Service - Executive,38-Excepted Service - Other,50-Senior Executive Service - Career,55-Senior Executive Service - Non-Career,**-Unspecified,Permanent,20-Competitive Service,40-Excepted Service - Schedule A,42-Excepted Service - Schedule B,44-Excepted Service - Schedule C,46-Excepted Service - Executive,48-Excepted Service - Other,60-Senior Executive Service - Limited Term,65-Senior Executive Service - Limited Emergency,Non-permanent,Unspecified,Type of Appointment - All,10-Competitive Service - Career,15-Competitive Service - Career-Conditional,30-Excepted Service - Schedule A,32-Excepted Service - Schedule B,36-Excepted Service - Executive,38-Excepted Service - Other,50-Senior Executive Service - Career,55-Senior Executive Service - Non-Career,**-Unspecified,Permanent,20-Competitive Service,40-Excepted Service - Schedule A,42-Excepted Service - Schedule B,44-Excepted Service - Schedule C,46-Excepted Service - Executive,48-Excepted Service - Other,60-Senior Executive Service - Limited Term,65-Senior Executive Service - Limited Emergency,Non-permanent,Unspecified,Type of Appointment - All,Type of Appointment - All
AB**-UNSPECIFIED,0,0,0,0,0,0,0,0,0,0,0,0,0,0,0,0,0,0,0,0,0,0,0,0,0,0,0,0,0,0,0,0,0,0,0,0,0,0,0,0,0,0,0
AB00-AMERICAN BATTLE MONUMENTS COMMISSION,0,0,0,0,0,0,0,0,0,0,0,0,0,0,0,0,0,0,0,0,0,0,0,0,0,0,0,0,0,0,0,0,0,0,0,0,0,0,0,0,0,0,0
AF**-UNSPECIFIED,0,0,0,0,0,0,0,0,0,0,0,0,0,0,0,0,0,0,0,0,0,0,0,0,0,0,0,0,0,0,0,0,0,0,0,0,0,0,0,0,0,0,0
AF02-AIR FORCE INSPECTION AND SAFETY CENTER,0,0,0,0,0,0,0,0,0,0,0,0,0,0,0,0,0,0,0,0,0,0,0,0,0,0,0,0,0,0,0,0,0,0,0,0,0,0,0,0,0,0,0
AF03-AIR FORCE OPERATIONAL TEST AND EVALUATION CENTER,0,0,0,0,0,0,0,0,0,0,0,0,0,0,0,0,0,0,0,0,0,1,0,0,0,0,0,0,0,0,1,0,0,0,0,0,0,0,0,0,0,1,1
AF04-AIR FORCE COMMUNICATIONS AGENCY,0,0,0,0,0,0,0,0,0,0,0,0,0,0,0,0,0,0,0,0,0,0,0,0,0,0,0,0,0,0,0,0,0,0,0,0,0,0,0,0,0,0,0
AF05-AIR FORCE INTELLIGENCE SERVICE,0,0,0,0,0,0,0,0,0,0,0,0,0,0,0,0,0,0,0,0,0,0,0,0,0,0,3,0,0,0,3,0,0,0,0,0,0,0,0,0,0,3,3
AF06-AIR FORCE AUDIT AGENCY,0,0,0,0,0,0,0,0,0,0,0,0,0,0,0,0,0,0,0,0,0,0,0,0,1,0,0,0,0,0,1,0,0,0,0,0,0,0,0,0,0,1,1
AF07-AIR FORCE OFFICE OF SPECIAL INVESTIGATIONS,0,0,0,0,0,0,0,0,0,0,0,0,0,0,0,0,0,0,0,0,0,0,0,0,0,0,0,0,0,0,0,1,0,0,0,0,0,0,0,1,0,1,1
AF08-AIR FORCE OFFICE OF SECURITY POLICE,0,0,0,0,0,0,0,0,0,0,0,0,0,0,0,0,0,0,0,0,0,0,0,0,0,0,0,0,0,0,0,1,0,0,0,0,0,0,0,1,0,1,1
AF09-AIR FORCE PERSONNEL CENTER,1,0,0,0,0,0,0,0,0,1,0,0,0,0,0,0,0,0,0,0,1,1,1,0,0,0,0,0,0,0,2,0,0,0,0,0,0,0,0,0,0,2,3
AF0B-U.S. AIR FORCE ACADEMY,0,1,0,0,0,0,0,0,0,1,0,0,0,0,0,0,0,0,0,0,1,1,12,0,0,0,0,0,0,0,13,1,1,0,0,0,0,0,0,2,0,15,16
"AF0D-U.S. AIR FORCES, EUROPE",1,0,0,0,0,0,0,0,0,1,0,0,0,0,0,0,0,0,0,0,1,5,1,0,0,0,1,0,0,0,7,0,25,0,0,0,0,0,0,25,0,32,33
AF0J-AIR EDUCATION AND TRAINING COMMAND,3,1,0,0,0,0,0,0,0,4,0,0,0,0,0,0,0,0,0,0,4,11,24,0,0,0,6,0,0,0,41,26,7,2,0,0,1,0,0,36,0,77,81
"AF0M-HEADQUARTERS, AIR FORCE RESERVE",0,1,0,0,0,0,0,0,0,1,0,0,0,0,0,0,0,0,0,0,1,11,50,0,0,0,7,0,0,0,68,8,0,10,0,0,1,0,0,19,0,87,88
"AF0N-IMMEDIATE OFFICE, HEADQUARTERS, USAF",3,0,0,0,0,0,0,0,0,3,0,0,0,0,0,0,0,0,0,0,3,1,0,0,0,0,0,0,0,0,1,0,0,0,0,0,0,0,0,0,0,1,4
AF0R-PACIFIC AIR FORCES,0,0,0,0,0,0,0,0,0,0,0,0,0,0,0,0,0,0,0,0,0,7,5,0,0,0,1,0,0,0,13,5,27,0,0,0,0,0,0,32,0,45,45
"AF0U-AIR FORCE INTELLIGENCE, SURVEILLANCE, & RECONNAISSANCE AGENCY",0,0,0,0,0,0,0,0,0,0,0,0,0,0,0,0,0,0,0,0,0,0,0,0,0,0,12,0,0,0,12,0,0,0,0,0,2,0,0,2,0,14,14
AF0V-AIR FORCE SPECIAL OPERATIONS COMMAND,0,0,0,0,0,0,0,0,0,0,0,0,0,0,0,0,0,0,0,0,0,0,1,0,0,0,0,0,0,0,1,2,16,0,0,0,0,0,0,18,0,19,19
AF10-AIR FORCE CENTER FOR QUALITY AND MANAGEMENT INNOVATION,0,0,0,0,0,0,0,0,0,0,0,0,0,0,0,0,0,0,0,0,0,0,0,0,0,0,0,0,0,0,0,0,0,0,0,0,0,0,0,0,0,0,0
AF11-AIR FORCE MANPOWER AGENCY,0,0,0,0,0,0,0,0,0,0,0,0,0,0,0,0,0,0,0,0,0,0,0,0,0,0,0,0,0,0,0,0,0,0,0,0,0,0,0,0,0,0,0
"AF1A-AIR FORCE C2 & INTELLIGENCE, SURVEILLANCE & RECONNAISSANCE",0,0,0,0,0,0,0,0,0,0,0,0,0,0,0,0,0,0,0,0,0,0,0,0,0,0,0,0,0,0,0,0,0,0,0,0,0,0,0,0,0,0,0
AF1C-AIR COMBAT COMMAND,2,0,0,0,0,0,0,0,0,2,0,0,0,0,0,0,0,0,0,1,3,10,19,0,0,0,4,0,0,0,33,14,28,0,0,0,0,0,0,42,0,75,78
AF1G-AIR FORCE LOGISTICS MANAGEMENT AGENCY,0,0,0,0,0,0,0,0,0,0,0,0,0,0,0,0,0,0,0,0,0,0,0,0,0,0,0,0,0,0,0,0,0,0,0,0,0,0,0,0,0,0,0
AF1L-AIR MOBILITY COMMAND,1,1,0,0,0,0,0,0,0,2,0,0,0,0,0,0,0,0,0,0,2,6,27,0,0,0,1,0,0,0,34,5,20,0,0,0,0,0,0,25,0,59,61
AF1M-AIR FORCE MATERIEL COMMAND,15,2,0,0,0,0,0,0,0,17,0,0,0,0,0,0,0,0,0,0,17,21,61,1,65,0,7,0,0,0,155,34,10,3,0,0,0,0,0,47,0,202,219
AF1P-AIR FORCE REAL PROPERTY AGENCY,0,0,0,0,0,0,0,0,0,0,0,0,0,0,0,0,0,0,0,0,0,0,1,0,0,0,0,0,0,0,1,0,0,0,0,0,0,0,0,0,0,1,1
AF1Q-HQ AF FLIGHT STANDARDS AGENCY,0,0,0,0,0,0,0,0,0,0,0,0,0,0,0,0,0,0,0,0,0,2,0,0,0,0,0,0,0,0,2,0,0,0,0,0,0,0,0,0,0,2,2
AF1S-SPACE COMMAND,2,0,0,0,0,0,0,0,0,2,0,0,0,0,0,0,0,0,0,0,2,12,6,0,0,0,9,0,0,0,27,5,5,1,0,0,2,0,0,13,0,40,42
AF1W-AIR FORCE ENGINEERING AND SERVICES CENTER,0,0,0,0,0,0,0,0,0,0,0,0,0,0,0,0,0,0,0,0,0,0,0,0,0,0,0,0,0,0,0,0,0,0,0,0,0,0,0,0,0,0,0
AF1Y-AIR FORCE CIVILIAN CAREER TRAINING,0,0,0,0,0,0,0,0,0,0,0,0,0,0,0,0,0,0,0,0,0,0,0,0,0,0,0,0,0,0,0,0,0,0,0,0,0,0,0,0,0,0,0
AF21-AIR FORCE NUCLEAR WEAPONS AGENCY,0,0,0,0,0,0,0,0,0,0,0,0,0,0,0,0,0,0,0,0,0,0,0,0,0,0,0,0,0,0,0,0,0,0,0,0,0,0,0,0,0,0,0
AF24-HQ USAF DIRECT SUPPORT ELEMENT,0,0,0,0,0,0,0,0,0,0,0,0,0,0,0,0,0,0,0,0,0,1,0,0,0,0,0,0,0,0,1,0,0,0,0,0,1,0,0,1,0,2,2
AF25-AF-WIDE SUPPORT ELEMENT,0,0,0,0,0,0,0,0,0,0,0,0,0,0,0,0,0,0,0,0,0,0,0,0,0,0,0,0,0,0,0,1,0,0,0,0,0,0,0,1,0,1,1
AF27-AIR FORCE AGENCY FOR MODELING AND SIMULATION,0,0,0,0,0,0,0,0,0,0,0,0,0,0,0,0,0,0,0,0,0,0,0,0,0,0,0,0,0,0,0,0,0,0,0,0,0,0,0,0,0,0,0
AF2A-AIR FORCE COST CENTER,1,0,0,0,0,0,0,0,0,1,0,0,0,0,0,0,0,0,0,0,1,0,0,0,0,0,0,0,0,0,0,0,0,0,0,0,0,0,0,0,0,0,1
AF2B-AIR FORCE DOCTRINE CENTER,0,0,0,0,0,0,0,0,0,0,0,0,0,0,0,0,0,0,0,0,0,0,0,0,0,0,0,0,0,0,0,0,0,0,0,0,0,0,0,0,0,0,0
AF2D-AIR FORCE PERSONNEL OPERATIONS AGENCY,0,0,0,0,0,0,0,0,0,0,0,0,0,0,0,0,0,0,0,0,0,0,0,0,0,0,0,0,0,0,0,0,0,0,0,0,0,0,0,0,0,0,0
AF2E-AIR FORCE LEGAL SERVICES CENTER,0,0,0,0,0,0,0,0,0,0,0,0,0,0,0,0,0,0,0,0,0,0,0,0,0,0,0,0,0,0,0,0,0,0,0,0,0,0,0,0,0,0,0
AF2F-AIR FORCE MEDICAL SERVICES CENTER,0,0,0,0,0,0,0,0,0,0,0,0,0,0,0,0,0,0,0,0,0,0,0,0,0,0,0,0,0,0,0,0,0,0,0,0,0,0,0,0,0,0,0
AF2G-AIR FORCE SERVICE INFORMATION AND NEWS CENTER,0,0,0,0,0,0,0,0,0,0,0,0,0,0,0,0,0,0,0,0,0,0,0,0,0,0,0,0,0,0,0,0,0,0,0,0,0,0,0,0,0,0,0
AF2I-AIR NATIONAL GUARD SUPPORT CENTER,0,0,0,0,0,0,0,0,0,0,0,0,0,0,0,0,0,0,0,0,0,1,1,0,0,0,0,0,0,0,2,0,0,1,0,0,0,0,0,1,0,3,3
AF2K-U.S. AIR FORCE HISTORICAL RESEARCH CENTER,0,0,0,0,0,0,0,0,0,0,0,0,0,0,0,0,0,0,0,0,0,0,0,0,0,0,0,0,0,0,0,0,0,0,0,0,0,0,0,0,0,0,0
AF2L-AIR FORCE TECHNICAL APPLICATIONS CENTER,0,0,0,0,0,0,0,0,0,0,0,0,0,0,0,0,0,0,0,0,0,0,0,0,0,0,0,0,0,0,0,0,0,0,0,0,0,0,0,0,0,0,0
AF2M-AIR FORCE REVIEW BOARDS OFFICE,1,0,0,0,0,0,0,0,0,1,0,0,0,0,0,0,0,0,0,0,1,0,0,0,0,0,0,0,0,0,0,0,0,0,0,0,0,0,0,0,0,0,1
AF2N-AIR FORCE CENTER FOR STUDIES AND ANALYSES,0,0,0,0,0,0,0,0,0,0,0,0,0,0,0,0,0,0,0,0,0,0,0,0,0,0,0,0,0,0,0,0,0,0,0,0,0,0,0,0,0,0,0
AF2Q-AIR WEATHER SERVICE,0,0,0,0,0,0,0,0,0,0,0,0,0,0,0,0,0,0,0,0,0,1,0,0,0,0,0,0,0,0,1,0,0,0,0,0,0,0,0,0,0,1,1
AF2R-AIR FORCE PROGRAM EXECUTIVE OFFICE,0,0,0,0,0,0,0,0,0,0,0,0,0,0,0,0,0,0,0,0,0,0,0,0,0,0,0,0,0,0,0,0,0,0,0,0,0,0,0,0,0,0,0
AF2S-HQ NORAD,0,0,0,0,0,0,0,0,0,0,0,0,0,0,0,0,0,0,0,0,0,1,0,0,0,0,0,0,0,0,1,0,0,0,0,0,0,0,0,0,0,1,1
AF2T-AIR FORCE SUPPLY CENTER,0,0,0,0,0,0,0,0,0,0,0,0,0,0,0,0,0,0,0,0,0,1,0,0,0,0,0,0,0,0,1,0,0,0,0,0,0,0,0,0,0,1,1
"AF2U-AIR FORCE MORALE, WELFARE AND RECREATION CENTER",0,0,0,0,0,0,0,0,0,0,0,0,0,0,0,0,0,0,0,0,0,0,0,0,0,0,0,0,0,0,0,0,0,0,0,0,0,0,0,0,0,0,0
AF2W-11TH WING,0,0,0,0,0,0,0,0,0,0,0,0,0,0,0,0,0,0,0,0,0,0,0,0,0,0,0,0,0,0,0,0,0,0,0,0,0,0,0,0,0,0,0
AF2Y-AIR FORCE PENTAGON COMMUNICATIONS AGENCY,0,0,0,0,0,0,0,0,0,0,0,0,0,0,0,0,0,0,0,0,0,0,0,0,0,0,0,0,0,0,0,0,0,0,0,0,0,0,0,0,0,0,0
AF2Z-HQ AIR FORCE MEDICAL OPERATIONS AGENCY,0,0,0,0,0,0,0,0,0,0,0,0,0,0,0,0,0,0,0,0,0,0,0,0,0,0,0,0,0,0,0,0,0,0,0,0,0,0,0,0,0,0,0
AF34-AIR NATIONAL GUARD UNITS (MOBILIZATION) (TITLE 5),0,0,0,0,0,0,0,0,0,0,0,0,0,0,0,0,0,0,0,0,0,0,1,0,0,0,0,0,0,0,1,0,0,0,0,0,0,0,0,0,0,1,1
"AF3C-AIR FORCE ELEMENTS, U.S. CENTRAL COMMAND",0,0,0,0,0,0,0,0,0,0,0,0,0,0,0,0,0,0,0,0,0,1,0,0,0,0,0,0,0,0,1,0,0,0,0,0,0,0,0,0,0,1,1
"AF3D-AIR FORCE ELEMENTS, U.S. SPECIAL OPERATIONS COMMAND",1,0,0,0,0,0,0,0,0,1,0,0,0,0,0,0,0,0,0,0,1,2,0,0,0,0,2,0,0,0,4,0,0,0,0,0,0,0,0,0,0,4,5
"AF3N-AIR FORCE ELEMENTS, U.S. ATLANTIC COMMAND",0,0,0,0,0,0,0,0,0,0,0,0,0,0,0,0,0,0,0,0,0,0,0,0,0,0,0,0,0,0,0,0,0,0,0,0,0,0,0,0,0,0,0
"AF3Q-AIR FORCE ELEMENTS, U.S. STRATEGIC COMMAND",1,0,0,0,0,0,0,0,0,1,0,0,0,0,0,0,0,0,0,0,1,3,0,2,1,0,1,0,0,0,7,2,0,0,0,0,0,0,0,2,0,9,10
"AF3S-HEADQUARTERS, U.S. SPACE COMMAND AND NORAD",0,0,0,0,0,0,0,0,0,0,0,0,0,0,0,0,0,0,0,0,0,0,0,0,0,0,0,0,0,0,0,0,0,0,0,0,0,0,0,0,0,0,0
"AF3T-AIR FORCE ELEMENTS, U.S. TRANSPORTATION COMMAND",0,0,0,0,0,0,0,0,0,0,0,0,0,0,0,0,0,0,0,0,0,0,0,1,0,0,0,0,0,0,1,0,0,0,0,0,0,0,0,0,0,1,1
"AF3V-AIR FORCE ELEMENTS, OTHER THAN EUROPE",1,0,0,0,0,0,0,0,0,1,0,0,0,0,0,0,0,0,0,1,2,1,0,0,0,0,2,0,0,0,3,1,0,1,0,0,0,0,0,2,0,5,7
AF3W-AIR FORCE CENTER FOR ENVIRONMENTAL EXCELLENCE,0,0,0,0,0,0,0,0,0,0,0,0,0,0,0,0,0,0,0,0,0,1,0,0,0,0,0,0,0,0,1,2,1,0,0,0,0,0,0,3,0,4,4
AF3Y-AIR FORCE FREQUENCY MANAGEMENT AGENCY,0,0,0,0,0,0,0,0,0,0,0,0,0,0,0,0,0,0,0,0,0,0,0,0,0,0,0,0,0,0,0,0,0,0,0,0,0,0,0,0,0,0,0
"AF4D-AIR FORCE ELEMENTS, U.S. NORTHERN COMMAND",0,0,0,0,0,0,0,0,0,0,0,0,0,0,0,0,0,0,0,0,0,0,1,0,0,0,0,0,0,0,1,0,0,0,0,0,0,0,0,0,0,1,1
AF4W-AIR FORCE DISTRICT OF WASHINGTON,3,2,0,0,0,0,0,0,0,5,0,0,0,0,0,0,0,0,0,0,5,2,10,0,1,0,3,0,0,0,16,0,0,1,0,0,0,0,0,1,0,17,22
AF5J-AIR FORCE FINANCIAL SERVICES,0,0,0,0,0,0,0,0,0,0,0,0,0,0,0,0,0,0,0,0,0,0,0,0,0,0,0,0,0,0,0,0,0,0,0,0,0,0,0,0,0,0,0
AF5K-AIR FORCE PETROLEUM AGENCY,0,0,0,0,0,0,0,0,0,0,0,0,0,0,0,0,0,0,0,0,0,0,0,0,0,0,0,0,0,0,0,0,0,0,0,0,0,0,0,0,0,0,0
AFNG-AIR NATIONAL GUARD UNITS (TITLE 32),0,0,0,0,0,0,0,0,0,0,0,0,0,0,0,0,0,0,0,0,0,0,1,0,0,0,62,0,0,0,63,0,7,0,0,0,253,0,0,260,0,323,323
"AFZG-U.S. SPECIAL OPERATIONS COMMAND (ANG, TITLE 32)",0,0,0,0,0,0,0,0,0,0,0,0,0,0,0,0,0,0,0,0,0,0,0,0,0,0,0,0,0,0,0,0,0,0,0,0,2,0,0,2,0,2,2
AFZS-U.S. SPECIAL OPERATIONS COMMAND (AIR FORCE),0,0,0,0,0,0,0,0,0,0,0,0,0,0,0,0,0,0,0,0,0,0,0,0,0,0,0,0,0,0,0,0,0,0,0,0,0,0,0,0,0,0,0
AG01-OFFICE OF THE SECRETARY OF AGRICULTURE,0,0,0,0,0,0,0,0,0,0,0,0,0,0,0,0,0,0,0,0,0,0,0,0,0,0,0,0,0,0,0,0,0,0,0,0,0,0,0,0,0,0,0
AG02-AGRICULTURAL MARKETING SERVICE,1,0,0,0,0,0,0,0,0,1,0,0,0,0,0,0,0,0,0,0,1,0,8,0,0,0,0,0,0,0,8,0,153,0,0,0,0,0,0,153,0,161,162
AG03-AGRICULTURAL RESEARCH SERVICE,2,3,0,0,0,0,0,0,0,5,0,0,0,0,0,0,0,0,0,0,5,2,22,0,0,0,0,0,0,0,24,7,21,42,0,0,0,0,0,70,0,94,99
AG07-RURAL HOUSING SERVICE,1,0,0,0,0,0,0,0,0,1,0,0,0,0,0,0,0,0,0,0,1,4,5,0,0,0,0,0,0,0,9,4,0,3,0,0,0,0,0,7,0,16,17
AG08-RISK MANAGEMENT AGENCY,0,0,0,0,0,0,0,0,0,0,0,0,0,0,0,0,0,0,0,0,0,0,0,0,0,0,0,0,0,0,0,0,0,0,1,0,0,0,0,1,0,1,1
AG10-FOREIGN AGRICULTURAL SERVICE,3,0,0,0,0,0,0,0,0,3,0,0,0,0,0,0,0,0,0,0,3,1,0,0,0,0,0,0,0,0,1,0,0,2,0,0,0,0,0,2,0,3,6
AG11-FOREST SERVICE,21,4,0,0,0,0,0,0,0,25,0,0,0,0,0,0,0,0,0,0,25,7,51,1,1,0,1,0,0,0,61,58,7,11,0,0,1,0,0,77,0,138,163
AG13-OFFICE OF COMMUNICATIONS,0,0,0,0,0,0,0,0,0,0,0,0,0,0,0,0,0,0,0,0,0,0,0,0,0,0,0,0,0,0,0,0,0,0,0,0,0,0,0,0,0,0,0
AG14-OFFICE OF THE GENERAL COUNSEL,0,0,0,0,0,0,0,0,0,0,0,0,0,0,0,0,0,0,0,0,0,0,0,2,0,0,0,0,0,0,2,0,0,0,0,0,0,0,0,0,0,2,2
AG15-RURAL UTILITIES SERVICE,0,0,0,0,0,0,0,0,0,0,0,0,0,0,0,0,0,0,0,0,0,0,1,0,0,0,0,0,0,0,1,0,0,2,0,0,0,0,0,2,0,3,3
AG16-NATURAL RESOURCES CONSERVATION SERVICE,2,0,0,0,0,0,0,0,0,2,0,0,0,0,0,0,0,0,0,0,2,1,7,0,1,0,0,0,0,0,9,10,4,0,0,0,0,0,0,14,0,23,25
AG18-ECONOMIC RESEARCH SERVICE,0,0,0,0,0,0,0,0,0,0,0,0,0,0,0,0,0,0,0,0,0,0,1,0,0,0,0,0,0,0,1,0,0,1,0,0,0,0,0,1,0,2,2
AG20-NATIONAL AGRICULTURAL STATISTICS SERVICE,0,0,0,0,0,0,0,0,0,0,0,0,0,0,0,0,0,0,0,0,0,1,0,0,0,0,0,0,0,0,1,1,0,0,0,0,0,0,0,1,0,2,2
"AG22-COOPERATIVE STATE RESEARCH, EDUCATION, AND EXTENSION SERVICE",0,0,0,0,0,0,0,0,0,0,0,0,0,0,0,0,0,0,0,0,0,1,0,0,0,0,0,0,0,0,1,0,1,0,0,0,0,0,0,1,0,2,2
AG23-OFFICE OF THE INSPECTOR GENERAL,1,0,0,0,0,0,0,0,0,1,0,0,0,0,0,0,0,0,0,0,1,0,0,0,1,0,0,0,0,0,1,0,0,0,0,0,0,0,0,0,0,1,2
AG30-FOOD AND NUTRITION SERVICE,1,0,0,0,0,0,0,0,0,1,0,0,0,0,0,0,0,0,0,0,1,0,6,0,1,0,0,0,0,0,7,0,0,0,0,0,0,0,0,0,0,7,8
AG32-RURAL BUSINESS-COOPERATIVE SERVICE,0,0,0,0,0,0,0,0,0,0,0,0,0,0,0,0,0,0,0,0,0,0,0,0,0,0,0,0,0,0,0,0,0,0,0,0,0,0,0,0,0,0,0
AG34-ANIMAL AND PLANT HEALTH INSPECTION SERVICE,6,0,0,0,0,0,0,0,0,6,0,0,0,0,0,0,0,0,0,0,6,3,23,0,0,0,1,0,0,0,27,35,54,12,0,0,0,0,0,101,0,128,134
"AG36-GRAIN INSPECTION, PACKERS AND STOCKYARDS ADMINISTRATION",1,0,0,0,0,0,0,0,0,1,0,0,0,0,0,0,0,0,0,0,1,0,2,0,1,0,0,0,0,0,3,0,8,0,0,0,0,0,0,8,0,11,12
AG37-FOOD SAFETY AND INSPECTION SERVICE,1,0,0,0,0,0,0,0,0,1,0,0,0,0,0,0,0,0,0,0,1,0,35,0,2,0,0,0,0,0,37,0,13,0,0,0,0,0,0,13,0,50,51
AG38-OFFICE OF THE CHIEF ECONOMIST,0,0,0,0,0,0,0,0,0,0,0,0,0,0,0,0,0,0,0,0,0,0,0,0,0,0,0,0,0,0,0,0,0,0,0,0,0,0,0,0,0,0,0
AG42-OFFICE OF BUDGET AND PROGRAM ANALYSIS,0,0,0,0,0,0,0,0,0,0,0,0,0,0,0,0,0,0,0,0,0,0,0,0,0,0,0,0,0,0,0,0,0,0,0,0,0,0,0,0,0,0,0
AG90-OFFICE OF THE CHIEF FINANCIAL OFFICER,2,0,0,0,0,0,0,0,0,2,0,0,0,0,0,0,0,0,0,0,2,1,4,0,0,0,0,0,0,0,5,0,0,0,0,0,0,0,0,0,0,5,7
AGCR-OFFICE OF CIVIL RIGHTS,0,0,0,0,0,0,0,0,0,0,0,0,0,0,0,0,0,0,0,0,0,0,0,0,0,0,0,0,0,0,0,0,0,0,0,0,0,0,0,0,0,0,0
AGDA-DEPARTMENTAL ADMINISTRATION,0,0,0,0,0,0,0,0,0,0,0,0,0,0,0,0,0,0,0,0,0,0,1,0,0,0,0,0,0,0,1,0,0,0,0,0,0,0,0,0,0,1,1
AGES-OFFICE OF THE EXECUTIVE SECRETARIAT,0,0,0,0,0,0,0,0,0,0,0,0,0,0,0,0,0,0,0,0,0,0,0,0,0,0,0,0,0,0,0,0,0,0,0,0,0,0,0,0,0,0,0
AGFA-FARM SERVICE AGENCY,0,0,0,0,0,0,0,0,0,0,0,0,0,0,0,0,0,0,0,0,0,1,21,0,3,0,0,0,0,0,25,1,0,1,0,0,0,0,0,2,0,27,27
AGHL-HOMELAND SECURITY STAFF,0,0,0,0,0,0,0,0,0,0,0,0,0,0,0,0,0,0,0,0,0,0,0,0,0,0,0,0,0,0,0,0,0,0,0,0,0,0,0,0,0,0,0
AGHS-HOMELAND SECURITY STAFF,0,0,0,0,0,0,0,0,0,0,0,0,0,0,0,0,0,0,0,0,0,0,0,0,0,0,0,0,0,0,0,0,0,0,0,0,0,0,0,0,0,0,0
AGIT-OFFICE OF THE CHIEF INFORMATION OFFICER,0,0,0,0,0,0,0,0,0,0,0,0,0,0,0,0,0,0,0,0,0,0,0,0,0,0,0,0,0,0,0,0,0,0,0,0,0,0,0,0,0,0,0
AGNA-NATIONAL APPEALS DIVISION,0,0,0,0,0,0,0,0,0,0,0,0,0,0,0,0,0,0,0,0,0,0,0,0,0,0,0,0,0,0,0,0,0,0,0,0,0,0,0,0,0,0,0
AH01-NATIONAL ENDOWMENT FOR THE ARTS,0,0,0,0,0,0,0,0,0,0,0,0,0,0,0,0,0,0,0,0,0,0,0,0,0,0,0,0,0,0,0,1,0,0,0,0,0,0,0,1,0,1,1
AH02-NATIONAL ENDOWMENT FOR THE HUMANITIES,1,0,0,0,0,0,0,0,0,1,0,0,0,0,0,0,0,0,0,0,1,0,0,0,0,0,0,0,0,0,0,0,0,0,0,0,0,0,0,0,0,0,1
AH03-INSTITUTE OF MUSEUM AND LIBRARY SERVICES,0,0,0,0,0,0,0,0,0,0,0,0,0,0,0,0,0,0,0,0,0,0,3,0,0,0,0,0,0,0,3,0,0,0,0,0,0,0,0,0,0,3,3
AI00-U.S. INSTITUTE OF PEACE,0,0,0,0,0,0,0,0,0,0,0,0,0,0,0,0,0,0,0,0,0,0,0,0,0,0,0,0,0,0,0,0,0,0,0,0,0,0,0,0,0,0,0
AM00-AGENCY FOR INTERNATIONAL DEVELOPMENT,3,0,0,0,0,0,0,0,0,3,0,0,0,0,0,0,0,0,0,0,3,0,1,1,0,0,1,0,0,0,3,0,0,0,0,2,2,0,0,4,0,7,10
AN00-AFRICAN DEVELOPMENT FOUNDATION,0,0,0,0,0,0,0,0,0,0,0,0,0,0,0,0,0,0,0,0,0,0,0,0,0,0,0,0,0,0,0,0,0,0,0,0,0,0,0,0,0,0,0
AP00-APPALACHIAN REGIONAL COMMISSION,0,0,0,0,0,0,0,0,0,0,0,0,0,0,0,0,0,0,0,0,0,0,0,0,0,0,0,0,0,0,0,0,0,0,0,0,0,0,0,0,0,0,0
AR**-UNSPECIFIED,0,0,0,0,0,0,0,0,0,0,0,0,0,0,0,0,0,0,0,0,0,0,0,0,0,0,0,0,0,0,0,0,0,0,0,0,0,0,0,0,0,0,0
AR3A-U.S. ARMY CENTRAL,0,0,0,0,0,0,0,0,0,0,0,0,0,0,0,0,0,0,0,0,0,0,0,0,0,0,0,0,0,0,0,0,0,0,0,0,0,0,0,0,0,0,0
AR5A-U.S. ARMY NORTH,0,0,0,0,0,0,0,0,0,0,0,0,0,0,0,0,0,0,0,0,0,0,0,0,0,0,0,0,0,0,0,0,0,0,0,0,0,0,0,0,0,0,0
ARAC-U.S. ARMY CONTRACTING AGENCY,12,2,0,0,0,0,0,0,0,14,0,0,0,0,0,0,0,0,0,0,14,1,3,0,0,0,0,0,0,0,4,0,0,0,0,0,0,0,0,0,0,4,18
ARAE-U.S. ARMY ACQUISITION SUPPORT CENTER,1,0,0,0,0,0,0,0,0,1,0,0,0,0,0,0,0,0,0,0,1,2,4,0,1,0,1,0,0,0,8,0,1,0,0,0,0,0,0,1,0,9,10
ARAS-U.S. ARMY INTELLIGENCE AND SECURITY COMMAND,0,0,0,0,0,0,0,0,0,0,0,0,0,0,0,0,0,0,0,0,0,0,0,0,0,0,13,0,0,0,13,0,0,0,0,0,0,0,0,0,0,13,13
ARAT-U.S. ARMY TEST AND EVALUATION COMMAND,1,0,0,0,0,0,0,0,0,1,0,0,0,0,0,0,0,0,0,0,1,10,5,0,3,0,0,0,0,0,18,1,0,0,0,0,0,0,0,1,0,19,20
ARAU-U.S. ARMY AUDIT AGENCY,0,0,0,0,0,0,0,0,0,0,0,0,0,0,0,0,0,0,0,0,0,0,0,0,0,0,0,0,0,0,0,0,0,0,0,0,0,0,0,0,0,0,0
ARBA-U.S. ARMY INSTALLATION MANAGEMENT COMMAND,25,6,0,0,0,0,0,0,0,31,0,0,0,0,0,0,0,0,0,0,31,38,86,2,0,0,30,0,0,0,156,174,30,0,0,0,36,0,0,240,0,396,427
ARCB-U.S. ARMY CRIMINAL INVESTIGATION COMMAND,0,0,0,0,0,0,0,0,0,0,0,0,0,0,0,0,0,0,0,0,0,5,0,0,0,0,1,0,0,0,6,3,0,0,0,0,0,0,0,3,0,9,9
ARCE-U.S. ARMY CORPS OF ENGINEERS,32,2,0,0,0,0,0,0,0,34,0,0,0,0,0,0,0,0,0,0,34,8,49,3,24,0,11,0,0,0,95,46,11,15,0,0,4,0,0,76,0,171,205
ARCS-IMMEDIATE OFFICE OF THE CHIEF OF STAFF OF THE ARMY,2,0,0,0,0,0,0,0,0,2,0,0,0,0,0,0,0,0,0,0,2,12,0,0,0,0,1,0,0,0,13,0,0,0,0,0,0,0,0,0,0,13,15
ARE1-IMMEDIATE OFFICE OF THE COMMANDER-IN-CHIEF OF THE U.S. ARMY EUROPE AND SEVENTH ARMY,0,0,0,0,0,0,0,0,0,0,0,0,0,0,0,0,0,0,0,0,0,2,1,0,0,0,0,0,0,0,3,3,3,0,0,0,0,0,0,6,0,9,9
ARE2-21ST THEATER SUSTAINMENT COMMAND (TSC),0,0,0,0,0,0,0,0,0,0,0,0,0,0,0,0,0,0,0,0,0,1,1,0,0,0,0,0,0,0,2,1,1,0,0,0,0,0,0,2,0,4,4
ARE3-U.S. ARMY SOUTHERN EURPOEAN TASK FORCE,0,0,0,0,0,0,0,0,0,0,0,0,0,0,0,0,0,0,0,0,0,0,0,0,0,0,0,0,0,0,0,0,0,0,0,0,0,0,0,0,0,0,0
ARE5-U.S. ARMY V CORPS,0,0,0,0,0,0,0,0,0,0,0,0,0,0,0,0,0,0,0,0,0,0,0,0,0,0,0,0,0,0,0,1,3,0,0,0,0,0,0,4,0,4,4
AREB-1ST PERSONNEL COMMAND,0,0,0,0,0,0,0,0,0,0,0,0,0,0,0,0,0,0,0,0,0,0,0,0,0,0,0,0,0,0,0,0,0,0,0,0,0,0,0,0,0,0,0
AREN-SEVENTH ARMY TRAINING COMMAND,0,0,0,0,0,0,0,0,0,0,0,0,0,0,0,0,0,0,0,0,0,1,0,0,0,0,1,0,0,0,2,0,0,0,0,0,0,0,0,0,0,2,2
ARFC-U.S. ARMY FORCES COMMAND,1,1,0,0,0,0,0,0,0,2,0,0,0,0,0,0,0,0,0,0,2,2,4,0,0,0,1,0,0,0,7,12,12,0,0,0,18,0,0,42,0,49,51
ARFL-U.S. ARMY SOUTH COMMAND,0,0,0,0,0,0,0,0,0,0,0,0,0,0,0,0,0,0,0,0,0,0,0,0,0,0,0,0,0,0,0,0,0,0,0,0,0,0,0,0,0,0,0
ARG6-U.S. ARMY NETWORK ENTERPRISE TECHNOLOGY COMMAND/9TH ARMY SIGNAL COMMAND,4,0,0,0,0,0,0,0,0,4,0,0,0,0,0,0,0,0,0,0,4,3,7,0,0,0,0,0,0,0,10,1,0,0,0,0,0,0,0,1,0,11,15
ARGB-OFFICE OF THE CHIEF OF THE NATIONAL GUARD BUREAU,0,0,0,0,0,0,0,0,0,0,0,0,0,0,0,0,0,0,0,0,0,1,0,0,0,0,1,0,0,0,2,0,0,0,0,0,0,0,0,0,0,2,2
ARHR-U.S. ARMY RESERVE COMMAND,3,0,0,0,0,0,0,0,0,3,0,0,0,0,0,0,0,0,0,0,3,0,44,0,0,0,21,0,0,0,65,5,0,0,0,0,0,0,0,5,0,70,73
ARJ1-U.S. ARMY ELEMENT SHAPE,0,0,0,0,0,0,0,0,0,0,0,0,0,0,0,0,0,0,0,0,0,2,0,0,0,0,0,0,0,0,2,0,0,0,0,0,0,0,0,0,0,2,2
ARJA-JOINT ACTIVITIES,3,0,0,0,0,0,0,0,0,3,0,0,0,0,0,0,0,0,0,0,3,5,3,1,0,0,8,0,0,0,17,3,2,0,0,0,3,0,0,8,0,25,28
ARMA-U.S. MILITARY ACADEMY,0,0,0,0,0,0,0,0,0,0,0,0,0,0,0,0,0,0,0,0,0,0,1,0,0,0,0,0,0,0,1,4,1,0,0,0,0,0,0,5,0,6,6
ARMC-U.S. ARMY MEDICAL COMMAND,10,0,0,0,0,0,0,0,0,10,0,0,0,0,0,0,0,0,0,0,10,56,240,1,0,0,45,0,0,0,342,91,39,2,0,0,8,0,0,140,0,482,492
ARMP-U.S. ARMY HUMAN RESOURCES COMMAND,0,0,0,0,0,0,0,0,0,0,0,0,0,0,0,0,0,0,0,0,0,0,0,0,0,0,0,0,0,0,0,0,0,0,0,0,0,0,0,0,0,0,0
ARMT-MILITARY SURFACE DEPLOYMENT AND DISTRIBUTION COMMAND,0,0,0,0,0,0,0,0,0,0,0,0,0,0,0,0,0,0,0,0,0,0,0,0,0,0,0,0,0,0,0,0,0,0,0,0,0,0,0,0,0,0,0
ARMW-U.S. ARMY MILITARY DISTRICT OF WASHINGTON,0,0,0,0,0,0,0,0,0,0,0,0,0,0,0,0,0,0,0,0,0,2,2,0,0,0,0,0,0,0,4,0,0,0,0,0,0,0,0,0,0,4,4
ARNG-ARMY NATIONAL GUARD UNITS (TITLE 32),0,0,0,0,0,0,0,0,0,0,0,0,0,0,0,0,0,0,0,0,0,1,4,0,0,0,154,0,0,0,159,1,26,0,0,0,273,0,0,300,1,460,460
"ARP1-U.S. ARMY, PACIFIC",0,0,0,0,0,0,0,0,0,0,0,0,0,0,0,0,0,0,0,0,0,1,2,0,0,0,2,0,0,0,5,1,9,0,0,0,1,0,0,11,0,16,16
ARP8-EIGHTH U.S. ARMY,0,0,0,0,0,0,0,0,0,0,0,0,0,0,0,0,0,0,0,0,0,3,4,0,0,0,0,0,0,0,7,0,5,0,0,0,0,0,0,5,0,12,12
ARPC-MILITARY ENTRANCE PROCESSING COMMAND,0,0,0,0,0,0,0,0,0,0,0,0,0,0,0,0,0,0,0,0,0,0,0,0,0,0,0,0,0,0,0,0,0,0,0,0,0,0,0,0,0,0,0
ARRC-U.S. ARMY RECRUITING COMMAND,0,0,0,0,0,0,0,0,0,0,0,0,0,0,0,0,0,0,0,0,0,0,0,0,0,0,0,0,0,0,0,0,0,0,0,0,0,0,0,0,0,0,0
ARSA-OFFICE OF THE SECRETARY OF THE ARMY,0,0,0,0,0,0,0,0,0,0,0,0,0,0,0,0,0,0,0,0,0,4,0,0,0,0,0,0,0,0,4,0,0,0,0,0,3,0,0,3,0,7,7
ARSB-FIELD OPERATING OFFICES OF THE OFFICE OF THE SECRETARY OF THE ARMY,0,0,0,0,0,0,0,0,0,0,0,0,0,0,0,0,0,0,0,0,0,0,0,0,15,0,8,0,0,0,23,0,0,0,0,0,0,0,0,0,0,23,23
ARSC-U. S. ARMY SPACE AND MISSILE DEFENSE COMMAND/U. S. ARMY FORCES STRATEGIC COMMAND,1,0,0,0,0,0,0,0,0,1,0,0,0,0,0,0,0,0,0,0,1,0,0,0,0,0,0,0,0,0,0,1,0,0,0,0,0,0,0,1,0,1,2
ARSE-FIELD OPERATING AGENCIES OF THE ARMY STAFF RESOURCED THROUGH OA-22,9,2,0,0,0,0,0,0,0,11,0,0,0,0,0,0,0,0,0,0,11,10,8,0,0,0,0,0,0,0,18,1,0,1,0,0,0,0,0,2,0,20,31
ARSF-FIELD OPERATING AGENCIES OF THE ARMY STAFF,0,0,0,0,0,0,0,0,0,0,0,0,0,0,0,0,0,0,0,0,0,0,0,0,0,0,0,0,0,0,0,0,0,0,0,0,0,0,0,0,0,0,0
"ARSJ-JOINT SERVICES AND ACTIVITIES SUPPORTED BY THE OFFICE, SECRETARY OF THE ARMY",2,0,0,0,0,0,0,0,0,2,0,0,0,0,0,0,0,0,0,0,2,3,0,0,0,0,0,0,0,0,3,0,8,0,0,0,5,0,0,13,0,16,18
ARSO-U.S. ARMY SOUTH,0,0,0,0,0,0,0,0,0,0,0,0,0,0,0,0,0,0,0,0,0,3,0,0,0,0,2,0,0,0,5,0,0,0,0,0,0,0,0,0,0,5,5
ARSP-U.S. SPECIAL OPERATIONS COMMAND (ARMY),2,0,0,0,0,0,0,0,0,2,0,0,0,0,0,0,0,0,0,0,2,1,5,0,0,0,0,0,0,0,6,3,0,1,0,0,0,0,0,4,0,10,12
"ARSS-STAFF SUPPORT AGENCIES OF THE CHIEF OF STAFF, ARMY",0,0,0,0,0,0,0,0,0,0,0,0,0,0,0,0,0,0,0,0,0,0,0,0,0,0,0,0,0,0,0,0,0,0,0,0,0,0,0,0,0,0,0
ARTA-U.S. ARMY ACCESSIONS COMMAND,1,0,0,0,0,0,0,0,0,1,0,0,0,0,0,0,0,0,0,0,1,9,8,0,0,0,3,0,0,0,20,6,0,0,0,0,0,0,0,6,0,26,27
ARTC-U.S. ARMY TRAINING AND DOCTRINE COMMAND,3,2,0,0,0,0,0,0,0,5,0,0,0,0,0,0,0,0,0,0,5,9,43,0,0,0,8,0,0,0,60,29,10,9,0,0,5,0,0,53,0,113,118
ARTM-U.S. MILITARY ENTRANCE PROCESSING COMMAND,2,2,0,0,0,0,0,0,0,4,0,0,0,0,0,0,0,0,0,0,4,2,14,0,0,0,10,0,0,0,26,3,0,0,0,0,0,0,0,3,0,29,33
ARTW-U.S. ARMY WAR COLLEGE,0,0,0,0,0,0,0,0,0,0,0,0,0,0,0,0,0,0,0,0,0,1,0,0,0,0,0,0,0,0,1,0,0,0,0,0,3,0,0,3,0,4,4
"ARX2-HEADQUARTERS, AMC",0,0,0,0,0,0,0,0,0,0,0,0,0,0,0,0,0,0,0,0,0,1,0,0,0,0,0,1,0,0,2,0,0,0,0,0,0,0,0,0,0,2,2
"ARX3-HEADQUARTERS, STAFF SUPPORT ACTIVITIES, AMC",0,0,0,0,0,0,0,0,0,0,0,0,0,0,0,0,0,0,0,0,0,0,0,0,0,0,0,0,0,0,0,0,0,0,0,0,0,0,0,0,0,0,0
"ARX4-TRAINING ACTIVITIES, AMC",0,0,0,0,0,0,0,0,0,0,0,0,0,0,0,0,0,0,0,0,0,0,0,0,0,0,0,0,0,0,0,0,0,0,0,0,0,0,0,0,0,0,0
ARX6-U.S. ARMY AVIATION AND MISSILE COMMAND,6,1,0,0,0,0,0,0,0,7,0,0,0,0,0,0,0,0,0,0,7,1,32,0,8,0,5,0,0,0,46,0,0,0,0,0,0,0,0,0,0,46,53
ARX7-U.S. ARMY TANK-AUTOMOTIVE AND ARMAMENT COMMAND (TACOM),8,2,0,0,0,0,0,0,0,10,0,0,0,0,0,0,0,0,0,0,10,3,38,1,27,0,6,0,0,0,75,31,111,0,0,0,11,0,0,153,0,228,238
ARX8-U.S. ARMY COMMUNICATIONS ELECTRONICS COMMAND,3,0,0,0,0,0,0,0,0,3,0,0,0,0,0,0,0,0,0,0,3,6,54,0,7,0,8,0,0,0,75,15,0,0,0,0,0,0,0,15,0,90,93
"ARX9-U.S. ARMY SIMULATION, TRAINING AND INSTRUMENTATION COMMAND",0,0,0,0,0,0,0,0,0,0,0,0,0,0,0,0,0,0,0,0,0,0,0,0,0,0,0,0,0,0,0,0,0,0,0,0,0,0,0,0,0,0,0
ARXA-U.S. ARMY CHEMICAL AND BIOLOGICAL DEFENSE COMMAND,0,0,0,0,0,0,0,0,0,0,0,0,0,0,0,0,0,0,0,0,0,0,0,0,0,0,0,0,0,0,0,0,0,0,0,0,0,0,0,0,0,0,0
ARXB-U.S. ARMY CHEMICAL MATERIALS AGENCY,0,0,0,0,0,0,0,0,0,0,0,0,0,0,0,0,0,0,0,0,0,1,13,0,0,0,1,0,0,0,15,0,0,0,0,0,0,0,0,0,0,15,15
ARXC-U.S. ARMY SUSTAINMENT COMMAND,2,0,0,0,0,0,0,0,0,2,0,0,0,0,0,0,0,0,0,0,2,1,2,0,0,0,0,0,0,0,3,1,3,0,0,0,1,0,0,5,0,8,10
ARXD-U.S. ARMY RESEARCH LABORATORY COMMAND,0,0,0,0,0,0,0,0,0,0,0,0,0,0,0,0,0,0,0,0,0,0,0,0,0,0,0,0,0,0,0,0,0,0,0,0,0,0,0,0,0,0,0
ARXK-MATERIEL ACQUISITION ACTIVITIES,0,0,0,0,0,0,0,0,0,0,0,0,0,0,0,0,0,0,0,0,0,0,0,0,0,0,0,0,0,0,0,0,0,0,0,0,0,0,0,0,0,0,0
ARXL-MATERIEL ACQUISITION PROJECT MANAGERS,0,0,0,0,0,0,0,0,0,0,0,0,0,0,0,0,0,0,0,0,0,0,0,0,0,0,0,0,0,0,0,0,0,0,0,0,0,0,0,0,0,0,0
ARXP-U.S. ARMY SECURITY ASSISTANCE COMMAND,0,0,0,0,0,0,0,0,0,0,0,0,0,0,0,0,0,0,0,0,0,0,0,0,0,0,0,0,0,0,0,0,0,0,0,0,0,0,0,0,0,0,0
ARXQ-U.S. ARMY JOINT MUNITIONS COMMAND,1,0,0,0,0,0,0,0,0,1,0,0,0,0,0,0,0,0,0,0,1,2,5,0,1,0,1,0,0,0,9,55,1,0,0,0,17,0,0,73,0,82,83
"ARXR-U.S. ARMY RESEARCH, DEVELOPMENT AND ENGINEERING COMMAND",0,1,0,0,0,0,0,0,0,1,0,0,0,0,0,0,0,0,0,0,1,2,30,1,9,0,9,0,0,0,51,4,0,2,0,0,0,0,0,6,0,57,58
ARXT-U.S. ARMY MILITARY SURFACE DEPLOYMENT AND DISTRIBUTION COMMAND,5,1,0,0,0,0,0,0,0,6,0,0,0,0,0,0,0,0,0,0,6,2,4,0,0,0,0,0,0,0,6,0,0,1,0,0,0,0,0,1,0,7,13
ARXX-MATERIEL READINESS ACTIVITIES,0,0,0,0,0,0,0,0,0,0,0,0,0,0,0,0,0,0,0,0,0,0,0,0,0,0,0,0,0,0,0,0,0,0,0,0,0,0,0,0,0,0,0
AU00-FEDERAL LABOR RELATIONS AUTHORITY,0,0,0,0,0,0,0,0,0,0,0,0,0,0,0,0,0,0,0,0,0,0,0,0,0,0,0,0,0,0,0,0,0,0,0,0,0,0,0,0,0,0,0
AW00-ARCTIC RESEARCH COMMISSION,0,0,0,0,0,0,0,0,0,0,0,0,0,0,0,0,0,0,0,0,0,0,0,0,0,0,0,0,0,0,0,0,0,0,0,0,0,0,0,0,0,0,0
BD00-MERIT SYSTEMS PROTECTION BOARD,0,0,0,0,0,0,0,0,0,0,0,0,0,0,0,0,0,0,0,0,0,1,0,1,0,0,0,0,0,0,2,0,0,0,0,0,0,0,0,0,0,2,2
BF00-DEFENSE NUCLEAR FACILITIES SAFETY BOARD,0,0,0,0,0,0,0,0,0,0,0,0,0,0,0,0,0,0,0,0,0,0,0,0,0,0,0,0,0,0,0,0,0,0,0,0,0,0,0,0,0,0,0
BG00-PENSION BENEFIT GUARANTY CORPORATION,4,0,0,0,0,0,0,0,0,4,0,0,0,0,0,0,0,0,0,0,4,2,4,0,0,0,0,0,0,0,6,1,0,3,0,0,0,0,0,4,0,10,14
BO00-OFFICE OF MANAGEMENT AND BUDGET,2,0,0,0,0,0,0,0,0,2,0,0,0,0,0,0,0,0,0,0,2,0,0,0,0,0,0,0,0,0,0,0,0,3,0,0,2,0,0,5,0,5,7
BT00-ARCHITECTURAL AND TRANSPORTATION BARRIERS COMPLIANCE BOARD,0,0,0,0,0,0,0,0,0,0,0,0,0,0,0,0,0,0,0,0,0,0,0,0,0,0,0,0,0,0,0,0,0,0,0,0,0,0,0,0,0,0,0
BW00-NUCLEAR WASTE TECHNICAL REVIEW BOARD,0,0,0,0,0,0,0,0,0,0,0,0,0,0,0,0,0,0,0,0,0,0,0,0,0,0,0,0,0,0,0,0,0,0,0,0,0,0,0,0,0,0,0
BZ00-CHRISTOPHER COLUMBUS FELLOWSHIP FOUNDATION,0,0,0,0,0,0,0,0,0,0,0,0,0,0,0,0,0,0,0,0,0,0,0,0,0,0,0,0,0,0,0,0,0,0,0,0,0,0,0,0,0,0,0
CC00-COMMISSION ON CIVIL RIGHTS,1,0,0,0,0,0,0,0,0,1,0,0,0,0,0,0,0,0,0,0,1,1,1,0,0,0,0,0,0,0,2,0,0,0,0,0,0,0,0,0,0,2,3
CE00-COUNCIL OF ECONOMIC ADVISERS,0,0,0,0,0,0,0,0,0,0,0,0,0,0,0,0,0,0,0,0,0,0,0,0,0,0,0,0,0,0,0,0,0,0,0,0,0,0,0,0,0,0,0
CF00-COMMISSION OF FINE ARTS,0,0,0,0,0,0,0,0,0,0,0,0,0,0,0,0,0,0,0,0,0,0,0,0,0,0,0,0,0,0,0,0,0,0,0,0,0,0,0,0,0,0,0
CM33-TECHNOLOGY ADMINISTRATION,0,0,0,0,0,0,0,0,0,0,0,0,0,0,0,0,0,0,0,0,0,0,0,0,0,0,0,0,0,0,0,0,0,0,0,0,0,0,0,0,0,0,0
CM51-OFFICE OF THE SECRETARY,2,0,0,0,0,0,0,0,0,2,0,0,0,0,0,0,0,0,0,0,2,0,1,0,0,0,0,0,0,0,1,0,0,0,1,0,0,0,0,1,0,2,4
CM52-ECONOMIC DEVELOPMENT ADMINISTRATION,1,0,0,0,0,0,0,0,0,1,0,0,0,0,0,0,0,0,0,0,1,0,0,0,0,0,0,0,0,0,0,0,0,0,0,0,0,0,0,0,0,0,1
CM53-BUREAU OF ECONOMIC ANALYSIS,2,0,0,0,0,0,0,0,0,2,0,0,0,0,0,0,0,0,0,0,2,0,2,0,0,0,0,0,0,0,2,0,0,0,0,0,0,0,0,0,0,2,4
CM54-NATIONAL OCEANIC AND ATMOSPHERIC ADMINISTRATION,10,4,0,0,0,0,0,0,0,14,0,0,0,0,0,0,0,0,0,0,14,2,30,7,1,0,2,0,0,0,42,1,1,1,1,0,0,0,0,4,0,46,60
