Agency,10-Competitive Service - Career,15-Competitive Service - Career-Conditional,30-Excepted Service - Schedule A,32-Excepted Service - Schedule B,36-Excepted Service - Executive,38-Excepted Service - Other,50-Senior Executive Service - Career,55-Senior Executive Service - Non-Career,**-Unspecified,Permanent,20-Competitive Service,40-Excepted Service - Schedule A,42-Excepted Service - Schedule B,44-Excepted Service - Schedule C,46-Excepted Service - Executive,48-Excepted Service - Other,60-Senior Executive Service - Limited Term,65-Senior Executive Service - Limited Emergency,Non-permanent,Unspecified,Type of Appointment - All,10-Competitive Service - Career,15-Competitive Service - Career-Conditional,30-Excepted Service - Schedule A,32-Excepted Service - Schedule B,36-Excepted Service - Executive,38-Excepted Service - Other,50-Senior Executive Service - Career,55-Senior Executive Service - Non-Career,**-Unspecified,Permanent,20-Competitive Service,40-Excepted Service - Schedule A,42-Excepted Service - Schedule B,44-Excepted Service - Schedule C,46-Excepted Service - Executive,48-Excepted Service - Other,60-Senior Executive Service - Limited Term,65-Senior Executive Service - Limited Emergency,Non-permanent,Unspecified,Type of Appointment - All,Type of Appointment - All
AB**-UNSPECIFIED,0,0,0,0,0,0,0,0,0,0,0,0,0,0,0,0,0,0,0,0,0,0,0,0,0,0,0,0,0,0,0,0,0,0,0,0,0,0,0,0,0,0,0
AB00-AMERICAN BATTLE MONUMENTS COMMISSION,0,0,0,0,0,0,0,0,0,0,0,0,0,0,0,0,0,0,0,0,0,0,0,0,0,0,1,0,0,0,1,0,0,0,0,0,0,0,0,0,0,1,1
AF**-UNSPECIFIED,0,0,0,0,0,0,0,0,0,0,0,0,0,0,0,0,0,0,0,0,0,0,0,0,0,0,0,0,0,0,0,0,0,0,0,0,0,0,0,0,0,0,0
AF02-AIR FORCE INSPECTION AND SAFETY CENTER,0,0,0,0,0,0,0,0,0,0,0,0,0,0,0,0,0,0,0,0,0,0,0,0,0,0,0,0,0,0,0,0,0,0,0,0,0,0,0,0,0,0,0
AF03-AIR FORCE OPERATIONAL TEST AND EVALUATION CENTER,0,0,0,0,0,0,0,0,0,0,0,0,0,0,0,0,0,0,0,0,0,0,0,0,0,0,0,0,0,0,0,0,0,2,0,0,0,0,0,2,0,2,2
AF04-AIR FORCE COMMUNICATIONS AGENCY,0,0,0,0,0,0,0,0,0,0,0,0,0,0,0,0,0,0,0,0,0,1,0,0,0,0,0,0,0,0,1,0,0,2,0,0,0,0,0,2,0,3,3
AF05-AIR FORCE INTELLIGENCE SERVICE,0,0,0,0,0,0,0,0,0,0,0,0,0,0,0,0,0,0,0,0,0,0,0,0,0,0,2,0,0,0,2,0,0,0,0,0,0,0,0,0,0,2,2
AF06-AIR FORCE AUDIT AGENCY,0,0,0,0,0,0,0,0,0,0,0,0,0,0,0,0,0,0,0,0,0,1,0,0,0,0,0,0,0,0,1,0,0,1,0,0,0,0,0,1,0,2,2
AF07-AIR FORCE OFFICE OF SPECIAL INVESTIGATIONS,1,0,0,0,0,0,0,0,0,1,0,0,0,0,0,0,0,0,0,0,1,2,0,0,0,0,2,0,0,0,4,0,0,0,0,0,0,0,0,0,0,4,5
AF08-AIR FORCE OFFICE OF SECURITY POLICE,0,0,0,0,0,0,0,0,0,0,0,0,0,0,0,0,0,0,0,0,0,0,0,0,0,0,0,0,0,0,0,0,0,0,0,0,0,0,0,0,0,0,0
AF09-AIR FORCE PERSONNEL CENTER,1,0,0,0,0,0,0,0,0,1,0,0,0,0,0,0,0,0,0,0,1,0,1,0,0,0,1,0,0,0,2,0,0,1,0,0,0,0,0,1,0,3,4
AF0B-U.S. AIR FORCE ACADEMY,0,0,0,0,0,0,0,0,0,0,0,0,0,0,0,0,0,0,0,0,0,3,4,0,0,0,2,0,0,0,9,1,1,34,0,0,0,0,0,36,1,46,46
"AF0D-U.S. AIR FORCES, EUROPE",1,0,0,0,0,0,0,0,0,1,0,0,0,0,0,0,0,0,0,0,1,1,0,0,0,0,0,0,0,0,1,0,11,0,0,0,0,0,0,11,0,12,13
AF0J-AIR EDUCATION AND TRAINING COMMAND,3,1,0,0,0,0,0,0,0,4,0,0,0,0,0,0,0,0,0,0,4,13,36,0,0,0,12,0,0,0,61,38,2,195,0,0,0,0,0,235,0,296,300
"AF0M-HEADQUARTERS, AIR FORCE RESERVE",0,1,0,0,0,0,0,0,0,1,0,0,0,0,0,0,0,0,0,0,1,15,32,0,0,0,18,0,0,0,65,6,0,39,0,0,0,0,0,45,0,110,111
"AF0N-IMMEDIATE OFFICE, HEADQUARTERS, USAF",1,0,0,0,0,0,1,0,0,2,0,0,0,0,0,0,0,0,0,0,2,7,0,2,0,0,0,1,0,0,10,0,0,2,0,0,0,0,0,2,0,12,14
AF0R-PACIFIC AIR FORCES,5,1,0,0,0,0,0,0,0,6,0,0,0,0,0,0,0,0,0,0,6,5,8,0,0,0,2,0,0,0,15,12,9,26,0,0,0,0,0,47,0,62,68
"AF0U-AIR FORCE INTELLIGENCE, SURVEILLANCE, & RECONNAISSANCE AGENCY",0,0,0,0,0,0,0,0,0,0,0,0,0,0,0,0,0,0,0,0,0,0,0,0,0,0,8,0,0,0,8,0,0,0,0,0,1,0,0,1,0,9,9
AF0V-AIR FORCE SPECIAL OPERATIONS COMMAND,0,0,0,0,0,0,0,0,0,0,0,0,0,0,0,0,0,0,0,0,0,1,3,0,0,0,1,0,0,0,5,1,2,33,0,0,0,0,0,36,0,41,41
AF10-AIR FORCE CENTER FOR QUALITY AND MANAGEMENT INNOVATION,0,0,0,0,0,0,0,0,0,0,0,0,0,0,0,0,0,0,0,0,0,0,0,0,0,0,0,0,0,0,0,0,0,0,0,0,0,0,0,0,0,0,0
AF11-AIR FORCE MANPOWER AGENCY,0,0,0,0,0,0,0,0,0,0,0,0,0,0,0,0,0,0,0,0,0,0,0,0,0,0,0,0,0,0,0,0,0,0,0,0,0,0,0,0,0,0,0
"AF1A-AIR FORCE C2 & INTELLIGENCE, SURVEILLANCE & RECONNAISSANCE",0,0,0,0,0,0,0,0,0,0,0,0,0,0,0,0,0,0,0,0,0,0,0,0,0,0,0,0,0,0,0,0,0,0,0,0,0,0,0,0,0,0,0
AF1C-AIR COMBAT COMMAND,5,2,0,0,0,1,0,0,0,8,0,0,0,0,0,0,0,0,0,0,8,9,28,0,0,0,10,0,0,0,47,10,18,105,0,0,0,0,0,133,0,180,188
AF1G-AIR FORCE LOGISTICS MANAGEMENT AGENCY,0,0,0,0,0,0,0,0,0,0,0,0,0,0,0,0,0,0,0,0,0,0,0,0,0,0,0,0,0,0,0,0,0,0,0,0,0,0,0,0,0,0,0
AF1L-AIR MOBILITY COMMAND,1,1,0,0,0,1,0,0,0,3,0,0,0,0,0,0,0,0,0,0,3,10,16,0,0,0,7,0,0,0,33,17,32,144,0,0,0,0,0,193,0,226,229
AF1M-AIR FORCE MATERIEL COMMAND,7,0,0,0,0,1,0,0,0,8,0,0,0,0,0,0,0,0,0,0,8,28,151,1,119,0,18,0,0,0,317,40,6,206,0,0,0,0,0,252,0,569,577
AF1P-AIR FORCE REAL PROPERTY AGENCY,0,0,0,0,0,0,0,0,0,0,0,0,0,0,0,0,0,0,0,0,0,0,0,0,0,0,0,0,0,0,0,0,0,0,0,0,0,0,0,0,0,0,0
AF1Q-HQ AF FLIGHT STANDARDS AGENCY,0,0,0,0,0,0,0,0,0,0,0,0,0,0,0,0,0,0,0,0,0,0,0,0,0,0,0,0,0,0,0,0,0,0,0,0,0,0,0,0,0,0,0
AF1S-SPACE COMMAND,5,0,0,0,0,0,0,0,0,5,0,0,0,0,0,0,0,0,0,0,5,14,18,0,6,0,13,0,0,0,51,5,3,40,0,0,0,0,0,48,0,99,104
AF1W-AIR FORCE ENGINEERING AND SERVICES CENTER,0,0,0,0,0,0,0,0,0,0,0,0,0,0,0,0,0,0,0,0,0,0,0,0,0,0,0,0,0,0,0,1,0,0,0,0,0,0,0,1,0,1,1
AF1Y-AIR FORCE CIVILIAN CAREER TRAINING,0,0,0,0,0,0,0,0,0,0,0,0,0,0,0,0,0,0,0,0,0,0,2,0,2,0,0,0,0,0,4,0,0,0,0,0,0,0,0,0,0,4,4
AF21-AIR FORCE NUCLEAR WEAPONS AGENCY,0,0,0,0,0,0,0,0,0,0,0,0,0,0,0,0,0,0,0,0,0,0,0,0,0,0,0,0,0,0,0,0,0,0,0,0,0,0,0,0,0,0,0
AF24-HQ USAF DIRECT SUPPORT ELEMENT,0,0,0,0,0,0,0,0,0,0,0,0,0,0,0,0,0,0,0,0,0,1,1,0,0,0,0,0,0,0,2,0,0,1,0,0,0,0,0,1,0,3,3
AF25-AF-WIDE SUPPORT ELEMENT,0,0,0,0,0,0,0,0,0,0,0,0,0,0,0,0,0,0,0,0,0,0,0,0,0,0,0,0,0,0,0,0,43,0,0,0,0,0,0,43,0,43,43
AF27-AIR FORCE AGENCY FOR MODELING AND SIMULATION,0,0,0,0,0,0,0,0,0,0,0,0,0,0,0,0,0,0,0,0,0,0,0,0,0,0,0,0,0,0,0,0,0,0,0,0,0,0,0,0,0,0,0
AF2A-AIR FORCE COST CENTER,0,0,0,0,0,0,0,0,0,0,0,0,0,0,0,0,0,0,0,0,0,0,0,0,0,0,0,0,0,0,0,0,0,0,0,0,0,0,0,0,0,0,0
AF2B-AIR FORCE DOCTRINE CENTER,0,0,0,0,0,0,0,0,0,0,0,0,0,0,0,0,0,0,0,0,0,0,0,0,0,0,0,0,0,0,0,0,0,0,0,0,0,0,0,0,0,0,0
AF2D-AIR FORCE PERSONNEL OPERATIONS AGENCY,0,0,0,0,0,0,0,0,0,0,0,0,0,0,0,0,0,0,0,0,0,0,0,0,0,0,0,0,0,0,0,0,0,0,0,0,0,0,0,0,0,0,0
AF2E-AIR FORCE LEGAL SERVICES CENTER,0,0,0,0,0,0,0,0,0,0,0,0,0,0,0,0,0,0,0,0,0,0,0,0,0,0,0,0,0,0,0,0,0,0,0,0,0,0,0,0,0,0,0
AF2F-AIR FORCE MEDICAL SERVICES CENTER,0,0,0,0,0,0,0,0,0,0,0,0,0,0,0,0,0,0,0,0,0,1,0,0,0,0,0,0,0,0,1,0,1,0,0,0,0,0,0,1,0,2,2
AF2G-AIR FORCE SERVICE INFORMATION AND NEWS CENTER,0,0,0,0,0,0,0,0,0,0,0,0,0,0,0,0,0,0,0,0,0,1,0,0,0,0,0,0,0,0,1,0,0,0,0,0,0,0,0,0,0,1,1
AF2I-AIR NATIONAL GUARD SUPPORT CENTER,0,0,0,0,0,0,0,0,0,0,0,0,0,0,0,0,0,0,0,0,0,0,0,0,0,0,0,0,0,0,0,0,0,0,0,0,0,0,0,0,0,0,0
AF2K-U.S. AIR FORCE HISTORICAL RESEARCH CENTER,0,0,0,0,0,0,0,0,0,0,0,0,0,0,0,0,0,0,0,0,0,0,0,0,0,0,0,0,0,0,0,0,0,0,0,0,0,0,0,0,0,0,0
AF2L-AIR FORCE TECHNICAL APPLICATIONS CENTER,0,0,0,0,0,0,0,0,0,0,0,0,0,0,0,0,0,0,0,0,0,0,0,0,0,0,0,0,0,0,0,0,0,0,0,0,0,0,0,0,0,0,0
AF2M-AIR FORCE REVIEW BOARDS OFFICE,0,0,0,0,0,0,0,0,0,0,0,0,0,0,0,0,0,0,0,0,0,0,0,0,0,0,0,0,0,0,0,0,0,0,0,0,0,0,0,0,0,0,0
AF2N-AIR FORCE CENTER FOR STUDIES AND ANALYSES,0,0,0,0,0,0,0,0,0,0,0,0,0,0,0,0,0,0,0,0,0,0,0,0,0,0,0,0,0,0,0,0,0,0,0,0,0,0,0,0,0,0,0
AF2Q-AIR WEATHER SERVICE,0,0,0,0,0,0,0,0,0,0,0,0,0,0,0,0,0,0,0,0,0,0,0,0,0,0,1,0,0,0,1,0,0,0,0,0,0,0,0,0,0,1,1
AF2R-AIR FORCE PROGRAM EXECUTIVE OFFICE,2,0,0,0,0,0,0,0,0,2,0,0,0,0,0,0,0,0,0,0,2,0,1,0,0,0,0,0,0,0,1,0,0,0,0,0,0,0,0,0,0,1,3
AF2S-HQ NORAD,0,0,0,0,0,0,0,0,0,0,0,0,0,0,0,0,0,0,0,0,0,0,0,0,0,0,0,0,0,0,0,0,0,0,0,0,0,0,0,0,0,0,0
AF2T-AIR FORCE SUPPLY CENTER,0,0,0,0,0,0,0,0,0,0,0,0,0,0,0,0,0,0,0,0,0,1,0,1,0,0,0,0,0,0,2,0,0,0,0,0,0,0,0,0,0,2,2
"AF2U-AIR FORCE MORALE, WELFARE AND RECREATION CENTER",0,0,0,0,0,0,0,0,0,0,0,0,0,0,0,0,0,0,0,0,0,0,0,0,0,0,0,0,0,0,0,0,0,0,0,0,0,0,0,0,0,0,0
AF2W-11TH WING,0,0,0,0,0,0,0,0,0,0,0,0,0,0,0,0,0,0,0,0,0,0,0,0,0,0,0,0,0,0,0,0,0,1,0,0,0,0,0,1,0,1,1
AF2Y-AIR FORCE PENTAGON COMMUNICATIONS AGENCY,0,0,0,0,0,0,0,0,0,0,0,0,0,0,0,0,0,0,0,0,0,0,0,0,0,0,0,0,0,0,0,0,0,0,0,0,0,0,0,0,0,0,0
AF2Z-HQ AIR FORCE MEDICAL OPERATIONS AGENCY,0,0,0,0,0,0,0,0,0,0,0,0,0,0,0,0,0,0,0,0,0,0,0,0,0,0,0,0,0,0,0,0,0,1,0,0,0,0,0,1,0,1,1
AF34-AIR NATIONAL GUARD UNITS (MOBILIZATION) (TITLE 5),0,0,0,0,0,0,0,0,0,0,0,0,0,0,0,0,0,0,0,0,0,0,0,0,0,0,1,0,0,0,1,0,0,18,0,0,0,0,0,18,0,19,19
"AF3C-AIR FORCE ELEMENTS, U.S. CENTRAL COMMAND",0,0,0,0,0,0,0,0,0,0,0,0,0,0,0,0,0,0,0,0,0,0,0,0,0,0,0,0,0,0,0,0,1,0,0,0,1,0,0,2,0,2,2
"AF3D-AIR FORCE ELEMENTS, U.S. SPECIAL OPERATIONS COMMAND",2,0,0,0,0,0,0,0,0,2,0,0,0,0,0,0,0,0,0,0,2,7,0,0,0,0,6,0,0,0,13,1,0,1,0,0,0,0,0,2,0,15,17
"AF3N-AIR FORCE ELEMENTS, U.S. ATLANTIC COMMAND",0,0,0,0,0,0,0,0,0,0,0,0,0,0,0,0,0,0,0,0,0,0,0,0,0,0,0,0,0,0,0,3,0,0,0,0,0,0,0,3,0,3,3
"AF3Q-AIR FORCE ELEMENTS, U.S. STRATEGIC COMMAND",0,0,0,0,0,0,0,0,0,0,0,0,0,0,0,0,0,0,0,0,0,1,1,0,0,0,1,0,0,0,3,0,0,12,0,0,0,0,0,12,0,15,15
"AF3S-HEADQUARTERS, U.S. SPACE COMMAND AND NORAD",0,0,0,0,0,0,0,0,0,0,0,0,0,0,0,0,0,0,0,0,0,0,0,0,0,0,0,0,0,0,0,0,0,0,0,0,0,0,0,0,0,0,0
"AF3T-AIR FORCE ELEMENTS, U.S. TRANSPORTATION COMMAND",3,0,0,0,0,0,0,0,0,3,0,0,0,0,0,0,0,0,0,0,3,0,2,0,0,0,0,0,0,0,2,0,0,0,0,0,0,0,0,0,0,2,5
"AF3V-AIR FORCE ELEMENTS, OTHER THAN EUROPE",0,0,0,0,0,0,0,0,0,0,0,0,0,0,0,0,0,0,0,0,0,1,1,0,0,0,1,0,0,0,3,0,13,0,0,0,0,0,0,13,0,16,16
AF3W-AIR FORCE CENTER FOR ENVIRONMENTAL EXCELLENCE,0,0,0,0,0,0,0,0,0,0,0,0,0,0,0,0,0,0,0,0,0,0,0,0,0,0,0,0,0,0,0,0,1,0,0,0,0,0,0,1,0,1,1
AF3Y-AIR FORCE FREQUENCY MANAGEMENT AGENCY,0,0,0,0,0,0,0,0,0,0,0,0,0,0,0,0,0,0,0,0,0,0,0,0,0,0,0,0,0,0,0,0,0,0,0,0,0,0,0,0,0,0,0
"AF4D-AIR FORCE ELEMENTS, U.S. NORTHERN COMMAND",0,0,0,0,0,0,0,0,0,0,0,0,0,0,0,0,0,0,0,0,0,1,0,0,0,0,0,0,0,0,1,0,0,0,0,0,0,0,0,0,0,1,1
AF4W-AIR FORCE DISTRICT OF WASHINGTON,2,1,0,0,0,0,0,0,0,3,0,0,0,0,0,0,0,0,0,0,3,4,2,0,0,0,2,0,0,0,8,1,0,5,0,0,0,0,0,6,0,14,17
AF5J-AIR FORCE FINANCIAL SERVICES,0,0,0,0,0,0,0,0,0,0,0,0,0,0,0,0,0,0,0,0,0,0,0,0,0,0,0,0,0,0,0,0,0,0,0,0,0,0,0,0,0,0,0
AF5K-AIR FORCE PETROLEUM AGENCY,0,0,0,0,0,0,0,0,0,0,0,0,0,0,0,0,0,0,0,0,0,0,0,0,0,0,0,0,0,0,0,0,0,0,0,0,0,0,0,0,0,0,0
AFNG-AIR NATIONAL GUARD UNITS (TITLE 32),0,0,0,0,0,0,0,0,0,0,0,0,0,0,0,0,0,0,0,0,0,0,1,0,0,0,78,0,0,0,79,0,4,0,0,0,333,0,0,337,1,417,417
"AFZG-U.S. SPECIAL OPERATIONS COMMAND (ANG, TITLE 32)",0,0,0,0,0,0,0,0,0,0,0,0,0,0,0,0,0,0,0,0,0,0,0,0,0,0,0,0,0,0,0,0,0,0,0,0,12,0,0,12,0,12,12
AFZS-U.S. SPECIAL OPERATIONS COMMAND (AIR FORCE),0,0,0,0,0,0,0,0,0,0,0,0,0,0,0,0,0,0,0,0,0,0,0,0,0,0,0,0,0,0,0,0,0,0,0,0,0,0,0,0,0,0,0
AG01-OFFICE OF THE SECRETARY OF AGRICULTURE,0,0,0,0,0,0,0,0,0,0,0,0,0,0,0,0,0,0,0,0,0,0,0,0,0,0,0,0,0,0,0,0,0,2,0,0,0,0,0,2,0,2,2
AG02-AGRICULTURAL MARKETING SERVICE,0,0,0,0,0,0,0,0,0,0,0,0,0,0,0,0,0,0,0,0,0,0,7,0,13,0,0,0,0,0,20,1,0,9,0,0,0,0,0,10,0,30,30
AG03-AGRICULTURAL RESEARCH SERVICE,2,3,0,0,0,0,0,0,0,5,0,0,0,0,0,0,0,0,0,0,5,2,33,0,0,0,0,0,0,0,35,15,140,384,0,0,0,0,0,539,0,574,579
AG07-RURAL HOUSING SERVICE,3,0,0,0,0,0,0,0,0,3,0,0,0,0,0,0,0,0,0,0,3,1,1,0,1,0,0,1,0,0,4,0,0,15,0,0,0,0,0,15,0,19,22
AG08-RISK MANAGEMENT AGENCY,0,0,0,0,0,0,0,0,0,0,0,0,0,0,0,0,0,0,0,0,0,0,0,0,0,0,0,0,0,0,0,0,1,9,0,0,0,0,0,10,0,10,10
AG10-FOREIGN AGRICULTURAL SERVICE,1,0,0,0,0,0,0,0,0,1,0,0,0,0,0,0,0,0,0,0,1,0,2,0,0,0,0,0,0,0,2,0,0,11,0,0,0,0,0,11,0,13,14
AG11-FOREST SERVICE,23,9,0,0,0,0,0,0,0,32,0,0,0,0,0,0,0,0,0,0,32,5,68,1,51,0,2,0,0,0,127,2751,13,1485,2,0,21,0,0,4272,0,4399,4431
AG13-OFFICE OF COMMUNICATIONS,0,0,0,0,0,0,0,0,0,0,0,0,0,0,0,0,0,0,0,0,0,0,0,0,0,0,0,0,0,0,0,0,0,2,0,0,0,0,0,2,0,2,2
AG14-OFFICE OF THE GENERAL COUNSEL,0,0,0,0,0,0,0,0,0,0,0,0,0,0,0,0,0,0,0,0,0,0,1,0,0,0,0,0,0,0,1,0,0,0,1,0,0,0,0,1,0,2,2
AG15-RURAL UTILITIES SERVICE,0,0,0,0,0,0,0,0,0,0,0,0,0,0,0,0,0,0,0,0,0,0,3,0,0,0,0,0,0,0,3,0,0,15,0,0,0,0,0,15,0,18,18
AG16-NATURAL RESOURCES CONSERVATION SERVICE,1,1,0,0,0,0,0,0,0,2,0,0,0,0,0,0,0,0,0,0,2,1,7,0,48,0,0,0,0,0,56,2,38,90,0,0,3,0,0,133,0,189,191
AG18-ECONOMIC RESEARCH SERVICE,0,0,0,0,0,0,0,0,0,0,0,0,0,0,0,0,0,0,0,0,0,0,0,0,0,0,0,0,0,0,0,0,0,15,0,0,1,0,0,16,0,16,16
AG20-NATIONAL AGRICULTURAL STATISTICS SERVICE,2,0,0,0,0,0,0,0,0,2,0,0,0,0,0,0,0,0,0,0,2,1,1,0,1,0,0,0,0,0,3,0,0,6,0,0,0,0,0,6,0,9,11
"AG22-COOPERATIVE STATE RESEARCH, EDUCATION, AND EXTENSION SERVICE",0,0,0,0,0,0,0,0,0,0,0,0,0,0,0,0,0,0,0,0,0,1,0,0,0,0,0,0,0,0,1,0,1,0,0,0,0,0,0,1,0,2,2
AG23-OFFICE OF THE INSPECTOR GENERAL,0,0,0,0,0,0,0,0,0,0,0,0,0,0,0,0,0,0,0,0,0,0,0,0,0,0,0,0,0,0,0,0,0,1,0,0,0,0,0,1,0,1,1
AG30-FOOD AND NUTRITION SERVICE,0,0,0,0,0,0,0,0,0,0,0,0,0,0,0,0,0,0,0,0,0,0,2,0,1,0,0,0,0,0,3,0,0,2,0,0,0,0,0,2,0,5,5
AG32-RURAL BUSINESS-COOPERATIVE SERVICE,1,0,0,0,0,0,0,0,0,1,0,0,0,0,0,0,0,0,0,0,1,0,0,0,0,0,0,0,0,0,0,0,0,1,0,0,0,0,0,1,0,1,2
AG34-ANIMAL AND PLANT HEALTH INSPECTION SERVICE,6,1,0,0,0,0,0,0,0,7,0,0,0,0,0,0,0,0,0,0,7,4,21,0,4,0,0,0,0,0,29,9,115,27,0,0,0,0,0,151,0,180,187
"AG36-GRAIN INSPECTION, PACKERS AND STOCKYARDS ADMINISTRATION",0,0,0,0,0,0,0,0,0,0,0,0,0,0,0,0,0,0,0,0,0,0,0,0,0,0,0,0,0,0,0,0,3,1,0,0,0,0,0,4,0,4,4
AG37-FOOD SAFETY AND INSPECTION SERVICE,4,0,0,0,0,0,0,0,0,4,0,0,0,0,0,0,0,0,0,0,4,3,48,0,0,0,0,0,0,0,51,2,9,8,0,0,0,0,0,19,0,70,74
AG38-OFFICE OF THE CHIEF ECONOMIST,0,0,0,0,0,0,0,0,0,0,0,0,0,0,0,0,0,0,0,0,0,0,0,0,0,0,0,0,0,0,0,0,0,0,0,0,0,0,0,0,0,0,0
AG42-OFFICE OF BUDGET AND PROGRAM ANALYSIS,0,0,0,0,0,0,0,0,0,0,0,0,0,0,0,0,0,0,0,0,0,0,0,0,0,0,0,0,0,0,0,0,0,1,0,0,0,0,0,1,0,1,1
AG90-OFFICE OF THE CHIEF FINANCIAL OFFICER,1,0,0,0,0,0,0,0,0,1,0,0,0,0,0,0,0,0,0,0,1,1,6,0,0,0,0,0,0,0,7,0,0,0,0,0,0,0,0,0,0,7,8
AGCR-OFFICE OF CIVIL RIGHTS,0,0,0,0,0,0,0,0,0,0,0,0,0,0,0,0,0,0,0,0,0,0,0,0,0,0,0,0,0,0,0,0,0,1,0,0,0,0,0,1,0,1,1
AGDA-DEPARTMENTAL ADMINISTRATION,0,0,0,0,0,0,0,0,0,0,0,0,0,0,0,0,0,0,0,0,0,0,0,0,0,0,0,0,0,0,0,0,0,1,0,0,0,0,0,1,0,1,1
AGES-OFFICE OF THE EXECUTIVE SECRETARIAT,0,0,0,0,0,0,0,0,0,0,0,0,0,0,0,0,0,0,0,0,0,0,0,0,0,0,0,0,0,0,0,0,0,0,0,0,0,0,0,0,0,0,0
AGFA-FARM SERVICE AGENCY,2,0,0,0,0,0,0,0,0,2,0,0,0,0,0,0,0,0,0,0,2,1,6,0,3,0,0,0,0,0,10,0,2,58,1,0,0,0,0,61,0,71,73
AGHL-HOMELAND SECURITY STAFF,0,0,0,0,0,0,0,0,0,0,0,0,0,0,0,0,0,0,0,0,0,0,0,0,0,0,0,0,0,0,0,0,0,0,0,0,0,0,0,0,0,0,0
AGHS-HOMELAND SECURITY STAFF,0,0,0,0,0,0,0,0,0,0,0,0,0,0,0,0,0,0,0,0,0,0,0,0,0,0,0,0,0,0,0,0,0,0,0,0,0,0,0,0,0,0,0
AGIT-OFFICE OF THE CHIEF INFORMATION OFFICER,1,0,0,0,0,0,0,0,0,1,0,0,0,0,0,0,0,0,0,0,1,0,0,0,0,0,0,0,0,0,0,0,1,0,0,0,0,0,0,1,0,1,2
AGNA-NATIONAL APPEALS DIVISION,0,0,0,0,0,0,0,0,0,0,0,0,0,0,0,0,0,0,0,0,0,0,0,0,0,0,0,0,0,0,0,0,0,0,0,0,0,0,0,0,0,0,0
AH01-NATIONAL ENDOWMENT FOR THE ARTS,0,0,0,0,0,0,0,0,0,0,0,0,0,0,0,0,0,0,0,0,0,0,0,0,0,0,1,0,0,0,1,0,0,1,0,0,0,0,0,1,0,2,2
AH02-NATIONAL ENDOWMENT FOR THE HUMANITIES,0,0,0,0,0,0,0,0,0,0,0,0,0,0,0,0,0,0,0,0,0,0,0,0,0,0,0,0,0,0,0,0,0,0,0,0,0,0,0,0,0,0,0
AH03-INSTITUTE OF MUSEUM AND LIBRARY SERVICES,1,0,0,0,0,0,0,0,0,1,0,0,0,0,0,0,0,0,0,0,1,0,0,0,0,0,0,0,0,0,0,0,0,0,0,3,1,0,0,4,0,4,5
AI00-U.S. INSTITUTE OF PEACE,0,0,0,0,0,0,0,0,0,0,0,0,0,0,0,0,0,0,0,0,0,0,0,0,0,0,0,0,0,0,0,0,0,0,0,0,0,0,0,0,0,0,0
AM00-AGENCY FOR INTERNATIONAL DEVELOPMENT,0,0,0,0,0,0,0,0,0,0,0,0,0,0,0,0,0,0,0,0,0,0,2,1,0,0,0,0,0,0,3,0,0,0,0,0,2,0,0,2,0,5,5
AN00-AFRICAN DEVELOPMENT FOUNDATION,0,0,0,0,0,0,0,0,0,0,0,0,0,0,0,0,0,0,0,0,0,0,0,0,0,0,0,0,0,0,0,0,0,0,0,0,0,0,0,0,0,0,0
AP00-APPALACHIAN REGIONAL COMMISSION,0,1,0,0,0,0,0,0,0,1,0,0,0,0,0,0,0,0,0,0,1,0,0,0,0,0,0,0,0,0,0,0,0,0,0,0,0,0,0,0,0,0,1
AR**-UNSPECIFIED,0,0,0,0,0,0,0,0,0,0,0,0,0,0,0,0,0,0,0,0,0,0,0,0,0,0,0,0,0,0,0,0,0,0,0,0,0,0,0,0,0,0,0
AR3A-U.S. ARMY CENTRAL,0,0,0,0,0,0,0,0,0,0,0,0,0,0,0,0,0,0,0,0,0,0,0,0,0,0,0,0,0,0,0,0,0,0,0,0,0,0,0,0,0,0,0
AR5A-U.S. ARMY NORTH,0,0,0,0,0,0,0,0,0,0,0,0,0,0,0,0,0,0,0,0,0,0,0,0,0,0,0,0,0,0,0,0,0,0,0,0,0,0,0,0,0,0,0
ARAC-U.S. ARMY CONTRACTING AGENCY,6,0,0,0,0,0,0,0,0,6,0,0,0,0,0,0,0,0,0,0,6,4,6,1,2,0,3,0,0,0,16,2,0,4,0,0,5,0,0,11,1,28,34
ARAE-U.S. ARMY ACQUISITION SUPPORT CENTER,3,0,0,0,0,0,0,0,0,3,0,0,0,0,0,0,0,0,0,0,3,4,0,0,2,0,1,0,0,0,7,1,0,9,0,0,3,0,0,13,0,20,23
ARAS-U.S. ARMY INTELLIGENCE AND SECURITY COMMAND,0,0,0,0,0,0,0,0,0,0,0,0,0,0,0,0,0,0,0,0,0,0,0,0,0,0,17,0,0,0,17,0,0,0,0,0,0,0,0,0,0,17,17
ARAT-U.S. ARMY TEST AND EVALUATION COMMAND,0,0,0,0,0,0,0,0,0,0,0,0,0,0,0,0,0,0,0,0,0,4,4,0,0,0,2,0,0,0,10,2,0,57,0,0,17,0,0,76,0,86,86
ARAU-U.S. ARMY AUDIT AGENCY,0,0,0,0,0,0,0,0,0,0,0,0,0,0,0,0,0,0,0,0,0,0,0,0,8,0,2,0,0,0,10,0,0,0,0,0,0,0,0,0,0,10,10
ARBA-U.S. ARMY INSTALLATION MANAGEMENT COMMAND,16,9,0,0,0,0,0,0,0,25,0,0,0,0,0,0,0,0,0,0,25,30,91,1,4,0,29,0,0,0,155,84,23,92,0,0,56,0,0,255,0,410,435
ARCB-U.S. ARMY CRIMINAL INVESTIGATION COMMAND,0,0,0,0,0,0,0,0,0,0,0,0,0,0,0,0,0,0,0,0,0,1,0,0,0,0,0,0,0,0,1,2,0,1,0,0,0,0,0,3,0,4,4
ARCE-U.S. ARMY CORPS OF ENGINEERS,26,3,0,0,0,0,0,0,0,29,0,0,0,0,0,0,0,0,0,0,29,9,44,2,70,0,22,0,0,0,147,153,6,422,0,0,60,0,0,641,0,788,817
ARCS-IMMEDIATE OFFICE OF THE CHIEF OF STAFF OF THE ARMY,1,0,0,0,0,0,0,0,0,1,0,0,0,0,0,0,0,0,0,0,1,5,0,0,0,0,1,0,0,0,6,0,0,1,0,0,0,0,0,1,0,7,8
ARE1-IMMEDIATE OFFICE OF THE COMMANDER-IN-CHIEF OF THE U.S. ARMY EUROPE AND SEVENTH ARMY,1,0,0,0,0,0,0,0,0,1,0,0,0,0,0,0,0,0,0,0,1,0,1,0,0,0,0,0,0,0,1,0,1,9,0,0,0,0,0,10,0,11,12
ARE2-21ST THEATER SUSTAINMENT COMMAND (TSC),0,0,0,0,0,0,0,0,0,0,0,0,0,0,0,0,0,0,0,0,0,0,0,0,0,0,0,0,0,0,0,0,2,0,0,0,0,0,0,2,0,2,2
ARE3-U.S. ARMY SOUTHERN EURPOEAN TASK FORCE,0,0,0,0,0,0,0,0,0,0,0,0,0,0,0,0,0,0,0,0,0,0,0,0,0,0,0,0,0,0,0,0,0,0,0,0,0,0,0,0,0,0,0
ARE5-U.S. ARMY V CORPS,0,0,0,0,0,0,0,0,0,0,0,0,0,0,0,0,0,0,0,0,0,0,0,0,0,0,0,0,0,0,0,0,1,0,0,0,0,0,0,1,0,1,1
AREB-1ST PERSONNEL COMMAND,0,0,0,0,0,0,0,0,0,0,0,0,0,0,0,0,0,0,0,0,0,0,0,0,0,0,1,0,0,0,1,0,0,0,0,0,0,0,0,0,0,1,1
AREN-SEVENTH ARMY TRAINING COMMAND,0,0,0,0,0,0,0,0,0,0,0,0,0,0,0,0,0,0,0,0,0,0,0,0,0,0,0,0,0,0,0,0,0,0,0,0,0,0,0,0,0,0,0
ARFC-U.S. ARMY FORCES COMMAND,1,0,0,0,0,0,0,0,0,1,0,0,0,0,0,0,0,0,0,0,1,5,3,1,0,0,3,0,0,0,12,11,1,0,0,0,3,0,0,15,0,27,28
ARFL-U.S. ARMY SOUTH COMMAND,0,0,0,0,0,0,0,0,0,0,0,0,0,0,0,0,0,0,0,0,0,0,0,0,0,0,0,0,0,0,0,2,0,0,0,0,0,0,0,2,0,2,2
ARG6-U.S. ARMY NETWORK ENTERPRISE TECHNOLOGY COMMAND/9TH ARMY SIGNAL COMMAND,1,0,0,0,0,0,0,0,0,1,0,0,0,0,0,0,0,0,0,0,1,1,1,0,0,0,0,0,0,0,2,1,0,0,0,0,2,0,0,3,0,5,6
ARGB-OFFICE OF THE CHIEF OF THE NATIONAL GUARD BUREAU,3,0,0,0,0,0,0,0,0,3,0,0,0,0,0,0,0,0,0,0,3,2,1,0,0,0,0,0,0,0,3,1,0,3,0,0,0,0,0,4,0,7,10
ARHR-U.S. ARMY RESERVE COMMAND,3,1,0,0,0,0,0,0,0,4,0,0,0,0,0,0,0,0,0,0,4,0,39,0,0,0,20,0,0,0,59,6,0,0,0,0,1,0,0,7,0,66,70
ARJ1-U.S. ARMY ELEMENT SHAPE,0,0,0,0,0,0,0,0,0,0,0,0,0,0,0,0,0,0,0,0,0,0,0,0,0,0,2,0,0,0,2,0,0,0,0,0,0,0,0,0,0,2,2
ARJA-JOINT ACTIVITIES,1,0,0,0,0,0,0,0,0,1,0,0,0,0,0,0,0,0,0,0,1,1,5,0,0,0,8,0,0,0,14,3,1,0,0,0,2,0,0,6,0,20,21
ARMA-U.S. MILITARY ACADEMY,1,0,0,0,0,0,0,0,0,1,0,0,0,0,0,0,0,0,0,0,1,3,1,1,0,0,0,0,0,0,5,1,0,6,0,0,0,0,0,7,0,12,13
ARMC-U.S. ARMY MEDICAL COMMAND,14,6,0,0,0,0,0,0,0,20,0,0,0,0,0,0,0,0,0,0,20,38,218,0,0,0,24,0,0,0,280,81,15,27,0,0,4,0,0,127,0,407,427
ARMP-U.S. ARMY HUMAN RESOURCES COMMAND,2,0,0,0,0,0,0,0,0,2,0,0,0,0,0,0,0,0,0,0,2,1,2,0,0,0,0,0,0,0,3,2,0,3,0,0,0,0,0,5,0,8,10
ARMT-MILITARY SURFACE DEPLOYMENT AND DISTRIBUTION COMMAND,6,0,0,0,0,0,0,0,0,6,0,0,0,0,0,0,0,0,0,0,6,1,5,0,0,0,0,0,0,0,6,0,0,5,0,0,0,0,0,5,0,11,17
ARMW-U.S. ARMY MILITARY DISTRICT OF WASHINGTON,1,0,0,0,0,0,0,0,0,1,0,0,0,0,0,0,0,0,0,0,1,0,3,0,0,0,0,0,0,0,3,0,0,0,0,0,0,0,0,0,0,3,4
ARNG-ARMY NATIONAL GUARD UNITS (TITLE 32),0,0,0,0,0,0,0,0,0,0,0,0,0,0,0,0,0,0,0,0,0,1,3,0,0,0,171,0,0,0,175,0,56,0,0,0,299,0,0,355,0,530,530
"ARP1-U.S. ARMY, PACIFIC",0,0,0,0,0,0,0,0,0,0,0,0,0,0,0,0,0,0,0,0,0,1,3,0,0,0,1,0,0,0,5,2,0,0,0,0,0,0,0,2,0,7,7
ARP8-EIGHTH U.S. ARMY,1,0,0,0,0,0,0,0,0,1,0,0,0,0,0,0,0,0,0,0,1,0,1,0,0,0,0,0,0,0,1,1,0,0,0,0,8,0,0,9,0,10,11
ARPC-MILITARY ENTRANCE PROCESSING COMMAND,0,0,0,0,0,0,0,0,0,0,0,0,0,0,0,0,0,0,0,0,0,0,0,0,0,0,0,0,0,0,0,0,0,0,0,0,0,0,0,0,0,0,0
ARRC-U.S. ARMY RECRUITING COMMAND,0,0,0,0,0,0,0,0,0,0,0,0,0,0,0,0,0,0,0,0,0,0,0,0,0,0,0,0,0,0,0,0,0,0,0,0,0,0,0,0,0,0,0
ARSA-OFFICE OF THE SECRETARY OF THE ARMY,1,0,0,0,0,0,0,0,0,1,0,0,0,0,0,0,0,0,0,0,1,1,0,0,0,0,0,0,0,0,1,0,0,2,0,0,5,0,0,7,0,8,9
ARSB-FIELD OPERATING OFFICES OF THE OFFICE OF THE SECRETARY OF THE ARMY,0,0,0,0,0,0,0,0,0,0,0,0,0,0,0,0,0,0,0,0,0,1,1,0,9,0,6,0,0,0,17,0,24,4,0,0,6,0,0,34,0,51,51
ARSC-U. S. ARMY SPACE AND MISSILE DEFENSE COMMAND/U. S. ARMY FORCES STRATEGIC COMMAND,1,0,0,0,0,0,0,0,0,1,0,0,0,0,0,0,0,0,0,0,1,0,3,0,1,0,0,0,0,0,4,3,0,0,0,0,0,0,0,3,0,7,8
ARSE-FIELD OPERATING AGENCIES OF THE ARMY STAFF RESOURCED THROUGH OA-22,11,0,0,0,0,0,0,0,0,11,0,0,0,0,0,0,0,0,0,0,11,20,6,1,4,0,3,0,0,0,34,1,0,65,0,0,4,0,0,70,0,104,115
ARSF-FIELD OPERATING AGENCIES OF THE ARMY STAFF,0,0,0,0,0,0,0,0,0,0,0,0,0,0,0,0,0,0,0,0,0,0,0,1,0,0,0,0,0,0,1,0,0,1,0,0,1,0,0,2,0,3,3
"ARSJ-JOINT SERVICES AND ACTIVITIES SUPPORTED BY THE OFFICE, SECRETARY OF THE ARMY",0,0,0,0,0,0,0,0,0,0,0,0,0,0,0,0,0,0,0,0,0,0,1,0,0,0,0,0,0,0,1,0,4,6,0,0,5,0,0,15,0,16,16
ARSO-U.S. ARMY SOUTH,0,0,0,0,0,0,0,0,0,0,0,0,0,0,0,0,0,0,0,0,0,0,0,0,0,0,0,0,0,0,0,0,0,0,0,0,0,0,0,0,0,0,0
ARSP-U.S. SPECIAL OPERATIONS COMMAND (ARMY),0,0,0,0,0,0,0,0,0,0,0,0,0,0,0,0,0,0,0,0,0,2,2,0,0,0,1,0,0,0,5,0,0,3,0,0,0,0,0,3,0,8,8
"ARSS-STAFF SUPPORT AGENCIES OF THE CHIEF OF STAFF, ARMY",0,0,0,0,0,0,0,0,0,0,0,0,0,0,0,0,0,0,0,0,0,0,0,0,0,0,0,0,0,0,0,0,0,0,0,0,0,0,0,0,0,0,0
ARTA-U.S. ARMY ACCESSIONS COMMAND,2,0,0,0,0,0,0,0,0,2,0,0,0,0,0,0,0,0,0,0,2,11,5,1,0,0,2,0,0,0,19,13,1,23,0,0,2,0,0,39,0,58,60
ARTC-U.S. ARMY TRAINING AND DOCTRINE COMMAND,4,1,0,0,0,0,0,0,0,5,0,0,0,0,0,0,0,0,0,0,5,2,46,0,0,0,14,0,0,0,62,22,29,53,0,0,30,0,0,134,0,196,201
ARTM-U.S. MILITARY ENTRANCE PROCESSING COMMAND,2,3,0,0,0,0,0,0,0,5,0,0,0,0,0,0,0,0,0,0,5,4,18,0,0,0,8,0,0,0,30,5,0,0,0,0,0,0,0,5,0,35,40
ARTW-U.S. ARMY WAR COLLEGE,0,0,0,0,0,0,0,0,0,0,0,0,0,0,0,0,0,0,0,0,0,0,2,0,0,0,0,0,0,0,2,0,0,23,0,0,1,0,0,24,0,26,26
"ARX2-HEADQUARTERS, AMC",1,2,0,0,0,0,0,0,0,3,0,0,0,0,0,0,0,0,0,0,3,0,1,0,0,0,1,0,0,0,2,0,0,0,0,0,0,0,0,0,0,2,5
"ARX3-HEADQUARTERS, STAFF SUPPORT ACTIVITIES, AMC",0,0,0,0,0,0,0,0,0,0,0,0,0,0,0,0,0,0,0,0,0,0,0,0,0,0,0,0,0,0,0,0,0,0,0,0,0,0,0,0,0,0,0
"ARX4-TRAINING ACTIVITIES, AMC",0,0,0,0,0,0,0,0,0,0,0,0,0,0,0,0,0,0,0,0,0,0,0,0,0,0,0,0,0,0,0,0,0,0,0,0,0,0,0,0,0,0,0
ARX6-U.S. ARMY AVIATION AND MISSILE COMMAND,7,0,0,0,0,0,0,0,0,7,0,0,0,0,0,0,0,0,0,0,7,4,18,0,7,0,6,0,0,0,35,9,0,6,0,0,10,0,0,25,0,60,67
ARX7-U.S. ARMY TANK-AUTOMOTIVE AND ARMAMENT COMMAND (TACOM),4,4,0,0,0,0,0,0,0,8,0,0,0,0,0,0,0,0,0,0,8,3,31,1,3,0,17,0,0,0,55,37,4,7,0,0,0,0,0,48,0,103,111
ARX8-U.S. ARMY COMMUNICATIONS ELECTRONICS COMMAND,4,0,0,0,0,0,0,0,0,4,0,0,0,0,0,0,0,0,0,0,4,2,24,1,72,0,5,0,0,0,104,7,0,23,0,0,3,0,0,33,0,137,141
"ARX9-U.S. ARMY SIMULATION, TRAINING AND INSTRUMENTATION COMMAND",0,0,0,0,0,0,0,0,0,0,0,0,0,0,0,0,0,0,0,0,0,0,0,0,0,0,0,0,0,0,0,0,0,0,0,0,0,0,0,0,0,0,0
ARXA-U.S. ARMY CHEMICAL AND BIOLOGICAL DEFENSE COMMAND,0,0,0,0,0,0,0,0,0,0,0,0,0,0,0,0,0,0,0,0,0,0,0,0,0,0,0,0,0,0,0,0,0,0,0,0,0,0,0,0,0,0,0
ARXB-U.S. ARMY CHEMICAL MATERIALS AGENCY,1,0,0,0,0,0,0,0,0,1,0,0,0,0,0,0,0,0,0,0,1,0,2,0,0,0,2,0,0,0,4,7,0,0,0,0,0,0,0,7,0,11,12
ARXC-U.S. ARMY SUSTAINMENT COMMAND,1,0,0,0,0,0,0,0,0,1,0,0,0,0,0,0,0,0,0,0,1,0,0,0,0,0,0,0,0,0,0,2,2,0,0,0,1,0,0,5,0,5,6
ARXD-U.S. ARMY RESEARCH LABORATORY COMMAND,0,0,0,0,0,0,0,0,0,0,0,0,0,0,0,0,0,0,0,0,0,0,0,0,0,0,0,0,0,0,0,0,0,0,0,0,0,0,0,0,0,0,0
ARXK-MATERIEL ACQUISITION ACTIVITIES,0,0,0,0,0,0,0,0,0,0,0,0,0,0,0,0,0,0,0,0,0,0,0,0,0,0,0,0,0,0,0,0,0,4,0,0,0,0,0,4,0,4,4
ARXL-MATERIEL ACQUISITION PROJECT MANAGERS,0,0,0,0,0,0,0,0,0,0,0,0,0,0,0,0,0,0,0,0,0,0,0,0,0,0,0,0,0,0,0,0,0,0,0,0,0,0,0,0,0,0,0
ARXP-U.S. ARMY SECURITY ASSISTANCE COMMAND,1,0,0,0,0,0,0,0,0,1,0,0,0,0,0,0,0,0,0,0,1,1,1,0,0,0,0,0,0,0,2,0,0,0,0,0,0,0,0,0,0,2,3
ARXQ-U.S. ARMY JOINT MUNITIONS COMMAND,1,0,0,0,0,0,0,0,0,1,0,0,0,0,0,0,0,0,0,0,1,5,1,0,0,0,1,0,0,0,7,11,0,16,0,0,3,0,0,30,0,37,38
"ARXR-U.S. ARMY RESEARCH, DEVELOPMENT AND ENGINEERING COMMAND",3,0,0,0,0,0,0,0,0,3,0,0,0,0,0,0,0,0,0,0,3,0,10,0,38,0,13,0,0,0,61,7,0,141,0,0,22,0,0,170,1,232,235
ARXT-U.S. ARMY MILITARY SURFACE DEPLOYMENT AND DISTRIBUTION COMMAND,0,0,0,0,0,0,0,0,0,0,0,0,0,0,0,0,0,0,0,0,0,0,0,0,0,0,0,0,0,0,0,0,0,0,0,0,0,0,0,0,0,0,0
ARXX-MATERIEL READINESS ACTIVITIES,0,0,0,0,0,0,0,0,0,0,0,0,0,0,0,0,0,0,0,0,0,0,0,0,0,0,0,0,0,0,0,0,0,7,0,0,0,0,0,7,0,7,7
AU00-FEDERAL LABOR RELATIONS AUTHORITY,0,0,0,0,0,0,0,0,0,0,0,0,0,0,0,0,0,0,0,0,0,0,0,0,0,0,0,0,0,0,0,0,0,0,0,0,0,0,0,0,0,0,0
AW00-ARCTIC RESEARCH COMMISSION,0,0,0,0,0,0,0,0,0,0,0,0,0,0,0,0,0,0,0,0,0,0,0,0,0,0,0,0,0,0,0,0,0,0,0,0,0,0,0,0,0,0,0
BD00-MERIT SYSTEMS PROTECTION BOARD,0,0,0,0,0,0,0,0,0,0,0,0,0,0,0,0,0,0,0,0,0,0,0,0,0,0,0,0,0,0,0,0,0,0,0,0,0,0,0,0,0,0,0
BF00-DEFENSE NUCLEAR FACILITIES SAFETY BOARD,0,0,0,0,0,0,0,0,0,0,0,0,0,0,0,0,0,0,0,0,0,0,0,0,0,0,0,0,0,0,0,0,0,0,0,0,0,0,0,0,0,0,0
BG00-PENSION BENEFIT GUARANTY CORPORATION,1,0,0,0,0,0,0,0,0,1,0,0,0,0,0,0,0,0,0,0,1,0,8,0,0,1,0,0,0,0,9,0,0,10,0,0,0,0,0,10,0,19,20
BO00-OFFICE OF MANAGEMENT AND BUDGET,0,0,0,0,0,0,0,0,0,0,0,0,0,0,0,0,0,0,0,0,0,0,1,0,0,0,0,0,0,0,1,0,0,24,1,0,0,0,0,25,0,26,26
BT00-ARCHITECTURAL AND TRANSPORTATION BARRIERS COMPLIANCE BOARD,0,0,0,0,0,0,0,0,0,0,0,0,0,0,0,0,0,0,0,0,0,0,0,0,0,0,0,0,0,0,0,0,0,0,0,0,0,0,0,0,0,0,0
BW00-NUCLEAR WASTE TECHNICAL REVIEW BOARD,0,0,0,0,0,0,0,0,0,0,0,0,0,0,0,0,0,0,0,0,0,0,0,0,0,0,0,0,0,0,0,0,0,0,0,0,0,0,0,0,0,0,0
BZ00-CHRISTOPHER COLUMBUS FELLOWSHIP FOUNDATION,0,0,0,0,0,0,0,0,0,0,0,0,0,0,0,0,0,0,0,0,0,0,0,0,0,0,0,0,0,0,0,0,0,0,0,0,0,0,0,0,0,0,0
CC00-COMMISSION ON CIVIL RIGHTS,0,0,0,0,0,0,0,0,0,0,0,0,0,0,0,0,0,0,0,0,0,0,0,0,0,0,0,0,0,0,0,0,0,0,0,0,0,0,0,0,0,0,0
CE00-COUNCIL OF ECONOMIC ADVISERS,0,0,0,0,0,0,0,0,0,0,0,0,0,0,0,0,0,0,0,0,0,0,0,0,0,0,0,0,0,0,0,0,0,0,0,0,0,0,0,0,0,0,0
CF00-COMMISSION OF FINE ARTS,0,0,0,0,0,0,0,0,0,0,0,0,0,0,0,0,0,0,0,0,0,0,0,0,0,0,0,0,0,0,0,0,0,0,0,0,0,0,0,0,0,0,0
CM33-TECHNOLOGY ADMINISTRATION,0,0,0,0,0,0,0,0,0,0,0,0,0,0,0,0,0,0,0,0,0,0,0,0,0,0,0,0,0,0,0,0,0,0,0,0,0,0,0,0,0,0,0
CM51-OFFICE OF THE SECRETARY,1,0,0,0,0,0,0,0,0,1,0,0,0,0,0,0,0,0,0,0,1,0,2,1,0,0,0,0,0,0,3,0,0,4,2,0,0,0,0,6,0,9,10
CM52-ECONOMIC DEVELOPMENT ADMINISTRATION,0,0,0,0,0,0,0,0,0,0,0,0,0,0,0,0,0,0,0,0,0,0,1,0,0,0,0,0,0,0,1,0,0,0,0,0,0,0,0,0,0,1,1
CM53-BUREAU OF ECONOMIC ANALYSIS,0,0,0,0,0,0,1,0,0,1,0,0,0,0,0,0,0,0,0,0,1,0,0,0,1,0,0,0,0,0,1,0,0,7,0,0,0,0,0,7,0,8,9
