CM55-INTERNATIONAL TRADE ADMINISTRATION,1,0,0,0,0,0,0,0,0,1,0,0,0,0,0,0,0,0,0,0,1,0,2,0,0,0,0,0,1,0,3,0,0,2,8,0,2,0,0,12,0,15,16
CM56-PATENT AND TRADEMARK OFFICE,1,0,0,0,0,0,0,0,0,1,0,0,0,0,0,0,0,0,0,0,1,0,85,0,0,0,0,0,0,0,85,0,0,0,3,0,0,0,0,3,0,88,89
CM57-NATIONAL INSTITUTE OF STANDARDS AND TECHNOLOGY,0,0,0,0,0,0,0,0,0,0,0,0,0,0,0,0,0,0,0,0,0,0,5,0,0,0,0,0,0,0,5,2,0,4,0,0,0,0,0,6,0,11,11
CM59-MINORITY BUSINESS DEVELOPMENT AGENCY,0,0,0,0,0,0,0,0,0,0,0,0,0,0,0,0,0,0,0,0,0,0,0,0,0,0,0,0,0,0,0,0,0,0,0,0,0,0,0,0,0,0,0
CM61-NATIONAL TELECOMMUNICATIONS AND INFORMATION ADMINISTRATION,0,0,0,0,0,0,0,0,0,0,0,0,0,0,0,0,0,0,0,0,0,0,0,0,0,0,0,0,0,0,0,0,0,0,0,0,0,0,0,0,0,0,0
CM62-NATIONAL TECHNICAL INFORMATION SERVICE,0,0,0,0,0,0,0,0,0,0,0,0,0,0,0,0,0,0,0,0,0,0,0,0,0,0,0,0,0,0,0,0,0,0,0,0,0,0,0,0,0,0,0
CM63-BUREAU OF THE CENSUS,0,1,0,0,0,0,0,0,0,1,0,0,0,0,0,0,0,0,0,0,1,0,46,134,0,0,0,0,0,0,180,4,426,1,1,0,0,0,0,432,0,612,613
CM64-OFFICE OF THE INSPECTOR GENERAL,0,0,0,0,0,0,0,0,0,0,0,0,0,0,0,0,0,0,0,0,0,0,0,1,0,0,0,0,0,0,1,0,0,0,0,0,0,0,0,0,0,1,1
CM65-ECONOMICS AND STATISTICS ADMINISTRATION,0,0,0,0,0,0,0,0,0,0,0,0,0,0,0,0,0,0,0,0,0,0,0,0,0,0,0,0,0,0,0,0,0,0,0,0,0,0,0,0,0,0,0
CM67-BUREAU OF INDUSTRY AND SECURITY,0,0,0,0,0,0,0,0,0,0,0,0,0,0,0,0,0,0,0,0,0,0,2,0,0,0,0,0,0,0,2,0,0,0,0,0,0,0,0,0,0,2,2
CT00-COMMODITY FUTURES TRADING COMMISSION,0,0,0,0,0,0,0,0,0,0,0,0,0,0,0,0,0,0,0,0,0,0,0,0,0,0,0,0,0,0,0,0,0,0,0,0,0,0,0,0,0,0,0
CU00-NATIONAL CREDIT UNION ADMINISTRATION,0,0,0,0,0,0,0,0,0,0,0,0,0,0,0,0,0,0,0,0,0,0,5,0,0,0,0,0,0,0,5,0,0,0,0,0,0,0,0,0,0,5,5
CX00-NATIONAL COMMISSION ON LIBRARIES AND INFORMATION SCIENCE,0,0,0,0,0,0,0,0,0,0,0,0,0,0,0,0,0,0,0,0,0,0,0,0,0,0,0,0,0,0,0,0,0,0,0,0,0,0,0,0,0,0,0
DB00-PUBLIC INTEREST DECLASSIFICATION BOARD,0,0,0,0,0,0,0,0,0,0,0,0,0,0,0,0,0,0,0,0,0,0,0,0,0,0,0,0,0,0,0,0,0,0,0,0,0,0,0,0,0,0,0
DD01-OFFICE OF THE SECRETARY OF DEFENSE,5,1,0,0,0,0,0,0,0,6,0,0,0,0,0,0,0,0,0,0,6,0,3,1,0,0,0,0,0,0,4,0,0,0,1,0,8,0,0,9,0,13,19
DD02-ORGANIZATION OF THE JOINT CHIEFS OF STAFF,0,0,0,0,0,0,0,0,0,0,0,0,0,0,0,0,0,0,0,0,0,0,0,0,0,0,0,0,0,0,0,0,0,0,0,0,0,0,0,0,0,0,0
DD04-DEFENSE INFORMATION SYSTEMS AGENCY,8,3,0,0,0,0,0,0,0,11,0,0,0,0,0,0,0,0,0,0,11,1,13,0,4,0,3,0,0,0,21,2,0,2,0,0,0,0,0,4,0,25,36
DD06-DEFENSE SECURITY COOPERATION AGENCY,2,0,0,0,0,0,0,0,0,2,0,0,0,0,0,0,0,0,0,0,2,0,0,0,0,0,0,0,0,0,0,0,0,0,0,0,0,0,0,0,0,0,2
DD07-DEFENSE LOGISTICS AGENCY,16,1,0,0,0,0,0,0,0,17,0,0,0,0,0,0,0,0,0,0,17,5,27,1,3,0,6,0,0,0,42,42,1,4,0,0,3,0,0,50,0,92,109
DD08-U.S. COURT OF APPEALS FOR THE ARMED FORCES,0,0,0,0,0,0,0,0,0,0,0,0,0,0,0,0,0,0,0,0,0,0,0,0,0,0,0,0,0,0,0,0,0,0,0,0,0,0,0,0,0,0,0
DD09-AMERICAN FORCES INFORMATION SERVICE,4,0,0,0,0,0,0,0,0,4,0,0,0,0,0,0,0,0,0,0,4,0,0,0,0,0,0,0,0,0,0,0,0,0,0,0,0,0,0,0,0,0,4
DD10-DEFENSE CONTRACT AUDIT AGENCY,2,0,0,0,0,0,0,0,0,2,0,0,0,0,0,0,0,0,0,0,2,2,7,0,13,0,0,0,0,0,22,0,0,3,0,0,0,0,0,3,0,25,27
DD12-DEFENSE SECURITY SERVICE,1,1,0,0,0,0,0,0,0,2,0,0,0,0,0,0,0,0,0,0,2,3,0,0,0,0,0,0,0,0,3,0,0,0,0,0,0,0,0,0,0,3,5
DD13-DEFENSE ADVANCED RESEARCH PROJECTS AGENCY,0,0,0,0,0,0,0,0,0,0,0,0,0,0,0,0,0,0,0,0,0,0,0,0,0,0,0,0,0,0,0,2,0,0,0,0,2,0,0,4,0,4,4
DD16-DEPARTMENT OF DEFENSE EDUCATION ACTIVITY,5,0,0,0,0,0,0,0,0,5,0,0,0,0,0,0,0,0,0,0,5,2,4,3,0,0,3,0,0,0,12,3,170,0,0,0,68,0,0,241,0,253,258
DD21-WASHINGTON HEADQUARTERS SERVICES,45,4,0,0,0,1,0,0,0,50,0,0,0,0,0,0,0,0,0,0,50,1,3,0,0,0,0,0,0,0,4,0,1,1,2,0,1,0,0,5,0,9,59
DD23-OFFICE OF ECONOMIC ADJUSTMENT,0,0,0,0,0,0,0,0,0,0,0,0,0,0,0,0,0,0,0,0,0,0,0,0,0,0,0,0,0,0,0,0,0,0,0,0,0,0,0,0,0,0,0
DD25-DEFENSE LEGAL SERVICES AGENCY,0,0,0,0,0,0,0,0,0,0,0,0,0,0,0,0,0,0,0,0,0,0,0,0,0,0,0,0,0,0,0,0,3,0,0,0,0,0,0,3,0,3,3
DD26-OFFICE OF THE INSPECTOR GENERAL,2,0,0,0,0,0,0,0,0,2,0,0,0,0,0,0,0,0,0,0,2,0,0,0,2,0,0,0,0,0,2,0,0,0,0,0,0,0,0,0,0,2,4
DD27-MISSILE DEFENSE AGENCY,2,0,0,0,0,0,0,0,0,2,0,0,0,0,0,0,0,0,0,0,2,0,0,0,0,0,0,0,0,0,0,0,0,0,0,0,0,0,0,0,0,0,2
DD29-DEFENSE TECHNOLOGY SECURITY ADMINISTRATION,1,0,0,0,0,0,0,0,0,1,0,0,0,0,0,0,0,0,0,0,1,0,1,0,0,0,0,0,0,0,1,0,0,0,0,0,0,0,0,0,0,1,2
DD34-DEFENSE COMMISSARY AGENCY,3,0,0,0,0,0,0,0,0,3,0,0,0,0,0,0,0,0,0,0,3,0,54,0,0,0,0,0,0,0,54,22,70,108,0,0,10,0,0,210,1,265,268
DD35-DEFENSE FINANCE AND ACCOUNTING SERVICE,6,0,0,0,0,0,0,0,0,6,0,0,0,0,0,0,0,0,0,0,6,6,30,0,10,0,2,1,0,0,49,40,0,0,0,0,0,0,0,40,0,89,95
DD48-DEFENSE HUMAN RESOURCES ACTIVITY,3,0,0,0,0,0,0,0,0,3,0,0,0,0,0,0,0,0,0,0,3,2,1,0,0,0,0,0,0,0,3,0,0,0,0,0,0,0,0,0,0,3,6
DD58-DEFENSE PRISONER OF WAR/MISSING PERSONNEL OFFICE,0,0,0,0,0,0,0,0,0,0,0,0,0,0,0,0,0,0,0,0,0,1,0,0,0,0,0,0,0,0,1,0,0,0,0,0,0,0,0,0,0,1,1
DD60-TRICARE MANAGEMENT ACTIVITY,0,0,0,0,0,0,0,0,0,0,0,0,0,0,0,0,0,0,0,0,0,0,4,0,0,0,0,0,0,0,4,0,0,0,0,0,10,0,0,10,0,14,14
DD61-DEFENSE THREAT REDUCTION AGENCY,6,3,0,0,0,0,0,0,0,9,0,0,0,0,0,0,0,0,0,0,9,0,5,1,0,0,0,0,0,0,6,0,0,1,0,0,0,0,0,1,0,7,16
DD63-DEFENSE CONTRACT MANAGEMENT AGENCY,2,3,0,0,0,0,0,0,0,5,0,0,0,0,0,0,0,0,0,0,5,3,6,0,1,0,1,0,0,0,11,4,0,0,0,0,0,0,0,4,0,15,20
DD65-PENTAGON FORCE PROTECTION AGENCY,1,0,0,0,0,0,0,0,0,1,0,0,0,0,0,0,0,0,0,0,1,1,2,0,0,0,0,0,0,0,3,0,1,0,0,0,0,0,0,1,0,4,5
DD68-DEPARTMENT OF DEFENSE TEST RESOURCE MANAGEMENT CENTER,1,0,0,0,0,0,0,0,0,1,0,0,0,0,0,0,0,0,0,0,1,0,0,0,0,0,0,0,0,0,0,0,0,0,0,0,0,0,0,0,0,0,1
DD69-NATIONAL DEFENSE UNIVERSITY,0,0,0,0,0,0,0,0,0,0,0,0,0,0,0,0,0,0,0,0,0,0,0,0,0,0,0,0,0,0,0,0,0,0,0,0,2,0,0,2,0,2,2
DD74-DEFENSE TECHNICAL INFORMATION CENTER,1,0,0,0,0,0,0,0,0,1,0,0,0,0,0,0,0,0,0,0,1,0,0,0,0,0,0,0,0,0,0,0,0,0,0,0,0,0,0,0,0,0,1
DD77-BUSINESS TRANSFORMATION AGENCY,0,0,0,0,0,0,0,0,0,0,0,0,0,0,0,0,0,0,0,0,0,0,0,0,0,0,0,0,0,0,0,0,0,0,0,0,0,0,0,0,0,0,0
DF00-OFFICE OF THE FEDERAL COORDINATOR FOR ALASKA NATURAL GAS TRANSPORTATION PROJECTS,0,0,0,0,0,0,0,0,0,0,0,0,0,0,0,0,0,0,0,0,0,0,0,0,0,0,0,0,0,0,0,0,0,0,0,0,0,0,0,0,0,0,0
"DJ01-OFFICES, BOARDS AND DIVISIONS",4,0,0,0,0,0,0,0,0,4,0,0,0,0,0,0,0,0,0,0,4,1,7,1,0,0,1,0,1,0,11,2,7,5,4,0,0,0,0,18,0,29,33
DJ02-FEDERAL BUREAU OF INVESTIGATION,0,0,0,0,0,0,0,0,0,0,0,0,0,0,0,0,0,0,0,0,0,0,0,0,0,0,0,0,0,0,0,0,0,0,0,0,0,0,0,0,0,0,0
DJ03-BUREAU OF PRISONS/FEDERAL PRISON SYSTEM,1,1,0,0,0,0,0,0,0,2,0,0,0,0,0,0,0,0,0,0,2,6,204,0,0,0,3,0,0,0,213,1,0,0,0,0,0,0,0,1,0,214,216
DJ06-DRUG ENFORCEMENT ADMINISTRATION,1,2,0,0,0,0,0,0,0,3,0,0,0,0,0,0,0,0,0,0,3,1,12,3,42,0,0,0,0,0,58,0,0,4,1,0,0,0,0,5,0,63,66
DJ07-OFFICE OF JUSTICE PROGRAMS,0,0,0,0,0,0,0,0,0,0,0,0,0,0,0,0,0,0,0,0,0,0,1,0,0,0,0,0,0,0,1,0,0,0,2,0,0,0,0,2,0,3,3
DJ08-U.S. MARSHALS SERVICE,0,0,0,0,0,0,0,0,0,0,0,0,0,0,0,0,0,0,0,0,0,1,5,0,0,0,0,0,0,0,6,0,0,0,0,0,0,0,0,0,0,6,6
DJ09-EXECUTIVE OFFICE FOR U.S. ATTORNEYS AND THE OFFICES OF THE U.S. ATTORNEYS,4,0,0,0,0,0,0,0,0,4,0,0,0,0,0,0,0,0,0,0,4,1,23,0,0,0,0,0,0,0,24,1,1,14,1,0,17,0,0,34,0,58,62
DJ10-OFFICE OF THE INSPECTOR GENERAL,0,0,0,0,0,0,0,0,0,0,0,0,0,0,0,0,0,0,0,0,0,0,1,0,0,0,0,0,0,0,1,0,0,1,0,0,0,0,0,1,0,2,2
DJ11-U.S. TRUSTEE PROGRAM,0,0,0,0,0,0,0,0,0,0,0,0,0,0,0,0,0,0,0,0,0,0,0,0,2,0,0,0,0,0,2,0,0,0,0,0,0,0,0,0,0,2,2
DJ12-EXECUTIVE OFFICE FOR IMMIGRATION REVIEW,1,0,0,0,0,0,0,0,0,1,0,0,0,0,0,0,0,0,0,0,1,0,0,0,0,0,0,0,0,0,0,0,2,1,0,0,0,0,0,3,0,3,4
DJ14-COMMUNITY RELATIONS SERVICE,0,0,0,0,0,0,0,0,0,0,0,0,0,0,0,0,0,0,0,0,0,0,0,0,0,0,0,0,0,0,0,0,0,0,0,0,0,0,0,0,0,0,0
"DJ15-BUREAU OF ALCOHOL, TOBACCO, FIREARMS, AND EXPLOSIVES",3,0,0,0,0,0,0,0,0,3,0,0,0,0,0,0,0,0,0,0,3,0,3,0,0,0,1,0,0,0,4,0,0,32,0,0,0,0,0,32,0,36,39
DL**-UNSPECIFIED,0,0,0,0,0,0,0,0,0,0,0,0,0,0,0,0,0,0,0,0,0,0,0,0,0,0,0,0,0,0,0,0,0,0,0,0,0,0,0,0,0,0,0
DLAA-OFFICE OF THE SECRETARY OF LABOR,0,0,0,0,0,0,0,0,0,0,0,0,0,0,0,0,0,0,0,0,0,0,0,0,0,0,0,0,1,0,1,0,2,1,2,0,0,0,0,5,0,6,6
DLAM-OFFICE OF THE ASSISTANT SECRETARY FOR ADMINISTRATION AND MANAGEMENT,0,0,0,0,0,0,0,0,0,0,0,0,0,0,0,0,0,0,0,0,0,1,0,0,0,0,0,0,0,0,1,0,0,1,0,0,0,0,0,1,0,2,2
DLBL-BUREAU OF INTERNATIONAL LABOR AFFAIRS,0,0,0,0,0,0,0,0,0,0,0,0,0,0,0,0,0,0,0,0,0,0,0,0,0,0,0,0,0,0,0,0,0,0,0,0,0,0,0,0,0,0,0
DLCA-OFFICE OF CONGRESSIONAL AND INTERGOVERNMENTAL AFFAIRS,0,0,0,0,0,0,0,0,0,0,0,0,0,0,0,0,0,0,0,0,0,0,0,0,0,0,0,0,0,0,0,0,0,0,0,0,0,0,0,0,0,0,0
DLCF-OFFICE OF THE CHIEF FINANCIAL OFFICER,0,0,0,0,0,0,0,0,0,0,0,0,0,0,0,0,0,0,0,0,0,0,0,0,0,0,0,0,0,0,0,0,0,2,0,0,0,0,0,2,0,2,2
DLEB-EMPLOYEE BENEFITS SECURITY ADMINISTRATION,0,0,0,0,0,0,0,0,0,0,0,0,0,0,0,0,0,0,0,0,0,0,0,0,0,0,0,0,0,0,0,0,0,0,0,0,0,0,0,0,0,0,0
DLEH-OFFICE OF DISABILITY EMPLOYMENT POLICY,0,1,0,0,0,0,0,0,0,1,0,0,0,0,0,0,0,0,0,0,1,0,0,0,0,0,0,0,0,0,0,0,0,0,0,0,0,0,0,0,0,0,1
DLES-EMPLOYMENT STANDARDS ADMINISTRATION,5,0,0,0,0,0,0,0,1,6,0,0,0,0,0,0,0,0,0,0,6,3,16,0,1,0,3,0,0,0,23,0,0,3,0,0,0,0,0,3,0,26,32
DLET-EMPLOYMENT AND TRAINING ADMINISTRATION,1,0,0,0,0,0,0,0,0,1,0,0,0,0,0,0,0,0,0,0,1,0,4,0,0,0,0,0,0,0,4,0,0,0,0,0,0,0,0,0,0,4,5
DLIG-OFFICE OF THE INSPECTOR GENERAL,0,0,0,0,0,0,0,0,0,0,0,0,0,0,0,0,0,0,0,0,0,0,2,0,1,0,0,0,0,0,3,0,0,0,0,0,0,0,0,0,0,3,3
DLLS-BUREAU OF LABOR STATISTICS,1,1,0,0,0,0,0,0,0,2,0,0,0,0,0,0,0,0,0,0,2,1,22,0,0,0,0,0,0,0,23,0,0,0,0,0,0,0,0,0,0,23,25
DLMS-MINE SAFETY AND HEALTH ADMINISTRATION,0,0,0,0,0,0,0,0,0,0,0,0,0,0,0,0,0,0,0,0,0,0,1,0,10,0,0,0,0,0,11,0,0,0,0,0,0,0,0,0,0,11,11
DLPA-OFFICE OF PUBLIC AFFAIRS,0,0,0,0,0,0,0,0,0,0,0,0,0,0,0,0,0,0,0,0,0,0,0,0,0,0,0,0,0,0,0,0,0,0,2,0,0,0,0,2,0,2,2
DLPE-OFFICE OF THE ASSISTANT SECRETARY FOR POLICY,0,0,0,0,0,0,0,0,0,0,0,0,0,0,0,0,0,0,0,0,0,0,0,0,0,0,0,0,0,0,0,0,0,0,1,0,0,0,0,1,0,1,1
DLPW-EMPLOYEE BENEFITS SECURITY ADMINISTRATION,0,0,0,0,0,0,0,0,0,0,0,0,0,0,0,0,0,0,0,0,0,1,0,0,3,0,0,0,0,0,4,0,0,3,0,0,0,0,0,3,0,7,7
DLSH-OCCUPATIONAL SAFETY AND HEALTH ADMINISTRATION,1,0,0,0,0,0,0,0,0,1,0,0,0,0,0,0,0,0,0,0,1,0,2,0,0,0,0,0,0,0,2,0,0,0,1,0,0,0,0,1,0,3,4
DLSL-OFFICE OF THE SOLICITOR,0,0,0,0,0,0,0,0,0,0,0,0,0,0,0,0,0,0,0,0,0,0,0,0,0,0,0,0,0,0,0,0,0,0,0,0,0,0,0,0,0,0,0
DLVE-VETERANS EMPLOYMENT AND TRAINING SERVICES,0,0,0,0,0,0,0,0,0,0,0,0,0,0,0,0,0,0,0,0,0,0,0,0,0,0,0,0,0,0,0,1,0,0,0,0,0,0,0,1,0,1,1
DLWB-WOMEN'S BUREAU,0,0,0,0,0,0,0,0,0,0,0,0,0,0,0,0,0,0,0,0,0,0,0,0,0,0,0,0,0,0,0,0,0,0,0,0,0,0,0,0,0,0,0
DN00-DEPARTMENT OF ENERGY,12,1,0,0,0,0,0,0,0,13,0,0,0,0,0,0,0,0,0,0,13,3,18,2,5,0,6,2,0,0,36,1,0,3,4,1,0,0,0,9,0,45,58
DQ00-DENALI COMMISSION,0,0,0,0,0,0,0,0,0,0,0,0,0,0,0,0,0,0,0,0,0,0,0,0,0,0,0,0,0,0,0,0,0,0,0,0,0,0,0,0,0,0,0
EB00-EXPORT-IMPORT BANK OF THE UNITED STATES,0,0,0,0,0,0,0,0,0,0,0,0,0,0,0,0,0,0,0,0,0,0,2,0,0,0,0,0,0,0,2,0,0,1,0,0,0,0,0,1,0,3,3
EC00-OFFICE OF ADMINISTRATION,0,1,0,0,0,0,0,0,0,1,0,0,0,0,0,0,0,0,0,0,1,1,1,1,0,0,0,0,0,0,3,0,2,0,0,0,1,0,0,3,0,6,7
EDEA-IMMEDIATE OFFICE OF THE SECRETARY OF EDUCATION,0,0,0,0,0,0,0,0,0,0,0,0,0,0,0,0,0,0,0,0,0,0,0,0,0,0,0,0,0,0,0,0,0,0,2,0,0,0,0,2,0,2,2
EDEB-OFFICE OF THE DUTY SECRETARY OF EDUCATION,0,0,0,0,0,0,0,0,0,0,0,0,0,0,0,0,0,0,0,0,0,0,2,0,0,0,0,0,0,0,2,0,0,0,0,0,0,0,0,0,0,2,2
EDEC-OFFICE FOR CIVIL RIGHTS,0,0,0,0,0,0,0,0,0,0,0,0,0,0,0,0,0,0,0,0,0,0,0,1,0,0,0,0,0,0,1,0,0,1,0,0,0,0,0,1,0,2,2
"EDED-OFFICE OF PLANNING, EVALUATION AND POLICY DEVELOPMENT",0,0,0,0,0,0,0,0,0,0,0,0,0,0,0,0,0,0,0,0,0,0,0,0,0,0,0,0,0,0,0,0,0,0,0,0,0,0,0,0,0,0,0
EDEE-OFFICE OF THE UNDER SECRETARY,0,0,0,0,0,0,0,0,0,0,0,0,0,0,0,0,0,0,0,0,0,0,0,0,0,0,0,0,0,0,0,0,0,0,0,0,0,0,0,0,0,0,0
EDEF-OFFICE OF INSPECTOR GENERAL,4,0,0,0,0,0,0,0,0,4,0,0,0,0,0,0,0,0,0,0,4,1,1,0,0,0,0,0,0,0,2,0,0,0,0,0,0,0,0,0,0,2,6
EDEG-OFFICE OF THE GENERAL COUNSEL,0,0,0,0,0,0,0,0,0,0,0,0,0,0,0,0,0,0,0,0,0,0,0,0,0,0,0,0,0,0,0,0,0,0,0,0,0,0,0,0,0,0,0
EDEH-OFFICE OF SPECIAL EDUCATION AND REHABILITATIVE SERVICES,0,0,0,0,0,0,0,0,0,0,0,0,0,0,0,0,0,0,0,0,0,0,0,0,0,0,0,0,0,0,0,0,0,3,0,0,1,0,0,4,0,4,4
EDEI-OFFICE OF THE CHIEF INFORMATION OFFICER,0,0,0,0,0,0,0,0,0,0,0,0,0,0,0,0,0,0,0,0,0,0,0,0,0,0,0,0,0,0,0,0,0,0,0,0,0,0,0,0,0,0,0
EDEJ-OFFICE OF LEGISLATION AND CONGRESSIONAL AFFAIRS,0,0,0,0,0,0,0,0,0,0,0,0,0,0,0,0,0,0,0,0,0,0,0,0,0,0,0,0,0,0,0,0,0,0,2,0,0,0,0,2,0,2,2
EDEK-OFFICE OF INTERGOVERNMENTAL AND INTERAGENCY AFFAIRS,0,0,0,0,0,0,0,0,0,0,0,0,0,0,0,0,0,0,0,0,0,1,0,0,0,0,0,0,0,0,1,0,0,0,0,0,0,0,0,0,0,1,1
EDEL-OFFICE OF THE CHIEF FINANCIAL OFFICER,0,0,0,0,0,0,0,0,0,0,0,0,0,0,0,0,0,0,0,0,0,0,0,0,0,0,0,0,0,0,0,0,0,1,0,0,0,0,0,1,0,1,1
EDEM-OFFICE OF MANAGEMENT,0,0,0,0,0,0,0,0,0,0,0,0,0,0,0,0,0,0,0,0,0,0,0,0,0,0,0,0,0,0,0,0,0,0,0,0,0,0,0,0,0,0,0
EDEN-FEDERAL STUDENT AID,2,0,0,0,0,0,0,0,0,2,0,0,0,0,0,0,0,0,0,0,2,0,3,0,0,0,0,0,0,0,3,0,0,1,0,0,1,0,0,2,0,5,7
EDEO-OFFICE OF COMMUNICATIONS AND OUTREACH,0,0,0,0,0,0,0,0,0,0,0,0,0,0,0,0,0,0,0,0,0,0,0,0,0,0,0,0,0,0,0,0,0,0,0,0,0,0,0,0,0,0,0
EDEP-OFFICE OF POSTSECONDARY EDUCATION,0,0,0,0,0,0,0,0,0,0,0,0,0,0,0,0,0,0,0,0,0,0,0,0,0,0,0,0,0,0,0,0,0,0,1,0,0,0,0,1,0,1,1
EDEQ-OFFICE OF SAFE AND DRUG-FREE SCHOOLS,0,0,0,0,0,0,0,0,0,0,0,0,0,0,0,0,0,0,0,0,0,0,0,0,0,0,0,0,0,0,0,0,0,0,0,0,0,0,0,0,0,0,0
EDER-INSTITUTE OF EDUCATION SCIENCES,0,0,0,0,0,0,0,0,0,0,0,0,0,0,0,0,0,0,0,0,0,0,0,0,0,0,0,0,0,0,0,0,0,0,0,0,1,0,0,1,0,1,1
EDES-OFFICE OF ELEMENTARY AND SECONDARY EDUCATION,0,0,0,0,0,0,0,0,0,0,0,0,0,0,0,0,0,0,0,0,0,0,0,0,0,0,0,0,0,0,0,0,0,0,0,0,0,0,0,0,0,0,0
EDET-OFFICE OF ENGLISH LANGUAGE ACQUISITION,0,0,0,0,0,0,0,0,0,0,0,0,0,0,0,0,0,0,0,0,0,0,0,0,0,0,0,0,0,0,0,0,0,0,0,0,0,0,0,0,0,0,0
EDEU-OFFICE OF INNOVATION AND IMPROVEMENT,0,0,0,0,0,0,0,0,0,0,0,0,0,0,0,0,0,0,0,0,0,0,0,0,0,0,0,0,0,0,0,0,0,0,0,0,0,0,0,0,0,0,0
EDEV-OFFICE OF VOCATIONAL AND ADULT EDUCATION,0,0,0,0,0,0,0,0,0,0,0,0,0,0,0,0,0,0,0,0,0,0,0,0,0,0,0,0,0,0,0,0,0,1,0,0,0,0,0,1,0,1,1
EDEX-NATIONAL INSTITUTE FOR LITERACY,0,0,0,0,0,0,0,0,0,0,0,0,0,0,0,0,0,0,0,0,0,0,0,0,0,0,0,0,0,0,0,0,0,0,0,0,0,0,0,0,0,0,0
EDEY-ADVISORY COUNCILS AND COMMITTEES,0,0,0,0,0,0,0,0,0,0,0,0,0,0,0,0,0,0,0,0,0,0,0,0,0,0,0,0,0,0,0,0,0,0,0,0,0,0,0,0,0,0,0
EDEZ-NATIONAL ASSESSMENT GOVERNING BOARD,0,0,0,0,0,0,0,0,0,0,0,0,0,0,0,0,0,0,0,0,0,0,0,0,0,0,0,0,0,0,0,0,0,0,0,0,1,0,0,1,0,1,1
EE00-EQUAL EMPLOYMENT OPPORTUNITY COMMISSION,0,0,0,0,0,0,0,0,0,0,0,0,0,0,0,0,0,0,0,0,0,0,1,0,0,0,0,0,0,0,1,2,0,1,0,0,0,0,0,3,0,4,4
EO00-MORRIS K. UDALL SCHOLARSHIP AND EXCELLENCE IN NATIONAL ENVIRONMENTAL POLICY FOUNDATION,0,0,0,0,0,0,0,0,0,0,0,0,0,0,0,0,0,0,0,0,0,0,0,0,0,0,0,0,0,0,0,0,0,0,0,0,1,0,0,1,0,1,1
EP00-ENVIRONMENTAL PROTECTION AGENCY,10,2,0,0,0,0,0,0,0,12,0,0,0,0,0,0,0,0,0,0,12,2,16,1,0,0,2,0,0,0,21,1,2,3,2,0,8,0,0,16,0,37,49
EQ00-COUNCIL ON ENVIRONMENTAL QUALITY/OFFICE OF ENVIRONMENTAL QUALITY,0,0,0,0,0,0,0,0,0,0,0,0,0,0,0,0,0,0,0,0,0,0,0,0,0,0,0,0,0,0,0,0,1,1,0,0,1,0,0,3,0,3,3
EW00-TRADE AND DEVELOPMENT AGENCY,2,0,0,0,0,0,0,0,0,2,0,0,0,0,0,0,0,0,0,0,2,0,1,0,0,0,0,0,0,0,1,0,0,0,0,0,1,0,0,1,0,2,4
FC00-FEDERAL COMMUNICATIONS COMMISSION,1,1,0,0,0,0,0,0,0,2,0,0,0,0,0,0,0,0,0,0,2,1,0,1,0,0,0,0,0,0,2,0,0,0,0,0,0,0,0,0,0,2,4
FD00-FEDERAL DEPOSIT INSURANCE CORPORATION,0,0,0,0,0,0,0,0,0,0,0,0,0,0,0,0,0,0,0,0,0,0,0,0,1,0,0,0,0,0,1,0,0,1,0,0,0,0,0,1,0,2,2
FI00-FEDERAL FINANCIAL INSTITUTIONS EXAMINATION COUNCIL,0,0,0,0,0,0,0,0,0,0,0,0,0,0,0,0,0,0,0,0,0,0,0,0,0,0,0,0,0,0,0,0,0,0,0,0,0,0,0,0,0,0,0
FJ00-CHEMICAL SAFETY AND HAZARD INVESTIGATION BOARD,0,0,0,0,0,0,0,0,0,0,0,0,0,0,0,0,0,0,0,0,0,0,1,0,0,0,0,0,0,0,1,0,0,0,0,0,0,0,0,0,0,1,1
FK00-FARM CREDIT SYSTEM INSURANCE CORPORATION,0,0,0,0,0,0,0,0,0,0,0,0,0,0,0,0,0,0,0,0,0,0,0,0,0,0,0,0,0,0,0,0,0,0,0,0,0,0,0,0,0,0,0
FL00-FARM CREDIT ADMINISTRATION,0,0,0,0,0,0,0,0,0,0,0,0,0,0,0,0,0,0,0,0,0,0,0,0,0,0,0,0,0,0,0,0,0,0,1,0,0,0,0,1,0,1,1
FM00-FEDERAL MEDIATION AND CONCILIATION SERVICE,0,0,0,0,0,0,0,0,0,0,0,0,0,0,0,0,0,0,0,0,0,0,0,0,0,0,1,0,0,0,1,0,0,0,0,0,0,0,0,0,0,1,1
FQ01-OFFICE OF THE DIRECTOR,1,0,0,0,0,0,0,0,0,1,0,0,0,0,0,0,0,0,0,0,1,0,6,0,0,0,0,0,0,0,6,0,0,0,0,0,0,0,0,0,0,6,7
FQ02-PRETRIAL SERVICES AGENCY,0,0,0,0,0,0,0,0,0,0,0,0,0,0,0,0,0,0,0,0,0,0,1,0,0,0,0,0,0,0,1,0,0,0,0,0,0,0,0,0,0,1,1
FT00-FEDERAL TRADE COMMISSION,1,0,0,0,0,0,0,0,0,1,0,0,0,0,0,0,0,0,0,0,1,0,2,3,0,0,0,0,1,0,6,0,0,0,0,0,0,0,0,0,0,6,7
FW00-OFFICE OF SPECIAL COUNSEL,0,0,0,0,0,0,0,0,0,0,0,0,0,0,0,0,0,0,0,0,0,0,0,0,0,0,0,0,0,0,0,0,0,0,0,0,0,0,0,0,0,0,0
FY00-FEDERAL HOUSING FINANCE BOARD,0,0,0,0,0,0,0,0,0,0,0,0,0,0,0,0,0,0,0,0,0,0,2,0,0,0,0,0,0,0,2,0,0,0,2,0,0,0,0,2,0,4,4
GB00-OVERSEAS PRIVATE INVESTMENT CORPORATION,2,0,0,0,0,0,0,0,0,2,0,0,0,0,0,0,0,0,0,0,2,0,2,0,0,0,0,0,0,0,2,0,0,1,0,0,0,0,0,1,0,3,5
GE00-BARRY GOLDWATER SCHOLARSHIP AND EXCELLENCE IN EDUCATION FOUNDATION,0,0,0,0,0,0,0,0,0,0,0,0,0,0,0,0,0,0,0,0,0,0,0,0,0,0,0,0,0,0,0,0,0,0,0,0,0,0,0,0,0,0,0
GG00-OFFICE OF GOVERNMENT ETHICS,0,0,0,0,0,0,0,0,0,0,0,0,0,0,0,0,0,0,0,0,0,0,0,0,0,0,0,0,0,0,0,0,0,0,0,0,0,0,0,0,0,0,0
GJ00-PRESIDIO TRUST,0,0,0,0,0,0,0,0,0,0,0,0,0,0,0,0,0,0,0,0,0,0,0,0,0,0,2,0,0,0,2,0,0,0,0,0,0,0,0,0,0,2,2
GM00-VALLES CALDERA TRUST,0,0,0,0,0,0,0,0,0,0,0,0,0,0,0,0,0,0,0,0,0,0,0,0,0,0,0,0,0,0,0,0,0,0,0,0,0,0,0,0,0,0,0
GO00-VIETNAM EDUCATION FOUNDATION,0,0,0,0,0,0,0,0,0,0,0,0,0,0,0,0,0,0,0,0,0,0,0,0,0,0,0,0,0,0,0,0,0,0,0,0,0,0,0,0,0,0,0
GQ00-ELECTION ASSISTANCE COMMISSION,0,0,0,0,0,0,0,0,0,0,0,0,0,0,0,0,0,0,0,0,0,0,0,0,0,0,0,0,0,0,0,0,0,0,0,0,2,0,0,2,0,2,2
GS01-IMMEDIATE OFFICE OF THE ADMINISTRATOR,0,0,0,0,0,0,0,0,0,0,0,0,0,0,0,0,0,0,0,0,0,0,0,0,0,0,0,0,0,0,0,0,0,0,0,0,0,0,0,0,0,0,0
GS03-PUBLIC BUILDINGS SERVICE,6,1,0,0,0,0,0,0,0,7,0,0,0,0,0,0,0,0,0,0,7,1,11,1,9,0,0,0,0,0,22,0,0,1,1,0,0,0,0,2,0,24,31
GS04-OFFICE OF CIVIL RIGHTS,0,0,0,0,0,0,0,0,0,0,0,0,0,0,0,0,0,0,0,0,0,0,0,0,0,0,0,0,0,0,0,0,0,0,0,0,0,0,0,0,0,0,0
GS10-OFFICE OF SMALL BUSINESS UTILIZATION,0,0,0,0,0,0,0,0,0,0,0,0,0,0,0,0,0,0,0,0,0,0,0,0,0,0,0,0,0,0,0,0,0,0,0,0,0,0,0,0,0,0,0
GS11-OFFICE OF THE CHIEF FINANCIAL OFFICER,0,0,0,0,0,0,0,0,0,0,0,0,0,0,0,0,0,0,0,0,0,0,0,0,2,0,0,0,0,0,2,0,0,0,0,0,0,0,0,0,0,2,2
GS12-OFFICE OF GENERAL COUNSEL,0,0,0,0,0,0,0,0,0,0,0,0,0,0,0,0,0,0,0,0,0,0,0,1,0,0,0,0,0,0,1,0,0,0,0,0,0,0,0,0,0,1,1
GS13-GSA BOARD OF CONTRACT APPEALS,0,0,0,0,0,0,0,0,0,0,0,0,0,0,0,0,0,0,0,0,0,0,0,0,0,0,0,0,0,0,0,0,0,0,0,0,0,0,0,0,0,0,0
GS14-OFFICE OF THE CHIEF HUMAN CAPITAL OFFICER,3,0,0,0,0,0,0,0,0,3,0,0,0,0,0,0,0,0,0,0,3,0,0,0,0,0,0,0,0,0,0,0,0,0,0,0,0,0,0,0,0,0,3
GS15-OFFICE OF INSPECTOR GENERAL,1,0,0,0,0,0,0,0,0,1,0,0,0,0,0,0,0,0,0,0,1,0,1,0,3,0,0,0,0,0,4,0,0,0,0,0,0,0,0,0,0,4,5
GS16-OFFICE OF THE CHIEF ACQUISITION OFFICER,0,0,0,0,0,0,0,0,0,0,0,0,0,0,0,0,0,0,0,0,0,0,0,0,0,0,0,0,0,0,0,0,0,0,0,0,0,0,0,0,0,0,0
GS19-OFFICE OF CITIZEN SERVICES AND COMMUNICATIONS,0,0,0,0,0,0,0,0,0,0,0,0,0,0,0,0,0,0,0,0,0,0,0,0,0,0,0,0,0,0,0,0,0,0,0,0,0,0,0,0,0,0,0
GS20-OFFICE OF CONGRESSIONAL AND INTERGOVERNMENTAL AFFAIRS,0,0,0,0,0,0,0,0,0,0,0,0,0,0,0,0,0,0,0,0,0,0,0,0,0,0,0,0,0,0,0,0,0,0,0,0,0,0,0,0,0,0,0
GS22-OFFICES OF THE REGIONAL ADMINISTRATORS,0,0,0,0,0,0,0,0,0,0,0,0,0,0,0,0,0,0,0,0,0,0,1,0,0,0,0,0,0,0,1,0,0,0,0,0,0,0,0,0,0,1,1
GS24-FEDERAL SUPPLY SERVICE,3,1,0,0,0,0,0,0,0,4,0,0,0,0,0,0,0,0,0,0,4,0,3,0,4,0,2,0,0,0,9,0,0,0,0,0,0,0,0,0,0,9,13
GS26-OFFICE OF GOVERNMENTWIDE POLICY,0,0,0,0,0,0,0,0,0,0,0,0,0,0,0,0,0,0,0,0,0,0,0,0,0,0,0,0,0,0,0,0,0,0,0,0,0,0,0,0,0,0,0
GS27-FEDERAL TECHNOLOGY SERVICE,2,0,0,0,0,0,0,0,0,2,0,0,0,0,0,0,0,0,0,0,2,0,3,0,1,0,0,0,0,0,4,0,0,1,0,0,0,0,0,1,0,5,7
GS28-OFFICE OF THE CHIEF INFORMATION OFFICER,0,0,0,0,0,0,0,0,0,0,0,0,0,0,0,0,0,0,0,0,0,0,0,0,0,0,0,0,0,0,0,0,0,0,0,0,0,0,0,0,0,0,0
GS30-FEDERAL ACQUISITION SERVICE,0,0,0,0,0,0,0,0,0,0,0,0,0,0,0,0,0,0,0,0,0,0,0,0,0,0,0,0,0,0,0,0,0,0,0,0,0,0,0,0,0,0,0
GS31-OFFICE OF EMERGENCY RESPONSE AND RECOVERY,0,0,0,0,0,0,0,0,0,0,0,0,0,0,0,0,0,0,0,0,0,0,0,0,0,0,0,0,0,0,0,0,0,0,0,0,0,0,0,0,0,0,0
GW00-INTERNATIONAL BOUNDARY AND WATER COMMISSION:  UNITED STATES AND MEXICO,0,0,0,0,0,0,0,0,0,0,0,0,0,0,0,0,0,0,0,0,0,0,0,0,0,0,0,0,0,0,0,0,0,0,0,0,1,0,0,1,0,1,1
GX00-INTERNATIONAL BOUNDARY COMMISSION:  UNITED STATES AND CANADA,0,0,0,0,0,0,0,0,0,0,0,0,0,0,0,0,0,0,0,0,0,0,0,0,0,0,0,0,0,0,0,0,0,0,0,0,0,0,0,0,0,0,0
GY00-INTERNATIONAL JOINT COMMISSION:  UNITED STATES AND CANADA,0,0,0,0,0,0,0,0,0,0,0,0,0,0,0,0,0,0,0,0,0,0,0,0,0,0,0,0,0,0,0,1,0,0,0,0,0,0,0,1,0,1,1
HB00-COMMITTEE FOR PURCHASE FROM PEOPLE WHO ARE BLIND OR SEVERELY DISABLED,0,0,0,0,0,0,0,0,0,0,0,0,0,0,0,0,0,0,0,0,0,0,0,0,0,0,0,0,0,0,0,1,0,0,0,0,0,0,0,1,0,1,1
HD00-U.S. HOLOCAUST MEMORIAL MUSEUM,0,0,0,0,0,0,0,0,0,0,0,0,0,0,0,0,0,0,0,0,0,1,3,0,0,0,0,0,0,0,4,0,0,0,0,0,0,0,0,0,0,4,4
HE10-OFFICE OF THE SECRETARY OF HEALTH AND HUMAN SERVICES,10,2,0,0,0,0,0,2,0,14,0,0,0,0,0,0,0,0,0,0,14,4,7,2,6,0,2,0,0,0,21,5,0,5,4,0,2,0,0,16,0,37,51
HE11-PROGRAM SUPPORT CENTER,7,1,0,0,0,0,0,0,0,8,0,0,0,0,0,0,0,0,0,0,8,1,2,0,0,0,0,0,0,0,3,0,0,3,0,0,0,0,0,3,0,6,14
HE12-ADMINISTRATION ON AGING,1,0,0,0,0,0,0,0,0,1,0,0,0,0,0,0,0,0,0,0,1,0,0,0,0,0,0,0,1,0,1,0,0,0,0,0,1,0,0,1,0,2,3
HE31-OFFICE OF THE ASSISTANT SECRETARY FOR HEALTH,0,0,0,0,0,0,0,0,0,0,0,0,0,0,0,0,0,0,0,0,0,0,0,0,0,0,0,0,0,0,0,0,0,0,0,0,0,0,0,0,0,0,0
HE32-SUBSTANCE ABUSE AND MENTAL HEALTH SERVICES ADMINISTRATION,2,0,0,0,0,0,0,0,0,2,0,0,0,0,0,0,0,0,0,0,2,0,3,0,0,0,0,0,0,0,3,0,0,0,0,0,8,0,0,8,2,13,15
HE33-AGENCY FOR HEALTHCARE RESEARCH AND QUALITY,0,0,0,0,0,0,0,0,0,0,0,0,0,0,0,0,0,0,0,0,0,0,0,0,0,0,0,0,0,0,0,0,0,0,0,0,0,0,0,0,0,0,0
HE34-HEALTH RESOURCES AND SERVICES ADMINISTRATION,0,0,0,0,0,0,0,0,0,0,0,0,0,0,0,0,0,0,0,0,0,0,3,0,0,0,0,0,0,0,3,0,0,0,0,0,18,0,0,18,5,26,26
HE35-AGENCY FOR TOXIC SUBSTANCES AND DISEASE REGISTRY,0,0,0,0,0,0,0,0,0,0,0,0,0,0,0,0,0,0,0,0,0,0,0,0,0,0,0,0,0,0,0,0,0,0,0,0,0,0,0,0,0,0,0
HE36-FOOD AND DRUG ADMINISTRATION,1,2,0,0,0,0,0,0,0,3,0,0,0,0,0,0,0,0,0,0,3,1,7,0,0,0,1,0,0,0,9,7,0,1,0,0,10,0,0,18,0,27,30
HE37-INDIAN HEALTH SERVICE,2,2,0,0,0,0,0,0,0,4,0,0,0,0,0,0,0,0,0,0,4,6,18,38,0,0,0,0,0,0,62,5,70,0,0,0,0,0,0,75,5,142,146
HE38-NATIONAL INSTITUTES OF HEALTH,6,2,0,0,0,0,0,0,0,8,0,0,0,0,0,0,0,0,0,1,9,4,26,0,0,0,0,0,0,0,30,2,0,0,0,0,33,0,0,35,0,65,74
HE39-CENTERS FOR DISEASE CONTROL AND PREVENTION,6,0,0,0,0,0,0,0,0,6,0,0,0,0,0,0,0,0,0,0,6,3,9,0,2,0,0,0,0,0,14,1,0,1,0,0,7,0,0,9,0,23,29
HE70-CENTERS FOR MEDICARE & MEDICAID SERVICES,2,0,0,0,0,0,0,0,0,2,0,0,0,0,0,0,0,0,0,0,2,1,25,0,5,0,0,1,1,0,33,0,0,2,0,0,2,0,0,4,4,41,43
HE90-ADMINISTRATION FOR CHILDREN AND FAMILIES,0,0,0,0,0,0,0,0,0,0,0,0,0,0,0,0,0,0,0,0,0,0,2,0,0,0,0,0,0,0,2,0,0,0,0,0,0,0,0,0,0,2,2
HP00-ADVISORY COUNCIL ON HISTORIC PRESERVATION,0,0,0,0,0,0,0,0,0,0,0,0,0,0,0,0,0,0,0,0,0,0,0,0,0,0,0,0,0,0,0,0,0,0,0,1,0,0,0,1,0,1,1
HS**-UNSPECIFIED,0,0,0,0,0,0,0,0,0,0,0,0,0,0,0,0,0,0,0,0,0,0,0,0,0,0,0,0,0,0,0,0,0,0,0,0,0,0,0,0,0,0,0
HSAA-DHS HEADQUARTERS,3,1,0,0,0,0,0,0,0,4,0,0,0,0,0,0,0,0,0,0,4,3,8,0,0,0,0,0,2,0,13,0,0,0,7,0,0,0,0,7,0,20,24
HSAB-BUREAU OF CITIZENSHIP AND IMMIGRATION SERVICES,1,1,0,0,0,0,0,0,0,2,0,0,0,0,0,0,0,0,0,0,2,2,24,0,0,0,0,0,0,0,26,2,0,0,0,0,1,0,0,3,0,29,31
HSAC-U.S. COAST GUARD,9,1,0,0,0,0,0,0,0,10,0,0,0,0,0,0,0,0,0,0,10,7,31,0,0,0,0,0,0,0,38,8,0,2,0,0,0,0,0,10,0,48,58
HSAD-U.S. SECRET SERVICE,1,0,0,0,0,0,0,0,0,1,0,0,0,0,0,0,0,0,0,0,1,2,4,0,0,0,0,0,0,0,6,0,0,23,0,0,0,0,0,23,0,29,30
HSAE-OFFICE OF THE INSPECTOR GENERAL,0,0,0,0,0,0,0,0,0,0,0,0,0,0,0,0,0,0,0,0,0,0,1,0,0,0,0,0,0,0,1,0,0,0,0,0,0,0,0,0,0,1,1
HSBA-US-VISIT,1,0,0,0,0,0,0,0,0,1,0,0,0,0,0,0,0,0,0,0,1,0,3,0,0,0,0,0,0,0,3,0,0,0,2,0,0,0,0,2,0,5,6
HSBB-BUREAU OF IMMIGRATION AND CUSTOMS ENFORCEMENT,2,1,0,0,0,0,0,0,0,3,0,0,0,0,0,0,0,0,0,0,3,0,2,0,0,0,2,0,0,0,4,0,0,2,0,0,0,0,0,2,0,6,9
HSBC-TRANSPORTATION SECURITY ADMINISTRATION,0,0,0,0,0,0,0,0,0,0,0,0,0,0,0,0,0,0,0,0,0,0,0,0,0,0,819,0,0,0,819,0,0,0,0,0,14,0,0,14,1,834,834
HSBD-BUREAU OF CUSTOMS AND BORDER PROTECTION,7,1,0,0,0,0,0,0,0,8,0,0,0,0,0,0,0,0,0,0,8,1,27,1,209,0,4,0,0,0,242,0,0,1,2,0,0,0,0,3,0,245,253
HSBE-FEDERAL LAW ENFORCEMENT TRAINING CENTERS,4,0,0,0,0,0,0,0,0,4,0,0,0,0,0,0,0,0,0,0,4,2,0,0,0,0,0,0,0,0,2,1,2,0,0,0,0,0,0,3,0,5,9
HSCB-FEDERAL EMERGENCY MANAGEMENT AGENCY,2,0,0,0,0,0,0,0,0,2,0,0,0,0,0,0,0,0,0,0,2,0,4,1,0,0,0,0,0,0,5,4,0,0,3,0,176,0,0,183,0,188,190
HSDA-DOMESTIC NUCLEAR DETECTION OFFICE,1,0,0,0,0,0,0,0,0,1,0,0,0,0,0,0,0,0,0,0,1,0,31,0,0,0,0,0,0,0,31,0,0,0,0,0,0,0,0,0,0,31,32
HSDB-OFFICE FOR INFORMATION ANALYSIS,0,0,0,0,0,0,0,0,0,0,0,0,0,0,0,0,0,0,0,0,0,0,0,0,0,0,0,0,0,0,0,0,0,0,0,0,0,0,0,0,0,0,0
HSEA-OFFICE OF THE UNDER SECRETARY FOR MANAGEMENT,8,1,0,0,0,0,0,0,0,9,0,0,0,0,0,0,0,0,0,0,9,0,1,0,0,0,0,0,1,0,2,0,0,0,1,0,1,0,0,2,0,4,13
HSFA-OFFICE OF THE UNDER SECRETARY FOR SCIENCE AND TECHNOLOGY,0,0,0,0,0,0,0,0,0,0,0,0,0,0,0,0,0,0,0,0,0,2,0,0,0,0,0,0,0,0,2,0,0,0,1,0,0,0,0,1,0,3,3
HT00-HARRY S. TRUMAN SCHOLARSHIP FOUNDATION,0,0,0,0,0,0,0,0,0,0,0,0,0,0,0,0,0,0,0,0,0,0,0,0,0,0,0,0,0,0,0,0,0,0,0,0,0,0,0,0,0,0,0
HU**-UNSPECIFIED,0,0,0,0,0,0,0,0,0,0,0,0,0,0,0,0,0,0,0,0,0,0,0,0,0,0,0,0,0,0,0,0,0,0,0,0,0,0,0,0,0,0,0
HU01-OFFICE OF THE SENIOR COORDINATOR FOR NEW ENGLAND,0,0,0,0,0,0,0,0,0,0,0,0,0,0,0,0,0,0,0,0,0,0,0,0,0,0,0,0,0,0,0,0,0,0,0,0,0,0,0,0,0,0,0
HU02-OFFICE OF THE SENIOR COORDINATOR FOR NEW YORK/NEW JERSEY,0,0,0,0,0,0,0,0,0,0,0,0,0,0,0,0,0,0,0,0,0,0,0,0,0,0,0,0,0,0,0,0,0,0,0,0,0,0,0,0,0,0,0
HU03-OFFICE OF THE SENIOR COORDINATOR FOR MID-ATLANTIC,0,0,0,0,0,0,0,0,0,0,0,0,0,0,0,0,0,0,0,0,0,0,1,0,0,0,0,0,0,0,1,0,0,0,0,0,0,0,0,0,0,1,1
HU04-OFFICE OF THE SENIOR COORDINATOR FOR SOUTHEAST/CARIBBEAN,0,0,0,0,0,0,0,0,0,0,0,0,0,0,0,0,0,0,0,0,0,0,0,0,0,0,0,0,0,0,0,0,0,0,0,0,0,0,0,0,0,0,0
HU05-OFFICE OF THE SENIOR COORDINATOR FOR MIDWEST,0,0,0,0,0,0,0,0,0,0,0,0,0,0,0,0,0,0,0,0,0,0,0,0,0,0,0,0,0,0,0,0,0,0,0,0,0,0,0,0,0,0,0
HU06-OFFICE OF THE SENIOR COORDINATOR FOR SOUTHWEST,0,0,0,0,0,0,0,0,0,0,0,0,0,0,0,0,0,0,0,0,0,0,0,0,0,0,0,0,0,0,0,0,0,0,0,0,0,0,0,0,0,0,0
HU07-OFFICE OF THE SENIOR COORDINATOR FOR GREAT PLAINS,0,0,0,0,0,0,0,0,0,0,0,0,0,0,0,0,0,0,0,0,0,0,0,0,0,0,0,0,0,0,0,0,0,0,0,0,0,0,0,0,0,0,0
HU08-OFFICE OF THE SENIOR COORDINATOR FOR ROCKY MOUNTAINS,0,0,0,0,0,0,0,0,0,0,0,0,0,0,0,0,0,0,0,0,0,0,0,0,0,0,0,0,0,0,0,0,0,0,0,0,0,0,0,0,0,0,0
HU09-OFFICE OF THE SENIOR COORDINATOR FOR PACIFIC/HAWAII,0,0,0,0,0,0,0,0,0,0,0,0,0,0,0,0,0,0,0,0,0,0,0,0,0,0,0,0,0,0,0,0,0,0,0,0,0,0,0,0,0,0,0
HU10-OFFICE OF THE SENIOR COORDINATOR FOR NORTHWEST/ALASKA,0,0,0,0,0,0,0,0,0,0,0,0,0,0,0,0,0,0,0,0,0,0,0,0,0,0,0,0,0,0,0,0,0,0,0,0,0,0,0,0,0,0,0
HUAA-OFFICE OF THE SECRETARY OF HOUSING AND URBAN DEVELOPMENT,0,0,0,0,0,0,0,0,0,0,0,0,0,0,0,0,0,0,0,0,0,0,0,0,0,0,0,0,0,0,0,0,0,0,0,0,0,0,0,0,0,0,0
HUBB-ASSISTANT SECRETARY FOR ADMINISTRATION,0,0,0,0,0,0,0,0,0,0,0,0,0,0,0,0,0,0,0,0,0,0,0,0,0,0,0,0,0,0,0,0,0,0,0,0,0,0,0,0,0,0,0
HUCC-OFFICE OF GENERAL COUNSEL,0,0,0,0,0,0,0,0,0,0,0,0,0,0,0,0,0,0,0,0,0,0,0,0,0,0,0,0,0,0,0,0,0,0,1,0,0,0,0,1,0,1,1
HUDD-ASSISTANT SECRETARY FOR COMMUNITY PLANNING AND DEVELOPMENT,0,0,0,0,0,0,0,0,0,0,0,0,0,0,0,0,0,0,0,0,0,0,0,0,0,0,0,0,0,0,0,0,0,0,0,0,0,0,0,0,0,0,0
