CF00-COMMISSION OF FINE ARTS,0,0,0,0,0,0,0,0,0,0,0,0,0,0,0,0,0,0,0,0,0,0,0,0,0,0,0,0,0,0,0,0,0,0,0,0,0,0,0,0,0,0,0,0,0,0,0
CM51-OFFICE OF THE SECRETARY,1,0,0,0,0,0,0,0,0,0,1,0,0,0,0,0,0,0,0,0,0,0,1,0,1,0,0,0,0,0,1,0,0,2,0,0,0,2,0,0,0,0,0,2,0,4,5
CM52-ECONOMIC DEVELOPMENT ADMINISTRATION,0,0,0,0,0,0,0,0,0,0,0,0,0,0,0,0,0,0,0,0,0,0,0,1,0,0,0,0,0,0,0,0,0,1,0,0,0,0,0,0,0,0,0,0,0,1,1
CM53-BUREAU OF ECONOMIC ANALYSIS,0,0,0,0,0,0,0,0,0,0,0,0,0,0,0,0,0,0,0,0,0,0,0,0,0,0,0,0,0,0,0,0,0,0,0,0,1,0,0,0,0,0,0,1,0,1,1
CM54-NATIONAL OCEANIC AND ATMOSPHERIC ADMINISTRATION,4,0,0,0,0,0,0,0,0,0,4,0,0,0,0,0,0,0,0,0,0,0,4,0,18,1,3,0,0,1,0,0,0,23,2,1,1,0,0,0,1,0,0,5,0,28,32
CM55-INTERNATIONAL TRADE ADMINISTRATION,1,0,0,0,0,0,0,0,0,0,1,0,0,0,0,0,0,0,0,0,0,0,1,0,0,0,0,0,0,0,0,0,0,0,0,0,0,0,0,0,0,0,0,0,0,0,1
CM56-PATENT AND TRADEMARK OFFICE,2,1,0,0,0,0,0,0,0,0,3,0,0,0,0,0,0,0,0,0,0,0,3,7,29,0,1,0,0,0,0,0,0,37,0,0,0,0,0,0,1,0,0,1,0,38,41
CM57-NATIONAL INSTITUTE OF STANDARDS AND TECHNOLOGY,0,0,0,0,0,0,0,0,0,0,0,0,0,0,0,0,0,0,0,0,0,0,0,0,6,0,0,0,0,0,0,0,0,6,1,3,0,0,0,0,0,0,0,4,0,10,10
CM59-MINORITY BUSINESS DEVELOPMENT AGENCY,0,0,0,0,0,0,0,0,0,0,0,0,0,0,0,0,0,0,0,0,0,0,0,0,0,0,0,0,0,0,0,0,0,0,0,0,0,0,0,0,0,0,0,0,0,0,0
CM61-NATIONAL TELECOMMUNICATIONS AND INFORMATION ADMINISTRATION,0,0,0,0,0,0,0,0,0,0,0,0,0,0,0,0,0,0,0,0,0,0,0,0,0,0,0,0,0,0,0,0,0,0,0,0,0,0,0,0,0,0,0,0,0,0,0
CM62-NATIONAL TECHNICAL INFORMATION SERVICE,0,0,0,0,0,0,0,0,0,0,0,0,0,0,0,0,0,0,0,0,0,0,0,0,0,0,0,0,0,0,0,0,0,0,0,0,0,0,0,0,0,0,0,0,0,0,0
CM63-BUREAU OF THE CENSUS,0,0,0,0,0,0,0,0,0,0,0,0,0,0,0,0,0,0,0,0,0,0,0,3,6,44,1,0,0,0,0,0,0,54,28,7,2,0,0,0,0,0,0,37,0,91,91
CM64-OFFICE OF THE INSPECTOR GENERAL,0,0,0,0,0,0,0,0,0,0,0,0,0,0,0,0,0,0,0,0,0,0,0,0,0,0,0,0,0,0,0,0,0,0,0,0,0,0,0,0,0,0,0,0,0,0,0
CM65-ECONOMICS AND STATISTICS ADMINISTRATION,0,0,0,0,0,0,0,0,0,0,0,0,0,0,0,0,0,0,0,0,0,0,0,0,0,0,0,0,0,0,0,0,0,0,0,0,0,0,0,0,0,0,0,0,0,0,0
CM67-BUREAU OF INDUSTRY AND SECURITY,0,0,0,0,0,0,0,0,0,0,0,0,0,0,0,0,0,0,0,0,0,0,0,1,0,0,0,0,0,0,0,0,0,1,0,0,0,1,0,0,0,0,0,1,0,2,2
CT00-COMMODITY FUTURES TRADING COMMISSION,0,0,0,0,0,0,0,0,0,0,0,0,0,0,0,0,0,0,0,0,0,0,0,0,3,1,0,0,0,0,0,0,0,4,0,2,0,1,0,0,0,0,0,3,0,7,7
CU00-NATIONAL CREDIT UNION ADMINISTRATION,1,0,0,0,0,0,0,0,0,0,1,0,0,0,0,0,0,0,0,0,0,0,1,0,0,0,1,0,0,0,0,0,0,1,0,0,0,0,0,0,0,0,0,0,0,1,2
DB00-PUBLIC INTEREST DECLASSIFICATION BOARD,0,0,0,0,0,0,0,0,0,0,0,0,0,0,0,0,0,0,0,0,0,0,0,0,0,0,0,0,0,0,0,0,0,0,0,0,0,0,0,0,0,0,0,0,0,0,0
DD**-UNSPECIFIED,0,0,0,0,0,0,0,0,0,0,0,0,0,0,0,0,0,0,0,0,0,0,0,0,0,0,0,0,0,0,0,0,0,0,0,0,0,0,0,0,0,0,0,0,0,0,0
DD01-OFFICE OF THE SECRETARY OF DEFENSE,1,0,0,0,0,0,0,1,0,0,2,0,0,0,0,0,0,0,0,0,0,0,2,0,3,0,0,0,0,1,2,1,0,7,1,0,0,2,0,1,0,0,0,4,0,11,13
DD02-ORGANIZATION OF THE JOINT CHIEFS OF STAFF,3,0,0,0,0,0,0,0,0,0,3,0,0,0,0,0,0,0,0,0,0,0,3,0,4,0,0,0,0,0,0,0,0,4,0,0,0,0,0,0,0,0,0,0,0,4,7
DD04-DEFENSE INFORMATION SYSTEMS AGENCY,7,3,0,0,0,0,0,0,0,0,10,0,0,0,0,0,0,0,0,0,0,0,10,1,22,1,0,0,0,0,0,0,0,24,0,0,0,0,0,0,0,0,0,0,0,24,34
DD06-DEFENSE SECURITY COOPERATION AGENCY,2,1,0,0,0,0,0,0,0,0,3,0,0,0,0,0,0,0,0,0,0,0,3,1,2,1,0,0,0,0,0,0,0,4,0,1,0,0,0,0,2,0,0,3,0,7,10
DD07-DEFENSE LOGISTICS AGENCY,18,5,0,0,0,0,0,0,0,0,23,0,0,0,0,0,0,0,0,0,0,0,23,3,66,2,10,0,0,4,0,0,0,85,3,1,0,0,0,0,0,0,0,4,0,89,112
DD08-U.S. COURT OF APPEALS FOR THE ARMED FORCES,0,0,0,0,0,0,0,0,0,0,0,0,0,0,0,0,0,0,0,0,0,0,0,0,0,0,0,0,0,0,0,0,0,0,0,2,0,0,0,0,0,0,0,2,0,2,2
DD10-DEFENSE CONTRACT AUDIT AGENCY,5,2,0,0,0,0,0,0,0,0,7,0,0,0,0,0,0,0,0,0,0,0,7,2,15,0,2,0,0,1,0,0,0,20,1,0,1,0,0,0,0,0,0,2,0,22,29
DD12-DEFENSE SECURITY SERVICE,0,0,0,0,0,0,0,0,0,0,0,0,0,0,0,0,0,0,0,0,0,0,0,0,0,0,0,0,0,1,0,0,0,1,0,0,0,0,0,0,0,0,0,0,0,1,1
DD13-DEFENSE ADVANCED RESEARCH PROJECTS AGENCY,0,1,0,0,0,0,0,0,0,0,1,0,0,0,0,0,0,0,0,0,0,0,1,0,0,0,0,0,0,0,0,0,0,0,0,0,0,0,0,0,0,0,0,0,0,0,1
DD16-DEPARTMENT OF DEFENSE EDUCATION ACTIVITY,2,2,0,0,0,0,0,0,0,0,4,0,0,0,0,0,0,0,0,0,0,0,4,1,5,8,0,0,0,19,0,0,0,33,2,114,0,0,0,0,43,0,0,159,0,192,196
DD21-WASHINGTON HEADQUARTERS SERVICES,1,3,0,0,0,0,0,0,0,0,4,0,0,0,0,0,0,0,0,0,0,0,4,0,4,0,1,0,0,0,0,0,0,5,0,1,0,0,0,0,1,0,0,2,0,7,11
DD23-OFFICE OF ECONOMIC ADJUSTMENT,0,0,0,0,0,0,0,0,0,0,0,0,0,0,0,0,0,0,0,0,0,0,0,0,0,0,0,0,0,0,0,0,0,0,0,0,0,0,0,0,0,0,0,0,0,0,0
DD25-DEFENSE LEGAL SERVICES AGENCY,0,1,0,0,0,0,0,0,0,0,1,0,0,0,0,0,0,0,0,0,0,0,1,0,0,0,0,0,0,0,0,0,0,0,0,1,0,0,0,0,0,0,0,1,0,1,2
DD26-OFFICE OF THE INSPECTOR GENERAL,1,1,0,0,0,0,0,0,0,0,2,0,0,0,0,0,0,0,0,0,0,0,2,1,2,0,0,0,0,0,0,0,0,3,1,0,0,0,0,0,0,0,0,1,0,4,6
DD27-MISSILE DEFENSE AGENCY,0,0,0,0,0,0,0,0,0,0,0,0,0,0,0,0,0,0,0,0,0,0,0,0,8,0,0,0,0,0,0,0,0,8,0,0,0,0,0,0,0,0,0,0,0,8,8
DD29-DEFENSE TECHNOLOGY SECURITY ADMINISTRATION,0,0,0,0,0,0,0,0,0,0,0,0,0,0,0,0,0,0,0,0,0,0,0,0,0,0,0,0,0,0,0,0,0,0,0,0,0,0,0,0,0,0,0,0,0,0,0
DD34-DEFENSE COMMISSARY AGENCY,6,0,0,0,0,0,0,0,0,0,6,0,0,0,0,0,0,0,0,0,0,0,6,3,105,3,0,0,0,0,0,0,0,111,3,24,58,0,0,0,0,0,0,85,0,196,202
DD35-DEFENSE FINANCE AND ACCOUNTING SERVICE,3,2,0,0,0,0,0,0,0,0,5,0,0,0,0,0,0,0,0,0,0,0,5,1,24,0,1,0,0,0,0,0,0,26,35,1,2,0,0,0,0,0,0,38,0,64,69
DD48-DEFENSE HUMAN RESOURCES ACTIVITY,3,0,0,0,0,0,0,0,0,0,3,0,0,0,0,0,0,0,0,0,0,0,3,0,3,0,0,0,0,7,1,0,0,11,0,0,2,0,0,0,1,0,0,3,0,14,17
DD58-DEFENSE PRISONER OF WAR/MISSING PERSONNEL OFFICE,0,0,0,0,0,0,0,0,0,0,0,0,0,0,0,0,0,0,0,0,0,0,0,0,0,0,0,0,0,0,0,0,0,0,0,0,0,0,0,0,0,0,0,0,0,0,0
DD60-DEFENSE HEALTH AGENCY,3,3,0,0,0,0,0,0,0,1,7,0,0,0,0,0,0,0,0,0,0,0,7,0,18,0,0,0,0,0,0,0,0,18,1,0,1,0,0,0,0,0,0,2,0,20,27
DD61-DEFENSE THREAT REDUCTION AGENCY,0,0,0,0,0,0,0,0,0,0,0,0,0,0,0,0,0,0,0,0,0,0,0,0,3,2,1,0,0,0,0,0,0,6,0,0,0,0,0,0,0,0,0,0,0,6,6
DD63-DEFENSE CONTRACT MANAGEMENT AGENCY,16,6,0,0,0,0,1,0,0,0,23,0,0,0,0,0,0,0,0,0,0,0,23,7,27,2,1,0,0,4,0,0,0,41,10,0,1,0,0,0,0,0,0,11,0,52,75
DD65-PENTAGON FORCE PROTECTION AGENCY,0,0,0,0,0,0,0,0,0,0,0,0,0,0,0,0,0,0,0,0,0,0,0,0,4,0,0,0,0,0,0,0,0,4,0,0,0,0,0,0,0,0,0,0,0,4,4
DD68-DEPARTMENT OF DEFENSE TEST RESOURCE MANAGEMENT CENTER,0,0,0,0,0,0,0,0,0,0,0,0,0,0,0,0,0,0,0,0,0,0,0,0,0,0,0,0,0,0,0,0,0,0,0,0,0,0,0,0,0,0,0,0,0,0,0
DD69-NATIONAL DEFENSE UNIVERSITY,0,0,0,0,0,0,0,0,0,0,0,0,0,0,0,0,0,0,0,0,0,0,0,0,1,0,0,0,0,0,0,0,0,1,0,0,0,0,0,0,1,0,0,1,0,2,2
DD71-DEFENSE MICROELECTRONICS ACTIVITY,0,0,0,0,0,0,0,0,0,0,0,0,0,0,0,0,0,0,0,0,0,0,0,0,0,0,0,0,0,0,0,0,0,0,0,0,0,0,0,0,0,0,0,0,0,0,0
DD74-DEFENSE TECHNICAL INFORMATION CENTER,1,0,0,0,0,0,0,0,0,0,1,0,0,0,0,0,0,0,0,0,0,0,1,0,0,0,0,0,0,0,0,0,0,0,2,1,0,0,0,0,0,0,0,3,0,3,4
DD77-BUSINESS TRANSFORMATION AGENCY,0,0,0,0,0,0,0,0,0,0,0,0,0,0,0,0,0,0,0,0,0,0,0,0,0,0,0,0,0,0,0,0,0,0,0,0,0,0,0,0,0,0,0,0,0,0,0
DD80-DEFENSE MEDIA ACTIVITY,3,1,0,0,0,0,0,0,0,0,4,0,0,0,0,0,0,0,0,0,0,0,4,2,6,0,0,0,0,0,0,0,0,8,0,0,0,0,0,0,0,0,0,0,0,8,12
DD81-DEFENSE ACQUISITION UNIVERSITY,0,0,0,0,0,0,0,0,0,0,0,0,0,0,0,0,0,0,0,0,0,0,0,0,0,0,0,0,0,0,0,0,0,0,0,0,0,0,0,0,2,0,0,2,0,2,2
DF00-OFFICE OF THE FEDERAL COORDINATOR FOR ALASKA NATURAL GAS TRANSPORTATION PROJECTS,0,0,0,0,0,0,0,0,0,0,0,0,0,0,0,0,0,0,0,0,0,0,0,0,0,0,0,0,0,0,0,0,0,0,0,0,0,0,0,0,0,0,0,0,0,0,0
DG00-NORTHERN BORDER REGIONAL COMMISSION,0,0,0,0,0,0,0,0,0,0,0,0,0,0,0,0,0,0,0,0,0,0,0,0,0,0,0,0,0,0,0,0,0,0,0,0,0,0,0,0,0,0,0,0,0,0,0
"DJ01-OFFICES, BOARDS AND DIVISIONS",0,0,0,0,0,0,0,0,0,0,0,0,0,0,0,0,0,0,0,0,0,0,0,1,2,0,0,0,0,0,0,0,0,3,0,5,2,1,0,0,0,0,0,8,0,11,11
DJ02-FEDERAL BUREAU OF INVESTIGATION,0,0,0,0,0,0,0,0,0,0,0,0,0,0,0,0,0,0,0,0,0,0,0,0,0,5,0,0,0,190,0,0,0,195,0,0,0,0,0,0,3,0,0,3,0,198,198
DJ03-BUREAU OF PRISONS/FEDERAL PRISON SYSTEM,0,0,0,0,0,0,0,0,0,0,0,0,0,0,0,0,0,0,0,0,0,0,0,2,188,0,0,0,0,1,0,0,0,191,0,1,3,0,0,0,0,0,0,4,0,195,195
DJ06-DRUG ENFORCEMENT ADMINISTRATION,0,0,0,0,0,0,0,0,0,0,0,0,0,0,0,0,0,0,0,0,0,0,0,0,4,0,1,0,0,0,0,0,0,5,0,0,2,0,0,0,0,0,0,2,0,7,7
DJ07-OFFICE OF JUSTICE PROGRAMS,0,0,0,0,0,0,0,0,0,0,0,0,0,0,0,0,0,0,0,0,0,0,0,0,0,0,0,0,0,0,0,0,0,0,0,0,0,0,0,0,0,0,0,0,0,0,0
DJ08-U.S. MARSHALS SERVICE,0,0,0,0,0,0,0,0,0,0,0,0,0,0,0,0,0,0,0,0,0,0,0,0,2,0,0,0,0,1,0,0,0,3,0,0,0,0,0,0,0,0,0,0,0,3,3
DJ09-EXECUTIVE OFFICE FOR U.S. ATTORNEYS AND THE OFFICES OF THE U.S. ATTORNEYS,1,0,0,0,0,0,0,0,0,0,1,0,0,0,0,0,0,0,0,0,0,0,1,0,6,0,0,0,0,1,0,0,0,7,0,0,0,0,0,0,2,0,0,2,0,9,10
DJ10-OFFICE OF THE INSPECTOR GENERAL,0,0,0,0,0,0,0,0,0,0,0,0,0,0,0,0,0,0,0,0,0,0,0,0,0,0,1,0,0,0,0,0,0,1,0,0,0,0,0,0,0,0,0,0,0,1,1
DJ11-U.S. TRUSTEE PROGRAM,0,0,0,0,0,0,0,0,0,0,0,0,0,0,0,0,0,0,0,0,0,0,0,0,0,0,0,0,0,0,0,0,0,0,0,0,0,0,0,0,0,0,0,0,0,0,0
DJ12-EXECUTIVE OFFICE FOR IMMIGRATION REVIEW,0,0,0,0,0,0,0,0,0,0,0,0,0,0,0,0,0,0,0,0,0,0,0,0,0,0,0,0,0,0,0,0,0,0,0,0,0,0,0,0,0,0,0,0,0,0,0
DJ14-COMMUNITY RELATIONS SERVICE,0,0,0,0,0,0,0,0,0,0,0,0,0,0,0,0,0,0,0,0,0,0,0,0,0,0,0,0,0,0,0,0,0,0,0,0,0,0,0,0,0,0,0,0,0,0,0
"DJ15-BUREAU OF ALCOHOL, TOBACCO, FIREARMS, AND EXPLOSIVES",0,0,0,0,0,0,0,0,0,0,0,0,0,0,0,0,0,0,0,0,0,0,0,0,0,0,0,0,0,0,0,0,0,0,0,0,0,0,0,0,0,0,0,0,0,0,0
DLAA-OFFICE OF THE SECRETARY OF LABOR,0,0,0,0,0,0,0,0,0,0,0,0,0,0,0,0,0,0,0,0,0,0,0,0,0,0,0,0,0,0,0,0,0,0,0,0,0,0,0,0,0,0,0,0,0,0,0
DLAM-OFFICE OF THE ASSISTANT SECRETARY FOR ADMINISTRATION AND MANAGEMENT,0,0,0,0,0,0,0,0,0,0,0,0,0,0,0,0,0,0,0,0,0,0,0,1,0,0,0,0,0,0,0,0,0,1,0,0,0,0,0,0,0,0,0,0,0,1,1
DLBL-BUREAU OF INTERNATIONAL LABOR AFFAIRS,0,0,0,0,0,0,0,0,0,0,0,0,0,0,0,0,0,0,0,0,0,0,0,0,0,0,1,0,0,0,0,0,0,1,0,0,0,0,0,0,0,0,0,0,0,1,1
DLCA-OFFICE OF CONGRESSIONAL AND INTERGOVERNMENTAL AFFAIRS,0,0,0,0,0,0,0,0,0,0,0,0,0,0,0,0,0,0,0,0,0,0,0,0,0,0,0,0,0,0,0,0,0,0,0,0,0,0,0,0,0,0,0,0,0,0,0
DLCF-OFFICE OF THE CHIEF FINANCIAL OFFICER,0,0,0,0,0,0,0,0,0,0,0,0,0,0,0,0,0,0,0,0,0,0,0,0,0,0,1,0,0,0,0,0,0,1,0,0,0,0,0,0,0,0,0,0,0,1,1
DLEB-EMPLOYEE BENEFITS SECURITY ADMINISTRATION,0,0,0,0,0,0,0,0,0,0,0,0,0,0,0,0,0,0,0,0,0,0,0,0,0,0,0,0,0,0,0,0,0,0,0,0,0,0,0,0,0,0,0,0,0,0,0
DLEH-OFFICE OF DISABILITY EMPLOYMENT POLICY,1,0,0,0,0,0,0,0,0,0,1,0,0,0,0,0,0,0,0,0,0,0,1,0,0,0,0,0,0,0,0,0,0,0,0,0,0,0,0,0,0,0,0,0,0,0,1
DLES-EMPLOYMENT STANDARDS ADMINISTRATION,0,0,0,0,0,0,0,0,0,0,0,0,0,0,0,0,0,0,0,0,0,0,0,0,0,0,0,0,0,0,0,0,0,0,0,0,0,0,0,0,0,0,0,0,0,0,0
DLET-EMPLOYMENT AND TRAINING ADMINISTRATION,0,0,0,0,0,0,0,0,0,0,0,0,0,0,0,0,0,0,0,0,0,0,0,0,2,0,0,0,0,1,0,0,0,3,0,0,0,1,0,0,0,0,0,1,0,4,4
DLIG-OFFICE OF THE INSPECTOR GENERAL,0,0,0,0,0,0,0,0,0,0,0,0,0,0,0,0,0,0,0,0,0,0,0,0,0,0,0,0,0,0,0,0,0,0,0,0,1,0,0,0,0,0,0,1,0,1,1
DLLS-BUREAU OF LABOR STATISTICS,1,0,0,0,0,0,0,0,0,0,1,0,0,0,0,0,0,0,0,0,0,0,1,1,5,0,0,0,0,0,0,0,0,6,0,0,0,0,0,0,0,0,0,0,0,6,7
DLMS-MINE SAFETY AND HEALTH ADMINISTRATION,0,1,0,0,0,0,0,0,0,0,1,0,0,0,0,0,0,0,0,0,0,0,1,0,8,1,0,0,0,0,0,0,0,9,0,0,0,0,0,0,0,0,0,0,0,9,10
DLOF-OFFICE OF FEDERAL CONTRACT COMPLIANCE PROGRAMS,0,0,0,0,0,0,0,0,0,0,0,0,0,0,0,0,0,0,0,0,0,0,0,0,0,0,0,0,0,0,0,0,0,0,0,0,0,0,0,0,0,0,0,0,0,0,0
DLOL-OFFICE OF LABOR-MANAGEMENT STANDARDS,0,0,0,0,0,0,0,0,0,0,0,0,0,0,0,0,0,0,0,0,0,0,0,0,0,0,0,0,0,0,0,0,0,0,0,0,0,0,0,0,0,0,0,0,0,0,0
DLOW-OFFICE OF WORKERS' COMPENSATION PROGRAMS,0,0,0,0,0,0,0,0,0,0,0,0,0,0,0,0,0,0,0,0,0,0,0,0,2,1,0,0,0,0,0,0,0,3,0,0,1,0,0,0,0,0,0,1,0,4,4
DLPA-OFFICE OF PUBLIC AFFAIRS,0,0,0,0,0,0,0,0,0,0,0,0,0,0,0,0,0,0,0,0,0,0,0,0,2,0,0,0,0,0,0,0,0,2,0,0,0,0,0,0,0,0,0,0,0,2,2
DLPE-OFFICE OF THE ASSISTANT SECRETARY FOR POLICY,0,0,0,0,0,0,0,0,0,0,0,0,0,0,0,0,0,0,0,0,0,0,0,0,0,0,0,0,0,0,0,0,0,0,0,0,0,0,0,0,0,0,0,0,0,0,0
DLPW-EMPLOYEE BENEFITS SECURITY ADMINISTRATION,0,0,0,0,0,0,0,0,0,0,0,0,0,0,0,0,0,0,0,0,0,0,0,0,7,0,0,0,0,0,0,0,0,7,0,0,2,0,0,0,0,0,0,2,0,9,9
DLSH-OCCUPATIONAL SAFETY AND HEALTH ADMINISTRATION,1,0,0,0,0,0,0,0,0,0,1,0,0,0,0,0,0,0,0,0,0,0,1,1,8,0,3,0,0,0,0,0,0,12,0,0,13,0,0,0,0,0,0,13,0,25,26
DLSL-OFFICE OF THE SOLICITOR,0,0,0,0,0,0,0,0,0,0,0,0,0,0,0,0,0,0,0,0,0,0,0,0,0,1,0,0,0,0,0,0,0,1,0,0,0,0,0,0,0,0,0,0,0,1,1
DLVE-VETERANS EMPLOYMENT AND TRAINING SERVICES,0,0,0,0,0,0,0,0,0,0,0,0,0,0,0,0,0,0,0,0,0,0,0,0,0,0,0,0,0,0,0,0,0,0,0,0,0,0,0,0,0,0,0,0,0,0,0
DLWB-WOMEN'S BUREAU,0,0,0,0,0,0,0,0,0,0,0,0,0,0,0,0,0,0,0,0,0,0,0,0,0,0,0,0,0,0,0,0,0,0,0,0,0,0,0,0,0,0,0,0,0,0,0
DLWH-WAGE AND HOUR DIVISION,0,0,0,0,0,0,0,0,0,0,0,0,0,0,0,0,0,0,0,0,0,0,0,1,2,1,0,0,0,0,0,0,0,4,0,0,0,0,0,0,0,0,0,0,0,4,4
DN**-UNSPECIFIED,0,0,0,0,0,0,0,0,0,0,0,0,0,0,0,0,0,0,0,0,0,0,0,0,0,0,0,0,0,0,0,0,0,0,0,0,0,0,0,0,0,0,0,0,0,0,0
DN00-DEPARTMENT OF ENERGY,8,0,0,0,0,0,0,0,0,0,8,0,0,0,0,0,0,0,0,0,0,0,8,0,13,0,1,0,0,1,0,0,0,15,4,0,3,0,0,0,7,0,0,14,0,29,37
DNFE-FEDERAL ENERGY REGULATORY COMMISSION,2,0,0,0,0,0,0,0,0,0,2,0,0,0,0,0,0,0,0,0,0,0,2,0,4,0,1,0,0,0,0,0,0,5,0,0,0,0,0,0,0,0,0,0,0,5,7
DQ00-DENALI COMMISSION,0,0,0,0,0,0,0,0,0,0,0,0,0,0,0,0,0,0,0,0,0,0,0,0,0,0,0,0,0,0,0,0,0,0,0,0,0,0,0,0,2,0,0,2,0,2,2
EB00-EXPORT-IMPORT BANK OF THE UNITED STATES,0,0,0,0,0,0,0,0,0,0,0,0,0,0,0,0,0,0,0,0,0,0,0,0,0,1,0,0,0,0,0,0,0,1,0,0,0,0,0,0,0,0,0,0,0,1,1
EC00-OFFICE OF ADMINISTRATION,0,0,0,0,0,0,0,0,0,0,0,0,0,0,0,0,0,0,0,0,0,0,0,0,0,0,0,0,0,0,0,0,0,0,0,0,0,0,0,0,0,0,0,0,0,0,0
EDEA-IMMEDIATE OFFICE OF THE SECRETARY OF EDUCATION,0,0,0,0,0,0,0,0,0,0,0,0,0,0,0,0,0,0,0,0,0,0,0,0,0,0,0,0,0,0,0,0,0,0,0,0,0,0,0,0,1,0,0,1,0,1,1
EDEB-OFFICE OF THE DUTY SECRETARY OF EDUCATION,0,0,0,0,0,0,0,0,0,0,0,0,0,0,0,0,0,0,0,0,0,0,0,0,0,0,0,0,0,0,0,0,0,0,0,0,0,0,0,0,0,0,0,0,0,0,0
EDEC-OFFICE FOR CIVIL RIGHTS,0,0,0,0,0,0,0,0,0,0,0,0,0,0,0,0,0,0,0,0,0,0,0,0,0,0,0,0,0,0,0,0,0,0,0,0,1,2,0,0,0,0,0,3,0,3,3
"EDED-OFFICE OF PLANNING, EVALUATION AND POLICY DEVELOPMENT",0,0,0,0,0,0,0,0,0,0,0,0,0,0,0,0,0,0,0,0,0,0,0,0,0,0,0,0,0,0,0,0,0,0,0,0,0,0,0,0,0,0,0,0,0,0,0
EDEE-OFFICE OF THE UNDER SECRETARY,0,0,0,0,0,0,0,0,0,0,0,0,0,0,0,0,0,0,0,0,0,0,0,0,0,0,0,0,0,0,0,0,0,0,0,0,0,0,0,0,0,0,0,0,0,0,0
EDEF-OFFICE OF INSPECTOR GENERAL,0,0,0,0,0,0,0,0,0,0,0,0,0,0,0,0,0,0,0,0,0,0,0,0,0,0,0,0,0,0,0,0,0,0,0,0,0,0,0,0,0,0,0,0,0,0,0
EDEG-OFFICE OF THE GENERAL COUNSEL,0,0,0,0,0,0,0,0,0,0,0,0,0,0,0,0,0,0,0,0,0,0,0,0,0,0,1,0,0,0,0,0,0,1,0,0,0,0,0,0,0,0,0,0,0,1,1
EDEH-OFFICE OF SPECIAL EDUCATION AND REHABILITATIVE SERVICES,1,0,0,0,0,0,0,0,0,0,1,0,0,0,0,0,0,0,0,0,0,0,1,0,2,0,0,0,0,0,0,0,0,2,0,0,0,0,0,0,0,0,0,0,0,2,3
EDEI-OFFICE OF THE CHIEF INFORMATION OFFICER,0,0,0,0,0,0,0,0,0,0,0,0,0,0,0,0,0,0,0,0,0,0,0,0,0,0,0,0,0,0,0,0,0,0,0,0,0,0,0,0,0,0,0,0,0,0,0
EDEJ-OFFICE OF LEGISLATION AND CONGRESSIONAL AFFAIRS,0,0,0,0,0,0,0,0,0,0,0,0,0,0,0,0,0,0,0,0,0,0,0,0,0,0,0,0,0,0,0,0,0,0,0,0,0,0,0,0,0,0,0,0,0,0,0
EDEL-OFFICE OF THE CHIEF FINANCIAL OFFICER,0,0,0,0,0,0,0,0,0,0,0,0,0,0,0,0,0,0,0,0,0,0,0,0,0,0,0,0,0,0,0,0,0,0,0,0,3,0,0,0,0,0,0,3,0,3,3
EDEM-OFFICE OF MANAGEMENT,0,0,0,0,0,0,0,0,0,0,0,0,0,0,0,0,0,0,0,0,0,0,0,0,0,0,0,0,0,0,0,0,0,0,0,0,0,0,0,0,0,0,0,0,0,0,0
EDEN-FEDERAL STUDENT AID,1,0,0,0,0,0,0,0,0,0,1,0,0,0,0,0,0,0,0,0,0,0,1,1,6,0,0,0,0,2,0,0,0,9,0,0,1,0,0,0,0,0,0,1,0,10,11
EDEO-OFFICE OF COMMUNICATIONS AND OUTREACH,0,0,0,0,0,0,0,0,0,0,0,0,0,0,0,0,0,0,0,0,0,0,0,0,0,0,0,0,0,0,0,0,0,0,0,0,1,0,0,0,0,0,0,1,0,1,1
EDEP-OFFICE OF POSTSECONDARY EDUCATION,0,0,0,0,0,0,0,0,0,0,0,0,0,0,0,0,0,0,0,0,0,0,0,0,4,0,0,0,0,0,0,0,0,4,0,0,1,1,0,0,1,0,0,3,0,7,7
EDEQ-OFFICE OF SAFE AND DRUG-FREE SCHOOLS,0,0,0,0,0,0,0,0,0,0,0,0,0,0,0,0,0,0,0,0,0,0,0,0,0,0,0,0,0,0,0,0,0,0,0,0,0,0,0,0,0,0,0,0,0,0,0
EDER-INSTITUTE OF EDUCATION SCIENCES,0,0,0,0,0,0,0,0,0,0,0,0,0,0,0,0,0,0,0,0,0,0,0,0,0,0,0,0,0,0,0,0,0,0,0,0,0,0,0,0,1,0,0,1,0,1,1
EDES-OFFICE OF ELEMENTARY AND SECONDARY EDUCATION,0,0,0,0,0,0,0,0,0,0,0,0,0,0,0,0,0,0,0,0,0,0,0,0,0,0,0,0,0,0,0,0,0,0,0,0,0,0,0,0,1,0,0,1,0,1,1
EDET-OFFICE OF ENGLISH LANGUAGE ACQUISITION,0,0,0,0,0,0,0,0,0,0,0,0,0,0,0,0,0,0,0,0,0,0,0,0,0,0,0,0,0,0,0,0,0,0,0,0,0,0,0,0,0,0,0,0,0,0,0
EDEU-OFFICE OF INNOVATION AND IMPROVEMENT,0,0,0,0,0,0,0,0,0,0,0,0,0,0,0,0,0,0,0,0,0,0,0,0,0,0,0,0,0,0,0,0,0,0,0,0,0,1,0,0,0,0,0,1,0,1,1
EDEV-OFFICE OF VOCATIONAL AND ADULT EDUCATION,0,0,0,0,0,0,0,0,0,0,0,0,0,0,0,0,0,0,0,0,0,0,0,0,1,0,0,0,0,0,0,0,0,1,0,0,0,0,0,0,0,0,0,0,0,1,1
EDEX-NATIONAL INSTITUTE FOR LITERACY,0,0,0,0,0,0,0,0,0,0,0,0,0,0,0,0,0,0,0,0,0,0,0,0,0,0,0,0,0,0,0,0,0,0,0,0,0,0,0,0,0,0,0,0,0,0,0
EDEY-ADVISORY COUNCILS AND COMMITTEES,0,0,0,0,0,0,0,0,0,0,0,0,0,0,0,0,0,0,0,0,0,0,0,0,0,0,0,0,0,0,0,0,0,0,0,0,0,0,0,0,0,0,0,0,0,0,0
EDEZ-NATIONAL ASSESSMENT GOVERNING BOARD,0,0,0,0,0,0,0,0,0,0,0,0,0,0,0,0,0,0,0,0,0,0,0,0,0,0,0,0,0,0,0,0,0,0,0,0,0,0,0,0,0,0,0,0,0,0,0
EE00-EQUAL EMPLOYMENT OPPORTUNITY COMMISSION,0,0,0,0,0,0,0,0,0,0,0,0,0,0,0,0,0,0,0,0,0,0,0,0,0,0,0,0,0,0,0,0,0,0,0,0,0,0,0,0,0,0,0,0,0,0,0
EO00-MORRIS K. UDALL AND STEWART L. UDALL FOUNDATION,0,0,0,0,0,0,0,0,0,0,0,0,0,0,0,0,0,0,0,0,0,0,0,0,0,0,0,0,0,0,0,0,0,0,0,0,0,0,0,0,0,0,0,0,0,0,0
EP00-ENVIRONMENTAL PROTECTION AGENCY,7,3,0,0,0,0,0,0,0,0,10,0,0,0,0,0,0,0,0,0,0,0,10,0,15,0,3,0,0,0,1,0,0,19,4,2,12,1,0,0,4,0,0,23,0,42,52
EQ00-COUNCIL ON ENVIRONMENTAL QUALITY/OFFICE OF ENVIRONMENTAL QUALITY,0,0,0,0,0,0,0,0,0,0,0,0,0,0,0,0,0,0,0,0,0,0,0,0,0,0,0,0,0,0,0,0,0,0,0,0,0,0,0,0,0,0,0,0,0,0,0
EW00-TRADE AND DEVELOPMENT AGENCY,0,0,0,0,0,0,0,0,0,0,0,0,0,0,0,0,0,0,0,0,0,0,0,0,0,0,0,0,0,0,0,0,0,0,0,0,0,0,0,0,0,0,0,0,0,0,0
FC00-FEDERAL COMMUNICATIONS COMMISSION,0,0,0,0,0,0,0,0,0,0,0,0,0,0,0,0,0,0,0,0,0,0,0,0,0,1,0,0,0,0,0,0,0,1,0,0,0,0,0,0,0,0,0,0,0,1,1
FD00-FEDERAL DEPOSIT INSURANCE CORPORATION,2,1,0,0,0,0,0,0,0,0,3,0,0,0,0,0,0,0,0,0,0,0,3,1,15,0,8,0,0,0,0,0,0,24,9,3,9,0,0,0,0,0,0,21,0,45,48
FI00-FEDERAL FINANCIAL INSTITUTIONS EXAMINATION COUNCIL,0,0,0,0,0,0,0,0,0,0,0,0,0,0,0,0,0,0,0,0,0,0,0,0,0,0,0,0,0,0,0,0,0,0,0,0,0,0,0,0,0,0,0,0,0,0,0
FJ00-CHEMICAL SAFETY AND HAZARD INVESTIGATION BOARD,0,0,0,0,0,0,0,0,0,0,0,0,0,0,0,0,0,0,0,0,0,0,0,0,0,0,0,0,0,0,0,0,0,0,0,0,0,0,0,0,0,0,0,0,0,0,0
FK00-FARM CREDIT SYSTEM INSURANCE CORPORATION,0,0,0,0,0,0,0,0,0,0,0,0,0,0,0,0,0,0,0,0,0,0,0,0,0,0,0,0,0,0,0,0,0,0,0,0,0,0,0,0,0,0,0,0,0,0,0
FL00-FARM CREDIT ADMINISTRATION,0,0,0,0,0,0,0,0,0,0,0,0,0,0,0,0,0,0,0,0,0,0,0,0,0,0,0,0,0,0,0,0,0,0,0,0,1,0,0,0,0,0,0,1,0,1,1
FM00-FEDERAL MEDIATION AND CONCILIATION SERVICE,0,0,0,0,0,0,0,0,0,0,0,0,0,0,0,0,0,0,0,0,0,0,0,0,0,0,0,0,0,0,0,0,0,0,0,0,0,0,0,0,0,0,0,0,0,0,0
FQ01-OFFICE OF THE DIRECTOR,0,0,0,0,0,0,0,0,0,0,0,0,0,0,0,0,0,0,0,0,0,0,0,0,0,0,0,0,0,0,0,0,0,0,0,0,1,0,0,0,0,0,0,1,0,1,1
FQ02-PRETRIAL SERVICES AGENCY,0,0,0,0,0,0,0,0,0,0,0,0,0,0,0,0,0,0,0,0,0,0,0,0,0,0,0,0,0,0,0,0,0,0,0,0,0,0,0,0,0,0,0,0,0,0,0
FRFT-BUREAU OF CONSUMER FINANCIAL PROTECTION,1,1,0,0,0,0,0,0,0,0,2,0,0,0,0,0,0,0,0,0,0,0,2,0,4,8,2,0,0,0,0,0,0,14,2,0,1,0,0,0,4,0,0,7,0,21,23
FT00-FEDERAL TRADE COMMISSION,0,0,0,0,0,0,0,0,0,0,0,0,0,0,0,0,0,0,0,0,0,0,0,0,2,2,0,0,0,0,0,0,0,4,0,0,2,0,0,0,0,0,0,2,0,6,6
FW00-OFFICE OF SPECIAL COUNSEL,0,0,0,0,0,0,0,0,0,0,0,0,0,0,0,0,0,0,0,0,0,0,0,0,0,0,0,0,0,0,0,0,0,0,0,0,0,0,0,0,0,0,0,0,0,0,0
FY00-FEDERAL HOUSING FINANCE BOARD,0,0,0,0,0,0,0,0,0,0,0,0,0,0,0,0,0,0,0,0,0,0,0,0,0,0,0,0,0,0,0,0,0,0,0,0,0,0,0,0,0,0,0,0,0,0,0
GB00-OVERSEAS PRIVATE INVESTMENT CORPORATION,0,0,0,0,0,0,0,0,0,0,0,0,0,0,0,0,0,0,0,0,0,0,0,0,0,0,0,0,0,0,0,0,0,0,0,0,0,0,0,5,0,0,0,5,0,5,5
GE00-BARRY GOLDWATER SCHOLARSHIP AND EXCELLENCE IN EDUCATION FOUNDATION,0,0,0,0,0,0,0,0,0,0,0,0,0,0,0,0,0,0,0,0,0,0,0,0,0,0,0,0,0,0,0,0,0,0,0,0,0,0,0,0,0,0,0,0,0,0,0
GG00-OFFICE OF GOVERNMENT ETHICS,0,0,0,0,0,0,0,0,0,0,0,0,0,0,0,0,0,0,0,0,0,0,0,0,0,0,0,0,0,0,0,0,0,0,0,0,0,0,0,0,0,0,0,0,0,0,0
GJ00-PRESIDIO TRUST,0,0,0,0,0,0,0,0,0,0,0,0,0,0,0,0,0,0,0,0,0,0,0,0,0,0,0,0,0,1,0,0,0,1,0,0,0,0,0,0,1,0,0,1,0,2,2
GM00-VALLES CALDERA TRUST,0,0,0,0,0,0,0,0,0,0,0,0,0,0,0,0,0,0,0,0,0,0,0,0,0,0,0,0,0,0,0,0,0,0,0,0,0,0,0,0,2,0,0,2,0,2,2
GO00-VIETNAM EDUCATION FOUNDATION,0,0,0,0,0,0,0,0,0,0,0,0,0,0,0,0,0,0,0,0,0,0,0,0,0,0,0,0,0,0,0,0,0,0,0,0,0,0,0,0,0,0,0,0,0,0,0
GQ00-ELECTION ASSISTANCE COMMISSION,0,0,0,0,0,0,0,0,0,0,0,0,0,0,0,0,0,0,0,0,0,0,0,0,0,0,0,0,0,0,0,0,0,0,0,0,0,0,0,0,1,0,0,1,0,1,1
GS01-IMMEDIATE OFFICE OF THE ADMINISTRATOR,0,0,0,0,0,0,0,0,0,0,0,0,0,0,0,0,0,0,0,0,0,0,0,0,1,0,0,0,0,0,0,0,0,1,0,0,0,0,0,0,0,0,0,0,0,1,1
GS02-OFFICE OF ADMINISTRATIVE SERVICES,0,0,0,0,0,0,0,0,0,0,0,0,0,0,0,0,0,0,0,0,0,0,0,0,0,0,0,0,0,0,0,0,0,0,0,0,0,0,0,0,0,0,0,0,0,0,0
GS03-PUBLIC BUILDINGS SERVICE,1,0,0,0,0,0,0,0,0,0,1,0,0,0,0,0,0,0,0,0,0,0,1,4,13,2,2,0,0,0,0,0,0,21,0,0,0,0,0,0,0,0,0,0,0,21,22
GS04-OFFICE OF CIVIL RIGHTS,0,0,0,0,0,0,0,0,0,0,0,0,0,0,0,0,0,0,0,0,0,0,0,0,0,0,0,0,0,0,0,0,0,0,0,0,0,0,0,0,0,0,0,0,0,0,0
GS10-OFFICE OF SMALL BUSINESS UTILIZATION,0,0,0,0,0,0,0,0,0,0,0,0,0,0,0,0,0,0,0,0,0,0,0,0,0,0,0,0,0,0,0,0,0,0,0,0,0,0,0,0,0,0,0,0,0,0,0
GS11-OFFICE OF THE CHIEF FINANCIAL OFFICER,2,0,0,0,0,0,0,0,0,0,2,0,0,0,0,0,0,0,0,0,0,0,2,0,0,0,0,0,0,0,0,0,0,0,1,0,0,0,0,0,0,0,0,1,0,1,3
GS12-OFFICE OF GENERAL COUNSEL,0,0,0,0,0,0,0,0,0,0,0,0,0,0,0,0,0,0,0,0,0,0,0,0,0,0,0,0,0,0,0,0,0,0,0,0,0,0,0,0,0,0,0,0,0,0,0
GS13-CIVILIAN BOARD OF CONTRACT APPEALS,1,0,0,0,0,0,0,0,0,0,1,0,0,0,0,0,0,0,0,0,0,0,1,0,0,1,0,0,0,0,0,0,0,1,0,0,0,0,0,0,0,0,0,0,0,1,2
GS14-OFFICE OF THE CHIEF HUMAN CAPITAL OFFICER,0,0,0,0,0,0,0,0,0,0,0,0,0,0,0,0,0,0,0,0,0,0,0,1,0,0,0,0,0,0,0,0,0,1,0,0,0,0,0,0,0,0,0,0,0,1,1
GS15-OFFICE OF INSPECTOR GENERAL,0,0,0,0,0,0,0,0,0,0,0,0,0,0,0,0,0,0,0,0,0,0,0,0,0,0,0,0,0,0,0,0,0,0,0,0,0,0,0,0,0,0,0,0,0,0,0
GS16-OFFICE OF THE CHIEF ACQUISITION OFFICER,0,0,0,0,0,0,0,0,0,0,0,0,0,0,0,0,0,0,0,0,0,0,0,0,0,0,0,0,0,0,0,0,0,0,0,0,0,0,0,0,0,0,0,0,0,0,0
GS19-OFFICE OF CITIZEN SERVICES AND COMMUNICATIONS,0,0,0,0,0,0,0,0,0,0,0,0,0,0,0,0,0,0,0,0,0,0,0,0,0,0,0,0,0,0,0,0,0,0,0,0,0,0,0,0,0,0,0,0,0,0,0
GS20-OFFICE OF CONGRESSIONAL AND INTERGOVERNMENTAL AFFAIRS,0,0,0,0,0,0,0,0,0,0,0,0,0,0,0,0,0,0,0,0,0,0,0,0,0,0,0,0,0,0,0,0,0,0,0,0,0,0,0,0,0,0,0,0,0,0,0
GS22-OFFICES OF THE REGIONAL ADMINISTRATORS,0,0,0,0,0,0,0,0,0,0,0,0,0,0,0,0,0,0,0,0,0,0,0,0,0,0,0,0,0,0,0,0,0,0,0,0,0,0,0,0,0,0,0,0,0,0,0
GS26-OFFICE OF GOVERNMENTWIDE POLICY,0,0,0,0,0,0,0,1,0,0,1,0,0,0,0,0,0,0,0,0,0,0,1,0,0,0,0,0,0,0,1,0,0,1,0,0,0,0,0,0,0,0,0,0,0,1,2
GS28-OFFICE OF THE CHIEF INFORMATION OFFICER,0,0,0,0,0,0,0,0,0,0,0,0,0,0,0,0,0,0,0,0,0,0,0,1,1,0,0,0,0,0,0,0,0,2,0,0,0,0,0,0,0,0,0,0,0,2,2
GS30-FEDERAL ACQUISITION SERVICE,1,0,0,0,0,0,0,1,0,0,2,0,0,0,0,0,0,0,0,0,0,0,2,1,6,0,1,0,0,0,0,0,0,8,0,0,0,0,0,0,0,0,0,0,0,8,10
GS31-OFFICE OF EMERGENCY RESPONSE AND RECOVERY,0,0,0,0,0,0,0,0,0,0,0,0,0,0,0,0,0,0,0,0,0,0,0,0,0,0,0,0,0,0,0,0,0,0,0,0,0,0,0,0,0,0,0,0,0,0,0
GS32-OFFICE OF COMMUNICATIONS AND MARKETING,1,0,0,0,0,0,0,0,0,0,1,0,0,0,0,0,0,0,0,0,0,0,1,0,0,0,0,0,0,0,0,0,0,0,0,0,1,0,0,0,0,0,0,1,0,1,2
GW00-INTERNATIONAL BOUNDARY AND WATER COMMISSION:  UNITED STATES AND MEXICO,0,0,0,0,0,0,0,0,0,0,0,0,0,0,0,0,0,0,0,0,0,0,0,0,2,0,0,0,0,0,0,0,0,2,0,0,0,0,0,0,0,0,0,0,0,2,2
GX00-INTERNATIONAL BOUNDARY COMMISSION:  UNITED STATES AND CANADA,0,0,0,0,0,0,0,0,0,0,0,0,0,0,0,0,0,0,0,0,0,0,0,0,0,0,0,0,0,0,0,0,0,0,0,0,0,0,0,0,0,0,0,0,0,0,0
GY00-INTERNATIONAL JOINT COMMISSION:  UNITED STATES AND CANADA,0,0,0,0,0,0,0,0,0,0,0,0,0,0,0,0,0,0,0,0,0,0,0,0,0,0,0,0,0,0,0,0,0,0,0,0,0,0,0,0,0,0,0,0,0,0,0
HB00-COMMITTEE FOR PURCHASE FROM PEOPLE WHO ARE BLIND OR SEVERELY DISABLED,0,0,0,0,0,0,0,0,0,0,0,0,0,0,0,0,0,0,0,0,0,0,0,0,0,0,0,0,0,0,0,0,0,0,0,0,0,0,0,0,0,0,0,0,0,0,0
HD00-U.S. HOLOCAUST MEMORIAL MUSEUM,0,0,0,0,0,0,0,0,0,0,0,0,0,0,0,0,0,0,0,0,0,0,0,0,0,0,0,0,0,0,0,0,0,0,0,0,0,0,0,0,0,0,0,0,0,0,0
HE10-OFFICE OF THE SECRETARY OF HEALTH AND HUMAN SERVICES,4,1,0,0,0,0,0,0,0,0,5,0,0,0,0,0,0,0,0,0,0,0,5,0,8,3,0,0,0,0,1,1,0,13,0,0,8,1,0,0,27,0,0,36,0,49,54
HE11-PROGRAM SUPPORT CENTER,0,1,0,0,0,0,0,0,0,0,1,0,0,0,0,0,0,0,0,0,0,0,1,0,1,0,0,0,0,0,0,0,0,1,0,0,1,0,0,0,0,0,0,1,0,2,3
HE12-ADMINISTRATION FOR COMMUNITY LIVING,0,0,0,0,0,0,0,0,0,0,0,0,0,0,0,0,0,0,0,0,0,0,0,0,0,0,0,0,0,0,0,0,0,0,0,0,0,0,0,0,0,0,0,0,0,0,0
HE31-OFFICE OF THE ASSISTANT SECRETARY FOR HEALTH,0,0,0,0,0,0,0,0,0,0,0,0,0,0,0,0,0,0,0,0,0,0,0,0,0,0,0,0,0,0,0,0,0,0,0,0,0,0,0,0,0,0,0,0,0,0,0
HE32-SUBSTANCE ABUSE AND MENTAL HEALTH SERVICES ADMINISTRATION,0,0,0,0,0,0,0,0,0,0,0,0,0,0,0,0,0,0,0,0,0,0,0,0,7,0,0,0,0,0,0,0,0,7,1,0,0,0,0,0,0,0,0,1,0,8,8
HE33-AGENCY FOR HEALTHCARE RESEARCH AND QUALITY,1,0,0,0,0,0,0,0,0,0,1,0,0,0,0,0,0,0,0,0,0,0,1,0,0,0,0,0,0,0,0,0,0,0,0,0,0,0,0,0,0,0,0,0,0,0,1
HE34-HEALTH RESOURCES AND SERVICES ADMINISTRATION,0,1,0,0,0,0,0,0,0,0,1,0,0,0,0,0,0,0,0,0,0,0,1,1,0,0,0,0,0,0,0,0,0,1,0,0,8,0,0,0,3,0,0,11,0,12,13
HE35-AGENCY FOR TOXIC SUBSTANCES AND DISEASE REGISTRY,0,0,0,0,0,0,0,0,0,0,0,0,0,0,0,0,0,0,0,0,0,0,0,0,0,0,0,0,0,0,0,0,0,0,0,0,0,0,0,0,0,0,0,0,0,0,0
HE36-FOOD AND DRUG ADMINISTRATION,2,0,0,0,0,0,0,0,0,0,2,0,0,0,0,0,0,0,0,0,0,0,2,1,19,1,0,0,0,0,0,0,0,21,1,1,16,0,0,0,28,0,0,46,0,67,69
HE37-INDIAN HEALTH SERVICE,5,0,0,0,0,0,0,0,0,0,5,0,0,0,0,0,0,0,0,0,0,0,5,10,52,42,0,0,0,0,0,0,0,104,1,55,2,0,0,0,1,0,0,59,0,163,168
HE38-NATIONAL INSTITUTES OF HEALTH,2,0,0,0,0,0,0,0,0,0,2,0,0,0,0,0,0,0,0,0,0,0,2,3,43,0,4,0,0,0,0,0,0,50,2,0,9,0,0,0,71,0,0,82,0,132,134
HE39-CENTERS FOR DISEASE CONTROL AND PREVENTION,2,0,0,0,0,0,0,0,0,0,2,0,0,0,0,0,0,0,0,0,0,0,2,1,8,7,1,0,0,0,0,0,0,17,1,1,0,0,0,0,10,0,0,12,0,29,31
HE70-CENTERS FOR MEDICARE & MEDICAID SERVICES,1,0,0,0,0,0,0,0,0,0,1,0,0,0,0,0,0,0,0,0,0,0,1,1,21,1,0,0,0,0,0,1,0,24,0,0,0,0,0,0,0,0,0,0,0,24,25
HE90-ADMINISTRATION FOR CHILDREN AND FAMILIES,0,0,0,0,0,0,0,0,0,0,0,0,0,0,0,0,0,0,0,0,0,0,0,0,1,0,0,0,0,0,0,1,0,2,0,1,0,0,0,0,0,0,0,1,0,3,3
HF**-UNSPECIFIED,1,0,0,0,0,0,0,0,0,0,1,0,0,0,0,0,0,0,0,0,0,0,1,2,4,0,0,0,0,0,0,0,0,6,0,0,6,0,0,0,0,0,0,6,0,12,13
HF00-FEDERAL HOUSING FINANCE AGENCY,0,0,0,0,0,0,0,0,0,0,0,0,0,0,0,0,0,0,0,0,0,0,0,0,0,0,0,0,0,0,0,0,0,0,0,0,0,0,0,0,0,0,0,0,0,0,0
HFHA-FEDERAL HOUSING FINANCE AGENCY,1,0,0,0,0,0,0,0,0,0,1,0,0,0,0,0,0,0,0,0,0,0,1,0,0,0,0,0,0,0,0,0,0,0,0,0,0,0,0,0,0,0,0,0,0,0,1
HFHI-OFFICE OF INSPECTOR GENERAL,1,0,0,0,0,0,0,0,0,0,1,0,0,0,0,0,0,0,0,0,0,0,1,0,1,1,0,0,0,0,0,0,0,2,0,0,0,0,0,0,0,0,0,0,0,2,3
HP00-ADVISORY COUNCIL ON HISTORIC PRESERVATION,0,0,0,0,0,0,0,0,0,0,0,0,0,0,0,0,0,0,0,0,0,0,0,0,0,0,0,0,0,0,0,0,0,0,0,0,0,0,0,0,0,0,0,0,0,0,0
HSAA-DHS HEADQUARTERS,6,2,0,0,0,0,0,0,0,0,8,0,0,0,0,0,0,0,0,0,0,0,8,0,12,0,2,0,0,0,1,0,0,15,2,1,2,1,0,0,0,0,0,6,0,21,29
HSAB-BUREAU OF CITIZENSHIP AND IMMIGRATION SERVICES,6,5,0,0,0,0,0,0,0,0,11,0,0,0,0,0,0,0,0,0,0,0,11,2,33,1,1,0,0,4,0,0,0,41,0,0,1,0,0,0,0,0,0,1,0,42,53
HSAC-U.S. COAST GUARD,7,7,0,0,0,0,0,0,0,0,14,0,0,0,0,0,0,0,0,0,0,0,14,3,32,1,0,0,0,7,0,0,0,43,9,0,2,0,0,0,0,0,0,11,0,54,68
HSAD-U.S. SECRET SERVICE,0,0,0,0,0,0,0,0,0,0,0,0,0,0,0,0,0,0,0,0,0,0,0,0,0,0,0,0,0,0,0,0,0,0,0,0,0,0,0,0,0,0,0,0,0,0,0
HSAE-OFFICE OF THE INSPECTOR GENERAL,1,0,0,0,0,0,0,0,0,0,1,0,0,0,0,0,0,0,0,0,0,0,1,0,1,0,0,0,0,0,0,0,0,1,0,0,0,0,0,0,0,0,0,0,0,1,2
