VAEB-DEPUTY ASSISTANT SECRETARY FOR INFORMATION AND TECHNOLOGY,5,4,0,0,0,0,0,0,0,0,9,0,0,0,0,0,0,0,0,0,0,0,9,6,36,2,0,0,0,4,0,0,0,48,0,0,2,0,0,0,0,0,0,2,0,50,59
VAGB-DEPUTY ASSISTANT SECRETARY FOR SECURITY AND LAW ENFORCEMENT,0,0,0,0,0,0,0,0,0,0,0,0,0,0,0,0,0,0,0,0,0,0,0,0,0,0,0,0,0,0,0,0,0,0,0,0,0,0,0,0,0,0,0,0,0,0,0
VAGC-DEPUTY ASSISTANT SECRETARY FOR EMERGENCY MANAGEMENT,0,0,0,0,0,0,0,0,0,0,0,0,0,0,0,0,0,0,0,0,0,0,0,0,0,0,0,0,0,0,0,0,0,0,0,0,0,0,0,0,0,0,0,0,0,0,0
VAHA-IMMEDIATE OFFICE OF THE ASSISTANT SECRETARY FOR POLICY AND PLANNING,0,0,0,0,0,0,0,0,0,0,0,0,0,0,0,0,0,0,0,0,0,0,0,0,0,0,1,0,0,1,0,0,0,2,0,0,0,0,0,0,0,0,0,0,0,2,2
VAHB-DEPUTY ASSISTANT SECRETARY FOR PROGRAM AND DATA ANALYSIS,0,0,0,0,0,0,0,0,0,0,0,0,0,0,0,0,0,0,0,0,0,0,0,0,0,0,0,0,0,0,0,0,0,0,0,0,0,0,0,0,0,0,0,0,0,0,0
VAHC-DEPUTY ASSISTANT SECRETARY FOR PLANNING AND EVALUATION,0,0,0,0,0,0,0,0,0,0,0,0,0,0,0,0,0,0,0,0,0,0,0,0,0,0,0,0,0,0,0,0,0,0,0,0,0,0,0,0,0,0,0,0,0,0,0
VAHD-NATIONAL CENTER FOR VETERAN ANALYSIS AND STATISTICS,0,0,0,0,0,0,0,0,0,0,0,0,0,0,0,0,0,0,0,0,0,0,0,0,0,0,0,0,0,0,0,0,0,0,0,0,0,0,0,0,0,0,0,0,0,0,0
VAJA-OFFICE OF THE ASSISTANT SECRETARY FOR PUBLIC AND INTERGOVERNMENTAL AFFAIRS,0,0,0,0,0,0,0,0,0,0,0,0,0,0,0,0,0,0,0,0,0,0,0,0,0,0,0,0,0,0,0,1,0,1,0,0,0,0,0,0,0,0,0,0,0,1,1
VAJB-DEPUTY ASSISTANCE SECRETARY FOR INTERGOVERNMENTAL AFFAIRS,0,0,0,0,0,0,0,0,0,0,0,0,0,0,0,0,0,0,0,0,0,0,0,0,0,0,0,0,0,0,0,0,0,0,0,0,0,0,0,0,0,0,0,0,0,0,0
VAJC-DEPUTY ASSISTANT SECRETARY FOR PUBLIC AFFAIRS,0,0,0,0,0,0,0,0,0,0,0,0,0,0,0,0,0,0,0,0,0,0,0,0,0,0,0,0,0,0,0,0,0,0,0,0,2,0,0,0,0,0,0,2,0,2,2
VAKA-IMMEDIATE OFFICE OF THE ASSISTANT SECRETARY FOR CONGRESSIONAL AND LEGISLATIVE AFFAIRS,0,0,0,0,0,0,0,0,0,0,0,0,0,0,0,0,0,0,0,0,0,0,0,0,0,0,0,0,0,0,0,0,0,0,0,0,0,0,0,0,0,0,0,0,0,0,0
VAKB-DEPUTY ASSISTANT SECRETARY FOR CONGRESSIONAL AFFAIRS,0,0,0,0,0,0,0,0,0,0,0,0,0,0,0,0,0,0,0,0,0,0,0,0,0,0,0,0,0,0,0,0,0,0,1,0,0,0,0,0,0,0,0,1,0,1,1
VALA-VETERANS BENEFITS ADMINISTRATION,7,3,0,0,0,0,0,0,0,0,10,0,0,0,0,0,0,0,0,0,0,0,10,15,130,1,3,0,0,34,1,0,0,184,0,0,2,0,0,1,0,0,0,3,0,187,197
VAPA-NATIONAL CEMETERY ADMINISTRATION,2,0,0,0,0,0,0,0,0,0,2,0,0,0,0,0,0,0,0,0,0,0,2,0,3,0,0,0,0,0,0,0,0,3,14,2,17,0,0,0,2,0,0,35,0,38,40
VATA-VETERANS HEALTH ADMINISTRATION,50,21,0,0,0,0,1,0,0,0,72,0,0,0,0,0,0,0,0,0,0,0,72,35,435,37,7,0,0,915,2,0,0,1431,114,47,346,0,0,0,983,0,0,1490,5,2926,2998
VB00-COMMISSION TO ELIMINATE CHILD ABUSE AND NEGLECT FATALITIES,0,0,0,0,0,0,0,0,0,0,0,0,0,0,0,0,0,0,0,0,0,0,0,0,0,0,0,0,0,0,0,0,0,0,0,0,0,0,0,0,0,0,0,0,0,0,0
VD00-PRIVACY AND CIVIL LIBERTIES OVERSIGHT BOARD,0,0,0,0,0,0,0,0,0,0,0,0,0,0,0,0,0,0,0,0,0,0,0,0,0,0,0,0,0,0,0,0,0,0,0,0,0,0,0,0,0,0,0,0,0,0,0
YE00-COMMISSION ON THE PREVENTION OF WEAPONS OF MASS DESTRUCTION PROLIFERATION AND TERRORISM,0,0,0,0,0,0,0,0,0,0,0,0,0,0,0,0,0,0,0,0,0,0,0,0,0,0,0,0,0,0,0,0,0,0,0,0,0,0,0,0,0,0,0,0,0,0,0
YF00-FINANCIAL CRISIS INQUIRY COMMISSION,0,0,0,0,0,0,0,0,0,0,0,0,0,0,0,0,0,0,0,0,0,0,0,0,0,0,0,0,0,0,0,0,0,0,0,0,0,0,0,0,0,0,0,0,0,0,0
YG00-RONALD REAGAN CENTENNIAL COMMISSION,0,0,0,0,0,0,0,0,0,0,0,0,0,0,0,0,0,0,0,0,0,0,0,0,0,0,0,0,0,0,0,0,0,0,0,0,0,0,0,0,0,0,0,0,0,0,0
ZL00-MEDICARE PAYMENT ADVISORY COMMISSION,0,0,0,0,0,0,0,0,0,0,0,0,0,0,0,0,0,0,0,0,0,0,0,0,0,0,0,0,0,0,0,0,0,0,0,0,0,0,0,0,0,0,0,0,0,0,0
ZP00-U.S. COMMISSION ON INTERNATIONAL RELIGIOUS FREEDOM,0,0,0,0,0,0,0,0,0,0,0,0,0,0,0,0,0,0,0,0,0,0,0,0,0,0,0,0,0,0,0,0,0,0,0,0,0,0,0,0,0,0,0,0,0,0,0
ZS00-UNITED STATES-CHINA ECONOMIC AND SECURITY REVIEW COMMISSION,0,0,0,0,0,0,0,0,0,0,0,0,0,0,0,0,0,0,0,0,0,0,0,0,0,0,0,0,0,0,0,0,0,0,0,0,0,0,0,0,2,0,0,2,0,2,2
ZU00-DWIGHT D. EISENHOWER MEMORIAL COMMISSION,0,0,0,0,0,0,0,0,0,0,0,0,0,0,0,0,0,0,0,0,0,0,0,0,0,0,0,0,0,0,0,0,0,0,0,0,0,0,0,0,0,0,0,0,0,0,0
All Agencies,709,202,0,0,0,0,7,6,0,0,924,0,0,0,0,0,0,0,0,0,0,1,925,361,4316,724,614,0,0,2922,11,10,0,8958,3601,4114,9294,33,0,10,2825,1,0,19878,7,28843,29768
