HSAD-U.S. SECRET SERVICE,0,1,0,0,0,0,0,0,0,0,1,0,0,0,0,0,0,0,0,0,0,0,1,0,0,0,0,0,0,0,2,0,0,2,0,0,19,0,0,0,0,0,0,19,0,21,22
HSAE-OFFICE OF THE INSPECTOR GENERAL,1,0,0,0,0,0,0,0,0,0,1,0,0,0,0,0,0,0,0,0,0,0,1,0,0,0,0,0,0,0,0,0,0,0,0,0,6,0,0,0,0,0,0,6,0,6,7
HSBB-BUREAU OF IMMIGRATION AND CUSTOMS ENFORCEMENT,11,1,0,0,0,0,0,0,0,0,12,0,0,0,0,0,0,0,0,0,0,0,12,2,30,4,4,0,0,17,0,0,0,57,0,0,16,0,0,0,0,0,0,16,0,73,85
HSBC-TRANSPORTATION SECURITY ADMINISTRATION,0,0,0,0,0,0,0,0,0,0,0,0,0,0,0,0,0,0,0,0,0,0,0,0,0,0,0,0,0,615,0,0,0,615,0,0,0,0,0,0,3,0,0,3,0,618,618
HSBD-BUREAU OF CUSTOMS AND BORDER PROTECTION,7,3,0,0,0,0,0,0,0,0,10,0,0,0,0,0,0,0,0,0,0,0,10,5,192,5,7,0,0,31,0,0,0,240,1,1,7,0,0,0,0,0,0,9,0,249,259
HSBE-FEDERAL LAW ENFORCEMENT TRAINING CENTERS,0,0,0,0,0,0,0,0,0,0,0,0,0,0,0,0,0,0,0,0,0,0,0,0,1,0,0,0,0,0,0,0,0,1,4,3,0,0,0,0,0,0,0,7,0,8,8
HSCA-NATIONAL PROTECTION AND PROGRAMS DIRECTORATE,2,0,0,0,0,0,1,0,0,0,3,0,0,0,0,0,0,0,0,0,0,0,3,0,10,5,0,0,0,15,2,0,0,32,1,0,14,0,0,0,0,0,0,15,0,47,50
HSCB-FEDERAL EMERGENCY MANAGEMENT AGENCY,6,2,0,0,0,0,0,0,0,0,8,0,0,0,0,0,0,0,0,0,0,0,8,1,16,3,0,0,0,1,0,0,0,21,8,0,28,0,0,0,18,0,0,54,0,75,83
HSDA-DOMESTIC NUCLEAR DETECTION OFFICE,1,0,0,0,0,0,0,0,0,0,1,0,0,0,0,0,0,0,0,0,0,0,1,0,0,0,0,0,0,0,0,0,0,0,0,0,0,0,0,0,0,0,0,0,0,0,1
HSFA-OFFICE OF THE UNDER SECRETARY FOR SCIENCE AND TECHNOLOGY,1,0,0,0,0,0,0,0,0,0,1,0,0,0,0,0,0,0,0,0,0,0,1,0,1,0,1,0,0,0,0,0,0,2,0,0,1,0,0,0,0,0,0,1,0,3,4
HT00-HARRY S. TRUMAN SCHOLARSHIP FOUNDATION,0,0,0,0,0,0,0,0,0,0,0,0,0,0,0,0,0,0,0,0,0,0,0,0,0,0,0,0,0,0,0,0,0,0,0,0,0,0,0,0,0,0,0,0,0,0,0
HU**-UNSPECIFIED,0,0,0,0,0,0,0,0,0,0,0,0,0,0,0,0,0,0,0,0,0,0,0,0,0,0,0,0,0,0,0,0,0,0,0,0,0,0,0,0,0,0,0,0,0,0,0
HU01-OFFICE OF THE SENIOR COORDINATOR FOR NEW ENGLAND,0,0,0,0,0,0,0,0,0,0,0,0,0,0,0,0,0,0,0,0,0,0,0,0,1,0,0,0,0,0,0,0,0,1,0,0,1,0,0,0,0,0,0,1,0,2,2
HU02-OFFICE OF THE SENIOR COORDINATOR FOR NEW YORK/NEW JERSEY,0,0,0,0,0,0,0,0,0,0,0,0,0,0,0,0,0,0,0,0,0,0,0,0,0,0,0,0,0,0,0,0,0,0,0,0,0,0,0,0,0,0,0,0,0,0,0
HU03-OFFICE OF THE SENIOR COORDINATOR FOR MID-ATLANTIC,0,0,0,0,0,0,0,0,0,0,0,0,0,0,0,0,0,0,0,0,0,0,0,0,0,0,0,0,0,0,0,0,0,0,0,0,0,0,0,0,0,0,0,0,0,0,0
HU04-OFFICE OF THE SENIOR COORDINATOR FOR SOUTHEAST/CARIBBEAN,0,0,0,0,0,0,0,0,0,0,0,0,0,0,0,0,0,0,0,0,0,0,0,0,0,0,0,0,0,0,0,0,0,0,0,0,1,0,0,0,0,0,0,1,0,1,1
HU05-OFFICE OF THE SENIOR COORDINATOR FOR MIDWEST,0,0,0,0,0,0,0,0,0,0,0,0,0,0,0,0,0,0,0,0,0,0,0,0,0,0,0,0,0,0,0,0,0,0,0,0,0,0,0,0,0,0,0,0,0,0,0
HU06-OFFICE OF THE SENIOR COORDINATOR FOR SOUTHWEST,0,0,0,0,0,0,0,0,0,0,0,0,0,0,0,0,0,0,0,0,0,0,0,0,0,0,0,0,0,0,0,0,0,0,0,0,0,0,0,0,0,0,0,0,0,0,0
HU07-OFFICE OF THE SENIOR COORDINATOR FOR GREAT PLAINS,0,0,0,0,0,0,0,0,0,0,0,0,0,0,0,0,0,0,0,0,0,0,0,0,0,0,0,0,0,0,0,0,0,0,0,0,0,0,0,0,0,0,0,0,0,0,0
HU08-OFFICE OF THE SENIOR COORDINATOR FOR ROCKY MOUNTAINS,0,0,0,0,0,0,0,0,0,0,0,0,0,0,0,0,0,0,0,0,0,0,0,0,0,0,0,0,0,0,0,0,0,0,0,0,1,0,0,0,0,0,0,1,0,1,1
HU09-OFFICE OF THE SENIOR COORDINATOR FOR PACIFIC/HAWAII,0,0,0,0,0,0,0,0,0,0,0,0,0,0,0,0,0,0,0,0,0,0,0,0,0,0,0,0,0,0,0,0,0,0,0,0,0,0,0,0,0,0,0,0,0,0,0
HU10-OFFICE OF THE SENIOR COORDINATOR FOR NORTHWEST/ALASKA,0,0,0,0,0,0,0,0,0,0,0,0,0,0,0,0,0,0,0,0,0,0,0,0,0,0,0,0,0,0,0,0,0,0,0,0,0,0,0,0,0,0,0,0,0,0,0
HUAA-OFFICE OF THE SECRETARY OF HOUSING AND URBAN DEVELOPMENT,0,0,0,0,0,0,0,0,0,0,0,0,0,0,0,0,0,0,0,0,0,0,0,0,0,0,0,0,0,0,0,1,0,1,0,0,0,0,0,0,0,0,0,0,0,1,1
HUBB-ASSISTANT SECRETARY FOR ADMINISTRATION,1,0,0,0,0,0,0,0,0,0,1,0,0,0,0,0,0,0,0,0,0,0,1,0,0,0,0,0,0,0,0,0,0,0,0,0,0,0,0,0,0,0,0,0,0,0,1
HUCC-OFFICE OF GENERAL COUNSEL,0,0,0,0,0,0,0,0,0,0,0,0,0,0,0,0,0,0,0,0,0,0,0,0,0,0,0,0,0,0,0,0,0,0,0,0,0,0,0,0,0,0,0,0,0,0,0
HUDD-ASSISTANT SECRETARY FOR COMMUNITY PLANNING AND DEVELOPMENT,0,0,0,0,0,0,0,0,0,0,0,0,0,0,0,0,0,0,0,0,0,0,0,0,0,0,0,0,0,0,0,0,0,0,0,0,0,0,0,0,0,0,0,0,0,0,0
HUEE-ASSISTANT SECRETARY FOR FAIR HOUSING AND EQUAL OPPORTUNITY,0,0,0,0,0,0,0,0,0,0,0,0,0,0,0,0,0,0,0,0,0,0,0,0,0,0,0,0,0,0,0,0,0,0,0,0,0,0,0,0,0,0,0,0,0,0,0
HUFF-OFFICE OF THE CHIEF FINANCIAL OFFICER,1,0,0,0,0,0,0,0,0,0,1,0,0,0,0,0,0,0,0,0,0,0,1,0,0,0,0,0,0,0,0,0,0,0,0,0,3,0,0,0,0,0,0,3,0,3,4
HUFH-OFFICE OF FEDERAL HOUSING ENTERPRISE OVERSIGHT,0,0,0,0,0,0,0,0,0,0,0,0,0,0,0,0,0,0,0,0,0,0,0,0,0,0,0,0,0,0,0,0,0,0,0,0,0,0,0,0,0,0,0,0,0,0,0
HUGG-OFFICE OF INSPECTOR GENERAL,1,0,0,0,0,0,0,0,0,0,1,0,0,0,0,0,0,0,0,0,0,0,1,0,0,0,0,0,0,0,0,0,0,0,0,0,0,0,0,0,0,0,0,0,0,0,1
HUII-OFFICE OF DEPARTMENTAL OPERATIONS AND COORDINATION,0,0,0,0,0,0,0,0,0,0,0,0,0,0,0,0,0,0,0,0,0,0,0,0,0,0,0,0,0,0,0,0,0,0,0,0,0,0,0,0,0,0,0,0,0,0,0
HUJJ-ASSISTANT SECRETARY FOR CONGRESSIONAL AND INTERGOVERNMENTAL RELATIONS,0,0,0,0,0,0,0,0,0,0,0,0,0,0,0,0,0,0,0,0,0,0,0,0,0,0,0,0,0,0,0,0,0,0,0,0,0,1,0,0,0,0,0,1,0,1,1
HUKA-CENTER FOR FAITH-BASED AND COMMUNITY INITIATIVES,0,0,0,0,0,0,0,0,0,0,0,0,0,0,0,0,0,0,0,0,0,0,0,0,0,0,0,0,0,0,0,0,0,0,0,0,0,0,0,0,0,0,0,0,0,0,0
HUKK-OFFICE OF FIELD POLICY AND MANAGEMENT,0,0,0,0,0,0,0,0,0,0,0,0,0,0,0,0,0,0,0,0,0,0,0,0,0,0,0,0,0,0,0,0,0,0,0,0,1,0,0,0,0,0,0,1,0,1,1
HULL-OFFICE OF HEALTHY HOMES AND LEAD HAZARD CONTROL,0,0,0,0,0,0,0,0,0,0,0,0,0,0,0,0,0,0,0,0,0,0,0,0,0,0,0,0,0,0,0,0,0,0,0,0,0,0,0,0,0,0,0,0,0,0,0
HUMM-ASSISTANT SECRETARY FOR HOUSING--FEDERAL HOUSING COMMISSIONER,0,0,0,0,0,0,0,0,0,0,0,0,0,0,0,0,0,0,0,0,0,0,0,0,0,0,0,0,0,0,0,0,0,0,0,0,0,0,0,0,0,0,0,0,0,0,0
HUNN-OFFICE OF THE CHIEF PROCUREMENT OFFICER,0,0,0,0,0,0,0,0,0,0,0,0,0,0,0,0,0,0,0,0,0,0,0,0,0,0,0,0,0,0,0,0,0,0,0,0,2,0,0,0,0,0,0,2,0,2,2
HUPP-ASSISTANT SECRETARY FOR PUBLIC AND INDIAN HOUSING,0,0,0,0,0,0,0,0,0,0,0,0,0,0,0,0,0,0,0,0,0,0,0,0,1,0,0,0,0,0,0,0,0,1,0,0,0,0,0,0,0,0,0,0,0,1,1
HUQQ-OFFICE OF THE CHIEF INFORMATION OFFICER,0,0,0,0,0,0,0,0,0,0,0,0,0,0,0,0,0,0,0,0,0,0,0,0,0,0,0,0,0,0,0,0,0,0,0,0,0,0,0,0,0,0,0,0,0,0,0
HURR-ASSISTANT SECRETARY FOR POLICY DEVELOPMENT AND RESEARCH,0,0,0,0,0,0,0,0,0,0,0,0,0,0,0,0,0,0,0,0,0,0,0,0,0,0,0,0,0,0,0,0,0,0,0,0,0,0,0,0,0,0,0,0,0,0,0
HUTT-GOVERNMENT NATIONAL MORTGAGE ASSOCIATION (GINNIE MAE),0,0,0,0,0,0,0,0,0,0,0,0,0,0,0,0,0,0,0,0,0,0,0,0,4,0,0,0,0,0,0,0,0,4,0,0,0,0,0,0,0,0,0,0,0,4,4
HUUU-OFFICE OF DEPARTMENTAL EQUAL EMPLOYMENT OPPORTUNITY,0,0,0,0,0,0,0,0,0,0,0,0,0,0,0,0,0,0,0,0,0,0,0,0,0,0,0,0,0,0,0,0,0,0,1,0,1,0,0,0,0,0,0,2,0,2,2
HUWW-ASSISTANT SECRETARY FOR PUBLIC AFFAIRS,0,0,0,0,0,0,0,0,0,0,0,0,0,0,0,0,0,0,0,0,0,0,0,0,0,0,0,0,0,0,0,0,0,0,0,0,0,0,0,0,0,0,0,0,0,0,0
HUXX-OFFICE OF STRATEGIC PLANNING AND MANAGEMENT,0,0,0,0,0,0,0,0,0,0,0,0,0,0,0,0,0,0,0,0,0,0,0,0,0,0,0,0,0,0,0,0,0,0,0,0,0,0,0,0,0,0,0,0,0,0,0
HUYY-OFFICE OF SUSTAINABLE HOUSING AND COMMUNTIES,0,0,0,0,0,0,0,0,0,0,0,0,0,0,0,0,0,0,0,0,0,0,0,0,0,0,0,0,0,0,0,0,0,0,0,0,0,0,0,0,0,0,0,0,0,0,0
HW00-U.S. INTERAGENCY COUNCIL ON HOMELESSNESS,0,0,0,0,0,0,0,0,0,0,0,0,0,0,0,0,0,0,0,0,0,0,0,0,0,0,0,0,0,0,0,0,0,0,0,0,0,0,0,0,2,0,0,2,0,2,2
IB00-BROADCASTING BOARD OF GOVERNORS,3,1,0,0,0,0,0,0,0,0,4,0,0,0,0,0,0,0,0,0,0,0,4,1,2,0,0,0,0,0,0,0,0,3,0,0,2,0,0,0,0,0,0,2,0,5,9
IF00-INTER-AMERICAN FOUNDATION,0,0,0,0,0,0,0,0,0,0,0,0,0,0,0,0,0,0,0,0,0,0,0,0,1,0,0,0,0,0,0,0,0,1,0,0,0,0,0,0,0,0,0,0,0,1,1
IG00-COUNCIL OF THE INSPECTORS GENERAL ON INTEGRITY AND EFFICIENCY,0,0,0,0,0,0,0,0,0,0,0,0,0,0,0,0,0,0,0,0,0,0,0,0,0,0,0,0,0,0,0,0,0,0,0,0,0,0,0,0,0,0,0,0,0,0,0
IN01-OFFICE OF THE SECRETARY OF THE INTERIOR,5,1,0,0,0,0,1,0,0,0,7,0,0,0,0,0,0,0,0,0,0,0,7,0,8,0,1,0,0,5,0,0,0,14,0,2,22,2,0,0,0,0,0,26,0,40,47
IN05-BUREAU OF LAND MANAGEMENT,15,6,0,0,0,0,1,0,0,0,22,0,0,0,0,0,0,0,0,0,0,0,22,6,22,2,6,0,0,2,0,0,0,38,32,745,188,0,0,0,180,0,0,1145,0,1183,1205
IN06-INDIAN AFFAIRS,4,0,0,0,0,0,0,0,0,0,4,0,0,0,0,0,0,0,0,0,0,0,4,4,2,13,0,0,0,0,0,0,0,19,0,33,5,0,0,0,10,0,0,48,0,67,71
IN07-BUREAU OF RECLAMATION,4,3,0,0,0,0,0,0,0,0,7,0,0,0,0,0,0,0,0,0,0,0,7,3,12,0,7,0,0,2,0,0,0,24,25,4,38,0,0,0,0,0,0,67,0,91,98
IN08-GEOLOGICAL SURVEY,2,0,0,0,0,0,0,1,0,0,3,0,0,0,0,0,0,0,0,0,0,0,3,0,4,0,6,0,0,0,0,0,0,10,10,77,140,0,0,0,0,0,0,227,0,237,240
IN10-NATIONAL PARK SERVICE,7,0,0,0,0,0,0,0,0,0,7,0,0,0,0,0,0,0,0,0,0,0,7,8,24,0,4,0,0,5,0,0,0,41,2392,217,157,0,0,1,38,0,0,2805,0,2846,2853
IN15-U.S. FISH AND WILDLIFE SERVICE,7,0,0,0,0,0,0,0,0,0,7,0,0,0,0,0,0,0,0,0,0,0,7,1,9,2,4,0,0,4,0,0,0,20,120,32,10,0,0,0,1,0,0,163,0,183,190
IN21-OFFICE OF THE SOLICITOR,0,0,0,0,0,0,0,0,0,0,0,0,0,0,0,0,0,0,0,0,0,0,0,0,0,0,0,0,0,0,0,0,0,0,1,1,0,0,0,0,0,0,0,2,0,2,2
"IN22-OFFICE OF SURFACE MINING, RECLAMATION AND ENFORCEMENT",2,1,0,0,0,0,0,0,0,0,3,0,0,0,0,0,0,0,0,0,0,0,3,0,2,0,1,0,0,0,0,0,0,3,0,0,2,0,0,0,0,0,0,2,0,5,8
"IN23-BUREAU OF OCEAN ENERGY MANAGEMENT, REGULATION, AND ENFORCEMENT",0,0,0,0,0,0,0,0,0,0,0,0,0,0,0,0,0,0,0,0,0,0,0,0,0,0,0,0,0,0,0,0,0,0,0,0,0,0,0,0,0,0,0,0,0,0,0
IN24-OFFICE OF THE INSPECTOR GENERAL,0,0,0,0,0,0,0,0,0,0,0,0,0,0,0,0,0,0,0,0,0,0,0,0,0,0,0,0,0,0,0,0,0,0,0,0,11,0,0,0,0,0,0,11,0,11,11
IN26-BUREAU OF SAFETY AND ENVIRONMENTAL ENFORCEMENT,1,0,0,0,0,0,0,0,0,0,1,0,0,0,0,0,0,0,0,0,0,0,1,0,9,0,0,0,0,0,0,0,0,9,1,0,5,0,0,0,0,0,0,6,0,15,16
IN27-BUREAU OF OCEAN ENERGY MANAGEMENT,0,1,0,0,0,0,0,0,0,0,1,0,0,0,0,0,0,0,0,0,0,0,1,0,1,0,0,0,0,0,0,0,0,1,0,0,2,0,0,0,0,0,0,2,0,3,4
JL03-U.S. TAX COURT,0,0,0,0,0,0,0,0,0,0,0,0,0,0,0,0,0,0,0,0,0,0,0,0,0,0,0,0,0,0,0,0,0,0,0,0,0,0,0,0,0,0,0,0,0,0,0
KS00-CORPORATION FOR NATIONAL AND COMMUNITY SERVICE,0,0,0,0,0,0,0,0,0,0,0,0,0,0,0,0,0,0,0,0,0,0,0,0,0,0,0,0,0,3,0,0,0,3,0,0,0,0,0,0,6,0,0,6,0,9,9
LF00-FEDERAL ELECTION COMMISSION,0,0,0,0,0,0,0,0,0,0,0,0,0,0,0,0,0,0,0,0,0,0,0,0,0,0,0,0,0,1,0,0,0,1,0,0,0,0,0,0,1,0,0,1,0,2,2
LP00-GOVERNMENT PRINTING OFFICE,0,0,0,0,0,0,0,0,0,0,0,0,0,0,0,0,0,0,0,0,0,0,0,1,2,0,0,0,0,0,0,0,0,3,0,0,5,0,0,0,0,0,0,5,0,8,8
LT00-U.S. TAX COURT,0,0,0,0,0,0,0,0,0,0,0,0,0,0,0,0,0,0,0,0,0,0,0,0,0,0,0,0,0,0,0,0,0,0,0,0,0,0,0,0,11,0,0,11,0,11,11
MA00-MARINE MAMMAL COMMISSION,0,0,0,0,0,0,0,0,0,0,0,0,0,0,0,0,0,0,0,0,0,0,0,0,0,0,0,0,0,0,0,0,0,0,0,0,0,0,0,0,0,0,0,0,0,0,0
MC00-FEDERAL MARITIME COMMISSION,0,0,0,0,0,0,0,0,0,0,0,0,0,0,0,0,0,0,0,0,0,0,0,0,1,0,0,0,0,0,0,0,0,1,0,0,3,0,0,0,0,0,0,3,0,4,4
MI00-MILLENNIUM CHALLENGE CORPORATION,0,0,0,0,0,0,0,0,0,0,0,0,0,0,0,0,0,0,0,0,0,0,0,0,0,0,0,0,0,0,0,0,0,0,0,0,0,0,0,0,0,0,0,0,0,0,0
NF00-NATIONAL SCIENCE FOUNDATION,1,0,0,0,0,0,0,0,0,0,1,0,0,0,0,0,0,0,0,0,0,0,1,0,1,0,0,0,0,1,0,0,0,2,0,0,19,0,0,0,11,0,0,30,0,32,33
NK00-NATIONAL COUNCIL ON DISABILITY,0,0,0,0,0,0,0,0,0,0,0,0,0,0,0,0,0,0,0,0,0,0,0,0,0,0,0,0,0,0,0,0,0,0,0,0,0,0,0,0,0,0,0,0,0,0,0
NL00-NATIONAL LABOR RELATIONS BOARD,0,0,0,0,0,0,0,0,0,0,0,0,0,0,0,0,0,0,0,0,0,0,0,0,0,1,7,0,0,0,0,0,0,8,1,1,16,0,0,0,0,0,0,18,0,26,26
NM00-NATIONAL MEDIATION BOARD,0,0,0,0,0,0,0,0,0,0,0,0,0,0,0,0,0,0,0,0,0,0,0,0,0,0,0,0,0,0,0,0,0,0,0,0,0,0,0,0,0,0,0,0,0,0,0
"NN10-HEADQUARTERS, NASA",0,1,0,0,0,0,0,1,0,0,2,0,0,0,0,0,0,0,0,0,0,0,2,0,0,1,1,0,0,0,0,0,0,2,0,0,5,0,0,0,4,0,0,9,0,11,13
NN21-AMES RESEARCH CENTER,0,0,0,0,0,0,0,0,0,0,0,0,0,0,0,0,0,0,0,0,0,0,0,0,0,1,1,0,0,0,0,0,0,2,0,0,0,0,0,0,0,0,0,0,0,2,2
NN22-JOHN GLENN RESEARCH CENTER AT LEWIS FIELD,1,0,0,0,0,0,0,0,0,0,1,0,0,0,0,0,0,0,0,0,0,0,1,0,3,0,1,0,0,0,0,0,0,4,0,0,0,0,0,0,0,0,0,0,0,4,5
NN23-LANGLEY RESEARCH CENTER,2,0,0,0,0,0,0,0,0,0,2,0,0,0,0,0,0,0,0,0,0,0,2,0,0,0,2,0,0,0,0,0,0,2,1,0,0,0,0,0,0,0,0,1,0,3,5
NN24-DRYDEN FLIGHT RESEARCH CENTER,0,1,0,0,0,0,0,0,0,0,1,0,0,0,0,0,0,0,0,0,0,0,1,0,1,0,0,0,0,0,0,0,0,1,0,0,0,0,0,0,0,0,0,0,0,1,2
NN51-GODDARD SPACE FLIGHT CENTER,4,0,0,0,0,0,0,0,0,0,4,0,0,0,0,0,0,0,0,0,0,0,4,1,4,1,4,0,0,0,0,0,0,10,1,0,3,0,0,0,1,0,0,5,0,15,19
NN62-GEORGE C. MARSHALL SPACE FLIGHT CENTER,4,0,0,0,0,0,0,0,0,0,4,0,0,0,0,0,0,0,0,0,0,0,4,0,5,0,6,0,0,0,0,0,0,11,0,0,0,0,0,0,0,0,0,0,0,11,15
NN64-JOHN C. STENNIS SPACE CENTER,0,0,0,0,0,0,0,0,0,0,0,0,0,0,0,0,0,0,0,0,0,0,0,0,0,0,0,0,0,0,0,0,0,0,0,0,0,0,0,0,0,0,0,0,0,0,0
NN72-LYNDON B. JOHNSON SPACE CENTER,0,0,0,0,0,0,0,0,0,0,0,0,0,0,0,0,0,0,0,0,0,0,0,1,0,1,2,0,0,0,0,0,0,4,0,0,7,0,0,0,0,0,0,7,0,11,11
NN76-JOHN F. KENNEDY SPACE CENTER,0,0,0,0,0,0,0,0,0,0,0,0,0,0,0,0,0,0,0,0,0,0,0,0,0,0,3,0,0,0,0,0,0,3,0,0,2,0,0,0,0,0,0,2,0,5,5
NP00-NATIONAL CAPITAL PLANNING COMMISSION,0,0,0,0,0,0,0,0,0,0,0,0,0,0,0,0,0,0,0,0,0,0,0,0,0,0,0,0,0,0,0,0,0,0,0,0,0,0,0,0,0,0,0,0,0,0,0
NQ00-NATIONAL ARCHIVES AND RECORDS ADMINISTRATION,4,0,0,0,0,0,0,0,0,0,4,0,0,0,0,0,0,0,0,0,0,0,4,0,2,0,0,0,0,0,0,0,0,2,1,0,37,0,0,0,0,0,0,38,0,40,44
NS00-NATIONAL SECURITY COUNCIL,0,0,0,0,0,0,0,0,0,0,0,0,0,0,0,0,0,0,0,0,0,0,0,0,0,0,0,0,0,0,0,0,0,0,0,2,0,0,0,0,0,0,0,2,0,2,2
NU00-NUCLEAR REGULATORY COMMISSION,0,0,0,0,0,0,0,0,0,0,0,0,0,0,0,0,0,0,0,0,0,0,0,0,0,0,0,0,0,4,0,0,0,4,0,0,0,0,0,0,19,0,0,19,0,23,23
NV11-IMMEDIATE OFFICE OF THE CHIEF OF NAVAL OPERATIONS,1,0,0,0,0,0,0,0,0,0,1,0,0,0,0,0,0,0,0,0,0,0,1,0,9,1,1,0,0,0,0,0,0,11,2,11,32,0,0,0,0,0,0,45,0,56,57
"NV12-ASSISTANT FOR ADMINISTRATION, UNDER SECRETARY OF THE NAVY",5,0,0,0,0,0,0,1,0,0,6,0,0,0,0,0,0,0,0,0,0,0,6,2,3,0,0,0,0,0,0,0,0,5,0,9,8,0,0,0,6,0,0,23,0,28,34
NV14-OFFICE OF NAVAL RESEARCH,1,0,0,0,0,0,0,0,0,0,1,0,0,0,0,0,0,0,0,0,0,0,1,0,8,0,1,0,0,0,0,0,0,9,0,1,36,0,0,0,1,0,0,38,0,47,48
NV15-NAVAL INTELLIGENCE COMMAND,0,0,0,0,0,0,0,0,0,0,0,0,0,0,0,0,0,0,0,0,0,0,0,0,0,0,0,0,0,14,0,0,0,14,0,0,0,0,0,0,1,0,0,1,0,15,15
NV18-NAVAL MEDICAL COMMAND,2,0,0,0,0,0,0,0,0,0,2,0,0,0,0,0,0,0,0,0,0,0,2,1,21,0,0,0,0,6,0,0,0,28,12,2,23,0,0,0,0,0,0,37,0,65,67
NV19-NAVAL AIR SYSTEMS COMMAND,5,0,0,0,0,0,0,0,0,0,5,0,0,0,0,0,0,0,0,0,0,0,5,5,40,1,27,0,0,12,0,0,0,85,20,5,88,0,0,0,0,0,0,113,0,198,203
NV22-BUREAU OF NAVAL PERSONNEL,2,1,0,0,0,0,0,0,0,0,3,0,0,0,0,0,0,0,0,0,0,0,3,0,6,0,0,0,0,2,0,0,0,8,0,0,0,0,0,0,0,0,0,0,0,8,11
NV23-NAVAL SUPPLY SYSTEMS COMMAND,2,2,0,0,0,0,0,0,0,0,4,0,0,0,0,0,0,0,0,0,0,0,4,2,17,1,1,0,0,2,0,0,0,23,3,6,10,0,0,0,0,0,0,19,0,42,46
NV24-NAVAL SEA SYSTEMS COMMAND,6,3,0,0,0,0,0,0,0,0,9,0,0,0,0,0,0,0,0,0,0,0,9,5,36,6,49,0,0,8,1,0,0,105,4,4,35,0,0,0,0,0,0,43,0,148,157
NV25-NAVAL FACILITIES ENGINEERING COMMAND,6,1,0,0,0,0,0,0,0,0,7,0,0,0,0,0,0,0,0,0,0,0,7,3,36,0,16,0,0,4,0,0,0,59,0,1,27,0,0,0,0,0,0,28,0,87,94
NV27-U.S. MARINE CORPS,17,5,0,0,0,0,0,1,0,0,23,0,0,0,0,0,0,0,0,0,0,0,23,12,55,2,13,0,0,20,0,0,0,102,5,5,16,0,0,0,7,0,0,33,0,135,158
NV30-STRATEGIC SYSTEMS PROGRAMS OFFICE,0,0,0,0,0,0,0,0,0,0,0,0,0,0,0,0,0,0,0,0,0,0,0,0,9,1,0,0,0,0,0,0,0,10,1,0,8,0,0,0,0,0,0,9,0,19,19
NV33-MILITARY SEALIFT COMMAND,1,0,0,0,0,0,0,0,0,0,1,0,0,0,0,0,0,0,0,0,0,0,1,0,7,30,0,0,0,0,0,0,0,37,1,48,16,0,0,0,0,0,0,65,0,102,103
NV39-SPACE AND NAVAL WARFARE SYSTEMS COMMAND,3,0,0,0,0,0,0,0,0,0,3,0,0,0,0,0,0,0,0,0,0,0,3,0,35,0,2,0,0,1,0,0,0,38,1,0,1,0,0,0,0,0,0,2,0,40,43
NV41-NAVY SYSTEMS MANAGEMENT ACTIVITY,1,0,0,0,0,0,0,0,0,0,1,0,0,0,0,0,0,0,0,0,0,0,1,0,0,0,0,0,0,0,0,0,0,0,0,0,0,0,0,0,0,0,0,0,0,0,1
"NV52-COMMANDER, NAVY INSTALLATIONS",12,3,0,0,0,0,0,0,0,0,15,0,0,0,0,0,0,0,0,0,0,0,15,5,77,1,1,0,0,13,0,0,0,97,9,20,5,0,0,0,0,0,0,34,0,131,146
"NV60-U.S. ATLANTIC FLEET, COMMANDER IN CHIEF",3,4,0,0,0,0,0,0,0,0,7,0,0,0,0,0,0,0,0,0,0,0,7,0,71,0,8,0,0,26,0,0,0,105,1,3,34,0,0,0,0,0,0,38,0,143,150
NV69-NAVAL SECURITY GROUP COMMAND,0,0,0,0,0,0,0,0,0,0,0,0,0,0,0,0,0,0,0,0,0,0,0,0,0,0,0,0,0,0,0,0,0,0,0,0,0,0,0,0,0,0,0,0,0,0,0
"NV70-U.S. PACIFIC FLEET, COMMANDER IN CHIEF",2,1,0,0,0,0,0,0,0,0,3,0,0,0,0,0,0,0,0,0,0,0,3,1,49,0,69,0,0,11,0,0,0,130,3,0,21,0,0,0,0,0,0,24,0,154,157
NV72-NAVAL RESERVE FORCE,0,0,0,0,0,0,0,0,0,0,0,0,0,0,0,0,0,0,0,0,0,0,0,0,1,0,0,0,0,1,0,0,0,2,0,2,0,0,0,0,0,0,0,2,0,4,4
NV74-NAVAL SPECIAL WARFARE COMMAND,0,0,0,0,0,0,0,0,0,0,0,0,0,0,0,0,0,0,0,0,0,0,0,0,2,0,0,0,0,1,0,0,0,3,4,0,0,0,0,0,0,0,0,4,0,7,7
NV76-NAVAL EDUCATION AND TRAINING COMMAND,0,0,0,0,0,0,0,0,0,0,0,0,0,0,0,0,0,0,0,0,0,0,0,2,45,0,1,0,0,2,0,0,0,50,5,0,3,0,0,0,0,0,0,8,0,58,58
OM00-OFFICE OF PERSONNEL MANAGEMENT,5,2,0,0,0,0,1,0,0,0,8,0,0,0,0,0,0,0,0,0,0,0,8,3,6,3,8,0,0,1,0,0,0,21,9,1,2,0,0,0,0,0,0,12,0,33,41
OS00-OCCUPATIONAL SAFETY AND HEALTH REVIEW COMMISSION,2,0,0,0,0,0,0,0,0,0,2,0,0,0,0,0,0,0,0,0,0,0,2,0,0,0,0,0,0,0,0,0,0,0,0,0,0,0,0,0,0,0,0,0,0,0,2
PU00-PEACE CORPS,0,0,0,0,0,0,0,0,0,0,0,0,0,0,0,0,0,0,0,0,0,0,0,0,0,0,0,0,0,0,0,0,0,0,0,0,0,0,0,0,25,0,0,25,0,25,25
QQ00-OFFICE OF NATIONAL DRUG CONTROL POLICY,0,0,0,0,0,0,0,0,0,0,0,0,0,0,0,0,0,0,0,0,0,0,0,0,0,0,0,0,0,0,0,0,0,0,0,0,0,0,0,0,0,0,0,0,0,0,0
RE00-OFFICE OF NAVAJO AND HOPI INDIAN RELOCATION,0,0,0,0,0,0,0,0,0,0,0,0,0,0,0,0,0,0,0,0,0,0,0,0,0,0,0,0,0,0,0,0,0,0,0,0,0,0,0,0,0,0,0,0,0,0,0
RF00-FEDERAL RETIREMENT THRIFT INVESTMENT BOARD,1,0,0,0,0,0,0,0,0,0,1,0,0,0,0,0,0,0,0,0,0,0,1,0,0,0,0,0,0,0,0,0,0,0,0,0,4,0,0,0,0,0,0,4,0,4,5
RH00-ARMED FORCES RETIREMENT HOME,0,0,0,0,0,0,0,0,0,0,0,0,0,0,0,0,0,0,0,0,0,0,0,0,2,0,0,0,0,0,0,0,0,2,0,0,0,0,0,0,0,0,0,0,0,2,2
RO**-UNSPECIFIED,0,0,0,0,0,0,0,0,0,0,0,0,0,0,0,0,0,0,0,0,0,0,0,0,0,0,0,0,0,0,0,0,0,0,0,0,0,0,0,0,0,0,0,0,0,0,0
RO00-MEDICAID AND CHIP PAYMENT AND ACCESS COMMISSION,0,0,0,0,0,0,0,0,0,0,0,0,0,0,0,0,0,0,0,0,0,0,0,0,0,0,0,0,0,1,0,0,0,1,0,0,0,0,0,0,0,0,0,0,0,1,1
RR00-RAILROAD RETIREMENT BOARD,0,0,0,0,0,0,0,0,0,0,0,0,0,0,0,0,0,0,0,0,0,0,0,0,2,0,0,0,0,0,0,0,0,2,0,0,0,0,0,0,0,0,0,0,0,2,2
RS00-FEDERAL MINE SAFETY AND HEALTH REVIEW COMMISSION,1,0,0,0,0,0,0,0,0,0,1,0,0,0,0,0,0,0,0,0,0,0,1,0,0,0,0,0,0,0,0,0,0,0,0,0,0,0,0,0,0,0,0,0,0,0,1
RZ00-RECOVERY ACT ACCOUNTABILITY & TRANSPARENCY BOARD,0,0,0,0,0,0,0,0,0,0,0,0,0,0,0,0,0,0,0,0,0,0,0,0,0,0,0,0,0,2,0,0,0,2,0,0,1,0,0,0,0,0,0,1,0,3,3
SB00-SMALL BUSINESS ADMINISTRATION,2,1,0,0,0,0,0,0,0,0,3,0,0,0,0,0,0,0,0,0,0,0,3,0,5,0,0,0,0,0,0,0,0,5,91,0,29,0,0,0,1,0,0,121,0,126,129
SE00-SECURITIES AND EXCHANGE COMMISSION,5,1,0,0,0,0,0,0,0,0,6,0,0,0,0,0,0,0,0,0,0,0,6,0,6,6,0,0,0,0,0,0,0,12,0,3,0,0,0,0,0,0,0,3,0,15,21
SK00-CONSUMER PRODUCT SAFETY COMMISSION,1,0,0,0,0,0,0,0,0,0,1,0,0,0,0,0,0,0,0,0,0,0,1,0,1,0,0,0,0,0,0,0,0,1,0,0,28,0,0,0,0,0,0,28,0,29,30
SM01-NATIONAL GALLERY OF ART,0,0,0,0,0,0,0,0,0,0,0,0,0,0,0,0,0,0,0,0,0,0,0,1,6,0,0,0,0,0,0,0,0,7,0,0,0,0,0,0,0,0,0,0,0,7,7
SM02-WOODROW WILSON INTERNATIONAL CENTER FOR SCHOLARS,0,0,0,0,0,0,0,0,0,0,0,0,0,0,0,0,0,0,0,0,0,0,0,0,0,0,0,0,0,0,0,0,0,0,0,0,0,0,0,0,0,0,0,0,0,0,0
SM03-SMITHSONIAN INSTITUTION (EXCEPT UNITS ADMINISTERED UNDER SEPARATE BOARDS OF TRUSTEES),4,0,0,0,0,0,0,0,0,0,4,0,0,0,0,0,0,0,0,0,0,0,4,0,3,0,0,0,0,0,0,0,0,3,1,13,2,0,0,0,0,0,0,16,0,19,23
SM04-JOHN F. KENNEDY CENTER FOR THE PERFORMING ARTS,0,0,0,0,0,0,0,0,0,0,0,0,0,0,0,0,0,0,0,0,0,0,0,0,1,0,0,0,0,0,0,0,0,1,0,0,0,0,0,0,0,0,0,0,0,1,1
SS00-SELECTIVE SERVICE SYSTEM,0,0,0,0,0,0,0,0,0,0,0,0,0,0,0,0,0,0,0,0,0,0,0,0,0,0,0,0,0,0,0,0,0,0,0,0,0,0,0,0,0,0,0,0,0,0,0
ST00-DEPARTMENT OF STATE,6,2,0,0,0,0,0,0,0,0,8,0,0,0,0,0,0,0,0,0,0,0,8,0,24,3,24,0,0,11,0,1,0,63,28,6,130,2,0,0,6,0,0,172,2,237,245
SZ00-SOCIAL SECURITY ADMINISTRATION,0,0,0,0,0,0,0,0,0,0,0,0,0,0,0,0,0,0,0,0,0,0,0,20,27,12,0,0,0,4,0,0,0,63,101,38,1,0,0,0,12,0,0,152,0,215,215
TB00-NATIONAL TRANSPORTATION SAFETY BOARD,1,0,0,0,0,0,0,0,0,0,1,0,0,0,0,0,0,0,0,0,0,0,1,2,2,0,0,0,0,0,0,0,0,4,0,0,8,0,0,0,0,0,0,8,0,12,13
TC00-U.S. INTERNATIONAL TRADE COMMISSION,1,1,0,0,0,0,0,0,0,0,2,0,0,0,0,0,0,0,0,0,0,0,2,0,0,0,0,0,0,0,0,0,0,0,0,0,9,0,0,0,0,0,0,9,0,9,11
TD01-OFFICE OF THE SECRETARY OF TRANSPORTATION,4,0,0,0,0,0,0,0,0,0,4,0,0,0,0,0,0,0,0,0,0,0,4,0,3,1,0,0,0,1,0,0,0,5,0,1,8,1,0,0,0,0,0,10,0,15,19
TD03-FEDERAL AVIATION ADMINISTRATION,0,0,0,0,0,0,0,0,0,0,0,0,0,0,0,0,0,0,0,0,0,0,0,0,0,0,0,0,0,50,0,0,0,50,0,0,0,0,0,0,92,0,0,92,0,142,142
TD04-FEDERAL HIGHWAY ADMINISTRATION,0,2,0,0,0,0,0,0,0,0,2,0,0,0,0,0,0,0,0,0,0,0,2,0,3,1,19,0,0,0,0,0,0,23,1,0,5,0,0,0,0,0,0,6,0,29,31
TD05-FEDERAL RAILROAD ADMINISTRATION,0,1,0,0,0,0,0,0,0,0,1,0,0,0,0,0,0,0,0,0,0,0,1,1,6,0,0,0,0,1,0,0,0,8,0,0,0,0,0,0,0,0,0,0,0,8,9
TD06-SAINT LAWRENCE SEAWAY DEVELOPMENT CORPORATION,0,0,0,0,0,0,0,0,0,0,0,0,0,0,0,0,0,0,0,0,0,0,0,0,0,0,0,0,0,0,0,0,0,0,0,1,2,0,0,0,0,0,0,3,0,3,3
TD09-FEDERAL TRANSIT ADMINISTRATION,0,0,0,0,0,0,0,0,0,0,0,0,0,0,0,0,0,0,0,0,0,0,0,0,1,0,0,0,0,0,0,0,0,1,1,0,2,0,0,0,0,0,0,3,0,4,4
TD10-NATIONAL HIGHWAY TRAFFIC SAFETY ADMINISTRATION,0,0,0,0,0,0,0,0,0,0,0,0,0,0,0,0,0,0,0,0,0,0,0,0,1,0,0,0,0,0,0,0,0,1,0,0,2,0,0,0,0,0,0,2,0,3,3
TD11-RESEARCH AND INNOVATIVE TECHNONOGY ADMINSTRATION,0,0,0,0,0,0,0,0,0,0,0,0,0,0,0,0,0,0,0,0,0,0,0,0,0,0,5,0,0,0,0,0,0,5,1,0,0,0,0,0,0,0,0,1,0,6,6
TD12-OFFICE OF INSPECTOR GENERAL,0,0,0,0,0,0,0,0,0,0,0,0,0,0,0,0,0,0,0,0,0,0,0,0,0,0,0,0,0,0,0,0,0,0,0,0,1,0,0,0,0,0,0,1,0,1,1
TD13-MARITIME ADMINISTRATION,1,0,0,0,0,0,0,0,0,0,1,0,0,0,0,0,0,0,0,0,0,0,1,0,0,0,0,0,0,0,0,0,0,0,0,1,0,0,0,0,0,0,0,1,0,1,2
TD15-SURFACE TRANSPORTATION BOARD,0,0,0,0,0,0,0,0,0,0,0,0,0,0,0,0,0,0,0,0,0,0,0,0,0,0,0,0,0,0,0,0,0,0,0,0,1,0,0,0,0,0,0,1,0,1,1
TD16-PIPELINE AND HAZARDOUS MATERIALS SAFETY ADMINISTRATION,0,0,0,0,0,0,0,0,0,0,0,0,0,0,0,0,0,0,0,0,0,0,0,1,0,0,0,0,0,0,0,0,0,1,0,0,0,0,0,0,0,0,0,0,0,1,1
TD17-FEDERAL MOTOR CARRIER SAFETY ADMINISTRATION,2,3,0,0,0,0,0,0,0,0,5,0,0,0,0,0,0,0,0,0,0,0,5,0,8,0,0,0,0,0,0,0,0,8,0,0,0,0,0,0,1,0,0,1,0,9,14
TN00-OFFICE OF THE U.S. TRADE REPRESENTATIVE,1,0,0,0,0,0,0,0,0,0,1,0,0,0,0,0,0,0,0,0,0,0,1,0,1,1,0,0,0,0,1,0,0,3,0,0,0,0,0,0,1,0,0,1,0,4,5
TR**-UNSPECIFIED,0,0,0,0,0,0,0,0,0,0,0,0,0,0,0,0,0,0,0,0,0,0,0,0,0,0,0,0,0,0,0,0,0,0,0,0,0,0,0,0,0,0,0,0,0,0,0
TR35-OFFICE OF THRIFT SUPERVISION,0,0,0,0,0,0,0,0,0,0,0,0,0,0,0,0,0,0,0,0,0,0,0,0,0,0,0,0,0,0,0,0,0,0,0,0,0,0,0,0,0,0,0,0,0,0,0
TR36-SPECIAL INSPECTOR GENERAL FOR THE TROUBLED ASSETS RELIEF PROGRAM (TARP),0,0,0,0,0,0,0,0,0,0,0,0,0,0,0,0,0,0,0,0,0,0,0,0,2,0,0,0,0,0,0,0,0,2,3,0,0,0,0,0,0,0,0,3,0,5,5
TR40-ALCOHOL AND TOBACCO TAX AND TRADE BUREAU,0,0,0,0,0,0,0,0,0,0,0,0,0,0,0,0,0,0,0,0,0,0,0,0,1,0,0,0,0,0,0,0,0,1,0,0,0,0,0,0,0,0,0,0,0,1,1
TR91-DEPARTMENTAL OFFICES,0,2,0,0,0,0,0,0,0,0,2,0,0,0,0,0,0,0,0,0,0,0,2,0,13,6,0,0,0,0,0,0,0,19,3,2,24,0,0,0,1,0,0,30,0,49,51
TR93-INTERNAL REVENUE SERVICE,1,0,0,0,0,0,0,0,0,0,1,0,0,0,0,0,0,0,0,0,0,0,1,1,24,4,0,0,0,2,0,0,0,31,14,1,14,0,0,0,0,0,0,29,0,60,61
TR95-OFFICE OF INSPECTOR GENERAL,2,0,0,0,0,0,0,0,0,0,2,0,0,0,0,0,0,0,0,0,0,0,2,0,1,0,0,0,0,0,0,0,0,1,1,0,1,0,0,0,0,0,0,2,0,3,5
TRAA-FINANCIAL MANAGEMENT SERVICE,2,0,0,0,0,0,0,0,0,0,2,0,0,0,0,0,0,0,0,0,0,0,2,0,1,0,1,0,0,0,0,0,0,2,3,0,1,0,0,0,0,0,0,4,0,6,8
TRAB-BUREAU OF THE PUBLIC DEBT,0,0,0,0,0,0,0,0,0,0,0,0,0,0,0,0,0,0,0,0,0,0,0,0,3,0,0,0,0,0,0,0,0,3,0,0,21,0,0,0,0,0,0,21,0,24,24
TRAD-U.S. MINT,1,2,0,0,0,0,0,0,0,0,3,0,0,0,0,0,0,0,0,0,0,0,3,0,4,0,0,0,0,0,0,0,0,4,0,0,0,0,0,0,0,0,0,0,0,4,7
TRAF-FINANCIAL CRIMES ENFORCEMENT NETWORK,0,0,0,0,0,0,0,0,0,0,0,0,0,0,0,0,0,0,0,0,0,0,0,0,0,0,0,0,0,0,0,0,0,0,1,0,0,0,0,0,0,0,0,1,0,1,1
TRAI-BUREAU OF ENGRAVING AND PRINTING,0,1,0,0,0,0,0,0,0,0,1,0,0,0,0,0,0,0,0,0,0,0,1,1,2,0,0,0,0,0,0,0,0,3,6,0,2,0,0,0,0,0,0,8,0,11,12
TRAJ-OFFICE OF THE COMPTROLLER OF THE CURRENCY,4,0,0,0,0,0,0,0,0,0,4,0,0,0,0,0,0,0,0,0,0,0,4,2,5,0,7,0,0,0,0,0,0,14,0,1,41,0,0,0,0,0,0,42,0,56,60
TRFD-BUREAU OF THE FISCAL SERVICE,0,0,0,0,0,0,0,0,0,0,0,0,0,0,0,0,0,0,0,0,0,0,0,0,0,0,0,0,0,0,0,0,0,0,0,0,0,0,0,0,0,0,0,0,0,0,0
TRTG-OFFICE OF THE INSPECTOR GENERAL FOR TAX ADMINISTRATION,0,1,0,0,0,0,0,0,0,0,1,0,0,0,0,0,0,0,0,0,0,0,1,0,0,0,0,0,0,0,0,0,0,0,0,0,0,0,0,0,0,0,0,0,0,0,1
TS00-OFFICE OF SCIENCE AND TECHNOLOGY POLICY,0,0,0,0,0,0,0,0,0,0,0,0,0,0,0,0,0,0,0,0,0,0,0,0,0,0,0,0,0,0,0,0,0,0,0,0,0,0,0,0,0,0,0,0,0,0,0
UJ00-JAPAN-UNITED STATES FRIENDSHIP COMMISSION,0,0,0,0,0,0,0,0,0,0,0,0,0,0,0,0,0,0,0,0,0,0,0,0,0,0,0,0,0,0,0,0,0,0,0,0,0,0,0,0,0,0,0,0,0,0,0
UT00-UTAH RECLAMATION MITIGATION AND CONSERVATION COMMISSION,0,0,0,0,0,0,0,0,0,0,0,0,0,0,0,0,0,0,0,0,0,0,0,0,0,0,0,0,0,0,0,0,0,0,0,0,0,0,0,0,0,0,0,0,0,0,0
VA**-UNSPECIFIED,0,0,0,0,0,0,0,0,0,0,0,0,0,0,0,0,0,0,0,0,0,0,0,0,0,0,0,0,0,0,0,0,0,0,0,0,0,0,0,0,0,0,0,0,0,0,0
VAAA-OFFICE OF THE SECRETARY,1,0,0,0,0,0,0,0,0,0,1,0,0,0,0,0,0,0,0,0,0,0,1,0,1,0,0,0,0,0,0,0,0,1,1,0,0,1,0,0,0,0,0,2,0,3,4
VAAD-BOARD OF VETERANS APPEALS,0,0,0,0,0,0,0,0,0,0,0,0,0,0,0,0,0,0,0,0,0,0,0,0,1,8,0,0,0,0,0,0,0,9,0,0,2,0,0,0,0,0,0,2,0,11,11
VAAE-GENERAL COUNSEL,0,1,0,0,0,0,0,0,0,0,1,0,0,0,0,0,0,0,0,0,0,0,1,0,1,1,0,0,0,0,0,0,0,2,0,1,0,0,0,0,0,0,0,1,0,3,4
VAAF-INSPECTOR GENERAL,0,0,0,0,0,0,0,0,0,0,0,0,0,0,0,0,0,0,0,0,0,0,0,1,0,0,0,0,0,0,0,0,0,1,0,0,0,0,0,0,0,0,0,0,0,1,1
VABA-IMMEDIATE OFFICE OF THE ASSISTANT SECRETARY FOR HUMAN RESOURCES AND ADMINISTRATION,0,0,0,0,0,0,0,0,0,0,0,0,0,0,0,0,0,0,0,0,0,0,0,0,0,0,0,0,0,0,0,0,0,0,0,0,0,0,0,0,0,0,0,0,0,0,0
VABC-ASSISTANT SECRETARY FOR HUMAN RESOURCES MANAGEMENT,1,0,0,0,0,0,0,0,0,0,1,0,0,0,0,0,0,0,0,0,0,0,1,0,0,0,0,0,0,0,0,0,0,0,1,0,0,0,0,0,0,0,0,1,0,1,2
VABD-ASSISTANT SECRETARY FOR DIVERSITY & INCLUSION,0,0,0,0,0,0,0,0,0,0,0,0,0,0,0,0,0,0,0,0,0,0,0,0,0,0,0,0,0,0,0,0,0,0,0,0,0,0,0,0,0,0,0,0,0,0,0
VABE-DEPUTY ASSISTANT SECRETARY FOR ADMINISTRATION,0,0,0,0,0,0,0,0,0,0,0,0,0,0,0,0,0,0,0,0,0,0,0,0,0,0,0,0,0,0,0,0,0,0,0,0,0,0,0,0,0,0,0,0,0,0,0
VABF-DEPUTY ASSISTANT SECRETARY FOR OFFICE OF RESOLUTION MANAGEMENT,0,0,0,0,0,0,0,0,0,0,0,0,0,0,0,0,0,0,0,0,0,0,0,0,0,0,0,0,0,2,0,0,0,2,0,0,0,0,0,0,0,0,0,0,0,2,2
VABG-DEPUTY ASSISTANT SECRETARY FOR CORPORATE SENIOR EXECUTIVE MANAGEMENT,0,0,0,0,0,0,0,0,0,0,0,0,0,0,0,0,0,0,0,0,0,0,0,0,1,0,0,0,0,0,0,0,0,1,0,0,0,0,0,0,0,0,0,0,0,1,1
VABH-DEPUTY ASSISTANT SECRETARY FOR LABOR MANAGEMENT RELATIONS,0,0,0,0,0,0,0,0,0,0,0,0,0,0,0,0,0,0,0,0,0,0,0,0,0,0,0,0,0,0,0,0,0,0,0,0,0,0,0,0,0,0,0,0,0,0,0
VABI-DEAN FOR VA LEARNING UNIVERSITY,0,0,0,0,0,0,0,0,0,0,0,0,0,0,0,0,0,0,0,0,0,0,0,0,0,0,0,0,0,0,0,0,0,0,0,0,0,0,0,0,0,0,0,0,0,0,0
VABJ-VETERAN EMPLOYMENT SERVICES OFFICE,0,0,0,0,0,0,0,0,0,0,0,0,0,0,0,0,0,0,0,0,0,0,0,0,0,0,0,0,0,1,0,0,0,1,0,0,0,0,0,0,0,0,0,0,0,1,1
VADA-IMMEDIATE OFFICE OF THE ASSISTANT SECRETARY FOR MANAGEMENT,2,0,0,0,0,0,0,0,0,0,2,0,0,0,0,0,0,0,0,0,0,0,2,1,0,1,0,0,0,0,0,0,0,2,0,0,0,0,0,0,0,0,0,0,0,2,4
VADC-DEPUTY ASSISTANT SECRETARY FOR BUDGET,0,0,0,0,0,0,0,0,0,0,0,0,0,0,0,0,0,0,0,0,0,0,0,0,0,0,0,0,0,0,0,0,0,0,0,0,0,0,0,0,0,0,0,0,0,0,0
VADD-DEPUTY ASSISTANT SECRETARY FOR FINANCE,4,0,0,0,0,0,0,0,0,0,4,0,0,0,0,0,0,0,0,0,0,0,4,0,1,0,0,0,0,1,0,0,0,2,0,0,0,0,0,0,0,0,0,0,0,2,6
VADG-DEPUTY ASSISTANT SECRETARY FOR ACQUISITION AND MATERIEL MANAGEMENT,2,0,0,0,0,0,0,0,0,0,2,0,0,0,0,0,0,0,0,0,0,0,2,0,2,0,0,0,0,0,0,0,0,2,0,0,1,0,0,0,0,0,0,1,0,3,5
VAEA-IMMEDIATE OFFICE OF THE ASSISTANT SECRETARY FOR INFORMATION AND TECHNOLOGY,0,0,0,0,0,0,0,0,0,0,0,0,0,0,0,0,0,0,0,0,0,0,0,0,0,0,0,0,0,0,0,0,0,0,0,0,0,0,0,0,0,0,0,0,0,0,0
VAEB-DEPUTY ASSISTANT SECRETARY FOR INFORMATION AND TECHNOLOGY,8,5,0,0,0,0,0,0,0,0,13,0,0,0,0,0,0,0,0,0,0,0,13,1,12,1,0,0,0,4,0,0,0,18,3,0,2,0,0,0,0,0,0,5,0,23,36
