Agency,10-Competitive Service - Career  Transfer,15-Competitive Service - Career-Conditional  Transfer,30-Excepted Service - Schedule A  Transfer,32-Excepted Service - Schedule B  Transfer,36-Excepted Service - Executive  Transfer,38-Excepted Service - Other  Transfer,50-Senior Executive Service - Career  Transfer,55-Senior Executive Service - Non-Career  Transfer,**-Unspecified  Transfer,Permanent  Transfer,20-Competitive Service  Transfer,40-Excepted Service - Schedule A  Transfer,42-Excepted Service - Schedule B  Transfer,44-Excepted Service - Schedule C  Transfer,46-Excepted Service - Executive  Transfer,48-Excepted Service - Other  Transfer,60-Senior Executive Service - Limited Term  Transfer,65-Senior Executive Service - Limited Emergency  Transfer,Non-permanent  Transfer,Unspecified  Transfer,Type of Appointment - All  Transfer,10-Competitive Service - Career,15-Competitive Service - Career-Conditional,30-Excepted Service - Schedule A,32-Excepted Service - Schedule B,36-Excepted Service - Executive,38-Excepted Service - Other,50-Senior Executive Service - Career,55-Senior Executive Service - Non-Career,**-Unspecified,Permanent,20-Competitive Service,40-Excepted Service - Schedule A,42-Excepted Service - Schedule B,44-Excepted Service - Schedule C,46-Excepted Service - Executive,48-Excepted Service - Other,60-Senior Executive Service - Limited Term,65-Senior Executive Service - Limited Emergency,Non-permanent,Unspecified,Type of Appointment - All,Type of Appointment - All
AB**-UNSPECIFIED,0,0,0,0,0,0,0,0,0,0,0,0,0,0,0,0,0,0,0,0,0,0,0,0,0,0,0,0,0,0,0,0,0,0,0,0,0,0,0,0,0,0,0
AB00-AMERICAN BATTLE MONUMENTS COMMISSION,0,0,0,0,0,0,0,0,0,0,0,0,0,0,0,0,0,0,0,0,0,0,0,0,0,0,0,0,0,0,0,0,0,0,0,0,0,0,0,0,0,0,0
AF**-UNSPECIFIED,1,0,0,0,0,0,0,0,0,1,0,0,0,0,0,0,0,0,0,0,1,0,1,0,0,0,0,0,0,0,1,0,0,0,0,0,0,0,0,0,0,1,2
AF02-AIR FORCE INSPECTION AND SAFETY CENTER,0,0,0,0,0,0,0,0,0,0,0,0,0,0,0,0,0,0,0,0,0,0,0,0,0,0,0,0,0,0,0,0,0,0,0,0,0,0,0,0,0,0,0
AF03-AIR FORCE OPERATIONAL TEST AND EVALUATION CENTER,1,0,0,0,0,0,0,0,0,1,0,0,0,0,0,0,0,0,0,0,1,0,0,0,0,0,0,0,0,0,0,0,0,5,0,0,0,0,0,5,0,5,6
AF04-AIR FORCE COMMUNICATIONS AGENCY,0,0,0,0,0,0,0,0,0,0,0,0,0,0,0,0,0,0,0,0,0,0,0,0,0,0,0,0,0,0,0,0,0,1,0,0,0,0,0,1,0,1,1
AF05-AIR FORCE INTELLIGENCE SERVICE,0,0,0,0,0,0,0,0,0,0,0,0,0,0,0,0,0,0,0,0,0,0,0,0,0,0,0,0,0,0,0,0,0,0,0,0,0,0,0,0,0,0,0
AF06-AIR FORCE AUDIT AGENCY,1,0,0,0,0,0,0,0,0,1,0,0,0,0,0,0,0,0,0,0,1,0,6,0,1,0,0,0,0,0,7,0,0,0,0,0,0,0,0,0,0,7,8
AF07-AIR FORCE OFFICE OF SPECIAL INVESTIGATIONS,0,0,0,0,0,0,0,0,0,0,0,0,0,0,0,0,0,0,0,0,0,0,0,3,0,0,1,0,0,0,4,0,0,0,0,0,0,0,0,0,0,4,4
AF08-AIR FORCE OFFICE OF SECURITY POLICE,0,0,0,0,0,0,0,0,0,0,0,0,0,0,0,0,0,0,0,0,0,0,0,0,0,0,0,0,0,0,0,0,0,0,0,0,0,0,0,0,0,0,0
AF09-AIR FORCE PERSONNEL CENTER,2,0,0,0,0,0,0,0,0,2,0,0,0,0,0,0,0,0,0,0,2,2,8,0,3,0,2,0,0,0,15,2,0,0,0,0,0,0,0,2,0,17,19
AF0B-U.S. AIR FORCE ACADEMY,0,0,0,0,0,0,0,0,0,0,0,0,0,0,0,0,0,0,0,0,0,0,7,0,0,0,1,0,0,0,8,1,1,0,0,0,0,0,0,2,0,10,10
"AF0D-U.S. AIR FORCES, EUROPE",2,0,0,0,0,0,0,0,0,2,0,0,0,0,0,0,0,0,0,0,2,2,4,0,0,0,0,0,0,0,6,1,123,0,0,0,1,0,0,125,0,131,133
AF0J-AIR EDUCATION AND TRAINING COMMAND,7,1,0,0,0,1,0,0,0,9,0,0,0,0,0,0,0,0,0,0,9,4,53,0,1,0,33,0,0,0,91,41,6,8,0,0,0,0,0,55,0,146,155
"AF0M-HEADQUARTERS, AIR FORCE RESERVE",3,0,0,0,0,0,0,0,0,3,0,0,0,0,0,0,0,0,0,0,3,5,54,0,0,0,18,0,0,0,77,8,2,32,0,0,0,0,0,42,0,119,122
"AF0N-IMMEDIATE OFFICE, HEADQUARTERS, USAF",1,0,0,0,0,0,0,0,0,1,0,0,0,0,0,0,0,0,0,0,1,0,3,1,1,0,1,0,0,0,6,1,0,2,1,0,0,0,0,4,0,10,11
AF0R-PACIFIC AIR FORCES,9,2,0,0,0,0,0,0,0,11,0,0,0,0,0,0,0,0,0,0,11,4,15,1,0,0,2,0,0,0,22,7,28,0,0,0,0,0,0,35,0,57,68
"AF0U-AIR FORCE INTELLIGENCE, SURVEILLANCE, & RECONNAISSANCE AGENCY",0,0,0,0,0,0,0,0,0,0,0,0,0,0,0,0,0,0,0,0,0,0,0,0,0,0,21,0,0,0,21,0,0,0,0,0,3,0,0,3,0,24,24
AF0V-AIR FORCE SPECIAL OPERATIONS COMMAND,0,0,0,0,0,0,0,0,0,0,0,0,0,0,0,0,0,0,0,0,0,0,0,0,0,0,0,0,0,0,0,0,0,0,0,0,0,0,0,0,0,0,0
AF10-AIR FORCE CENTER FOR QUALITY AND MANAGEMENT INNOVATION,0,0,0,0,0,0,0,0,0,0,0,0,0,0,0,0,0,0,0,0,0,0,0,0,0,0,0,0,0,0,0,0,0,0,0,0,0,0,0,0,0,0,0
AF11-AIR FORCE MANPOWER AGENCY,0,0,0,0,0,0,0,0,0,0,0,0,0,0,0,0,0,0,0,0,0,0,1,0,0,0,1,0,0,0,2,2,0,0,0,0,0,0,0,2,0,4,4
"AF1A-AIR FORCE C2 & INTELLIGENCE, SURVEILLANCE & RECONNAISSANCE",0,0,0,0,0,0,0,0,0,0,0,0,0,0,0,0,0,0,0,0,0,0,0,0,0,0,0,0,0,0,0,0,0,0,0,0,0,0,0,0,0,0,0
AF1C-AIR COMBAT COMMAND,6,1,0,0,0,0,0,0,0,7,0,0,0,0,0,0,0,0,0,0,7,7,63,0,1,0,23,0,0,0,94,27,3,0,0,0,0,0,0,30,0,124,131
AF1G-AIR FORCE LOGISTICS MANAGEMENT AGENCY,0,0,0,0,0,0,0,0,0,0,0,0,0,0,0,0,0,0,0,0,0,0,0,0,0,0,0,0,0,0,0,0,0,0,0,0,0,0,0,0,0,0,0
AF1L-AIR MOBILITY COMMAND,7,1,0,0,0,0,0,0,0,8,0,0,0,0,0,0,0,0,0,0,8,3,34,0,0,0,7,0,0,0,44,23,30,2,0,0,0,0,0,55,0,99,107
AF1M-AIR FORCE MATERIEL COMMAND,13,4,0,0,0,0,0,0,0,17,0,0,0,0,0,0,0,0,0,0,17,6,157,3,83,0,20,0,0,0,269,75,8,19,0,0,0,0,0,102,0,371,388
AF1P-AIR FORCE REAL PROPERTY AGENCY,1,0,0,0,0,0,0,0,0,1,0,0,0,0,0,0,0,0,0,0,1,0,0,0,0,0,0,0,0,0,0,0,0,0,0,0,0,0,0,0,0,0,1
AF1Q-HQ AF FLIGHT STANDARDS AGENCY,0,0,0,0,0,0,0,0,0,0,0,0,0,0,0,0,0,0,0,0,0,0,0,0,0,0,0,0,0,0,0,1,0,0,0,0,0,0,0,1,0,1,1
AF1S-SPACE COMMAND,5,0,0,0,0,0,0,0,0,5,0,0,0,0,0,0,0,0,0,0,5,4,30,0,0,0,13,0,0,0,47,11,2,0,0,0,0,0,0,13,0,60,65
AF1W-AIR FORCE ENGINEERING AND SERVICES CENTER,0,0,0,0,0,0,0,0,0,0,0,0,0,0,0,0,0,0,0,0,0,0,0,0,0,0,0,0,0,0,0,0,0,0,0,0,0,0,0,0,0,0,0
AF1Y-AIR FORCE CIVILIAN CAREER TRAINING,0,0,0,0,0,0,0,0,0,0,0,0,0,0,0,0,0,0,0,0,0,0,0,0,0,0,0,0,0,0,0,0,0,0,0,0,0,0,0,0,0,0,0
AF21-AIR FORCE NUCLEAR WEAPONS AGENCY,0,0,0,0,0,0,0,0,0,0,0,0,0,0,0,0,0,0,0,0,0,0,0,0,0,0,0,0,0,0,0,0,0,0,0,0,0,0,0,0,0,0,0
AF24-HQ USAF DIRECT SUPPORT ELEMENT,0,0,0,0,0,0,0,0,0,0,0,0,0,0,0,0,0,0,0,0,0,0,0,0,0,0,0,0,0,0,0,0,0,0,0,0,0,0,0,0,0,0,0
AF25-AF-WIDE SUPPORT ELEMENT,0,0,0,0,0,0,0,0,0,0,0,0,0,0,0,0,0,0,0,0,0,0,0,0,0,0,0,0,0,0,0,0,0,0,0,0,0,0,0,0,0,0,0
AF27-AIR FORCE AGENCY FOR MODELING AND SIMULATION,0,0,0,0,0,0,0,0,0,0,0,0,0,0,0,0,0,0,0,0,0,0,0,0,0,0,0,0,0,0,0,0,0,0,0,0,0,0,0,0,0,0,0
AF2A-AIR FORCE COST CENTER,0,0,0,0,0,0,0,0,0,0,0,0,0,0,0,0,0,0,0,0,0,0,0,0,0,0,0,0,0,0,0,0,0,0,0,0,0,0,0,0,0,0,0
AF2B-AIR FORCE DOCTRINE CENTER,0,0,0,0,0,0,0,0,0,0,0,0,0,0,0,0,0,0,0,0,0,0,1,0,0,0,0,0,0,0,1,0,0,0,0,0,0,0,0,0,0,1,1
AF2D-AIR FORCE PERSONNEL OPERATIONS AGENCY,0,0,0,0,0,0,0,0,0,0,0,0,0,0,0,0,0,0,0,0,0,0,0,0,0,0,0,0,0,0,0,0,0,0,0,0,0,0,0,0,0,0,0
AF2E-AIR FORCE LEGAL SERVICES CENTER,0,0,0,0,0,0,0,0,0,0,0,0,0,0,0,0,0,0,0,0,0,0,0,0,0,0,0,0,0,0,0,0,0,1,0,0,0,0,0,1,0,1,1
AF2F-AIR FORCE MEDICAL SERVICES CENTER,0,0,0,0,0,0,0,0,0,0,0,0,0,0,0,0,0,0,0,0,0,0,0,0,0,0,0,0,0,0,0,0,0,0,0,0,0,0,0,0,0,0,0
AF2G-AIR FORCE SERVICE INFORMATION AND NEWS CENTER,0,0,0,0,0,0,0,0,0,0,0,0,0,0,0,0,0,0,0,0,0,0,0,0,0,0,0,0,0,0,0,2,0,0,0,0,0,0,0,2,0,2,2
AF2I-AIR NATIONAL GUARD SUPPORT CENTER,0,0,0,0,0,0,0,0,0,0,0,0,0,0,0,0,0,0,0,0,0,1,0,0,0,0,0,0,0,0,1,1,0,2,0,0,0,0,0,3,0,4,4
AF2K-U.S. AIR FORCE HISTORICAL RESEARCH CENTER,0,0,0,0,0,0,0,0,0,0,0,0,0,0,0,0,0,0,0,0,0,0,0,0,0,0,0,0,0,0,0,2,0,0,0,0,0,0,0,2,0,2,2
AF2L-AIR FORCE TECHNICAL APPLICATIONS CENTER,0,0,0,0,0,0,0,0,0,0,0,0,0,0,0,0,0,0,0,0,0,0,0,0,0,0,0,0,0,0,0,0,0,0,0,0,0,0,0,0,0,0,0
AF2M-AIR FORCE REVIEW BOARDS OFFICE,0,0,0,0,0,0,0,0,0,0,0,0,0,0,0,0,0,0,0,0,0,0,0,0,0,0,0,0,0,0,0,0,0,1,0,0,0,0,0,1,0,1,1
AF2N-AIR FORCE CENTER FOR STUDIES AND ANALYSES,0,0,0,0,0,0,0,0,0,0,0,0,0,0,0,0,0,0,0,0,0,0,1,0,0,0,0,0,0,0,1,0,0,0,0,0,0,0,0,0,0,1,1
AF2Q-AIR WEATHER SERVICE,0,0,0,0,0,0,0,0,0,0,0,0,0,0,0,0,0,0,0,0,0,0,1,0,0,0,0,0,0,0,1,1,0,0,0,0,0,0,0,1,0,2,2
AF2R-AIR FORCE PROGRAM EXECUTIVE OFFICE,0,0,0,0,0,0,0,0,0,0,0,0,0,0,0,0,0,0,0,0,0,0,0,0,0,0,0,0,0,0,0,0,0,0,0,0,0,0,0,0,0,0,0
AF2S-HQ NORAD,0,0,0,0,0,0,0,0,0,0,0,0,0,0,0,0,0,0,0,0,0,0,0,0,0,0,0,0,0,0,0,0,0,0,0,0,0,0,0,0,0,0,0
AF2T-AIR FORCE SUPPLY CENTER,0,0,0,0,0,0,0,0,0,0,0,0,0,0,0,0,0,0,0,0,0,0,0,0,0,0,0,0,0,0,0,0,0,0,0,0,0,0,0,0,0,0,0
"AF2U-AIR FORCE MORALE, WELFARE AND RECREATION CENTER",0,0,0,0,0,0,0,0,0,0,0,0,0,0,0,0,0,0,0,0,0,0,0,1,0,0,0,0,0,0,1,0,0,0,0,0,0,0,0,0,0,1,1
AF2W-11TH WING,0,1,0,0,0,0,0,0,0,1,0,0,0,0,0,0,0,0,0,0,1,1,5,0,0,0,1,0,0,0,7,2,0,9,0,0,1,0,0,12,0,19,20
AF2Y-AIR FORCE PENTAGON COMMUNICATIONS AGENCY,0,0,0,0,0,0,0,0,0,0,0,0,0,0,0,0,0,0,0,0,0,0,0,0,0,0,0,0,0,0,0,0,0,0,0,0,0,0,0,0,0,0,0
AF2Z-HQ AIR FORCE MEDICAL OPERATIONS AGENCY,0,0,0,0,0,0,0,0,0,0,0,0,0,0,0,0,0,0,0,0,0,0,0,0,0,0,0,0,0,0,0,0,0,0,0,0,0,0,0,0,0,0,0
AF34-AIR NATIONAL GUARD UNITS (MOBILIZATION) (TITLE 5),0,0,0,0,0,0,0,0,0,0,0,0,0,0,0,0,0,0,0,0,0,0,4,0,0,0,1,0,0,0,5,1,1,0,0,0,0,0,0,2,0,7,7
"AF3C-AIR FORCE ELEMENTS, U.S. CENTRAL COMMAND",0,0,0,0,0,0,0,0,0,0,0,0,0,0,0,0,0,0,0,0,0,0,1,0,0,0,1,0,0,0,2,0,2,0,0,0,3,0,0,5,0,7,7
"AF3D-AIR FORCE ELEMENTS, U.S. SPECIAL OPERATIONS COMMAND",1,0,0,0,0,0,0,0,0,1,0,0,0,0,0,0,0,0,0,0,1,0,1,0,0,0,2,0,0,0,3,0,0,0,0,0,0,0,0,0,0,3,4
"AF3N-AIR FORCE ELEMENTS, U.S. ATLANTIC COMMAND",1,0,0,0,0,0,0,0,0,1,0,0,0,0,0,0,0,0,0,0,1,0,0,0,0,0,2,0,0,0,2,0,0,0,0,0,0,0,0,0,0,2,3
"AF3Q-AIR FORCE ELEMENTS, U.S. STRATEGIC COMMAND",0,0,0,0,0,0,0,0,0,0,0,0,0,0,0,0,0,0,0,0,0,0,2,0,3,0,3,0,0,0,8,1,0,0,0,0,0,0,0,1,0,9,9
"AF3S-HEADQUARTERS, U.S. SPACE COMMAND AND NORAD",2,0,0,0,0,0,0,0,0,2,0,0,0,0,0,0,0,0,0,0,2,0,3,0,0,0,2,0,0,0,5,0,1,0,0,0,0,0,0,1,0,6,8
"AF3T-AIR FORCE ELEMENTS, U.S. TRANSPORTATION COMMAND",0,0,0,0,0,0,0,0,0,0,0,0,0,0,0,0,0,0,0,0,0,0,0,0,0,0,0,0,0,0,0,2,0,0,0,0,0,0,0,2,0,2,2
"AF3V-AIR FORCE ELEMENTS, OTHER THAN EUROPE",0,0,0,0,0,0,0,0,0,0,0,0,0,0,0,0,0,0,0,0,0,0,2,0,0,0,2,0,0,0,4,0,0,1,0,0,0,0,0,1,0,5,5
AF3W-AIR FORCE CENTER FOR ENVIRONMENTAL EXCELLENCE,0,0,0,0,0,0,0,0,0,0,0,0,0,0,0,0,0,0,0,0,0,0,0,0,0,0,0,0,0,0,0,1,0,0,0,0,0,0,0,1,0,1,1
AF3Y-AIR FORCE FREQUENCY MANAGEMENT AGENCY,0,0,0,0,0,0,0,0,0,0,0,0,0,0,0,0,0,0,0,0,0,0,1,0,0,0,0,0,0,0,1,0,0,0,0,0,0,0,0,0,0,1,1
"AF4D-AIR FORCE ELEMENTS, U.S. NORTHERN COMMAND",0,0,0,0,0,0,0,0,0,0,0,0,0,0,0,0,0,0,0,0,0,0,0,0,0,0,0,0,0,0,0,0,0,0,0,0,0,0,0,0,0,0,0
AF4W-AIR FORCE DISTRICT OF WASHINGTON,0,0,0,0,0,0,0,0,0,0,0,0,0,0,0,0,0,0,0,0,0,0,0,0,0,0,0,0,0,0,0,0,0,0,0,0,0,0,0,0,0,0,0
AF5J-AIR FORCE FINANCIAL SERVICES,0,0,0,0,0,0,0,0,0,0,0,0,0,0,0,0,0,0,0,0,0,0,0,0,0,0,0,0,0,0,0,0,0,0,0,0,0,0,0,0,0,0,0
AF5K-AIR FORCE PETROLEUM AGENCY,0,0,0,0,0,0,0,0,0,0,0,0,0,0,0,0,0,0,0,0,0,0,0,0,0,0,0,0,0,0,0,0,0,0,0,0,0,0,0,0,0,0,0
AFNG-AIR NATIONAL GUARD UNITS (TITLE 32),0,0,0,0,0,0,0,0,0,0,0,0,0,0,0,0,0,0,0,0,0,0,0,0,0,0,112,0,0,0,112,0,5,0,0,0,220,0,0,225,1,338,338
"AFZG-U.S. SPECIAL OPERATIONS COMMAND (ANG, TITLE 32)",0,0,0,0,0,0,0,0,0,0,0,0,0,0,0,0,0,0,0,0,0,0,0,0,0,0,0,0,0,0,0,0,0,0,0,0,8,0,0,8,0,8,8
AFZS-U.S. SPECIAL OPERATIONS COMMAND (AIR FORCE),1,0,0,0,0,0,0,0,0,1,0,0,0,0,0,0,0,0,0,0,1,0,1,0,1,0,4,0,0,0,6,2,1,0,0,0,1,0,0,4,0,10,11
AG01-OFFICE OF THE SECRETARY OF AGRICULTURE,0,0,0,0,0,0,0,0,0,0,0,0,0,0,0,0,0,0,0,0,0,0,0,0,0,0,0,0,0,0,0,0,0,0,0,0,0,0,0,0,0,0,0
AG02-AGRICULTURAL MARKETING SERVICE,0,0,0,0,0,0,0,0,0,0,0,0,0,0,0,0,0,0,0,0,0,0,5,0,3,0,0,0,0,0,8,0,85,0,0,0,0,0,0,85,0,93,93
AG03-AGRICULTURAL RESEARCH SERVICE,4,0,0,0,0,0,0,0,0,4,0,0,0,0,0,0,0,0,0,0,4,1,21,1,1,0,0,0,0,0,24,6,17,24,0,0,0,0,0,47,0,71,75
AG07-RURAL HOUSING SERVICE,2,0,0,0,0,0,0,0,0,2,0,0,0,0,0,0,0,0,0,0,2,4,18,0,0,0,1,0,0,0,23,6,1,5,1,0,1,0,0,14,0,37,39
AG08-RISK MANAGEMENT AGENCY,0,0,0,0,0,0,0,0,0,0,0,0,0,0,0,0,0,0,0,0,0,0,0,0,0,0,0,0,0,0,0,0,0,0,0,0,0,0,0,0,0,0,0
AG10-FOREIGN AGRICULTURAL SERVICE,0,0,0,0,0,0,0,0,0,0,0,0,0,0,0,0,0,0,0,0,0,0,0,0,0,0,0,0,0,0,0,0,0,2,0,0,0,0,0,2,0,2,2
AG11-FOREST SERVICE,10,2,0,0,0,0,0,0,0,12,0,0,0,0,0,0,0,0,0,0,12,9,20,1,4,0,1,0,0,0,35,99,28,28,0,0,2,0,0,157,0,192,204
AG13-OFFICE OF COMMUNICATIONS,0,0,0,0,0,0,0,0,0,0,0,0,0,0,0,0,0,0,0,0,0,0,0,0,0,0,0,0,0,0,0,0,0,0,0,0,0,0,0,0,0,0,0
AG14-OFFICE OF THE GENERAL COUNSEL,0,0,0,0,0,0,0,0,0,0,0,0,0,0,0,0,0,0,0,0,0,0,0,0,0,0,0,0,0,0,0,0,0,1,0,0,0,0,0,1,0,1,1
AG15-RURAL UTILITIES SERVICE,0,0,0,0,0,0,0,0,0,0,0,0,0,0,0,0,0,0,0,0,0,0,1,0,0,0,0,0,0,0,1,0,0,0,0,0,0,0,0,0,0,1,1
AG16-NATURAL RESOURCES CONSERVATION SERVICE,2,1,0,0,0,0,0,0,0,3,0,0,0,0,0,0,0,0,0,0,3,3,29,0,13,0,4,0,0,0,49,4,6,4,0,0,1,0,0,15,0,64,67
AG18-ECONOMIC RESEARCH SERVICE,1,0,0,0,0,0,0,0,0,1,0,0,0,0,0,0,0,0,0,0,1,0,2,0,0,0,0,0,0,0,2,0,0,0,0,0,0,0,0,0,0,2,3
AG20-NATIONAL AGRICULTURAL STATISTICS SERVICE,0,0,0,0,0,0,0,0,0,0,0,0,0,0,0,0,0,0,0,0,0,0,4,0,1,0,0,0,0,0,5,0,0,0,0,0,0,0,0,0,0,5,5
"AG22-COOPERATIVE STATE RESEARCH, EDUCATION, AND EXTENSION SERVICE",1,0,0,0,0,0,0,0,0,1,0,0,0,0,0,0,0,0,0,0,1,0,1,0,0,0,0,0,0,0,1,0,7,0,0,0,1,0,0,8,0,9,10
AG23-OFFICE OF THE INSPECTOR GENERAL,1,3,0,0,0,0,0,0,0,4,0,0,0,0,0,0,0,0,0,0,4,0,0,0,0,0,0,0,0,0,0,0,0,0,0,0,0,0,0,0,0,0,4
AG30-FOOD AND NUTRITION SERVICE,1,0,0,0,0,0,0,0,0,1,0,0,0,0,0,0,0,0,0,0,1,1,0,0,0,0,0,0,0,0,1,0,0,1,0,0,0,0,0,1,0,2,3
AG32-RURAL BUSINESS-COOPERATIVE SERVICE,0,0,0,0,0,0,0,0,0,0,0,0,0,0,0,0,0,0,0,0,0,0,1,0,0,0,0,0,0,0,1,0,0,0,0,0,0,0,0,0,0,1,1
AG34-ANIMAL AND PLANT HEALTH INSPECTION SERVICE,8,3,0,0,0,0,0,0,0,11,0,0,0,0,0,0,0,0,0,0,11,4,20,0,0,0,1,0,0,0,25,15,22,6,0,0,0,0,0,43,0,68,79
"AG36-GRAIN INSPECTION, PACKERS AND STOCKYARDS ADMINISTRATION",1,0,0,0,0,0,0,0,0,1,0,0,0,0,0,0,0,0,0,0,1,0,0,0,0,0,0,0,0,0,0,0,3,0,0,0,0,0,0,3,0,3,4
AG37-FOOD SAFETY AND INSPECTION SERVICE,1,1,0,0,0,0,0,0,0,2,0,0,0,0,0,0,0,0,0,0,2,1,13,0,0,0,0,0,0,0,14,1,12,0,0,0,0,0,0,13,0,27,29
AG38-OFFICE OF THE CHIEF ECONOMIST,0,0,0,0,0,0,0,0,0,0,0,0,0,0,0,0,0,0,0,0,0,0,0,0,0,0,0,0,0,0,0,0,0,0,0,0,0,0,0,0,0,0,0
AG42-OFFICE OF BUDGET AND PROGRAM ANALYSIS,0,0,0,0,0,0,0,0,0,0,0,0,0,0,0,0,0,0,0,0,0,0,1,0,0,0,0,0,0,0,1,0,0,0,0,0,0,0,0,0,0,1,1
AG90-OFFICE OF THE CHIEF FINANCIAL OFFICER,1,0,0,0,0,0,0,0,0,1,0,0,0,0,0,0,0,0,0,0,1,0,0,0,0,0,0,1,0,0,1,0,0,0,0,0,0,0,0,0,0,1,2
AGCR-OFFICE OF CIVIL RIGHTS,0,0,0,0,0,0,0,0,0,0,0,0,0,0,0,0,0,0,0,0,0,0,0,0,0,0,0,0,0,0,0,0,0,0,0,0,0,0,0,0,0,0,0
AGDA-DEPARTMENTAL ADMINISTRATION,0,0,0,0,0,0,0,0,0,0,0,0,0,0,0,0,0,0,0,0,0,0,1,0,0,0,0,0,0,0,1,0,1,0,0,0,0,0,0,1,0,2,2
AGES-OFFICE OF THE EXECUTIVE SECRETARIAT,0,0,0,0,0,0,0,0,0,0,0,0,0,0,0,0,0,0,0,0,0,0,0,0,0,0,0,0,0,0,0,0,0,0,0,0,0,0,0,0,0,0,0
AGFA-FARM SERVICE AGENCY,5,0,0,0,0,0,0,0,0,5,0,0,0,0,0,0,0,0,0,0,5,0,7,0,3,0,1,0,0,0,11,2,0,3,0,0,0,0,0,5,0,16,21
AGHL-HOMELAND SECURITY STAFF,0,0,0,0,0,0,0,0,0,0,0,0,0,0,0,0,0,0,0,0,0,0,0,0,0,0,0,0,0,0,0,0,0,0,0,0,0,0,0,0,0,0,0
AGHS-HOMELAND SECURITY STAFF,0,0,0,0,0,0,0,0,0,0,0,0,0,0,0,0,0,0,0,0,0,0,0,0,0,0,0,0,0,0,0,0,0,0,0,0,0,0,0,0,0,0,0
AGIT-OFFICE OF THE CHIEF INFORMATION OFFICER,1,0,0,0,0,0,0,0,0,1,0,0,0,0,0,0,0,0,0,0,1,0,1,0,0,0,0,0,0,0,1,0,0,0,0,0,0,0,0,0,0,1,2
AGNA-NATIONAL APPEALS DIVISION,0,0,0,0,0,0,0,0,0,0,0,0,0,0,0,0,0,0,0,0,0,0,0,0,0,0,0,0,0,0,0,0,0,0,0,0,0,0,0,0,0,0,0
AH01-NATIONAL ENDOWMENT FOR THE ARTS,0,0,0,0,0,0,0,0,0,0,0,0,0,0,0,0,0,0,0,0,0,0,1,0,0,0,0,0,0,0,1,0,0,0,0,0,0,0,0,0,0,1,1
AH02-NATIONAL ENDOWMENT FOR THE HUMANITIES,0,0,0,0,0,0,0,0,0,0,0,0,0,0,0,0,0,0,0,0,0,1,0,0,0,0,0,0,0,0,1,0,0,0,0,8,0,0,0,8,0,9,9
AH03-INSTITUTE OF MUSEUM AND LIBRARY SERVICES,1,0,0,0,0,0,0,0,0,1,0,0,0,0,0,0,0,0,0,0,1,0,1,0,0,0,0,0,0,0,1,0,0,0,0,7,0,0,0,7,0,8,9
AI00-U.S. INSTITUTE OF PEACE,0,0,0,0,0,0,0,0,0,0,0,0,0,0,0,0,0,0,0,0,0,0,0,0,0,0,0,0,0,0,0,0,0,0,0,0,2,0,0,2,0,2,2
AM00-AGENCY FOR INTERNATIONAL DEVELOPMENT,2,1,0,0,0,0,0,0,0,3,0,0,0,0,0,0,0,0,0,0,3,1,7,0,0,0,0,1,0,0,9,2,6,0,0,0,2,0,0,10,0,19,22
AN00-AFRICAN DEVELOPMENT FOUNDATION,0,0,0,0,0,0,0,0,0,0,0,0,0,0,0,0,0,0,0,0,0,0,0,0,0,0,0,0,0,0,0,0,0,0,0,0,0,0,0,0,0,0,0
AP00-APPALACHIAN REGIONAL COMMISSION,0,0,0,0,0,0,0,0,0,0,0,0,0,0,0,0,0,0,0,0,0,0,0,0,0,0,0,0,0,0,0,0,0,0,0,0,0,0,0,0,0,0,0
AR**-UNSPECIFIED,0,0,0,0,0,0,0,0,0,0,0,0,0,0,0,0,0,0,0,0,0,0,0,0,0,0,0,0,0,0,0,0,0,0,0,0,0,0,0,0,0,0,0
AR3A-U.S. ARMY CENTRAL,0,0,0,0,0,0,0,0,0,0,0,0,0,0,0,0,0,0,0,0,0,0,0,0,0,0,0,0,0,0,0,0,0,0,0,0,0,0,0,0,0,0,0
AR5A-U.S. ARMY NORTH,0,0,0,0,0,0,0,0,0,0,0,0,0,0,0,0,0,0,0,0,0,0,0,0,0,0,0,0,0,0,0,0,0,0,0,0,0,0,0,0,0,0,0
ARAC-U.S. ARMY CONTRACTING AGENCY,5,0,0,0,0,0,0,0,0,5,0,0,0,0,0,0,0,0,0,0,5,0,3,1,0,0,1,0,0,0,5,1,0,0,0,0,0,0,0,1,0,6,11
ARAE-U.S. ARMY ACQUISITION SUPPORT CENTER,1,0,0,0,0,0,0,0,0,1,0,0,0,0,0,0,0,0,0,0,1,2,6,0,3,0,0,0,0,0,11,1,3,1,0,0,2,0,0,7,0,18,19
ARAS-U.S. ARMY INTELLIGENCE AND SECURITY COMMAND,0,0,0,0,0,0,0,0,0,0,0,0,0,0,0,0,0,0,0,0,0,0,0,0,0,0,32,0,0,0,32,0,0,0,0,0,2,0,0,2,0,34,34
ARAT-U.S. ARMY TEST AND EVALUATION COMMAND,3,0,0,0,0,0,0,0,0,3,0,0,0,0,0,0,0,0,0,0,3,1,9,0,12,0,3,0,0,0,25,3,0,0,0,0,2,0,0,5,0,30,33
ARAU-U.S. ARMY AUDIT AGENCY,0,0,0,0,0,0,0,0,0,0,0,0,0,0,0,0,0,0,0,0,0,0,0,0,0,0,0,0,0,0,0,0,0,0,0,0,0,0,0,0,0,0,0
ARBA-U.S. ARMY INSTALLATION MANAGEMENT COMMAND,23,14,0,0,0,0,0,0,0,37,0,0,0,0,0,0,0,0,0,0,37,28,183,0,3,0,44,0,0,0,258,213,220,1,0,0,13,0,0,447,1,706,743
ARCB-U.S. ARMY CRIMINAL INVESTIGATION COMMAND,0,0,0,0,0,0,0,0,0,0,0,0,0,0,0,0,0,0,0,0,0,2,10,0,1,0,0,0,0,0,13,0,0,0,0,0,0,0,0,0,0,13,13
ARCE-U.S. ARMY CORPS OF ENGINEERS,10,1,0,0,0,0,0,0,0,11,0,0,0,0,0,0,0,0,0,0,11,5,31,0,14,0,0,0,0,0,50,19,1,14,0,0,3,0,0,37,0,87,98
ARCS-IMMEDIATE OFFICE OF THE CHIEF OF STAFF OF THE ARMY,0,0,0,0,0,0,0,0,0,0,0,0,0,0,0,0,0,0,0,0,0,1,6,0,0,0,1,0,0,0,8,0,0,0,0,0,0,0,0,0,0,8,8
ARE1-IMMEDIATE OFFICE OF THE COMMANDER-IN-CHIEF OF THE U.S. ARMY EUROPE AND SEVENTH ARMY,1,0,0,0,0,0,0,0,0,1,0,0,0,0,0,0,0,0,0,0,1,0,2,0,0,0,1,0,0,0,3,3,6,0,0,0,0,0,0,9,0,12,13
ARE2-21ST THEATER SUSTAINMENT COMMAND (TSC),1,0,0,0,0,0,0,0,0,1,0,0,0,0,0,0,0,0,0,0,1,1,1,0,0,0,0,0,0,0,2,2,2,0,0,0,0,0,0,4,0,6,7
ARE3-U.S. ARMY SOUTHERN EURPOEAN TASK FORCE,0,0,0,0,0,0,0,0,0,0,0,0,0,0,0,0,0,0,0,0,0,0,0,0,0,0,0,0,0,0,0,0,0,0,0,0,0,0,0,0,0,0,0
ARE5-U.S. ARMY V CORPS,1,0,0,0,0,0,0,0,0,1,0,0,0,0,0,0,0,0,0,0,1,1,0,0,0,0,2,0,0,0,3,0,2,0,0,0,1,0,0,3,0,6,7
AREB-1ST PERSONNEL COMMAND,0,0,0,0,0,0,0,0,0,0,0,0,0,0,0,0,0,0,0,0,0,0,2,0,0,0,2,0,0,0,4,8,26,0,0,0,1,0,0,35,0,39,39
AREN-SEVENTH ARMY TRAINING COMMAND,0,0,0,0,0,0,0,0,0,0,0,0,0,0,0,0,0,0,0,0,0,0,3,0,0,0,2,0,0,0,5,0,1,0,0,0,0,0,0,1,0,6,6
ARFC-U.S. ARMY FORCES COMMAND,1,0,0,0,0,0,0,0,0,1,0,0,0,0,0,0,0,0,0,0,1,2,13,0,0,0,4,0,0,0,19,5,4,0,0,0,0,0,0,9,0,28,29
ARFL-U.S. ARMY SOUTH COMMAND,0,0,0,0,0,0,0,0,0,0,0,0,0,0,0,0,0,0,0,0,0,0,2,0,0,0,1,0,0,0,3,0,0,0,0,0,0,0,0,0,0,3,3
ARG6-U.S. ARMY NETWORK ENTERPRISE TECHNOLOGY COMMAND/9TH ARMY SIGNAL COMMAND,3,0,0,0,0,0,0,0,0,3,0,0,0,0,0,0,0,0,0,0,3,1,10,0,0,0,2,0,0,0,13,1,4,0,0,0,0,0,0,5,0,18,21
ARGB-OFFICE OF THE CHIEF OF THE NATIONAL GUARD BUREAU,0,0,0,0,0,0,0,0,0,0,0,0,0,0,0,0,0,0,0,0,0,0,0,0,0,0,0,0,0,0,0,0,0,1,0,0,0,0,0,1,0,1,1
ARHR-U.S. ARMY RESERVE COMMAND,3,1,0,0,0,0,0,0,0,4,0,0,0,0,0,0,0,0,0,0,4,2,37,0,0,0,9,0,0,0,48,16,0,1,0,0,0,0,0,17,0,65,69
ARJ1-U.S. ARMY ELEMENT SHAPE,0,0,0,0,0,0,0,0,0,0,0,0,0,0,0,0,0,0,0,0,0,0,1,0,0,0,2,0,0,0,3,0,2,0,0,0,1,0,0,3,0,6,6
ARJA-JOINT ACTIVITIES,1,0,0,0,0,0,0,0,0,1,0,0,0,0,0,0,0,0,0,0,1,0,1,0,0,0,5,0,0,0,6,2,6,0,0,0,2,0,0,10,0,16,17
ARMA-U.S. MILITARY ACADEMY,0,0,0,0,0,0,0,0,0,0,0,0,0,0,0,0,0,0,0,0,0,0,0,0,0,0,0,0,0,0,0,2,0,0,0,0,0,0,0,2,0,2,2
ARMC-U.S. ARMY MEDICAL COMMAND,16,6,0,0,0,0,0,0,0,22,0,0,0,0,0,0,0,0,0,0,22,15,170,1,0,0,23,0,0,0,209,64,33,0,0,0,9,0,0,106,0,315,337
ARMP-U.S. ARMY HUMAN RESOURCES COMMAND,1,0,0,0,0,0,0,0,0,1,0,0,0,0,0,0,0,0,0,0,1,1,15,1,0,0,1,1,0,0,19,3,0,0,0,0,0,0,0,3,0,22,23
ARMT-MILITARY SURFACE DEPLOYMENT AND DISTRIBUTION COMMAND,0,0,0,0,0,0,0,0,0,0,0,0,0,0,0,0,0,0,0,0,0,1,12,0,0,0,0,0,0,0,13,1,2,0,0,0,0,0,0,3,0,16,16
ARMW-U.S. ARMY MILITARY DISTRICT OF WASHINGTON,0,0,0,0,0,0,0,0,0,0,0,0,0,0,0,0,0,0,0,0,0,0,2,0,0,0,3,0,0,0,5,0,0,0,0,0,0,0,0,0,0,5,5
ARNG-ARMY NATIONAL GUARD UNITS (TITLE 32),0,0,0,0,0,0,0,0,0,0,0,0,0,0,0,0,0,0,0,0,0,0,4,0,0,0,110,0,0,0,114,1,90,0,0,0,218,0,0,309,1,424,424
"ARP1-U.S. ARMY, PACIFIC",2,0,0,0,0,0,0,0,0,2,0,0,0,0,0,0,0,0,0,0,2,0,3,0,0,0,2,0,0,0,5,4,1,0,0,0,4,0,0,9,0,14,16
ARP8-EIGHTH U.S. ARMY,2,0,0,0,0,0,0,0,0,2,0,0,0,0,0,0,0,0,0,0,2,1,5,0,0,0,2,0,0,0,8,0,0,0,0,0,0,0,0,0,0,8,10
ARPC-MILITARY ENTRANCE PROCESSING COMMAND,0,3,0,0,0,1,0,0,0,4,0,0,0,0,0,0,0,0,0,0,4,0,8,0,0,0,0,0,0,0,8,1,0,0,0,0,0,0,0,1,0,9,13
ARRC-U.S. ARMY RECRUITING COMMAND,0,0,0,0,0,1,0,0,0,1,0,0,0,0,0,0,0,0,0,0,1,1,1,0,0,0,1,0,0,0,3,1,0,0,0,0,0,0,0,1,0,4,5
ARSA-OFFICE OF THE SECRETARY OF THE ARMY,1,0,0,0,0,0,0,0,0,1,0,0,0,0,0,0,0,0,0,0,1,0,1,0,0,0,0,0,0,0,1,0,0,0,0,1,15,0,0,16,0,17,18
ARSB-FIELD OPERATING OFFICES OF THE OFFICE OF THE SECRETARY OF THE ARMY,1,0,0,0,0,0,0,0,0,1,0,0,0,0,0,0,0,0,0,0,1,0,2,0,0,0,0,0,0,0,2,0,1,0,0,0,0,0,0,1,0,3,4
ARSC-U. S. ARMY SPACE AND MISSILE DEFENSE COMMAND/U. S. ARMY FORCES STRATEGIC COMMAND,0,0,0,0,0,0,0,0,0,0,0,0,0,0,0,0,0,0,0,0,0,0,1,0,0,0,0,0,0,0,1,2,0,0,0,0,0,0,0,2,0,3,3
ARSE-FIELD OPERATING AGENCIES OF THE ARMY STAFF RESOURCED THROUGH OA-22,5,0,0,0,0,0,0,0,0,5,0,0,0,0,0,0,0,0,0,0,5,3,6,0,3,0,5,0,0,0,17,2,3,1,0,0,2,0,0,8,0,25,30
ARSF-FIELD OPERATING AGENCIES OF THE ARMY STAFF,0,0,0,0,0,0,0,0,0,0,0,0,0,0,0,0,0,0,0,0,0,0,1,0,0,0,0,0,0,0,1,0,0,0,0,0,0,0,0,0,0,1,1
"ARSJ-JOINT SERVICES AND ACTIVITIES SUPPORTED BY THE OFFICE, SECRETARY OF THE ARMY",0,0,0,0,0,0,0,0,0,0,0,0,0,0,0,0,0,0,0,0,0,1,4,0,0,0,0,0,0,0,5,0,0,0,0,0,0,0,0,0,0,5,5
ARSO-U.S. ARMY SOUTH,0,0,0,0,0,0,0,0,0,0,0,0,0,0,0,0,0,0,0,0,0,0,0,0,0,0,0,0,0,0,0,0,0,0,0,0,0,0,0,0,0,0,0
ARSP-U.S. SPECIAL OPERATIONS COMMAND (ARMY),0,0,0,0,0,0,0,0,0,0,0,0,0,0,0,0,0,0,0,0,0,0,4,0,0,0,0,0,0,0,4,10,0,0,0,0,0,0,0,10,0,14,14
"ARSS-STAFF SUPPORT AGENCIES OF THE CHIEF OF STAFF, ARMY",0,0,0,0,0,0,0,0,0,0,0,0,0,0,0,0,0,0,0,0,0,0,0,0,0,0,0,0,0,0,0,0,0,0,0,0,0,0,0,0,0,0,0
ARTA-U.S. ARMY ACCESSIONS COMMAND,0,0,0,0,0,0,0,0,0,0,0,0,0,0,0,0,0,0,0,0,0,0,0,0,0,0,0,0,0,0,0,0,0,0,0,0,0,0,0,0,0,0,0
ARTC-U.S. ARMY TRAINING AND DOCTRINE COMMAND,7,1,0,0,0,0,0,0,0,8,0,0,0,0,0,0,0,0,0,0,8,9,78,0,0,0,24,0,0,0,111,25,20,0,0,0,10,0,0,55,1,167,175
ARTM-U.S. MILITARY ENTRANCE PROCESSING COMMAND,0,0,0,0,0,0,0,0,0,0,0,0,0,0,0,0,0,0,0,0,0,0,0,0,0,0,0,0,0,0,0,0,0,0,0,0,0,0,0,0,0,0,0
ARTW-U.S. ARMY WAR COLLEGE,0,0,0,0,0,0,0,0,0,0,0,0,0,0,0,0,0,0,0,0,0,0,0,0,0,0,0,0,0,0,0,0,0,0,0,0,0,0,0,0,0,0,0
"ARX2-HEADQUARTERS, AMC",1,0,0,0,0,0,0,0,0,1,0,0,0,0,0,0,0,0,0,0,1,1,4,0,0,0,0,0,0,0,5,1,0,1,0,0,0,0,0,2,0,7,8
"ARX3-HEADQUARTERS, STAFF SUPPORT ACTIVITIES, AMC",0,0,0,0,0,0,0,0,0,0,0,0,0,0,0,0,0,0,0,0,0,0,0,0,0,0,0,0,0,0,0,0,0,0,0,0,0,0,0,0,0,0,0
"ARX4-TRAINING ACTIVITIES, AMC",0,0,0,0,0,0,0,0,0,0,0,0,0,0,0,0,0,0,0,0,0,0,0,0,0,0,0,0,0,0,0,0,0,0,0,0,0,0,0,0,0,0,0
ARX6-U.S. ARMY AVIATION AND MISSILE COMMAND,0,0,0,0,0,0,0,0,0,0,0,0,0,0,0,0,0,0,0,0,0,2,35,1,6,0,6,0,0,0,50,7,1,0,0,0,1,0,0,9,0,59,59
ARX7-U.S. ARMY TANK-AUTOMOTIVE AND ARMAMENT COMMAND (TACOM),3,1,0,0,0,0,0,0,0,4,0,0,0,0,0,0,0,0,0,0,4,11,112,1,11,0,13,0,0,0,148,74,240,2,0,0,72,0,0,388,0,536,540
ARX8-U.S. ARMY COMMUNICATIONS ELECTRONICS COMMAND,0,0,0,0,0,0,0,0,0,0,0,0,0,0,0,0,0,0,0,0,0,2,55,1,1,0,2,0,0,0,61,10,0,0,0,0,0,0,0,10,0,71,71
"ARX9-U.S. ARMY SIMULATION, TRAINING AND INSTRUMENTATION COMMAND",0,0,0,0,0,0,0,0,0,0,0,0,0,0,0,0,0,0,0,0,0,0,0,0,0,0,3,0,0,0,3,0,0,0,0,0,0,0,0,0,0,3,3
ARXA-U.S. ARMY CHEMICAL AND BIOLOGICAL DEFENSE COMMAND,0,0,0,0,0,0,0,0,0,0,0,0,0,0,0,0,0,0,0,0,0,0,2,0,0,0,0,0,0,0,2,0,0,0,0,0,0,0,0,0,0,2,2
ARXB-U.S. ARMY CHEMICAL MATERIALS AGENCY,1,0,0,0,0,0,0,0,0,1,0,0,0,0,0,0,0,0,0,0,1,1,35,0,0,0,6,0,0,0,42,12,0,0,0,0,0,0,0,12,0,54,55
ARXC-U.S. ARMY SUSTAINMENT COMMAND,0,0,0,0,0,0,0,0,0,0,0,0,0,0,0,0,0,0,0,0,0,0,0,0,0,0,0,0,0,0,0,0,0,0,0,0,0,0,0,0,0,0,0
ARXD-U.S. ARMY RESEARCH LABORATORY COMMAND,0,0,0,0,0,0,0,0,0,0,0,0,0,0,0,0,0,0,0,0,0,0,0,0,0,0,0,0,0,0,0,0,0,0,0,0,0,0,0,0,0,0,0
ARXK-MATERIEL ACQUISITION ACTIVITIES,0,0,0,0,0,0,0,0,0,0,0,0,0,0,0,0,0,0,0,0,0,0,0,0,0,0,2,0,0,0,2,0,0,0,0,0,1,0,0,1,0,3,3
ARXL-MATERIEL ACQUISITION PROJECT MANAGERS,0,0,0,0,0,0,0,0,0,0,0,0,0,0,0,0,0,0,0,0,0,0,0,0,0,0,0,0,0,0,0,0,0,0,0,0,0,0,0,0,0,0,0
ARXP-U.S. ARMY SECURITY ASSISTANCE COMMAND,1,0,0,0,0,0,0,0,0,1,0,0,0,0,0,0,0,0,0,0,1,0,0,0,0,0,0,0,0,0,0,0,0,0,0,0,0,0,0,0,0,0,1
ARXQ-U.S. ARMY JOINT MUNITIONS COMMAND,0,0,0,0,0,0,0,0,0,0,0,0,0,0,0,0,0,0,0,0,0,2,11,1,0,0,3,0,0,0,17,2,0,0,0,0,0,0,0,2,0,19,19
"ARXR-U.S. ARMY RESEARCH, DEVELOPMENT AND ENGINEERING COMMAND",4,0,0,0,0,0,0,0,0,4,0,0,0,0,0,0,0,0,0,0,4,2,34,0,9,0,4,0,0,0,49,5,0,1,0,0,1,0,0,7,0,56,60
ARXT-U.S. ARMY MILITARY SURFACE DEPLOYMENT AND DISTRIBUTION COMMAND,0,0,0,0,0,0,0,0,0,0,0,0,0,0,0,0,0,0,0,0,0,0,0,0,0,0,1,0,0,0,1,0,0,0,0,0,0,0,0,0,0,1,1
ARXX-MATERIEL READINESS ACTIVITIES,0,0,0,0,0,0,0,0,0,0,0,0,0,0,0,0,0,0,0,0,0,0,0,0,0,0,0,0,0,0,0,0,0,0,0,0,0,0,0,0,0,0,0
AU00-FEDERAL LABOR RELATIONS AUTHORITY,0,0,0,0,0,0,0,0,0,0,0,0,0,0,0,0,0,0,0,0,0,0,0,0,0,0,0,0,0,0,0,0,0,0,0,0,0,0,0,0,0,0,0
AW00-ARCTIC RESEARCH COMMISSION,0,0,0,0,0,0,0,0,0,0,0,0,0,0,0,0,0,0,0,0,0,0,0,0,0,0,0,0,0,0,0,0,0,0,0,0,0,0,0,0,0,0,0
BD00-MERIT SYSTEMS PROTECTION BOARD,0,0,0,0,0,0,0,0,0,0,0,0,0,0,0,0,0,0,0,0,0,0,0,1,0,0,0,0,0,0,1,0,0,0,0,0,0,0,0,0,0,1,1
BF00-DEFENSE NUCLEAR FACILITIES SAFETY BOARD,0,0,0,0,0,0,0,0,0,0,0,0,0,0,0,0,0,0,0,0,0,0,0,0,0,0,0,0,0,0,0,0,0,0,0,1,0,0,0,1,0,1,1
BG00-PENSION BENEFIT GUARANTY CORPORATION,0,0,0,0,0,0,0,0,0,0,0,0,0,0,0,0,0,0,0,0,0,0,1,0,0,0,0,0,0,0,1,0,0,2,0,0,1,0,0,3,0,4,4
BO00-OFFICE OF MANAGEMENT AND BUDGET,0,0,0,0,0,0,0,0,0,0,0,0,0,0,0,0,0,0,0,0,0,0,2,0,0,0,0,0,0,0,2,0,1,1,0,0,0,0,0,2,0,4,4
BT00-ARCHITECTURAL AND TRANSPORTATION BARRIERS COMPLIANCE BOARD,0,0,0,0,0,0,0,0,0,0,0,0,0,0,0,0,0,0,0,0,0,0,0,0,0,0,0,0,0,0,0,0,0,0,0,0,0,0,0,0,0,0,0
BW00-NUCLEAR WASTE TECHNICAL REVIEW BOARD,0,0,0,0,0,0,0,0,0,0,0,0,0,0,0,0,0,0,0,0,0,0,0,0,0,0,0,0,0,0,0,0,0,0,0,0,0,0,0,0,0,0,0
BZ00-CHRISTOPHER COLUMBUS FELLOWSHIP FOUNDATION,0,0,0,0,0,0,0,0,0,0,0,0,0,0,0,0,0,0,0,0,0,0,0,0,0,0,0,0,0,0,0,0,0,0,0,0,0,0,0,0,0,0,0
CC00-COMMISSION ON CIVIL RIGHTS,0,0,0,0,0,0,0,0,0,0,0,0,0,0,0,0,0,0,0,0,0,2,0,1,0,0,0,0,0,0,3,0,0,0,0,0,0,0,0,0,0,3,3
CE00-COUNCIL OF ECONOMIC ADVISERS,0,0,0,0,0,0,0,0,0,0,0,0,0,0,0,0,0,0,0,0,0,0,0,0,0,0,0,0,0,0,0,0,0,0,0,0,0,0,0,0,0,0,0
CF00-COMMISSION OF FINE ARTS,0,0,0,0,0,0,0,0,0,0,0,0,0,0,0,0,0,0,0,0,0,0,0,0,0,0,0,0,0,0,0,0,0,0,0,0,0,0,0,0,0,0,0
CM33-TECHNOLOGY ADMINISTRATION,0,0,0,0,0,0,0,0,0,0,0,0,0,0,0,0,0,0,0,0,0,0,0,0,0,0,0,0,0,0,0,0,0,0,0,0,0,0,0,0,0,0,0
CM51-OFFICE OF THE SECRETARY,4,1,0,0,0,0,0,0,0,5,0,0,0,0,0,0,0,0,0,0,5,0,1,2,0,0,0,0,0,0,3,0,0,0,0,0,0,0,0,0,0,3,8
CM52-ECONOMIC DEVELOPMENT ADMINISTRATION,0,0,0,0,0,0,0,0,0,0,0,0,0,0,0,0,0,0,0,0,0,0,0,0,0,0,0,0,0,0,0,0,0,0,0,0,0,0,0,0,0,0,0
CM53-BUREAU OF ECONOMIC ANALYSIS,1,0,0,0,0,0,0,0,0,1,0,0,0,0,0,0,0,0,0,0,1,0,5,0,0,0,0,0,0,0,5,0,0,0,0,0,0,0,0,0,0,5,6
