HSAE-OFFICE OF THE INSPECTOR GENERAL,2,0,0,0,0,0,0,0,0,0,2,0,0,0,0,0,0,0,0,0,0,0,2,0,0,0,0,0,0,0,2,0,0,2,0,0,0,0,0,0,0,0,0,0,0,2,4
HSBB-BUREAU OF IMMIGRATION AND CUSTOMS ENFORCEMENT,10,0,0,0,0,0,0,0,0,0,10,0,0,0,0,0,0,0,0,0,0,0,10,4,35,3,0,0,0,0,0,0,0,42,1,0,0,0,2,0,0,0,0,3,0,45,55
HSBC-TRANSPORTATION SECURITY ADMINISTRATION,0,0,0,0,0,0,0,0,0,0,0,0,0,0,0,0,0,0,0,0,0,0,0,0,0,0,0,0,0,629,0,0,0,629,0,0,0,0,0,0,8,0,0,8,0,637,637
HSBD-BUREAU OF CUSTOMS AND BORDER PROTECTION,2,5,0,0,0,0,0,0,0,0,7,0,0,0,0,0,0,0,0,0,0,0,7,0,119,1,0,0,0,2,0,0,0,122,1,0,0,0,0,0,0,0,0,1,0,123,130
HSBE-FEDERAL LAW ENFORCEMENT TRAINING CENTERS,0,0,0,0,0,0,0,0,0,0,0,0,0,0,0,0,0,0,0,0,0,0,0,0,1,0,0,0,0,0,0,0,0,1,1,0,0,0,0,0,0,0,0,1,0,2,2
HSCA-NATIONAL PROTECTION AND PROGRAMS DIRECTORATE,2,2,0,0,0,0,1,0,0,0,5,0,0,0,0,0,0,0,0,0,0,0,5,1,3,0,0,0,0,6,0,0,0,10,2,0,0,0,0,0,0,0,0,2,0,12,17
HSCB-FEDERAL EMERGENCY MANAGEMENT AGENCY,3,2,0,0,0,0,0,0,0,0,5,0,0,0,0,0,0,0,0,0,0,0,5,1,11,5,0,3,0,0,1,0,0,21,1,0,0,0,0,0,49,0,0,50,0,71,76
HSDA-DOMESTIC NUCLEAR DETECTION OFFICE,2,2,0,0,0,0,0,0,0,0,4,0,0,0,0,0,0,0,0,0,0,0,4,0,1,1,0,0,0,1,0,0,0,3,2,0,0,0,0,0,0,0,0,2,0,5,9
HSFA-OFFICE OF THE UNDER SECRETARY FOR SCIENCE AND TECHNOLOGY,0,0,0,0,0,0,0,0,0,0,0,0,0,0,0,0,0,0,0,0,0,0,0,0,3,0,0,0,0,0,0,0,0,3,0,1,0,0,0,0,0,0,0,1,0,4,4
HT00-HARRY S. TRUMAN SCHOLARSHIP FOUNDATION,0,0,0,0,0,0,0,0,0,0,0,0,0,0,0,0,0,0,0,0,0,0,0,0,0,0,0,0,0,0,0,0,0,0,0,0,0,0,0,0,0,0,0,0,0,0,0
HU**-UNSPECIFIED,0,0,0,0,0,0,0,0,0,0,0,0,0,0,0,0,0,0,0,0,0,0,0,1,0,0,0,0,0,0,0,0,0,1,0,0,0,0,0,0,0,0,0,0,0,1,1
HU01-OFFICE OF THE SENIOR COORDINATOR FOR NEW ENGLAND,0,0,0,0,0,0,0,0,0,0,0,0,0,0,0,0,0,0,0,0,0,0,0,0,0,1,0,0,0,0,0,0,0,1,0,0,0,0,0,0,0,0,0,0,0,1,1
HU02-OFFICE OF THE SENIOR COORDINATOR FOR NEW YORK/NEW JERSEY,0,0,0,0,0,0,0,0,0,0,0,0,0,0,0,0,0,0,0,0,0,0,0,0,1,0,0,0,0,0,0,0,0,1,0,0,0,0,0,0,0,0,0,0,0,1,1
HU03-OFFICE OF THE SENIOR COORDINATOR FOR MID-ATLANTIC,0,0,0,0,0,0,0,0,0,0,0,0,0,0,0,0,0,0,0,0,0,0,0,0,2,0,0,0,0,0,0,0,0,2,0,0,0,0,0,0,0,0,0,0,0,2,2
HU04-OFFICE OF THE SENIOR COORDINATOR FOR SOUTHEAST/CARIBBEAN,0,0,0,0,0,0,0,0,0,0,0,0,0,0,0,0,0,0,0,0,0,0,0,1,1,0,0,0,0,0,0,0,0,2,0,0,0,0,0,0,0,0,0,0,0,2,2
HU05-OFFICE OF THE SENIOR COORDINATOR FOR MIDWEST,0,0,0,0,0,0,0,0,0,0,0,0,0,0,0,0,0,0,0,0,0,0,0,0,0,0,0,0,0,0,0,0,0,0,3,0,0,0,0,0,0,0,0,3,0,3,3
HU06-OFFICE OF THE SENIOR COORDINATOR FOR SOUTHWEST,0,0,0,0,0,0,0,0,0,0,0,0,0,0,0,0,0,0,0,0,0,0,0,0,1,0,0,0,0,0,0,0,0,1,0,0,0,0,0,0,0,0,0,0,0,1,1
HU07-OFFICE OF THE SENIOR COORDINATOR FOR GREAT PLAINS,0,0,0,0,0,0,0,0,0,0,0,0,0,0,0,0,0,0,0,0,0,0,0,0,0,0,0,0,0,0,0,0,0,0,0,0,0,0,0,0,0,0,0,0,0,0,0
HU08-OFFICE OF THE SENIOR COORDINATOR FOR ROCKY MOUNTAINS,1,0,0,0,0,0,0,0,0,0,1,0,0,0,0,0,0,0,0,0,0,0,1,0,0,0,0,0,0,0,0,0,0,0,0,0,0,0,0,0,0,0,0,0,0,0,1
HU09-OFFICE OF THE SENIOR COORDINATOR FOR PACIFIC/HAWAII,0,0,0,0,0,0,0,0,0,0,0,0,0,0,0,0,0,0,0,0,0,0,0,0,4,0,0,0,0,0,0,0,0,4,2,0,0,0,0,0,0,0,0,2,0,6,6
HU10-OFFICE OF THE SENIOR COORDINATOR FOR NORTHWEST/ALASKA,0,0,0,0,0,0,0,0,0,0,0,0,0,0,0,0,0,0,0,0,0,0,0,0,0,0,0,0,0,0,0,0,0,0,0,0,0,0,0,0,0,0,0,0,0,0,0
HUAA-OFFICE OF THE SECRETARY OF HOUSING AND URBAN DEVELOPMENT,0,0,0,0,0,0,0,0,0,0,0,0,0,0,0,0,0,0,0,0,0,0,0,0,0,0,0,0,0,0,0,0,0,0,0,0,0,1,0,0,0,0,0,1,0,1,1
HUBB-ASSISTANT SECRETARY FOR ADMINISTRATION,4,0,0,0,0,0,0,0,0,0,4,0,0,0,0,0,0,0,0,0,0,0,4,0,0,0,0,0,0,0,0,0,0,0,0,0,0,0,0,0,0,0,0,0,0,0,4
HUCC-OFFICE OF GENERAL COUNSEL,0,0,0,0,0,0,0,0,0,0,0,0,0,0,0,0,0,0,0,0,0,0,0,0,0,1,0,0,0,0,0,0,0,1,0,1,0,0,0,0,0,0,0,1,0,2,2
HUDD-ASSISTANT SECRETARY FOR COMMUNITY PLANNING AND DEVELOPMENT,0,0,0,0,0,0,0,0,0,0,0,0,0,0,0,0,0,0,0,0,0,0,0,0,2,0,0,0,0,0,0,0,0,2,0,0,0,0,0,0,0,0,0,0,0,2,2
HUEE-ASSISTANT SECRETARY FOR FAIR HOUSING AND EQUAL OPPORTUNITY,0,0,0,0,0,0,0,0,0,0,0,0,0,0,0,0,0,0,0,0,0,0,0,0,0,0,0,0,0,0,0,0,0,0,0,0,0,0,0,0,0,0,0,0,0,0,0
HUFF-OFFICE OF THE CHIEF FINANCIAL OFFICER,1,0,0,0,0,0,0,0,0,0,1,0,0,0,0,0,0,0,0,0,0,0,1,0,0,0,0,0,0,0,0,0,0,0,0,0,0,0,0,0,0,0,0,0,0,0,1
HUFH-OFFICE OF FEDERAL HOUSING ENTERPRISE OVERSIGHT,0,0,0,0,0,0,0,0,0,0,0,0,0,0,0,0,0,0,0,0,0,0,0,0,0,0,0,0,0,0,0,0,0,0,0,0,0,0,0,0,0,0,0,0,0,0,0
HUGG-OFFICE OF INSPECTOR GENERAL,0,0,0,0,0,0,0,0,0,0,0,0,0,0,0,0,0,0,0,0,0,0,0,0,0,0,0,0,0,0,0,0,0,0,0,0,0,0,0,0,0,0,0,0,0,0,0
HUII-OFFICE OF DEPARTMENTAL OPERATIONS AND COORDINATION,0,0,0,0,0,0,0,0,0,0,0,0,0,0,0,0,0,0,0,0,0,0,0,0,0,0,0,0,0,0,0,0,0,0,0,0,0,0,0,0,0,0,0,0,0,0,0
HUJJ-ASSISTANT SECRETARY FOR CONGRESSIONAL AND INTERGOVERNMENTAL RELATIONS,0,0,0,0,0,0,0,0,0,0,0,0,0,0,0,0,0,0,0,0,0,0,0,0,0,0,0,0,0,0,0,0,0,0,0,0,0,0,0,0,0,0,0,0,0,0,0
HUKA-CENTER FOR FAITH-BASED AND COMMUNITY INITIATIVES,0,0,0,0,0,0,0,0,0,0,0,0,0,0,0,0,0,0,0,0,0,0,0,0,0,0,0,0,0,0,0,0,0,0,0,0,0,0,0,0,0,0,0,0,0,0,0
HUKK-OFFICE OF FIELD POLICY AND MANAGEMENT,0,0,0,0,0,0,0,0,0,0,0,0,0,0,0,0,0,0,0,0,0,0,0,0,0,0,0,0,0,0,0,0,0,0,0,0,0,0,0,0,0,0,0,0,0,0,0
HULL-OFFICE OF HEALTHY HOMES AND LEAD HAZARD CONTROL,0,0,0,0,0,0,0,0,0,0,0,0,0,0,0,0,0,0,0,0,0,0,0,0,2,0,0,0,0,0,0,0,0,2,0,0,0,0,0,0,0,0,0,0,0,2,2
HUMM-ASSISTANT SECRETARY FOR HOUSING--FEDERAL HOUSING COMMISSIONER,2,2,0,0,0,0,0,0,0,0,4,0,0,0,0,0,0,0,0,0,0,0,4,0,6,0,0,1,0,0,0,0,0,7,0,0,0,0,0,0,0,0,0,0,0,7,11
HUNN-OFFICE OF THE CHIEF PROCUREMENT OFFICER,3,1,0,0,0,0,0,0,0,0,4,0,0,0,0,0,0,0,0,0,0,0,4,0,1,0,0,0,0,0,0,0,0,1,0,0,0,0,0,0,0,0,0,0,0,1,5
HUPP-ASSISTANT SECRETARY FOR PUBLIC AND INDIAN HOUSING,0,0,0,0,0,0,0,0,0,0,0,0,0,0,0,0,0,0,0,0,0,0,0,0,0,0,0,0,0,0,0,0,0,0,0,0,0,0,0,0,0,0,0,0,0,0,0
HUQQ-OFFICE OF THE CHIEF INFORMATION OFFICER,0,0,0,0,0,0,0,0,0,0,0,0,0,0,0,0,0,0,0,0,0,0,0,0,0,0,0,0,0,0,0,0,0,0,0,0,0,0,0,0,0,0,0,0,0,0,0
HURR-ASSISTANT SECRETARY FOR POLICY DEVELOPMENT AND RESEARCH,0,0,0,0,0,0,0,0,0,0,0,0,0,0,0,0,0,0,0,0,0,0,0,0,1,0,0,1,0,0,0,0,0,2,0,0,0,0,0,0,0,0,0,0,0,2,2
HUTT-GOVERNMENT NATIONAL MORTGAGE ASSOCIATION (GINNIE MAE),1,0,0,0,0,0,0,0,0,0,1,0,0,0,0,0,0,0,0,0,0,0,1,0,2,0,0,0,0,0,0,0,0,2,0,0,0,0,0,0,0,0,0,0,0,2,3
HUUU-OFFICE OF DEPARTMENTAL EQUAL EMPLOYMENT OPPORTUNITY,0,0,0,0,0,0,0,0,0,0,0,0,0,0,0,0,0,0,0,0,0,0,0,0,0,0,0,0,0,0,0,0,0,0,0,0,0,0,0,0,0,0,0,0,0,0,0
HUWW-ASSISTANT SECRETARY FOR PUBLIC AFFAIRS,0,0,0,0,0,0,0,0,0,0,0,0,0,0,0,0,0,0,0,0,0,0,0,0,0,0,0,0,0,0,0,0,0,0,0,0,0,1,0,0,1,0,0,2,0,2,2
HUXX-OFFICE OF STRATEGIC PLANNING AND MANAGEMENT,0,0,0,0,0,0,0,0,0,0,0,0,0,0,0,0,0,0,0,0,0,0,0,0,0,0,0,0,0,0,0,0,0,0,0,0,0,0,0,0,0,0,0,0,0,0,0
HUYY-OFFICE OF SUSTAINABLE HOUSING AND COMMUNTIES,0,0,0,0,0,0,0,0,0,0,0,0,0,0,0,0,0,0,0,0,0,0,0,0,0,0,0,0,0,0,0,0,0,0,0,0,0,0,0,0,0,0,0,0,0,0,0
HW00-U.S. INTERAGENCY COUNCIL ON HOMELESSNESS,0,0,0,0,0,0,0,0,0,0,0,0,0,0,0,0,0,0,0,0,0,0,0,0,0,0,0,0,0,0,0,0,0,0,0,0,0,0,0,0,0,0,0,0,0,0,0
IB00-BROADCASTING BOARD OF GOVERNORS,1,0,0,0,0,0,0,0,0,0,1,0,0,0,0,0,0,0,0,0,0,0,1,0,3,0,0,0,0,0,0,0,0,3,0,0,0,0,0,0,1,0,0,1,0,4,5
IF00-INTER-AMERICAN FOUNDATION,0,0,0,0,0,0,0,0,0,0,0,0,0,0,0,0,0,0,0,0,0,0,0,0,0,0,0,0,0,0,0,0,0,0,0,0,0,0,0,0,0,0,0,0,0,0,0
IG00-COUNCIL OF THE INSPECTORS GENERAL ON INTEGRITY AND EFFICIENCY,0,0,0,0,0,0,0,0,0,0,0,0,0,0,0,0,0,0,0,0,0,0,0,0,0,0,0,0,0,0,0,0,0,0,0,0,0,0,0,0,0,0,0,0,0,0,0
IN01-OFFICE OF THE SECRETARY OF THE INTERIOR,8,4,0,0,0,0,0,0,0,0,12,0,0,0,0,0,0,0,0,0,0,0,12,2,9,0,0,0,0,1,0,0,0,12,11,0,0,0,2,0,0,0,0,13,0,25,37
IN05-BUREAU OF LAND MANAGEMENT,14,7,0,0,0,0,0,0,0,0,21,0,0,0,0,0,0,0,0,0,0,0,21,4,13,1,0,0,0,1,1,0,0,20,12,25,0,0,1,0,3,0,0,41,0,61,82
IN06-INDIAN AFFAIRS,4,0,0,0,0,0,0,0,0,0,4,0,0,0,0,0,0,0,0,0,0,0,4,0,3,15,0,0,0,1,0,0,0,19,0,7,0,0,0,0,30,0,0,37,0,56,60
IN07-BUREAU OF RECLAMATION,3,5,0,0,0,0,0,0,0,0,8,0,0,0,0,0,0,0,0,0,0,0,8,0,26,0,0,0,0,2,0,0,0,28,1,4,0,0,0,0,0,0,0,5,0,33,41
IN08-GEOLOGICAL SURVEY,7,1,0,0,0,0,0,0,0,0,8,0,0,0,0,0,0,0,0,0,0,0,8,1,4,0,0,0,0,0,0,0,0,5,20,9,0,0,0,0,0,0,0,29,0,34,42
IN10-NATIONAL PARK SERVICE,9,4,0,0,0,0,0,0,0,0,13,0,0,0,0,0,0,0,0,0,0,0,13,2,14,0,0,1,0,5,0,0,0,22,62,39,0,0,5,0,0,0,0,106,0,128,141
IN15-U.S. FISH AND WILDLIFE SERVICE,1,2,0,0,0,0,0,0,0,0,3,0,0,0,0,0,0,0,0,0,0,0,3,1,12,3,0,1,0,1,0,0,0,18,17,10,0,0,0,0,0,0,0,27,0,45,48
IN21-OFFICE OF THE SOLICITOR,0,0,0,0,0,0,0,0,0,0,0,0,0,0,0,0,0,0,0,0,0,0,0,1,0,1,0,0,0,0,0,0,0,2,0,2,0,0,0,0,0,0,0,2,0,4,4
"IN22-OFFICE OF SURFACE MINING, RECLAMATION AND ENFORCEMENT",0,0,0,0,0,0,0,0,0,0,0,0,0,0,0,0,0,0,0,0,0,0,0,0,0,0,0,0,0,0,0,0,0,0,0,0,0,0,0,0,0,0,0,0,0,0,0
"IN23-BUREAU OF OCEAN ENERGY MANAGEMENT, REGULATION, AND ENFORCEMENT",0,0,0,0,0,0,0,0,0,0,0,0,0,0,0,0,0,0,0,0,0,0,0,0,0,0,0,0,0,0,0,0,0,0,0,0,0,0,0,0,0,0,0,0,0,0,0
IN24-OFFICE OF THE INSPECTOR GENERAL,0,0,0,0,0,0,0,0,0,0,0,0,0,0,0,0,0,0,0,0,0,0,0,0,0,0,0,0,0,0,0,0,0,0,0,0,0,0,0,0,0,0,0,0,0,0,0
IN26-BUREAU OF SAFETY AND ENVIRONMENTAL ENFORCEMENT,1,0,0,0,0,0,0,0,0,0,1,0,0,0,0,0,0,0,0,0,0,0,1,1,4,0,0,0,0,0,0,0,0,5,0,0,0,0,0,0,0,0,0,0,0,5,6
IN27-BUREAU OF OCEAN ENERGY MANAGEMENT,3,0,0,0,0,0,0,0,0,0,3,0,0,0,0,0,0,0,0,0,0,0,3,0,2,0,0,0,0,0,0,0,0,2,0,0,0,0,0,0,0,0,0,0,0,2,5
JL03-U.S. TAX COURT,0,0,0,0,0,0,0,0,0,0,0,0,0,0,0,0,0,0,0,0,0,0,0,0,0,0,0,0,0,0,0,0,0,0,0,0,0,0,0,0,0,0,0,0,0,0,0
KS00-CORPORATION FOR NATIONAL AND COMMUNITY SERVICE,0,0,0,0,0,0,0,0,0,0,0,0,0,0,0,0,0,0,0,0,0,0,0,0,0,0,0,0,0,10,0,0,0,10,0,0,0,0,0,0,3,0,0,3,0,13,13
LF00-FEDERAL ELECTION COMMISSION,0,0,0,0,0,0,0,0,0,0,0,0,0,0,0,0,0,0,0,0,0,0,0,0,0,0,0,0,0,2,0,0,0,2,0,0,0,0,0,0,0,0,0,0,0,2,2
LP00-GOVERNMENT PRINTING OFFICE,1,0,0,0,0,0,0,0,0,0,1,0,0,0,0,0,0,0,0,0,0,0,1,0,6,0,0,0,0,0,0,0,0,6,0,0,0,0,0,0,0,0,0,0,0,6,7
LT00-U.S. TAX COURT,0,0,0,0,0,0,0,0,0,0,0,0,0,0,0,0,0,0,0,0,0,0,0,0,0,0,0,0,0,0,0,0,0,0,0,0,0,0,0,0,1,0,0,1,0,1,1
MA00-MARINE MAMMAL COMMISSION,0,0,0,0,0,0,0,0,0,0,0,0,0,0,0,0,0,0,0,0,0,0,0,0,0,0,0,0,0,0,0,0,0,0,0,0,0,0,0,0,0,0,0,0,0,0,0
MC00-FEDERAL MARITIME COMMISSION,1,0,0,0,0,0,0,0,0,0,1,0,0,0,0,0,0,0,0,0,0,0,1,0,0,1,0,0,0,0,0,0,0,1,0,0,0,0,0,0,0,0,0,0,0,1,2
MI00-MILLENNIUM CHALLENGE CORPORATION,0,0,0,0,0,0,0,0,0,0,0,0,0,0,0,0,0,0,0,0,0,0,0,0,1,0,0,0,0,0,0,0,0,1,3,0,0,0,1,0,1,0,0,5,0,6,6
NF00-NATIONAL SCIENCE FOUNDATION,2,1,0,0,0,0,0,0,0,0,3,0,0,0,0,0,0,0,0,0,0,0,3,0,0,0,0,1,0,1,1,0,0,3,0,0,0,0,0,0,8,1,0,9,0,12,15
NK00-NATIONAL COUNCIL ON DISABILITY,0,0,0,0,0,0,0,0,0,0,0,0,0,0,0,0,0,0,0,0,0,0,0,0,0,0,0,0,0,0,0,0,0,0,0,0,0,0,0,0,0,0,0,0,0,0,0
NL00-NATIONAL LABOR RELATIONS BOARD,1,1,0,0,0,0,0,0,0,0,2,0,0,0,0,0,0,0,0,0,0,0,2,0,3,5,0,0,0,0,0,0,0,8,0,7,0,0,0,0,0,0,0,7,0,15,17
NM00-NATIONAL MEDIATION BOARD,1,0,0,0,0,0,0,0,0,0,1,0,0,0,0,0,0,0,0,0,0,0,1,0,0,0,0,0,0,0,0,0,0,0,0,0,0,0,0,0,0,0,0,0,0,0,1
"NN10-HEADQUARTERS, NASA",0,2,0,0,0,0,0,0,0,0,2,0,0,0,0,0,0,0,0,0,0,0,2,0,1,0,0,0,0,0,0,0,0,1,0,0,0,0,0,0,0,0,0,0,0,1,3
NN21-AMES RESEARCH CENTER,0,0,0,0,0,0,0,0,0,0,0,0,0,0,0,0,0,0,0,0,0,0,0,0,4,0,0,0,0,0,0,0,0,4,1,0,0,0,0,0,0,0,0,1,0,5,5
NN22-JOHN GLENN RESEARCH CENTER AT LEWIS FIELD,0,0,0,0,0,0,0,0,0,0,0,0,0,0,0,0,0,0,0,0,0,0,0,0,1,0,0,0,0,0,0,0,0,1,0,0,0,0,0,0,0,0,0,0,0,1,1
NN23-LANGLEY RESEARCH CENTER,0,0,0,0,0,0,0,0,0,0,0,0,0,0,0,0,0,0,0,0,0,0,0,0,1,2,0,1,0,0,0,0,0,4,0,0,0,0,0,0,0,0,0,0,0,4,4
NN24-DRYDEN FLIGHT RESEARCH CENTER,0,0,0,0,0,0,0,0,0,0,0,0,0,0,0,0,0,0,0,0,0,0,0,0,2,0,0,0,0,0,0,0,0,2,0,0,0,0,0,0,0,0,0,0,0,2,2
NN51-GODDARD SPACE FLIGHT CENTER,1,0,0,0,0,0,0,0,0,0,1,0,0,0,0,0,0,0,0,0,0,0,1,1,5,0,0,6,0,0,0,0,0,12,0,0,0,0,1,0,1,0,0,2,0,14,15
NN62-GEORGE C. MARSHALL SPACE FLIGHT CENTER,0,1,0,0,0,0,0,0,0,0,1,0,0,0,0,0,0,0,0,0,0,0,1,0,5,1,0,0,0,1,0,0,0,7,0,0,0,0,0,0,0,0,0,0,0,7,8
NN64-JOHN C. STENNIS SPACE CENTER,1,0,0,0,0,0,0,0,0,0,1,0,0,0,0,0,0,0,0,0,0,0,1,0,0,0,0,0,0,0,0,0,0,0,0,0,0,0,0,0,0,0,0,0,0,0,1
NN72-LYNDON B. JOHNSON SPACE CENTER,2,0,0,0,0,0,0,0,0,0,2,0,0,0,0,0,0,0,0,0,0,0,2,0,1,0,0,0,0,0,0,0,0,1,0,0,0,0,0,0,0,0,0,0,0,1,3
NN76-JOHN F. KENNEDY SPACE CENTER,0,0,0,0,0,0,0,0,0,0,0,0,0,0,0,0,0,0,0,0,0,0,0,0,0,0,0,1,0,0,0,0,0,1,0,0,0,0,0,0,0,0,0,0,0,1,1
NP00-NATIONAL CAPITAL PLANNING COMMISSION,0,0,0,0,0,0,0,0,0,0,0,0,0,0,0,0,0,0,0,0,0,0,0,0,2,0,0,0,0,0,0,0,0,2,0,0,0,0,0,0,0,0,0,0,0,2,2
NQ00-NATIONAL ARCHIVES AND RECORDS ADMINISTRATION,0,0,0,0,0,0,0,0,0,0,0,0,0,0,0,0,0,0,0,0,0,0,0,1,2,0,0,0,0,1,0,0,0,4,5,0,0,0,5,0,0,0,0,10,0,14,14
NS00-NATIONAL SECURITY COUNCIL,0,0,0,0,0,0,0,0,0,0,0,0,0,0,0,0,0,0,0,0,0,0,0,0,0,0,0,0,0,0,0,0,0,0,0,2,0,0,0,0,0,0,0,2,0,2,2
NU00-NUCLEAR REGULATORY COMMISSION,0,0,0,0,0,0,0,0,0,0,0,0,0,0,0,0,0,0,0,0,0,0,0,0,0,0,0,0,0,0,0,0,0,0,0,0,0,0,0,0,4,0,0,4,0,4,4
NV11-IMMEDIATE OFFICE OF THE CHIEF OF NAVAL OPERATIONS,4,1,0,0,0,0,0,0,0,0,5,0,0,0,0,0,0,0,0,0,0,0,5,2,17,0,0,0,0,3,0,0,0,22,3,24,0,0,0,0,0,0,0,27,0,49,54
"NV12-ASSISTANT FOR ADMINISTRATION, UNDER SECRETARY OF THE NAVY",7,1,0,0,0,0,0,0,0,0,8,0,0,0,0,0,0,0,0,0,0,0,8,0,12,11,0,7,0,2,0,0,0,32,1,1,0,0,0,0,1,0,0,3,0,35,43
NV14-OFFICE OF NAVAL RESEARCH,0,0,0,0,0,0,0,0,0,0,0,0,0,0,0,0,0,0,0,0,0,0,0,1,12,1,0,0,0,1,0,0,0,15,0,0,0,0,0,0,0,0,0,0,0,15,15
NV15-NAVAL INTELLIGENCE COMMAND,0,0,0,0,0,0,0,0,0,0,0,0,0,0,0,0,0,0,0,0,0,0,0,0,0,0,0,0,0,14,0,0,0,14,0,0,0,0,0,0,0,0,0,0,0,14,14
NV18-NAVAL MEDICAL COMMAND,6,3,0,0,0,0,0,0,0,0,9,0,0,0,0,0,0,0,0,0,0,1,10,2,55,1,0,0,0,6,0,0,0,64,13,3,0,0,0,0,0,0,0,16,0,80,90
NV19-NAVAL AIR SYSTEMS COMMAND,5,5,0,0,0,0,0,0,0,0,10,0,0,0,0,0,0,0,0,0,0,0,10,4,113,3,0,1,0,14,0,0,0,135,23,0,0,0,0,0,0,0,0,23,0,158,168
NV22-BUREAU OF NAVAL PERSONNEL,0,0,0,0,0,0,0,0,0,0,0,0,0,0,0,0,0,0,0,0,0,0,0,0,10,0,0,0,0,1,0,0,0,11,0,0,0,0,0,0,0,0,0,0,0,11,11
NV23-NAVAL SUPPLY SYSTEMS COMMAND,9,0,0,0,0,0,0,0,0,0,9,0,0,0,0,0,0,0,0,0,0,0,9,1,18,1,0,0,0,6,0,0,0,26,3,4,0,0,0,0,0,0,0,7,0,33,42
NV24-NAVAL SEA SYSTEMS COMMAND,19,6,0,0,0,0,1,0,0,0,26,0,0,0,0,0,0,0,0,0,0,0,26,6,106,7,0,0,0,10,0,0,0,129,4,0,0,0,1,0,0,0,0,5,0,134,160
NV25-NAVAL FACILITIES ENGINEERING COMMAND,5,3,0,0,0,0,0,0,0,0,8,0,0,0,0,0,0,0,0,0,0,0,8,1,45,0,0,3,0,5,0,0,0,54,4,2,0,0,0,0,0,0,0,6,0,60,68
NV27-U.S. MARINE CORPS,25,3,0,0,0,0,0,0,0,0,28,0,0,0,0,0,0,0,0,0,0,0,28,11,113,7,0,0,0,43,0,0,0,174,24,2,0,0,0,0,1,0,0,27,0,201,229
NV30-STRATEGIC SYSTEMS PROGRAMS OFFICE,0,0,0,0,0,0,0,0,0,0,0,0,0,0,0,0,0,0,0,0,0,0,0,0,0,0,0,0,0,2,0,0,0,2,1,0,0,0,0,0,0,0,0,1,0,3,3
NV33-MILITARY SEALIFT COMMAND,0,0,0,0,0,0,0,0,0,0,0,0,0,0,0,0,0,0,0,0,0,0,0,1,7,42,0,0,0,2,0,0,0,52,1,2,0,0,0,0,0,0,0,3,0,55,55
NV39-SPACE AND NAVAL WARFARE SYSTEMS COMMAND,3,1,0,0,0,0,1,0,0,0,5,0,0,0,0,0,0,0,0,0,0,0,5,3,61,6,0,0,0,5,0,0,0,75,10,1,0,0,0,0,0,0,0,11,0,86,91
NV41-NAVY SYSTEMS MANAGEMENT ACTIVITY,0,0,0,0,0,0,0,0,0,0,0,0,0,0,0,0,0,0,0,0,0,0,0,0,0,0,0,0,0,0,0,0,0,0,0,0,0,0,0,0,0,0,0,0,0,0,0
"NV52-COMMANDER, NAVY INSTALLATIONS",3,3,0,0,0,0,0,0,0,0,6,0,0,0,0,0,0,0,0,0,0,0,6,4,51,0,0,0,0,16,0,0,0,71,11,13,0,0,0,0,0,0,0,24,0,95,101
"NV60-U.S. ATLANTIC FLEET, COMMANDER IN CHIEF",0,0,0,0,0,0,1,0,0,0,1,0,0,0,0,0,0,0,0,0,0,0,1,1,56,0,0,0,0,44,0,0,0,101,2,1,0,0,0,0,0,0,0,3,0,104,105
NV69-NAVAL SECURITY GROUP COMMAND,0,0,0,0,0,0,0,0,0,0,0,0,0,0,0,0,0,0,0,0,0,0,0,0,0,0,0,0,0,0,0,0,0,0,0,0,0,0,0,0,0,0,0,0,0,0,0
"NV70-U.S. PACIFIC FLEET, COMMANDER IN CHIEF",2,0,0,0,0,0,0,0,0,0,2,0,0,0,0,0,0,0,0,0,0,0,2,2,23,0,0,10,0,7,0,0,0,42,45,0,0,0,0,0,0,0,0,45,0,87,89
NV72-NAVAL RESERVE FORCE,0,0,0,0,0,0,0,0,0,0,0,0,0,0,0,0,0,0,0,0,0,0,0,0,2,0,0,0,0,1,0,0,0,3,0,0,0,0,0,0,0,0,0,0,0,3,3
NV74-NAVAL SPECIAL WARFARE COMMAND,0,0,0,0,0,0,0,0,0,0,0,0,0,0,0,0,0,0,0,0,0,0,0,0,9,0,0,0,0,2,0,0,0,11,4,0,0,0,0,0,0,0,0,4,0,15,15
NV76-NAVAL EDUCATION AND TRAINING COMMAND,0,0,0,0,0,0,0,0,0,0,0,0,0,0,0,0,0,0,0,0,0,0,0,1,124,2,0,0,0,12,0,0,0,139,3,0,0,0,0,0,0,0,0,3,0,142,142
OM00-OFFICE OF PERSONNEL MANAGEMENT,7,7,0,0,0,0,0,0,0,0,14,0,0,0,0,0,0,0,0,0,0,0,14,3,13,3,0,1,0,3,0,0,0,23,2,0,0,2,0,0,0,0,0,4,0,27,41
OS00-OCCUPATIONAL SAFETY AND HEALTH REVIEW COMMISSION,0,0,0,0,0,0,0,0,0,0,0,0,0,0,0,0,0,0,0,0,0,0,0,0,0,0,0,0,0,0,0,0,0,0,0,0,0,0,0,0,0,0,0,0,0,0,0
PU00-PEACE CORPS,0,0,0,0,0,0,0,0,0,0,0,0,0,0,0,0,0,0,0,0,0,0,0,0,0,0,0,0,0,0,0,0,0,0,0,0,0,0,0,0,15,0,0,15,0,15,15
QQ00-OFFICE OF NATIONAL DRUG CONTROL POLICY,0,0,0,0,0,0,0,0,0,0,0,0,0,0,0,0,0,0,0,0,0,0,0,0,0,0,0,0,0,0,0,0,0,0,0,0,0,0,0,0,0,0,0,0,0,0,0
RE00-OFFICE OF NAVAJO AND HOPI INDIAN RELOCATION,0,0,0,0,0,0,0,0,0,0,0,0,0,0,0,0,0,0,0,0,0,0,0,0,0,0,0,0,0,0,0,0,0,0,0,0,0,0,0,0,0,0,0,0,0,0,0
RF00-FEDERAL RETIREMENT THRIFT INVESTMENT BOARD,1,0,0,0,0,0,1,0,0,0,2,0,0,0,0,0,0,0,0,0,0,0,2,1,3,0,0,0,0,3,0,0,0,7,0,0,0,0,0,0,0,0,0,0,0,7,9
RH00-ARMED FORCES RETIREMENT HOME,0,0,0,0,0,0,0,0,0,0,0,0,0,0,0,0,0,0,0,0,0,0,0,0,0,0,0,0,0,0,0,0,0,0,0,0,0,0,0,0,0,0,0,0,0,0,0
RO**-UNSPECIFIED,0,0,0,0,0,0,0,0,0,0,0,0,0,0,0,0,0,0,0,0,0,0,0,0,0,0,0,0,0,0,0,0,0,0,0,0,0,0,0,0,0,0,0,0,0,0,0
RO00-MEDICAID AND CHIP PAYMENT AND ACCESS COMMISSION,0,0,0,0,0,0,0,0,0,0,0,0,0,0,0,0,0,0,0,0,0,0,0,0,0,0,0,0,0,0,0,0,0,0,0,0,0,0,0,0,2,0,0,2,0,2,2
RR00-RAILROAD RETIREMENT BOARD,0,3,0,0,0,0,0,0,0,0,3,0,0,0,0,0,0,0,0,0,0,0,3,1,5,0,0,0,0,0,0,0,0,6,0,0,0,0,0,0,0,0,0,0,0,6,9
RS00-FEDERAL MINE SAFETY AND HEALTH REVIEW COMMISSION,0,0,0,0,0,0,0,0,0,0,0,0,0,0,0,0,0,0,0,0,0,0,0,0,0,0,0,0,0,0,0,0,0,0,0,0,0,0,0,0,0,0,0,0,0,0,0
RZ00-RECOVERY ACT ACCOUNTABILITY & TRANSPARENCY BOARD,0,0,0,0,0,0,0,0,0,0,0,0,0,0,0,0,0,0,0,0,0,0,0,0,0,0,0,0,0,0,0,0,0,0,0,0,0,0,0,0,0,0,0,0,0,0,0
SB00-SMALL BUSINESS ADMINISTRATION,5,2,0,0,0,0,0,0,0,0,7,0,0,0,0,0,0,0,0,0,0,0,7,0,11,0,0,0,0,1,0,0,0,12,30,14,0,2,0,0,0,0,0,46,0,58,65
SE00-SECURITIES AND EXCHANGE COMMISSION,7,3,0,0,0,0,0,0,0,0,10,0,0,0,0,0,0,0,0,0,0,0,10,0,25,30,0,0,0,0,0,0,0,55,0,9,0,0,1,0,0,0,0,10,0,65,75
SK00-CONSUMER PRODUCT SAFETY COMMISSION,1,1,0,0,0,0,0,0,0,0,2,0,0,0,0,0,0,0,0,0,0,0,2,0,0,0,0,0,0,0,0,0,0,0,0,0,0,0,0,0,0,0,0,0,0,0,2
SM01-NATIONAL GALLERY OF ART,1,1,0,0,0,0,0,0,0,0,2,0,0,0,0,0,0,0,0,0,0,0,2,0,3,1,0,0,0,0,0,0,0,4,0,0,0,0,1,0,0,0,0,1,0,5,7
SM02-WOODROW WILSON INTERNATIONAL CENTER FOR SCHOLARS,0,0,0,0,0,0,0,0,0,0,0,0,0,0,0,0,0,0,0,0,0,0,0,0,0,0,0,0,0,0,0,0,0,0,0,0,0,0,0,0,0,0,0,0,0,0,0
SM03-SMITHSONIAN INSTITUTION (EXCEPT UNITS ADMINISTERED UNDER SEPARATE BOARDS OF TRUSTEES),0,1,0,0,0,0,0,0,0,0,1,0,0,0,0,0,0,0,0,0,0,0,1,0,10,2,0,0,0,0,0,0,0,12,6,0,0,0,0,0,0,0,0,6,0,18,19
SM04-JOHN F. KENNEDY CENTER FOR THE PERFORMING ARTS,0,0,0,0,0,0,0,0,0,0,0,0,0,0,0,0,0,0,0,0,0,0,0,0,0,0,0,0,0,0,0,0,0,0,0,0,0,0,0,0,0,0,0,0,0,0,0
SS00-SELECTIVE SERVICE SYSTEM,1,0,0,0,0,0,0,0,0,0,1,0,0,0,0,0,0,0,0,0,0,0,1,0,0,0,0,0,0,0,0,0,0,0,0,0,0,1,0,0,0,0,0,1,0,1,2
ST00-DEPARTMENT OF STATE,14,2,0,0,0,0,0,1,0,0,17,0,0,0,0,0,0,0,0,0,0,0,17,9,30,1,0,20,0,2,0,0,0,62,23,12,2,1,11,0,7,0,0,56,0,118,135
SZ00-SOCIAL SECURITY ADMINISTRATION,2,0,0,0,0,0,1,0,0,0,3,0,0,0,0,0,0,0,0,0,0,0,3,33,125,188,0,0,0,33,0,0,0,379,48,50,0,0,0,0,1,0,0,99,0,478,481
TB00-NATIONAL TRANSPORTATION SAFETY BOARD,0,0,0,0,0,0,0,0,0,0,0,0,0,0,0,0,0,0,0,0,0,0,0,0,2,0,0,0,0,0,0,0,0,2,0,0,0,0,0,0,0,0,0,0,0,2,2
TC00-U.S. INTERNATIONAL TRADE COMMISSION,0,0,0,0,0,0,0,0,0,0,0,0,0,0,0,0,0,0,0,0,0,0,0,0,0,2,0,0,0,0,0,0,0,2,0,0,0,2,0,1,1,0,0,4,0,6,6
TD01-OFFICE OF THE SECRETARY OF TRANSPORTATION,2,0,0,0,0,0,0,0,0,0,2,0,0,0,0,0,0,0,0,0,0,0,2,0,3,1,0,1,0,0,0,0,0,5,1,0,0,0,0,0,0,0,0,1,0,6,8
TD03-FEDERAL AVIATION ADMINISTRATION,0,0,0,0,0,0,0,0,0,0,0,0,0,0,0,0,0,0,0,0,0,0,0,0,0,0,0,0,0,322,0,0,0,322,0,0,0,0,0,0,91,0,0,91,0,413,413
TD04-FEDERAL HIGHWAY ADMINISTRATION,0,0,0,0,0,0,0,0,0,0,0,0,0,0,0,0,0,0,0,0,0,0,0,0,9,0,0,0,0,0,0,0,0,9,0,0,0,0,0,0,0,0,0,0,0,9,9
TD05-FEDERAL RAILROAD ADMINISTRATION,0,0,0,0,0,0,0,0,0,0,0,0,0,0,0,0,0,0,0,0,0,0,0,0,3,0,0,0,0,0,0,0,0,3,0,0,0,0,0,0,0,0,0,0,0,3,3
TD06-SAINT LAWRENCE SEAWAY DEVELOPMENT CORPORATION,0,0,0,0,0,0,0,0,0,0,0,0,0,0,0,0,0,0,0,0,0,0,0,0,4,0,0,0,0,0,0,0,0,4,0,0,0,0,0,0,0,0,0,0,0,4,4
TD09-FEDERAL TRANSIT ADMINISTRATION,0,0,0,0,0,0,0,0,0,0,0,0,0,0,0,0,0,0,0,0,0,0,0,0,0,0,0,0,0,0,0,0,0,0,0,0,0,0,0,0,0,0,0,0,0,0,0
TD10-NATIONAL HIGHWAY TRAFFIC SAFETY ADMINISTRATION,1,0,0,0,0,0,0,0,0,0,1,0,0,0,0,0,0,0,0,0,0,0,1,0,0,0,0,0,0,0,0,0,0,0,0,0,0,0,0,0,0,0,0,0,0,0,1
TD11-RESEARCH AND INNOVATIVE TECHNONOGY ADMINSTRATION,1,0,0,0,0,0,0,0,0,0,1,0,0,0,0,0,0,0,0,0,0,0,1,0,0,1,0,0,0,0,0,0,0,1,0,0,0,0,0,0,0,0,0,0,0,1,2
TD12-OFFICE OF INSPECTOR GENERAL,0,0,0,0,0,0,0,0,0,0,0,0,0,0,0,0,0,0,0,0,0,0,0,0,0,0,0,0,0,0,0,0,0,0,0,0,0,0,0,0,0,0,0,0,0,0,0
TD13-MARITIME ADMINISTRATION,0,0,0,0,0,0,0,0,0,0,0,0,0,0,0,0,0,0,0,0,0,0,0,0,5,0,0,0,0,0,0,0,0,5,0,0,0,0,0,0,0,0,0,0,0,5,5
TD15-SURFACE TRANSPORTATION BOARD,0,0,0,0,0,0,0,0,0,0,0,0,0,0,0,0,0,0,0,0,0,0,0,0,1,0,0,0,0,0,0,0,0,1,0,0,0,0,0,0,0,0,0,0,0,1,1
TD16-PIPELINE AND HAZARDOUS MATERIALS SAFETY ADMINISTRATION,1,0,0,0,0,0,0,0,0,0,1,0,0,0,0,0,0,0,0,0,0,0,1,0,2,1,0,3,0,1,0,0,0,7,0,0,0,0,0,0,0,0,0,0,0,7,8
TD17-FEDERAL MOTOR CARRIER SAFETY ADMINISTRATION,1,0,0,0,0,0,0,0,0,0,1,0,0,0,0,0,0,0,0,0,0,0,1,0,4,1,0,0,0,0,0,1,0,6,0,0,0,0,0,0,0,0,0,0,0,6,7
TN00-OFFICE OF THE U.S. TRADE REPRESENTATIVE,1,0,0,0,0,0,0,0,0,0,1,0,0,0,0,0,0,0,0,0,0,0,1,0,0,0,0,0,0,0,0,0,0,0,0,0,0,0,0,0,4,0,0,4,0,4,5
TR**-UNSPECIFIED,0,0,0,0,0,0,0,0,0,0,0,0,0,0,0,0,0,0,0,0,0,0,0,0,0,0,0,0,0,0,0,0,0,0,0,0,0,0,0,0,0,0,0,0,0,0,0
TR35-OFFICE OF THRIFT SUPERVISION,0,0,0,0,0,0,0,0,0,0,0,0,0,0,0,0,0,0,0,0,0,0,0,0,0,0,0,0,0,0,0,0,0,0,0,0,0,0,0,0,0,0,0,0,0,0,0
TR36-SPECIAL INSPECTOR GENERAL FOR THE TROUBLED ASSETS RELIEF PROGRAM (TARP),0,0,0,0,0,0,0,0,0,0,0,0,0,0,0,0,0,0,0,0,0,0,0,1,5,0,0,0,0,0,0,0,0,6,1,0,0,0,0,0,0,0,0,1,0,7,7
TR40-ALCOHOL AND TOBACCO TAX AND TRADE BUREAU,0,0,0,0,0,0,0,0,0,0,0,0,0,0,0,0,0,0,0,0,0,0,0,0,1,0,0,0,0,0,0,0,0,1,0,0,0,0,0,0,0,0,0,0,0,1,1
TR91-DEPARTMENTAL OFFICES,1,2,0,0,0,0,0,0,0,0,3,0,0,0,0,0,0,0,0,0,0,0,3,0,21,3,0,3,0,0,0,0,0,27,3,8,0,1,0,0,0,0,0,12,0,39,42
TR93-INTERNAL REVENUE SERVICE,0,1,0,0,0,0,0,1,0,0,2,0,0,0,0,0,0,0,0,0,0,0,2,3,90,16,0,1,0,7,0,0,0,117,5,24,0,0,0,0,1,0,0,30,0,147,149
TR95-OFFICE OF INSPECTOR GENERAL,0,0,0,0,0,0,0,0,0,0,0,0,0,0,0,0,0,0,0,0,0,0,0,0,1,0,0,0,0,0,0,0,0,1,0,0,0,0,0,0,0,0,0,0,0,1,1
TRAA-FINANCIAL MANAGEMENT SERVICE,1,0,0,0,0,0,0,0,0,0,1,0,0,0,0,0,0,0,0,0,0,0,1,0,1,0,0,0,0,0,0,0,0,1,0,0,0,0,0,0,0,0,0,0,0,1,2
TRAB-BUREAU OF THE PUBLIC DEBT,0,0,0,0,0,0,0,0,0,0,0,0,0,0,0,0,0,0,0,0,0,0,0,0,7,0,0,0,0,0,0,0,0,7,0,0,0,0,0,0,0,0,0,0,0,7,7
TRAD-U.S. MINT,1,0,0,0,0,0,0,0,0,0,1,0,0,0,0,0,0,0,0,0,0,0,1,0,0,0,0,0,0,0,0,0,0,0,0,0,0,0,0,0,0,0,0,0,0,0,1
TRAF-FINANCIAL CRIMES ENFORCEMENT NETWORK,1,0,0,0,0,0,0,1,0,0,2,0,0,0,0,0,0,0,0,0,0,0,2,0,1,0,0,0,0,0,0,0,0,1,6,0,0,0,0,0,0,0,0,6,0,7,9
TRAI-BUREAU OF ENGRAVING AND PRINTING,2,0,0,0,0,0,0,0,0,0,2,0,0,0,0,0,0,0,0,0,0,0,2,0,3,0,0,0,0,1,0,0,0,4,4,0,0,0,0,0,0,0,0,4,0,8,10
TRAJ-OFFICE OF THE COMPTROLLER OF THE CURRENCY,4,1,0,0,0,0,0,0,0,0,5,0,0,0,0,0,0,0,0,0,0,0,5,1,6,3,6,0,0,0,0,0,0,16,1,3,0,0,0,0,0,0,0,4,0,20,25
TRFD-BUREAU OF THE FISCAL SERVICE,0,0,0,0,0,0,0,0,0,0,0,0,0,0,0,0,0,0,0,0,0,0,0,0,0,0,0,0,0,0,0,0,0,0,0,0,0,0,0,0,0,0,0,0,0,0,0
TRTG-OFFICE OF THE INSPECTOR GENERAL FOR TAX ADMINISTRATION,0,0,0,0,0,0,0,0,0,0,0,0,0,0,0,0,0,0,0,0,0,0,0,0,0,0,0,0,0,0,0,0,0,0,0,0,0,0,0,0,0,0,0,0,0,0,0
TS00-OFFICE OF SCIENCE AND TECHNOLOGY POLICY,0,0,0,0,0,0,0,0,0,0,0,0,0,0,0,0,0,0,0,0,0,0,0,0,0,0,0,0,0,0,0,0,0,0,0,0,0,0,0,0,0,0,0,0,0,0,0
UJ00-JAPAN-UNITED STATES FRIENDSHIP COMMISSION,0,0,0,0,0,0,0,0,0,0,0,0,0,0,0,0,0,0,0,0,0,0,0,0,0,0,0,0,0,0,0,0,0,0,0,0,0,0,0,0,0,0,0,0,0,0,0
UT00-UTAH RECLAMATION MITIGATION AND CONSERVATION COMMISSION,0,0,0,0,0,0,0,0,0,0,0,0,0,0,0,0,0,0,0,0,0,0,0,0,0,0,0,0,0,0,0,0,0,0,0,0,0,0,0,0,0,0,0,0,0,0,0
VA**-UNSPECIFIED,0,0,0,0,0,0,0,0,0,0,0,0,0,0,0,0,0,0,0,0,0,0,0,0,0,0,0,0,0,0,0,0,0,0,0,0,0,0,0,0,0,0,0,0,0,0,0
VAAA-OFFICE OF THE SECRETARY,2,0,0,0,0,0,0,0,0,0,2,0,0,0,0,0,0,0,0,0,0,0,2,0,1,0,0,0,0,1,0,0,0,2,0,0,0,0,0,0,0,0,0,0,0,2,4
VAAD-BOARD OF VETERANS APPEALS,0,0,0,0,0,0,0,0,0,0,0,0,0,0,0,0,0,0,0,0,0,0,0,0,0,0,0,0,0,0,0,0,0,0,0,0,0,0,0,0,0,0,0,0,0,0,0
VAAE-GENERAL COUNSEL,1,1,0,0,0,0,0,0,0,0,2,0,0,0,0,0,0,0,0,0,0,0,2,1,0,2,0,0,0,0,0,0,0,3,0,0,0,0,0,0,0,0,0,0,0,3,5
VAAF-INSPECTOR GENERAL,1,0,0,0,0,0,0,0,0,0,1,0,0,0,0,0,0,0,0,0,0,0,1,0,0,0,0,0,0,1,0,0,0,1,0,0,0,0,0,0,0,0,0,0,0,1,2
VABA-IMMEDIATE OFFICE OF THE ASSISTANT SECRETARY FOR HUMAN RESOURCES AND ADMINISTRATION,0,0,0,0,0,0,0,0,0,0,0,0,0,0,0,0,0,0,0,0,0,0,0,0,0,0,0,0,0,0,0,0,0,0,0,0,0,0,3,0,0,0,0,3,0,3,3
VABC-ASSISTANT SECRETARY FOR HUMAN RESOURCES MANAGEMENT,2,1,0,0,0,0,0,0,0,0,3,0,0,0,0,0,0,0,0,0,0,0,3,0,0,0,0,0,0,0,0,0,0,0,0,0,0,0,0,0,0,0,0,0,0,0,3
VABD-ASSISTANT SECRETARY FOR DIVERSITY & INCLUSION,0,0,0,0,0,0,0,0,0,0,0,0,0,0,0,0,0,0,0,0,0,0,0,0,0,0,0,0,0,0,0,0,0,0,0,0,0,0,0,0,0,0,0,0,0,0,0
VABE-DEPUTY ASSISTANT SECRETARY FOR ADMINISTRATION,0,0,0,0,0,0,0,0,0,0,0,0,0,0,0,0,0,0,0,0,0,0,0,0,0,0,0,0,0,0,0,0,0,0,0,0,0,0,0,0,0,0,0,0,0,0,0
VABF-DEPUTY ASSISTANT SECRETARY FOR OFFICE OF RESOLUTION MANAGEMENT,0,0,0,0,0,0,0,0,0,0,0,0,0,0,0,0,0,0,0,0,0,0,0,0,1,0,0,0,0,0,0,0,0,1,0,0,0,0,0,0,0,0,0,0,0,1,1
VABG-DEPUTY ASSISTANT SECRETARY FOR CORPORATE SENIOR EXECUTIVE MANAGEMENT,2,0,0,0,0,0,0,0,0,0,2,0,0,0,0,0,0,0,0,0,0,0,2,0,0,0,0,0,0,0,0,0,0,0,0,0,0,0,0,0,0,0,0,0,0,0,2
VABH-DEPUTY ASSISTANT SECRETARY FOR LABOR MANAGEMENT RELATIONS,1,0,0,0,0,0,0,0,0,0,1,0,0,0,0,0,0,0,0,0,0,0,1,0,0,0,0,0,0,0,0,0,0,0,0,0,0,0,0,0,0,0,0,0,0,0,1
VABI-DEAN FOR VA LEARNING UNIVERSITY,0,0,0,0,0,0,0,0,0,0,0,0,0,0,0,0,0,0,0,0,0,0,0,0,0,0,0,0,0,0,0,0,0,0,0,0,0,0,0,0,0,0,0,0,0,0,0
VABJ-VETERAN EMPLOYMENT SERVICES OFFICE,0,0,0,0,0,0,0,0,0,0,0,0,0,0,0,0,0,0,0,0,0,0,0,0,0,0,0,0,0,0,0,0,0,0,0,0,0,0,0,0,0,0,0,0,0,0,0
VADA-IMMEDIATE OFFICE OF THE ASSISTANT SECRETARY FOR MANAGEMENT,0,0,0,0,0,0,0,0,0,0,0,0,0,0,0,0,0,0,0,0,0,0,0,0,0,0,0,0,0,0,0,0,0,0,0,0,0,0,0,0,0,0,0,0,0,0,0
VADC-DEPUTY ASSISTANT SECRETARY FOR BUDGET,0,0,0,0,0,0,0,0,0,0,0,0,0,0,0,0,0,0,0,0,0,0,0,0,1,0,0,0,0,0,0,0,0,1,0,0,0,0,0,0,0,0,0,0,0,1,1
VADD-DEPUTY ASSISTANT SECRETARY FOR FINANCE,1,0,0,0,0,0,0,0,0,0,1,0,0,0,0,0,0,0,0,0,0,0,1,1,0,2,0,0,0,2,0,0,0,5,0,0,0,0,0,0,0,0,0,0,0,5,6
VADG-DEPUTY ASSISTANT SECRETARY FOR ACQUISITION AND MATERIEL MANAGEMENT,1,1,0,0,0,0,0,0,0,0,2,0,0,0,0,0,0,0,0,0,0,0,2,0,2,0,0,0,0,0,0,0,0,2,0,0,0,0,0,0,0,0,0,0,0,2,4
VAEA-IMMEDIATE OFFICE OF THE ASSISTANT SECRETARY FOR INFORMATION AND TECHNOLOGY,0,0,0,0,0,0,0,0,0,0,0,0,0,0,0,0,0,0,0,0,0,0,0,0,0,0,0,0,0,0,0,0,0,0,0,0,0,0,0,0,0,0,0,0,0,0,0
VAEB-DEPUTY ASSISTANT SECRETARY FOR INFORMATION AND TECHNOLOGY,7,1,0,0,0,0,0,0,0,0,8,0,0,0,0,0,0,0,0,0,0,0,8,2,21,0,0,0,0,2,0,0,0,25,3,0,0,0,0,0,0,0,0,3,0,28,36
VAGB-DEPUTY ASSISTANT SECRETARY FOR SECURITY AND LAW ENFORCEMENT,0,0,0,0,0,0,0,0,0,0,0,0,0,0,0,0,0,0,0,0,0,0,0,0,0,0,0,0,0,0,0,0,0,0,1,0,0,0,0,0,0,0,0,1,0,1,1
VAGC-DEPUTY ASSISTANT SECRETARY FOR EMERGENCY MANAGEMENT,0,0,0,0,0,0,0,0,0,0,0,0,0,0,0,0,0,0,0,0,0,0,0,0,0,0,0,0,0,0,0,0,0,0,0,0,0,0,0,0,0,0,0,0,0,0,0
