CM55-INTERNATIONAL TRADE ADMINISTRATION,0,0,0,0,0,0,0,0,0,0,0,0,0,0,0,0,0,0,0,0,0,0,0,0,2,0,0,0,1,0,3,0,0,0,2,0,0,0,0,2,0,5,5
CM56-PATENT AND TRADEMARK OFFICE,6,0,0,0,0,0,0,0,0,6,0,0,0,0,0,0,0,0,0,0,6,0,28,0,0,0,0,0,0,0,28,0,1,0,0,0,0,0,0,1,0,29,35
CM57-NATIONAL INSTITUTE OF STANDARDS AND TECHNOLOGY,0,0,0,0,0,0,0,0,0,0,0,0,0,0,0,0,0,0,0,0,0,0,5,0,0,0,0,0,0,0,5,0,1,1,0,0,0,0,0,2,0,7,7
CM59-MINORITY BUSINESS DEVELOPMENT AGENCY,0,0,0,0,0,0,0,0,0,0,0,0,0,0,0,0,0,0,0,0,0,0,0,0,0,0,0,0,0,0,0,0,0,0,0,0,1,0,0,1,0,1,1
CM61-NATIONAL TELECOMMUNICATIONS AND INFORMATION ADMINISTRATION,0,0,0,0,0,0,0,0,0,0,0,0,0,0,0,0,0,0,0,0,0,0,0,0,0,0,0,0,0,0,0,0,0,0,0,0,0,0,0,0,0,0,0
CM62-NATIONAL TECHNICAL INFORMATION SERVICE,0,0,0,0,0,0,0,0,0,0,0,0,0,0,0,0,0,0,0,0,0,0,0,0,0,0,0,1,0,0,1,0,0,0,0,0,0,0,0,0,0,1,1
CM63-BUREAU OF THE CENSUS,0,0,0,0,0,0,1,0,0,1,0,0,0,0,0,0,0,0,0,0,1,2,71,110,0,0,0,0,0,0,183,0,160,0,0,0,0,0,0,160,0,343,344
CM64-OFFICE OF THE INSPECTOR GENERAL,0,0,0,0,0,0,0,0,0,0,0,0,0,0,0,0,0,0,0,0,0,0,0,0,0,0,0,0,0,0,0,0,0,0,0,0,0,0,0,0,0,0,0
CM65-ECONOMICS AND STATISTICS ADMINISTRATION,0,0,0,0,0,0,0,0,0,0,0,0,0,0,0,0,0,0,0,0,0,0,0,0,0,0,0,0,0,0,0,0,0,0,0,0,0,0,0,0,0,0,0
CM67-BUREAU OF INDUSTRY AND SECURITY,1,0,0,0,0,0,0,0,0,1,0,0,0,0,0,0,0,0,0,0,1,2,2,0,0,0,0,0,0,0,4,0,0,0,0,0,0,0,0,0,0,4,5
CT00-COMMODITY FUTURES TRADING COMMISSION,0,0,0,0,0,0,0,0,0,0,0,0,0,0,0,0,0,0,0,0,0,0,0,0,0,0,0,0,0,0,0,0,0,0,0,0,0,0,0,0,0,0,0
CU00-NATIONAL CREDIT UNION ADMINISTRATION,2,0,0,0,0,0,0,0,0,2,0,0,0,0,0,0,0,0,0,0,2,0,1,0,3,0,0,0,0,0,4,0,0,0,2,0,0,0,0,2,0,6,8
CX00-NATIONAL COMMISSION ON LIBRARIES AND INFORMATION SCIENCE,0,0,0,0,0,0,0,0,0,0,0,0,0,0,0,0,0,0,0,0,0,0,0,0,0,0,0,0,0,0,0,0,0,0,0,0,0,0,0,0,0,0,0
DB00-PUBLIC INTEREST DECLASSIFICATION BOARD,0,0,0,0,0,0,0,0,0,0,0,0,0,0,0,0,0,0,0,0,0,0,0,0,0,0,0,0,0,0,0,0,0,0,0,0,0,0,0,0,0,0,0
DD01-OFFICE OF THE SECRETARY OF DEFENSE,1,1,0,0,0,0,0,0,0,2,0,0,0,0,0,0,0,0,0,0,2,2,4,0,0,0,2,1,0,0,9,0,1,0,0,0,6,0,0,7,0,16,18
DD02-ORGANIZATION OF THE JOINT CHIEFS OF STAFF,1,0,0,0,0,0,0,0,0,1,0,0,0,0,0,0,0,0,0,0,1,0,0,0,0,0,0,0,0,0,0,0,0,0,0,0,0,0,0,0,0,0,1
DD04-DEFENSE INFORMATION SYSTEMS AGENCY,8,3,0,0,0,0,0,0,0,11,0,0,0,0,0,0,0,0,0,0,11,1,16,0,2,0,4,0,0,0,23,1,0,3,0,0,0,0,0,4,0,27,38
DD06-DEFENSE SECURITY COOPERATION AGENCY,2,0,0,0,0,0,0,0,0,2,0,0,0,0,0,0,0,0,0,0,2,0,1,0,0,0,0,0,0,0,1,0,0,0,0,0,0,0,0,0,0,1,3
DD07-DEFENSE LOGISTICS AGENCY,14,5,0,0,0,1,0,0,0,20,0,0,0,0,0,0,0,0,0,0,20,9,48,3,1,0,10,0,0,0,71,18,4,2,0,0,1,0,0,25,0,96,116
DD08-U.S. COURT OF APPEALS FOR THE ARMED FORCES,0,0,0,0,0,0,0,0,0,0,0,0,0,0,0,0,0,0,0,0,0,0,0,0,0,0,0,0,0,0,0,0,0,0,0,0,0,0,0,0,0,0,0
DD09-AMERICAN FORCES INFORMATION SERVICE,1,0,0,0,0,0,0,0,0,1,0,0,0,0,0,0,0,0,0,0,1,0,2,0,0,0,0,0,0,0,2,0,0,0,0,0,0,0,0,0,0,2,3
DD10-DEFENSE CONTRACT AUDIT AGENCY,2,1,0,0,0,0,0,0,0,3,0,0,0,0,0,0,0,0,0,0,3,0,5,0,9,0,0,0,0,0,14,0,0,1,0,0,0,0,0,1,0,15,18
DD12-DEFENSE SECURITY SERVICE,2,0,0,0,0,0,0,0,0,2,0,0,0,0,0,0,0,0,0,0,2,1,1,1,0,0,0,1,0,0,4,0,0,0,0,0,0,0,0,0,0,4,6
DD13-DEFENSE ADVANCED RESEARCH PROJECTS AGENCY,0,0,0,0,0,0,0,0,0,0,0,0,0,0,0,0,0,0,0,0,0,0,0,0,0,0,0,0,0,0,0,0,0,0,0,0,1,0,0,1,0,1,1
DD16-DEPARTMENT OF DEFENSE EDUCATION ACTIVITY,4,0,0,0,0,0,0,0,0,4,0,0,0,0,0,0,0,0,0,0,4,1,2,0,0,0,5,0,0,0,8,0,223,0,0,0,55,0,0,278,0,286,290
DD21-WASHINGTON HEADQUARTERS SERVICES,2,0,0,0,0,0,0,0,0,2,0,0,0,0,0,0,0,0,0,0,2,0,6,1,0,0,0,0,0,0,7,0,1,0,1,0,1,0,0,3,0,10,12
DD23-OFFICE OF ECONOMIC ADJUSTMENT,0,0,0,0,0,0,0,0,0,0,0,0,0,0,0,0,0,0,0,0,0,0,0,0,0,0,0,0,0,0,0,0,0,0,0,0,0,0,0,0,0,0,0
DD25-DEFENSE LEGAL SERVICES AGENCY,0,0,0,0,0,0,0,0,0,0,0,0,0,0,0,0,0,0,0,0,0,0,0,0,0,0,0,0,0,0,0,0,1,0,0,0,0,0,0,1,0,1,1
DD26-OFFICE OF THE INSPECTOR GENERAL,2,0,0,0,0,0,0,0,0,2,0,0,0,0,0,0,0,0,0,0,2,1,1,1,2,0,1,0,0,0,6,0,0,0,0,0,0,0,0,0,0,6,8
DD27-MISSILE DEFENSE AGENCY,2,0,0,0,0,0,0,0,0,2,0,0,0,0,0,0,0,0,0,0,2,0,3,0,0,0,0,1,0,0,4,0,0,0,0,0,1,0,0,1,0,5,7
DD29-DEFENSE TECHNOLOGY SECURITY ADMINISTRATION,1,0,0,0,0,0,0,0,0,1,0,0,0,0,0,0,0,0,0,0,1,0,1,0,0,0,0,0,0,0,1,0,0,0,0,0,0,0,0,0,0,1,2
DD34-DEFENSE COMMISSARY AGENCY,2,0,0,0,0,0,0,0,0,2,0,0,0,0,0,0,0,0,0,0,2,3,75,0,0,0,2,0,0,0,80,42,51,93,0,0,2,0,0,188,0,268,270
DD35-DEFENSE FINANCE AND ACCOUNTING SERVICE,4,0,0,0,0,0,0,0,0,4,0,0,0,0,0,0,0,0,0,0,4,4,47,0,12,0,2,0,0,0,65,33,0,7,0,0,0,0,0,40,0,105,109
DD48-DEFENSE HUMAN RESOURCES ACTIVITY,3,0,0,0,0,0,0,0,0,3,0,0,0,0,0,0,0,0,0,0,3,0,3,0,0,0,0,0,0,0,3,1,0,0,0,0,0,0,0,1,0,4,7
DD58-DEFENSE PRISONER OF WAR/MISSING PERSONNEL OFFICE,0,0,0,0,0,0,0,0,0,0,0,0,0,0,0,0,0,0,0,0,0,0,0,0,0,0,0,0,0,0,0,0,0,0,0,0,0,0,0,0,0,0,0
DD60-TRICARE MANAGEMENT ACTIVITY,1,0,0,0,0,0,0,0,0,1,0,0,0,0,0,0,0,0,0,0,1,0,2,0,0,0,0,0,0,0,2,0,0,0,0,0,0,0,0,0,0,2,3
DD61-DEFENSE THREAT REDUCTION AGENCY,3,1,0,0,0,0,0,0,0,4,0,0,0,0,0,0,0,0,0,0,4,0,4,0,0,0,0,1,0,0,5,0,0,0,0,0,0,0,0,0,0,5,9
DD63-DEFENSE CONTRACT MANAGEMENT AGENCY,9,1,0,0,0,0,0,0,0,10,0,0,0,0,0,0,0,0,0,0,10,0,5,0,1,0,4,0,0,0,10,0,0,0,0,0,0,0,0,0,0,10,20
DD65-PENTAGON FORCE PROTECTION AGENCY,4,2,0,0,0,0,0,0,0,6,0,0,0,0,0,0,0,0,0,0,6,0,15,0,0,0,0,0,0,0,15,0,1,0,0,0,0,0,0,1,0,16,22
DD68-DEPARTMENT OF DEFENSE TEST RESOURCE MANAGEMENT CENTER,0,0,0,0,0,0,0,0,0,0,0,0,0,0,0,0,0,0,0,0,0,0,0,0,0,0,0,0,0,0,0,0,0,0,0,0,0,0,0,0,0,0,0
DD69-NATIONAL DEFENSE UNIVERSITY,1,0,0,0,0,0,0,0,0,1,0,0,0,0,0,0,0,0,0,0,1,0,1,0,0,0,0,0,0,0,1,2,0,0,0,0,4,0,0,6,0,7,8
DD74-DEFENSE TECHNICAL INFORMATION CENTER,0,0,0,0,0,0,0,0,0,0,0,0,0,0,0,0,0,0,0,0,0,0,1,0,0,0,0,0,0,0,1,0,0,0,0,0,0,0,0,0,0,1,1
DD77-BUSINESS TRANSFORMATION AGENCY,0,0,0,0,0,0,1,0,0,1,0,0,0,0,0,0,0,0,0,0,1,0,0,0,0,0,0,0,0,0,0,0,0,0,0,0,0,0,0,0,0,0,1
DF00-OFFICE OF THE FEDERAL COORDINATOR FOR ALASKA NATURAL GAS TRANSPORTATION PROJECTS,0,0,0,0,0,0,0,0,0,0,0,0,0,0,0,0,0,0,0,0,0,0,0,0,0,0,0,0,0,0,0,0,0,0,0,0,0,0,0,0,0,0,0
"DJ01-OFFICES, BOARDS AND DIVISIONS",7,0,0,0,0,0,0,0,0,7,0,0,0,0,0,0,0,0,0,0,7,1,13,0,5,0,2,0,2,0,23,3,11,11,2,1,0,0,0,28,0,51,58
DJ02-FEDERAL BUREAU OF INVESTIGATION,0,0,0,0,0,0,0,0,0,0,0,0,0,0,0,0,0,0,0,0,0,0,0,0,0,0,0,0,0,0,0,0,0,0,0,0,0,0,0,0,0,0,0
DJ03-BUREAU OF PRISONS/FEDERAL PRISON SYSTEM,2,0,0,0,0,0,0,0,0,2,0,0,0,0,0,0,0,0,0,0,2,1,150,1,0,0,5,0,0,0,157,0,0,2,0,0,0,0,0,2,0,159,161
DJ06-DRUG ENFORCEMENT ADMINISTRATION,2,1,0,0,0,0,0,0,0,3,0,0,0,0,0,0,0,0,0,0,3,1,11,7,37,0,0,0,0,0,56,0,0,5,0,0,0,0,0,5,0,61,64
DJ07-OFFICE OF JUSTICE PROGRAMS,1,0,0,0,0,0,0,0,0,1,0,0,0,0,0,0,0,0,0,0,1,0,0,0,0,0,0,0,0,0,0,0,0,3,0,0,0,0,0,3,0,3,4
DJ08-U.S. MARSHALS SERVICE,1,0,0,0,0,0,0,0,0,1,0,0,0,0,0,0,0,0,0,0,1,2,3,0,0,0,0,0,0,0,5,0,0,0,0,0,0,0,0,0,0,5,6
DJ09-EXECUTIVE OFFICE FOR U.S. ATTORNEYS AND THE OFFICES OF THE U.S. ATTORNEYS,5,1,0,0,0,0,0,0,0,6,0,0,0,0,0,0,0,0,0,0,6,0,13,0,0,0,0,0,0,0,13,1,0,14,0,2,10,0,0,27,0,40,46
DJ10-OFFICE OF THE INSPECTOR GENERAL,1,0,0,0,0,0,0,0,0,1,0,0,0,0,0,0,0,0,0,0,1,1,1,0,0,0,0,0,0,0,2,0,0,3,0,0,0,0,0,3,0,5,6
DJ11-U.S. TRUSTEE PROGRAM,0,0,0,0,0,0,0,0,0,0,0,0,0,0,0,0,0,0,0,0,0,0,2,0,3,0,0,0,0,0,5,0,2,0,0,0,0,0,0,2,0,7,7
DJ12-EXECUTIVE OFFICE FOR IMMIGRATION REVIEW,1,0,0,0,0,0,0,0,0,1,0,0,0,0,0,0,0,0,0,0,1,1,5,0,0,0,0,0,0,0,6,0,1,1,0,0,0,0,0,2,0,8,9
DJ14-COMMUNITY RELATIONS SERVICE,0,0,0,0,0,0,0,0,0,0,0,0,0,0,0,0,0,0,0,0,0,0,0,0,0,0,0,0,0,0,0,0,0,0,0,0,0,0,0,0,0,0,0
"DJ15-BUREAU OF ALCOHOL, TOBACCO, FIREARMS, AND EXPLOSIVES",3,0,0,0,0,0,0,0,0,3,0,0,0,0,0,0,0,0,0,0,3,1,3,0,0,0,0,0,0,0,4,0,0,0,0,0,0,0,0,0,0,4,7
DL**-UNSPECIFIED,0,0,0,0,0,0,0,0,0,0,0,0,0,0,0,0,0,0,0,0,0,0,0,0,0,0,0,0,0,0,0,0,0,0,0,0,0,0,0,0,0,0,0
DLAA-OFFICE OF THE SECRETARY OF LABOR,0,0,0,0,0,0,0,0,0,0,0,0,0,0,0,0,0,0,0,0,0,0,1,0,0,0,0,0,0,0,1,0,0,0,1,0,0,0,0,1,0,2,2
DLAM-OFFICE OF THE ASSISTANT SECRETARY FOR ADMINISTRATION AND MANAGEMENT,0,0,0,0,0,0,0,0,0,0,0,0,0,0,0,0,0,0,0,0,0,0,1,1,0,0,0,0,0,0,2,0,0,3,0,0,0,0,0,3,0,5,5
DLBL-BUREAU OF INTERNATIONAL LABOR AFFAIRS,0,0,0,0,0,0,0,0,0,0,0,0,0,0,0,0,0,0,0,0,0,0,0,0,0,0,0,0,0,0,0,0,0,0,0,0,0,0,0,0,0,0,0
DLCA-OFFICE OF CONGRESSIONAL AND INTERGOVERNMENTAL AFFAIRS,0,0,0,0,0,0,0,0,0,0,0,0,0,0,0,0,0,0,0,0,0,0,0,0,0,0,0,0,0,0,0,0,0,0,1,0,0,0,0,1,0,1,1
DLCF-OFFICE OF THE CHIEF FINANCIAL OFFICER,0,0,0,0,0,0,0,0,0,0,0,0,0,0,0,0,0,0,0,0,0,0,0,0,0,0,0,0,0,0,0,0,0,0,0,0,0,0,0,0,0,0,0
DLEB-EMPLOYEE BENEFITS SECURITY ADMINISTRATION,0,0,0,0,0,0,0,0,0,0,0,0,0,0,0,0,0,0,0,0,0,0,0,0,0,0,0,0,0,0,0,0,0,0,0,0,0,0,0,0,0,0,0
DLEH-OFFICE OF DISABILITY EMPLOYMENT POLICY,0,0,0,0,0,0,0,0,0,0,0,0,0,0,0,0,0,0,0,0,0,0,0,0,0,0,0,0,0,0,0,0,0,0,0,0,0,0,0,0,0,0,0
DLES-EMPLOYMENT STANDARDS ADMINISTRATION,1,1,0,0,0,0,0,0,0,2,0,0,0,0,0,0,0,0,0,0,2,2,8,0,0,0,1,0,0,0,11,11,0,6,0,0,0,0,0,17,0,28,30
DLET-EMPLOYMENT AND TRAINING ADMINISTRATION,2,0,0,0,0,0,0,0,0,2,0,0,0,0,0,0,0,0,0,0,2,0,11,1,4,0,0,0,0,0,16,0,0,0,0,0,0,0,0,0,0,16,18
DLIG-OFFICE OF THE INSPECTOR GENERAL,1,0,0,0,0,0,0,0,0,1,0,0,0,0,0,0,0,0,0,0,1,0,0,0,0,0,0,0,0,0,0,0,0,0,0,0,0,0,0,0,0,0,1
DLLS-BUREAU OF LABOR STATISTICS,1,0,0,0,0,0,0,0,0,1,0,0,0,0,0,0,0,0,0,0,1,0,10,0,0,0,0,0,0,0,10,0,0,0,0,0,0,0,0,0,0,10,11
DLMS-MINE SAFETY AND HEALTH ADMINISTRATION,0,0,0,0,0,0,0,0,0,0,0,0,0,0,0,0,0,0,0,0,0,1,2,0,5,0,0,0,0,0,8,0,0,0,0,0,0,0,0,0,0,8,8
DLPA-OFFICE OF PUBLIC AFFAIRS,0,0,0,0,0,0,0,0,0,0,0,0,0,0,0,0,0,0,0,0,0,0,1,0,0,0,0,0,0,0,1,0,0,0,0,0,0,0,0,0,0,1,1
DLPE-OFFICE OF THE ASSISTANT SECRETARY FOR POLICY,0,0,0,0,0,0,0,0,0,0,0,0,0,0,0,0,0,0,0,0,0,0,0,0,0,0,0,0,0,0,0,0,0,0,0,0,0,0,0,0,0,0,0
DLPW-EMPLOYEE BENEFITS SECURITY ADMINISTRATION,0,0,0,0,0,0,0,0,0,0,0,0,0,0,0,0,0,0,0,0,0,0,1,0,4,0,0,0,0,0,5,0,0,2,0,0,0,0,0,2,0,7,7
DLSH-OCCUPATIONAL SAFETY AND HEALTH ADMINISTRATION,0,0,0,0,0,0,0,0,0,0,0,0,0,0,0,0,0,0,0,0,0,0,5,0,0,0,0,0,0,0,5,0,0,0,0,0,0,0,0,0,0,5,5
DLSL-OFFICE OF THE SOLICITOR,0,0,0,0,0,0,0,0,0,0,0,0,0,0,0,0,0,0,0,0,0,0,0,0,0,0,0,0,0,0,0,0,0,0,0,0,0,0,0,0,0,0,0
DLVE-VETERANS EMPLOYMENT AND TRAINING SERVICES,1,0,0,0,0,0,0,0,0,1,0,0,0,0,0,0,0,0,0,0,1,0,0,0,0,0,0,0,0,0,0,0,0,0,1,0,0,0,0,1,0,1,2
DLWB-WOMEN'S BUREAU,0,0,0,0,0,0,0,0,0,0,0,0,0,0,0,0,0,0,0,0,0,0,0,0,0,0,0,0,0,0,0,0,0,0,0,0,0,0,0,0,0,0,0
DN00-DEPARTMENT OF ENERGY,7,1,0,0,0,0,0,0,0,8,0,0,0,0,0,0,0,0,0,0,8,2,20,4,4,0,0,1,0,0,31,1,0,3,1,1,35,0,0,41,24,96,104
DQ00-DENALI COMMISSION,0,0,0,0,0,0,0,0,0,0,0,0,0,0,0,0,0,0,0,0,0,0,0,0,0,0,0,0,0,0,0,0,0,0,0,0,0,0,0,0,0,0,0
EB00-EXPORT-IMPORT BANK OF THE UNITED STATES,0,0,0,0,0,0,0,0,0,0,0,0,0,0,0,0,0,0,0,0,0,0,1,0,0,0,0,0,0,0,1,0,0,0,1,0,0,0,0,1,0,2,2
EC00-OFFICE OF ADMINISTRATION,1,0,0,0,0,0,0,0,0,1,0,0,0,0,0,0,0,0,0,0,1,0,1,1,0,0,0,0,0,0,2,0,0,0,0,0,0,0,0,0,0,2,3
EDEA-IMMEDIATE OFFICE OF THE SECRETARY OF EDUCATION,0,0,0,0,0,0,0,0,0,0,0,0,0,0,0,0,0,0,0,0,0,0,0,0,0,0,0,0,0,0,0,0,0,0,1,0,0,0,0,1,0,1,1
EDEB-OFFICE OF THE DUTY SECRETARY OF EDUCATION,0,0,0,0,0,0,0,0,0,0,0,0,0,0,0,0,0,0,0,0,0,0,0,0,0,0,0,0,0,0,0,0,0,0,0,0,0,0,0,0,0,0,0
EDEC-OFFICE FOR CIVIL RIGHTS,0,0,0,0,0,0,0,0,0,0,0,0,0,0,0,0,0,0,0,0,0,0,0,0,0,0,0,0,0,0,0,0,1,0,0,0,0,0,0,1,0,1,1
"EDED-OFFICE OF PLANNING, EVALUATION AND POLICY DEVELOPMENT",0,0,0,0,0,0,0,0,0,0,0,0,0,0,0,0,0,0,0,0,0,0,0,0,0,0,0,0,0,0,0,0,0,0,0,0,0,0,0,0,0,0,0
EDEE-OFFICE OF THE UNDER SECRETARY,0,0,0,0,0,0,0,0,0,0,0,0,0,0,0,0,0,0,0,0,0,0,0,0,0,0,0,0,0,0,0,0,0,0,0,0,0,0,0,0,0,0,0
EDEF-OFFICE OF INSPECTOR GENERAL,0,0,0,0,0,0,0,0,0,0,0,0,0,0,0,0,0,0,0,0,0,0,0,0,0,0,0,0,0,0,0,0,0,0,0,0,0,0,0,0,0,0,0
EDEG-OFFICE OF THE GENERAL COUNSEL,0,0,0,0,0,0,0,0,0,0,0,0,0,0,0,0,0,0,0,0,0,0,0,1,0,0,0,0,0,0,1,0,0,0,0,0,0,0,0,0,0,1,1
EDEH-OFFICE OF SPECIAL EDUCATION AND REHABILITATIVE SERVICES,1,0,0,0,0,0,0,0,0,1,0,0,0,0,0,0,0,0,0,0,1,0,4,1,0,0,0,0,0,0,5,0,0,2,0,0,0,0,0,2,0,7,8
EDEI-OFFICE OF THE CHIEF INFORMATION OFFICER,0,0,0,0,0,0,0,0,0,0,0,0,0,0,0,0,0,0,0,0,0,0,0,0,0,0,0,0,0,0,0,0,0,0,0,0,0,0,0,0,0,0,0
EDEJ-OFFICE OF LEGISLATION AND CONGRESSIONAL AFFAIRS,0,0,0,0,0,0,0,0,0,0,0,0,0,0,0,0,0,0,0,0,0,0,0,0,0,0,0,0,0,0,0,0,0,0,0,0,0,0,0,0,0,0,0
EDEK-OFFICE OF INTERGOVERNMENTAL AND INTERAGENCY AFFAIRS,0,0,0,0,0,0,0,0,0,0,0,0,0,0,0,0,0,0,0,0,0,0,0,0,0,0,0,0,0,0,0,0,0,0,0,0,0,0,0,0,0,0,0
EDEL-OFFICE OF THE CHIEF FINANCIAL OFFICER,0,0,0,0,0,0,0,0,0,0,0,0,0,0,0,0,0,0,0,0,0,0,0,0,0,0,0,0,0,0,0,0,0,1,0,0,0,0,0,1,0,1,1
EDEM-OFFICE OF MANAGEMENT,1,0,0,0,0,0,0,0,0,1,0,0,0,0,0,0,0,0,0,0,1,0,0,0,0,0,0,0,0,0,0,0,0,1,0,0,0,0,0,1,0,1,2
EDEN-FEDERAL STUDENT AID,2,2,0,0,0,0,0,0,0,4,0,0,0,0,0,0,0,0,0,0,4,0,1,0,1,0,3,0,0,0,5,0,0,0,0,0,0,0,0,0,0,5,9
EDEO-OFFICE OF COMMUNICATIONS AND OUTREACH,0,0,0,0,0,0,0,0,0,0,0,0,0,0,0,0,0,0,0,0,0,0,0,0,0,0,0,0,0,0,0,0,0,0,1,0,0,0,0,1,0,1,1
EDEP-OFFICE OF POSTSECONDARY EDUCATION,0,0,0,0,0,0,0,0,0,0,0,0,0,0,0,0,0,0,0,0,0,0,0,0,0,0,0,0,0,0,0,0,0,0,0,0,0,0,0,0,0,0,0
EDEQ-OFFICE OF SAFE AND DRUG-FREE SCHOOLS,0,0,0,0,0,0,0,0,0,0,0,0,0,0,0,0,0,0,0,0,0,0,0,0,0,0,0,0,0,0,0,0,0,0,0,0,0,0,0,0,0,0,0
EDER-INSTITUTE OF EDUCATION SCIENCES,1,0,0,0,0,0,0,0,0,1,0,0,0,0,0,0,0,0,0,0,1,0,1,0,0,0,0,0,0,0,1,0,0,0,0,0,2,0,0,2,0,3,4
EDES-OFFICE OF ELEMENTARY AND SECONDARY EDUCATION,0,0,0,0,0,0,0,0,0,0,0,0,0,0,0,0,0,0,0,0,0,0,0,0,0,0,0,0,0,0,0,0,0,1,0,0,2,0,0,3,0,3,3
EDET-OFFICE OF ENGLISH LANGUAGE ACQUISITION,0,0,0,0,0,0,0,0,0,0,0,0,0,0,0,0,0,0,0,0,0,0,0,0,0,0,0,0,0,0,0,0,0,0,0,0,0,0,0,0,0,0,0
EDEU-OFFICE OF INNOVATION AND IMPROVEMENT,0,0,0,0,0,0,0,0,0,0,0,0,0,0,0,0,0,0,0,0,0,0,0,0,0,0,0,0,0,0,0,0,0,0,0,0,0,0,0,0,0,0,0
EDEV-OFFICE OF VOCATIONAL AND ADULT EDUCATION,0,0,0,0,0,0,0,0,0,0,0,0,0,0,0,0,0,0,0,0,0,0,0,0,0,0,0,0,0,0,0,0,0,0,0,0,0,0,0,0,0,0,0
EDEX-NATIONAL INSTITUTE FOR LITERACY,0,0,0,0,0,0,0,0,0,0,0,0,0,0,0,0,0,0,0,0,0,0,0,0,0,0,0,0,0,0,0,0,0,0,0,0,0,0,0,0,0,0,0
EDEY-ADVISORY COUNCILS AND COMMITTEES,0,0,0,0,0,0,0,0,0,0,0,0,0,0,0,0,0,0,0,0,0,0,0,0,0,0,0,0,0,0,0,0,0,0,0,0,0,0,0,0,0,0,0
EDEZ-NATIONAL ASSESSMENT GOVERNING BOARD,0,0,0,0,0,0,0,0,0,0,0,0,0,0,0,0,0,0,0,0,0,0,0,0,0,0,0,0,0,0,0,0,0,0,0,0,1,0,0,1,0,1,1
EE00-EQUAL EMPLOYMENT OPPORTUNITY COMMISSION,0,0,0,0,0,0,0,0,0,0,0,0,0,0,0,0,0,0,0,0,0,0,1,1,0,0,0,0,0,0,2,4,0,0,0,0,0,0,0,4,0,6,6
EO00-MORRIS K. UDALL SCHOLARSHIP AND EXCELLENCE IN NATIONAL ENVIRONMENTAL POLICY FOUNDATION,0,0,0,0,0,0,0,0,0,0,0,0,0,0,0,0,0,0,0,0,0,0,0,0,0,0,0,0,0,0,0,0,0,0,0,0,0,0,0,0,0,0,0
EP00-ENVIRONMENTAL PROTECTION AGENCY,7,0,0,0,0,0,0,0,0,7,0,0,0,0,0,0,0,0,0,0,7,2,8,4,5,0,0,0,0,0,19,7,2,6,3,0,22,0,0,40,0,59,66
EQ00-COUNCIL ON ENVIRONMENTAL QUALITY/OFFICE OF ENVIRONMENTAL QUALITY,0,0,0,0,0,0,0,0,0,0,0,0,0,0,0,0,0,0,0,0,0,0,0,0,0,0,0,0,0,0,0,0,0,0,0,0,0,0,0,0,0,0,0
EW00-TRADE AND DEVELOPMENT AGENCY,0,0,0,0,0,0,0,0,0,0,0,0,0,0,0,0,0,0,0,0,0,0,0,0,0,0,0,0,0,0,0,0,0,0,0,0,0,0,0,0,0,0,0
FC00-FEDERAL COMMUNICATIONS COMMISSION,1,0,0,0,0,0,0,0,0,1,0,0,0,0,0,0,0,0,0,0,1,0,0,3,0,0,0,0,0,0,3,0,0,0,1,0,2,0,0,3,0,6,7
FD00-FEDERAL DEPOSIT INSURANCE CORPORATION,1,0,0,0,0,0,0,0,0,1,0,0,0,0,0,0,0,0,0,0,1,0,1,0,0,0,0,0,0,0,1,0,0,2,0,0,0,0,0,2,0,3,4
FI00-FEDERAL FINANCIAL INSTITUTIONS EXAMINATION COUNCIL,0,0,0,0,0,0,0,0,0,0,0,0,0,0,0,0,0,0,0,0,0,0,0,0,0,0,0,0,0,0,0,0,0,0,0,0,0,0,0,0,0,0,0
FJ00-CHEMICAL SAFETY AND HAZARD INVESTIGATION BOARD,0,0,0,0,0,0,0,0,0,0,0,0,0,0,0,0,0,0,0,0,0,0,0,0,0,0,0,0,0,0,0,0,0,0,0,0,0,0,0,0,0,0,0
FK00-FARM CREDIT SYSTEM INSURANCE CORPORATION,0,0,0,0,0,0,0,0,0,0,0,0,0,0,0,0,0,0,0,0,0,0,0,0,0,0,0,0,0,0,0,0,0,0,0,0,0,0,0,0,0,0,0
FL00-FARM CREDIT ADMINISTRATION,0,0,0,0,0,0,0,0,0,0,0,0,0,0,0,0,0,0,0,0,0,0,0,0,0,0,0,0,0,0,0,0,0,0,0,0,0,0,0,0,0,0,0
FM00-FEDERAL MEDIATION AND CONCILIATION SERVICE,0,0,0,0,0,0,0,0,0,0,0,0,0,0,0,0,0,0,0,0,0,0,0,0,0,0,0,0,0,0,0,0,0,0,0,0,0,0,0,0,0,0,0
FQ01-OFFICE OF THE DIRECTOR,0,0,0,0,0,0,0,0,0,0,0,0,0,0,0,0,0,0,0,0,0,0,5,0,0,0,0,0,0,0,5,0,0,1,0,0,0,0,0,1,0,6,6
FQ02-PRETRIAL SERVICES AGENCY,0,0,0,0,0,0,0,0,0,0,0,0,0,0,0,0,0,0,0,0,0,0,6,0,0,0,0,0,0,0,6,0,0,0,0,0,0,0,0,0,0,6,6
FT00-FEDERAL TRADE COMMISSION,1,1,0,0,0,0,0,0,0,2,0,0,0,0,0,0,0,0,0,0,2,0,0,3,0,0,0,0,0,0,3,0,0,1,0,0,1,0,0,2,0,5,7
FW00-OFFICE OF SPECIAL COUNSEL,0,0,0,0,0,0,0,0,0,0,0,0,0,0,0,0,0,0,0,0,0,0,0,1,0,0,0,0,0,0,1,0,0,0,0,0,0,0,0,0,0,1,1
FY00-FEDERAL HOUSING FINANCE BOARD,0,0,0,0,0,0,0,0,0,0,0,0,0,0,0,0,0,0,0,0,0,0,1,0,0,0,0,0,0,0,1,0,0,0,0,0,0,0,0,0,0,1,1
GB00-OVERSEAS PRIVATE INVESTMENT CORPORATION,0,0,0,0,0,0,0,0,0,0,0,0,0,0,0,0,0,0,0,0,0,0,0,0,0,0,0,0,0,0,0,0,0,0,0,0,0,0,0,0,0,0,0
GE00-BARRY GOLDWATER SCHOLARSHIP AND EXCELLENCE IN EDUCATION FOUNDATION,0,0,0,0,0,0,0,0,0,0,0,0,0,0,0,0,0,0,0,0,0,0,0,0,0,0,0,0,0,0,0,0,0,0,0,0,0,0,0,0,0,0,0
GG00-OFFICE OF GOVERNMENT ETHICS,0,0,0,0,0,0,0,0,0,0,0,0,0,0,0,0,0,0,0,0,0,0,0,2,0,0,0,0,0,0,2,0,0,0,0,0,0,0,0,0,0,2,2
GJ00-PRESIDIO TRUST,0,0,0,0,0,0,0,0,0,0,0,0,0,0,0,0,0,0,0,0,0,0,0,0,0,0,0,0,0,0,0,0,0,0,0,0,2,0,0,2,0,2,2
GM00-VALLES CALDERA TRUST,0,0,0,0,0,0,0,0,0,0,0,0,0,0,0,0,0,0,0,0,0,0,0,0,0,0,0,0,0,0,0,0,0,0,0,0,0,0,0,0,0,0,0
GO00-VIETNAM EDUCATION FOUNDATION,0,0,0,0,0,0,0,0,0,0,0,0,0,0,0,0,0,0,0,0,0,0,0,0,0,0,0,0,0,0,0,0,0,0,0,0,3,0,0,3,0,3,3
GQ00-ELECTION ASSISTANCE COMMISSION,0,0,0,0,0,0,0,0,0,0,0,0,0,0,0,0,0,0,0,0,0,0,0,0,0,0,1,0,0,0,1,0,0,0,0,0,1,0,0,1,0,2,2
GS01-IMMEDIATE OFFICE OF THE ADMINISTRATOR,0,0,0,0,0,0,0,0,0,0,0,0,0,0,0,0,0,0,0,0,0,0,0,0,0,0,0,0,0,0,0,0,0,0,0,0,0,0,0,0,0,0,0
GS03-PUBLIC BUILDINGS SERVICE,9,1,0,0,0,0,0,0,0,10,0,0,0,0,0,0,0,0,0,0,10,3,12,0,12,0,1,0,0,0,28,3,2,1,0,0,0,0,0,6,0,34,44
GS04-OFFICE OF CIVIL RIGHTS,0,0,0,0,0,0,0,0,0,0,0,0,0,0,0,0,0,0,0,0,0,0,0,0,0,0,0,0,0,0,0,0,0,0,0,0,0,0,0,0,0,0,0
GS10-OFFICE OF SMALL BUSINESS UTILIZATION,0,0,0,0,0,0,0,0,0,0,0,0,0,0,0,0,0,0,0,0,0,0,0,0,0,0,0,0,0,0,0,0,0,0,0,0,0,0,0,0,0,0,0
GS11-OFFICE OF THE CHIEF FINANCIAL OFFICER,1,0,0,0,0,0,0,0,0,1,0,0,0,0,0,0,0,0,0,0,1,0,0,0,0,0,0,0,0,0,0,1,0,0,0,0,0,0,0,1,0,1,2
GS12-OFFICE OF GENERAL COUNSEL,0,0,0,0,0,0,0,0,0,0,0,0,0,0,0,0,0,0,0,0,0,0,0,0,0,0,0,0,0,0,0,0,0,0,0,0,0,0,0,0,0,0,0
GS13-GSA BOARD OF CONTRACT APPEALS,0,0,0,0,0,0,0,0,0,0,0,0,0,0,0,0,0,0,0,0,0,0,0,0,0,0,0,0,0,0,0,0,0,0,0,0,0,0,0,0,0,0,0
GS14-OFFICE OF THE CHIEF HUMAN CAPITAL OFFICER,1,0,0,0,0,0,0,0,0,1,0,0,0,0,0,0,0,0,0,0,1,0,0,0,0,0,0,0,0,0,0,0,0,0,0,0,0,0,0,0,0,0,1
GS15-OFFICE OF INSPECTOR GENERAL,2,0,0,0,0,0,0,0,0,2,0,0,0,0,0,0,0,0,0,0,2,0,0,0,0,0,0,0,0,0,0,0,0,0,0,0,0,0,0,0,0,0,2
GS16-OFFICE OF THE CHIEF ACQUISITION OFFICER,0,0,0,0,0,0,0,0,0,0,0,0,0,0,0,0,0,0,0,0,0,0,0,0,0,0,0,0,0,0,0,0,0,0,0,0,0,0,0,0,0,0,0
GS19-OFFICE OF CITIZEN SERVICES AND COMMUNICATIONS,0,0,0,0,0,0,0,0,0,0,0,0,0,0,0,0,0,0,0,0,0,0,0,0,0,0,0,0,0,0,0,0,0,0,1,0,0,0,0,1,0,1,1
GS20-OFFICE OF CONGRESSIONAL AND INTERGOVERNMENTAL AFFAIRS,0,0,0,0,0,0,0,0,0,0,0,0,0,0,0,0,0,0,0,0,0,0,0,0,0,0,0,0,0,0,0,0,0,0,0,0,0,0,0,0,0,0,0
GS22-OFFICES OF THE REGIONAL ADMINISTRATORS,0,0,0,0,0,0,0,0,0,0,0,0,0,0,0,0,0,0,0,0,0,0,0,0,0,0,0,0,0,0,0,0,0,0,0,0,0,0,0,0,0,0,0
GS24-FEDERAL SUPPLY SERVICE,0,0,0,0,0,0,0,0,0,0,0,0,0,0,0,0,0,0,0,0,0,0,1,0,0,0,0,0,0,0,1,0,0,0,0,0,0,0,0,0,0,1,1
GS26-OFFICE OF GOVERNMENTWIDE POLICY,0,0,0,0,0,0,0,0,0,0,0,0,0,0,0,0,0,0,0,0,0,0,0,0,0,0,0,0,0,0,0,0,0,0,0,0,0,0,0,0,0,0,0
GS27-FEDERAL TECHNOLOGY SERVICE,1,0,0,0,0,0,0,0,0,1,0,0,0,0,0,0,0,0,0,0,1,0,0,0,1,0,0,0,0,0,1,0,0,0,0,0,0,0,0,0,0,1,2
GS28-OFFICE OF THE CHIEF INFORMATION OFFICER,0,0,0,0,0,0,0,0,0,0,0,0,0,0,0,0,0,0,0,0,0,0,0,0,0,0,0,0,0,0,0,0,0,0,0,0,0,0,0,0,0,0,0
GS30-FEDERAL ACQUISITION SERVICE,0,0,0,0,0,0,0,0,0,0,0,0,0,0,0,0,0,0,0,0,0,0,0,0,0,0,0,0,0,0,0,0,0,0,0,0,0,0,0,0,0,0,0
GS31-OFFICE OF EMERGENCY RESPONSE AND RECOVERY,0,0,0,0,0,0,0,0,0,0,0,0,0,0,0,0,0,0,0,0,0,0,0,0,0,0,0,0,0,0,0,0,0,0,0,0,0,0,0,0,0,0,0
GW00-INTERNATIONAL BOUNDARY AND WATER COMMISSION:  UNITED STATES AND MEXICO,0,0,0,0,0,0,0,0,0,0,0,0,0,0,0,0,0,0,0,0,0,0,0,0,0,0,2,0,0,0,2,0,0,0,0,0,0,0,0,0,0,2,2
GX00-INTERNATIONAL BOUNDARY COMMISSION:  UNITED STATES AND CANADA,0,0,0,0,0,0,0,0,0,0,0,0,0,0,0,0,0,0,0,0,0,0,0,0,0,0,0,0,0,0,0,0,0,0,0,0,0,0,0,0,0,0,0
GY00-INTERNATIONAL JOINT COMMISSION:  UNITED STATES AND CANADA,0,0,0,0,0,0,0,0,0,0,0,0,0,0,0,0,0,0,0,0,0,0,0,0,0,0,0,0,0,0,0,0,0,0,0,0,0,0,0,0,0,0,0
HB00-COMMITTEE FOR PURCHASE FROM PEOPLE WHO ARE BLIND OR SEVERELY DISABLED,0,0,0,0,0,0,0,0,0,0,0,0,0,0,0,0,0,0,0,0,0,0,0,0,0,0,0,0,0,0,0,0,0,0,0,0,0,0,0,0,0,0,0
HD00-U.S. HOLOCAUST MEMORIAL MUSEUM,2,0,0,0,0,0,0,0,0,2,0,0,0,0,0,0,0,0,0,0,2,0,3,0,0,0,0,0,0,0,3,0,0,0,0,0,0,0,0,0,0,3,5
HE10-OFFICE OF THE SECRETARY OF HEALTH AND HUMAN SERVICES,8,1,0,0,0,1,0,0,0,10,0,0,0,0,0,0,0,0,0,0,10,1,0,1,1,0,0,0,0,0,3,0,1,3,0,0,0,2,0,6,2,11,21
HE11-PROGRAM SUPPORT CENTER,0,0,0,0,0,0,0,0,0,0,0,0,0,0,0,0,0,0,0,0,0,0,0,0,0,0,0,0,0,0,0,0,0,1,0,0,0,0,0,1,0,1,1
HE12-ADMINISTRATION ON AGING,0,0,0,0,0,0,0,0,0,0,0,0,0,0,0,0,0,0,0,0,0,0,0,0,0,0,0,0,0,0,0,0,0,0,0,0,0,0,0,0,0,0,0
HE31-OFFICE OF THE ASSISTANT SECRETARY FOR HEALTH,0,0,0,0,0,0,0,0,0,0,0,0,0,0,0,0,0,0,0,0,0,0,0,0,0,0,0,0,0,0,0,0,0,0,0,0,0,0,0,0,0,0,0
HE32-SUBSTANCE ABUSE AND MENTAL HEALTH SERVICES ADMINISTRATION,0,0,0,0,0,0,0,0,0,0,0,0,0,0,0,0,0,0,0,0,0,0,1,0,0,0,0,0,0,0,1,0,0,0,0,0,1,0,0,1,0,2,2
HE33-AGENCY FOR HEALTHCARE RESEARCH AND QUALITY,0,0,0,0,0,0,0,0,0,0,0,0,0,0,0,0,0,0,0,0,0,0,0,0,0,0,0,0,0,0,0,0,0,0,0,0,0,0,0,0,0,0,0
HE34-HEALTH RESOURCES AND SERVICES ADMINISTRATION,0,0,0,0,0,0,0,0,0,0,0,0,0,0,0,0,0,0,0,1,1,0,0,0,0,0,0,0,0,0,0,0,0,0,0,0,0,0,0,0,0,0,1
HE35-AGENCY FOR TOXIC SUBSTANCES AND DISEASE REGISTRY,0,0,0,0,0,0,0,0,0,0,0,0,0,0,0,0,0,0,0,0,0,0,0,0,0,0,0,0,0,0,0,0,0,0,0,0,0,0,0,0,0,0,0
HE36-FOOD AND DRUG ADMINISTRATION,4,0,0,0,0,0,0,0,0,4,0,0,0,0,0,0,0,0,0,0,4,2,8,0,0,0,0,0,0,0,10,1,0,3,0,0,26,1,0,31,3,44,48
HE37-INDIAN HEALTH SERVICE,1,0,0,0,0,0,0,0,0,1,0,0,0,0,0,0,0,0,0,0,1,7,18,33,0,0,0,0,0,0,58,2,75,0,0,0,1,0,0,78,4,140,141
HE38-NATIONAL INSTITUTES OF HEALTH,5,1,0,0,0,0,0,0,0,6,0,0,0,0,0,0,0,0,0,0,6,0,22,0,0,0,0,0,0,0,22,0,0,0,0,0,38,0,0,38,20,80,86
HE39-CENTERS FOR DISEASE CONTROL AND PREVENTION,5,1,0,0,0,0,0,0,0,6,0,0,0,0,0,0,0,0,0,0,6,0,8,0,1,0,0,0,0,0,9,0,0,1,0,0,3,0,0,4,0,13,19
HE70-CENTERS FOR MEDICARE & MEDICAID SERVICES,0,0,0,0,0,0,0,0,0,0,0,0,0,0,0,0,0,0,0,0,0,0,1,0,0,0,0,0,0,0,1,0,0,0,0,0,0,0,0,0,0,1,1
HE90-ADMINISTRATION FOR CHILDREN AND FAMILIES,0,0,0,0,0,0,0,0,0,0,0,0,0,0,0,0,0,0,0,0,0,0,0,0,0,0,0,0,0,0,0,0,0,0,0,0,0,0,0,0,0,0,0
HP00-ADVISORY COUNCIL ON HISTORIC PRESERVATION,0,0,0,0,0,0,0,0,0,0,0,0,0,0,0,0,0,0,0,0,0,0,0,0,0,0,1,0,0,0,1,0,0,0,0,0,0,0,0,0,0,1,1
HS**-UNSPECIFIED,0,0,0,0,0,0,0,0,0,0,0,0,0,0,0,0,0,0,0,0,0,0,0,0,0,0,0,0,0,0,0,0,0,0,0,0,0,0,0,0,0,0,0
HSAA-DHS HEADQUARTERS,2,0,0,0,0,0,0,0,0,2,0,0,0,0,0,0,0,0,0,0,2,1,9,0,0,0,0,0,0,0,10,0,0,0,2,0,0,0,0,2,0,12,14
HSAB-BUREAU OF CITIZENSHIP AND IMMIGRATION SERVICES,1,0,0,0,0,0,0,0,0,1,0,0,0,0,0,0,0,0,0,0,1,0,22,0,0,0,1,0,0,0,23,0,0,5,0,0,7,0,0,12,0,35,36
HSAC-U.S. COAST GUARD,15,4,0,0,0,0,0,0,0,19,0,0,0,0,0,0,0,0,0,0,19,5,39,2,0,0,5,0,0,0,51,5,1,0,0,0,1,0,0,7,0,58,77
HSAD-U.S. SECRET SERVICE,0,0,0,0,0,0,0,0,0,0,0,0,0,0,0,0,0,0,0,0,0,1,5,0,0,0,1,0,0,0,7,0,1,48,0,0,0,0,0,49,0,56,56
HSAE-OFFICE OF THE INSPECTOR GENERAL,1,0,0,0,0,0,0,0,0,1,0,0,0,0,0,0,0,0,0,0,1,0,1,0,1,0,0,0,0,0,2,0,0,0,0,0,1,0,0,1,0,3,4
HSBA-US-VISIT,0,0,0,0,0,0,0,0,0,0,0,0,0,0,0,0,0,0,0,0,0,0,0,0,0,0,0,0,0,0,0,0,0,0,0,0,0,0,0,0,0,0,0
HSBB-BUREAU OF IMMIGRATION AND CUSTOMS ENFORCEMENT,8,1,0,0,0,0,0,0,0,9,0,0,0,0,0,0,0,0,0,0,9,2,4,6,20,0,1,0,1,0,34,0,0,5,0,0,0,0,0,5,0,39,48
HSBC-TRANSPORTATION SECURITY ADMINISTRATION,0,0,0,0,0,0,0,0,0,0,0,0,0,0,0,0,0,0,0,0,0,0,0,0,0,0,712,0,0,0,712,0,0,0,0,1,5,0,0,6,0,718,718
HSBD-BUREAU OF CUSTOMS AND BORDER PROTECTION,4,0,0,0,0,0,0,0,0,4,0,0,0,0,0,0,0,0,0,0,4,2,17,0,186,0,2,0,0,0,207,0,0,1,0,0,0,0,0,1,0,208,212
HSBE-FEDERAL LAW ENFORCEMENT TRAINING CENTERS,2,0,0,0,0,0,0,0,0,2,0,0,0,0,0,0,0,0,0,0,2,2,2,0,1,0,0,0,0,0,5,2,6,0,0,0,2,0,0,10,0,15,17
HSCB-FEDERAL EMERGENCY MANAGEMENT AGENCY,4,1,0,0,0,0,0,0,0,5,0,0,0,0,0,0,0,0,0,0,5,7,4,2,0,0,0,0,0,0,13,1,0,0,1,0,638,0,0,640,0,653,658
HSDA-DOMESTIC NUCLEAR DETECTION OFFICE,0,0,0,0,0,0,0,0,0,0,0,0,0,0,0,0,0,0,0,0,0,3,4,0,0,0,0,0,0,0,7,0,0,0,1,0,2,0,0,3,0,10,10
HSDB-OFFICE FOR INFORMATION ANALYSIS,0,0,0,0,0,0,0,0,0,0,0,0,0,0,0,0,0,0,0,0,0,0,0,0,0,0,0,0,0,0,0,0,0,0,0,0,0,0,0,0,0,0,0
HSEA-OFFICE OF THE UNDER SECRETARY FOR MANAGEMENT,0,0,0,0,0,0,0,0,0,0,0,0,0,0,0,0,0,0,0,0,0,0,0,0,0,0,0,0,0,0,0,0,0,0,0,0,0,0,0,0,0,0,0
HSFA-OFFICE OF THE UNDER SECRETARY FOR SCIENCE AND TECHNOLOGY,1,0,0,0,0,0,0,0,0,1,0,0,0,0,0,0,0,0,0,0,1,0,0,0,0,0,0,0,0,0,0,0,0,0,0,0,0,0,0,0,0,0,1
HT00-HARRY S. TRUMAN SCHOLARSHIP FOUNDATION,0,0,0,0,0,0,0,0,0,0,0,0,0,0,0,0,0,0,0,0,0,0,0,0,0,0,0,0,0,0,0,0,0,0,0,0,0,0,0,0,0,0,0
HU**-UNSPECIFIED,0,0,0,0,0,0,0,0,0,0,0,0,0,0,0,0,0,0,0,0,0,0,0,0,0,0,0,0,0,0,0,0,0,0,0,0,0,0,0,0,0,0,0
HU01-OFFICE OF THE SENIOR COORDINATOR FOR NEW ENGLAND,0,0,0,0,0,0,0,0,0,0,0,0,0,0,0,0,0,0,0,0,0,0,0,0,0,0,0,0,0,0,0,0,0,0,0,0,0,0,0,0,0,0,0
HU02-OFFICE OF THE SENIOR COORDINATOR FOR NEW YORK/NEW JERSEY,0,0,0,0,0,0,0,0,0,0,0,0,0,0,0,0,0,0,0,0,0,0,0,0,0,0,0,0,0,0,0,0,0,0,0,0,0,0,0,0,0,0,0
HU03-OFFICE OF THE SENIOR COORDINATOR FOR MID-ATLANTIC,0,0,0,0,0,0,0,0,0,0,0,0,0,0,0,0,0,0,0,0,0,0,0,0,0,0,0,0,0,0,0,0,0,0,0,0,0,0,0,0,0,0,0
HU04-OFFICE OF THE SENIOR COORDINATOR FOR SOUTHEAST/CARIBBEAN,2,0,0,0,0,0,0,0,0,2,0,0,0,0,0,0,0,0,0,0,2,0,0,0,0,0,0,0,0,0,0,0,0,0,0,0,0,0,0,0,0,0,2
HU05-OFFICE OF THE SENIOR COORDINATOR FOR MIDWEST,0,0,0,0,0,0,0,0,0,0,0,0,0,0,0,0,0,0,0,0,0,0,0,0,0,0,0,0,0,0,0,0,0,0,0,0,0,0,0,0,0,0,0
HU06-OFFICE OF THE SENIOR COORDINATOR FOR SOUTHWEST,0,0,0,0,0,0,0,0,0,0,0,0,0,0,0,0,0,0,0,0,0,0,0,0,1,0,0,0,0,0,1,0,0,0,0,0,0,0,0,0,0,1,1
HU07-OFFICE OF THE SENIOR COORDINATOR FOR GREAT PLAINS,0,0,0,0,0,0,0,0,0,0,0,0,0,0,0,0,0,0,0,0,0,0,0,0,0,0,0,0,0,0,0,0,0,0,0,0,0,0,0,0,0,0,0
HU08-OFFICE OF THE SENIOR COORDINATOR FOR ROCKY MOUNTAINS,0,0,0,0,0,0,0,0,0,0,0,0,0,0,0,0,0,0,0,0,0,0,0,0,0,0,0,0,0,0,0,0,0,0,0,0,0,0,0,0,0,0,0
HU09-OFFICE OF THE SENIOR COORDINATOR FOR PACIFIC/HAWAII,0,0,0,0,0,0,0,0,0,0,0,0,0,0,0,0,0,0,0,0,0,0,0,0,0,0,0,0,0,0,0,0,0,0,0,0,0,0,0,0,0,0,0
HU10-OFFICE OF THE SENIOR COORDINATOR FOR NORTHWEST/ALASKA,0,0,0,0,0,0,0,0,0,0,0,0,0,0,0,0,0,0,0,0,0,0,0,0,0,0,0,0,0,0,0,0,0,0,0,0,0,0,0,0,0,0,0
HUAA-OFFICE OF THE SECRETARY OF HOUSING AND URBAN DEVELOPMENT,0,0,0,0,0,0,0,0,0,0,0,0,0,0,0,0,0,0,0,0,0,0,0,0,0,0,0,0,0,0,0,0,0,0,0,0,0,0,0,0,0,0,0
HUBB-ASSISTANT SECRETARY FOR ADMINISTRATION,1,2,0,0,0,0,0,0,0,3,0,0,0,0,0,0,0,0,0,0,3,1,0,0,0,0,0,0,0,0,1,0,0,0,0,0,0,0,0,0,0,1,4
HUCC-OFFICE OF GENERAL COUNSEL,0,0,0,0,0,0,0,0,0,0,0,0,0,0,0,0,0,0,0,0,0,0,0,0,0,0,0,0,0,0,0,0,0,0,0,0,0,0,0,0,0,0,0
HUDD-ASSISTANT SECRETARY FOR COMMUNITY PLANNING AND DEVELOPMENT,0,0,0,0,0,0,0,0,0,0,0,0,0,0,0,0,0,0,0,0,0,0,0,0,0,0,0,0,0,0,0,0,0,0,1,0,0,0,0,1,0,1,1
