HUEE-ASSISTANT SECRETARY FOR FAIR HOUSING AND EQUAL OPPORTUNITY,0,0,0,0,0,0,0,0,0,0,0,0,0,0,0,0,0,0,0,0,0,0,0,0,0,0,0,0,0,0,0,0,0,0,0,0,0,0,0,0,0,0,0
HUFF-OFFICE OF THE CHIEF FINANCIAL OFFICER,0,0,0,0,0,0,0,0,0,0,0,0,0,0,0,0,0,0,0,0,0,0,0,0,0,0,0,0,0,0,0,0,0,0,0,0,0,0,0,0,0,0,0
HUFH-OFFICE OF FEDERAL HOUSING ENTERPRISE OVERSIGHT,3,0,0,0,0,0,0,0,0,3,0,0,0,0,0,0,0,0,0,0,3,1,6,0,0,0,0,0,0,0,7,0,0,0,0,0,0,0,0,0,0,7,10
HUGG-OFFICE OF INSPECTOR GENERAL,1,0,0,0,0,0,0,0,0,1,0,0,0,0,0,0,0,0,0,0,1,0,0,0,1,0,1,0,0,0,2,0,0,0,0,0,0,0,0,0,0,2,3
HUII-OFFICE OF DEPARTMENTAL OPERATIONS AND COORDINATION,0,0,0,0,0,0,0,0,0,0,0,0,0,0,0,0,0,0,0,0,0,0,0,0,0,0,0,0,0,0,0,0,0,0,0,0,0,0,0,0,0,0,0
HUJJ-ASSISTANT SECRETARY FOR CONGRESSIONAL AND INTERGOVERNMENTAL RELATIONS,0,0,0,0,0,0,0,0,0,0,0,0,0,0,0,0,0,0,0,0,0,0,0,0,0,0,0,0,0,0,0,0,0,0,0,0,0,0,0,0,0,0,0
HUKA-CENTER FOR FAITH-BASED AND COMMUNITY INITIATIVES,0,0,0,0,0,0,0,0,0,0,0,0,0,0,0,0,0,0,0,0,0,0,0,0,0,0,0,0,0,0,0,0,0,0,0,0,0,0,0,0,0,0,0
HUKK-OFFICE OF FIELD POLICY AND MANAGEMENT,0,0,0,0,0,0,0,0,0,0,0,0,0,0,0,0,0,0,0,0,0,0,0,0,0,0,0,0,0,0,0,0,0,0,1,0,0,0,0,1,0,1,1
HULL-OFFICE OF HEALTHY HOMES AND LEAD HAZARD CONTROL,0,0,0,0,0,0,0,0,0,0,0,0,0,0,0,0,0,0,0,0,0,0,0,0,0,0,0,0,0,0,0,0,0,0,0,0,0,0,0,0,0,0,0
HUMM-ASSISTANT SECRETARY FOR HOUSING--FEDERAL HOUSING COMMISSIONER,0,0,0,0,0,0,0,0,0,0,0,0,0,0,0,0,0,0,0,0,0,0,1,0,0,0,0,0,0,0,1,0,0,0,0,0,0,0,0,0,0,1,1
HUNN-OFFICE OF THE CHIEF PROCUREMENT OFFICER,0,0,0,0,0,0,0,0,0,0,0,0,0,0,0,0,0,0,0,0,0,0,0,0,0,0,0,0,0,0,0,0,0,0,0,0,0,0,0,0,0,0,0
HUPP-ASSISTANT SECRETARY FOR PUBLIC AND INDIAN HOUSING,0,0,0,0,0,0,0,0,0,0,0,0,0,0,0,0,0,0,0,0,0,0,1,0,0,0,0,0,0,0,1,0,0,0,0,0,0,0,0,0,0,1,1
HUQQ-OFFICE OF THE CHIEF INFORMATION OFFICER,0,0,0,0,0,0,0,0,0,0,0,0,0,0,0,0,0,0,0,0,0,0,0,0,0,0,0,0,0,0,0,0,0,0,0,0,0,0,0,0,0,0,0
HURR-ASSISTANT SECRETARY FOR POLICY DEVELOPMENT AND RESEARCH,0,0,0,0,0,0,0,0,0,0,0,0,0,0,0,0,0,0,0,0,0,0,0,0,0,0,0,0,0,0,0,0,0,0,0,0,0,0,0,0,0,0,0
HUTT-GOVERNMENT NATIONAL MORTGAGE ASSOCIATION (GINNIE MAE),0,0,0,0,0,0,0,0,0,0,0,0,0,0,0,0,0,0,0,0,0,0,0,0,0,0,0,0,0,0,0,0,0,0,0,0,0,0,0,0,0,0,0
HUUU-OFFICE OF DEPARTMENTAL EQUAL EMPLOYMENT OPPORTUNITY,0,0,0,0,0,0,0,0,0,0,0,0,0,0,0,0,0,0,0,0,0,0,0,0,0,0,0,0,0,0,0,0,0,0,0,0,0,0,0,0,0,0,0
HUWW-ASSISTANT SECRETARY FOR PUBLIC AFFAIRS,0,0,0,0,0,0,0,0,0,0,0,0,0,0,0,0,0,0,0,0,0,0,0,0,0,0,0,0,0,0,0,0,0,0,0,0,0,0,0,0,0,0,0
HW00-U.S. INTERAGENCY COUNCIL ON HOMELESSNESS,0,0,0,0,0,0,0,0,0,0,0,0,0,0,0,0,0,0,0,0,0,0,0,0,0,0,0,0,0,0,0,0,0,0,0,0,0,0,0,0,0,0,0
IB00-BROADCASTING BOARD OF GOVERNORS,0,0,0,0,0,0,0,0,0,0,0,0,0,0,0,0,0,0,0,0,0,0,2,0,1,0,0,0,0,0,3,0,0,0,0,0,4,0,0,4,0,7,7
IF00-INTER-AMERICAN FOUNDATION,0,0,0,0,0,0,0,0,0,0,0,0,0,0,0,0,0,0,0,0,0,0,0,0,0,0,0,0,0,0,0,0,0,0,0,0,0,0,0,0,0,0,0
IN01-OFFICE OF THE SECRETARY OF THE INTERIOR,4,0,0,0,0,0,0,0,0,4,0,0,0,0,0,0,0,0,0,0,4,1,12,2,0,0,0,0,0,0,15,1,0,1,1,0,0,0,0,3,0,18,22
IN05-BUREAU OF LAND MANAGEMENT,6,4,0,0,0,0,0,0,0,10,0,0,0,0,0,0,0,0,0,0,10,5,15,0,3,0,2,0,0,0,25,18,63,12,0,0,2,0,0,95,0,120,130
IN06-INDIAN AFFAIRS,3,0,0,0,0,0,0,0,0,3,0,0,0,0,0,0,0,0,0,0,3,2,1,24,0,0,1,0,0,0,28,0,10,0,0,0,29,0,0,39,0,67,70
IN07-BUREAU OF RECLAMATION,2,0,0,0,0,0,0,0,0,2,0,0,0,0,0,0,0,0,0,0,2,4,16,0,1,0,0,0,0,0,21,2,2,5,0,0,0,0,0,9,0,30,32
IN08-GEOLOGICAL SURVEY,2,0,0,0,0,0,0,0,0,2,0,0,0,0,0,0,0,0,0,0,2,3,2,0,5,0,0,0,0,0,10,7,16,24,0,0,0,0,0,47,0,57,59
IN10-NATIONAL PARK SERVICE,10,2,0,0,0,0,0,0,0,12,0,0,0,0,0,0,0,0,0,0,12,4,16,1,1,0,1,0,0,0,23,276,58,36,0,0,15,0,0,385,0,408,420
IN15-U.S. FISH AND WILDLIFE SERVICE,7,1,0,0,0,0,0,0,0,8,0,0,0,0,0,0,0,0,0,0,8,1,9,0,0,0,0,0,0,0,10,33,10,3,0,0,0,0,0,46,0,56,64
IN21-OFFICE OF THE SOLICITOR,0,0,0,0,0,0,0,0,0,0,0,0,0,0,0,0,0,0,0,0,0,0,0,0,0,0,0,0,0,0,0,0,0,0,0,0,0,0,0,0,0,0,0
"IN22-OFFICE OF SURFACE MINING, RECLAMATION AND ENFORCEMENT",0,0,0,0,0,0,0,0,0,0,0,0,0,0,0,0,0,0,0,0,0,0,0,0,0,0,0,0,0,0,0,0,0,0,1,0,0,0,0,1,0,1,1
IN23-MINERAL MANAGEMENT SERVICE,4,0,0,0,0,0,0,0,0,4,0,0,0,0,0,0,0,0,0,0,4,1,2,0,0,0,0,0,0,0,3,0,0,1,0,0,0,0,0,1,0,4,8
IN24-OFFICE OF THE INSPECTOR GENERAL,0,0,0,0,0,0,0,0,0,0,0,0,0,0,0,0,0,0,0,0,0,0,0,0,0,0,0,0,0,0,0,0,0,0,0,0,0,0,0,0,0,0,0
IW00-COMMISSION ON THE INTELLIGENCE CAPABILITIES OF THE UNITED STATES REGARDING WEAPONS OF MASS DESTRUCTION,0,0,0,0,0,0,0,0,0,0,0,0,0,0,0,0,0,0,0,0,0,0,0,0,0,0,0,0,0,0,0,0,0,0,0,0,1,0,0,1,0,1,1
KS00-CORPORATION FOR NATIONAL AND COMMUNITY SERVICE,0,0,0,0,0,0,0,0,0,0,0,0,0,0,0,0,0,0,0,0,0,0,0,0,0,0,4,0,0,0,4,0,0,0,0,0,2,0,0,2,0,6,6
LF00-FEDERAL ELECTION COMMISSION,0,0,0,0,0,0,0,0,0,0,0,0,0,0,0,0,0,0,0,0,0,0,0,0,0,0,1,0,0,0,1,0,0,0,0,0,0,0,0,0,0,1,1
LP00-GOVERNMENT PRINTING OFFICE,4,0,0,0,0,0,0,0,0,4,0,0,0,0,0,0,0,0,0,0,4,0,3,0,1,0,0,0,0,0,4,5,0,0,0,0,0,0,0,5,0,9,13
LT00-U.S. TAX COURT,0,0,0,0,0,0,0,0,0,0,0,0,0,0,0,0,0,0,0,0,0,0,0,0,0,0,0,0,0,0,0,0,0,0,0,0,0,0,0,0,0,0,0
MA00-MARINE MAMMAL COMMISSION,0,0,0,0,0,0,0,0,0,0,0,0,0,0,0,0,0,0,0,0,0,0,0,0,0,0,0,0,0,0,0,0,0,0,0,0,0,0,0,0,0,0,0
MC00-FEDERAL MARITIME COMMISSION,0,0,0,0,0,0,0,0,0,0,0,0,0,0,0,0,0,0,0,0,0,0,0,0,0,0,0,0,0,0,0,0,0,0,0,0,0,0,0,0,0,0,0
MI00-MILLENNIUM CHALLENGE CORPORATION,0,0,0,0,0,0,0,0,0,0,0,0,0,0,0,0,0,0,0,0,0,0,0,0,0,0,7,0,0,0,7,0,0,0,0,0,0,0,0,0,0,7,7
NF00-NATIONAL SCIENCE FOUNDATION,1,0,0,0,0,0,0,0,0,1,0,0,0,0,0,0,0,0,0,0,1,0,0,0,0,0,1,1,0,0,2,0,0,2,0,0,5,0,0,7,0,9,10
NK00-NATIONAL COUNCIL ON DISABILITY,0,0,0,0,0,0,0,0,0,0,0,0,0,0,0,0,0,0,0,0,0,0,0,0,0,0,0,0,0,0,0,0,0,0,0,0,0,0,0,0,0,0,0
NL00-NATIONAL LABOR RELATIONS BOARD,1,1,0,0,0,0,0,0,0,2,0,0,0,0,0,0,0,0,0,0,2,0,0,1,0,0,0,0,0,0,1,0,1,0,0,0,0,0,0,1,0,2,4
NM00-NATIONAL MEDIATION BOARD,0,0,0,0,0,0,0,0,0,0,0,0,0,0,0,0,0,0,0,0,0,0,1,0,0,0,0,0,0,0,1,0,0,0,0,0,0,0,0,0,0,1,1
"NN10-HEADQUARTERS, NASA",3,1,0,0,0,0,0,0,0,4,0,0,0,0,0,0,0,0,0,0,4,0,0,0,0,0,0,0,0,0,0,2,0,0,4,0,2,0,0,8,0,8,12
NN21-AMES RESEARCH CENTER,0,0,0,0,0,0,0,0,0,0,0,0,0,0,0,0,0,0,0,0,0,0,0,0,0,0,0,0,0,0,0,0,0,0,0,0,0,0,0,0,0,0,0
NN22-JOHN GLENN RESEARCH CENTER AT LEWIS FIELD,0,0,0,0,0,0,0,0,0,0,0,0,0,0,0,0,0,0,0,0,0,0,0,0,1,0,0,0,0,0,1,0,0,0,0,0,0,0,0,0,0,1,1
NN23-LANGLEY RESEARCH CENTER,0,0,0,0,0,0,0,0,0,0,0,0,0,0,0,0,0,0,0,0,0,0,0,0,0,0,0,0,0,0,0,0,0,0,0,0,0,0,0,0,0,0,0
NN24-DRYDEN FLIGHT RESEARCH CENTER,1,0,0,0,0,0,1,0,0,2,0,0,0,0,0,0,0,0,0,0,2,0,0,0,0,0,0,0,0,0,0,0,0,0,0,0,0,0,0,0,0,0,2
NN51-GODDARD SPACE FLIGHT CENTER,1,0,0,0,0,0,0,0,0,1,0,0,0,0,0,0,0,0,0,0,1,0,2,0,0,0,0,0,0,0,2,6,0,0,0,0,1,0,0,7,0,9,10
NN62-GEORGE C. MARSHALL SPACE FLIGHT CENTER,0,0,0,0,0,0,0,0,0,0,0,0,0,0,0,0,0,0,0,0,0,0,0,0,0,0,0,0,0,0,0,2,0,0,0,0,0,0,0,2,0,2,2
NN64-JOHN C. STENNIS SPACE CENTER,0,0,0,0,0,0,0,0,0,0,0,0,0,0,0,0,0,0,0,0,0,0,0,0,0,0,0,0,0,0,0,0,0,0,0,0,0,0,0,0,0,0,0
NN72-LYNDON B. JOHNSON SPACE CENTER,0,0,0,0,0,0,0,0,0,0,0,0,0,0,0,0,0,0,0,0,0,0,0,0,2,0,0,0,0,0,2,5,0,0,0,0,3,0,0,8,0,10,10
NN76-JOHN F. KENNEDY SPACE CENTER,0,0,0,0,0,0,0,0,0,0,0,0,0,0,0,0,0,0,0,0,0,0,0,0,3,0,0,0,0,0,3,2,0,0,0,0,0,0,0,2,0,5,5
NP00-NATIONAL CAPITAL PLANNING COMMISSION,0,0,0,0,0,0,0,0,0,0,0,0,0,0,0,0,0,0,0,0,0,0,0,0,0,0,0,0,0,0,0,0,0,0,0,0,0,0,0,0,0,0,0
NQ00-NATIONAL ARCHIVES AND RECORDS ADMINISTRATION,4,0,0,0,0,0,0,0,0,4,0,0,0,0,0,0,0,0,0,0,4,0,18,0,0,0,0,0,0,0,18,14,1,20,0,0,0,0,0,35,0,53,57
NS00-NATIONAL SECURITY COUNCIL,0,0,0,0,0,0,0,0,0,0,0,0,0,0,0,0,0,0,0,0,0,0,0,0,0,0,0,0,0,0,0,0,1,0,0,0,0,0,0,1,0,1,1
NU00-NUCLEAR REGULATORY COMMISSION,0,0,0,0,0,0,0,0,0,0,0,0,0,0,0,0,0,0,0,0,0,0,0,0,0,0,19,1,0,0,20,0,0,0,0,0,4,0,0,4,0,24,24
NV11-IMMEDIATE OFFICE OF THE CHIEF OF NAVAL OPERATIONS,3,1,0,0,0,0,0,0,0,4,0,0,0,0,0,0,0,0,0,0,4,0,14,1,1,0,5,0,0,0,21,2,1,4,0,0,2,0,0,9,0,30,34
"NV12-ASSISTANT FOR ADMINISTRATION, UNDER SECRETARY OF THE NAVY",3,1,0,0,0,1,0,0,0,5,0,0,0,0,0,0,0,0,0,0,5,3,6,28,11,0,5,0,0,0,53,0,1,3,1,1,1,0,0,7,0,60,65
NV14-OFFICE OF NAVAL RESEARCH,3,0,0,0,0,0,0,0,0,3,0,0,0,0,0,0,0,0,0,0,3,0,5,0,3,0,0,0,0,0,8,1,0,4,0,0,1,0,0,6,0,14,17
NV15-NAVAL INTELLIGENCE COMMAND,0,0,0,0,0,0,0,0,0,0,0,0,0,0,0,0,0,0,0,0,0,0,0,0,0,0,10,0,0,0,10,0,0,0,0,0,0,0,0,0,0,10,10
NV18-NAVAL MEDICAL COMMAND,5,0,0,0,0,0,0,0,0,5,0,0,0,0,0,0,0,0,0,0,5,3,40,0,0,0,8,0,0,0,51,3,7,6,0,0,2,0,0,18,0,69,74
NV19-NAVAL AIR SYSTEMS COMMAND,1,1,0,0,0,0,0,0,0,2,0,0,0,0,0,0,0,0,0,0,2,2,18,1,6,0,6,0,0,0,33,1,0,0,0,0,1,0,0,2,0,35,37
NV22-BUREAU OF NAVAL PERSONNEL,0,0,0,0,0,0,0,0,0,0,0,0,0,0,0,0,0,0,0,0,0,2,5,0,0,0,5,0,0,0,12,0,0,0,0,0,0,0,0,0,0,12,12
NV23-NAVAL SUPPLY SYSTEMS COMMAND,1,1,0,0,0,0,0,0,0,2,0,0,0,0,0,0,0,0,0,0,2,0,6,1,0,0,1,0,0,0,8,2,0,0,0,0,0,0,0,2,0,10,12
NV24-NAVAL SEA SYSTEMS COMMAND,0,0,0,0,0,0,0,0,0,0,0,0,0,0,0,0,0,0,0,0,0,2,14,0,1,0,2,0,0,0,19,1,0,0,0,0,0,0,0,1,0,20,20
NV25-NAVAL FACILITIES ENGINEERING COMMAND,3,1,0,0,0,0,0,0,0,4,0,0,0,0,0,0,0,0,0,0,4,2,11,0,6,0,2,0,0,0,21,1,0,0,0,0,0,0,0,1,0,22,26
NV27-U.S. MARINE CORPS,3,3,0,0,0,0,0,0,0,6,0,0,0,0,0,0,0,0,0,0,6,5,58,1,0,0,13,0,0,0,77,56,5,2,0,0,0,0,0,63,0,140,146
NV30-STRATEGIC SYSTEMS PROGRAMS OFFICE,1,0,0,0,0,1,0,0,0,2,0,0,0,0,0,0,0,0,0,0,2,1,1,0,0,0,0,0,0,0,2,0,0,0,0,0,0,0,0,0,0,2,4
NV33-MILITARY SEALIFT COMMAND,0,0,0,0,0,0,0,0,0,0,0,0,0,0,0,0,0,0,0,0,0,0,3,31,0,0,0,0,0,0,34,0,36,0,0,0,0,0,0,36,0,70,70
NV39-SPACE AND NAVAL WARFARE SYSTEMS COMMAND,2,0,0,0,0,0,0,0,0,2,0,0,0,0,0,0,0,0,0,0,2,2,12,0,15,0,4,0,0,0,33,6,0,3,0,0,0,0,0,9,0,42,44
NV41-NAVY SYSTEMS MANAGEMENT ACTIVITY,1,0,0,0,0,0,0,0,0,1,0,0,0,0,0,0,0,0,0,0,1,0,0,0,0,0,0,0,0,0,0,0,0,0,0,0,0,0,0,0,0,0,1
"NV52-COMMANDER, NAVY INSTALLATIONS",7,3,0,0,0,0,0,0,0,10,0,0,0,0,0,0,0,0,0,0,10,11,47,0,2,0,9,0,0,0,69,21,5,1,0,0,21,0,0,48,0,117,127
"NV60-U.S. ATLANTIC FLEET, COMMANDER IN CHIEF",2,0,0,0,0,0,0,0,0,2,0,0,0,0,0,0,0,0,0,0,2,0,14,0,1,0,8,0,0,0,23,4,0,1,0,0,0,0,0,5,0,28,30
"NV61-U.S. NAVAL FORCES, EUROPE",0,0,0,0,0,0,0,0,0,0,0,0,0,0,0,0,0,0,0,0,0,0,1,0,0,0,0,0,0,0,1,0,1,0,0,0,2,0,0,3,0,4,4
NV62-CHIEF OF NAVAL EDUCATION AND TRAINING,0,0,0,0,0,0,0,0,0,0,0,0,0,0,0,0,0,0,0,0,0,0,0,0,0,0,0,0,0,0,0,0,0,0,0,0,0,0,0,0,0,0,0
NV69-NAVAL SECURITY GROUP COMMAND,0,0,0,0,0,0,0,0,0,0,0,0,0,0,0,0,0,0,0,0,0,0,0,0,0,0,2,0,0,0,2,0,0,0,0,0,0,0,0,0,0,2,2
"NV70-U.S. PACIFIC FLEET, COMMANDER IN CHIEF",0,0,0,0,0,0,0,0,0,0,0,0,0,0,0,0,0,0,0,0,0,3,22,0,51,0,11,0,0,0,87,1,0,6,0,0,0,0,0,7,0,94,94
NV72-NAVAL RESERVE FORCE,0,0,0,0,0,0,0,0,0,0,0,0,0,0,0,0,0,0,0,0,0,1,0,0,0,0,0,0,0,0,1,2,0,0,0,0,1,0,0,3,0,4,4
NV74-NAVAL SPECIAL WARFARE COMMAND,0,0,0,0,0,0,0,0,0,0,0,0,0,0,0,0,0,0,0,0,0,0,2,0,0,0,1,0,0,0,3,1,0,0,0,0,0,0,0,1,0,4,4
NV76-NAVAL EDUCATION AND TRAINING COMMAND,3,0,0,0,0,0,0,0,0,3,0,0,0,0,0,0,0,0,0,0,3,1,8,0,7,0,4,0,0,0,20,2,0,0,0,0,0,0,0,2,0,22,25
OM00-OFFICE OF PERSONNEL MANAGEMENT,1426,89,0,0,0,43,0,0,0,1558,0,0,0,0,0,0,0,0,0,0,1558,2,8,17,2,0,0,0,0,0,29,9,7,3,1,0,0,0,0,20,0,49,1607
OS00-OCCUPATIONAL SAFETY AND HEALTH REVIEW COMMISSION,1,0,0,0,0,0,0,0,0,1,0,0,0,0,0,0,0,0,0,0,1,0,0,0,0,0,0,0,0,0,0,0,0,0,0,0,0,0,0,0,0,0,1
PU00-PEACE CORPS,0,0,0,0,0,0,0,0,0,0,0,0,0,0,0,0,0,0,0,0,0,0,0,0,0,0,0,0,0,0,0,0,0,0,0,0,13,0,0,13,0,13,13
QQ00-OFFICE OF NATIONAL DRUG CONTROL POLICY,0,0,0,0,0,0,0,0,0,0,0,0,0,0,0,0,0,0,0,0,0,0,0,0,0,0,0,0,0,0,0,0,0,0,2,0,0,0,0,2,0,2,2
RE00-OFFICE OF NAVAJO AND HOPI INDIAN RELOCATION,0,0,0,0,0,0,0,0,0,0,0,0,0,0,0,0,0,0,0,0,0,0,0,0,0,0,0,0,0,0,0,0,0,0,0,0,0,0,0,0,0,0,0
RF00-FEDERAL RETIREMENT THRIFT INVESTMENT BOARD,0,0,0,0,0,0,0,0,0,0,0,0,0,0,0,0,0,0,0,0,0,0,0,0,0,0,0,0,0,0,0,0,0,0,0,0,0,0,0,0,0,0,0
RH00-ARMED FORCES RETIREMENT HOME,1,0,0,0,0,0,0,0,0,1,0,0,0,0,0,0,0,0,0,0,1,0,0,0,0,0,0,0,0,0,0,0,0,0,0,0,0,0,0,0,0,0,1
RR00-RAILROAD RETIREMENT BOARD,0,1,0,0,0,0,0,0,0,1,0,0,0,0,0,0,0,0,0,0,1,0,0,0,0,0,0,0,0,0,0,0,0,0,0,0,0,0,0,0,0,0,1
RS00-FEDERAL MINE SAFETY AND HEALTH REVIEW COMMISSION,0,0,0,0,0,0,0,0,0,0,0,0,0,0,0,0,0,0,0,0,0,0,0,0,0,0,0,0,0,0,0,0,0,0,0,0,0,0,0,0,0,0,0
SB00-SMALL BUSINESS ADMINISTRATION,2,0,0,0,0,0,0,0,0,2,0,0,0,0,0,0,0,0,0,0,2,0,4,2,0,0,0,0,0,0,6,1,7,0,3,0,1,0,0,12,0,18,20
SE00-SECURITIES AND EXCHANGE COMMISSION,1,0,0,0,0,0,0,0,0,1,0,0,0,0,0,0,0,0,0,0,1,1,20,13,0,0,0,0,0,0,34,3,2,1,0,0,0,0,0,6,0,40,41
SK00-CONSUMER PRODUCT SAFETY COMMISSION,0,0,0,0,0,0,0,0,0,0,0,0,0,0,0,0,0,0,0,0,0,0,0,0,0,0,0,0,0,0,0,0,0,0,0,0,0,0,0,0,0,0,0
SM01-NATIONAL GALLERY OF ART,0,0,0,0,0,0,0,0,0,0,0,0,0,0,0,0,0,0,0,0,0,1,0,1,0,0,0,0,0,0,2,1,0,0,0,0,0,0,0,1,0,3,3
SM02-WOODROW WILSON INTERNATIONAL CENTER FOR SCHOLARS,0,0,0,0,0,0,0,0,0,0,0,0,0,0,0,0,0,0,0,0,0,0,0,0,0,0,0,0,0,0,0,0,0,0,0,0,0,0,0,0,0,0,0
SM03-SMITHSONIAN INSTITUTION (EXCEPT UNITS ADMINISTERED UNDER SEPARATE BOARDS OF TRUSTEES),0,0,0,0,0,0,0,0,0,0,0,0,0,0,0,0,0,0,0,0,0,3,10,0,0,0,1,0,0,0,14,1,0,0,0,0,0,0,0,1,0,15,15
SM04-JOHN F. KENNEDY CENTER FOR THE PERFORMING ARTS,1,0,0,0,0,0,0,0,0,1,0,0,0,0,0,0,0,0,0,0,1,0,0,0,0,0,0,0,0,0,0,0,0,0,0,0,0,0,0,0,0,0,1
SS00-SELECTIVE SERVICE SYSTEM,1,0,0,0,0,0,0,0,0,1,0,0,0,0,0,0,0,0,0,0,1,1,0,0,0,0,0,0,0,0,1,0,0,0,1,0,0,0,0,1,0,2,3
ST00-DEPARTMENT OF STATE,4,0,0,0,0,0,0,0,0,4,0,0,0,0,0,0,0,0,0,0,4,1,23,0,7,0,111,0,0,0,142,33,14,6,6,1,57,0,0,117,7,266,270
SZ00-SOCIAL SECURITY ADMINISTRATION,5,0,0,0,0,0,0,0,0,5,0,0,0,0,0,0,0,0,0,0,5,4,33,1,35,0,1,0,0,0,74,0,14,4,1,0,1,0,0,20,0,94,99
TB00-NATIONAL TRANSPORTATION SAFETY BOARD,2,0,0,0,0,0,0,0,0,2,0,0,0,0,0,0,0,0,0,0,2,0,0,0,0,0,0,0,0,0,0,0,0,0,0,0,0,0,0,0,0,0,2
TC00-U.S. INTERNATIONAL TRADE COMMISSION,1,0,0,0,0,0,0,0,0,1,0,0,0,0,0,0,0,0,0,0,1,0,0,0,0,0,0,0,0,0,0,1,0,0,0,0,0,0,0,1,0,1,2
TD01-OFFICE OF THE SECRETARY OF TRANSPORTATION,2,1,0,0,0,0,0,0,0,3,0,0,0,0,0,0,0,0,0,0,3,0,1,0,1,0,0,0,0,0,2,1,0,0,1,0,0,0,0,2,0,4,7
TD03-FEDERAL AVIATION ADMINISTRATION,0,0,0,0,0,0,0,0,0,0,0,0,0,0,0,0,0,0,0,0,0,0,0,0,0,0,116,0,0,0,116,0,0,0,0,0,24,0,0,24,0,140,140
TD04-FEDERAL HIGHWAY ADMINISTRATION,6,0,0,0,0,0,0,0,0,6,0,0,0,0,0,0,0,0,0,0,6,0,5,0,1,0,0,0,0,0,6,1,0,2,0,0,0,0,0,3,0,9,15
TD05-FEDERAL RAILROAD ADMINISTRATION,1,0,0,0,0,0,0,0,0,1,0,0,0,0,0,0,0,0,0,0,1,0,4,0,1,0,0,0,0,0,5,0,0,1,0,0,0,0,0,1,0,6,7
TD06-SAINT LAWRENCE SEAWAY DEVELOPMENT CORPORATION,0,0,0,0,0,0,0,0,0,0,0,0,0,0,0,0,0,0,0,0,0,0,0,0,0,0,0,0,0,0,0,0,0,0,0,0,0,0,0,0,0,0,0
TD09-FEDERAL TRANSIT ADMINISTRATION,0,0,0,0,0,0,0,0,0,0,0,0,0,0,0,0,0,0,0,0,0,0,0,0,0,0,0,0,0,0,0,0,0,0,0,0,0,0,0,0,0,0,0
TD10-NATIONAL HIGHWAY TRAFFIC SAFETY ADMINISTRATION,0,0,0,0,0,0,0,0,0,0,0,0,0,0,0,0,0,0,0,0,0,1,3,0,0,0,0,0,0,0,4,0,0,0,0,0,0,0,0,0,0,4,4
TD11-RESEARCH AND INNOVATIVE TECHNONOGY ADMINSTRATION,0,0,0,0,0,0,0,0,0,0,0,0,0,0,0,0,0,0,0,0,0,0,0,0,2,0,0,0,0,0,2,0,0,0,0,0,0,0,0,0,0,2,2
TD12-OFFICE OF INSPECTOR GENERAL,2,0,0,0,0,0,0,0,0,2,0,0,0,0,0,0,0,0,0,0,2,0,0,0,0,0,0,0,0,0,0,0,0,1,0,0,0,0,0,1,1,2,4
TD13-MARITIME ADMINISTRATION,3,1,0,0,0,0,0,0,0,4,0,0,0,0,0,0,0,0,0,0,4,0,0,0,0,0,0,0,0,0,0,0,0,0,0,0,0,0,0,0,0,0,4
TD15-SURFACE TRANSPORTATION BOARD,0,0,0,0,0,0,0,0,0,0,0,0,0,0,0,0,0,0,0,0,0,0,0,0,0,0,0,0,0,0,0,0,0,0,0,0,0,0,0,0,0,0,0
TD16-PIPELINE AND HAZARDOUS MATERIALS SAFETY ADMINISTRATION,0,0,0,0,0,0,0,0,0,0,0,0,0,0,0,0,0,0,0,0,0,0,0,0,0,0,0,0,0,0,0,0,0,0,0,0,0,0,0,0,0,0,0
TD17-FEDERAL MOTOR CARRIER SAFETY ADMINISTRATION,0,0,0,0,0,0,0,0,0,0,0,0,0,0,0,0,0,0,0,0,0,1,4,0,4,0,0,0,0,0,9,0,0,0,0,0,0,0,0,0,0,9,9
TN00-OFFICE OF THE U.S. TRADE REPRESENTATIVE,0,0,0,0,0,0,0,0,0,0,0,0,0,0,0,0,0,0,0,0,0,0,0,0,0,0,0,0,0,0,0,0,0,0,0,0,0,0,0,0,0,0,0
TR35-OFFICE OF THRIFT SUPERVISION,1,1,0,0,0,0,0,0,0,2,0,0,0,0,0,0,0,0,0,0,2,0,6,0,0,0,0,0,0,0,6,0,0,0,0,0,0,0,0,0,0,6,8
TR40-ALCOHOL AND TOBACCO TAX AND TRADE BUREAU,3,0,0,0,0,0,0,0,0,3,0,0,0,0,0,0,0,0,0,0,3,0,5,0,0,0,0,0,0,0,5,1,0,0,0,0,0,0,0,1,0,6,9
TR91-DEPARTMENTAL OFFICES,1,0,0,0,0,0,0,0,0,1,0,0,0,0,0,0,0,0,0,0,1,0,3,0,1,0,0,0,0,0,4,0,2,0,5,0,0,1,0,8,0,12,13
TR93-INTERNAL REVENUE SERVICE,4,1,0,0,0,0,0,0,0,5,0,0,0,0,0,0,0,0,0,0,5,5,695,7,2,0,0,0,0,0,709,859,59,121,0,0,0,0,0,1039,0,1748,1753
TR95-OFFICE OF INSPECTOR GENERAL,1,0,0,0,0,0,0,0,0,1,0,0,0,0,0,0,0,0,0,0,1,0,0,0,0,0,0,0,0,0,0,0,0,0,0,0,0,0,0,0,0,0,1
TRAA-FINANCIAL MANAGEMENT SERVICE,1,0,0,0,0,0,0,0,0,1,0,0,0,0,0,0,0,0,0,0,1,1,2,0,0,0,0,0,0,0,3,2,0,2,0,0,0,0,0,4,0,7,8
TRAB-BUREAU OF THE PUBLIC DEBT,0,0,0,0,0,0,0,0,0,0,0,0,0,0,0,0,0,0,0,0,0,0,2,0,2,0,0,0,0,0,4,0,0,2,0,0,0,0,0,2,0,6,6
TRAD-U.S. MINT,0,0,0,0,0,0,0,0,0,0,0,0,0,0,0,0,0,0,0,0,0,0,2,0,0,0,0,0,0,0,2,1,0,0,0,0,0,0,0,1,0,3,3
TRAF-FINANCIAL CRIMES ENFORCEMENT NETWORK,0,0,0,0,0,0,0,0,0,0,0,0,0,0,0,0,0,0,0,0,0,0,0,0,0,0,0,0,0,0,0,0,0,1,0,0,0,0,0,1,0,1,1
TRAI-BUREAU OF ENGRAVING AND PRINTING,2,1,0,0,0,0,0,0,0,3,0,0,0,0,0,0,0,0,0,0,3,0,2,0,0,0,0,0,0,0,2,0,0,0,0,0,0,0,0,0,0,2,5
TRAJ-OFFICE OF THE COMPTROLLER OF THE CURRENCY,4,0,0,0,0,0,0,0,0,4,0,0,0,0,0,0,0,0,0,0,4,0,1,0,1,0,0,0,0,0,2,0,0,0,0,0,0,0,0,0,0,2,6
TRTG-OFFICE OF THE INSPECTOR GENERAL FOR TAX ADMINISTRATION,1,0,0,0,0,0,0,0,0,1,0,0,0,0,0,0,0,0,0,0,1,0,1,1,1,0,0,0,0,0,3,0,0,0,0,0,0,0,0,0,0,3,4
TS00-OFFICE OF SCIENCE AND TECHNOLOGY POLICY,0,0,0,0,0,0,0,0,0,0,0,0,0,0,0,0,0,0,0,0,0,0,1,0,0,0,0,0,0,0,1,0,0,0,0,0,0,0,0,0,0,1,1
UJ00-JAPAN-UNITED STATES FRIENDSHIP COMMISSION,0,0,0,0,0,0,0,0,0,0,0,0,0,0,0,0,0,0,0,0,0,0,0,0,0,0,0,0,0,0,0,0,0,0,0,0,0,0,0,0,0,0,0
UT00-UTAH RECLAMATION MITIGATION AND CONSERVATION COMMISSION,0,0,0,0,0,0,0,0,0,0,0,0,0,0,0,0,0,0,0,0,0,0,0,0,0,0,0,0,0,0,0,0,0,0,0,0,0,0,0,0,0,0,0
VA**-UNSPECIFIED,0,0,0,0,0,0,0,0,0,0,0,0,0,0,0,0,0,0,0,0,0,0,0,0,0,0,1,0,0,0,1,0,0,0,0,0,0,0,0,0,0,1,1
VAAA-OFFICE OF THE SECRETARY,0,0,0,0,0,0,0,0,0,0,0,0,0,0,0,0,0,0,0,0,0,0,1,0,0,0,0,0,0,0,1,0,0,0,0,0,1,0,0,1,0,2,2
VAAC-BOARD OF CONTRACT APPEALS,0,0,0,0,0,0,0,0,0,0,0,0,0,0,0,0,0,0,0,0,0,0,0,0,0,0,0,0,0,0,0,0,0,0,0,0,0,0,0,0,0,0,0
VAAD-BOARD OF VETERANS APPEALS,0,0,0,0,0,0,0,0,0,0,0,0,0,0,0,0,0,0,0,0,0,0,0,0,0,0,0,0,0,0,0,0,0,0,0,0,0,0,0,0,0,0,0
VAAE-GENERAL COUNSEL,0,0,0,0,0,0,0,0,0,0,0,0,0,0,0,0,0,0,0,0,0,0,0,3,0,0,1,0,0,0,4,0,1,0,0,0,0,0,0,1,0,5,5
VAAF-INSPECTOR GENERAL,1,0,0,0,0,0,0,0,0,1,0,0,0,0,0,0,0,0,0,0,1,1,1,0,0,0,0,0,0,0,2,0,0,0,0,0,0,0,0,0,0,2,3
VAAH-OFFICE OF SMALL AND DISADVANTAGED BUSINESS UTILIZATION,0,0,0,0,0,0,0,0,0,0,0,0,0,0,0,0,0,0,0,0,0,0,0,0,0,0,0,0,0,0,0,0,0,0,0,0,0,0,0,0,0,0,0
VABA-IMMEDIATE OFFICE OF THE ASSISTANT SECRETARY FOR HUMAN RESOURCES AND ADMINISTRATION,0,0,0,0,0,0,0,0,0,0,0,0,0,0,0,0,0,0,0,0,0,0,0,0,0,0,0,0,0,0,0,0,0,0,0,0,0,0,0,0,0,0,0
VABC-ASSISTANT SECRETARY FOR HUMAN RESOURCES MANAGEMENT,1,0,0,0,0,0,0,0,0,1,0,0,0,0,0,0,0,0,0,0,1,0,0,0,0,0,0,0,0,0,0,0,0,0,0,0,0,0,0,0,0,0,1
VABD-DEPUTY ASSISTANT SECRETARY FOR EQUAL OPPORTUNITY,0,0,0,0,0,0,0,0,0,0,0,0,0,0,0,0,0,0,0,0,0,0,0,0,0,0,0,0,0,0,0,0,0,0,0,0,0,0,0,0,0,0,0
VABE-DEPUTY ASSISTANT SECRETARY FOR ADMINISTRATION,0,0,0,0,0,0,0,0,0,0,0,0,0,0,0,0,0,0,0,0,0,0,0,0,0,0,0,0,0,0,0,0,0,0,0,0,0,0,0,0,0,0,0
VABF-DEPUTY ASSISTANT SECRETARY FOR OFFICE OF RESOLUTION MANAGEMENT,0,0,0,0,0,0,0,0,0,0,0,0,0,0,0,0,0,0,0,0,0,0,0,0,0,0,0,0,0,0,0,0,0,0,0,0,0,0,0,0,0,0,0
VADA-IMMEDIATE OFFICE OF THE ASSISTANT SECRETARY FOR MANAGEMENT,0,0,0,0,0,0,0,0,0,0,0,0,0,0,0,0,0,0,0,0,0,0,0,0,0,0,0,0,0,0,0,0,0,0,0,0,0,0,0,0,0,0,0
VADC-DEPUTY ASSISTANT SECRETARY FOR BUDGET,1,0,0,0,0,0,0,0,0,1,0,0,0,0,0,0,0,0,0,0,1,0,0,0,0,0,0,0,0,0,0,0,0,0,0,0,0,0,0,0,0,0,1
VADD-DEPUTY ASSISTANT SECRETARY FOR FINANCE,0,0,0,0,0,0,0,0,0,0,0,0,0,0,0,0,0,0,0,0,0,1,1,0,1,0,0,0,0,0,3,2,0,0,0,0,0,0,0,2,0,5,5
VADG-DEPUTY ASSISTANT SECRETARY FOR ACQUISITION AND MATERIEL MANAGEMENT,1,0,0,0,0,0,0,0,0,1,0,0,0,0,0,0,0,0,0,0,1,0,1,0,0,0,1,0,0,0,2,0,0,0,0,0,0,0,0,0,0,2,3
VAEA-IMMEDIATE OFFICE OF THE ASSISTANT SECRETARY FOR INFORMATION AND TECHNOLOGY,0,0,0,0,0,0,0,0,0,0,0,0,0,0,0,0,0,0,0,0,0,0,0,0,0,0,0,0,0,0,0,0,0,0,0,0,0,0,0,0,0,0,0
VAEB-DEPUTY ASSISTANT SECRETARY FOR INFORMATION AND TECHNOLOGY,0,0,0,0,0,0,0,0,0,0,0,0,0,0,0,0,0,0,0,0,0,0,1,0,0,0,1,0,0,0,2,0,0,0,0,0,0,0,0,0,0,2,2
VAHA-IMMEDIATE OFFICE OF THE ASSISTANT SECRETARY FOR POLICY AND PLANNING,0,0,0,0,0,0,0,0,0,0,0,0,0,0,0,0,0,0,0,0,0,0,0,0,0,0,0,0,0,0,0,0,0,0,0,0,0,0,0,0,0,0,0
VAHB-DEPUTY ASSISTANT SECRETARY FOR PROGRAM AND DATA ANALYSIS,0,0,0,0,0,0,0,0,0,0,0,0,0,0,0,0,0,0,0,0,0,0,0,0,0,0,0,0,0,0,0,0,0,0,0,0,0,0,0,0,0,0,0
VAHC-DEPUTY ASSISTANT SECRETARY FOR PLANNING AND EVALUATION,0,0,0,0,0,0,0,0,0,0,0,0,0,0,0,0,0,0,0,0,0,0,0,0,0,0,0,0,0,0,0,0,0,0,0,0,0,0,0,0,0,0,0
VAHD-NATIONAL CENTER FOR VETERAN ANALYSIS AND STATISTICS,0,0,0,0,0,0,0,0,0,0,0,0,0,0,0,0,0,0,0,0,0,0,0,0,0,0,0,0,0,0,0,0,0,0,0,0,0,0,0,0,0,0,0
VAJA-OFFICE OF THE ASSISTANT SECRETARY FOR PUBLIC AND INTERGOVERNMENTAL AFFAIRS,0,0,0,0,0,0,0,0,0,0,0,0,0,0,0,0,0,0,0,0,0,0,0,0,0,0,0,0,0,0,0,0,0,0,0,0,0,0,0,0,0,0,0
VAJB-DEPUTY ASSISTANCE SECRETARY FOR INTERGOVERNMENTAL AFFAIRS,0,0,0,0,0,0,0,0,0,0,0,0,0,0,0,0,0,0,0,0,0,0,0,0,0,0,0,0,0,0,0,0,0,0,0,0,0,0,0,0,0,0,0
VAJC-DEPUTY ASSISTANT SECRETARY FOR PUBLIC AFFAIRS,0,0,0,0,0,0,0,0,0,0,0,0,0,0,0,0,0,0,0,0,0,0,0,0,0,0,0,0,0,0,0,0,0,0,1,0,0,0,0,1,0,1,1
VAKA-IMMEDIATE OFFICE OF THE ASSISTANT SECRETARY FOR CONGRESSIONAL AND LEGISLATIVE AFFAIRS,0,0,0,0,0,0,0,0,0,0,0,0,0,0,0,0,0,0,0,0,0,0,0,0,0,0,0,0,0,0,0,0,0,0,0,0,0,0,0,0,0,0,0
VAKB-DEPUTY ASSISTANT SECRETARY FOR CONGRESSIONAL AFFAIRS,0,0,0,0,0,0,0,0,0,0,0,0,0,0,0,0,0,0,0,0,0,0,0,0,0,0,0,0,0,0,0,0,0,0,0,0,0,0,0,0,0,0,0
VALA-VETERANS BENEFITS ADMINISTRATION,1,0,0,0,0,0,0,0,0,1,0,0,0,0,0,0,0,0,0,0,1,2,10,0,15,0,10,0,0,0,37,2,0,2,0,0,0,0,0,4,0,41,42
VAPA-NATIONAL CEMETERY ADMINISTRATION,3,0,0,0,0,0,0,0,0,3,0,0,0,0,0,0,0,0,0,0,3,0,7,0,0,0,2,0,0,0,9,13,0,0,0,0,5,0,0,18,0,27,30
VATA-VETERANS HEALTH ADMINISTRATION,21,6,0,0,0,1,0,0,0,28,0,0,0,0,0,0,0,0,0,1,29,36,382,4,1,0,385,0,0,0,808,71,25,26,0,0,508,0,0,630,12,1450,1479
YA00-COMMISSION ON THE REVIEW OF THE OVERSEAS MILITARY FACILITY STRUCTURE OF THE UNITED STATES,0,0,0,0,0,0,0,0,0,0,0,0,0,0,0,0,0,0,0,0,0,0,0,0,0,0,0,0,0,0,0,0,0,0,0,0,0,0,0,0,0,0,0
YB00-ANTITRUST MODERNIZATION COMMISSION,0,0,0,0,0,0,0,0,0,0,0,0,0,0,0,0,0,0,0,0,0,0,0,0,0,0,0,0,0,0,0,0,0,0,0,0,0,0,0,0,0,0,0
YD00-HELPING TO ENHANCE THE LIVELIHOOD OF PEOPLE (HELP) AROUND THE GLOBE COMMISSION,0,0,0,0,0,0,0,0,0,0,0,0,0,0,0,0,0,0,0,0,0,0,0,0,0,0,0,0,0,0,0,0,0,0,0,0,0,0,0,0,0,0,0
YE00-COMMISSION ON THE PREVENTION OF WEAPONS OF MASS DESTRUCTION PROLIFERATION AND TERRORISM,0,0,0,0,0,0,0,0,0,0,0,0,0,0,0,0,0,0,0,0,0,0,0,0,0,0,0,0,0,0,0,0,0,0,0,0,0,0,0,0,0,0,0
ZL00-MEDICARE PAYMENT ADVISORY COMMISSION,0,0,0,0,0,0,0,0,0,0,0,0,0,0,0,0,0,0,0,0,0,0,0,0,0,0,2,0,0,0,2,0,0,0,0,0,0,0,0,0,0,2,2
ZP00-U.S. COMMISSION ON INTERNATIONAL RELIGIOUS FREEDOM,0,0,0,0,0,0,0,0,0,0,0,0,0,0,0,0,0,0,0,0,0,0,0,0,0,0,0,0,0,0,0,0,0,0,0,0,1,0,0,1,0,1,1
ZS00-UNITED STATES-CHINA ECONOMIC AND SECURITY REVIEW COMMISSION,0,0,0,0,0,0,0,0,0,0,0,0,0,0,0,0,0,0,0,0,0,0,0,0,0,0,0,0,0,0,0,0,0,0,0,0,0,0,0,0,0,0,0
ZU00-DWIGHT D. EISENHOWER MEMORIAL COMMISSION,0,0,0,0,0,0,0,0,0,0,0,0,0,0,0,0,0,0,0,0,0,0,0,0,0,0,0,0,0,0,0,0,0,0,0,0,0,0,0,0,0,0,0
All Agencies,2094,219,0,0,0,49,2,2,1,2367,0,0,0,0,0,0,0,0,0,2,2369,357,3884,360,702,0,2265,8,11,0,7587,2593,1678,763,110,8,1551,1,0,6704,42,14333,16702
