"352","EDEL","EDEL-OFFICE OF THE CHIEF FINANCIAL OFFICER",138,20,1,2,1,0,3,3,0,0,168,0,0,4,0,2,0,0,0,0,6,0,174,"EDEL-OFFICE OF THE CHIEF FINANCIAL OFFICER",141,21,1,5,0,0,2,2,0,0,172,0,0,7,0,0,0,0,0,0,7,0,179,"EDEL-OFFICE OF THE CHIEF FINANCIAL OFFICER",152,21,2,3,0,1,3,0,0,182,0,0,9,0,0,0,0,0,9,0,191,"EDEL-OFFICE OF THE CHIEF FINANCIAL OFFICER",152,22,2,6,0,1,2,0,0,185,0,0,11,0,0,0,0,0,11,0,196,"EDEL-OFFICE OF THE CHIEF FINANCIAL OFFICER",154,17,2,2,0,1,3,0,0,179,0,0,7,0,0,0,0,0,7,0,186,"EDEL-OFFICE OF THE CHIEF FINANCIAL OFFICER",220,19,2,3,0,1,6,0,0,251,0,0,12,1,1,0,0,0,14,0,265,"EDEL-OFFICE OF THE CHIEF FINANCIAL OFFICER",222,13,1,4,0,1,5,0,0,246,0,0,14,1,1,0,0,0,16,0,262,"EDEL-OFFICE OF THE CHIEF FINANCIAL OFFICER",239,14,2,2,0,0,5,0,0,262,0,0,12,2,1,0,0,0,15,0,277,"EDEL-OFFICE OF THE CHIEF FINANCIAL OFFICER",233,25,1,3,0,1,3,0,0,266,1,0,13,2,1,0,0,0,17,0,283,"EDEL-OFFICE OF THE CHIEF FINANCIAL OFFICER",238,21,1,5,0,1,4,0,0,270,0,0,14,3,1,0,0,0,18,0,288,"EDEL-OFFICE OF THE CHIEF FINANCIAL OFFICER",240,26,1,5,0,0,3,0,0,275,2,0,14,3,1,0,0,0,20,0,295,"EDEL-OFFICE OF THE CHIEF FINANCIAL OFFICER",231,25,1,1,0,0,4,0,0,262,1,0,15,3,1,2,0,0,22,0,284,"EDEL-OFFICE OF THE CHIEF FINANCIAL OFFICER",231,35,2,1,0,0,3,0,0,272,4,0,7,0,0,3,0,0,14,0,286,"EDEL-OFFICE OF THE CHIEF FINANCIAL OFFICER",228,33,1,0,0,1,3,0,0,266,0,0,5,0,0,0,0,0,5,0,271,"EDEL-OFFICE OF THE CHIEF FINANCIAL OFFICER",215,36,1,0,0,1,3,0,0,256,2,0,7,1,0,0,1,0,11,0,267,"EDEL-OFFICE OF THE CHIEF FINANCIAL OFFICER",273,38,1,0,0,0,2,0,0,314,1,0,11,1,1,1,1,0,16,0,330
"353","EDEM","EDEM-OFFICE OF MANAGEMENT",144,9,5,1,0,0,5,5,0,0,169,1,0,2,0,0,0,0,0,0,3,0,172,"EDEM-OFFICE OF MANAGEMENT",152,15,7,1,0,0,4,3,0,0,182,0,0,3,0,2,0,0,0,0,5,0,187,"EDEM-OFFICE OF MANAGEMENT",150,20,7,2,0,3,4,0,0,186,1,0,5,0,0,0,0,0,6,0,192,"EDEM-OFFICE OF MANAGEMENT",148,17,7,6,0,3,3,1,0,185,0,0,6,0,0,0,0,0,6,0,191,"EDEM-OFFICE OF MANAGEMENT",158,16,7,4,0,3,3,1,0,192,0,0,5,0,0,1,0,0,6,0,198,"EDEM-OFFICE OF MANAGEMENT",161,16,9,3,0,2,4,0,0,195,0,0,4,3,1,2,0,0,10,0,205,"EDEM-OFFICE OF MANAGEMENT",149,15,8,0,0,3,3,1,0,179,0,0,2,2,1,2,0,0,7,0,186,"EDEM-OFFICE OF MANAGEMENT",157,11,10,1,0,1,3,0,0,183,0,0,2,3,1,2,0,0,8,0,191,"EDEM-OFFICE OF MANAGEMENT",143,4,10,1,0,1,4,1,0,164,0,0,3,2,0,3,0,0,8,0,172,"EDEM-OFFICE OF MANAGEMENT",153,6,10,1,0,1,4,1,0,176,1,0,3,1,1,3,0,0,9,0,185,"EDEM-OFFICE OF MANAGEMENT",159,7,10,0,0,1,4,2,0,183,4,0,3,3,1,5,0,0,16,0,199,"EDEM-OFFICE OF MANAGEMENT",165,10,10,0,0,1,4,2,0,192,4,0,1,2,1,6,0,0,14,0,206,"EDEM-OFFICE OF MANAGEMENT",170,11,10,0,0,1,5,0,0,197,1,0,3,0,0,7,0,0,11,0,208,"EDEM-OFFICE OF MANAGEMENT",158,10,11,0,0,1,5,0,0,185,3,1,5,0,0,6,0,0,15,0,200,"EDEM-OFFICE OF MANAGEMENT",166,7,10,0,0,1,4,0,0,188,1,0,5,0,0,8,0,0,14,0,202,"EDEM-OFFICE OF MANAGEMENT",174,6,11,0,0,1,5,0,0,197,3,0,3,0,0,7,0,0,13,0,210
"354","EDEN","EDEN-FEDERAL STUDENT AID",910,160,4,0,1,0,153,11,0,0,1239,1,0,2,0,0,0,0,0,0,3,0,1242,"EDEN-FEDERAL STUDENT AID",811,232,2,4,0,0,164,9,0,0,1222,1,0,8,0,0,0,0,0,0,9,0,1231,"EDEN-FEDERAL STUDENT AID",819,216,2,7,0,169,9,0,0,1222,1,0,15,0,0,1,0,0,17,0,1239,"EDEN-FEDERAL STUDENT AID",781,170,1,38,0,148,9,0,0,1147,0,0,25,0,0,3,0,0,28,0,1175,"EDEN-FEDERAL STUDENT AID",761,100,1,8,0,79,12,0,0,961,0,0,16,0,0,1,0,0,17,0,978,"EDEN-FEDERAL STUDENT AID",793,108,3,15,0,77,12,0,0,1008,0,0,10,0,0,3,0,0,13,0,1021,"EDEN-FEDERAL STUDENT AID",806,95,4,8,0,79,12,0,0,1004,1,0,8,0,0,3,0,0,12,0,1016,"EDEN-FEDERAL STUDENT AID",808,78,1,7,0,77,15,0,0,986,0,0,14,0,0,3,0,0,17,0,1003,"EDEN-FEDERAL STUDENT AID",842,82,1,4,0,72,14,0,0,1015,0,0,12,0,0,5,0,0,17,0,1032,"EDEN-FEDERAL STUDENT AID",936,51,1,4,0,60,15,0,0,1067,2,0,13,0,0,3,0,0,18,0,1085,"EDEN-FEDERAL STUDENT AID",975,38,1,2,0,39,10,0,0,1065,1,0,9,0,0,4,0,0,14,0,1079,"EDEN-OFC OF STUDENT FINANCIAL ASSISTANCE PROG",1008,75,2,1,0,23,8,0,0,1117,1,0,22,0,0,5,0,0,28,0,1145,"EDEN-OFC OF STUDENT FINANCIAL ASSISTANCE PROG",1013,120,2,1,0,22,7,0,0,1165,2,0,28,0,0,13,0,0,43,0,1208,"EDEN-OFC OF STUDENT FINANCIAL ASSISTANCE PROG",993,138,2,1,0,14,5,0,0,1153,8,0,25,0,0,21,0,0,54,0,1207,"EDEN-OFC OF STUDENT FINANCIAL ASSISTANCE PROG",1005,127,2,0,0,15,5,0,0,1154,11,1,13,0,0,21,0,0,46,0,1200,NA,NA,NA,NA,NA,NA,NA,NA,NA,NA,NA,NA,NA,NA,NA,NA,NA,NA,NA,NA,NA,NA
"355","EDEO","EDEO-OFFICE OF COMMUNICATIONS AND OUTREACH",74,6,1,0,0,0,2,0,0,0,83,0,1,0,14,0,0,8,0,0,23,0,106,"EDEO-OFFICE OF COMMUNICATIONS AND OUTREACH",73,10,1,0,0,0,1,0,0,0,85,0,1,0,15,0,1,12,0,0,29,0,114,"EDEO-OFFICE OF COMMUNICATIONS AND OUTREACH",72,14,1,0,0,2,1,0,0,90,0,0,5,14,1,18,0,0,38,0,128,"EDEO-OFFICE OF COMMUNICATIONS AND OUTREACH",75,9,1,2,0,2,1,0,0,90,0,0,3,14,1,0,0,0,18,0,108,"EDEO-OFFICE OF COMMUNICATIONS AND OUTREACH",78,11,1,2,0,2,1,0,0,95,0,0,0,13,1,0,0,0,14,0,109,"EDEO-OFFICE OF COMMUNICATIONS AND OUTREACH",79,9,1,0,0,2,1,0,0,92,0,0,1,39,1,0,0,0,41,0,133,"EDEO-OFFICE OF COMMUNICATIONS AND OUTREACH",77,11,1,1,0,2,1,0,0,93,0,0,1,43,1,1,0,0,46,0,139,"EDEO-OFFICE OF COMMUNICATIONS AND OUTREACH",82,8,2,0,0,1,1,1,0,95,0,0,1,43,1,1,0,0,46,0,141,"EDEO-OFFICE OF COMMUNICATIONS AND OUTREACH",83,9,2,0,0,1,0,0,0,95,0,0,1,30,1,1,0,0,33,0,128,NA,NA,NA,NA,NA,NA,NA,NA,NA,NA,NA,NA,NA,NA,NA,NA,NA,NA,NA,NA,NA,NA,NA,NA,NA,NA,NA,NA,NA,NA,NA,NA,NA,NA,NA,NA,NA,NA,NA,NA,NA,NA,NA,NA,NA,NA,NA,NA,NA,NA,NA,NA,NA,NA,NA,NA,NA,NA,NA,NA,NA,NA,NA,NA,NA,NA,NA,NA,NA,NA,NA,NA,NA,NA,NA,NA,NA,NA,NA,NA,NA,NA,NA,NA,NA,NA,NA,NA,NA,NA,NA,NA,NA,NA,NA,NA,NA,NA,NA,NA,NA,NA,NA,NA,NA,NA,NA,NA,NA,NA,NA,NA,NA,NA,NA,NA,NA,NA,NA,NA,NA,NA,NA,NA,NA,NA,NA,NA,NA,NA,NA,NA,NA,NA,NA,NA,NA,NA,NA,NA,NA,NA,NA,NA,NA,NA,NA,NA,NA,NA,NA,NA,NA,NA
"356","EDEP","EDEP-OFFICE OF POSTSECONDARY EDUCATION",145,24,0,2,0,0,3,2,0,0,176,1,0,0,3,0,0,35,0,0,39,0,215,"EDEP-OFFICE OF POSTSECONDARY EDUCATION",139,35,1,2,0,0,2,3,1,0,183,0,0,0,1,0,1,57,0,0,59,0,242,"EDEP-OFFICE OF POSTSECONDARY EDUCATION",161,31,1,2,0,2,4,1,0,202,0,0,3,2,2,55,0,0,62,0,264,"EDEP-OFFICE OF POSTSECONDARY EDUCATION",162,18,1,17,0,1,4,0,0,203,1,0,4,2,2,32,0,0,41,0,244,"EDEP-OFFICE OF POSTSECONDARY EDUCATION",169,17,3,9,0,2,4,0,0,204,0,0,1,0,0,29,0,0,30,0,234,"EDEP-OFFICE OF POSTSECONDARY EDUCATION",177,11,8,2,0,2,4,1,0,205,0,0,3,2,0,41,0,0,46,0,251,"EDEP-OFFICE OF POSTSECONDARY EDUCATION",181,11,5,0,0,1,3,0,0,201,0,0,2,5,1,55,0,0,63,0,264,"EDEP-OFFICE OF POSTSECONDARY EDUCATION",189,10,2,0,0,1,4,0,0,206,0,0,4,6,0,44,0,0,54,0,260,"EDEP-OFFICE OF POSTSECONDARY EDUCATION",204,12,1,0,0,1,4,1,0,223,0,0,0,2,1,47,0,0,50,0,273,"EDEP-OFFICE OF POSTSECONDARY EDUCATION",202,12,0,0,0,0,4,1,0,219,0,0,1,3,4,54,0,0,62,0,281,"EDEP-OFFICE OF POSTSECONDARY EDUCATION",213,13,0,0,0,0,2,1,0,229,2,0,0,3,13,54,0,0,72,0,301,"EDEP-OFFICE OF POSTSECONDARY EDUCATION",191,20,0,0,0,0,1,2,0,214,1,0,2,4,15,51,0,0,73,0,287,"EDEP-OFFICE OF POSTSECONDARY EDUCATION",180,31,0,0,0,1,3,0,0,215,1,0,3,0,16,55,1,0,76,0,291,"EDEP-OFFICE OF POSTSECONDARY EDUCATION",191,32,0,0,0,4,3,1,0,231,1,0,3,11,24,68,1,0,108,0,339,"EDEP-OFFICE OF POSTSECONDARY EDUCATION",173,25,0,0,0,3,2,1,0,204,4,0,9,16,24,45,1,0,99,0,303,"EDEP-OFFICE OF POSTSECONDARY EDUCATION",1176,120,5,0,0,11,9,1,0,1322,12,0,10,10,27,66,0,1,126,0,1448
"357","EDEQ",NA,NA,NA,NA,NA,NA,NA,NA,NA,NA,NA,NA,NA,NA,NA,NA,NA,NA,NA,NA,NA,NA,NA,NA,NA,NA,NA,NA,NA,NA,NA,NA,NA,NA,NA,NA,NA,NA,NA,NA,NA,NA,NA,NA,NA,NA,NA,NA,"EDEQ-OFFICE OF SAFE AND DRUG-FREE SCHOOLS",31,5,0,1,0,0,1,0,0,38,0,0,1,2,0,0,0,0,3,0,41,"EDEQ-OFFICE OF SAFE AND DRUG-FREE SCHOOLS",34,5,1,0,0,0,1,0,0,41,0,0,0,3,0,8,0,0,11,0,52,"EDEQ-OFFICE OF SAFE AND DRUG-FREE SCHOOLS",34,6,1,0,0,0,1,0,0,42,0,0,0,3,0,8,0,0,11,0,53,"EDEQ-OFFICE OF SAFE AND DRUG-FREE SCHOOLS",34,7,1,0,0,0,1,1,0,44,0,0,0,3,0,8,0,0,11,0,55,"EDEQ-OFFICE OF SAFE AND DRUG-FREE SCHOOLS",35,9,0,0,0,0,1,1,0,46,0,0,0,3,0,12,0,0,15,0,61,"EDEQ-OFFICE OF SAFE AND DRUG-FREE SCHOOLS",39,6,1,0,0,0,1,1,0,48,1,0,1,3,0,10,0,0,15,0,63,"EDEQ-OFFICE OF SAFE AND DRUG-FREE SCHOOLS",41,3,3,0,0,0,1,1,0,49,0,0,0,3,0,0,0,0,3,0,52,"EDEQ-OFFICE OF SAFE AND DRUG-FREE SCHOOLS",43,3,2,0,0,0,1,1,0,50,1,0,0,2,0,3,0,0,6,0,56,"EDEQ-OFFICE OF SAFE AND DRUG-FREE SCHOOLS",35,6,4,0,0,0,1,0,0,46,0,0,0,2,0,1,1,0,4,0,50,NA,NA,NA,NA,NA,NA,NA,NA,NA,NA,NA,NA,NA,NA,NA,NA,NA,NA,NA,NA,NA,NA,NA,NA,NA,NA,NA,NA,NA,NA,NA,NA,NA,NA,NA,NA,NA,NA,NA,NA,NA,NA,NA,NA,NA,NA,NA,NA,NA,NA,NA,NA,NA,NA,NA,NA,NA,NA,NA,NA,NA,NA,NA,NA,NA,NA,NA,NA,NA,NA,NA,NA,NA,NA,NA,NA,NA,NA,NA,NA,NA,NA,NA,NA,NA,NA,NA,NA,NA,NA,NA,NA,NA,NA,NA,NA,NA,NA,NA,NA,NA,NA,NA,NA,NA,NA,NA,NA,NA,NA
"358","EDER","EDER-INSTITUTE OF EDUCATION SCIENCES",104,28,0,0,0,0,1,3,0,0,136,0,0,0,0,1,2,32,0,0,35,0,171,"EDER-INSTITUTE OF EDUCATION SCIENCES",108,22,0,0,0,0,1,3,0,0,134,0,0,2,0,0,2,38,0,0,42,0,176,"EDER-INSTITUTE OF EDUCATION SCIENCES",122,19,0,0,0,1,4,0,0,146,0,0,3,0,2,51,0,0,56,0,202,"EDER-INSTITUTE OF EDUCATION SCIENCES",116,31,0,0,0,0,3,0,0,150,0,0,4,0,1,48,0,0,53,0,203,"EDER-INSTITUTE OF EDUCATION SCIENCES",120,34,0,0,0,0,3,0,0,157,0,0,0,0,1,36,0,0,37,0,194,"EDER-INSTITUTE OF EDUCATION SCIENCES",119,30,0,0,0,0,4,0,0,153,0,0,1,0,2,34,0,0,37,0,190,"EDER-INSTITUTE OF EDUCATION SCIENCES",120,21,0,0,0,0,4,0,0,145,0,0,2,0,2,41,0,0,45,0,190,"EDER-INSTITUTE OF EDUCATION SCIENCES",125,16,0,0,0,0,4,0,0,145,0,0,3,0,2,35,0,0,40,0,185,"EDER-INSTITUTE OF EDUCATION SCIENCES",132,15,0,0,0,0,4,0,0,151,0,0,2,0,1,37,0,0,40,0,191,"EDER-INSTITUTE OF EDUCATION SCIENCES",135,9,0,0,0,0,4,0,0,148,0,0,3,1,2,26,0,0,32,0,180,"EDER-INSTITUTE OF EDUCATION SCIENCES",142,11,1,0,0,0,4,0,0,158,0,0,4,1,1,19,0,0,25,0,183,"EDER-OFC OF ED RES AND IMPROVEMENT",252,11,2,0,0,0,6,0,0,271,1,0,5,1,1,26,0,0,34,0,305,"EDER-OFC OF ED RES AND IMPROVEMENT",271,22,2,0,0,2,6,0,0,303,1,0,6,0,1,21,0,0,29,0,332,"EDER-OFC OF ED RES AND IMPROVEMENT",267,26,1,0,0,4,5,0,0,303,4,0,6,0,1,28,0,0,39,0,342,"EDER-OFC OF ED RES AND IMPROVEMENT",287,38,1,0,0,2,5,0,0,333,3,0,9,0,1,26,0,0,39,0,372,"EDER-OFC OF ED RES AND IMPROVEMENT",293,36,1,0,0,0,6,0,0,336,5,0,6,0,2,19,0,0,32,0,368
"359","EDES","EDES-OFFICE OF ELEMENTARY AND SECONDARY EDUCATION",181,32,3,1,4,0,0,2,1,0,224,0,0,0,9,0,1,16,0,0,26,0,250,"EDES-OFFICE OF ELEMENTARY AND SECONDARY EDUCATION",182,43,2,1,0,0,0,1,1,0,230,0,0,1,10,0,1,33,0,0,45,0,275,"EDES-OFFICE OF ELEMENTARY AND SECONDARY EDUCATION",158,53,1,0,0,1,1,0,0,214,0,0,0,9,0,32,0,0,41,0,255,"EDES-OFFICE OF ELEMENTARY AND SECONDARY EDUCATION",168,32,7,22,0,0,3,1,0,233,0,0,0,9,1,20,0,0,30,0,263,"EDES-OFFICE OF ELEMENTARY AND SECONDARY EDUCATION",169,29,6,8,0,0,3,0,0,215,0,1,0,4,1,42,0,0,48,0,263,"EDES-OFFICE OF ELEMENTARY AND SECONDARY EDUCATION",163,23,8,6,0,0,4,1,0,205,0,0,0,8,1,39,0,0,48,0,253,"EDES-OFFICE OF ELEMENTARY AND SECONDARY EDUCATION",153,36,4,0,0,0,3,2,0,198,0,0,0,8,1,22,0,0,31,0,229,"EDES-OFFICE OF ELEMENTARY AND SECONDARY EDUCATION",151,30,5,0,1,0,5,0,0,192,2,0,0,9,1,13,0,0,25,0,217,"EDES-OFFICE OF ELEMENTARY AND SECONDARY EDUCATION",155,31,4,0,2,0,6,0,0,198,0,0,0,9,1,12,0,0,22,0,220,"EDES-OFFICE OF ELEMENTARY AND SECONDARY EDUCATION",141,18,2,0,2,0,5,0,0,168,0,0,0,7,12,1,0,0,20,0,188,"EDES-OFC OF ELEM AND SEC ED",163,34,4,0,2,0,5,0,0,208,0,0,0,6,11,4,0,0,21,0,229,"EDES-OFC OF ELEM AND SEC ED",196,43,13,0,2,0,5,0,0,259,0,0,4,10,12,3,0,0,29,0,288,"EDES-OFC OF ELEM AND SEC ED",193,40,10,0,2,3,6,0,0,254,3,0,4,0,12,4,0,0,23,0,277,"EDES-OFC OF ELEM AND SEC ED",204,34,0,0,2,8,6,0,0,254,5,0,2,8,12,1,0,0,28,0,282,"EDES-OFC OF ELEM AND SEC ED",182,41,0,0,2,7,5,1,0,238,2,0,11,11,11,2,0,0,37,0,275,"EDES-OFC OF ELEM AND SEC ED",190,34,0,0,2,4,6,1,0,237,5,0,8,13,12,3,0,0,41,0,278
"360","EDET","EDET-OFFICE OF ENGLISH LANGUAGE ACQUISITION",14,1,0,0,0,0,0,0,1,0,16,0,0,0,0,0,0,0,0,0,0,0,16,"EDET-OFFICE OF ENGLISH LANGUAGE ACQUISITION",15,2,0,0,0,0,0,0,1,0,18,0,0,0,1,0,0,0,0,0,1,0,19,"EDET-OFFICE OF ENGLISH LANGUAGE ACQUISITION",17,3,0,0,0,0,0,1,0,21,0,0,0,1,0,0,0,0,1,0,22,"EDET-OFFICE OF ENGLISH LANGUAGE ACQUISITION",18,1,0,0,0,0,0,1,0,20,0,0,0,0,0,0,0,0,0,0,20,"EDET-OFFICE OF ENGLISH LANGUAGE ACQUISITION",21,1,0,0,0,0,0,0,0,22,0,0,0,0,0,0,0,0,0,0,22,"EDET-OFFICE OF ENGLISH LANGUAGE ACQUISITION",27,3,0,0,0,0,0,0,0,30,0,0,0,0,0,0,0,0,0,0,30,"EDET-OFFICE OF ENGLISH LANGUAGE ACQUISITION",30,5,0,0,0,0,0,1,0,36,0,0,0,1,0,0,0,0,1,0,37,"EDET-OFFICE OF ENGLISH LANGUAGE ACQUISITION",34,5,0,0,0,0,0,1,0,40,0,0,1,1,0,0,0,0,2,0,42,"EDET-OFFICE OF ENGLISH LANGUAGE ACQUISITION",33,3,0,0,0,0,0,1,0,37,1,0,0,0,0,0,0,0,1,0,38,"EDET-OFFICE OF ENGLISH LANGUAGE ACQUISITION",33,5,0,0,0,0,0,1,0,39,1,0,0,3,0,0,0,0,4,0,43,"EDET-OFFICE OF ENGLISH LANGUAGE ACQUISITION",32,9,0,0,0,0,0,1,0,42,0,0,0,3,0,0,0,0,3,0,45,"EDET-OFFICE OF ENGLISH LANGUAGE ACQUISITION",33,9,0,0,0,0,0,1,0,43,2,0,0,3,0,0,0,0,5,0,48,"EDET-OFC OF BILINGUAL ED & MIN LANG AFFAIRS",32,13,0,0,0,0,1,0,0,46,2,0,0,0,0,0,0,0,2,0,48,"EDET-OFC OF BILINGUAL ED & MIN LANG AFFAIRS",36,11,0,0,0,0,1,0,0,48,3,0,0,1,0,0,0,0,4,0,52,"EDET-OFC OF BILINGUAL ED & MIN LANG AFFAIRS",34,12,0,0,0,0,1,0,0,47,1,0,0,1,0,0,0,0,2,0,49,"EDET-OFC OF BILINGUAL ED & MIN LANG AFFAIRS",36,6,0,0,0,0,0,1,0,43,1,0,0,2,0,0,0,0,3,0,46
"361","EDEU","EDEU-OFFICE OF INNOVATION AND IMPROVEMENT",59,21,0,2,2,0,0,1,1,0,86,0,2,1,4,0,0,1,0,0,8,0,94,"EDEU-OFFICE OF INNOVATION AND IMPROVEMENT",52,29,1,2,0,0,0,1,1,0,86,0,1,1,5,0,0,2,0,0,9,0,95,"EDEU-OFFICE OF INNOVATION AND IMPROVEMENT",55,30,2,1,0,0,1,1,0,90,0,1,5,3,0,2,0,0,11,0,101,"EDEU-OFFICE OF INNOVATION AND IMPROVEMENT",61,11,3,7,0,0,1,1,0,84,0,0,4,6,0,15,0,0,25,0,109,"EDEU-OFFICE OF INNOVATION AND IMPROVEMENT",64,3,2,9,0,0,1,1,0,80,0,0,1,4,0,13,0,0,18,0,98,"EDEU-OFFICE OF INNOVATION AND IMPROVEMENT",65,6,2,12,0,0,2,1,0,88,0,0,1,3,0,0,0,0,4,0,92,"EDEU-OFFICE OF INNOVATION AND IMPROVEMENT",73,7,2,5,0,0,2,1,0,90,0,0,1,3,0,0,0,0,4,0,94,"EDEU-OFFICE OF INNOVATION AND IMPROVEMENT",69,15,0,4,0,0,2,1,0,91,1,0,3,1,0,0,0,0,5,0,96,"EDEU-OFFICE OF INNOVATION AND IMPROVEMENT",69,15,1,0,0,0,2,1,0,88,1,0,1,1,0,0,0,0,3,0,91,"EDEU-OFFICE OF INNOVATION AND IMPROVEMENT",71,15,2,0,0,0,1,1,0,90,1,0,1,2,0,0,0,0,4,0,94,"EDEU-OFFICE OF INNOVATION AND IMPROVEMENT",75,6,1,0,0,0,0,1,0,83,1,0,1,4,0,0,0,0,6,0,89,NA,NA,NA,NA,NA,NA,NA,NA,NA,NA,NA,NA,NA,NA,NA,NA,NA,NA,NA,NA,NA,NA,NA,NA,NA,NA,NA,NA,NA,NA,NA,NA,NA,NA,NA,NA,NA,NA,NA,NA,NA,NA,NA,NA,NA,NA,NA,NA,NA,NA,NA,NA,NA,NA,NA,NA,NA,NA,NA,NA,NA,NA,NA,NA,NA,NA,NA,NA,NA,NA,NA,NA,NA,NA,NA,NA,NA,NA,NA,NA,NA,NA,NA,NA,NA,NA,NA,NA,NA,NA,NA,NA,NA,NA,NA,NA,NA,NA,NA,NA,NA,NA,NA,NA,NA,NA,NA,NA,NA,NA
"362","EDEV","EDEV-OFFICE OF VOCATIONAL AND ADULT EDUCATION",62,9,0,2,0,0,0,1,1,0,75,0,1,0,5,0,1,3,0,0,10,0,85,"EDEV-OFFICE OF VOCATIONAL AND ADULT EDUCATION",63,8,1,0,2,0,0,1,1,0,76,0,1,0,3,0,1,1,0,0,6,0,82,"EDEV-OFFICE OF VOCATIONAL AND ADULT EDUCATION",64,8,1,0,0,0,2,1,0,76,0,1,0,6,1,3,0,0,11,0,87,"EDEV-OFFICE OF VOCATIONAL AND ADULT EDUCATION",66,9,1,0,0,0,2,1,0,79,0,1,0,5,1,3,0,0,10,0,89,"EDEV-OFFICE OF VOCATIONAL AND ADULT EDUCATION",70,12,1,0,0,0,3,0,0,86,0,0,0,4,0,0,0,0,4,0,90,"EDEV-OFFICE OF VOCATIONAL AND ADULT EDUCATION",70,13,2,0,0,0,2,0,0,87,0,0,5,3,1,2,0,0,11,0,98,"EDEV-OFFICE OF VOCATIONAL AND ADULT EDUCATION",74,9,2,0,0,0,3,0,0,88,0,1,4,3,1,1,0,0,10,0,98,"EDEV-OFFICE OF VOCATIONAL AND ADULT EDUCATION",82,7,2,0,0,0,3,0,0,94,0,1,3,1,1,1,0,0,7,0,101,"EDEV-OFFICE OF VOCATIONAL AND ADULT EDUCATION",85,10,7,0,0,0,4,0,0,106,0,1,6,4,0,3,0,0,14,0,120,"EDEV-OFFICE OF VOCATIONAL AND ADULT EDUCATION",92,8,6,0,0,0,4,1,0,111,1,1,3,4,1,2,0,0,12,0,123,"EDEV-OFFICE OF VOCATIONAL AND ADULT EDUCATION",100,14,1,0,0,0,3,1,0,119,1,1,3,3,0,0,0,0,8,0,127,"EDEV-OFFICE OF VOCATIONAL AND ADULT EDUCATION",86,17,3,0,0,0,4,1,0,111,0,1,1,3,1,4,0,0,10,0,121,"EDEV-OFFICE OF VOCATIONAL AND ADULT EDUCATION",85,25,3,0,0,0,3,0,0,116,0,0,1,1,1,1,0,0,4,0,120,"EDEV-OFFICE OF VOCATIONAL AND ADULT EDUCATION",81,24,0,0,0,0,3,0,0,108,0,0,1,5,1,4,1,0,12,0,120,"EDEV-OFFICE OF VOCATIONAL AND ADULT EDUCATION",86,24,0,0,0,0,2,0,0,112,2,0,0,5,1,2,1,0,11,0,123,"EDEV-OFFICE OF VOCATIONAL AND ADULT EDUCATION",91,10,0,0,0,0,3,0,0,104,1,0,1,5,1,2,1,0,11,0,115
"363","EDEX","EDEX-NATIONAL INSTITUTE FOR LITERACY",0,0,0,0,0,0,0,0,0,0,0,0,0,0,0,0,0,1,0,0,1,0,1,"EDEX-NATIONAL INSTITUTE FOR LITERACY",0,0,0,0,0,0,0,0,0,0,0,0,0,0,0,0,0,1,0,0,1,0,1,"EDEX-NATIONAL INSTITUTE FOR LITERACY",0,0,0,0,0,0,0,0,0,0,0,0,0,0,0,1,0,0,1,0,1,"EDEX-NATIONAL INSTITUTE FOR LITERACY",3,0,0,0,0,9,0,0,0,12,0,0,0,0,0,1,0,0,1,0,13,"EDEX-NATIONAL INSTITUTE FOR LITERACY",3,0,0,0,0,8,0,0,0,11,0,0,0,0,0,10,0,0,10,0,21,"EDEX-NATIONAL INSTITUTE FOR LITERACY",3,0,0,0,0,8,0,0,0,11,0,0,0,0,0,11,0,0,11,0,22,"EDEX-NATIONAL INSTITUTE FOR LITERACY",4,0,0,0,0,0,0,0,0,4,0,0,0,0,0,20,0,0,20,0,24,"EDEX-NATIONAL INSTITUTE FOR LITERACY",4,0,0,0,0,0,0,0,0,4,0,0,0,0,0,22,0,0,22,0,26,"EDEX-NATIONAL INSTITUTE FOR LITERACY",4,0,0,0,0,0,0,0,0,4,0,0,0,0,0,18,0,0,18,0,22,"EDEX-NATIONAL INSTITUTE FOR LITERACY",5,0,0,0,0,0,0,0,0,5,0,0,0,0,0,17,0,0,17,0,22,"EDEX-NATIONAL INSTITUTE FOR LITERACY",4,0,1,0,0,0,0,0,0,5,1,0,0,0,0,21,0,0,22,0,27,"EDEX-NATIONAL INSTITUTE FOR LITERACY",4,0,0,0,0,0,0,0,0,4,1,0,0,0,7,8,0,0,16,0,20,"EDEX-NATIONAL INSTITUTE FOR LITERACY",5,0,0,0,0,0,0,0,0,5,1,0,0,0,7,12,0,0,20,0,25,"EDEX-NATIONAL INSTITUTE FOR LITERACY",4,0,0,0,0,0,0,0,0,4,1,0,0,0,7,12,0,0,20,0,24,"EDEX-NATIONAL INSTITUTE FOR LITERACY",4,0,0,0,0,1,0,0,0,5,1,0,0,0,7,9,0,0,17,0,22,"EDEX-NATIONAL INSTITUTE FOR LITERACY",4,0,0,0,0,2,0,0,0,6,1,0,0,0,10,7,0,0,18,0,24
"364","EDEY","EDEY-ADVISORY COUNCILS AND COMMITTEES",0,0,0,0,0,0,4,0,0,0,4,0,0,0,0,0,0,16,0,0,16,0,20,"EDEY-ADVISORY COUNCILS AND COMMITTEES",0,0,0,0,0,0,4,0,0,0,4,0,0,0,0,0,0,17,0,0,17,0,21,"EDEY-ADVISORY COUNCILS AND COMMITTEES",0,0,0,0,0,3,0,0,0,3,0,0,0,0,0,17,0,0,17,0,20,"EDEY-ADVISORY COUNCILS AND COMMITTEES",0,0,0,0,0,3,0,0,0,3,0,0,0,0,0,19,0,0,19,0,22,"EDEY-ADVISORY COUNCILS AND COMMITTEES",0,0,0,0,0,3,0,0,0,3,0,0,0,0,0,20,0,0,20,0,23,"EDEY-ADVISORY COUNCILS AND COMMITTEES",0,0,0,0,0,5,0,0,0,5,0,0,0,0,0,24,0,0,24,0,29,"EDEY-ADVISORY COUNCILS AND COMMITTEES",0,0,0,0,0,8,0,0,0,8,0,0,0,0,0,25,0,0,25,0,33,"EDEY-ADVISORY COUNCILS AND COMMITTEES",0,0,0,0,0,8,0,0,0,8,0,0,0,0,0,25,0,0,25,0,33,"EDEY-ADVISORY COUNCILS AND COMMITTEES",0,0,0,0,0,6,0,0,0,6,0,0,0,0,0,26,0,0,26,0,32,"EDEY-ADVISORY COUNCILS AND COMMITTEES",0,0,0,0,0,6,0,0,0,6,0,0,0,0,0,21,0,0,21,0,27,"EDEY-ADVISORY COUNCILS AND COMMITTEES",0,0,0,0,0,8,0,0,0,8,0,0,0,0,0,26,0,0,26,0,34,"EDEY-ADVISORY COUNCILS AND COMMITTEES",0,0,0,0,0,8,0,0,0,8,0,0,0,0,0,23,0,0,23,0,31,"EDEY-ADVISORY COUNCILS AND COMMITTEES",0,0,0,0,0,5,0,0,0,5,0,0,0,0,0,25,0,0,25,0,30,"EDEY-ADVISORY COUNCILS AND COMMITTEES",0,0,0,0,0,4,0,0,0,4,0,0,0,0,1,27,0,0,28,0,32,"EDEY-ADVISORY COUNCILS AND COMMITTEES",0,0,0,0,0,6,0,0,0,6,0,0,0,0,2,26,0,0,28,0,34,"EDEY-ADVISORY COUNCILS AND COMMITTEES",0,0,0,0,0,5,0,0,0,5,0,0,0,0,1,23,0,0,24,0,29
"365","EDEZ","EDEZ-NATIONAL ASSESSMENT GOVERNING BOARD",5,1,0,0,0,0,1,0,0,0,7,0,0,0,0,0,0,27,0,0,27,0,34,"EDEZ-NATIONAL ASSESSMENT GOVERNING BOARD",4,1,0,0,0,0,0,0,0,0,5,0,0,0,0,0,0,30,0,0,30,0,35,"EDEZ-NATIONAL ASSESSMENT GOVERNING BOARD",5,1,0,0,0,0,0,0,0,6,0,0,0,0,0,32,0,0,32,0,38,"EDEZ-NATIONAL ASSESSMENT GOVERNING BOARD",5,1,0,0,0,0,0,0,0,6,0,0,0,0,0,31,0,0,31,0,37,"EDEZ-NATIONAL ASSESSMENT GOVERNING BOARD",6,0,0,0,0,0,0,0,0,6,0,0,0,0,0,27,0,0,27,0,33,"EDEZ-NATIONAL ASSESSMENT GOVERNING BOARD",6,0,0,0,0,0,0,0,0,6,0,0,0,0,0,30,0,0,30,0,36,"EDEZ-NATIONAL ASSESSMENT GOVERNING BOARD",6,0,0,0,0,0,0,0,0,6,0,0,0,0,0,30,0,0,30,0,36,"EDEZ-NATIONAL ASSESSMENT GOVERNING BOARD",5,1,0,0,0,0,0,0,0,6,0,0,0,0,0,26,0,0,26,0,32,"EDEZ-NATIONAL ASSESSMENT GOVERNING BOARD",5,1,0,0,0,0,0,0,0,6,0,0,0,0,0,30,0,0,30,0,36,"EDEZ-NATIONAL ASSESSMENT GOVERNING BOARD",4,2,0,0,0,0,0,0,0,6,0,0,0,0,0,29,0,0,29,0,35,"EDEZ-NATIONAL ASSESSMENT GOVERNING BOARD",4,2,0,0,0,1,0,0,0,7,0,0,0,0,0,28,0,0,28,0,35,"EDEZ-NATIONAL ASSESSMENT GOVERNING BOARD",4,2,0,0,0,1,0,0,0,7,0,0,0,0,0,27,0,0,27,0,34,"EDEZ-NATIONAL ASSESSMENT GOVERNING BOARD",4,2,0,0,0,1,0,0,0,7,0,0,0,0,0,28,0,0,28,0,35,"EDEZ-NATIONAL ASSESSMENT GOVERNING BOARD",4,0,0,0,0,1,0,0,0,5,0,0,0,0,0,30,0,0,30,0,35,"EDEZ-NATIONAL ASSESSMENT GOVERNING BOARD",4,0,0,0,0,1,0,0,0,5,0,0,0,0,0,28,0,0,28,0,33,"EDEZ-NATIONAL ASSESSMENT GOVERNING BOARD",4,0,0,0,0,1,0,0,0,5,0,0,0,0,1,27,0,0,28,0,33
"366","EE00","EE00-EQUAL EMPLOYMENT OPPORTUNITY COMMISSION",1516,93,488,0,0,0,5,27,3,0,2132,3,6,0,1,5,6,1,0,0,22,0,2154,"EE00-EQUAL EMPLOYMENT OPPORTUNITY COMMISSION",1479,241,519,0,0,0,1,28,3,0,2271,2,5,10,1,0,5,0,0,0,23,0,2294,"EE00-EQUAL EMPLOYMENT OPPORTUNITY COMMISSION",1429,441,549,0,0,2,27,3,0,2451,1,5,14,1,6,1,0,0,28,0,2479,"EE00-EQUAL EMPLOYMENT OPPORTUNITY COMMISSION",1368,571,536,0,0,4,23,3,0,2505,2,9,18,1,6,0,2,0,38,0,2543,"EE00-EQUAL EMPLOYMENT OPPORTUNITY COMMISSION",1366,426,510,0,0,5,26,0,0,2333,4,6,5,0,3,0,2,0,20,0,2353,"EE00-EQUAL EMPLOYMENT OPPORTUNITY COMMISSION",1385,275,488,0,0,4,24,2,0,2178,6,6,7,0,5,0,3,0,27,0,2205,"EE00-EQUAL EMPLOYMENT OPPORTUNITY COMMISSION",1442,172,494,0,0,4,29,1,0,2142,29,11,4,0,5,0,1,0,50,0,2192,"EE00-EQUAL EMPLOYMENT OPPORTUNITY COMMISSION",1495,43,521,0,0,2,27,0,0,2088,80,6,13,1,5,2,0,0,107,0,2195,"EE00-EQUAL EMPLOYMENT OPPORTUNITY COMMISSION",1701,20,526,0,0,2,30,0,0,2279,58,10,9,0,6,1,0,0,84,0,2363,"EE00-EQUAL EMPLOYMENT OPPORTUNITY COMMISSION",1801,17,545,0,0,3,31,0,0,2397,40,7,12,1,5,1,2,0,68,0,2465,"EE00-EQUAL EMPLOYMENT OPPORTUNITY COMMISSION",1840,109,563,0,0,6,36,1,0,2555,2,8,14,2,5,0,2,0,33,0,2588,"EE00-EQUAL EMPLOYMENT OPPORTUNITY COMMISSION",1935,165,583,0,0,12,39,2,0,2736,3,9,19,4,3,0,2,0,40,0,2776,"EE00-EQUAL EMPLOYMENT OPPORTUNITY COMMISSION",1926,281,602,0,0,19,38,0,0,2866,1,8,27,4,3,0,1,0,44,0,2910,"EE00-EQUAL EMPLOYMENT OPPORTUNITY COMMISSION",1924,182,544,1,0,17,40,1,0,2709,20,13,29,3,4,0,0,1,70,0,2779,"EE00-EQUAL EMPLOYMENT OPPORTUNITY COMMISSION",2049,168,564,4,0,28,37,3,0,2853,19,9,46,9,4,2,1,1,91,0,2944,"EE00-EQUAL EMPLOYMENT OPPORTUNITY COMMISSION",1970,26,464,0,0,7,40,3,0,2510,19,8,24,4,4,2,0,0,61,0,2571
"367","EK00",NA,NA,NA,NA,NA,NA,NA,NA,NA,NA,NA,NA,NA,NA,NA,NA,NA,NA,NA,NA,NA,NA,NA,NA,NA,NA,NA,NA,NA,NA,NA,NA,NA,NA,NA,NA,NA,NA,NA,NA,NA,NA,NA,NA,NA,NA,NA,NA,NA,NA,NA,NA,NA,NA,NA,NA,NA,NA,NA,NA,NA,NA,NA,NA,NA,NA,NA,NA,NA,NA,NA,NA,NA,NA,NA,NA,NA,NA,NA,NA,NA,NA,NA,NA,NA,NA,NA,NA,NA,NA,NA,NA,NA,NA,NA,NA,NA,NA,NA,NA,NA,NA,NA,NA,NA,NA,NA,NA,NA,NA,NA,NA,NA,NA,NA,NA,NA,NA,NA,NA,NA,NA,NA,NA,NA,NA,NA,NA,NA,NA,NA,NA,NA,NA,NA,NA,NA,NA,NA,NA,NA,NA,NA,NA,NA,NA,NA,NA,NA,NA,NA,NA,NA,NA,NA,NA,NA,NA,NA,NA,NA,NA,NA,NA,NA,NA,NA,NA,NA,NA,NA,NA,NA,NA,NA,NA,NA,NA,NA,NA,NA,NA,NA,NA,NA,NA,NA,NA,NA,NA,NA,NA,NA,NA,NA,NA,NA,NA,NA,NA,NA,NA,NA,NA,NA,NA,NA,NA,NA,NA,NA,NA,NA,NA,NA,NA,NA,NA,NA,NA,NA,NA,NA,NA,NA,NA,NA,NA,NA,NA,NA,NA,NA,NA,NA,NA,NA,NA,NA,NA,NA,NA,NA,NA,NA,NA,NA,NA,NA,NA,NA,NA,NA,NA,NA,NA,NA,NA,NA,NA,NA,NA,NA,NA,NA,NA,NA,NA,NA,NA,NA,NA,NA,NA,NA,NA,NA,NA,NA,NA,NA,NA,NA,NA,NA,NA,NA,NA,NA,NA,NA,NA,NA,NA,NA,NA,NA,NA,NA,NA,NA,NA,NA,NA,NA,NA,NA,NA,NA,NA,NA,NA,NA,NA,NA,NA,NA,NA,NA,NA,NA,NA,NA,NA,NA,NA,NA,NA,NA,NA,NA,NA,NA,NA,"EK00-ASSASSINATIONS RECORDS REVIEW BOARD",0,0,0,0,0,3,0,0,0,3,0,0,0,0,0,22,0,0,22,0,25
"368","EM00",NA,NA,NA,NA,NA,NA,NA,NA,NA,NA,NA,NA,NA,NA,NA,NA,NA,NA,NA,NA,NA,NA,NA,NA,NA,NA,NA,NA,NA,NA,NA,NA,NA,NA,NA,NA,NA,NA,NA,NA,NA,NA,NA,NA,NA,NA,NA,NA,NA,NA,NA,NA,NA,NA,NA,NA,NA,NA,NA,NA,NA,NA,NA,NA,NA,NA,NA,NA,NA,NA,NA,NA,NA,NA,NA,NA,NA,NA,NA,NA,NA,NA,NA,NA,NA,NA,NA,NA,NA,NA,NA,NA,NA,NA,NA,NA,NA,NA,NA,NA,NA,NA,NA,NA,NA,NA,NA,NA,NA,NA,NA,NA,NA,NA,NA,NA,NA,NA,NA,NA,NA,NA,NA,NA,NA,NA,NA,NA,NA,NA,NA,NA,NA,NA,NA,NA,NA,NA,NA,NA,NA,NA,NA,NA,NA,NA,NA,NA,NA,NA,NA,NA,NA,NA,NA,NA,NA,NA,NA,NA,NA,NA,NA,NA,NA,NA,NA,NA,NA,NA,NA,NA,NA,NA,NA,NA,NA,NA,NA,NA,NA,NA,NA,NA,NA,NA,NA,NA,NA,NA,NA,NA,NA,NA,NA,NA,NA,NA,NA,NA,NA,NA,NA,NA,NA,NA,NA,NA,NA,NA,NA,NA,NA,NA,NA,NA,NA,NA,NA,NA,NA,NA,NA,NA,NA,NA,NA,NA,NA,NA,NA,NA,NA,NA,NA,NA,NA,NA,NA,NA,NA,NA,NA,NA,NA,NA,"EM00-FEDERAL EMERGENCY MANAGEMENT AGENCY",1662,272,200,1,0,17,31,19,0,2202,123,36,30,15,4,6184,1,0,6393,0,8595,"EM00-FEDERAL EMERGENCY MANAGEMENT AGENCY",1672,250,200,1,0,19,32,3,0,2177,190,35,29,4,2,5937,8,0,6205,0,8382,"EM00-FEDERAL EMERGENCY MANAGEMENT AGENCY",1652,256,201,0,0,17,32,15,0,2173,70,32,37,5,6,5899,1,0,6050,0,8223,"EM00-FEDERAL EMERGENCY MANAGEMENT AGENCY",1659,187,210,0,0,23,29,16,0,2124,74,25,31,6,7,7607,2,0,7752,0,9876,"EM00-FEDERAL EMERGENCY MANAGEMENT AGENCY",1736,175,217,0,0,23,29,15,0,2195,72,2,36,5,6,7142,2,0,7265,0,9460
"369","EO00","EO00-MORRIS K. UDALL AND STEWART L. UDALL FOUNDATION",0,0,0,0,0,0,8,0,0,0,8,0,1,0,0,0,6,33,0,0,40,0,48,"EO00-MORRIS K. UDALL AND STEWART L. UDALL FOUNDATION",0,0,0,0,0,0,9,0,0,0,9,0,0,0,0,0,6,38,0,0,44,0,53,"EO00-MORRIS K. UDALL AND STEWART L. UDALL FOUNDATION",0,0,0,0,0,4,0,0,0,4,0,0,0,0,6,45,0,0,51,0,55,"EO00-MORRIS K. UDALL AND STEWART L. UDALL FOUNDATION",0,0,0,0,0,4,0,0,0,4,0,0,0,0,6,53,0,0,59,0,63,"EO00-MORRIS K. UDALL SCHOLARSHIP AND EXCELLENCE IN NATIONAL ENVIRONMENTAL POLICY FOUNDATION",0,0,0,0,0,4,0,0,0,4,0,0,0,0,6,36,0,0,42,0,46,"EO00-MORRIS K. UDALL SCHOLARSHIP AND EXCELLENCE IN NATIONAL ENVIRONMENTAL POLICY FOUNDATION",0,0,0,0,0,4,0,0,0,4,0,0,0,0,6,35,0,0,41,0,45,"EO00-MORRIS K. UDALL SCHOLARSHIP AND EXCELLENCE IN NATIONAL ENVIRONMENTAL POLICY FOUNDATION",0,0,0,0,0,4,0,0,0,4,0,0,0,0,6,32,0,0,38,0,42,"EO00-MORRIS K. UDALL SCHOLARSHIP AND EXCELLENCE IN NATIONAL ENVIRONMENTAL POLICY FOUNDATION",0,0,0,0,0,4,0,0,0,4,0,0,0,0,6,36,0,0,42,0,46,"EO00-MORRIS K. UDALL SCHOLARSHIP AND EXCELLENCE IN NATIONAL ENVIRONMENTAL POLICY FOUNDATION",0,0,0,0,0,4,0,0,0,4,0,0,0,0,6,33,0,0,39,0,43,"EO00-MORRIS K. UDALL SCHOLARSHIP AND EXCELLENCE IN NATIONAL ENVIRONMENTAL POLICY FOUNDATION",0,0,0,0,0,7,0,0,0,7,0,0,0,0,5,30,0,0,35,0,42,"EO00-MORRIS K UDALL SCHOLARSHIP...FOUNDATION",0,0,0,0,0,6,0,0,0,6,0,0,0,0,5,28,0,0,33,0,39,"EO00-MORRIS K UDALL SCHOLARSHIP...FOUNDATION",0,0,0,0,0,6,0,0,0,6,0,0,0,0,2,24,0,0,26,0,32,"EO00-MORRIS K UDALL SCHOLARSHIP...FOUNDATION",0,0,0,0,0,3,0,0,0,3,0,0,0,0,2,22,0,0,24,0,27,"EO00-MORRIS K UDALL SCHOLARSHIP...FOUNDATION",0,0,0,0,0,6,0,0,0,6,0,0,0,0,2,16,0,0,18,0,24,"EO00-MORRIS K UDALL SCHOLARSHIP...FOUNDATION",0,0,0,0,0,5,0,0,0,5,0,0,0,0,0,12,0,0,12,0,17,"EO00-MORRIS K UDALL SCHOLARSHIP...FOUNDATION",0,0,0,0,0,3,0,0,0,3,0,0,0,0,1,3,0,0,4,0,7
