"180","ARNG","ARNG-ARMY NATIONAL GUARD UNITS (TITLE 32)",1245,186,0,0,0,0,22930,0,0,0,24361,20,10,0,0,0,0,3308,0,0,3338,0,27699,"ARNG-ARMY NATIONAL GUARD UNITS (TITLE 32)",1263,175,3,0,0,0,22342,0,0,0,23783,26,204,0,0,0,0,3416,0,0,3646,0,27429,"ARNG-ARMY NATIONAL GUARD UNITS (TITLE 32)",1322,223,0,0,0,21318,0,0,0,22863,40,365,0,0,0,3384,0,0,3789,2,26654,"ARNG-ARMY NATIONAL GUARD UNITS (TITLE 32)",1318,265,0,0,0,21776,0,0,0,23359,43,620,5,0,0,3335,0,0,4003,3,27365,"ARNG-ARMY NATIONAL GUARD UNITS (TITLE 32)",1310,244,0,0,0,20260,0,0,0,21814,46,1735,14,0,0,6258,0,0,8053,0,29867,"ARNG-ARMY NATIONAL GUARD UNITS (TITLE 32)",1275,251,2,0,0,21857,0,0,0,23385,35,966,10,0,0,5072,0,0,6083,0,29468,"ARNG-ARMY NATIONAL GUARD UNITS (TITLE 32)",1336,182,3,0,0,21705,0,0,0,23226,23,672,0,0,0,4089,0,0,4784,2,28012,"ARNG-ARMY NATIONAL GUARD UNITS (TITLE 32)",1376,158,2,0,0,20930,0,0,0,22466,20,1076,6,0,0,3818,0,0,4920,1,27387,"ARNG-ARMY NATIONAL GUARD UNITS (TITLE 32)",1414,116,2,0,0,19751,0,0,1,21284,34,1073,15,0,0,2889,0,0,4011,1,25296,"ARNG-ARMY NATIONAL GUARD UNITS (TITLE 32)",1479,94,2,0,0,18810,0,0,1,20386,68,482,0,0,0,2818,0,0,3368,1,23755,"ARNG-ARMY NATIONAL GUARD UNITS (TITLE 32)",1536,67,2,0,0,19071,0,0,0,20676,38,208,0,0,0,3252,0,0,3498,0,24174,"ARNG-ARMY NATIONAL GUARD UNITS (TITLE 32)",1569,44,2,0,0,21167,0,0,1,22783,32,7,0,0,0,2529,0,0,2568,2,25353,"ARNG-ARMY NATIONAL GUARD UNITS (TITLE 32)",1629,4,3,0,0,21199,0,0,0,22835,5,0,0,0,0,2287,0,0,2292,0,25127,"ARNG-ARMY NATIONAL GUARD UNITS (TITLE 32)",1738,2,3,0,0,20503,0,0,0,22246,1,0,0,0,0,2300,0,0,2301,0,24547,"ARNG-ARMY NATIONAL GUARD UNITS (TITLE 32)",1864,4,3,0,0,19530,0,0,0,21401,4,0,0,0,0,2139,0,0,2143,0,23544,"ARNG-ARMY NATIONAL GUARD UNITS (TITLE 32)",2001,37,3,0,0,19934,0,0,0,21975,8,0,0,0,0,1672,0,0,1680,1,23656
"181","ARP1","ARP1-U.S. ARMY, PACIFIC",1049,200,7,0,0,0,95,0,0,0,1351,18,14,0,0,0,0,5,0,0,37,0,1388,"ARP1-U.S. ARMY, PACIFIC",1025,248,6,1,0,0,107,0,0,0,1387,22,17,0,0,0,0,17,0,0,56,0,1443,"ARP1-U.S. ARMY, PACIFIC",706,214,7,1,0,118,0,0,0,1046,18,4,0,0,0,13,0,0,35,0,1081,"ARP1-U.S. ARMY, PACIFIC",532,196,6,2,0,106,0,0,0,842,32,5,0,0,0,18,0,0,55,0,897,"ARP1-U.S. ARMY, PACIFIC",513,99,4,3,0,85,0,0,0,704,63,10,1,0,0,7,0,0,81,0,785,"ARP1-U.S. ARMY, PACIFIC",542,24,3,0,0,85,0,0,0,654,40,33,0,0,0,6,0,0,79,0,733,"ARP1-U.S. ARMY, PACIFIC",527,37,5,0,0,87,0,0,0,656,63,7,0,0,0,5,0,0,75,0,731,"ARP1-U.S. ARMY, PACIFIC",660,275,6,0,0,129,0,0,0,1070,64,10,0,0,0,6,0,0,80,0,1150,"ARP1-U.S. ARMY, PACIFIC",674,286,7,0,0,125,0,0,0,1092,65,9,1,0,0,10,0,0,85,0,1177,"ARP1-U.S. ARMY, PACIFIC",686,298,7,0,0,106,0,0,0,1097,38,10,1,0,0,1,0,0,50,0,1147,"ARP1-U.S. ARMY, PACIFIC",2289,295,41,0,0,160,0,0,0,2785,197,77,4,0,0,3,0,0,281,0,3066,"ARP1-U.S. ARMY, PACIFIC",2573,298,41,0,0,106,0,0,0,3018,326,89,4,0,0,1,0,0,420,0,3438,"ARP1-U.S. ARMY, PACIFIC",2706,221,29,1,0,104,0,0,0,3061,178,66,1,0,0,6,0,0,251,1,3313,"ARP1-U.S. ARMY, PACIFIC",2945,148,26,1,0,159,0,0,0,3279,199,56,5,0,0,4,0,0,264,0,3543,"ARP1-U.S. ARMY, PACIFIC",3040,181,40,2,0,149,0,0,0,3412,176,31,4,0,0,1,0,0,212,0,3624,"ARP1-U.S. ARMY, PACIFIC",3064,317,40,0,0,140,0,0,0,3561,153,32,3,0,0,0,0,0,188,0,3749
"182","ARP8",NA,NA,NA,NA,NA,NA,NA,NA,NA,NA,NA,NA,NA,NA,NA,NA,NA,NA,NA,NA,NA,NA,NA,NA,NA,NA,NA,NA,NA,NA,NA,NA,NA,NA,NA,NA,NA,NA,NA,NA,NA,NA,NA,NA,NA,NA,NA,NA,"ARP8-EIGHTH U.S. ARMY",293,84,0,0,0,8,0,0,0,385,5,25,0,0,0,1,0,0,31,0,416,"ARP8-EIGHTH U.S. ARMY",374,183,1,0,0,19,0,0,0,577,7,92,0,0,0,2,0,0,101,0,678,"ARP8-EIGHTH U.S. ARMY",374,154,1,1,0,20,0,0,0,550,8,76,0,0,0,2,0,0,86,0,636,"ARP8-EIGHTH U.S. ARMY",366,79,0,1,0,14,0,0,0,460,7,45,0,0,0,3,0,0,55,0,515,"ARP8-EIGHTH U.S. ARMY",338,82,1,0,0,19,0,0,0,440,10,26,0,0,0,5,0,0,41,0,481,"ARP8-EIGHTH U.S. ARMY",345,115,1,0,0,24,0,0,0,485,13,38,0,0,0,6,0,0,57,0,542,"ARP8-EIGHTH U.S. ARMY",387,129,1,0,0,23,0,0,0,540,18,32,0,0,0,9,0,0,59,0,599,"ARP8-EIGHTH U.S. ARMY",419,103,2,0,0,34,0,0,0,558,26,32,0,0,0,16,0,0,74,0,632,"ARP8-EIGHTH U.S. ARMY",708,149,4,0,0,59,0,0,0,920,46,24,0,0,0,75,0,0,145,0,1065,"ARP8-EIGHTH U.S. ARMY",847,139,5,0,0,79,0,0,0,1070,55,19,0,0,0,78,0,0,152,0,1222,"ARP8-EIGHTH U.S. ARMY",871,146,8,1,0,112,0,0,0,1138,62,28,0,0,0,69,0,0,159,0,1297,"ARP8-EIGHTH U.S. ARMY",851,83,8,4,0,140,0,0,0,1086,62,57,0,0,0,35,0,0,154,0,1240,"ARP8-EIGHTH U.S. ARMY",842,56,10,2,0,132,0,0,0,1042,55,87,1,0,0,4,0,0,147,0,1189,"ARP8-EIGHTH U.S. ARMY",823,74,8,0,0,97,0,0,0,1002,53,84,1,0,0,11,0,0,149,0,1151
"183","ARPC",NA,NA,NA,NA,NA,NA,NA,NA,NA,NA,NA,NA,NA,NA,NA,NA,NA,NA,NA,NA,NA,NA,NA,NA,NA,NA,NA,NA,NA,NA,NA,NA,NA,NA,NA,NA,NA,NA,NA,NA,NA,NA,NA,NA,NA,NA,NA,NA,NA,NA,NA,NA,NA,NA,NA,NA,NA,NA,NA,NA,NA,NA,NA,NA,NA,NA,NA,NA,NA,NA,NA,NA,NA,NA,NA,NA,NA,NA,NA,NA,NA,NA,NA,NA,NA,NA,NA,NA,NA,NA,NA,NA,NA,NA,NA,NA,NA,NA,NA,NA,NA,NA,NA,NA,NA,NA,NA,NA,NA,NA,NA,NA,NA,NA,NA,NA,NA,NA,NA,NA,NA,NA,NA,NA,NA,NA,NA,NA,NA,NA,NA,NA,NA,NA,NA,NA,NA,NA,NA,NA,NA,NA,NA,NA,NA,NA,NA,NA,NA,NA,NA,NA,NA,NA,NA,NA,NA,NA,NA,NA,NA,NA,NA,NA,NA,NA,NA,NA,NA,NA,NA,NA,NA,NA,NA,NA,NA,NA,NA,NA,"ARPC-MILITARY ENTRANCE PROCESSING COMMAND",895,331,3,2,0,69,0,0,0,1300,9,1,0,0,0,1,0,0,11,0,1311,"ARPC-MILITARY ENTRANCE PROCESSING COMMAND",998,220,3,3,0,41,0,0,0,1265,13,0,0,0,0,0,0,0,13,0,1278,"ARPC-MILITARY ENTRANCE PROCESSING COMMAND",976,207,0,2,0,46,0,0,0,1231,12,1,0,0,0,0,0,0,13,0,1244,"ARPC-MILITARY ENTRANCE PROCESSING COMMAND",1006,192,1,1,0,46,0,0,0,1246,17,1,0,0,0,0,0,0,18,0,1264,"ARPC-MILITARY ENTRANCE PROCESSING COMMAND",1022,189,1,0,0,51,0,0,0,1263,22,0,0,0,0,0,0,0,22,0,1285,"ARPC-MILITARY ENTRANCE PROCESSING COMMAND",1018,142,4,0,0,69,0,0,0,1233,13,0,0,0,0,0,0,0,13,0,1246,"ARPC-MILITARY ENTRANCE PROCESSING COMMAND",1038,127,5,0,0,69,0,0,0,1239,29,0,0,0,0,1,0,0,30,0,1269,"ARPC-MILITARY ENTRANCE PROCESSING COMMAND",1063,109,5,0,0,71,0,0,0,1248,26,1,0,0,0,1,0,0,28,0,1276
"184","ARRC",NA,NA,NA,NA,NA,NA,NA,NA,NA,NA,NA,NA,NA,NA,NA,NA,NA,NA,NA,NA,NA,NA,NA,NA,NA,NA,NA,NA,NA,NA,NA,NA,NA,NA,NA,NA,NA,NA,NA,NA,NA,NA,NA,NA,NA,NA,NA,NA,NA,NA,NA,NA,NA,NA,NA,NA,NA,NA,NA,NA,NA,NA,NA,NA,NA,NA,NA,NA,NA,NA,NA,NA,NA,NA,NA,NA,NA,NA,NA,NA,NA,NA,NA,NA,NA,NA,NA,NA,NA,NA,NA,NA,NA,NA,NA,NA,NA,NA,NA,NA,NA,NA,NA,NA,NA,NA,NA,NA,NA,NA,NA,NA,NA,NA,NA,NA,NA,NA,NA,NA,NA,NA,NA,NA,NA,NA,NA,NA,NA,NA,NA,NA,NA,NA,NA,NA,NA,NA,NA,NA,NA,NA,NA,NA,NA,NA,NA,NA,NA,NA,NA,NA,NA,NA,NA,NA,NA,NA,NA,NA,NA,NA,NA,NA,NA,NA,NA,NA,NA,NA,NA,NA,NA,NA,NA,NA,NA,NA,NA,NA,"ARRC-U.S. ARMY RECRUITING COMMAND",775,244,5,1,0,72,0,0,0,1097,48,0,0,0,0,0,0,0,48,0,1145,"ARRC-U.S. ARMY RECRUITING COMMAND",879,134,5,1,0,33,0,0,0,1052,47,0,0,0,0,1,0,0,48,0,1100,"ARRC-U.S. ARMY RECRUITING COMMAND",917,86,6,1,0,24,0,0,0,1034,69,0,2,0,0,1,0,0,72,0,1106,"ARRC-U.S. ARMY RECRUITING COMMAND",994,139,5,1,0,44,0,0,0,1183,22,0,2,0,0,1,0,0,25,0,1208,"ARRC-U.S. ARMY RECRUITING COMMAND",1009,122,6,3,0,52,0,0,0,1192,23,0,2,0,0,0,0,0,25,0,1217,"ARRC-U.S. ARMY RECRUITING COMMAND",1031,91,8,3,0,52,0,0,0,1185,26,0,3,0,0,1,0,0,30,0,1215,"ARRC-U.S. ARMY RECRUITING COMMAND",1011,58,6,2,0,46,0,0,0,1123,27,0,0,0,0,1,0,0,28,0,1151,"ARRC-U.S. ARMY RECRUITING COMMAND",1102,65,5,1,0,46,0,0,0,1219,35,0,1,0,0,0,0,0,36,0,1255
"185","ARSA","ARSA-OFFICE OF THE SECRETARY OF THE ARMY",844,70,30,0,0,0,9,49,7,0,1009,4,2,0,8,0,7,51,0,0,72,0,1081,"ARSA-OFFICE OF THE SECRETARY OF THE ARMY",827,107,29,0,0,0,10,48,6,0,1027,6,1,10,11,3,8,55,0,0,94,0,1121,"ARSA-OFFICE OF THE SECRETARY OF THE ARMY",816,140,28,0,0,9,55,7,0,1055,9,0,7,11,6,53,0,0,86,0,1141,"ARSA-OFFICE OF THE SECRETARY OF THE ARMY",777,136,27,0,0,10,50,5,0,1005,9,0,4,9,7,102,0,0,131,0,1136,"ARSA-OFFICE OF THE SECRETARY OF THE ARMY",754,105,28,0,0,11,42,5,0,945,11,0,10,2,4,124,1,0,152,0,1097,"ARSA-OFFICE OF THE SECRETARY OF THE ARMY",724,0,23,1,0,11,42,11,0,812,10,1,12,14,6,115,2,0,160,0,972,"ARSA-OFFICE OF THE SECRETARY OF THE ARMY",645,0,20,3,0,11,40,11,0,730,6,5,7,15,7,80,4,0,124,0,854,"ARSA-OFFICE OF THE SECRETARY OF THE ARMY",552,73,16,1,0,9,37,11,0,699,7,0,4,14,7,25,4,0,61,0,760,"ARSA-OFFICE OF THE SECRETARY OF THE ARMY",522,73,16,0,0,7,42,8,0,668,7,1,6,15,5,26,8,0,68,0,736,"ARSA-OFFICE OF THE SECRETARY OF THE ARMY",539,49,13,0,0,6,35,9,0,651,7,3,7,10,6,64,4,0,101,0,752,"ARSA-OFFICE OF THE SECRETARY OF THE ARMY",530,26,14,0,0,7,31,10,0,618,2,0,9,10,7,39,5,0,72,0,690,"ARSA-OFFICE OF THE SECRETARY OF THE ARMY",478,11,12,0,0,4,35,13,0,553,3,3,1,9,7,93,3,0,119,0,672,"ARSA-OFFICE OF THE SECRETARY OF THE ARMY",524,15,9,0,0,3,38,9,0,598,4,1,2,5,1,19,2,0,34,0,632,"ARSA-OFFICE OF THE SECRETARY OF THE ARMY",516,9,11,0,0,5,42,7,0,590,8,1,6,7,8,57,5,0,92,0,682,"ARSA-OFFICE OF THE SECRETARY OF THE ARMY",483,7,9,0,0,4,41,5,0,549,2,1,3,7,9,107,5,0,134,0,683,"ARSA-OFFICE OF THE SECRETARY OF THE ARMY",488,4,7,0,0,3,38,6,0,546,3,0,6,9,9,67,1,0,95,0,641
"186","ARSB","ARSB-FIELD OPERATING OFFICES OF THE OFFICE OF THE SECRETARY OF THE ARMY",952,714,11,7,149,0,124,4,0,0,1961,15,15,1,0,1,0,1,0,0,33,0,1994,"ARSB-FIELD OPERATING OFFICES OF THE OFFICE OF THE SECRETARY OF THE ARMY",1037,959,11,21,7,0,142,5,0,0,2182,32,28,10,0,0,0,21,0,0,91,0,2273,"ARSB-FIELD OPERATING OFFICES OF THE OFFICE OF THE SECRETARY OF THE ARMY",885,1279,11,21,0,87,5,0,0,2288,30,42,8,0,0,0,0,0,80,0,2368,"ARSB-FIELD OPERATING OFFICES OF THE OFFICE OF THE SECRETARY OF THE ARMY",786,336,12,1384,0,26,6,0,0,2550,15,10,5,0,0,1,0,0,31,0,2581,"ARSB-FIELD OPERATING OFFICES OF THE OFFICE OF THE SECRETARY OF THE ARMY",834,366,18,1960,0,46,6,0,0,3230,12,4,5,0,0,2,0,0,23,0,3253,"ARSB-FIELD OPERATING OFFICES OF THE OFFICE OF THE SECRETARY OF THE ARMY",1031,242,16,1381,0,103,5,0,0,2778,12,6,2,0,0,1,0,0,21,0,2799,"ARSB-FIELD OPERATING OFFICES OF THE OFFICE OF THE SECRETARY OF THE ARMY",880,175,12,1288,0,117,1,0,0,2473,11,3,3,0,0,1,0,0,18,1,2492,"ARSB-FIELD OPERATING OFFICES OF THE OFFICE OF THE SECRETARY OF THE ARMY",2906,399,17,1303,0,164,3,0,0,4792,21,38,10,0,0,2,0,0,71,0,4863,"ARSB-FIELD OPERATING OFFICES OF THE OFFICE OF THE SECRETARY OF THE ARMY",423,140,2,100,0,14,2,0,0,681,2,14,2,0,0,0,0,0,18,0,699,"ARSB-FIELD OPERATING OFFICES OF THE OFFICE OF THE SECRETARY OF THE ARMY",519,145,0,120,0,25,2,0,0,811,3,10,4,0,0,0,0,0,17,0,828,"ARSB-FLD OPERATING OFC OF OFC OF SEC OF ARMY",1695,1032,21,321,0,140,3,0,0,3212,15,9,19,0,0,1,0,0,44,0,3256,"ARSB-FLD OPERATING OFC OF OFC OF SEC OF ARMY",2013,834,12,40,0,105,1,0,0,3005,23,13,16,0,0,1,0,0,53,0,3058,"ARSB-FLD OPERATING OFC OF OFC OF SEC OF ARMY",2140,829,20,64,0,136,0,0,0,3189,44,6,19,1,0,2,0,0,72,0,3261,"ARSB-FLD OPERATING OFC OF OFC OF SEC OF ARMY",2164,584,24,60,0,171,1,0,0,3004,18,7,47,1,0,1,0,0,74,0,3078,"ARSB-FLD OPERATING OFC OF OFC OF SEC OF ARMY",2308,656,26,71,0,196,0,0,0,3257,23,3,63,1,0,6,1,0,97,0,3354,"ARSB-FLD OPERATING OFC OF OFC OF SEC OF ARMY",2265,427,20,27,0,129,0,0,0,2868,38,10,62,1,0,5,1,0,117,0,2985
"187","ARSC","ARSC-U. S. ARMY SPACE AND MISSILE DEFENSE COMMAND/U. S. ARMY FORCES STRATEGIC COMMAND",672,129,15,2,0,0,59,4,0,0,881,4,0,0,0,0,0,4,0,0,8,0,889,"ARSC-U. S. ARMY SPACE AND MISSILE DEFENSE COMMAND/U. S. ARMY FORCES STRATEGIC COMMAND",635,166,14,2,1,0,64,5,0,0,887,12,0,4,0,3,0,6,0,0,25,0,912,"ARSC-U. S. ARMY SPACE AND MISSILE DEFENSE COMMAND/U. S. ARMY FORCES STRATEGIC COMMAND",695,199,15,7,0,71,7,0,0,994,18,1,11,0,0,6,0,0,36,0,1030,"ARSC-U. S. ARMY SPACE AND MISSILE DEFENSE COMMAND/U. S. ARMY FORCES STRATEGIC COMMAND",698,121,14,40,0,66,7,0,0,946,21,0,8,0,0,4,0,0,33,0,979,"ARSC-U. S. ARMY SPACE AND MISSILE DEFENSE COMMAND/U. S. ARMY FORCES STRATEGIC COMMAND",678,79,8,21,0,60,8,0,0,854,20,1,8,0,0,7,0,0,36,0,890,"ARSC-U. S. ARMY SPACE AND MISSILE DEFENSE COMMAND/U. S. ARMY FORCES STRATEGIC COMMAND",691,41,10,10,0,49,7,0,0,808,24,2,5,0,0,5,0,0,36,0,844,"ARSC-U.S. ARMY SPACE AND STRATEGIC DEFENSE COMMAND",702,44,10,22,0,47,7,0,0,832,29,2,5,0,0,3,0,0,39,0,871,"ARSC-U.S. ARMY SPACE AND STRATEGIC DEFENSE COMMAND",735,82,11,16,0,53,7,0,0,904,31,0,4,0,0,8,0,0,43,0,947,"ARSC-U.S. ARMY SPACE AND STRATEGIC DEFENSE COMMAND",829,85,11,19,0,64,8,0,0,1016,32,0,8,0,0,5,0,0,45,0,1061,"ARSC-U.S. ARMY SPACE AND STRATEGIC DEFENSE COMMAND",875,77,5,15,0,78,7,0,0,1057,23,1,10,0,0,4,0,0,38,0,1095,"ARSC-US ARMY SPACE AND STRATEGIC DEFENSE CMD",978,106,4,11,0,86,7,0,0,1192,32,1,12,0,0,1,0,0,46,0,1238,"ARSC-US ARMY SPACE AND STRATEGIC DEFENSE CMD",960,86,6,3,0,60,7,0,0,1122,50,0,3,0,0,1,0,0,54,0,1176,"ARSC-US ARMY SPACE AND STRATEGIC DEFENSE CMD",971,56,5,5,0,71,7,0,0,1115,51,4,8,0,0,1,0,0,64,0,1179,"ARSC-US ARMY SPACE AND STRATEGIC DEFENSE CMD",954,29,4,2,0,78,6,0,0,1073,52,0,11,0,0,3,0,0,66,0,1139,"ARSC-US ARMY SPACE AND STRATEGIC DEFENSE CMD",968,15,6,5,0,59,6,0,0,1059,60,2,1,0,0,3,0,0,66,0,1125,"ARSC-US ARMY SPACE AND STRATEGIC DEFENSE CMD",940,14,5,8,0,56,8,0,0,1031,54,7,1,0,0,1,0,0,63,0,1094
"188","ARSE","ARSE-HQDA FIELD OPERATING AGENCIES AND STAFF SUPPORT AGENCIES AND STAFF SUPPORT AGENCIES",5328,565,62,21,8,0,144,7,0,0,6135,47,7,3,0,1,0,1,0,0,59,0,6194,"ARSE-HQDA FIELD OPERATING AGENCIES AND STAFF SUPPORT AGENCIES AND STAFF SUPPORT AGENCIES",5060,1134,70,56,2,0,277,6,0,0,6605,98,12,12,0,2,0,2,0,0,126,0,6731,"ARSE-HQDA FIELD OPERATING AGENCIES AND STAFF SUPPORT AGENCIES AND STAFF SUPPORT AGENCIES",4847,1378,71,77,0,333,5,0,0,6711,121,21,43,0,0,4,0,0,189,0,6900,"ARSE-HQDA FIELD OPERATING AGENCIES AND STAFF SUPPORT AGENCIES AND STAFF SUPPORT AGENCIES",5208,1358,71,255,0,258,5,0,0,7155,133,27,68,0,0,16,0,0,244,0,7399,"ARSE-FIELD OPERATING AGENCIES OF THE ARMY STAFF RESOURCED THROUGH OA-22",5267,766,73,244,0,134,5,0,0,6489,122,27,115,0,0,9,0,0,273,0,6762,"ARSE-FIELD OPERATING AGENCIES OF THE ARMY STAFF RESOURCED THROUGH OA-22",5526,243,67,223,0,87,4,0,0,6150,84,30,118,0,0,10,0,0,242,0,6392,"ARSE-FIELD OPERATING AGENCIES OF THE ARMY STAFF RESOURCED THROUGH OA-22",3152,101,53,50,0,55,3,0,0,3414,30,33,28,0,0,7,0,0,98,1,3513,"ARSE-FIELD OPERATING AGENCIES OF THE ARMY STAFF RESOURCED THROUGH OA-22",921,163,53,14,0,21,3,0,0,1175,43,7,6,0,0,4,0,0,60,1,1236,"ARSE-FIELD OPERATING AGENCIES OF THE ARMY STAFF RESOURCED THROUGH OA-22",3231,795,63,865,0,202,6,0,0,5162,58,41,43,0,0,5,0,0,147,1,5310,"ARSE-FIELD OPERATING AGENCIES OF THE ARMY STAFF RESOURCED THROUGH OA-22",3234,970,65,545,0,165,5,0,0,4984,69,46,33,0,0,5,0,0,153,0,5137,"ARSE-FLD OP AG OF ARMY STAFF RESOURCED OA-22",1076,55,47,1,0,17,5,0,0,1201,49,2,15,0,0,9,0,0,75,0,1276,"ARSE-FLD OP AG OF ARMY STAFF RESOURCED OA-22",893,50,39,0,0,19,3,0,0,1004,16,3,14,0,0,8,0,0,41,0,1045,"ARSE-FLD OP AG OF ARMY STAFF RESOURCED OA-22",920,56,38,0,0,27,3,0,0,1044,12,2,5,0,0,2,0,0,21,0,1065,"ARSE-FLD OP AG OF ARMY STAFF RESOURCED OA-22",933,35,34,1,0,37,3,0,0,1043,21,1,6,0,0,7,0,0,35,0,1078,"ARSE-FLD OP AG OF ARMY STAFF RESOURCED OA-22",1002,25,34,1,0,24,3,0,0,1089,27,3,10,0,0,7,0,0,47,0,1136,"ARSE-FLD OP AG OF ARMY STAFF RESOURCED OA-22",1034,256,34,32,0,50,3,0,0,1409,35,3,7,0,0,6,0,0,51,0,1460
"189","ARSF","ARSF-MISCELLANEOUS FIELD OPERATING AGENCIES",31,3,2,0,0,0,1,0,0,0,37,2,0,0,0,0,0,0,0,0,2,0,39,"ARSF-MISCELLANEOUS FIELD OPERATING AGENCIES",29,6,2,0,0,0,1,0,0,0,38,3,0,0,0,0,0,2,0,0,5,0,43,"ARSF-MISCELLANEOUS FIELD OPERATING AGENCIES",31,7,2,0,0,0,0,0,0,40,4,0,0,0,0,1,0,0,5,0,45,"ARSF-MISCELLANEOUS FIELD OPERATING AGENCIES",31,6,2,0,0,0,0,0,0,39,3,0,1,0,0,1,0,0,5,0,44,"ARSF-FIELD OPERATING AGENCIES OF THE ARMY STAFF",29,4,2,0,0,0,0,0,0,35,1,0,2,0,0,0,0,0,3,0,38,"ARSF-FIELD OPERATING AGENCIES OF THE ARMY STAFF",31,8,25,0,0,5,0,0,0,69,1,0,0,0,0,1,0,0,2,0,71,"ARSF-FIELD OPERATING AGENCIES OF THE ARMY STAFF",31,8,25,0,0,5,1,0,0,70,1,1,0,0,0,1,0,0,3,0,73,"ARSF-FIELD OPERATING AGENCIES OF THE ARMY STAFF",33,8,20,0,0,6,0,0,0,67,1,2,0,0,0,1,0,0,4,0,71,"ARSF-FIELD OPERATING AGENCIES OF THE ARMY STAFF",37,7,20,0,0,6,0,0,0,70,0,1,0,0,0,1,0,0,2,0,72,"ARSF-FIELD OPERATING AGENCIES OF THE ARMY STAFF",44,11,14,0,0,9,0,0,0,78,2,0,1,0,0,0,0,0,3,0,81,"ARSF-FLD OPERATING AGENCIES OF THE ARMY STAFF",845,53,12,0,0,29,0,0,0,939,12,50,2,0,0,16,0,0,80,0,1019,"ARSF-FLD OPERATING AGENCIES OF THE ARMY STAFF",937,77,15,0,0,27,2,0,0,1058,18,43,3,0,0,22,0,0,86,0,1144,"ARSF-FLD OPERATING AGENCIES OF THE ARMY STAFF",989,73,17,1,0,33,2,0,0,1115,17,32,0,0,0,21,0,0,70,0,1185,"ARSF-FLD OPERATING AGENCIES OF THE ARMY STAFF",1000,61,13,4,0,41,2,0,0,1121,19,24,0,0,0,38,0,0,81,0,1202,"ARSF-FLD OPERATING AGENCIES OF THE ARMY STAFF",1638,39,14,6,0,102,4,0,0,1803,156,10,2,0,0,56,0,0,224,0,2027,"ARSF-FLD OPERATING AGENCIES OF THE ARMY STAFF",1698,29,13,5,0,91,5,0,0,1841,129,6,2,0,0,70,0,0,207,0,2048
"190","ARSJ","ARSJ-JOINT SERVICES AND ACTIVITIES SUPPORTED BY THE OFFICE, SECRETARY OF THE ARMY",882,106,28,1,2,0,26,0,0,0,1045,2,196,2,0,0,1,16,0,0,217,0,1262,"ARSJ-JOINT SERVICES AND ACTIVITIES SUPPORTED BY THE OFFICE, SECRETARY OF THE ARMY",834,126,28,3,2,0,35,0,0,0,1028,0,184,13,0,1,1,74,0,0,273,0,1301,"ARSJ-JOINT SERVICES AND ACTIVITIES SUPPORTED BY THE OFFICE, SECRETARY OF THE ARMY",801,105,29,3,0,38,0,0,0,976,1,138,28,0,0,171,0,0,338,0,1314,"ARSJ-JOINT SERVICES AND ACTIVITIES SUPPORTED BY THE OFFICE, SECRETARY OF THE ARMY",793,133,25,8,0,38,0,0,0,997,8,118,38,0,1,192,0,0,357,0,1354,"ARSJ-JOINT SERVICES AND ACTIVITIES SUPPORTED BY THE OFFICE, SECRETARY OF THE ARMY",781,91,25,2,0,31,0,0,0,930,8,98,21,0,1,131,0,0,259,0,1189,"ARSJ-JOINT SERVICES AND ACTIVITIES SUPPORTED BY THE OFFICE, SECRETARY OF THE ARMY",812,23,26,0,0,34,0,0,0,895,6,137,29,0,0,31,0,0,203,0,1098,"ARSJ-JOINT SERVICES AND ACTIVITIES SUPPORTED BY THE OFFICE, SECRETARY OF THE ARMY",819,39,27,0,0,38,0,0,0,923,9,104,7,0,0,32,0,0,152,0,1075,"ARSJ-JOINT SERVICES AND ACTIVITIES SUPPORTED BY THE OFFICE, SECRETARY OF THE ARMY",888,115,29,1,0,43,1,0,0,1077,6,99,11,0,0,38,0,0,154,0,1231,"ARSJ-JOINT SERVICES AND ACTIVITIES SUPPORTED BY THE OFFICE, SECRETARY OF THE ARMY",902,119,35,1,0,44,1,0,0,1102,6,71,7,0,0,1,0,0,85,0,1187,"ARSJ-JOINT SERVICES AND ACTIVITIES SUPPORTED BY THE OFFICE, SECRETARY OF THE ARMY",978,98,37,1,0,42,0,0,0,1156,9,32,5,0,0,4,0,0,50,0,1206,"ARSJ-JT SERV & ACT SUP BY OFC, SEC OF ARMY",990,62,38,2,0,48,0,0,0,1140,8,67,15,0,0,1,0,0,91,0,1231,"ARSJ-JT SERV & ACT SUP BY OFC, SEC OF ARMY",947,42,41,3,0,48,1,1,0,1083,4,4,13,0,0,1,0,0,22,0,1105,"ARSJ-JT SERV & ACT SUP BY OFC, SEC OF ARMY",1021,41,35,4,0,53,1,0,0,1155,5,3,8,0,0,1,0,0,17,0,1172,"ARSJ-JT SERV & ACT SUP BY OFC, SEC OF ARMY",1040,21,36,4,0,54,3,1,0,1159,7,5,17,0,0,1,0,0,30,0,1189,"ARSJ-JT SERV & ACT SUP BY OFC, SEC OF ARMY",1057,21,35,2,0,54,3,1,0,1173,7,2,10,0,0,1,0,0,20,0,1193,"ARSJ-JT SERV & ACT SUP BY OFC, SEC OF ARMY",1128,16,34,1,0,60,2,1,0,1242,5,3,9,0,0,2,0,0,19,0,1261
"191","ARSO","ARSO-U.S. ARMY SOUTH",231,18,5,0,0,0,24,0,0,0,278,25,1,0,0,0,0,0,0,0,26,0,304,"ARSO-U.S. ARMY SOUTH",219,41,4,0,0,0,27,0,0,0,291,27,0,0,0,0,0,2,0,0,29,0,320,"ARSO-U.S. ARMY SOUTH",188,65,4,0,0,23,0,0,0,280,21,0,0,0,0,1,0,0,22,0,302,"ARSO-U.S. ARMY SOUTH",166,77,4,0,0,34,0,0,0,281,16,0,0,0,0,1,0,0,17,0,298,"ARSO-U.S. ARMY SOUTH",165,53,3,0,0,38,0,0,0,259,19,0,0,0,0,0,0,0,19,0,278,"ARSO-U.S. ARMY SOUTH",192,0,4,0,0,31,0,0,0,227,6,1,0,0,0,0,0,0,7,0,234,"ARSO-U.S. ARMY SOUTH",0,0,0,0,0,14,0,0,0,14,0,0,0,0,0,1,0,0,1,0,15,NA,NA,NA,NA,NA,NA,NA,NA,NA,NA,NA,NA,NA,NA,NA,NA,NA,NA,NA,NA,NA,NA,NA,NA,NA,NA,NA,NA,NA,NA,NA,NA,NA,NA,NA,NA,NA,NA,NA,NA,NA,NA,NA,NA,NA,NA,NA,NA,NA,NA,NA,NA,NA,NA,NA,NA,NA,NA,NA,NA,NA,NA,NA,NA,NA,NA,NA,NA,NA,NA,NA,NA,NA,NA,NA,NA,NA,NA,NA,NA,NA,NA,NA,NA,NA,NA,NA,NA,NA,NA,NA,NA,NA,NA,NA,NA,NA,NA,NA,NA,NA,NA,NA,NA,NA,NA,NA,NA,NA,NA,NA,NA,NA,NA,NA,NA,NA,NA,NA,NA,NA,NA,NA,NA,NA,NA,NA,NA,NA,NA,NA,NA,NA,NA,NA,NA,NA,NA,NA,NA,NA,NA,NA,NA,NA,NA,NA,NA,NA,NA,NA,NA,NA,NA,NA,NA,NA,NA,NA,NA,NA,NA,NA,NA,NA,NA,NA,NA,NA,NA,NA,NA,NA,NA,NA,NA,NA,NA,NA,NA,NA,NA,NA,NA,NA,NA,NA,NA,NA,NA,NA,NA,NA,NA,NA,NA,NA,NA
"192","ARSP","ARSP-U.S. SPECIAL OPERATIONS COMMAND (ARMY)",1207,250,2,2,0,0,120,1,0,0,1582,56,4,0,0,0,0,15,0,0,75,0,1657,"ARSP-U.S. SPECIAL OPERATIONS COMMAND (ARMY)",1102,329,2,2,0,0,125,0,0,0,1560,104,9,0,0,0,0,34,0,0,147,0,1707,"ARSP-U.S. SPECIAL OPERATIONS COMMAND (ARMY)",978,444,2,5,0,161,0,0,0,1590,119,11,14,0,0,42,0,0,186,0,1776,"ARSP-U.S. SPECIAL OPERATIONS COMMAND (ARMY)",944,381,2,3,0,184,0,0,0,1514,145,13,45,0,0,44,0,0,247,1,1762,"ARSP-U.S. SPECIAL OPERATIONS COMMAND (ARMY)",901,301,3,5,0,179,0,0,0,1389,159,18,36,0,0,40,0,0,253,1,1643,"ARSP-U.S. SPECIAL OPERATIONS COMMAND (ARMY)",876,162,4,5,0,154,0,0,0,1201,126,6,29,0,0,24,0,0,185,1,1387,"ARSP-U.S. SPECIAL OPERATIONS COMMAND (ARMY)",740,224,5,6,0,171,0,0,0,1146,140,6,20,0,0,23,0,0,189,0,1335,"ARSP-U.S. SPECIAL OPERATIONS COMMAND (ARMY)",770,272,4,6,0,230,0,0,0,1282,182,5,27,0,0,27,0,0,241,0,1523,"ARSP-U.S. SPECIAL OPERATIONS COMMAND (ARMY)",743,210,5,5,0,197,0,0,0,1160,205,8,13,0,0,27,0,0,253,0,1413,"ARSP-U.S. SPECIAL OPERATIONS COMMAND (ARMY)",746,183,4,2,0,154,0,0,0,1089,187,5,16,0,0,15,0,0,223,0,1312,"ARSP-U.S. SPECIAL OPERATIONS COMMAND (ARMY)",775,134,4,1,0,159,0,0,0,1073,115,4,7,0,0,15,0,0,141,0,1214,"ARSP-U.S. SPECIAL OPERATIONS COMMAND (ARMY)",800,93,5,1,0,152,0,0,0,1051,76,8,5,0,0,15,0,0,104,0,1155,"ARSP-U.S. SPECIAL OPERATIONS COMMAND (ARMY)",796,90,8,1,0,152,0,0,0,1047,40,0,0,0,0,6,0,0,46,0,1093,"ARSP-U.S. SPECIAL OPERATIONS COMMAND (ARMY)",815,67,8,1,0,167,0,0,0,1058,49,0,0,0,0,2,0,0,51,0,1109,"ARSP-U.S. SPECIAL OPERATIONS COMMAND (ARMY)",787,63,11,2,0,150,0,0,0,1013,45,0,1,0,0,1,0,0,47,0,1060,"ARSP-U.S. SPECIAL OPERATIONS COMMAND (ARMY)",811,59,11,0,0,129,0,0,0,1010,50,0,1,0,0,2,0,0,53,0,1063
"193","ARSS",NA,NA,NA,NA,NA,NA,NA,NA,NA,NA,NA,NA,NA,NA,NA,NA,NA,NA,NA,NA,NA,NA,NA,NA,NA,NA,NA,NA,NA,NA,NA,NA,NA,NA,NA,NA,NA,NA,NA,NA,NA,NA,NA,NA,NA,NA,NA,NA,NA,NA,NA,NA,NA,NA,NA,NA,NA,NA,NA,NA,NA,NA,NA,NA,NA,NA,NA,NA,NA,NA,NA,NA,NA,NA,NA,NA,NA,NA,NA,NA,NA,NA,NA,NA,NA,NA,NA,NA,NA,NA,NA,NA,NA,NA,NA,NA,NA,NA,NA,NA,NA,NA,NA,NA,NA,NA,NA,NA,NA,NA,NA,NA,NA,NA,NA,NA,NA,NA,NA,NA,NA,NA,NA,NA,NA,NA,NA,NA,NA,NA,NA,NA,NA,NA,NA,NA,NA,NA,NA,NA,NA,NA,NA,NA,NA,NA,NA,NA,NA,NA,NA,NA,NA,NA,NA,NA,NA,NA,NA,NA,NA,NA,NA,NA,NA,NA,NA,NA,NA,NA,NA,NA,NA,NA,NA,NA,NA,NA,NA,NA,"ARSS-STAFF SUPPORT AGENCIES OF THE CHIEF OF STAFF, ARMY",21,8,0,0,0,1,0,0,0,30,0,0,0,0,0,0,0,0,0,0,30,"ARSS-STAFF SUPPORT AGENCIES OF THE CHIEF OF STAFF, ARMY",18,0,0,0,0,1,0,0,0,19,0,0,0,0,0,0,0,0,0,0,19,"ARSS-STAFF SUP AGENCIES OF CHF OF STAFF, ARMY",23,1,0,1,0,0,0,0,0,25,0,0,1,0,0,0,0,0,1,0,26,"ARSS-STAFF SUP AGENCIES OF CHF OF STAFF, ARMY",60,2,0,2,0,0,1,0,0,65,0,0,1,0,0,0,0,0,1,0,66,"ARSS-STAFF SUP AGENCIES OF CHF OF STAFF, ARMY",63,1,0,0,0,0,0,0,0,64,1,0,0,0,0,0,0,0,1,0,65,"ARSS-STAFF SUP AGENCIES OF CHF OF STAFF, ARMY",64,1,0,0,0,0,0,0,0,65,0,0,0,0,0,0,0,0,0,0,65,"ARSS-STAFF SUP AGENCIES OF CHF OF STAFF, ARMY",64,1,0,0,0,0,0,0,0,65,0,0,0,0,0,0,0,0,0,0,65,"ARSS-STAFF SUP AGENCIES OF CHF OF STAFF, ARMY",58,1,0,0,0,0,0,0,0,59,0,0,0,0,0,0,0,0,0,0,59
"194","ARSU",NA,NA,NA,NA,NA,NA,NA,NA,NA,NA,NA,NA,NA,NA,NA,NA,NA,NA,NA,NA,NA,NA,NA,NA,NA,NA,NA,NA,NA,NA,NA,NA,NA,NA,NA,NA,NA,NA,NA,NA,NA,NA,NA,NA,NA,NA,NA,NA,NA,NA,NA,NA,NA,NA,NA,NA,NA,NA,NA,NA,NA,NA,NA,NA,NA,NA,NA,NA,NA,NA,NA,NA,NA,NA,NA,NA,NA,NA,NA,NA,NA,NA,NA,NA,NA,NA,NA,NA,NA,NA,NA,NA,NA,NA,NA,NA,NA,NA,NA,NA,NA,NA,NA,NA,NA,NA,NA,NA,NA,NA,NA,NA,NA,NA,NA,NA,NA,NA,NA,NA,NA,NA,NA,NA,NA,NA,NA,NA,NA,NA,NA,NA,NA,NA,NA,NA,NA,NA,NA,NA,NA,NA,NA,NA,NA,NA,NA,NA,NA,NA,NA,NA,NA,NA,NA,NA,NA,NA,NA,NA,NA,NA,NA,NA,NA,NA,NA,NA,NA,NA,NA,NA,NA,NA,NA,NA,NA,NA,NA,NA,"ARSU-U.S. ARMY SOUTHERN COMMAND",0,0,0,0,0,1,0,0,0,1,0,0,0,0,0,0,0,0,0,0,1,"ARSU-U.S. ARMY SOUTHERN COMMAND",3,0,0,0,0,3,0,0,0,6,1,0,0,0,0,1,0,0,2,0,8,"ARSU-U.S. ARMY SOUTHERN COMMAND",450,87,4,2,0,79,0,0,0,622,36,7,0,0,0,0,0,0,43,0,665,"ARSU-U.S. ARMY SOUTHERN COMMAND",472,111,4,2,0,93,0,0,0,682,18,5,3,0,0,1,0,0,27,0,709,"ARSU-U.S. ARMY SOUTHERN COMMAND",426,136,6,2,0,102,0,0,0,672,13,0,0,0,0,1,0,0,14,0,686,"ARSU-U.S. ARMY SOUTHERN COMMAND",415,116,3,2,0,109,1,0,0,646,59,0,1,0,0,2,0,0,62,0,708,"ARSU-U.S. ARMY SOUTHERN COMMAND",354,68,57,3,0,202,1,0,1,686,73,0,0,0,0,79,0,0,152,0,838,"ARSU-U.S. ARMY SOUTHERN COMMAND",244,20,107,0,0,373,1,0,7,752,30,0,0,0,0,197,0,0,227,0,979
"195","ARTA",NA,NA,NA,NA,NA,NA,NA,NA,NA,NA,NA,NA,NA,NA,NA,NA,NA,NA,NA,NA,NA,NA,NA,NA,NA,NA,NA,NA,NA,NA,NA,NA,NA,NA,NA,NA,NA,NA,NA,NA,NA,NA,NA,NA,NA,NA,NA,NA,NA,NA,NA,NA,NA,NA,NA,NA,NA,NA,NA,NA,NA,NA,NA,NA,NA,NA,NA,NA,NA,NA,"ARTA-U.S. ARMY ACCESSIONS COMMAND",213,61,2,3,0,39,0,0,0,318,33,0,5,0,0,1,0,0,39,0,357,"ARTA-U.S. ARMY ACCESSIONS COMMAND",1844,351,12,16,0,168,0,0,0,2391,414,0,9,0,0,3,0,0,426,0,2817,"ARTA-U.S. ARMY ACCESSIONS COMMAND",2103,107,10,8,0,131,0,0,0,2359,109,0,1,0,0,1,0,0,111,0,2470,"ARTA-U.S. ARMY ACCESSIONS COMMAND",1964,212,9,5,0,127,0,0,0,2317,66,1,1,0,0,1,0,0,69,0,2386,"ARTA-U.S. ARMY ACCESSIONS COMMAND",1566,565,7,5,0,200,0,0,0,2343,65,0,1,0,0,0,0,0,66,0,2409,"ARTA-U.S. ARMY ACCESSIONS COMMAND",107,35,2,0,0,8,0,0,0,152,4,0,0,0,0,0,0,0,4,0,156,NA,NA,NA,NA,NA,NA,NA,NA,NA,NA,NA,NA,NA,NA,NA,NA,NA,NA,NA,NA,NA,NA,NA,NA,NA,NA,NA,NA,NA,NA,NA,NA,NA,NA,NA,NA,NA,NA,NA,NA,NA,NA,NA,NA,NA,NA,NA,NA,NA,NA,NA,NA,NA,NA,NA,NA,NA,NA,NA,NA,NA,NA,NA,NA,NA,NA,NA,NA,NA,NA,NA,NA,NA,NA,NA,NA,NA,NA,NA,NA,NA,NA,NA,NA,NA,NA,NA,NA,NA,NA,NA,NA,NA,NA,NA,NA,NA,NA,NA,NA,NA,NA,NA,NA,NA,NA,NA,NA,NA,NA,NA,NA,NA,NA,NA,NA,NA,NA,NA,NA,NA,NA,NA,NA,NA,NA,NA,NA,NA,NA,NA,NA,NA,NA,NA,NA,NA,NA,NA,NA,NA,NA,NA,NA,NA,NA,NA,NA,NA,NA,NA,NA,NA,NA
